Date,Campaign Id,Campaign Name,Campaign Type,Campaign Start Date,Campaign End Date,Budget Type,Budget,Currency,Ad Group Id,Ad Group Name,Targeting Audience,Daypart Targeted,Bid Strategy,Bid,Store Name,Store Id,Clicks,Orders,Sales,Marketing Fees | (Including any applicable taxes),DoorDash Marketing Credit,Third-party Contribution,Average Order Value,Average CPA,ROAS,New Cx Acquired,Lapsed Cx Acquired,Existing Cx Acquired,Total Cx Acquired,New DashPass Cx Acquired,Existing DashPass Cx Acquired,Lapsed DashPass Cx Acquired,Total DashPass Cx Acquired,Impression based orders,Impression based sales
2025-10-12,945efc92-6e78-49d9-bc21-8ef1d2471fc4,Ads - Caps <> Spice,sponsored listing,2025-09-19,None,Weekly,5000.00,USD,97f406ae-2452-4364-9047-70a79ea745a1,All Customers - Afternoon,all,custom,MANUAL_SET_BIDDING,3.00,East Craig Road,75739,1,0,0.00,0.00,-0.00,-0.00,0.00,0.00,0.00,0,0,0,0,0,0,0,0,0,0.00
2025-10-12,945efc92-6e78-49d9-bc21-8ef1d2471fc4,Ads - Caps <> Spice,sponsored listing,2025-09-19,None,Weekly,5000.00,USD,97f406ae-2452-4364-9047-70a79ea745a1,All Customers - Afternoon,all,custom,MANUAL_SET_BIDDING,3.00,Riverwind Dr,34516256,0,0,0.00,0.00,-0.00,-0.00,0.00,0.00,0.00,0,0,0,0,0,0,0,0,0,0.00
2025-10-12,945efc92-6e78-49d9-bc21-8ef1d2471fc4,Ads - Caps <> Spice,sponsored listing,2025-09-19,None,Weekly,5000.00,USD,337ccf4e-d3be-4d44-8fea-6f7bb3304b89,All Customers - Afternoon,all,custom,MANUAL_SET_BIDDING,3.00,Byers Dr,23186665,0,0,0.00,0.00,-0.00,-0.00,0.00,0.00,0.00,0,0,0,0,0,0,0,0,0,0.00
2025-10-12,945efc92-6e78-49d9-bc21-8ef1d2471fc4,Ads - Caps <> Spice,sponsored listing,2025-09-19,None,Weekly,5000.00,USD,97f406ae-2452-4364-9047-70a79ea745a1,All Customers - Afternoon,all,custom,MANUAL_SET_BIDDING,3.00,Cheyenne Rd,2375637,0,0,0.00,0.00,-0.00,-0.00,0.00,0.00,0.00,0,0,0,0,0,0,0,0,0,0.00
2025-10-12,945efc92-6e78-49d9-bc21-8ef1d2471fc4,Ads - Caps <> Spice,sponsored listing,2025-09-19,None,Weekly,5000.00,USD,337ccf4e-d3be-4d44-8fea-6f7bb3304b89,All Customers - Afternoon,all,custom,MANUAL_SET_BIDDING,3.00,Bidwell - Folsom,26234909,7,4,109.59,12.00,-0.00,-0.00,27.40,3.00,9.13,0,0,4,4,0,4,0,4,5,173.53
2025-10-12,945efc92-6e78-49d9-bc21-8ef1d2471fc4,Ads - Caps <> Spice,sponsored listing,2025-09-19,None,Weekly,5000.00,USD,337ccf4e-d3be-4d44-8fea-6f7bb3304b89,All Customers - Afternoon,all,custom,MANUAL_SET_BIDDING,3.00,Overland Park,24110474,15,6,157.72,18.00,-0.00,-0.00,26.29,3.00,8.76,2,2,2,6,1,2,1,4,8,209.48
2025-10-12,945efc92-6e78-49d9-bc21-8ef1d2471fc4,Ads - Caps <> Spice,sponsored listing,2025-09-19,None,Weekly,5000.00,USD,337ccf4e-d3be-4d44-8fea-6f7bb3304b89,All Customers - Afternoon,all,custom,MANUAL_SET_BIDDING,3.00,Roanoke,24637171,10,3,78.90,9.00,-0.00,-0.00,26.30,3.00,8.77,0,0,3,3,0,3,0,3,3,78.90
2025-10-12,945efc92-6e78-49d9-bc21-8ef1d2471fc4,Ads - Caps <> Spice,sponsored listing,2025-09-19,None,Weekly,5000.00,USD,337ccf4e-d3be-4d44-8fea-6f7bb3304b89,All Customers - Afternoon,all,custom,MANUAL_SET_BIDDING,3.00,Moreno Beach Drive,23085788,3,2,59.36,6.00,-0.00,-0.00,29.68,3.00,9.89,0,0,2,2,0,2,0,2,2,59.36
2025-10-12,945efc92-6e78-49d9-bc21-8ef1d2471fc4,Ads - Caps <> Spice,sponsored listing,2025-09-19,None,Weekly,5000.00,USD,337ccf4e-d3be-4d44-8fea-6f7bb3304b89,All Customers - Afternoon,all,custom,MANUAL_SET_BIDDING,3.00,Collier Pkwy-Lutz,23057623,3,2,65.73,6.00,-0.00,-0.00,32.87,3.00,10.96,0,1,1,2,0,1,0,1,4,131.68
2025-10-12,945efc92-6e78-49d9-bc21-8ef1d2471fc4,Ads - Caps <> Spice,sponsored listing,2025-09-19,None,Weekly,5000.00,USD,97f406ae-2452-4364-9047-70a79ea745a1,All Customers - Afternoon,all,custom,MANUAL_SET_BIDDING,3.00,Maryland Pkwy,1007892,0,0,0.00,0.00,-0.00,-0.00,0.00,0.00,0.00,0,0,0,0,0,0,0,0,0,0.00
2025-10-12,945efc92-6e78-49d9-bc21-8ef1d2471fc4,Ads - Caps <> Spice,sponsored listing,2025-09-19,None,Weekly,5000.00,USD,337ccf4e-d3be-4d44-8fea-6f7bb3304b89,All Customers - Afternoon,all,custom,MANUAL_SET_BIDDING,3.00,West Charleston,23641277,1,0,0.00,0.00,-0.00,-0.00,0.00,0.00,0.00,0,0,0,0,0,0,0,0,1,27.78
2025-10-12,945efc92-6e78-49d9-bc21-8ef1d2471fc4,Ads - Caps <> Spice,sponsored listing,2025-09-19,None,Weekly,5000.00,USD,337ccf4e-d3be-4d44-8fea-6f7bb3304b89,All Customers - Afternoon,all,custom,MANUAL_SET_BIDDING,3.00,Limonite Ave,2375675,2,1,31.78,3.00,-0.00,-0.00,31.78,3.00,10.59,0,0,1,1,0,1,0,1,2,72.54
2025-10-12,945efc92-6e78-49d9-bc21-8ef1d2471fc4,Ads - Caps <> Spice,sponsored listing,2025-09-19,None,Weekly,5000.00,USD,337ccf4e-d3be-4d44-8fea-6f7bb3304b89,All Customers - Afternoon,all,custom,MANUAL_SET_BIDDING,3.00,N Broad St,578662,2,2,32.07,6.00,-0.00,-0.00,16.04,3.00,5.35,0,0,2,2,0,1,0,1,7,164.16
2025-10-12,c15d8db7-7b8d-419b-aaf9-a7fe8914f715,Sponsored Listing 05/22/2025,sponsored listing,2025-05-22,None,Daily,1940.00,USD,7e1c2d6c-858c-47af-a75e-63f392710b94,,all,day,MANUAL_SET_BIDDING,5.00,Happy Valley,23584856,37,11,436.96,45.18,-0.00,-0.00,39.72,4.11,9.67,1,0,10,11,0,8,0,8,16,681.63
2025-10-12,945efc92-6e78-49d9-bc21-8ef1d2471fc4,Ads - Caps <> Spice,sponsored listing,2025-09-19,None,Weekly,5000.00,USD,337ccf4e-d3be-4d44-8fea-6f7bb3304b89,All Customers - Afternoon,all,custom,MANUAL_SET_BIDDING,3.00,South  Walton Blvd,1616214,11,1,38.97,3.00,-0.00,-0.00,38.97,3.00,12.99,0,1,0,1,0,0,0,0,2,49.48
2025-10-12,945efc92-6e78-49d9-bc21-8ef1d2471fc4,Ads - Caps <> Spice,sponsored listing,2025-09-19,None,Weekly,5000.00,USD,337ccf4e-d3be-4d44-8fea-6f7bb3304b89,All Customers - Afternoon,all,custom,MANUAL_SET_BIDDING,3.00,Governor Ritchie,24121153,5,0,0.00,0.00,-0.00,-0.00,0.00,0.00,0.00,0,0,0,0,0,0,0,0,0,0.00
2025-10-12,945efc92-6e78-49d9-bc21-8ef1d2471fc4,Ads - Caps <> Spice,sponsored listing,2025-09-19,None,Weekly,5000.00,USD,337ccf4e-d3be-4d44-8fea-6f7bb3304b89,All Customers - Afternoon,all,custom,MANUAL_SET_BIDDING,3.00,Plumb Lane,439577,10,5,108.29,15.00,-0.00,-0.00,21.66,3.00,7.22,1,0,4,5,1,4,0,5,5,108.29
2025-10-12,945efc92-6e78-49d9-bc21-8ef1d2471fc4,Ads - Caps <> Spice,sponsored listing,2025-09-19,None,Weekly,5000.00,USD,337ccf4e-d3be-4d44-8fea-6f7bb3304b89,All Customers - Afternoon,all,custom,MANUAL_SET_BIDDING,3.00,Parker,24021312,1,0,0.00,0.00,-0.00,-0.00,0.00,0.00,0.00,0,0,0,0,0,0,0,0,0,0.00
2025-10-12,945efc92-6e78-49d9-bc21-8ef1d2471fc4,Ads - Caps <> Spice,sponsored listing,2025-09-19,None,Weekly,5000.00,USD,337ccf4e-d3be-4d44-8fea-6f7bb3304b89,All Customers - Afternoon,all,custom,MANUAL_SET_BIDDING,3.00,Park Road Center,27677423,5,3,95.74,9.00,-0.00,-0.00,31.91,3.00,10.64,2,0,1,3,2,1,0,3,5,146.29
2025-10-12,945efc92-6e78-49d9-bc21-8ef1d2471fc4,Ads - Caps <> Spice,sponsored listing,2025-09-19,None,Weekly,5000.00,USD,337ccf4e-d3be-4d44-8fea-6f7bb3304b89,All Customers - Afternoon,all,custom,MANUAL_SET_BIDDING,3.00,Kenosha & 177th,1856591,13,6,252.79,18.00,-0.00,-0.00,42.13,3.00,14.04,1,1,4,6,1,4,0,5,12,428.84
2025-10-12,945efc92-6e78-49d9-bc21-8ef1d2471fc4,Ads - Caps <> Spice,sponsored listing,2025-09-19,None,Weekly,5000.00,USD,337ccf4e-d3be-4d44-8fea-6f7bb3304b89,All Customers - Afternoon,all,custom,MANUAL_SET_BIDDING,3.00,"Marlton, NJ",35211042,1,0,0.00,0.00,-0.00,-0.00,0.00,0.00,0.00,0,0,0,0,0,0,0,0,1,30.16
2025-10-12,945efc92-6e78-49d9-bc21-8ef1d2471fc4,Ads - Caps <> Spice,sponsored listing,2025-09-19,None,Weekly,5000.00,USD,337ccf4e-d3be-4d44-8fea-6f7bb3304b89,All Customers - Afternoon,all,custom,MANUAL_SET_BIDDING,3.00,Anthem,75750,3,2,55.46,6.00,-0.00,-0.00,27.73,3.00,9.24,0,0,2,2,0,1,0,1,3,75.54
2025-10-12,945efc92-6e78-49d9-bc21-8ef1d2471fc4,Ads - Caps <> Spice,sponsored listing,2025-09-19,None,Weekly,5000.00,USD,337ccf4e-d3be-4d44-8fea-6f7bb3304b89,All Customers - Afternoon,all,custom,MANUAL_SET_BIDDING,3.00,West Craig Road,75727,1,0,0.00,0.00,-0.00,-0.00,0.00,0.00,0.00,0,0,0,0,0,0,0,0,4,55.74
2025-10-12,945efc92-6e78-49d9-bc21-8ef1d2471fc4,Ads - Caps <> Spice,sponsored listing,2025-09-19,None,Weekly,5000.00,USD,337ccf4e-d3be-4d44-8fea-6f7bb3304b89,All Customers - Afternoon,all,custom,MANUAL_SET_BIDDING,3.00,E William Street,1053361,11,5,166.71,15.00,-0.00,-0.00,33.34,3.00,11.11,2,0,2,4,2,0,0,2,7,216.86
2025-10-12,945efc92-6e78-49d9-bc21-8ef1d2471fc4,Ads - Caps <> Spice,sponsored listing,2025-09-19,None,Weekly,5000.00,USD,337ccf4e-d3be-4d44-8fea-6f7bb3304b89,All Customers - Afternoon,all,custom,MANUAL_SET_BIDDING,3.00,Red Rock Casino,75737,2,1,32.27,3.00,-0.00,-0.00,32.27,3.00,10.76,0,0,1,1,0,1,0,1,1,32.27
2025-10-12,945efc92-6e78-49d9-bc21-8ef1d2471fc4,Ads - Caps <> Spice,sponsored listing,2025-09-19,None,Weekly,5000.00,USD,97f406ae-2452-4364-9047-70a79ea745a1,All Customers - Afternoon,all,custom,MANUAL_SET_BIDDING,3.00,Niles Cortland Rd SE,34043935,0,0,0.00,0.00,-0.00,-0.00,0.00,0.00,0.00,0,0,0,0,0,0,0,0,0,0.00
2025-10-12,945efc92-6e78-49d9-bc21-8ef1d2471fc4,Ads - Caps <> Spice,sponsored listing,2025-09-19,None,Weekly,5000.00,USD,97f406ae-2452-4364-9047-70a79ea745a1,All Customers - Afternoon,all,custom,MANUAL_SET_BIDDING,3.00,Silverside Road,691182,0,0,0.00,0.00,-0.00,-0.00,0.00,0.00,0.00,0,0,0,0,0,0,0,0,0,0.00
2025-10-12,945efc92-6e78-49d9-bc21-8ef1d2471fc4,Ads - Caps <> Spice,sponsored listing,2025-09-19,None,Weekly,5000.00,USD,97f406ae-2452-4364-9047-70a79ea745a1,All Customers - Afternoon,all,custom,MANUAL_SET_BIDDING,3.00,Red Cliff Dr,578425,0,0,0.00,0.00,-0.00,-0.00,0.00,0.00,0.00,0,0,0,0,0,0,0,0,0,0.00
2025-10-12,945efc92-6e78-49d9-bc21-8ef1d2471fc4,Ads - Caps <> Spice,sponsored listing,2025-09-19,None,Weekly,5000.00,USD,9a6a8cb5-0536-4d63-ac59-bfcc3ec46632,Dinner – Lapsed Customers - 7:00 PM - 9:00 PM,existing,custom,MANUAL_SET_BIDDING,3.00,Cortez Rd  West,26034424,0,0,0.00,0.00,-0.00,-0.00,0.00,0.00,0.00,0,0,0,0,0,0,0,0,0,0.00
2025-10-12,945efc92-6e78-49d9-bc21-8ef1d2471fc4,Ads - Caps <> Spice,sponsored listing,2025-09-19,None,Weekly,5000.00,USD,337ccf4e-d3be-4d44-8fea-6f7bb3304b89,All Customers - Afternoon,all,custom,MANUAL_SET_BIDDING,3.00,Silverside Road,691182,12,5,111.73,15.00,-0.00,-0.00,22.35,3.00,7.45,0,0,5,5,0,3,0,3,5,111.73
2025-10-12,945efc92-6e78-49d9-bc21-8ef1d2471fc4,Ads - Caps <> Spice,sponsored listing,2025-09-19,None,Weekly,5000.00,USD,337ccf4e-d3be-4d44-8fea-6f7bb3304b89,All Customers - Afternoon,all,custom,MANUAL_SET_BIDDING,3.00,Brayden Pkwy,2375657,10,4,103.44,12.00,-0.00,-0.00,25.86,3.00,8.62,0,0,4,4,0,3,0,3,5,123.92
2025-10-12,945efc92-6e78-49d9-bc21-8ef1d2471fc4,Ads - Caps <> Spice,sponsored listing,2025-09-19,None,Weekly,5000.00,USD,337ccf4e-d3be-4d44-8fea-6f7bb3304b89,All Customers - Afternoon,all,custom,MANUAL_SET_BIDDING,3.00,West Cheyenne Ave,75722,9,2,56.55,6.00,-0.00,-0.00,28.28,3.00,9.43,0,0,2,2,0,1,0,1,2,56.55
2025-10-12,945efc92-6e78-49d9-bc21-8ef1d2471fc4,Ads - Caps <> Spice,sponsored listing,2025-09-19,None,Weekly,5000.00,USD,337ccf4e-d3be-4d44-8fea-6f7bb3304b89,All Customers - Afternoon,all,custom,MANUAL_SET_BIDDING,3.00,W Blue Diamond Rd,75738,5,1,30.38,3.00,-0.00,-0.00,30.38,3.00,10.13,0,0,1,1,0,1,0,1,1,30.38
2025-10-12,945efc92-6e78-49d9-bc21-8ef1d2471fc4,Ads - Caps <> Spice,sponsored listing,2025-09-19,None,Weekly,5000.00,USD,337ccf4e-d3be-4d44-8fea-6f7bb3304b89,All Customers - Afternoon,all,custom,MANUAL_SET_BIDDING,3.00,South Eastern Ave,75744,1,0,0.00,0.00,-0.00,-0.00,0.00,0.00,0.00,0,0,0,0,0,0,0,0,0,0.00
2025-10-12,945efc92-6e78-49d9-bc21-8ef1d2471fc4,Ads - Caps <> Spice,sponsored listing,2025-09-19,None,Weekly,5000.00,USD,337ccf4e-d3be-4d44-8fea-6f7bb3304b89,All Customers - Afternoon,all,custom,MANUAL_SET_BIDDING,3.00,Castle Rock,23057614,2,0,0.00,0.00,-0.00,-0.00,0.00,0.00,0.00,0,0,0,0,0,0,0,0,1,26.98
2025-10-12,945efc92-6e78-49d9-bc21-8ef1d2471fc4,Ads - Caps <> Spice,sponsored listing,2025-09-19,None,Weekly,5000.00,USD,97f406ae-2452-4364-9047-70a79ea745a1,All Customers - Afternoon,all,custom,MANUAL_SET_BIDDING,3.00,East 82nd St,184537,0,0,0.00,0.00,-0.00,-0.00,0.00,0.00,0.00,0,0,0,0,0,0,0,0,0,0.00
2025-10-12,945efc92-6e78-49d9-bc21-8ef1d2471fc4,Ads - Caps <> Spice,sponsored listing,2025-09-19,None,Weekly,5000.00,USD,97f406ae-2452-4364-9047-70a79ea745a1,All Customers - Afternoon,all,custom,MANUAL_SET_BIDDING,3.00,"Lewes, DE",34776698,0,0,0.00,0.00,-0.00,-0.00,0.00,0.00,0.00,0,0,0,0,0,0,0,0,0,0.00
2025-10-12,945efc92-6e78-49d9-bc21-8ef1d2471fc4,Ads - Caps <> Spice,sponsored listing,2025-09-19,None,Weekly,5000.00,USD,337ccf4e-d3be-4d44-8fea-6f7bb3304b89,All Customers - Afternoon,all,custom,MANUAL_SET_BIDDING,3.00,Nellis Blvd,75755,3,1,36.58,3.00,-0.00,-0.00,36.58,3.00,12.19,0,0,1,1,0,1,0,1,1,36.58
2025-10-12,945efc92-6e78-49d9-bc21-8ef1d2471fc4,Ads - Caps <> Spice,sponsored listing,2025-09-19,None,Weekly,5000.00,USD,337ccf4e-d3be-4d44-8fea-6f7bb3304b89,All Customers - Afternoon,all,custom,MANUAL_SET_BIDDING,3.00,Ogletown Stanton,422117,23,3,116.30,9.00,-0.00,-0.00,38.77,3.00,12.92,0,0,3,3,0,2,0,2,5,157.37
2025-10-12,3d931fbc-dadf-49d2-874c-2ae846d475ef,Sponsored Listing 08/07/2025,sponsored listing,2025-08-07,None,Daily,77.00,USD,33c77ede-4f0b-4417-aa7b-63120030d53a,,new,day,AUTOMATED_BIDDING,,Chicago River West,34048823,86,4,151.58,36.89,-0.00,-0.00,37.90,9.22,4.11,4,0,0,4,1,0,0,1,4,151.58
2025-10-12,945efc92-6e78-49d9-bc21-8ef1d2471fc4,Ads - Caps <> Spice,sponsored listing,2025-09-19,None,Weekly,5000.00,USD,337ccf4e-d3be-4d44-8fea-6f7bb3304b89,All Customers - Afternoon,all,custom,MANUAL_SET_BIDDING,3.00,Hwy 72 - Madison,27685318,5,4,86.19,12.00,-0.00,-0.00,21.55,3.00,7.18,2,0,2,4,2,2,0,4,6,154.91
2025-10-12,945efc92-6e78-49d9-bc21-8ef1d2471fc4,Ads - Caps <> Spice,sponsored listing,2025-09-19,None,Weekly,5000.00,USD,337ccf4e-d3be-4d44-8fea-6f7bb3304b89,All Customers - Afternoon,all,custom,MANUAL_SET_BIDDING,3.00,Terrace Center,321047,7,2,74.63,6.00,-0.00,-0.00,37.32,3.00,12.44,1,0,1,2,1,1,0,2,5,129.09
2025-10-12,945efc92-6e78-49d9-bc21-8ef1d2471fc4,Ads - Caps <> Spice,sponsored listing,2025-09-19,None,Weekly,5000.00,USD,337ccf4e-d3be-4d44-8fea-6f7bb3304b89,All Customers - Afternoon,all,custom,MANUAL_SET_BIDDING,3.00,East Craig Road,75739,5,2,33.76,6.00,-0.00,-0.00,16.88,3.00,5.63,1,0,1,2,1,0,0,1,3,64.94
2025-10-12,945efc92-6e78-49d9-bc21-8ef1d2471fc4,Ads - Caps <> Spice,sponsored listing,2025-09-19,None,Weekly,5000.00,USD,337ccf4e-d3be-4d44-8fea-6f7bb3304b89,All Customers - Afternoon,all,custom,MANUAL_SET_BIDDING,3.00,Arapahoe Rd,23349425,6,2,74.31,6.00,-0.00,-0.00,37.16,3.00,12.39,1,0,1,2,1,0,0,1,3,93.69
2025-10-12,945efc92-6e78-49d9-bc21-8ef1d2471fc4,Ads - Caps <> Spice,sponsored listing,2025-09-19,None,Weekly,5000.00,USD,97f406ae-2452-4364-9047-70a79ea745a1,All Customers - Afternoon,all,custom,MANUAL_SET_BIDDING,3.00,Nature Park Drive,75726,0,0,0.00,0.00,-0.00,-0.00,0.00,0.00,0.00,0,0,0,0,0,0,0,0,0,0.00
2025-10-12,945efc92-6e78-49d9-bc21-8ef1d2471fc4,Ads - Caps <> Spice,sponsored listing,2025-09-19,None,Weekly,5000.00,USD,337ccf4e-d3be-4d44-8fea-6f7bb3304b89,All Customers - Afternoon,all,custom,MANUAL_SET_BIDDING,3.00,Elm St,34052609,6,2,61.15,6.00,-0.00,-0.00,30.58,3.00,10.19,1,0,1,2,0,1,0,1,8,298.04
2025-10-12,945efc92-6e78-49d9-bc21-8ef1d2471fc4,Ads - Caps <> Spice,sponsored listing,2025-09-19,None,Weekly,5000.00,USD,97f406ae-2452-4364-9047-70a79ea745a1,All Customers - Afternoon,all,custom,MANUAL_SET_BIDDING,3.00,Millsboro Plaza,23360934,0,0,0.00,0.00,-0.00,-0.00,0.00,0.00,0.00,0,0,0,0,0,0,0,0,0,0.00
2025-10-12,945efc92-6e78-49d9-bc21-8ef1d2471fc4,Ads - Caps <> Spice,sponsored listing,2025-09-19,None,Weekly,5000.00,USD,337ccf4e-d3be-4d44-8fea-6f7bb3304b89,All Customers - Afternoon,all,custom,MANUAL_SET_BIDDING,3.00,N 87th Street,27965,4,2,66.56,6.00,-0.00,-0.00,33.28,3.00,11.09,0,0,2,2,0,2,0,2,2,66.56
2025-10-12,945efc92-6e78-49d9-bc21-8ef1d2471fc4,Ads - Caps <> Spice,sponsored listing,2025-09-19,None,Weekly,5000.00,USD,337ccf4e-d3be-4d44-8fea-6f7bb3304b89,All Customers - Afternoon,all,custom,MANUAL_SET_BIDDING,3.00,Sumneytown Pike,24717004,1,1,29.45,3.00,-0.00,-0.00,29.45,3.00,9.82,0,0,1,1,0,1,0,1,2,49.83
2025-10-12,945efc92-6e78-49d9-bc21-8ef1d2471fc4,Ads - Caps <> Spice,sponsored listing,2025-09-19,None,Weekly,5000.00,USD,337ccf4e-d3be-4d44-8fea-6f7bb3304b89,All Customers - Afternoon,all,custom,MANUAL_SET_BIDDING,3.00,1st Ave NE,23128705,2,1,12.89,3.00,-0.00,-0.00,12.89,3.00,4.30,0,0,1,1,0,0,0,0,2,41.55
2025-10-12,919bb82c-6d8a-4a5c-80c5-10e762b6d9f6,Sponsored Listing 04/07/2025,sponsored listing,2025-04-07,None,Daily,34.00,USD,7399c4cb-685f-4888-8de4-e5a0a68094f2,,all,day,AUTOMATED_BIDDING,,Downingtown,33699763,16,5,120.60,22.64,-0.00,-0.00,24.12,4.53,5.33,1,1,3,5,0,1,1,2,11,329.32
2025-10-12,945efc92-6e78-49d9-bc21-8ef1d2471fc4,Ads - Caps <> Spice,sponsored listing,2025-09-19,None,Weekly,5000.00,USD,337ccf4e-d3be-4d44-8fea-6f7bb3304b89,All Customers - Afternoon,all,custom,MANUAL_SET_BIDDING,3.00,Maryland Pkwy,1007892,2,1,38.06,3.00,-0.00,-0.00,38.06,3.00,12.69,0,1,0,1,0,0,1,1,1,38.06
2025-10-12,945efc92-6e78-49d9-bc21-8ef1d2471fc4,Ads - Caps <> Spice,sponsored listing,2025-09-19,None,Weekly,5000.00,USD,97f406ae-2452-4364-9047-70a79ea745a1,All Customers - Afternoon,all,custom,MANUAL_SET_BIDDING,3.00,Whitesburg Dr (Medical District),34051357,0,0,0.00,0.00,-0.00,-0.00,0.00,0.00,0.00,0,0,0,0,0,0,0,0,0,0.00
2025-10-12,d3e92915-aaa0-49c5-863f-3b702070f815,Sponsored Listing 05/19/2025,sponsored listing,2025-05-19,None,Daily,50.00,USD,e40dbf32-9788-4c9b-91d5-428e01aecd91,,all,day,AUTOMATED_BIDDING,,Chicago River West,34048823,1,1,47.75,8.96,-0.00,-0.00,47.75,8.96,5.33,0,0,1,1,0,1,0,1,1,47.75
2025-10-12,945efc92-6e78-49d9-bc21-8ef1d2471fc4,Ads - Caps <> Spice,sponsored listing,2025-09-19,None,Weekly,5000.00,USD,337ccf4e-d3be-4d44-8fea-6f7bb3304b89,All Customers - Afternoon,all,custom,MANUAL_SET_BIDDING,3.00,Princeton,32118309,1,0,0.00,0.00,-0.00,-0.00,0.00,0.00,0.00,0,0,0,0,0,0,0,0,0,0.00
2025-10-12,945efc92-6e78-49d9-bc21-8ef1d2471fc4,Ads - Caps <> Spice,sponsored listing,2025-09-19,None,Weekly,5000.00,USD,97f406ae-2452-4364-9047-70a79ea745a1,All Customers - Afternoon,all,custom,MANUAL_SET_BIDDING,3.00,Manchester Rd,27715447,1,0,0.00,0.00,-0.00,-0.00,0.00,0.00,0.00,0,0,0,0,0,0,0,0,0,0.00
2025-10-12,945efc92-6e78-49d9-bc21-8ef1d2471fc4,Ads - Caps <> Spice,sponsored listing,2025-09-19,None,Weekly,5000.00,USD,337ccf4e-d3be-4d44-8fea-6f7bb3304b89,All Customers - Afternoon,all,custom,MANUAL_SET_BIDDING,3.00,Smithtown Bypass,23349427,0,0,0.00,0.00,-0.00,-0.00,0.00,0.00,0.00,0,0,0,0,0,0,0,0,0,0.00
2025-10-12,945efc92-6e78-49d9-bc21-8ef1d2471fc4,Ads - Caps <> Spice,sponsored listing,2025-09-19,None,Weekly,5000.00,USD,97f406ae-2452-4364-9047-70a79ea745a1,All Customers - Afternoon,all,custom,MANUAL_SET_BIDDING,3.00,Concord Pike,23151390,1,0,0.00,0.00,-0.00,-0.00,0.00,0.00,0.00,0,0,0,0,0,0,0,0,1,34.67
2025-10-12,bc5ef595-7f63-4973-b895-94a51a6e7f56,Sponsored Listing 10/12/2025,sponsored listing,2025-10-12,None,Daily,74.00,USD,bb4a7e20-27f1-493d-8ece-3a8c8ef92fa8,,all,day,AUTOMATED_BIDDING,,Raccoon Rd,26015022,22,8,346.98,37.63,-0.00,-0.00,43.37,4.70,9.22,2,1,5,8,1,5,0,6,9,399.64
2025-10-12,945efc92-6e78-49d9-bc21-8ef1d2471fc4,Ads - Caps <> Spice,sponsored listing,2025-09-19,None,Weekly,5000.00,USD,337ccf4e-d3be-4d44-8fea-6f7bb3304b89,All Customers - Afternoon,all,custom,MANUAL_SET_BIDDING,3.00,University Ave,1084955,2,0,0.00,0.00,-0.00,-0.00,0.00,0.00,0.00,0,0,0,0,0,0,0,0,2,55.93
2025-10-12,945efc92-6e78-49d9-bc21-8ef1d2471fc4,Ads - Caps <> Spice,sponsored listing,2025-09-19,None,Weekly,5000.00,USD,337ccf4e-d3be-4d44-8fea-6f7bb3304b89,All Customers - Afternoon,all,custom,MANUAL_SET_BIDDING,3.00,Niles Cortland Rd SE,34043935,24,3,160.67,9.00,-0.00,-0.00,53.56,3.00,17.85,0,0,3,3,0,3,0,3,4,181.75
2025-10-12,945efc92-6e78-49d9-bc21-8ef1d2471fc4,Ads - Caps <> Spice,sponsored listing,2025-09-19,None,Weekly,5000.00,USD,97f406ae-2452-4364-9047-70a79ea745a1,All Customers - Afternoon,all,custom,MANUAL_SET_BIDDING,3.00,W Blue Diamond Rd,75738,1,1,52.04,3.00,-0.00,-0.00,52.04,3.00,17.35,0,0,1,1,0,1,0,1,1,52.04
2025-10-12,945efc92-6e78-49d9-bc21-8ef1d2471fc4,Ads - Caps <> Spice,sponsored listing,2025-09-19,None,Weekly,5000.00,USD,337ccf4e-d3be-4d44-8fea-6f7bb3304b89,All Customers - Afternoon,all,custom,MANUAL_SET_BIDDING,3.00,The Old Road,24898774,1,0,0.00,0.00,-0.00,-0.00,0.00,0.00,0.00,0,0,0,0,0,0,0,0,1,24.99
2025-10-12,945efc92-6e78-49d9-bc21-8ef1d2471fc4,Ads - Caps <> Spice,sponsored listing,2025-09-19,None,Weekly,5000.00,USD,97f406ae-2452-4364-9047-70a79ea745a1,All Customers - Afternoon,all,custom,MANUAL_SET_BIDDING,3.00,Sierra St - Reno,719271,1,0,0.00,0.00,-0.00,-0.00,0.00,0.00,0.00,0,0,0,0,0,0,0,0,0,0.00
2025-10-12,945efc92-6e78-49d9-bc21-8ef1d2471fc4,Ads - Caps <> Spice,sponsored listing,2025-09-19,None,Weekly,5000.00,USD,337ccf4e-d3be-4d44-8fea-6f7bb3304b89,All Customers - Afternoon,all,custom,MANUAL_SET_BIDDING,3.00,Sunrise Blvd,31345439,6,1,39.86,3.00,-0.00,-0.00,39.86,3.00,13.29,1,0,0,1,1,0,0,1,1,39.86
2025-10-12,945efc92-6e78-49d9-bc21-8ef1d2471fc4,Ads - Caps <> Spice,sponsored listing,2025-09-19,None,Weekly,5000.00,USD,337ccf4e-d3be-4d44-8fea-6f7bb3304b89,All Customers - Afternoon,all,custom,MANUAL_SET_BIDDING,3.00,"Capriotti's of Milford, LLC",1636430,1,0,0.00,0.00,-0.00,-0.00,0.00,0.00,0.00,0,0,0,0,0,0,0,0,0,0.00
2025-10-12,945efc92-6e78-49d9-bc21-8ef1d2471fc4,Ads - Caps <> Spice,sponsored listing,2025-09-19,None,Weekly,5000.00,USD,337ccf4e-d3be-4d44-8fea-6f7bb3304b89,All Customers - Afternoon,all,custom,MANUAL_SET_BIDDING,3.00,Interquest Parkway,27558470,4,0,0.00,0.00,-0.00,-0.00,0.00,0.00,0.00,0,0,0,0,0,0,0,0,0,0.00
2025-10-12,945efc92-6e78-49d9-bc21-8ef1d2471fc4,Ads - Caps <> Spice,sponsored listing,2025-09-19,None,Weekly,5000.00,USD,337ccf4e-d3be-4d44-8fea-6f7bb3304b89,All Customers - Afternoon,all,custom,MANUAL_SET_BIDDING,3.00,Forest Drive,674540,4,2,40.77,6.00,-0.00,-0.00,20.39,3.00,6.80,0,0,2,2,0,2,0,2,5,104.19
2025-10-12,945efc92-6e78-49d9-bc21-8ef1d2471fc4,Ads - Caps <> Spice,sponsored listing,2025-09-19,None,Weekly,5000.00,USD,97f406ae-2452-4364-9047-70a79ea745a1,All Customers - Afternoon,all,custom,MANUAL_SET_BIDDING,3.00,E Silverado Ranch,75746,0,0,0.00,0.00,-0.00,-0.00,0.00,0.00,0.00,0,0,0,0,0,0,0,0,0,0.00
2025-10-12,945efc92-6e78-49d9-bc21-8ef1d2471fc4,Ads - Caps <> Spice,sponsored listing,2025-09-19,None,Weekly,5000.00,USD,97f406ae-2452-4364-9047-70a79ea745a1,All Customers - Afternoon,all,custom,MANUAL_SET_BIDDING,3.00,Eden Square Ctr,420646,0,0,0.00,0.00,-0.00,-0.00,0.00,0.00,0.00,0,0,0,0,0,0,0,0,0,0.00
2025-10-12,945efc92-6e78-49d9-bc21-8ef1d2471fc4,Ads - Caps <> Spice,sponsored listing,2025-09-19,None,Weekly,5000.00,USD,97f406ae-2452-4364-9047-70a79ea745a1,All Customers - Afternoon,all,custom,MANUAL_SET_BIDDING,3.00,Hwy 72 - Madison,27685318,0,0,0.00,0.00,-0.00,-0.00,0.00,0.00,0.00,0,0,0,0,0,0,0,0,0,0.00
2025-10-12,945efc92-6e78-49d9-bc21-8ef1d2471fc4,Ads - Caps <> Spice,sponsored listing,2025-09-19,None,Weekly,5000.00,USD,337ccf4e-d3be-4d44-8fea-6f7bb3304b89,All Customers - Afternoon,all,custom,MANUAL_SET_BIDDING,3.00,North Union St,575293,18,4,109.52,12.00,-0.00,-0.00,27.38,3.00,9.13,0,2,2,4,0,0,1,1,4,114.81
2025-10-12,945efc92-6e78-49d9-bc21-8ef1d2471fc4,Ads - Caps <> Spice,sponsored listing,2025-09-19,None,Weekly,5000.00,USD,97f406ae-2452-4364-9047-70a79ea745a1,All Customers - Afternoon,all,custom,MANUAL_SET_BIDDING,3.00,Newark,390890,0,0,0.00,0.00,-0.00,-0.00,0.00,0.00,0.00,0,0,0,0,0,0,0,0,0,0.00
2025-10-12,945efc92-6e78-49d9-bc21-8ef1d2471fc4,Ads - Caps <> Spice,sponsored listing,2025-09-19,None,Weekly,5000.00,USD,337ccf4e-d3be-4d44-8fea-6f7bb3304b89,All Customers - Afternoon,all,custom,MANUAL_SET_BIDDING,3.00,Nevada Way,75754,2,1,21.77,3.00,-0.00,-0.00,21.77,3.00,7.26,0,1,0,1,0,0,0,0,1,21.77
2025-10-12,945efc92-6e78-49d9-bc21-8ef1d2471fc4,Ads - Caps <> Spice,sponsored listing,2025-09-19,None,Weekly,5000.00,USD,337ccf4e-d3be-4d44-8fea-6f7bb3304b89,All Customers - Afternoon,all,custom,MANUAL_SET_BIDDING,3.00,GVR Casino,75749,2,1,22.18,3.00,-0.00,-0.00,22.18,3.00,7.39,0,0,1,1,0,0,0,0,2,52.35
2025-10-12,945efc92-6e78-49d9-bc21-8ef1d2471fc4,Ads - Caps <> Spice,sponsored listing,2025-09-19,None,Weekly,5000.00,USD,337ccf4e-d3be-4d44-8fea-6f7bb3304b89,All Customers - Afternoon,all,custom,MANUAL_SET_BIDDING,3.00,Marlboro - Easton,674514,6,2,53.44,6.00,-0.00,-0.00,26.72,3.00,8.91,1,0,1,2,1,1,0,2,5,113.88
2025-10-12,945efc92-6e78-49d9-bc21-8ef1d2471fc4,Ads - Caps <> Spice,sponsored listing,2025-09-19,None,Weekly,5000.00,USD,337ccf4e-d3be-4d44-8fea-6f7bb3304b89,All Customers - Afternoon,all,custom,MANUAL_SET_BIDDING,3.00,Millsboro Plaza,23360934,14,5,157.75,15.00,-0.00,-0.00,31.55,3.00,10.52,2,0,3,5,0,2,0,2,10,302.90
2025-10-12,945efc92-6e78-49d9-bc21-8ef1d2471fc4,Ads - Caps <> Spice,sponsored listing,2025-09-19,None,Weekly,5000.00,USD,97f406ae-2452-4364-9047-70a79ea745a1,All Customers - Afternoon,all,custom,MANUAL_SET_BIDDING,3.00,East Ridge Pike,1640642,0,0,0.00,0.00,-0.00,-0.00,0.00,0.00,0.00,0,0,0,0,0,0,0,0,0,0.00
2025-10-12,945efc92-6e78-49d9-bc21-8ef1d2471fc4,Ads - Caps <> Spice,sponsored listing,2025-09-19,None,Weekly,5000.00,USD,337ccf4e-d3be-4d44-8fea-6f7bb3304b89,All Customers - Afternoon,all,custom,MANUAL_SET_BIDDING,3.00,Sierra Hwy,27476315,1,0,0.00,0.00,-0.00,-0.00,0.00,0.00,0.00,0,0,0,0,0,0,0,0,1,18.39
2025-10-12,945efc92-6e78-49d9-bc21-8ef1d2471fc4,Ads - Caps <> Spice,sponsored listing,2025-09-19,None,Weekly,5000.00,USD,97f406ae-2452-4364-9047-70a79ea745a1,All Customers - Afternoon,all,custom,MANUAL_SET_BIDDING,3.00,West Sahara Avenue,424852,0,0,0.00,0.00,-0.00,-0.00,0.00,0.00,0.00,0,0,0,0,0,0,0,0,1,23.58
2025-10-12,945efc92-6e78-49d9-bc21-8ef1d2471fc4,Ads - Caps <> Spice,sponsored listing,2025-09-19,None,Weekly,5000.00,USD,337ccf4e-d3be-4d44-8fea-6f7bb3304b89,All Customers - Afternoon,all,custom,MANUAL_SET_BIDDING,3.00,Paradise Road,75734,2,0,0.00,0.00,-0.00,-0.00,0.00,0.00,0.00,0,0,0,0,0,0,0,0,0,0.00
2025-10-12,945efc92-6e78-49d9-bc21-8ef1d2471fc4,Ads - Caps <> Spice,sponsored listing,2025-09-19,None,Weekly,5000.00,USD,337ccf4e-d3be-4d44-8fea-6f7bb3304b89,All Customers - Afternoon,all,custom,MANUAL_SET_BIDDING,3.00,Pioneer Pkwy,874359,0,0,0.00,0.00,-0.00,-0.00,0.00,0.00,0.00,0,0,0,0,0,0,0,0,0,0.00
2025-10-12,945efc92-6e78-49d9-bc21-8ef1d2471fc4,Ads - Caps <> Spice,sponsored listing,2025-09-19,None,Weekly,5000.00,USD,337ccf4e-d3be-4d44-8fea-6f7bb3304b89,All Customers - Afternoon,all,custom,MANUAL_SET_BIDDING,3.00,Cortez Rd  West,26034424,3,1,41.74,3.00,-0.00,-0.00,41.74,3.00,13.91,0,0,1,1,0,1,0,1,2,75.11
2025-10-12,945efc92-6e78-49d9-bc21-8ef1d2471fc4,Ads - Caps <> Spice,sponsored listing,2025-09-19,None,Weekly,5000.00,USD,9a6a8cb5-0536-4d63-ac59-bfcc3ec46632,Dinner – Lapsed Customers - 7:00 PM - 9:00 PM,existing,custom,MANUAL_SET_BIDDING,3.00,Manchester Rd,27715447,1,0,0.00,0.00,-0.00,-0.00,0.00,0.00,0.00,0,0,0,0,0,0,0,0,0,0.00
2025-10-12,945efc92-6e78-49d9-bc21-8ef1d2471fc4,Ads - Caps <> Spice,sponsored listing,2025-09-19,None,Weekly,5000.00,USD,337ccf4e-d3be-4d44-8fea-6f7bb3304b89,All Customers - Afternoon,all,custom,MANUAL_SET_BIDDING,3.00,Douglas Blvd,1018616,6,1,33.36,3.00,-0.00,-0.00,33.36,3.00,11.12,0,0,1,1,0,1,0,1,2,53.75
2025-10-12,945efc92-6e78-49d9-bc21-8ef1d2471fc4,Ads - Caps <> Spice,sponsored listing,2025-09-19,None,Weekly,5000.00,USD,337ccf4e-d3be-4d44-8fea-6f7bb3304b89,All Customers - Afternoon,all,custom,MANUAL_SET_BIDDING,3.00,East Ridge Pike,1640642,4,2,44.37,6.00,-0.00,-0.00,22.19,3.00,7.40,0,0,2,2,0,1,0,1,2,44.37
2025-10-12,945efc92-6e78-49d9-bc21-8ef1d2471fc4,Ads - Caps <> Spice,sponsored listing,2025-09-19,None,Weekly,5000.00,USD,337ccf4e-d3be-4d44-8fea-6f7bb3304b89,All Customers - Afternoon,all,custom,MANUAL_SET_BIDDING,3.00,E Silverado Ranch,75746,1,1,26.38,3.00,-0.00,-0.00,26.38,3.00,8.79,1,0,0,1,1,0,0,1,2,58.35
2025-10-12,945efc92-6e78-49d9-bc21-8ef1d2471fc4,Ads - Caps <> Spice,sponsored listing,2025-09-19,None,Weekly,5000.00,USD,337ccf4e-d3be-4d44-8fea-6f7bb3304b89,All Customers - Afternoon,all,custom,MANUAL_SET_BIDDING,3.00,Sierra St - Reno,719271,22,9,165.13,27.00,-0.00,-0.00,18.35,3.00,6.12,1,1,7,9,0,2,1,3,11,202.29
2025-10-12,945efc92-6e78-49d9-bc21-8ef1d2471fc4,Ads - Caps <> Spice,sponsored listing,2025-09-19,None,Weekly,5000.00,USD,97f406ae-2452-4364-9047-70a79ea745a1,All Customers - Afternoon,all,custom,MANUAL_SET_BIDDING,3.00,West Basin Rd,575301,0,0,0.00,0.00,-0.00,-0.00,0.00,0.00,0.00,0,0,0,0,0,0,0,0,1,13.48
2025-10-12,945efc92-6e78-49d9-bc21-8ef1d2471fc4,Ads - Caps <> Spice,sponsored listing,2025-09-19,None,Weekly,5000.00,USD,337ccf4e-d3be-4d44-8fea-6f7bb3304b89,All Customers - Afternoon,all,custom,MANUAL_SET_BIDDING,3.00,Broadway - Tucson,27829895,6,1,29.98,3.00,-0.00,-0.00,29.98,3.00,9.99,0,0,1,1,0,0,0,0,2,60.76
2025-10-12,945efc92-6e78-49d9-bc21-8ef1d2471fc4,Ads - Caps <> Spice,sponsored listing,2025-09-19,None,Weekly,5000.00,USD,337ccf4e-d3be-4d44-8fea-6f7bb3304b89,All Customers - Afternoon,all,custom,MANUAL_SET_BIDDING,3.00,Gambrills,24415514,3,1,26.97,3.00,-0.00,-0.00,26.97,3.00,8.99,1,0,0,1,1,0,0,1,1,26.97
2025-10-12,945efc92-6e78-49d9-bc21-8ef1d2471fc4,Ads - Caps <> Spice,sponsored listing,2025-09-19,None,Weekly,5000.00,USD,337ccf4e-d3be-4d44-8fea-6f7bb3304b89,All Customers - Afternoon,all,custom,MANUAL_SET_BIDDING,3.00,Meadows - Reno,705841,4,1,32.38,3.00,-0.00,-0.00,32.38,3.00,10.79,0,0,1,1,0,0,0,0,2,61.76
2025-10-12,945efc92-6e78-49d9-bc21-8ef1d2471fc4,Ads - Caps <> Spice,sponsored listing,2025-09-19,None,Weekly,5000.00,USD,337ccf4e-d3be-4d44-8fea-6f7bb3304b89,All Customers - Afternoon,all,custom,MANUAL_SET_BIDDING,3.00,Kirkwood Hwy,390889,10,3,202.82,9.00,-0.00,-0.00,67.61,3.00,22.54,0,1,2,3,0,1,1,2,3,202.82
2025-10-12,945efc92-6e78-49d9-bc21-8ef1d2471fc4,Ads - Caps <> Spice,sponsored listing,2025-09-19,None,Weekly,5000.00,USD,97f406ae-2452-4364-9047-70a79ea745a1,All Customers - Afternoon,all,custom,MANUAL_SET_BIDDING,3.00,North Town Center,75721,0,0,0.00,0.00,-0.00,-0.00,0.00,0.00,0.00,0,0,0,0,0,0,0,0,0,0.00
2025-10-12,5988790d-c8fe-447e-80d3-8a98e08c5b3f,Sponsored Listing 04/25/2025,sponsored listing,2025-04-25,None,Daily,50.00,USD,58e89ecb-83bc-4753-aa78-d61fedec8949,,new,day,AUTOMATED_BIDDING,,Chicago River West,34048823,5,1,53.95,11.33,-0.00,-0.00,53.95,11.33,4.76,1,0,0,1,1,0,0,1,2,72.44
2025-10-12,945efc92-6e78-49d9-bc21-8ef1d2471fc4,Ads - Caps <> Spice,sponsored listing,2025-09-19,None,Weekly,5000.00,USD,337ccf4e-d3be-4d44-8fea-6f7bb3304b89,All Customers - Afternoon,all,custom,MANUAL_SET_BIDDING,3.00,Downingtown,33699763,5,2,58.83,6.00,-0.00,-0.00,29.42,3.00,9.81,0,0,2,2,0,2,0,2,4,105.40
2025-10-12,945efc92-6e78-49d9-bc21-8ef1d2471fc4,Ads - Caps <> Spice,sponsored listing,2025-09-19,None,Weekly,5000.00,USD,337ccf4e-d3be-4d44-8fea-6f7bb3304b89,All Customers - Afternoon,all,custom,MANUAL_SET_BIDDING,3.00,Manchester Rd,27715447,15,3,71.82,9.00,-0.00,-0.00,23.94,3.00,7.98,0,0,3,3,0,2,0,2,6,180.13
2025-10-12,945efc92-6e78-49d9-bc21-8ef1d2471fc4,Ads - Caps <> Spice,sponsored listing,2025-09-19,None,Weekly,5000.00,USD,337ccf4e-d3be-4d44-8fea-6f7bb3304b89,All Customers - Afternoon,all,custom,MANUAL_SET_BIDDING,3.00,Coeur d'Alene,23085790,9,5,146.47,15.00,-0.00,-0.00,29.29,3.00,9.76,1,2,2,5,1,2,2,5,7,198.82
2025-10-12,945efc92-6e78-49d9-bc21-8ef1d2471fc4,Ads - Caps <> Spice,sponsored listing,2025-09-19,None,Weekly,5000.00,USD,337ccf4e-d3be-4d44-8fea-6f7bb3304b89,All Customers - Afternoon,all,custom,MANUAL_SET_BIDDING,3.00,Southern Highlands,1750142,4,0,0.00,0.00,-0.00,-0.00,0.00,0.00,0.00,0,0,0,0,0,0,0,0,0,0.00
2025-10-12,945efc92-6e78-49d9-bc21-8ef1d2471fc4,Ads - Caps <> Spice,sponsored listing,2025-09-19,None,Weekly,5000.00,USD,97f406ae-2452-4364-9047-70a79ea745a1,All Customers - Afternoon,all,custom,MANUAL_SET_BIDDING,3.00,Freeman Park,24404087,0,0,0.00,0.00,-0.00,-0.00,0.00,0.00,0.00,0,0,0,0,0,0,0,0,0,0.00
2025-10-12,945efc92-6e78-49d9-bc21-8ef1d2471fc4,Ads - Caps <> Spice,sponsored listing,2025-09-19,None,Weekly,5000.00,USD,337ccf4e-d3be-4d44-8fea-6f7bb3304b89,All Customers - Afternoon,all,custom,MANUAL_SET_BIDDING,3.00,Heart Pine-Odessa,2232632,2,1,12.09,3.00,-0.00,-0.00,12.09,3.00,4.03,0,0,1,1,0,1,0,1,3,70.35
2025-10-12,945efc92-6e78-49d9-bc21-8ef1d2471fc4,Ads - Caps <> Spice,sponsored listing,2025-09-19,None,Weekly,5000.00,USD,337ccf4e-d3be-4d44-8fea-6f7bb3304b89,All Customers - Afternoon,all,custom,MANUAL_SET_BIDDING,3.00,North Haven Ave,28834163,4,0,0.00,0.00,-0.00,-0.00,0.00,0.00,0.00,0,0,0,0,0,0,0,0,0,0.00
2025-10-12,945efc92-6e78-49d9-bc21-8ef1d2471fc4,Ads - Caps <> Spice,sponsored listing,2025-09-19,None,Weekly,5000.00,USD,337ccf4e-d3be-4d44-8fea-6f7bb3304b89,All Customers - Afternoon,all,custom,MANUAL_SET_BIDDING,3.00,Kent Island,691089,3,0,0.00,0.00,-0.00,-0.00,0.00,0.00,0.00,0,0,0,0,0,0,0,0,0,0.00
2025-10-12,6dcfccaf-60c4-488e-bbf3-cc4a29cbf9da,Sponsored Listing 08/07/2025,sponsored listing,2025-08-07,None,Daily,85.72,USD,d4f97af1-eea4-4c46-93d0-97045be27bd7,,all,day,AUTOMATED_BIDDING,,Chicago River West,34048823,36,9,332.98,77.01,-0.00,-0.00,37.00,8.56,4.32,0,2,7,9,0,7,1,8,10,346.75
2025-10-12,945efc92-6e78-49d9-bc21-8ef1d2471fc4,Ads - Caps <> Spice,sponsored listing,2025-09-19,None,Weekly,5000.00,USD,337ccf4e-d3be-4d44-8fea-6f7bb3304b89,All Customers - Afternoon,all,custom,MANUAL_SET_BIDDING,3.00,Rancho Mirage,32864869,1,1,32.49,3.00,-0.00,-0.00,32.49,3.00,10.83,0,0,1,1,0,1,0,1,1,32.49
2025-10-12,945efc92-6e78-49d9-bc21-8ef1d2471fc4,Ads - Caps <> Spice,sponsored listing,2025-09-19,None,Weekly,5000.00,USD,97f406ae-2452-4364-9047-70a79ea745a1,All Customers - Afternoon,all,custom,MANUAL_SET_BIDDING,3.00,Downtown Summerlin,75736,0,0,0.00,0.00,-0.00,-0.00,0.00,0.00,0.00,0,0,0,0,0,0,0,0,0,0.00
2025-10-12,945efc92-6e78-49d9-bc21-8ef1d2471fc4,Ads - Caps <> Spice,sponsored listing,2025-09-19,None,Weekly,5000.00,USD,337ccf4e-d3be-4d44-8fea-6f7bb3304b89,All Customers - Afternoon,all,custom,MANUAL_SET_BIDDING,3.00,Boulder Station,23349419,1,1,29.48,3.00,-0.00,-0.00,29.48,3.00,9.83,0,0,1,1,0,1,0,1,1,29.48
2025-10-12,945efc92-6e78-49d9-bc21-8ef1d2471fc4,Ads - Caps <> Spice,sponsored listing,2025-09-19,None,Weekly,5000.00,USD,337ccf4e-d3be-4d44-8fea-6f7bb3304b89,All Customers - Afternoon,all,custom,MANUAL_SET_BIDDING,3.00,Plank Rd,27918503,3,3,93.82,9.00,-0.00,-0.00,31.27,3.00,10.42,2,0,1,3,2,1,0,3,3,95.43
2025-10-12,945efc92-6e78-49d9-bc21-8ef1d2471fc4,Ads - Caps <> Spice,sponsored listing,2025-09-19,None,Weekly,5000.00,USD,337ccf4e-d3be-4d44-8fea-6f7bb3304b89,All Customers - Afternoon,all,custom,MANUAL_SET_BIDDING,3.00,Barnes Road,24892677,10,1,17.88,3.00,-0.00,-0.00,17.88,3.00,5.96,0,0,1,1,0,0,0,0,1,17.88
2025-10-12,945efc92-6e78-49d9-bc21-8ef1d2471fc4,Ads - Caps <> Spice,sponsored listing,2025-09-19,None,Weekly,5000.00,USD,97f406ae-2452-4364-9047-70a79ea745a1,All Customers - Afternoon,all,custom,MANUAL_SET_BIDDING,3.00,Elm St,34052609,0,0,0.00,0.00,-0.00,-0.00,0.00,0.00,0.00,0,0,0,0,0,0,0,0,0,0.00
2025-10-12,945efc92-6e78-49d9-bc21-8ef1d2471fc4,Ads - Caps <> Spice,sponsored listing,2025-09-19,None,Weekly,5000.00,USD,337ccf4e-d3be-4d44-8fea-6f7bb3304b89,All Customers - Afternoon,all,custom,MANUAL_SET_BIDDING,3.00,Whitesburg Dr (Medical District),34051357,13,7,246.08,21.00,-0.00,-0.00,35.15,3.00,11.72,4,0,3,7,3,3,0,6,9,291.83
2025-10-12,945efc92-6e78-49d9-bc21-8ef1d2471fc4,Ads - Caps <> Spice,sponsored listing,2025-09-19,None,Weekly,5000.00,USD,337ccf4e-d3be-4d44-8fea-6f7bb3304b89,All Customers - Afternoon,all,custom,MANUAL_SET_BIDDING,3.00,WVC High Market,2608935,2,1,29.49,3.00,-0.00,-0.00,29.49,3.00,9.83,0,0,1,1,0,1,0,1,0,0.00
2025-10-12,945efc92-6e78-49d9-bc21-8ef1d2471fc4,Ads - Caps <> Spice,sponsored listing,2025-09-19,None,Weekly,5000.00,USD,97f406ae-2452-4364-9047-70a79ea745a1,All Customers - Afternoon,all,custom,MANUAL_SET_BIDDING,3.00,Bridge St,35060561,0,0,0.00,0.00,-0.00,-0.00,0.00,0.00,0.00,0,0,0,0,0,0,0,0,0,0.00
2025-10-12,d3e92915-aaa0-49c5-863f-3b702070f815,Sponsored Listing 05/19/2025,sponsored listing,2025-05-19,None,Daily,50.00,USD,e40dbf32-9788-4c9b-91d5-428e01aecd91,,all,day,AUTOMATED_BIDDING,,West Fullerton Ave,23349403,2,0,0.00,0.00,-0.00,-0.00,0.00,0.00,0.00,0,0,0,0,0,0,0,0,0,0.00
2025-10-12,945efc92-6e78-49d9-bc21-8ef1d2471fc4,Ads - Caps <> Spice,sponsored listing,2025-09-19,None,Weekly,5000.00,USD,337ccf4e-d3be-4d44-8fea-6f7bb3304b89,All Customers - Afternoon,all,custom,MANUAL_SET_BIDDING,3.00,17th St Ammon,24968543,4,1,16.18,3.00,-0.00,-0.00,16.18,3.00,5.39,1,0,0,1,0,0,0,0,1,35.98
2025-10-12,945efc92-6e78-49d9-bc21-8ef1d2471fc4,Ads - Caps <> Spice,sponsored listing,2025-09-19,None,Weekly,5000.00,USD,9a6a8cb5-0536-4d63-ac59-bfcc3ec46632,Dinner – Lapsed Customers - 7:00 PM - 9:00 PM,existing,custom,MANUAL_SET_BIDDING,3.00,Kent Island,691089,0,0,0.00,0.00,-0.00,-0.00,0.00,0.00,0.00,0,0,0,0,0,0,0,0,0,0.00
2025-10-12,945efc92-6e78-49d9-bc21-8ef1d2471fc4,Ads - Caps <> Spice,sponsored listing,2025-09-19,None,Weekly,5000.00,USD,97f406ae-2452-4364-9047-70a79ea745a1,All Customers - Afternoon,all,custom,MANUAL_SET_BIDDING,3.00,Boulder Station,23349419,0,0,0.00,0.00,-0.00,-0.00,0.00,0.00,0.00,0,0,0,0,0,0,0,0,0,0.00
2025-10-12,945efc92-6e78-49d9-bc21-8ef1d2471fc4,Ads - Caps <> Spice,sponsored listing,2025-09-19,None,Weekly,5000.00,USD,337ccf4e-d3be-4d44-8fea-6f7bb3304b89,All Customers - Afternoon,all,custom,MANUAL_SET_BIDDING,3.00,Eden Square Ctr,420646,11,5,148.29,15.00,-0.00,-0.00,29.66,3.00,9.89,0,3,2,5,0,0,3,3,9,249.81
2025-10-12,945efc92-6e78-49d9-bc21-8ef1d2471fc4,Ads - Caps <> Spice,sponsored listing,2025-09-19,None,Weekly,5000.00,USD,337ccf4e-d3be-4d44-8fea-6f7bb3304b89,All Customers - Afternoon,all,custom,MANUAL_SET_BIDDING,3.00,Blue Diamond Road,333447,2,1,27.49,3.00,-0.00,-0.00,27.49,3.00,9.16,0,0,1,1,0,1,0,1,2,73.35
2025-10-12,945efc92-6e78-49d9-bc21-8ef1d2471fc4,Ads - Caps <> Spice,sponsored listing,2025-09-19,None,Weekly,5000.00,USD,97f406ae-2452-4364-9047-70a79ea745a1,All Customers - Afternoon,all,custom,MANUAL_SET_BIDDING,3.00,Los Altos,33476901,0,0,0.00,0.00,-0.00,-0.00,0.00,0.00,0.00,0,0,0,0,0,0,0,0,0,0.00
2025-10-12,945efc92-6e78-49d9-bc21-8ef1d2471fc4,Ads - Caps <> Spice,sponsored listing,2025-09-19,None,Weekly,5000.00,USD,337ccf4e-d3be-4d44-8fea-6f7bb3304b89,All Customers - Afternoon,all,custom,MANUAL_SET_BIDDING,3.00,S Fort Apache,75730,5,0,0.00,0.00,-0.00,-0.00,0.00,0.00,0.00,0,0,0,0,0,0,0,0,1,10.89
2025-10-12,945efc92-6e78-49d9-bc21-8ef1d2471fc4,Ads - Caps <> Spice,sponsored listing,2025-09-19,None,Weekly,5000.00,USD,337ccf4e-d3be-4d44-8fea-6f7bb3304b89,All Customers - Afternoon,all,custom,MANUAL_SET_BIDDING,3.00,Post Falls,34326515,6,4,124.48,12.00,-0.00,-0.00,31.12,3.00,10.37,1,0,3,4,1,1,0,2,5,164.44
2025-10-12,945efc92-6e78-49d9-bc21-8ef1d2471fc4,Ads - Caps <> Spice,sponsored listing,2025-09-19,None,Weekly,5000.00,USD,337ccf4e-d3be-4d44-8fea-6f7bb3304b89,All Customers - Afternoon,all,custom,MANUAL_SET_BIDDING,3.00,S Marion Road,1742411,2,1,23.66,3.00,-0.00,-0.00,23.66,3.00,7.89,0,0,1,1,0,0,0,0,1,23.66
2025-10-12,945efc92-6e78-49d9-bc21-8ef1d2471fc4,Ads - Caps <> Spice,sponsored listing,2025-09-19,None,Weekly,5000.00,USD,337ccf4e-d3be-4d44-8fea-6f7bb3304b89,All Customers - Afternoon,all,custom,MANUAL_SET_BIDDING,3.00,Blackstone-Fresno,24415716,0,0,0.00,0.00,-0.00,-0.00,0.00,0.00,0.00,0,0,0,0,0,0,0,0,0,0.00
2025-10-12,945efc92-6e78-49d9-bc21-8ef1d2471fc4,Ads - Caps <> Spice,sponsored listing,2025-09-19,None,Weekly,5000.00,USD,337ccf4e-d3be-4d44-8fea-6f7bb3304b89,All Customers - Afternoon,all,custom,MANUAL_SET_BIDDING,3.00,S Stanford Way,699470,3,1,19.19,3.00,-0.00,-0.00,19.19,3.00,6.40,1,0,0,1,1,0,0,1,1,19.19
2025-10-12,c15d8db7-7b8d-419b-aaf9-a7fe8914f715,Sponsored Listing 05/22/2025,sponsored listing,2025-05-22,None,Daily,1940.00,USD,7e1c2d6c-858c-47af-a75e-63f392710b94,,all,day,MANUAL_SET_BIDDING,5.00,Grand Ave-Portland,1370229,60,16,566.88,71.77,-0.00,-0.00,35.43,4.49,7.90,2,5,9,16,2,8,3,13,22,760.30
2025-10-12,945efc92-6e78-49d9-bc21-8ef1d2471fc4,Ads - Caps <> Spice,sponsored listing,2025-09-19,None,Weekly,5000.00,USD,97f406ae-2452-4364-9047-70a79ea745a1,All Customers - Afternoon,all,custom,MANUAL_SET_BIDDING,3.00,Northdale Blvd,24976449,0,0,0.00,0.00,-0.00,-0.00,0.00,0.00,0.00,0,0,0,0,0,0,0,0,1,36.25
2025-10-12,945efc92-6e78-49d9-bc21-8ef1d2471fc4,Ads - Caps <> Spice,sponsored listing,2025-09-19,None,Weekly,5000.00,USD,337ccf4e-d3be-4d44-8fea-6f7bb3304b89,All Customers - Afternoon,all,custom,MANUAL_SET_BIDDING,3.00,Townpark Lane,128721,7,2,39.85,6.00,-0.00,-0.00,19.93,3.00,6.64,1,0,1,2,1,0,0,1,3,60.23
2025-10-12,945efc92-6e78-49d9-bc21-8ef1d2471fc4,Ads - Caps <> Spice,sponsored listing,2025-09-19,None,Weekly,5000.00,USD,337ccf4e-d3be-4d44-8fea-6f7bb3304b89,All Customers - Afternoon,all,custom,MANUAL_SET_BIDDING,3.00,Kennett Square,575296,0,0,0.00,0.00,-0.00,-0.00,0.00,0.00,0.00,0,0,0,0,0,0,0,0,0,0.00
2025-10-12,945efc92-6e78-49d9-bc21-8ef1d2471fc4,Ads - Caps <> Spice,sponsored listing,2025-09-19,None,Weekly,5000.00,USD,337ccf4e-d3be-4d44-8fea-6f7bb3304b89,All Customers - Afternoon,all,custom,MANUAL_SET_BIDDING,3.00,North Boulder Hwy,75752,4,1,34.77,3.00,-0.00,-0.00,34.77,3.00,11.59,0,1,0,1,0,0,1,1,1,34.77
2025-10-12,945efc92-6e78-49d9-bc21-8ef1d2471fc4,Ads - Caps <> Spice,sponsored listing,2025-09-19,None,Weekly,5000.00,USD,97f406ae-2452-4364-9047-70a79ea745a1,All Customers - Afternoon,all,custom,MANUAL_SET_BIDDING,3.00,North Union St,575293,1,1,23.07,3.00,-0.00,-0.00,23.07,3.00,7.69,1,0,0,1,1,0,0,1,1,23.07
2025-10-12,945efc92-6e78-49d9-bc21-8ef1d2471fc4,Ads - Caps <> Spice,sponsored listing,2025-09-19,None,Weekly,5000.00,USD,337ccf4e-d3be-4d44-8fea-6f7bb3304b89,All Customers - Afternoon,all,custom,MANUAL_SET_BIDDING,3.00,Cheyenne and 215,388423,1,0,0.00,0.00,-0.00,-0.00,0.00,0.00,0.00,0,0,0,0,0,0,0,0,0,0.00
2025-10-12,945efc92-6e78-49d9-bc21-8ef1d2471fc4,Ads - Caps <> Spice,sponsored listing,2025-09-19,None,Weekly,5000.00,USD,9a6a8cb5-0536-4d63-ac59-bfcc3ec46632,Dinner – Lapsed Customers - 7:00 PM - 9:00 PM,existing,custom,MANUAL_SET_BIDDING,3.00,Raccoon Rd,26015022,0,0,0.00,0.00,-0.00,-0.00,0.00,0.00,0.00,0,0,0,0,0,0,0,0,0,0.00
2025-10-12,945efc92-6e78-49d9-bc21-8ef1d2471fc4,Ads - Caps <> Spice,sponsored listing,2025-09-19,None,Weekly,5000.00,USD,337ccf4e-d3be-4d44-8fea-6f7bb3304b89,All Customers - Afternoon,all,custom,MANUAL_SET_BIDDING,3.00,Sunset and Sandhill,32849799,1,0,0.00,0.00,-0.00,-0.00,0.00,0.00,0.00,0,0,0,0,0,0,0,0,0,0.00
2025-10-12,945efc92-6e78-49d9-bc21-8ef1d2471fc4,Ads - Caps <> Spice,sponsored listing,2025-09-19,None,Weekly,5000.00,USD,9a6a8cb5-0536-4d63-ac59-bfcc3ec46632,Dinner – Lapsed Customers - 7:00 PM - 9:00 PM,existing,custom,MANUAL_SET_BIDDING,3.00,1st Ave NE,23128705,0,0,0.00,0.00,-0.00,-0.00,0.00,0.00,0.00,0,0,0,0,0,0,0,0,0,0.00
2025-10-12,945efc92-6e78-49d9-bc21-8ef1d2471fc4,Ads - Caps <> Spice,sponsored listing,2025-09-19,None,Weekly,5000.00,USD,337ccf4e-d3be-4d44-8fea-6f7bb3304b89,All Customers - Afternoon,all,custom,MANUAL_SET_BIDDING,3.00,Lantana Drive,390888,4,2,82.85,6.00,-0.00,-0.00,41.43,3.00,13.81,0,0,2,2,0,1,0,1,5,135.10
2025-10-12,945efc92-6e78-49d9-bc21-8ef1d2471fc4,Ads - Caps <> Spice,sponsored listing,2025-09-19,None,Weekly,5000.00,USD,97f406ae-2452-4364-9047-70a79ea745a1,All Customers - Afternoon,all,custom,MANUAL_SET_BIDDING,3.00,Marlboro - Easton,674514,0,0,0.00,0.00,-0.00,-0.00,0.00,0.00,0.00,0,0,0,0,0,0,0,0,0,0.00
2025-10-12,945efc92-6e78-49d9-bc21-8ef1d2471fc4,Ads - Caps <> Spice,sponsored listing,2025-09-19,None,Weekly,5000.00,USD,337ccf4e-d3be-4d44-8fea-6f7bb3304b89,All Customers - Afternoon,all,custom,MANUAL_SET_BIDDING,3.00,Riverwind Dr,34516256,15,3,112.19,9.00,-0.00,-0.00,37.40,3.00,12.47,1,0,2,3,1,1,0,2,4,135.06
2025-10-12,945efc92-6e78-49d9-bc21-8ef1d2471fc4,Ads - Caps <> Spice,sponsored listing,2025-09-19,None,Weekly,5000.00,USD,337ccf4e-d3be-4d44-8fea-6f7bb3304b89,All Customers - Afternoon,all,custom,MANUAL_SET_BIDDING,3.00,"Lewes, DE",34776698,8,5,168.22,15.00,-0.00,-0.00,33.64,3.00,11.21,2,0,3,5,1,1,0,2,6,185.81
2025-10-12,945efc92-6e78-49d9-bc21-8ef1d2471fc4,Ads - Caps <> Spice,sponsored listing,2025-09-19,None,Weekly,5000.00,USD,337ccf4e-d3be-4d44-8fea-6f7bb3304b89,All Customers - Afternoon,all,custom,MANUAL_SET_BIDDING,3.00,NE Cookingham Dr,23035356,0,0,0.00,0.00,-0.00,-0.00,0.00,0.00,0.00,0,0,0,0,0,0,0,0,0,0.00
2025-10-12,fb1dc19a-54a2-4b2e-a32d-67dcf67e36e8,Sponsored Listing 06/03/2025,sponsored listing,2025-06-03,None,Daily,30.00,USD,323457b9-a9c9-4aab-bceb-0d4ff7d7148b,,all,day,AUTOMATED_BIDDING,,Hamilton Blvd,23066760,17,8,427.59,37.54,-0.00,-0.00,53.45,4.69,11.39,3,1,4,8,1,3,0,4,8,427.59
2025-10-12,945efc92-6e78-49d9-bc21-8ef1d2471fc4,Ads - Caps <> Spice,sponsored listing,2025-09-19,None,Weekly,5000.00,USD,97f406ae-2452-4364-9047-70a79ea745a1,All Customers - Afternoon,all,custom,MANUAL_SET_BIDDING,3.00,Catclaw - Abilene,29652227,0,0,0.00,0.00,-0.00,-0.00,0.00,0.00,0.00,0,0,0,0,0,0,0,0,0,0.00
2025-10-12,945efc92-6e78-49d9-bc21-8ef1d2471fc4,Ads - Caps <> Spice,sponsored listing,2025-09-19,None,Weekly,5000.00,USD,337ccf4e-d3be-4d44-8fea-6f7bb3304b89,All Customers - Afternoon,all,custom,MANUAL_SET_BIDDING,3.00,South Rainbow,75732,6,3,83.02,9.00,-0.00,-0.00,27.67,3.00,9.22,0,0,3,3,0,3,0,3,3,83.02
2025-10-12,05936896-70c3-4ae3-89a7-df171cfcf211,Sponsored Listing 06/02/2025,sponsored listing,2025-06-02,None,Daily,67.86,USD,235364da-d1a8-46c8-bec8-af6931ad9b6f,,new,day,AUTOMATED_BIDDING,,West Fullerton Ave,23349403,76,1,60.24,11.76,-0.00,-0.00,60.24,11.76,5.12,1,0,0,1,1,0,0,1,1,60.24
2025-10-12,945efc92-6e78-49d9-bc21-8ef1d2471fc4,Ads - Caps <> Spice,sponsored listing,2025-09-19,None,Weekly,5000.00,USD,337ccf4e-d3be-4d44-8fea-6f7bb3304b89,All Customers - Afternoon,all,custom,MANUAL_SET_BIDDING,3.00,Horizon Ridge,75753,0,0,0.00,0.00,-0.00,-0.00,0.00,0.00,0.00,0,0,0,0,0,0,0,0,0,0.00
2025-10-12,945efc92-6e78-49d9-bc21-8ef1d2471fc4,Ads - Caps <> Spice,sponsored listing,2025-09-19,None,Weekly,5000.00,USD,337ccf4e-d3be-4d44-8fea-6f7bb3304b89,All Customers - Afternoon,all,custom,MANUAL_SET_BIDDING,3.00,Highbrook Way,33551695,9,1,14.18,3.00,-0.00,-0.00,14.18,3.00,4.73,0,0,1,1,0,0,0,0,3,39.05
2025-10-12,945efc92-6e78-49d9-bc21-8ef1d2471fc4,Ads - Caps <> Spice,sponsored listing,2025-09-19,None,Weekly,5000.00,USD,97f406ae-2452-4364-9047-70a79ea745a1,All Customers - Afternoon,all,custom,MANUAL_SET_BIDDING,3.00,Interquest Parkway,27558470,0,0,0.00,0.00,-0.00,-0.00,0.00,0.00,0.00,0,0,0,0,0,0,0,0,0,0.00
2025-10-12,945efc92-6e78-49d9-bc21-8ef1d2471fc4,Ads - Caps <> Spice,sponsored listing,2025-09-19,None,Weekly,5000.00,USD,9a6a8cb5-0536-4d63-ac59-bfcc3ec46632,Dinner – Lapsed Customers - 7:00 PM - 9:00 PM,existing,custom,MANUAL_SET_BIDDING,3.00,Roby Dr - Hammond,24891803,0,0,0.00,0.00,-0.00,-0.00,0.00,0.00,0.00,0,0,0,0,0,0,0,0,0,0.00
2025-10-12,919bb82c-6d8a-4a5c-80c5-10e762b6d9f6,Sponsored Listing 04/07/2025,sponsored listing,2025-04-07,None,Daily,34.00,USD,7399c4cb-685f-4888-8de4-e5a0a68094f2,,all,day,AUTOMATED_BIDDING,,East Market Street,23256727,20,5,157.84,21.42,-0.00,-0.00,31.57,4.28,7.37,0,0,5,5,0,5,0,5,7,251.77
2025-10-12,945efc92-6e78-49d9-bc21-8ef1d2471fc4,Ads - Caps <> Spice,sponsored listing,2025-09-19,None,Weekly,5000.00,USD,337ccf4e-d3be-4d44-8fea-6f7bb3304b89,All Customers - Afternoon,all,custom,MANUAL_SET_BIDDING,3.00,De Soto-Chatsworth,651597,2,0,0.00,0.00,-0.00,-0.00,0.00,0.00,0.00,0,0,0,0,0,0,0,0,1,16.06
2025-10-12,945efc92-6e78-49d9-bc21-8ef1d2471fc4,Ads - Caps <> Spice,sponsored listing,2025-09-19,None,Weekly,5000.00,USD,337ccf4e-d3be-4d44-8fea-6f7bb3304b89,All Customers - Afternoon,all,custom,MANUAL_SET_BIDDING,3.00,Bel Air,23733193,6,3,120.07,9.00,-0.00,-0.00,40.02,3.00,13.34,2,1,0,3,1,0,1,2,4,177.03
2025-10-12,945efc92-6e78-49d9-bc21-8ef1d2471fc4,Ads - Caps <> Spice,sponsored listing,2025-09-19,None,Weekly,5000.00,USD,337ccf4e-d3be-4d44-8fea-6f7bb3304b89,All Customers - Afternoon,all,custom,MANUAL_SET_BIDDING,3.00,West Sahara Avenue,424852,3,3,74.75,9.00,-0.00,-0.00,24.92,3.00,8.31,0,0,3,3,0,2,0,2,3,80.86
2025-10-12,945efc92-6e78-49d9-bc21-8ef1d2471fc4,Ads - Caps <> Spice,sponsored listing,2025-09-19,None,Weekly,5000.00,USD,97f406ae-2452-4364-9047-70a79ea745a1,All Customers - Afternoon,all,custom,MANUAL_SET_BIDDING,3.00,17th St Ammon,24968543,0,0,0.00,0.00,-0.00,-0.00,0.00,0.00,0.00,0,0,0,0,0,0,0,0,0,0.00
2025-10-12,945efc92-6e78-49d9-bc21-8ef1d2471fc4,Ads - Caps <> Spice,sponsored listing,2025-09-19,None,Weekly,5000.00,USD,337ccf4e-d3be-4d44-8fea-6f7bb3304b89,All Customers - Afternoon,all,custom,MANUAL_SET_BIDDING,3.00,Olympia Ave-Tulsa,24892240,13,2,63.05,6.00,-0.00,-0.00,31.53,3.00,10.51,1,0,1,2,1,1,0,2,1,38.37
2025-10-12,bbcf360b-6c91-4d94-811d-aacfcdbaf5bf,ads mid sept- Nov 27,sponsored listing,2025-09-22,2025-11-28,Daily,14.00,USD,ffbbcc90-0169-4c2a-92b8-c3a797b17a07,,all,day,AUTOMATED_BIDDING,,University Dr,29894178,10,4,102.68,16.15,-0.00,-0.00,25.67,4.04,6.36,1,1,2,4,1,2,1,4,5,135.66
2025-10-12,945efc92-6e78-49d9-bc21-8ef1d2471fc4,Ads - Caps <> Spice,sponsored listing,2025-09-19,None,Weekly,5000.00,USD,97f406ae-2452-4364-9047-70a79ea745a1,All Customers - Afternoon,all,custom,MANUAL_SET_BIDDING,3.00,S Fort Apache,75730,0,0,0.00,0.00,-0.00,-0.00,0.00,0.00,0.00,0,0,0,0,0,0,0,0,0,0.00
2025-10-12,945efc92-6e78-49d9-bc21-8ef1d2471fc4,Ads - Caps <> Spice,sponsored listing,2025-09-19,None,Weekly,5000.00,USD,97f406ae-2452-4364-9047-70a79ea745a1,All Customers - Afternoon,all,custom,MANUAL_SET_BIDDING,3.00,Paradise Road,75734,2,2,49.75,6.00,-0.00,-0.00,24.88,3.00,8.29,0,0,2,2,0,1,0,1,2,49.75
2025-10-12,945efc92-6e78-49d9-bc21-8ef1d2471fc4,Ads - Caps <> Spice,sponsored listing,2025-09-19,None,Weekly,5000.00,USD,337ccf4e-d3be-4d44-8fea-6f7bb3304b89,All Customers - Afternoon,all,custom,MANUAL_SET_BIDDING,3.00,Mountain View,2608887,5,1,43.96,3.00,-0.00,-0.00,43.96,3.00,14.65,1,0,0,1,1,0,0,1,3,100.70
2025-10-12,945efc92-6e78-49d9-bc21-8ef1d2471fc4,Ads - Caps <> Spice,sponsored listing,2025-09-19,None,Weekly,5000.00,USD,337ccf4e-d3be-4d44-8fea-6f7bb3304b89,All Customers - Afternoon,all,custom,MANUAL_SET_BIDDING,3.00,Northdale Blvd,24976449,5,1,15.48,3.00,-0.00,-0.00,15.48,3.00,5.16,0,0,1,1,0,0,0,0,2,62.23
2025-10-12,945efc92-6e78-49d9-bc21-8ef1d2471fc4,Ads - Caps <> Spice,sponsored listing,2025-09-19,None,Weekly,5000.00,USD,337ccf4e-d3be-4d44-8fea-6f7bb3304b89,All Customers - Afternoon,all,custom,MANUAL_SET_BIDDING,3.00,West Flamingo Road,75731,2,0,0.00,0.00,-0.00,-0.00,0.00,0.00,0.00,0,0,0,0,0,0,0,0,1,53.35
2025-10-12,945efc92-6e78-49d9-bc21-8ef1d2471fc4,Ads - Caps <> Spice,sponsored listing,2025-09-19,None,Weekly,5000.00,USD,337ccf4e-d3be-4d44-8fea-6f7bb3304b89,All Customers - Afternoon,all,custom,MANUAL_SET_BIDDING,3.00,Bridge St,35060561,1,1,41.97,3.00,-0.00,-0.00,41.97,3.00,13.99,1,0,0,1,0,0,0,0,4,127.58
2025-10-12,945efc92-6e78-49d9-bc21-8ef1d2471fc4,Ads - Caps <> Spice,sponsored listing,2025-09-19,None,Weekly,5000.00,USD,337ccf4e-d3be-4d44-8fea-6f7bb3304b89,All Customers - Afternoon,all,custom,MANUAL_SET_BIDDING,3.00,Zionsville,24415273,6,3,87.00,9.00,-0.00,-0.00,29.00,3.00,9.67,0,0,3,3,0,3,0,3,4,123.37
2025-10-12,945efc92-6e78-49d9-bc21-8ef1d2471fc4,Ads - Caps <> Spice,sponsored listing,2025-09-19,None,Weekly,5000.00,USD,9a6a8cb5-0536-4d63-ac59-bfcc3ec46632,Dinner – Lapsed Customers - 7:00 PM - 9:00 PM,existing,custom,MANUAL_SET_BIDDING,3.00,Whitesburg Dr (Medical District),34051357,0,0,0.00,0.00,-0.00,-0.00,0.00,0.00,0.00,0,0,0,0,0,0,0,0,0,0.00
2025-10-12,945efc92-6e78-49d9-bc21-8ef1d2471fc4,Ads - Caps <> Spice,sponsored listing,2025-09-19,None,Weekly,5000.00,USD,337ccf4e-d3be-4d44-8fea-6f7bb3304b89,All Customers - Afternoon,all,custom,MANUAL_SET_BIDDING,3.00,Aliante Casino,75725,2,1,53.46,3.00,-0.00,-0.00,53.46,3.00,17.82,0,0,1,1,0,1,0,1,2,145.56
2025-10-12,945efc92-6e78-49d9-bc21-8ef1d2471fc4,Ads - Caps <> Spice,sponsored listing,2025-09-19,None,Weekly,5000.00,USD,337ccf4e-d3be-4d44-8fea-6f7bb3304b89,All Customers - Afternoon,all,custom,MANUAL_SET_BIDDING,3.00,Murrieta Hot Springs Rd,29652192,4,1,25.47,3.00,-0.00,-0.00,25.47,3.00,8.49,0,0,1,1,0,1,0,1,2,57.96
2025-10-12,945efc92-6e78-49d9-bc21-8ef1d2471fc4,Ads - Caps <> Spice,sponsored listing,2025-09-19,None,Weekly,5000.00,USD,97f406ae-2452-4364-9047-70a79ea745a1,All Customers - Afternoon,all,custom,MANUAL_SET_BIDDING,3.00,Kirkwood Hwy,390889,0,0,0.00,0.00,-0.00,-0.00,0.00,0.00,0.00,0,0,0,0,0,0,0,0,0,0.00
2025-10-12,945efc92-6e78-49d9-bc21-8ef1d2471fc4,Ads - Caps <> Spice,sponsored listing,2025-09-19,None,Weekly,5000.00,USD,97f406ae-2452-4364-9047-70a79ea745a1,All Customers - Afternoon,all,custom,MANUAL_SET_BIDDING,3.00,South Rainbow,75732,0,0,0.00,0.00,-0.00,-0.00,0.00,0.00,0.00,0,0,0,0,0,0,0,0,0,0.00
2025-10-12,945efc92-6e78-49d9-bc21-8ef1d2471fc4,Ads - Caps <> Spice,sponsored listing,2025-09-19,None,Weekly,5000.00,USD,337ccf4e-d3be-4d44-8fea-6f7bb3304b89,All Customers - Afternoon,all,custom,MANUAL_SET_BIDDING,3.00,North Town Center,75721,1,1,54.57,3.00,-0.00,-0.00,54.57,3.00,18.19,0,0,1,1,0,0,0,0,1,54.57
2025-10-12,bc5ef595-7f63-4973-b895-94a51a6e7f56,Sponsored Listing 10/12/2025,sponsored listing,2025-10-12,None,Daily,74.00,USD,bb4a7e20-27f1-493d-8ece-3a8c8ef92fa8,,all,day,AUTOMATED_BIDDING,,Niles Cortland Rd SE,34043935,16,8,213.79,40.48,-0.00,-0.00,26.72,5.06,5.28,4,0,4,8,4,4,0,8,8,213.79
2025-10-12,945efc92-6e78-49d9-bc21-8ef1d2471fc4,Ads - Caps <> Spice,sponsored listing,2025-09-19,None,Weekly,5000.00,USD,97f406ae-2452-4364-9047-70a79ea745a1,All Customers - Afternoon,all,custom,MANUAL_SET_BIDDING,3.00,1st Ave NE,23128705,0,0,0.00,0.00,-0.00,-0.00,0.00,0.00,0.00,0,0,0,0,0,0,0,0,0,0.00
2025-10-12,945efc92-6e78-49d9-bc21-8ef1d2471fc4,Ads - Caps <> Spice,sponsored listing,2025-09-19,None,Weekly,5000.00,USD,337ccf4e-d3be-4d44-8fea-6f7bb3304b89,All Customers - Afternoon,all,custom,MANUAL_SET_BIDDING,3.00,Stephanie St,75751,1,1,31.86,3.00,-0.00,-0.00,31.86,3.00,10.62,0,0,1,1,0,1,0,1,2,60.04
2025-10-12,9f19b533-0013-45a4-83ab-3447aa7b4b49,Sponsored Listing 01/24/2025,sponsored listing,2025-01-24,None,Daily,28.00,USD,c3d89dcc-cddb-4139-835e-8ad7d0cbc26d,,new,day,AUTOMATED_BIDDING,,N 87th Street,27965,1,0,0.00,0.00,-0.00,-0.00,0.00,0.00,0.00,0,0,0,0,0,0,0,0,0,0.00
2025-10-12,945efc92-6e78-49d9-bc21-8ef1d2471fc4,Ads - Caps <> Spice,sponsored listing,2025-09-19,None,Weekly,5000.00,USD,97f406ae-2452-4364-9047-70a79ea745a1,All Customers - Afternoon,all,custom,MANUAL_SET_BIDDING,3.00,West Avera Dr,1742446,0,0,0.00,0.00,-0.00,-0.00,0.00,0.00,0.00,0,0,0,0,0,0,0,0,0,0.00
2025-10-12,945efc92-6e78-49d9-bc21-8ef1d2471fc4,Ads - Caps <> Spice,sponsored listing,2025-09-19,None,Weekly,5000.00,USD,97f406ae-2452-4364-9047-70a79ea745a1,All Customers - Afternoon,all,custom,MANUAL_SET_BIDDING,3.00,Park Road Center,27677423,0,0,0.00,0.00,-0.00,-0.00,0.00,0.00,0.00,0,0,0,0,0,0,0,0,0,0.00
2025-10-12,945efc92-6e78-49d9-bc21-8ef1d2471fc4,Ads - Caps <> Spice,sponsored listing,2025-09-19,None,Weekly,5000.00,USD,97f406ae-2452-4364-9047-70a79ea745a1,All Customers - Afternoon,all,custom,MANUAL_SET_BIDDING,3.00,Cranberry Township,24851842,0,0,0.00,0.00,-0.00,-0.00,0.00,0.00,0.00,0,0,0,0,0,0,0,0,0,0.00
2025-10-12,945efc92-6e78-49d9-bc21-8ef1d2471fc4,Ads - Caps <> Spice,sponsored listing,2025-09-19,None,Weekly,5000.00,USD,337ccf4e-d3be-4d44-8fea-6f7bb3304b89,All Customers - Afternoon,all,custom,MANUAL_SET_BIDDING,3.00,East Market Street,23256727,2,0,0.00,0.00,-0.00,-0.00,0.00,0.00,0.00,0,0,0,0,0,0,0,0,0,0.00
2025-10-12,945efc92-6e78-49d9-bc21-8ef1d2471fc4,Ads - Caps <> Spice,sponsored listing,2025-09-19,None,Weekly,5000.00,USD,337ccf4e-d3be-4d44-8fea-6f7bb3304b89,All Customers - Afternoon,all,custom,MANUAL_SET_BIDDING,3.00,Concord Pike,23151390,4,4,135.81,12.00,-0.00,-0.00,33.95,3.00,11.32,2,0,2,4,0,2,0,2,4,135.81
2025-10-12,eafccee4-8165-4152-bbdb-ba84b5ef5c9e,Sponsored Listing 04/25/2025,sponsored listing,2025-04-25,None,Daily,75.00,USD,1d7b1dac-b745-4b72-a4bc-2193251b4825,,all,day,AUTOMATED_BIDDING,,Chicago River West,34048823,1,1,90.34,9.60,-0.00,-0.00,90.34,9.60,9.41,0,0,1,1,0,1,0,1,1,90.34
2025-10-12,0ec9dc7d-17c1-42bf-b8e1-01d8028c77ba,Sponsored Listing 09/22/2025,sponsored listing,2025-09-22,None,Daily,22.00,USD,ba58b73a-3362-43fb-8aab-dea31bb7c814,,all,day,AUTOMATED_BIDDING,,Frisco,34516355,22,6,154.59,32.35,-0.00,-0.00,25.77,5.39,4.78,1,3,2,6,1,2,3,6,8,223.02
2025-10-12,945efc92-6e78-49d9-bc21-8ef1d2471fc4,Ads - Caps <> Spice,sponsored listing,2025-09-19,None,Weekly,5000.00,USD,337ccf4e-d3be-4d44-8fea-6f7bb3304b89,All Customers - Afternoon,all,custom,MANUAL_SET_BIDDING,3.00,San Luis Obispo,23900701,7,2,81.42,6.00,-0.00,-0.00,40.71,3.00,13.57,0,0,2,2,0,2,0,2,2,81.42
2025-10-12,945efc92-6e78-49d9-bc21-8ef1d2471fc4,Ads - Caps <> Spice,sponsored listing,2025-09-19,None,Weekly,5000.00,USD,337ccf4e-d3be-4d44-8fea-6f7bb3304b89,All Customers - Afternoon,all,custom,MANUAL_SET_BIDDING,3.00,South State Rd,1713806,3,2,44.37,6.00,-0.00,-0.00,22.19,3.00,7.40,1,0,1,2,0,1,0,1,3,61.15
2025-10-12,945efc92-6e78-49d9-bc21-8ef1d2471fc4,Ads - Caps <> Spice,sponsored listing,2025-09-19,None,Weekly,5000.00,USD,97f406ae-2452-4364-9047-70a79ea745a1,All Customers - Afternoon,all,custom,MANUAL_SET_BIDDING,3.00,Palm Ave - Fresno,1581092,0,0,0.00,0.00,-0.00,-0.00,0.00,0.00,0.00,0,0,0,0,0,0,0,0,0,0.00
2025-10-12,945efc92-6e78-49d9-bc21-8ef1d2471fc4,Ads - Caps <> Spice,sponsored listing,2025-09-19,None,Weekly,5000.00,USD,9a6a8cb5-0536-4d63-ac59-bfcc3ec46632,Dinner – Lapsed Customers - 7:00 PM - 9:00 PM,existing,custom,MANUAL_SET_BIDDING,3.00,Elm St,34052609,0,0,0.00,0.00,-0.00,-0.00,0.00,0.00,0.00,0,0,0,0,0,0,0,0,0,0.00
2025-10-12,945efc92-6e78-49d9-bc21-8ef1d2471fc4,Ads - Caps <> Spice,sponsored listing,2025-09-19,None,Weekly,5000.00,USD,337ccf4e-d3be-4d44-8fea-6f7bb3304b89,All Customers - Afternoon,all,custom,MANUAL_SET_BIDDING,3.00,State and 6100 S,2608908,8,4,153.45,12.00,-0.00,-0.00,38.36,3.00,12.79,1,0,3,4,0,3,0,3,7,279.90
2025-10-12,945efc92-6e78-49d9-bc21-8ef1d2471fc4,Ads - Caps <> Spice,sponsored listing,2025-09-19,None,Weekly,5000.00,USD,9a6a8cb5-0536-4d63-ac59-bfcc3ec46632,Dinner – Lapsed Customers - 7:00 PM - 9:00 PM,existing,custom,MANUAL_SET_BIDDING,3.00,Zionsville,24415273,0,0,0.00,0.00,-0.00,-0.00,0.00,0.00,0.00,0,0,0,0,0,0,0,0,0,0.00
2025-10-12,eafccee4-8165-4152-bbdb-ba84b5ef5c9e,Sponsored Listing 04/25/2025,sponsored listing,2025-04-25,None,Daily,75.00,USD,1d7b1dac-b745-4b72-a4bc-2193251b4825,,all,day,AUTOMATED_BIDDING,,West Fullerton Ave,23349403,1,0,0.00,0.00,-0.00,-0.00,0.00,0.00,0.00,0,0,0,0,0,0,0,0,0,0.00
2025-10-12,945efc92-6e78-49d9-bc21-8ef1d2471fc4,Ads - Caps <> Spice,sponsored listing,2025-09-19,None,Weekly,5000.00,USD,97f406ae-2452-4364-9047-70a79ea745a1,All Customers - Afternoon,all,custom,MANUAL_SET_BIDDING,3.00,Barnes Road,24892677,0,0,0.00,0.00,-0.00,-0.00,0.00,0.00,0.00,0,0,0,0,0,0,0,0,0,0.00
2025-10-12,945efc92-6e78-49d9-bc21-8ef1d2471fc4,Ads - Caps <> Spice,sponsored listing,2025-09-19,None,Weekly,5000.00,USD,337ccf4e-d3be-4d44-8fea-6f7bb3304b89,All Customers - Afternoon,all,custom,MANUAL_SET_BIDDING,3.00,Red Cliff Dr,578425,3,2,45.68,6.00,-0.00,-0.00,22.84,3.00,7.61,0,0,2,2,0,1,0,1,3,74.53
2025-10-12,945efc92-6e78-49d9-bc21-8ef1d2471fc4,Ads - Caps <> Spice,sponsored listing,2025-09-19,None,Weekly,5000.00,USD,337ccf4e-d3be-4d44-8fea-6f7bb3304b89,All Customers - Afternoon,all,custom,MANUAL_SET_BIDDING,3.00,West Avera Dr,1742446,3,1,17.28,3.00,-0.00,-0.00,17.28,3.00,5.76,1,0,0,1,0,0,0,0,2,40.66
2025-10-12,945efc92-6e78-49d9-bc21-8ef1d2471fc4,Ads - Caps <> Spice,sponsored listing,2025-09-19,None,Weekly,5000.00,USD,337ccf4e-d3be-4d44-8fea-6f7bb3304b89,All Customers - Afternoon,all,custom,MANUAL_SET_BIDDING,3.00,West Azure,75724,1,1,29.98,3.00,-0.00,-0.00,29.98,3.00,9.99,1,0,0,1,0,0,0,0,1,29.98
2025-10-12,4861a65d-f77d-4020-ae87-7e098bbb5440,Mid Sep-November boost,sponsored listing,2025-09-22,None,Daily,14.00,USD,1698db27-cd94-4608-922e-6f562c3760f5,,all,day,AUTOMATED_BIDDING,,International Pkwy,24671402,12,2,39.76,10.22,-0.00,-0.00,19.88,5.11,3.89,1,0,1,2,1,0,0,1,5,147.17
2025-10-12,945efc92-6e78-49d9-bc21-8ef1d2471fc4,Ads - Caps <> Spice,sponsored listing,2025-09-19,None,Weekly,5000.00,USD,97f406ae-2452-4364-9047-70a79ea745a1,All Customers - Afternoon,all,custom,MANUAL_SET_BIDDING,3.00,South  Walton Blvd,1616214,0,0,0.00,0.00,-0.00,-0.00,0.00,0.00,0.00,0,0,0,0,0,0,0,0,0,0.00
2025-10-12,945efc92-6e78-49d9-bc21-8ef1d2471fc4,Ads - Caps <> Spice,sponsored listing,2025-09-19,None,Weekly,5000.00,USD,337ccf4e-d3be-4d44-8fea-6f7bb3304b89,All Customers - Afternoon,all,custom,MANUAL_SET_BIDDING,3.00,Main Street - Anoka,34494893,7,3,90.88,9.00,-0.00,-0.00,30.29,3.00,10.10,0,0,3,3,0,2,0,2,4,118.45
2025-10-12,945efc92-6e78-49d9-bc21-8ef1d2471fc4,Ads - Caps <> Spice,sponsored listing,2025-09-19,None,Weekly,5000.00,USD,97f406ae-2452-4364-9047-70a79ea745a1,All Customers - Afternoon,all,custom,MANUAL_SET_BIDDING,3.00,"Capriotti's of Milford, LLC",1636430,0,0,0.00,0.00,-0.00,-0.00,0.00,0.00,0.00,0,0,0,0,0,0,0,0,0,0.00
2025-10-12,945efc92-6e78-49d9-bc21-8ef1d2471fc4,Ads - Caps <> Spice,sponsored listing,2025-09-19,None,Weekly,5000.00,USD,337ccf4e-d3be-4d44-8fea-6f7bb3304b89,All Customers - Afternoon,all,custom,MANUAL_SET_BIDDING,3.00,West Basin Rd,575301,9,3,62.37,9.00,-0.00,-0.00,20.79,3.00,6.93,1,0,2,3,1,1,0,2,3,62.37
2025-10-12,945efc92-6e78-49d9-bc21-8ef1d2471fc4,Ads - Caps <> Spice,sponsored listing,2025-09-19,None,Weekly,5000.00,USD,337ccf4e-d3be-4d44-8fea-6f7bb3304b89,All Customers - Afternoon,all,custom,MANUAL_SET_BIDDING,3.00,E Robindale Road,27815740,0,0,0.00,0.00,-0.00,-0.00,0.00,0.00,0.00,0,0,0,0,0,0,0,0,0,0.00
2025-10-12,945efc92-6e78-49d9-bc21-8ef1d2471fc4,Ads - Caps <> Spice,sponsored listing,2025-09-19,None,Weekly,5000.00,USD,337ccf4e-d3be-4d44-8fea-6f7bb3304b89,All Customers - Afternoon,all,custom,MANUAL_SET_BIDDING,3.00,Raccoon Rd,26015022,14,6,191.02,18.00,-0.00,-0.00,31.84,3.00,10.61,2,0,4,6,1,3,0,4,10,365.05
2025-10-12,945efc92-6e78-49d9-bc21-8ef1d2471fc4,Ads - Caps <> Spice,sponsored listing,2025-09-19,None,Weekly,5000.00,USD,337ccf4e-d3be-4d44-8fea-6f7bb3304b89,All Customers - Afternoon,all,custom,MANUAL_SET_BIDDING,3.00,Palm Ave - Fresno,1581092,6,1,39.57,3.00,-0.00,-0.00,39.57,3.00,13.19,1,0,0,1,1,0,0,1,2,100.72
2025-10-12,945efc92-6e78-49d9-bc21-8ef1d2471fc4,Ads - Caps <> Spice,sponsored listing,2025-09-19,None,Weekly,5000.00,USD,337ccf4e-d3be-4d44-8fea-6f7bb3304b89,All Customers - Afternoon,all,custom,MANUAL_SET_BIDDING,3.00,East 82nd St,184537,6,1,29.98,3.00,-0.00,-0.00,29.98,3.00,9.99,1,0,0,1,0,0,0,0,5,105.30
2025-10-12,d83b375e-0c3f-465d-ae9d-ed90c7b4c32b,Sponsored Listing 01/10/2025,sponsored listing,2025-01-10,None,Daily,27.00,USD,3b5f84b8-ca79-434b-a97d-7675273a1095,,new,day,AUTOMATED_BIDDING,,"Capriotti's of Milford, LLC",1636430,8,0,0.00,0.00,-0.00,-0.00,0.00,0.00,0.00,0,0,0,0,0,0,0,0,0,0.00
2025-10-12,945efc92-6e78-49d9-bc21-8ef1d2471fc4,Ads - Caps <> Spice,sponsored listing,2025-09-19,None,Weekly,5000.00,USD,97f406ae-2452-4364-9047-70a79ea745a1,All Customers - Afternoon,all,custom,MANUAL_SET_BIDDING,3.00,Ogletown Stanton,422117,0,0,0.00,0.00,-0.00,-0.00,0.00,0.00,0.00,0,0,0,0,0,0,0,0,0,0.00
2025-10-12,945efc92-6e78-49d9-bc21-8ef1d2471fc4,Ads - Caps <> Spice,sponsored listing,2025-09-19,None,Weekly,5000.00,USD,337ccf4e-d3be-4d44-8fea-6f7bb3304b89,All Customers - Afternoon,all,custom,MANUAL_SET_BIDDING,3.00,Cranberry Township,24851842,5,1,37.97,3.00,-0.00,-0.00,37.97,3.00,12.66,0,0,1,1,0,1,0,1,1,13.39
2025-10-12,945efc92-6e78-49d9-bc21-8ef1d2471fc4,Ads - Caps <> Spice,sponsored listing,2025-09-19,None,Weekly,5000.00,USD,337ccf4e-d3be-4d44-8fea-6f7bb3304b89,All Customers - Afternoon,all,custom,MANUAL_SET_BIDDING,3.00,Dana Park - Mesa,126177,10,3,127.63,9.00,-0.00,-0.00,42.54,3.00,14.18,0,2,1,3,0,1,2,3,4,168.09
2025-10-12,945efc92-6e78-49d9-bc21-8ef1d2471fc4,Ads - Caps <> Spice,sponsored listing,2025-09-19,None,Weekly,5000.00,USD,337ccf4e-d3be-4d44-8fea-6f7bb3304b89,All Customers - Afternoon,all,custom,MANUAL_SET_BIDDING,3.00,Jennersville Rd,433075,5,1,15.59,3.00,-0.00,-0.00,15.59,3.00,5.20,0,0,1,1,0,1,0,1,2,28.78
2025-10-12,945efc92-6e78-49d9-bc21-8ef1d2471fc4,Ads - Caps <> Spice,sponsored listing,2025-09-19,None,Weekly,5000.00,USD,337ccf4e-d3be-4d44-8fea-6f7bb3304b89,All Customers - Afternoon,all,custom,MANUAL_SET_BIDDING,3.00,Sahara & Las Vegas,75735,1,1,47.97,3.00,-0.00,-0.00,47.97,3.00,15.99,1,0,0,1,1,0,0,1,1,47.97
2025-10-12,945efc92-6e78-49d9-bc21-8ef1d2471fc4,Ads - Caps <> Spice,sponsored listing,2025-09-19,None,Weekly,5000.00,USD,337ccf4e-d3be-4d44-8fea-6f7bb3304b89,All Customers - Afternoon,all,custom,MANUAL_SET_BIDDING,3.00,Highlands Ranch,1791292,1,0,0.00,0.00,-0.00,-0.00,0.00,0.00,0.00,0,0,0,0,0,0,0,0,0,0.00
2025-10-12,945efc92-6e78-49d9-bc21-8ef1d2471fc4,Ads - Caps <> Spice,sponsored listing,2025-09-19,None,Weekly,5000.00,USD,337ccf4e-d3be-4d44-8fea-6f7bb3304b89,All Customers - Afternoon,all,custom,MANUAL_SET_BIDDING,3.00,West Glenwood Ave,575295,14,5,202.47,15.00,-0.00,-0.00,40.49,3.00,13.50,1,1,3,5,1,2,1,4,6,216.86
2025-10-12,945efc92-6e78-49d9-bc21-8ef1d2471fc4,Ads - Caps <> Spice,sponsored listing,2025-09-19,None,Weekly,5000.00,USD,97f406ae-2452-4364-9047-70a79ea745a1,All Customers - Afternoon,all,custom,MANUAL_SET_BIDDING,3.00,Aliante Casino,75725,1,0,0.00,0.00,-0.00,-0.00,0.00,0.00,0.00,0,0,0,0,0,0,0,0,0,0.00
2025-10-12,945efc92-6e78-49d9-bc21-8ef1d2471fc4,Ads - Caps <> Spice,sponsored listing,2025-09-19,None,Weekly,5000.00,USD,97f406ae-2452-4364-9047-70a79ea745a1,All Customers - Afternoon,all,custom,MANUAL_SET_BIDDING,3.00,Post Falls,34326515,0,0,0.00,0.00,-0.00,-0.00,0.00,0.00,0.00,0,0,0,0,0,0,0,0,0,0.00
2025-10-12,945efc92-6e78-49d9-bc21-8ef1d2471fc4,Ads - Caps <> Spice,sponsored listing,2025-09-19,None,Weekly,5000.00,USD,337ccf4e-d3be-4d44-8fea-6f7bb3304b89,All Customers - Afternoon,all,custom,MANUAL_SET_BIDDING,3.00,Nature Park Drive,75726,0,0,0.00,0.00,-0.00,-0.00,0.00,0.00,0.00,0,0,0,0,0,0,0,0,0,0.00
2025-10-12,945efc92-6e78-49d9-bc21-8ef1d2471fc4,Ads - Caps <> Spice,sponsored listing,2025-09-19,None,Weekly,5000.00,USD,337ccf4e-d3be-4d44-8fea-6f7bb3304b89,All Customers - Afternoon,all,custom,MANUAL_SET_BIDDING,3.00,E 53rd - Davenport,582282,9,4,163.78,12.00,-0.00,-0.00,40.95,3.00,13.65,0,1,3,4,0,3,1,4,7,227.11
2025-10-12,945efc92-6e78-49d9-bc21-8ef1d2471fc4,Ads - Caps <> Spice,sponsored listing,2025-09-19,None,Weekly,5000.00,USD,337ccf4e-d3be-4d44-8fea-6f7bb3304b89,All Customers - Afternoon,all,custom,MANUAL_SET_BIDDING,3.00,East Sepulveda,1743753,3,1,34.18,3.00,-0.00,-0.00,34.18,3.00,11.39,0,0,1,1,0,1,0,1,4,130.53
2025-10-12,945efc92-6e78-49d9-bc21-8ef1d2471fc4,Ads - Caps <> Spice,sponsored listing,2025-09-19,None,Weekly,5000.00,USD,337ccf4e-d3be-4d44-8fea-6f7bb3304b89,All Customers - Afternoon,all,custom,MANUAL_SET_BIDDING,3.00,College Station,23349412,3,1,16.00,3.00,-0.00,-0.00,16.00,3.00,5.33,0,0,1,1,0,0,0,0,1,16.00
2025-10-12,9f19b533-0013-45a4-83ab-3447aa7b4b49,Sponsored Listing 01/24/2025,sponsored listing,2025-01-24,None,Daily,28.00,USD,c3d89dcc-cddb-4139-835e-8ad7d0cbc26d,,new,day,AUTOMATED_BIDDING,,Old Town,27964,5,1,23.77,4.23,-0.00,-0.00,23.77,4.23,5.62,1,0,0,1,0,0,0,0,1,23.77
2025-10-12,945efc92-6e78-49d9-bc21-8ef1d2471fc4,Ads - Caps <> Spice,sponsored listing,2025-09-19,None,Weekly,5000.00,USD,337ccf4e-d3be-4d44-8fea-6f7bb3304b89,All Customers - Afternoon,all,custom,MANUAL_SET_BIDDING,3.00,Catclaw - Abilene,29652227,8,3,55.06,9.00,-0.00,-0.00,18.35,3.00,6.12,1,0,2,3,1,0,0,1,5,153.35
2025-10-12,945efc92-6e78-49d9-bc21-8ef1d2471fc4,Ads - Caps <> Spice,sponsored listing,2025-09-19,None,Weekly,5000.00,USD,337ccf4e-d3be-4d44-8fea-6f7bb3304b89,All Customers - Afternoon,all,custom,MANUAL_SET_BIDDING,3.00,Cheyenne Rd,2375637,1,0,0.00,0.00,-0.00,-0.00,0.00,0.00,0.00,0,0,0,0,0,0,0,0,1,91.13
2025-10-12,945efc92-6e78-49d9-bc21-8ef1d2471fc4,Ads - Caps <> Spice,sponsored listing,2025-09-19,None,Weekly,5000.00,USD,97f406ae-2452-4364-9047-70a79ea745a1,All Customers - Afternoon,all,custom,MANUAL_SET_BIDDING,3.00,West Glenwood Ave,575295,0,0,0.00,0.00,-0.00,-0.00,0.00,0.00,0.00,0,0,0,0,0,0,0,0,0,0.00
2025-10-12,945efc92-6e78-49d9-bc21-8ef1d2471fc4,Ads - Caps <> Spice,sponsored listing,2025-09-19,None,Weekly,5000.00,USD,337ccf4e-d3be-4d44-8fea-6f7bb3304b89,All Customers - Afternoon,all,custom,MANUAL_SET_BIDDING,3.00,Old Town,27964,3,2,53.34,6.00,-0.00,-0.00,26.67,3.00,8.89,0,0,2,2,0,1,0,1,3,96.88
2025-10-12,945efc92-6e78-49d9-bc21-8ef1d2471fc4,Ads - Caps <> Spice,sponsored listing,2025-09-19,None,Weekly,5000.00,USD,9a6a8cb5-0536-4d63-ac59-bfcc3ec46632,Dinner – Lapsed Customers - 7:00 PM - 9:00 PM,existing,custom,MANUAL_SET_BIDDING,3.00,Northdale Blvd,24976449,0,0,0.00,0.00,-0.00,-0.00,0.00,0.00,0.00,0,0,0,0,0,0,0,0,0,0.00
2025-10-12,945efc92-6e78-49d9-bc21-8ef1d2471fc4,Ads - Caps <> Spice,sponsored listing,2025-09-19,None,Weekly,5000.00,USD,337ccf4e-d3be-4d44-8fea-6f7bb3304b89,All Customers - Afternoon,all,custom,MANUAL_SET_BIDDING,3.00,Oso Blanca Rd,178087,4,2,30.77,6.00,-0.00,-0.00,15.39,3.00,5.13,0,0,2,2,0,2,0,2,5,94.48
2025-10-12,945efc92-6e78-49d9-bc21-8ef1d2471fc4,Ads - Caps <> Spice,sponsored listing,2025-09-19,None,Weekly,5000.00,USD,97f406ae-2452-4364-9047-70a79ea745a1,All Customers - Afternoon,all,custom,MANUAL_SET_BIDDING,3.00,Roanoke,24637171,0,0,0.00,0.00,-0.00,-0.00,0.00,0.00,0.00,0,0,0,0,0,0,0,0,0,0.00
2025-10-12,945efc92-6e78-49d9-bc21-8ef1d2471fc4,Ads - Caps <> Spice,sponsored listing,2025-09-19,None,Weekly,5000.00,USD,97f406ae-2452-4364-9047-70a79ea745a1,All Customers - Afternoon,all,custom,MANUAL_SET_BIDDING,3.00,E 53rd - Davenport,582282,0,0,0.00,0.00,-0.00,-0.00,0.00,0.00,0.00,0,0,0,0,0,0,0,0,0,0.00
2025-10-12,945efc92-6e78-49d9-bc21-8ef1d2471fc4,Ads - Caps <> Spice,sponsored listing,2025-09-19,None,Weekly,5000.00,USD,337ccf4e-d3be-4d44-8fea-6f7bb3304b89,All Customers - Afternoon,all,custom,MANUAL_SET_BIDDING,3.00,Roby Dr - Hammond,24891803,5,2,36.85,6.00,-0.00,-0.00,18.43,3.00,6.14,0,0,2,2,0,1,0,1,2,36.85
2025-10-12,945efc92-6e78-49d9-bc21-8ef1d2471fc4,Ads - Caps <> Spice,sponsored listing,2025-09-19,None,Weekly,5000.00,USD,97f406ae-2452-4364-9047-70a79ea745a1,All Customers - Afternoon,all,custom,MANUAL_SET_BIDDING,3.00,Red Rock Casino,75737,0,0,0.00,0.00,-0.00,-0.00,0.00,0.00,0.00,0,0,0,0,0,0,0,0,0,0.00
2025-10-12,6783ead2-9619-4945-bad6-65d59c164d9f,Sponsored Listing 06/03/2025,sponsored listing,2025-06-03,None,Daily,30.00,USD,c0d5a3fd-63d6-406f-a038-da4efa25d21a,,all,day,AUTOMATED_BIDDING,,Hamilton Blvd,23066760,9,4,119.20,15.21,-0.00,-0.00,29.80,3.80,7.84,3,0,1,4,3,0,0,3,4,119.20
2025-10-12,945efc92-6e78-49d9-bc21-8ef1d2471fc4,Ads - Caps <> Spice,sponsored listing,2025-09-19,None,Weekly,5000.00,USD,337ccf4e-d3be-4d44-8fea-6f7bb3304b89,All Customers - Afternoon,all,custom,MANUAL_SET_BIDDING,3.00,St Rose Pkwy,1335286,1,0,0.00,0.00,-0.00,-0.00,0.00,0.00,0.00,0,0,0,0,0,0,0,0,4,91.94
2025-10-12,945efc92-6e78-49d9-bc21-8ef1d2471fc4,Ads - Caps <> Spice,sponsored listing,2025-09-19,None,Weekly,5000.00,USD,337ccf4e-d3be-4d44-8fea-6f7bb3304b89,All Customers - Afternoon,all,custom,MANUAL_SET_BIDDING,3.00,Los Altos,33476901,16,8,249.34,24.00,-0.00,-0.00,31.17,3.00,10.39,0,0,8,8,0,8,0,8,12,391.42
2025-10-12,945efc92-6e78-49d9-bc21-8ef1d2471fc4,Ads - Caps <> Spice,sponsored listing,2025-09-19,None,Weekly,5000.00,USD,97f406ae-2452-4364-9047-70a79ea745a1,All Customers - Afternoon,all,custom,MANUAL_SET_BIDDING,3.00,Kenosha & 177th,1856591,0,0,0.00,0.00,-0.00,-0.00,0.00,0.00,0.00,0,0,0,0,0,0,0,0,0,0.00
2025-10-12,945efc92-6e78-49d9-bc21-8ef1d2471fc4,Ads - Caps <> Spice,sponsored listing,2025-09-19,None,Weekly,5000.00,USD,97f406ae-2452-4364-9047-70a79ea745a1,All Customers - Afternoon,all,custom,MANUAL_SET_BIDDING,3.00,Jennersville Rd,433075,0,0,0.00,0.00,-0.00,-0.00,0.00,0.00,0.00,0,0,0,0,0,0,0,0,0,0.00
2025-10-12,945efc92-6e78-49d9-bc21-8ef1d2471fc4,Ads - Caps <> Spice,sponsored listing,2025-09-19,None,Weekly,5000.00,USD,337ccf4e-d3be-4d44-8fea-6f7bb3304b89,All Customers - Afternoon,all,custom,MANUAL_SET_BIDDING,3.00,Magnolia Ave,31345441,3,0,0.00,0.00,-0.00,-0.00,0.00,0.00,0.00,0,0,0,0,0,0,0,0,0,0.00
2025-10-12,945efc92-6e78-49d9-bc21-8ef1d2471fc4,Ads - Caps <> Spice,sponsored listing,2025-09-19,None,Weekly,5000.00,USD,337ccf4e-d3be-4d44-8fea-6f7bb3304b89,All Customers - Afternoon,all,custom,MANUAL_SET_BIDDING,3.00,Downtown Summerlin,75736,1,1,23.77,3.00,-0.00,-0.00,23.77,3.00,7.92,0,1,0,1,0,0,1,1,1,23.77
2025-10-12,945efc92-6e78-49d9-bc21-8ef1d2471fc4,Ads - Caps <> Spice,sponsored listing,2025-09-19,None,Weekly,5000.00,USD,337ccf4e-d3be-4d44-8fea-6f7bb3304b89,All Customers - Afternoon,all,custom,MANUAL_SET_BIDDING,3.00,Frisco,34516355,7,1,42.86,3.00,-0.00,-0.00,42.86,3.00,14.29,0,0,1,1,0,0,0,0,1,42.86
2025-10-12,945efc92-6e78-49d9-bc21-8ef1d2471fc4,Ads - Caps <> Spice,sponsored listing,2025-09-19,None,Weekly,5000.00,USD,97f406ae-2452-4364-9047-70a79ea745a1,All Customers - Afternoon,all,custom,MANUAL_SET_BIDDING,3.00,NE Cookingham Dr,23035356,0,0,0.00,0.00,-0.00,-0.00,0.00,0.00,0.00,0,0,0,0,0,0,0,0,0,0.00
2025-10-12,945efc92-6e78-49d9-bc21-8ef1d2471fc4,Ads - Caps <> Spice,sponsored listing,2025-09-19,None,Weekly,5000.00,USD,97f406ae-2452-4364-9047-70a79ea745a1,All Customers - Afternoon,all,custom,MANUAL_SET_BIDDING,3.00,Santa Fe Station,75723,0,0,0.00,0.00,-0.00,-0.00,0.00,0.00,0.00,0,0,0,0,0,0,0,0,0,0.00
2025-10-12,6dcfccaf-60c4-488e-bbf3-cc4a29cbf9da,Sponsored Listing 08/07/2025,sponsored listing,2025-08-07,None,Daily,85.72,USD,d4f97af1-eea4-4c46-93d0-97045be27bd7,,all,day,AUTOMATED_BIDDING,,West Fullerton Ave,23349403,23,7,199.35,60.86,-0.00,-0.00,28.48,8.69,3.28,0,1,6,7,0,5,1,6,9,263.59
2025-10-12,945efc92-6e78-49d9-bc21-8ef1d2471fc4,Ads - Caps <> Spice,sponsored listing,2025-09-19,None,Weekly,5000.00,USD,337ccf4e-d3be-4d44-8fea-6f7bb3304b89,All Customers - Afternoon,all,custom,MANUAL_SET_BIDDING,3.00,Newark,390890,14,3,59.25,9.00,-0.00,-0.00,19.75,3.00,6.58,0,1,2,3,0,2,1,3,6,158.08
2025-10-12,945efc92-6e78-49d9-bc21-8ef1d2471fc4,Ads - Caps <> Spice,sponsored listing,2025-09-19,None,Weekly,5000.00,USD,9a6a8cb5-0536-4d63-ac59-bfcc3ec46632,Dinner – Lapsed Customers - 7:00 PM - 9:00 PM,existing,custom,MANUAL_SET_BIDDING,3.00,Main Street - Anoka,34494893,0,0,0.00,0.00,-0.00,-0.00,0.00,0.00,0.00,0,0,0,0,0,0,0,0,0,0.00
2025-10-12,945efc92-6e78-49d9-bc21-8ef1d2471fc4,Ads - Caps <> Spice,sponsored listing,2025-09-19,None,Weekly,5000.00,USD,97f406ae-2452-4364-9047-70a79ea745a1,All Customers - Afternoon,all,custom,MANUAL_SET_BIDDING,3.00,E Robindale Road,27815740,0,0,0.00,0.00,-0.00,-0.00,0.00,0.00,0.00,0,0,0,0,0,0,0,0,0,0.00
2025-10-12,945efc92-6e78-49d9-bc21-8ef1d2471fc4,Ads - Caps <> Spice,sponsored listing,2025-09-19,None,Weekly,5000.00,USD,337ccf4e-d3be-4d44-8fea-6f7bb3304b89,All Customers - Afternoon,all,custom,MANUAL_SET_BIDDING,3.00,South Sandhill Rd,75741,2,1,37.77,3.00,-0.00,-0.00,37.77,3.00,12.59,0,0,1,1,0,0,0,0,0,0.00
2025-10-12,945efc92-6e78-49d9-bc21-8ef1d2471fc4,Ads - Caps <> Spice,sponsored listing,2025-09-19,None,Weekly,5000.00,USD,337ccf4e-d3be-4d44-8fea-6f7bb3304b89,All Customers - Afternoon,all,custom,MANUAL_SET_BIDDING,3.00,Santa Fe Station,75723,0,0,0.00,0.00,-0.00,-0.00,0.00,0.00,0.00,0,0,0,0,0,0,0,0,0,0.00
2025-10-12,945efc92-6e78-49d9-bc21-8ef1d2471fc4,Ads - Caps <> Spice,sponsored listing,2025-09-19,None,Weekly,5000.00,USD,9a6a8cb5-0536-4d63-ac59-bfcc3ec46632,Dinner – Lapsed Customers - 7:00 PM - 9:00 PM,existing,custom,MANUAL_SET_BIDDING,3.00,South  Walton Blvd,1616214,0,0,0.00,0.00,-0.00,-0.00,0.00,0.00,0.00,0,0,0,0,0,0,0,0,0,0.00
2025-10-12,945efc92-6e78-49d9-bc21-8ef1d2471fc4,Ads - Caps <> Spice,sponsored listing,2025-09-19,None,Weekly,5000.00,USD,337ccf4e-d3be-4d44-8fea-6f7bb3304b89,All Customers - Afternoon,all,custom,MANUAL_SET_BIDDING,3.00,Freeman Park,24404087,2,0,0.00,0.00,-0.00,-0.00,0.00,0.00,0.00,0,0,0,0,0,0,0,0,0,0.00
2025-10-12,945efc92-6e78-49d9-bc21-8ef1d2471fc4,Ads - Caps <> Spice,sponsored listing,2025-09-19,None,Weekly,5000.00,USD,9a6a8cb5-0536-4d63-ac59-bfcc3ec46632,Dinner – Lapsed Customers - 7:00 PM - 9:00 PM,existing,custom,MANUAL_SET_BIDDING,3.00,Catclaw - Abilene,29652227,0,0,0.00,0.00,-0.00,-0.00,0.00,0.00,0.00,0,0,0,0,0,0,0,0,0,0.00
2025-10-12,945efc92-6e78-49d9-bc21-8ef1d2471fc4,Ads - Caps <> Spice,sponsored listing,2025-09-19,None,Weekly,5000.00,USD,337ccf4e-d3be-4d44-8fea-6f7bb3304b89,All Customers - Afternoon,all,custom,MANUAL_SET_BIDDING,3.00,Shepherd - Fresno,24559604,3,2,35.04,6.00,-0.00,-0.00,17.52,3.00,5.84,0,0,2,2,0,1,0,1,3,87.21
2025-10-11,0ec9dc7d-17c1-42bf-b8e1-01d8028c77ba,Sponsored Listing 09/22/2025,sponsored listing,2025-09-22,None,Daily,22.00,USD,ba58b73a-3362-43fb-8aab-dea31bb7c814,,all,day,AUTOMATED_BIDDING,,Frisco,34516355,8,3,128.50,11.23,-0.00,-0.00,42.83,3.74,11.44,1,1,1,3,1,1,1,3,5,222.59
2025-10-11,945efc92-6e78-49d9-bc21-8ef1d2471fc4,Ads - Caps <> Spice,sponsored listing,2025-09-19,None,Weekly,5000.00,USD,97f406ae-2452-4364-9047-70a79ea745a1,All Customers - Afternoon,all,custom,MANUAL_SET_BIDDING,3.00,South  Walton Blvd,1616214,1,0,0.00,0.00,-0.00,-0.00,0.00,0.00,0.00,0,0,0,0,0,0,0,0,0,0.00
2025-10-11,945efc92-6e78-49d9-bc21-8ef1d2471fc4,Ads - Caps <> Spice,sponsored listing,2025-09-19,None,Weekly,5000.00,USD,97f406ae-2452-4364-9047-70a79ea745a1,All Customers - Afternoon,all,custom,MANUAL_SET_BIDDING,3.00,Silverside Road,691182,1,1,37.58,3.00,-0.00,-0.00,37.58,3.00,12.53,0,0,1,1,0,1,0,1,1,37.58
2025-10-11,945efc92-6e78-49d9-bc21-8ef1d2471fc4,Ads - Caps <> Spice,sponsored listing,2025-09-19,None,Weekly,5000.00,USD,97f406ae-2452-4364-9047-70a79ea745a1,All Customers - Afternoon,all,custom,MANUAL_SET_BIDDING,3.00,Park Road Center,27677423,0,0,0.00,0.00,-0.00,-0.00,0.00,0.00,0.00,0,0,0,0,0,0,0,0,0,0.00
2025-10-11,945efc92-6e78-49d9-bc21-8ef1d2471fc4,Ads - Caps <> Spice,sponsored listing,2025-09-19,None,Weekly,5000.00,USD,337ccf4e-d3be-4d44-8fea-6f7bb3304b89,All Customers - Afternoon,all,custom,MANUAL_SET_BIDDING,3.00,Red Cliff Dr,578425,2,1,18.18,3.00,-0.00,-0.00,18.18,3.00,6.06,0,0,1,1,0,1,0,1,1,18.18
2025-10-11,c15d8db7-7b8d-419b-aaf9-a7fe8914f715,Sponsored Listing 05/22/2025,sponsored listing,2025-05-22,None,Daily,1940.00,USD,7e1c2d6c-858c-47af-a75e-63f392710b94,,all,day,MANUAL_SET_BIDDING,5.00,Grand Ave-Portland,1370229,36,11,270.28,49.24,-0.00,-0.00,24.57,4.48,5.49,0,2,9,11,0,8,2,10,11,316.15
2025-10-11,945efc92-6e78-49d9-bc21-8ef1d2471fc4,Ads - Caps <> Spice,sponsored listing,2025-09-19,None,Weekly,5000.00,USD,337ccf4e-d3be-4d44-8fea-6f7bb3304b89,All Customers - Afternoon,all,custom,MANUAL_SET_BIDDING,3.00,Gambrills,24415514,2,1,49.17,3.00,-0.00,-0.00,49.17,3.00,16.39,0,0,1,1,0,0,0,0,1,49.17
2025-10-11,945efc92-6e78-49d9-bc21-8ef1d2471fc4,Ads - Caps <> Spice,sponsored listing,2025-09-19,None,Weekly,5000.00,USD,337ccf4e-d3be-4d44-8fea-6f7bb3304b89,All Customers - Afternoon,all,custom,MANUAL_SET_BIDDING,3.00,West Craig Road,75727,3,2,57.64,6.00,-0.00,-0.00,28.82,3.00,9.61,0,0,2,2,0,2,0,2,4,86.60
2025-10-11,945efc92-6e78-49d9-bc21-8ef1d2471fc4,Ads - Caps <> Spice,sponsored listing,2025-09-19,None,Weekly,5000.00,USD,337ccf4e-d3be-4d44-8fea-6f7bb3304b89,All Customers - Afternoon,all,custom,MANUAL_SET_BIDDING,3.00,North Haven Ave,28834163,6,2,38.77,6.00,-0.00,-0.00,19.39,3.00,6.46,0,0,2,2,0,2,0,2,1,21.98
2025-10-11,6dcfccaf-60c4-488e-bbf3-cc4a29cbf9da,Sponsored Listing 08/07/2025,sponsored listing,2025-08-07,None,Daily,85.72,USD,d4f97af1-eea4-4c46-93d0-97045be27bd7,,all,day,AUTOMATED_BIDDING,,West Fullerton Ave,23349403,22,4,105.80,35.57,-0.00,-0.00,26.45,8.89,2.97,0,1,3,4,0,3,1,4,7,206.66
2025-10-11,945efc92-6e78-49d9-bc21-8ef1d2471fc4,Ads - Caps <> Spice,sponsored listing,2025-09-19,None,Weekly,5000.00,USD,9a6a8cb5-0536-4d63-ac59-bfcc3ec46632,Dinner – Lapsed Customers - 7:00 PM - 9:00 PM,existing,custom,MANUAL_SET_BIDDING,3.00,Niles Cortland Rd SE,34043935,0,0,0.00,0.00,-0.00,-0.00,0.00,0.00,0.00,0,0,0,0,0,0,0,0,0,0.00
2025-10-11,945efc92-6e78-49d9-bc21-8ef1d2471fc4,Ads - Caps <> Spice,sponsored listing,2025-09-19,None,Weekly,5000.00,USD,9a6a8cb5-0536-4d63-ac59-bfcc3ec46632,Dinner – Lapsed Customers - 7:00 PM - 9:00 PM,existing,custom,MANUAL_SET_BIDDING,3.00,Parker,24021312,0,0,0.00,0.00,-0.00,-0.00,0.00,0.00,0.00,0,0,0,0,0,0,0,0,0,0.00
2025-10-11,945efc92-6e78-49d9-bc21-8ef1d2471fc4,Ads - Caps <> Spice,sponsored listing,2025-09-19,None,Weekly,5000.00,USD,337ccf4e-d3be-4d44-8fea-6f7bb3304b89,All Customers - Afternoon,all,custom,MANUAL_SET_BIDDING,3.00,Catclaw - Abilene,29652227,14,5,164.85,15.00,-0.00,-0.00,32.97,3.00,10.99,0,0,5,5,0,4,0,4,9,295.21
2025-10-11,945efc92-6e78-49d9-bc21-8ef1d2471fc4,Ads - Caps <> Spice,sponsored listing,2025-09-19,None,Weekly,5000.00,USD,9a6a8cb5-0536-4d63-ac59-bfcc3ec46632,Dinner – Lapsed Customers - 7:00 PM - 9:00 PM,existing,custom,MANUAL_SET_BIDDING,3.00,University Ave,1084955,0,0,0.00,0.00,-0.00,-0.00,0.00,0.00,0.00,0,0,0,0,0,0,0,0,0,0.00
2025-10-11,945efc92-6e78-49d9-bc21-8ef1d2471fc4,Ads - Caps <> Spice,sponsored listing,2025-09-19,None,Weekly,5000.00,USD,337ccf4e-d3be-4d44-8fea-6f7bb3304b89,All Customers - Afternoon,all,custom,MANUAL_SET_BIDDING,3.00,Silverside Road,691182,14,6,233.90,18.00,-0.00,-0.00,38.98,3.00,12.99,0,3,3,6,0,2,2,4,8,277.27
2025-10-11,945efc92-6e78-49d9-bc21-8ef1d2471fc4,Ads - Caps <> Spice,sponsored listing,2025-09-19,None,Weekly,5000.00,USD,9a6a8cb5-0536-4d63-ac59-bfcc3ec46632,Dinner – Lapsed Customers - 7:00 PM - 9:00 PM,existing,custom,MANUAL_SET_BIDDING,3.00,Manchester Rd,27715447,0,0,0.00,0.00,-0.00,-0.00,0.00,0.00,0.00,0,0,0,0,0,0,0,0,0,0.00
2025-10-11,945efc92-6e78-49d9-bc21-8ef1d2471fc4,Ads - Caps <> Spice,sponsored listing,2025-09-19,None,Weekly,5000.00,USD,9a6a8cb5-0536-4d63-ac59-bfcc3ec46632,Dinner – Lapsed Customers - 7:00 PM - 9:00 PM,existing,custom,MANUAL_SET_BIDDING,3.00,"Marlton, NJ",35211042,0,0,0.00,0.00,-0.00,-0.00,0.00,0.00,0.00,0,0,0,0,0,0,0,0,0,0.00
2025-10-11,945efc92-6e78-49d9-bc21-8ef1d2471fc4,Ads - Caps <> Spice,sponsored listing,2025-09-19,None,Weekly,5000.00,USD,337ccf4e-d3be-4d44-8fea-6f7bb3304b89,All Customers - Afternoon,all,custom,MANUAL_SET_BIDDING,3.00,Sahara & Las Vegas,75735,2,1,26.39,3.00,-0.00,-0.00,26.39,3.00,8.80,0,0,1,1,0,0,0,0,2,44.16
2025-10-11,945efc92-6e78-49d9-bc21-8ef1d2471fc4,Ads - Caps <> Spice,sponsored listing,2025-09-19,None,Weekly,5000.00,USD,337ccf4e-d3be-4d44-8fea-6f7bb3304b89,All Customers - Afternoon,all,custom,MANUAL_SET_BIDDING,3.00,Interquest Parkway,27558470,2,1,24.48,3.00,-0.00,-0.00,24.48,3.00,8.16,0,1,0,1,0,0,1,1,4,96.51
2025-10-11,945efc92-6e78-49d9-bc21-8ef1d2471fc4,Ads - Caps <> Spice,sponsored listing,2025-09-19,None,Weekly,5000.00,USD,337ccf4e-d3be-4d44-8fea-6f7bb3304b89,All Customers - Afternoon,all,custom,MANUAL_SET_BIDDING,3.00,Pioneer Pkwy,874359,0,0,0.00,0.00,-0.00,-0.00,0.00,0.00,0.00,0,0,0,0,0,0,0,0,0,0.00
2025-10-11,945efc92-6e78-49d9-bc21-8ef1d2471fc4,Ads - Caps <> Spice,sponsored listing,2025-09-19,None,Weekly,5000.00,USD,97f406ae-2452-4364-9047-70a79ea745a1,All Customers - Afternoon,all,custom,MANUAL_SET_BIDDING,3.00,North Haven Ave,28834163,0,0,0.00,0.00,-0.00,-0.00,0.00,0.00,0.00,0,0,0,0,0,0,0,0,0,0.00
2025-10-11,945efc92-6e78-49d9-bc21-8ef1d2471fc4,Ads - Caps <> Spice,sponsored listing,2025-09-19,None,Weekly,5000.00,USD,97f406ae-2452-4364-9047-70a79ea745a1,All Customers - Afternoon,all,custom,MANUAL_SET_BIDDING,3.00,Jennersville Rd,433075,1,1,11.99,3.00,-0.00,-0.00,11.99,3.00,4.00,0,1,0,1,0,0,0,0,1,11.99
2025-10-11,945efc92-6e78-49d9-bc21-8ef1d2471fc4,Ads - Caps <> Spice,sponsored listing,2025-09-19,None,Weekly,5000.00,USD,337ccf4e-d3be-4d44-8fea-6f7bb3304b89,All Customers - Afternoon,all,custom,MANUAL_SET_BIDDING,3.00,West Avera Dr,1742446,2,0,0.00,0.00,-0.00,-0.00,0.00,0.00,0.00,0,0,0,0,0,0,0,0,1,34.36
2025-10-11,945efc92-6e78-49d9-bc21-8ef1d2471fc4,Ads - Caps <> Spice,sponsored listing,2025-09-19,None,Weekly,5000.00,USD,97f406ae-2452-4364-9047-70a79ea745a1,All Customers - Afternoon,all,custom,MANUAL_SET_BIDDING,3.00,West Charleston,23641277,0,0,0.00,0.00,-0.00,-0.00,0.00,0.00,0.00,0,0,0,0,0,0,0,0,0,0.00
2025-10-11,945efc92-6e78-49d9-bc21-8ef1d2471fc4,Ads - Caps <> Spice,sponsored listing,2025-09-19,None,Weekly,5000.00,USD,9a6a8cb5-0536-4d63-ac59-bfcc3ec46632,Dinner – Lapsed Customers - 7:00 PM - 9:00 PM,existing,custom,MANUAL_SET_BIDDING,3.00,Castle Rock,23057614,0,0,0.00,0.00,-0.00,-0.00,0.00,0.00,0.00,0,0,0,0,0,0,0,0,0,0.00
2025-10-11,945efc92-6e78-49d9-bc21-8ef1d2471fc4,Ads - Caps <> Spice,sponsored listing,2025-09-19,None,Weekly,5000.00,USD,97f406ae-2452-4364-9047-70a79ea745a1,All Customers - Afternoon,all,custom,MANUAL_SET_BIDDING,3.00,Aliante Casino,75725,1,1,13.49,3.00,-0.00,-0.00,13.49,3.00,4.50,0,1,0,1,0,0,1,1,1,13.49
2025-10-11,945efc92-6e78-49d9-bc21-8ef1d2471fc4,Ads - Caps <> Spice,sponsored listing,2025-09-19,None,Weekly,5000.00,USD,337ccf4e-d3be-4d44-8fea-6f7bb3304b89,All Customers - Afternoon,all,custom,MANUAL_SET_BIDDING,3.00,S Stanford Way,699470,7,1,31.18,3.00,-0.00,-0.00,31.18,3.00,10.39,0,0,1,1,0,0,0,0,2,77.93
2025-10-11,945efc92-6e78-49d9-bc21-8ef1d2471fc4,Ads - Caps <> Spice,sponsored listing,2025-09-19,None,Weekly,5000.00,USD,97f406ae-2452-4364-9047-70a79ea745a1,All Customers - Afternoon,all,custom,MANUAL_SET_BIDDING,3.00,Cranberry Township,24851842,0,0,0.00,0.00,-0.00,-0.00,0.00,0.00,0.00,0,0,0,0,0,0,0,0,0,0.00
2025-10-11,945efc92-6e78-49d9-bc21-8ef1d2471fc4,Ads - Caps <> Spice,sponsored listing,2025-09-19,None,Weekly,5000.00,USD,337ccf4e-d3be-4d44-8fea-6f7bb3304b89,All Customers - Afternoon,all,custom,MANUAL_SET_BIDDING,3.00,East Craig Road,75739,1,1,52.78,3.00,-0.00,-0.00,52.78,3.00,17.59,0,0,1,1,0,1,0,1,2,79.17
2025-10-11,945efc92-6e78-49d9-bc21-8ef1d2471fc4,Ads - Caps <> Spice,sponsored listing,2025-09-19,None,Weekly,5000.00,USD,337ccf4e-d3be-4d44-8fea-6f7bb3304b89,All Customers - Afternoon,all,custom,MANUAL_SET_BIDDING,3.00,Rancho Mirage,32864869,1,1,19.99,3.00,-0.00,-0.00,19.99,3.00,6.66,0,0,1,1,0,1,0,1,1,19.99
2025-10-11,945efc92-6e78-49d9-bc21-8ef1d2471fc4,Ads - Caps <> Spice,sponsored listing,2025-09-19,None,Weekly,5000.00,USD,337ccf4e-d3be-4d44-8fea-6f7bb3304b89,All Customers - Afternoon,all,custom,MANUAL_SET_BIDDING,3.00,West Flamingo Road,75731,3,1,14.19,3.00,-0.00,-0.00,14.19,3.00,4.73,1,0,0,1,1,0,0,1,3,91.35
2025-10-11,945efc92-6e78-49d9-bc21-8ef1d2471fc4,Ads - Caps <> Spice,sponsored listing,2025-09-19,None,Weekly,5000.00,USD,337ccf4e-d3be-4d44-8fea-6f7bb3304b89,All Customers - Afternoon,all,custom,MANUAL_SET_BIDDING,3.00,Post Falls,34326515,6,3,95.59,9.00,-0.00,-0.00,31.86,3.00,10.62,0,1,2,3,0,2,1,3,5,176.00
2025-10-11,945efc92-6e78-49d9-bc21-8ef1d2471fc4,Ads - Caps <> Spice,sponsored listing,2025-09-19,None,Weekly,5000.00,USD,97f406ae-2452-4364-9047-70a79ea745a1,All Customers - Afternoon,all,custom,MANUAL_SET_BIDDING,3.00,Sierra St - Reno,719271,0,0,0.00,0.00,-0.00,-0.00,0.00,0.00,0.00,0,0,0,0,0,0,0,0,0,0.00
2025-10-11,f43efa40-34e8-4489-8407-0aeaf570bddd,Sponsored Listing 07/14/2025,sponsored listing,2025-07-14,None,Daily,30.00,USD,2da9b9a3-3774-42b2-bed4-328ccce2f2c4,,all,custom,AUTOMATED_BIDDING,,Chicago River West,34048823,8,1,20.37,11.93,-0.00,-0.00,20.37,11.93,1.71,0,0,1,1,0,1,0,1,1,20.37
2025-10-11,945efc92-6e78-49d9-bc21-8ef1d2471fc4,Ads - Caps <> Spice,sponsored listing,2025-09-19,None,Weekly,5000.00,USD,97f406ae-2452-4364-9047-70a79ea745a1,All Customers - Afternoon,all,custom,MANUAL_SET_BIDDING,3.00,Niles Cortland Rd SE,34043935,1,0,0.00,0.00,-0.00,-0.00,0.00,0.00,0.00,0,0,0,0,0,0,0,0,1,57.48
2025-10-11,945efc92-6e78-49d9-bc21-8ef1d2471fc4,Ads - Caps <> Spice,sponsored listing,2025-09-19,None,Weekly,5000.00,USD,337ccf4e-d3be-4d44-8fea-6f7bb3304b89,All Customers - Afternoon,all,custom,MANUAL_SET_BIDDING,3.00,Sierra St - Reno,719271,9,2,44.64,6.00,-0.00,-0.00,22.32,3.00,7.44,0,1,1,2,0,1,1,2,8,186.51
2025-10-11,945efc92-6e78-49d9-bc21-8ef1d2471fc4,Ads - Caps <> Spice,sponsored listing,2025-09-19,None,Weekly,5000.00,USD,337ccf4e-d3be-4d44-8fea-6f7bb3304b89,All Customers - Afternoon,all,custom,MANUAL_SET_BIDDING,3.00,West Charleston,23641277,2,0,0.00,0.00,-0.00,-0.00,0.00,0.00,0.00,0,0,0,0,0,0,0,0,0,0.00
2025-10-11,945efc92-6e78-49d9-bc21-8ef1d2471fc4,Ads - Caps <> Spice,sponsored listing,2025-09-19,None,Weekly,5000.00,USD,97f406ae-2452-4364-9047-70a79ea745a1,All Customers - Afternoon,all,custom,MANUAL_SET_BIDDING,3.00,NE Cookingham Dr,23035356,0,0,0.00,0.00,-0.00,-0.00,0.00,0.00,0.00,0,0,0,0,0,0,0,0,0,0.00
2025-10-11,6dcfccaf-60c4-488e-bbf3-cc4a29cbf9da,Sponsored Listing 08/07/2025,sponsored listing,2025-08-07,None,Daily,85.72,USD,d4f97af1-eea4-4c46-93d0-97045be27bd7,,all,day,AUTOMATED_BIDDING,,Chicago River West,34048823,28,4,152.34,30.34,-0.00,-0.00,38.09,7.59,5.02,0,1,3,4,0,3,1,4,7,217.08
2025-10-11,945efc92-6e78-49d9-bc21-8ef1d2471fc4,Ads - Caps <> Spice,sponsored listing,2025-09-19,None,Weekly,5000.00,USD,9a6a8cb5-0536-4d63-ac59-bfcc3ec46632,Dinner – Lapsed Customers - 7:00 PM - 9:00 PM,existing,custom,MANUAL_SET_BIDDING,3.00,Ogletown Stanton,422117,0,0,0.00,0.00,-0.00,-0.00,0.00,0.00,0.00,0,0,0,0,0,0,0,0,0,0.00
2025-10-11,945efc92-6e78-49d9-bc21-8ef1d2471fc4,Ads - Caps <> Spice,sponsored listing,2025-09-19,None,Weekly,5000.00,USD,97f406ae-2452-4364-9047-70a79ea745a1,All Customers - Afternoon,all,custom,MANUAL_SET_BIDDING,3.00,"Lewes, DE",34776698,0,0,0.00,0.00,-0.00,-0.00,0.00,0.00,0.00,0,0,0,0,0,0,0,0,1,66.01
2025-10-11,945efc92-6e78-49d9-bc21-8ef1d2471fc4,Ads - Caps <> Spice,sponsored listing,2025-09-19,None,Weekly,5000.00,USD,9a6a8cb5-0536-4d63-ac59-bfcc3ec46632,Dinner – Lapsed Customers - 7:00 PM - 9:00 PM,existing,custom,MANUAL_SET_BIDDING,3.00,Jennersville Rd,433075,0,0,0.00,0.00,-0.00,-0.00,0.00,0.00,0.00,0,0,0,0,0,0,0,0,0,0.00
2025-10-11,945efc92-6e78-49d9-bc21-8ef1d2471fc4,Ads - Caps <> Spice,sponsored listing,2025-09-19,None,Weekly,5000.00,USD,337ccf4e-d3be-4d44-8fea-6f7bb3304b89,All Customers - Afternoon,all,custom,MANUAL_SET_BIDDING,3.00,Bidwell - Folsom,26234909,8,3,66.83,9.00,-0.00,-0.00,22.28,3.00,7.43,0,0,3,3,0,2,0,2,5,190.72
2025-10-11,eafccee4-8165-4152-bbdb-ba84b5ef5c9e,Sponsored Listing 04/25/2025,sponsored listing,2025-04-25,None,Daily,75.00,USD,1d7b1dac-b745-4b72-a4bc-2193251b4825,,all,day,AUTOMATED_BIDDING,,West Fullerton Ave,23349403,3,0,0.00,0.00,-0.00,-0.00,0.00,0.00,0.00,0,0,0,0,0,0,0,0,1,22.28
2025-10-11,945efc92-6e78-49d9-bc21-8ef1d2471fc4,Ads - Caps <> Spice,sponsored listing,2025-09-19,None,Weekly,5000.00,USD,97f406ae-2452-4364-9047-70a79ea745a1,All Customers - Afternoon,all,custom,MANUAL_SET_BIDDING,3.00,Newark,390890,0,0,0.00,0.00,-0.00,-0.00,0.00,0.00,0.00,0,0,0,0,0,0,0,0,0,0.00
2025-10-11,945efc92-6e78-49d9-bc21-8ef1d2471fc4,Ads - Caps <> Spice,sponsored listing,2025-09-19,None,Weekly,5000.00,USD,97f406ae-2452-4364-9047-70a79ea745a1,All Customers - Afternoon,all,custom,MANUAL_SET_BIDDING,3.00,E Silverado Ranch,75746,0,0,0.00,0.00,-0.00,-0.00,0.00,0.00,0.00,0,0,0,0,0,0,0,0,0,0.00
2025-10-11,945efc92-6e78-49d9-bc21-8ef1d2471fc4,Ads - Caps <> Spice,sponsored listing,2025-09-19,None,Weekly,5000.00,USD,337ccf4e-d3be-4d44-8fea-6f7bb3304b89,All Customers - Afternoon,all,custom,MANUAL_SET_BIDDING,3.00,Limonite Ave,2375675,2,1,43.27,3.00,-0.00,-0.00,43.27,3.00,14.42,0,0,1,1,0,0,0,0,2,100.84
2025-10-11,4861a65d-f77d-4020-ae87-7e098bbb5440,Mid Sep-November boost,sponsored listing,2025-09-22,None,Daily,14.00,USD,1698db27-cd94-4608-922e-6f562c3760f5,,all,day,AUTOMATED_BIDDING,,International Pkwy,24671402,4,2,51.85,7.83,-0.00,-0.00,25.93,3.92,6.62,0,0,2,2,0,1,0,1,3,97.69
2025-10-11,945efc92-6e78-49d9-bc21-8ef1d2471fc4,Ads - Caps <> Spice,sponsored listing,2025-09-19,None,Weekly,5000.00,USD,97f406ae-2452-4364-9047-70a79ea745a1,All Customers - Afternoon,all,custom,MANUAL_SET_BIDDING,3.00,"Capriotti's of Milford, LLC",1636430,0,0,0.00,0.00,-0.00,-0.00,0.00,0.00,0.00,0,0,0,0,0,0,0,0,1,62.34
2025-10-11,945efc92-6e78-49d9-bc21-8ef1d2471fc4,Ads - Caps <> Spice,sponsored listing,2025-09-19,None,Weekly,5000.00,USD,337ccf4e-d3be-4d44-8fea-6f7bb3304b89,All Customers - Afternoon,all,custom,MANUAL_SET_BIDDING,3.00,1st Ave NE,23128705,5,2,38.26,6.00,-0.00,-0.00,19.13,3.00,6.38,0,0,2,2,0,1,0,1,3,57.04
2025-10-11,945efc92-6e78-49d9-bc21-8ef1d2471fc4,Ads - Caps <> Spice,sponsored listing,2025-09-19,None,Weekly,5000.00,USD,337ccf4e-d3be-4d44-8fea-6f7bb3304b89,All Customers - Afternoon,all,custom,MANUAL_SET_BIDDING,3.00,De Soto-Chatsworth,651597,2,1,25.16,3.00,-0.00,-0.00,25.16,3.00,8.39,0,0,1,1,0,1,0,1,4,150.20
2025-10-11,945efc92-6e78-49d9-bc21-8ef1d2471fc4,Ads - Caps <> Spice,sponsored listing,2025-09-19,None,Weekly,5000.00,USD,97f406ae-2452-4364-9047-70a79ea745a1,All Customers - Afternoon,all,custom,MANUAL_SET_BIDDING,3.00,Olympia Ave-Tulsa,24892240,0,0,0.00,0.00,-0.00,-0.00,0.00,0.00,0.00,0,0,0,0,0,0,0,0,0,0.00
2025-10-11,945efc92-6e78-49d9-bc21-8ef1d2471fc4,Ads - Caps <> Spice,sponsored listing,2025-09-19,None,Weekly,5000.00,USD,337ccf4e-d3be-4d44-8fea-6f7bb3304b89,All Customers - Afternoon,all,custom,MANUAL_SET_BIDDING,3.00,Old Town,27964,5,1,16.79,3.00,-0.00,-0.00,16.79,3.00,5.60,0,0,1,1,0,0,0,0,1,16.79
2025-10-11,945efc92-6e78-49d9-bc21-8ef1d2471fc4,Ads - Caps <> Spice,sponsored listing,2025-09-19,None,Weekly,5000.00,USD,337ccf4e-d3be-4d44-8fea-6f7bb3304b89,All Customers - Afternoon,all,custom,MANUAL_SET_BIDDING,3.00,Park Road Center,27677423,2,1,28.49,3.00,-0.00,-0.00,28.49,3.00,9.50,0,0,1,1,0,1,0,1,1,28.49
2025-10-11,945efc92-6e78-49d9-bc21-8ef1d2471fc4,Ads - Caps <> Spice,sponsored listing,2025-09-19,None,Weekly,5000.00,USD,97f406ae-2452-4364-9047-70a79ea745a1,All Customers - Afternoon,all,custom,MANUAL_SET_BIDDING,3.00,Interquest Parkway,27558470,0,0,0.00,0.00,-0.00,-0.00,0.00,0.00,0.00,0,0,0,0,0,0,0,0,0,0.00
2025-10-11,945efc92-6e78-49d9-bc21-8ef1d2471fc4,Ads - Caps <> Spice,sponsored listing,2025-09-19,None,Weekly,5000.00,USD,9a6a8cb5-0536-4d63-ac59-bfcc3ec46632,Dinner – Lapsed Customers - 7:00 PM - 9:00 PM,existing,custom,MANUAL_SET_BIDDING,3.00,Mountain View,2608887,0,0,0.00,0.00,-0.00,-0.00,0.00,0.00,0.00,0,0,0,0,0,0,0,0,0,0.00
2025-10-11,945efc92-6e78-49d9-bc21-8ef1d2471fc4,Ads - Caps <> Spice,sponsored listing,2025-09-19,None,Weekly,5000.00,USD,97f406ae-2452-4364-9047-70a79ea745a1,All Customers - Afternoon,all,custom,MANUAL_SET_BIDDING,3.00,Plumb Lane,439577,0,0,0.00,0.00,-0.00,-0.00,0.00,0.00,0.00,0,0,0,0,0,0,0,0,0,0.00
2025-10-11,945efc92-6e78-49d9-bc21-8ef1d2471fc4,Ads - Caps <> Spice,sponsored listing,2025-09-19,None,Weekly,5000.00,USD,97f406ae-2452-4364-9047-70a79ea745a1,All Customers - Afternoon,all,custom,MANUAL_SET_BIDDING,3.00,East Craig Road,75739,0,0,0.00,0.00,-0.00,-0.00,0.00,0.00,0.00,0,0,0,0,0,0,0,0,0,0.00
2025-10-11,945efc92-6e78-49d9-bc21-8ef1d2471fc4,Ads - Caps <> Spice,sponsored listing,2025-09-19,None,Weekly,5000.00,USD,337ccf4e-d3be-4d44-8fea-6f7bb3304b89,All Customers - Afternoon,all,custom,MANUAL_SET_BIDDING,3.00,Meadows - Reno,705841,3,0,0.00,0.00,-0.00,-0.00,0.00,0.00,0.00,0,0,0,0,0,0,0,0,1,234.76
2025-10-11,945efc92-6e78-49d9-bc21-8ef1d2471fc4,Ads - Caps <> Spice,sponsored listing,2025-09-19,None,Weekly,5000.00,USD,337ccf4e-d3be-4d44-8fea-6f7bb3304b89,All Customers - Afternoon,all,custom,MANUAL_SET_BIDDING,3.00,Sumneytown Pike,24717004,10,3,87.12,9.00,-0.00,-0.00,29.04,3.00,9.68,0,0,3,3,0,1,0,1,5,125.78
2025-10-11,945efc92-6e78-49d9-bc21-8ef1d2471fc4,Ads - Caps <> Spice,sponsored listing,2025-09-19,None,Weekly,5000.00,USD,337ccf4e-d3be-4d44-8fea-6f7bb3304b89,All Customers - Afternoon,all,custom,MANUAL_SET_BIDDING,3.00,Kennett Square,575296,1,0,0.00,0.00,-0.00,-0.00,0.00,0.00,0.00,0,0,0,0,0,0,0,0,0,0.00
2025-10-11,945efc92-6e78-49d9-bc21-8ef1d2471fc4,Ads - Caps <> Spice,sponsored listing,2025-09-19,None,Weekly,5000.00,USD,97f406ae-2452-4364-9047-70a79ea745a1,All Customers - Afternoon,all,custom,MANUAL_SET_BIDDING,3.00,Roanoke,24637171,0,0,0.00,0.00,-0.00,-0.00,0.00,0.00,0.00,0,0,0,0,0,0,0,0,0,0.00
2025-10-11,945efc92-6e78-49d9-bc21-8ef1d2471fc4,Ads - Caps <> Spice,sponsored listing,2025-09-19,None,Weekly,5000.00,USD,337ccf4e-d3be-4d44-8fea-6f7bb3304b89,All Customers - Afternoon,all,custom,MANUAL_SET_BIDDING,3.00,Mountain View,2608887,4,1,23.18,3.00,-0.00,-0.00,23.18,3.00,7.73,1,0,0,1,1,0,0,1,2,60.96
2025-10-11,945efc92-6e78-49d9-bc21-8ef1d2471fc4,Ads - Caps <> Spice,sponsored listing,2025-09-19,None,Weekly,5000.00,USD,97f406ae-2452-4364-9047-70a79ea745a1,All Customers - Afternoon,all,custom,MANUAL_SET_BIDDING,3.00,Sunset and Sandhill,32849799,0,0,0.00,0.00,-0.00,-0.00,0.00,0.00,0.00,0,0,0,0,0,0,0,0,0,0.00
2025-10-11,945efc92-6e78-49d9-bc21-8ef1d2471fc4,Ads - Caps <> Spice,sponsored listing,2025-09-19,None,Weekly,5000.00,USD,97f406ae-2452-4364-9047-70a79ea745a1,All Customers - Afternoon,all,custom,MANUAL_SET_BIDDING,3.00,Kenosha & 177th,1856591,2,0,0.00,0.00,-0.00,-0.00,0.00,0.00,0.00,0,0,0,0,0,0,0,0,0,0.00
2025-10-11,945efc92-6e78-49d9-bc21-8ef1d2471fc4,Ads - Caps <> Spice,sponsored listing,2025-09-19,None,Weekly,5000.00,USD,337ccf4e-d3be-4d44-8fea-6f7bb3304b89,All Customers - Afternoon,all,custom,MANUAL_SET_BIDDING,3.00,Southern Highlands,1750142,2,1,51.95,3.00,-0.00,-0.00,51.95,3.00,17.32,0,0,1,1,0,0,0,0,1,51.95
2025-10-11,945efc92-6e78-49d9-bc21-8ef1d2471fc4,Ads - Caps <> Spice,sponsored listing,2025-09-19,None,Weekly,5000.00,USD,97f406ae-2452-4364-9047-70a79ea745a1,All Customers - Afternoon,all,custom,MANUAL_SET_BIDDING,3.00,S Fort Apache,75730,0,0,0.00,0.00,-0.00,-0.00,0.00,0.00,0.00,0,0,0,0,0,0,0,0,1,47.05
2025-10-11,945efc92-6e78-49d9-bc21-8ef1d2471fc4,Ads - Caps <> Spice,sponsored listing,2025-09-19,None,Weekly,5000.00,USD,337ccf4e-d3be-4d44-8fea-6f7bb3304b89,All Customers - Afternoon,all,custom,MANUAL_SET_BIDDING,3.00,South Eastern Ave,75744,2,2,44.05,6.00,-0.00,-0.00,22.03,3.00,7.34,1,0,1,2,0,1,0,1,3,86.41
2025-10-11,945efc92-6e78-49d9-bc21-8ef1d2471fc4,Ads - Caps <> Spice,sponsored listing,2025-09-19,None,Weekly,5000.00,USD,9a6a8cb5-0536-4d63-ac59-bfcc3ec46632,Dinner – Lapsed Customers - 7:00 PM - 9:00 PM,existing,custom,MANUAL_SET_BIDDING,3.00,Silverside Road,691182,0,0,0.00,0.00,-0.00,-0.00,0.00,0.00,0.00,0,0,0,0,0,0,0,0,0,0.00
2025-10-11,945efc92-6e78-49d9-bc21-8ef1d2471fc4,Ads - Caps <> Spice,sponsored listing,2025-09-19,None,Weekly,5000.00,USD,337ccf4e-d3be-4d44-8fea-6f7bb3304b89,All Customers - Afternoon,all,custom,MANUAL_SET_BIDDING,3.00,Cheyenne Rd,2375637,3,2,42.63,6.00,-0.00,-0.00,21.32,3.00,7.11,0,0,2,2,0,1,0,1,3,104.46
2025-10-11,945efc92-6e78-49d9-bc21-8ef1d2471fc4,Ads - Caps <> Spice,sponsored listing,2025-09-19,None,Weekly,5000.00,USD,337ccf4e-d3be-4d44-8fea-6f7bb3304b89,All Customers - Afternoon,all,custom,MANUAL_SET_BIDDING,3.00,Niles Cortland Rd SE,34043935,12,5,157.35,15.00,-0.00,-0.00,31.47,3.00,10.49,1,0,4,5,1,4,0,5,6,177.42
2025-10-11,945efc92-6e78-49d9-bc21-8ef1d2471fc4,Ads - Caps <> Spice,sponsored listing,2025-09-19,None,Weekly,5000.00,USD,97f406ae-2452-4364-9047-70a79ea745a1,All Customers - Afternoon,all,custom,MANUAL_SET_BIDDING,3.00,Ogletown Stanton,422117,2,0,0.00,0.00,-0.00,-0.00,0.00,0.00,0.00,0,0,0,0,0,0,0,0,0,0.00
2025-10-11,945efc92-6e78-49d9-bc21-8ef1d2471fc4,Ads - Caps <> Spice,sponsored listing,2025-09-19,None,Weekly,5000.00,USD,337ccf4e-d3be-4d44-8fea-6f7bb3304b89,All Customers - Afternoon,all,custom,MANUAL_SET_BIDDING,3.00,Santa Fe Station,75723,1,1,35.88,3.00,-0.00,-0.00,35.88,3.00,11.96,1,0,0,1,1,0,0,1,1,35.88
2025-10-11,945efc92-6e78-49d9-bc21-8ef1d2471fc4,Ads - Caps <> Spice,sponsored listing,2025-09-19,None,Weekly,5000.00,USD,337ccf4e-d3be-4d44-8fea-6f7bb3304b89,All Customers - Afternoon,all,custom,MANUAL_SET_BIDDING,3.00,Highbrook Way,33551695,3,1,38.87,3.00,-0.00,-0.00,38.87,3.00,12.96,0,0,1,1,0,0,0,0,3,82.14
2025-10-11,945efc92-6e78-49d9-bc21-8ef1d2471fc4,Ads - Caps <> Spice,sponsored listing,2025-09-19,None,Weekly,5000.00,USD,97f406ae-2452-4364-9047-70a79ea745a1,All Customers - Afternoon,all,custom,MANUAL_SET_BIDDING,3.00,Bridge St,35060561,1,0,0.00,0.00,-0.00,-0.00,0.00,0.00,0.00,0,0,0,0,0,0,0,0,0,0.00
2025-10-11,945efc92-6e78-49d9-bc21-8ef1d2471fc4,Ads - Caps <> Spice,sponsored listing,2025-09-19,None,Weekly,5000.00,USD,97f406ae-2452-4364-9047-70a79ea745a1,All Customers - Afternoon,all,custom,MANUAL_SET_BIDDING,3.00,East Ridge Pike,1640642,1,0,0.00,0.00,-0.00,-0.00,0.00,0.00,0.00,0,0,0,0,0,0,0,0,0,0.00
2025-10-11,c15d8db7-7b8d-419b-aaf9-a7fe8914f715,Sponsored Listing 05/22/2025,sponsored listing,2025-05-22,None,Daily,1940.00,USD,7e1c2d6c-858c-47af-a75e-63f392710b94,,all,day,MANUAL_SET_BIDDING,5.00,Happy Valley,23584856,40,12,396.16,51.73,-0.00,-0.00,33.01,4.31,7.66,1,2,9,12,1,8,2,11,15,489.37
