Date,Campaign Id,Campaign Name,Campaign Type,Campaign Start Date,Campaign End Date,Budget Type,Budget,Ad Group Id,Ad Group Name,Daypart Targeted,Targeting Audience,Type of Promotion,Type of discount,Discount,Minimum Order Amount,Currency,Store Name,Store Id,Orders,Sales,Customer Discounts from Marketing | (Funded by you),Customer Discounts from Marketing | (Funded by DoorDash),Customer Discounts from Marketing | (Funded by a Third-party),Marketing Fees | (Including any applicable taxes),DoorDash Marketing Credit,Third-party Contribution,Average Order Value,Average cost of Order,ROAS,New Cx Acquired,Existing Cx Acquired,Lapsed Cx Acquired,Total Cx Acquired,New DashPass Cx Acquired,Existing DashPass Cx Acquired,Lapsed DashPass Cx Acquired,Total DashPass Cx Acquired
2025-10-12,02d2c45e-5b6f-4058-b05d-1fbcb475312e,"First order, 20% off 04/09/2025",promotion,2025-04-09,None,N/A,,,,,,,$ Off,0.00,0.00,USD,University Dr,29894178,1,21.58,4.32,0.00,0.00,0.99,-0.00,-0.00,21.58,5.31,4.06,1,0,0,1,0,0,0,0
2025-10-12,77e23ebd-6e10-4113-938c-bb55550710f5,Spice <> Capriotti's - Sep / Oct,promotion,2025-09-18,None,N/A,,ba37e4d8-36c4-4cbe-8c7d-f4d1379109bd,"Spend $15, Save $3 | Low price Sensitivity",day,all,Order Discount,$ Off,3.00,15.00,USD,"Marlton, NJ",35211042,3,149.34,9.00,0.00,0.00,2.97,-0.00,-0.00,49.78,3.99,12.48,2,1,0,3,1,1,0,2
2025-10-12,02d2c45e-5b6f-4058-b05d-1fbcb475312e,"First order, 20% off 04/09/2025",promotion,2025-04-09,None,N/A,,,,,,,$ Off,0.00,0.00,USD,Silverside Road,691182,1,16.89,3.38,0.00,0.00,0.99,-0.00,-0.00,16.89,4.37,3.86,1,0,0,1,1,0,0,1
2025-10-12,77e23ebd-6e10-4113-938c-bb55550710f5,Spice <> Capriotti's - Sep / Oct,promotion,2025-09-18,None,N/A,,43340528-e1b7-4f95-ab40-8dc92bf9c274,"Spend $35, Save $6 | High Price Sensitivity",day,all,Order Discount,$ Off,6.00,35.00,USD,West Basin Rd,575301,0,0.00,0.00,0.00,0.00,0.00,-0.00,-0.00,0.00,0.00,0.00,0,0,0,0,0,0,0,0
2025-10-12,b2e42382-0262-4b42-bbf3-d1a2efa87346,Happy Hour discount 09/24/2024,promotion,2024-09-24,None,N/A,,,,,,,$ Off,0.00,0.00,USD,Townpark Lane,128721,5,104.72,31.13,0.00,0.00,4.95,-0.00,-0.00,20.94,7.22,2.90,3,2,0,5,2,2,0,4
2025-10-12,77e23ebd-6e10-4113-938c-bb55550710f5,Spice <> Capriotti's - Sep / Oct,promotion,2025-09-18,None,N/A,,d1d0b263-4918-4c81-8c97-630471e7185b,10% Happy Hour Discount - Medium Price Sensitivity,day,all,Order Discount,% Off,10.0%,25.00,USD,Jennersville Rd,433075,0,0.00,0.00,0.00,0.00,0.00,-0.00,-0.00,0.00,0.00,0.00,0,0,0,0,0,0,0,0
2025-10-12,77e23ebd-6e10-4113-938c-bb55550710f5,Spice <> Capriotti's - Sep / Oct,promotion,2025-09-18,None,N/A,,f06f33c5-bff5-4bb3-8dda-6cedeb2e6fc1,10% Happy hour Discount - Min $30 | Low Price Sensitivity,day,all,Order Discount,% Off,7.0%,30.00,USD,Parker,24021312,2,70.93,4.97,0.00,0.00,1.98,-0.00,-0.00,35.47,3.48,10.21,0,1,1,2,0,1,1,2
2025-10-12,02d2c45e-5b6f-4058-b05d-1fbcb475312e,"First order, 20% off 04/09/2025",promotion,2025-04-09,None,N/A,,,,,,,$ Off,0.00,0.00,USD,Sahara & Las Vegas,75735,1,47.97,5.00,0.00,0.00,0.99,-0.00,-0.00,47.97,5.99,8.01,1,0,0,1,1,0,0,1
2025-10-12,77e23ebd-6e10-4113-938c-bb55550710f5,Spice <> Capriotti's - Sep / Oct,promotion,2025-09-18,None,N/A,,,,day,,,$ Off,0.00,0.00,USD,N Broad St,578662,0,0.00,0.00,0.00,0.00,0.00,-0.00,-0.00,0.00,0.00,0.00,0,0,0,0,0,0,0,0
2025-10-12,77e23ebd-6e10-4113-938c-bb55550710f5,Spice <> Capriotti's - Sep / Oct,promotion,2025-09-18,None,N/A,,43340528-e1b7-4f95-ab40-8dc92bf9c274,"Spend $35, Save $6 | High Price Sensitivity",day,all,Order Discount,$ Off,6.00,35.00,USD,College Station,23349412,0,0.00,0.00,0.00,0.00,0.00,-0.00,-0.00,0.00,0.00,0.00,0,0,0,0,0,0,0,0
2025-10-12,77e23ebd-6e10-4113-938c-bb55550710f5,Spice <> Capriotti's - Sep / Oct,promotion,2025-09-18,None,N/A,,43340528-e1b7-4f95-ab40-8dc92bf9c274,"Spend $35, Save $6 | High Price Sensitivity",day,all,Order Discount,$ Off,6.00,35.00,USD,Shepherd - Fresno,24559604,1,43.17,6.00,0.00,0.00,0.99,-0.00,-0.00,43.17,6.99,6.18,0,0,1,1,0,0,0,0
2025-10-12,77e23ebd-6e10-4113-938c-bb55550710f5,Spice <> Capriotti's - Sep / Oct,promotion,2025-09-18,None,N/A,,ba37e4d8-36c4-4cbe-8c7d-f4d1379109bd,"Spend $15, Save $3 | Low price Sensitivity",day,all,Order Discount,$ Off,3.00,15.00,USD,Cortez Rd  West,26034424,2,62.14,6.00,0.00,0.00,1.98,-0.00,-0.00,31.07,3.99,7.79,0,2,0,2,0,2,0,2
2025-10-12,77e23ebd-6e10-4113-938c-bb55550710f5,Spice <> Capriotti's - Sep / Oct,promotion,2025-09-18,None,N/A,,d1d0b263-4918-4c81-8c97-630471e7185b,10% Happy Hour Discount - Medium Price Sensitivity,day,all,Order Discount,% Off,10.0%,25.00,USD,East 82nd St,184537,0,0.00,0.00,0.00,0.00,0.00,-0.00,-0.00,0.00,0.00,0.00,0,0,0,0,0,0,0,0
2025-10-12,02d2c45e-5b6f-4058-b05d-1fbcb475312e,"First order, 20% off 04/09/2025",promotion,2025-04-09,None,N/A,,,,,,,$ Off,0.00,0.00,USD,West Basin Rd,575301,2,50.47,8.38,0.00,0.00,1.98,-0.00,-0.00,25.24,5.18,4.87,2,0,0,2,1,0,0,1
2025-10-12,77e23ebd-6e10-4113-938c-bb55550710f5,Spice <> Capriotti's - Sep / Oct,promotion,2025-09-18,None,N/A,,,,day,,,$ Off,0.00,0.00,USD,Castle Rock,23057614,0,0.00,0.00,0.00,0.00,0.00,-0.00,-0.00,0.00,0.00,0.00,0,0,0,0,0,0,0,0
2025-10-12,77e23ebd-6e10-4113-938c-bb55550710f5,Spice <> Capriotti's - Sep / Oct,promotion,2025-09-18,None,N/A,,d1d0b263-4918-4c81-8c97-630471e7185b,10% Happy Hour Discount - Medium Price Sensitivity,day,all,Order Discount,% Off,10.0%,25.00,USD,NE Cookingham Dr,23035356,0,0.00,0.00,0.00,0.00,0.00,-0.00,-0.00,0.00,0.00,0.00,0,0,0,0,0,0,0,0
2025-10-12,77e23ebd-6e10-4113-938c-bb55550710f5,Spice <> Capriotti's - Sep / Oct,promotion,2025-09-18,None,N/A,,d1d0b263-4918-4c81-8c97-630471e7185b,10% Happy Hour Discount - Medium Price Sensitivity,day,all,Order Discount,% Off,10.0%,25.00,USD,De Soto-Chatsworth,651597,0,0.00,0.00,0.00,0.00,0.00,-0.00,-0.00,0.00,0.00,0.00,0,0,0,0,0,0,0,0
2025-10-12,77e23ebd-6e10-4113-938c-bb55550710f5,Spice <> Capriotti's - Sep / Oct,promotion,2025-09-18,None,N/A,,d1d0b263-4918-4c81-8c97-630471e7185b,10% Happy Hour Discount - Medium Price Sensitivity,day,all,Order Discount,% Off,10.0%,25.00,USD,West Craig Road,75727,1,34.36,3.44,0.00,0.00,0.99,-0.00,-0.00,34.36,4.43,7.76,0,1,0,1,0,0,0,0
2025-10-12,77e23ebd-6e10-4113-938c-bb55550710f5,Spice <> Capriotti's - Sep / Oct,promotion,2025-09-18,None,N/A,,ba37e4d8-36c4-4cbe-8c7d-f4d1379109bd,"Spend $15, Save $3 | Low price Sensitivity",day,all,Order Discount,$ Off,3.00,15.00,USD,Castle Rock,23057614,3,112.17,9.00,0.00,0.00,2.97,-0.00,-0.00,37.39,3.99,9.37,0,2,1,3,0,1,1,2
2025-10-12,77e23ebd-6e10-4113-938c-bb55550710f5,Spice <> Capriotti's - Sep / Oct,promotion,2025-09-18,None,N/A,,f06f33c5-bff5-4bb3-8dda-6cedeb2e6fc1,10% Happy hour Discount - Min $30 | Low Price Sensitivity,day,all,Order Discount,% Off,7.0%,30.00,USD,Gambrills,24415514,0,0.00,0.00,0.00,0.00,0.00,-0.00,-0.00,0.00,0.00,0.00,0,0,0,0,0,0,0,0
2025-10-12,77e23ebd-6e10-4113-938c-bb55550710f5,Spice <> Capriotti's - Sep / Oct,promotion,2025-09-18,None,N/A,,f06f33c5-bff5-4bb3-8dda-6cedeb2e6fc1,10% Happy hour Discount - Min $30 | Low Price Sensitivity,day,all,Order Discount,% Off,7.0%,30.00,USD,GVR Casino,75749,0,0.00,0.00,0.00,0.00,0.00,-0.00,-0.00,0.00,0.00,0.00,0,0,0,0,0,0,0,0
2025-10-12,77e23ebd-6e10-4113-938c-bb55550710f5,Spice <> Capriotti's - Sep / Oct,promotion,2025-09-18,None,N/A,,d1d0b263-4918-4c81-8c97-630471e7185b,10% Happy Hour Discount - Medium Price Sensitivity,day,all,Order Discount,% Off,10.0%,25.00,USD,E Silverado Ranch,75746,0,0.00,0.00,0.00,0.00,0.00,-0.00,-0.00,0.00,0.00,0.00,0,0,0,0,0,0,0,0
2025-10-12,77e23ebd-6e10-4113-938c-bb55550710f5,Spice <> Capriotti's - Sep / Oct,promotion,2025-09-18,None,N/A,,d1d0b263-4918-4c81-8c97-630471e7185b,10% Happy Hour Discount - Medium Price Sensitivity,day,all,Order Discount,% Off,10.0%,25.00,USD,East Ridge Pike,1640642,7,291.92,26.43,0.00,0.00,6.93,-0.00,-0.00,41.70,4.77,8.75,0,6,1,7,0,4,1,5
2025-10-12,77e23ebd-6e10-4113-938c-bb55550710f5,Spice <> Capriotti's - Sep / Oct,promotion,2025-09-18,None,N/A,,43340528-e1b7-4f95-ab40-8dc92bf9c274,"Spend $35, Save $6 | High Price Sensitivity",day,all,Order Discount,$ Off,6.00,35.00,USD,North Union St,575293,0,0.00,0.00,0.00,0.00,0.00,-0.00,-0.00,0.00,0.00,0.00,0,0,0,0,0,0,0,0
2025-10-12,178f54dc-804b-413e-b1bd-ffbdde7f61a1,"Dormant customers, 20% off 02/01/2025",promotion,2025-02-01,None,N/A,,,,,,,$ Off,0.00,0.00,USD,East Sepulveda,1743753,1,19.19,3.84,0.00,0.00,0.99,-0.00,-0.00,19.19,4.83,3.97,0,0,1,1,0,0,0,0
2025-10-12,77e23ebd-6e10-4113-938c-bb55550710f5,Spice <> Capriotti's - Sep / Oct,promotion,2025-09-18,None,N/A,,f06f33c5-bff5-4bb3-8dda-6cedeb2e6fc1,10% Happy hour Discount - Min $30 | Low Price Sensitivity,day,all,Order Discount,% Off,7.0%,30.00,USD,University Ave,1084955,1,30.97,2.17,0.00,0.00,0.99,-0.00,-0.00,30.97,3.16,9.80,0,0,1,1,0,0,1,1
2025-10-12,77e23ebd-6e10-4113-938c-bb55550710f5,Spice <> Capriotti's - Sep / Oct,promotion,2025-09-18,None,N/A,,f06f33c5-bff5-4bb3-8dda-6cedeb2e6fc1,10% Happy hour Discount - Min $30 | Low Price Sensitivity,day,all,Order Discount,% Off,7.0%,30.00,USD,Smithtown Bypass,23349427,0,0.00,0.00,0.00,0.00,0.00,-0.00,-0.00,0.00,0.00,0.00,0,0,0,0,0,0,0,0
2025-10-12,77e23ebd-6e10-4113-938c-bb55550710f5,Spice <> Capriotti's - Sep / Oct,promotion,2025-09-18,None,N/A,,d1d0b263-4918-4c81-8c97-630471e7185b,10% Happy Hour Discount - Medium Price Sensitivity,day,all,Order Discount,% Off,10.0%,25.00,USD,East Craig Road,75739,0,0.00,0.00,0.00,0.00,0.00,-0.00,-0.00,0.00,0.00,0.00,0,0,0,0,0,0,0,0
2025-10-12,77e23ebd-6e10-4113-938c-bb55550710f5,Spice <> Capriotti's - Sep / Oct,promotion,2025-09-18,None,N/A,,d1d0b263-4918-4c81-8c97-630471e7185b,10% Happy Hour Discount - Medium Price Sensitivity,day,all,Order Discount,% Off,10.0%,25.00,USD,Santa Fe Station,75723,0,0.00,0.00,0.00,0.00,0.00,-0.00,-0.00,0.00,0.00,0.00,0,0,0,0,0,0,0,0
2025-10-12,77e23ebd-6e10-4113-938c-bb55550710f5,Spice <> Capriotti's - Sep / Oct,promotion,2025-09-18,None,N/A,,,,day,,,$ Off,0.00,0.00,USD,College Station,23349412,0,0.00,0.00,0.00,0.00,0.00,-0.00,-0.00,0.00,0.00,0.00,0,0,0,0,0,0,0,0
2025-10-12,77e23ebd-6e10-4113-938c-bb55550710f5,Spice <> Capriotti's - Sep / Oct,promotion,2025-09-18,None,N/A,,d1d0b263-4918-4c81-8c97-630471e7185b,10% Happy Hour Discount - Medium Price Sensitivity,day,all,Order Discount,% Off,10.0%,25.00,USD,W Blue Diamond Rd,75738,3,159.22,13.86,0.00,0.00,2.97,-0.00,-0.00,53.07,5.61,9.46,0,2,1,3,0,2,1,3
2025-10-12,77e23ebd-6e10-4113-938c-bb55550710f5,Spice <> Capriotti's - Sep / Oct,promotion,2025-09-18,None,N/A,,43340528-e1b7-4f95-ab40-8dc92bf9c274,"Spend $35, Save $6 | High Price Sensitivity",day,all,Order Discount,$ Off,6.00,35.00,USD,South  Walton Blvd,1616214,1,47.27,6.00,0.00,0.00,0.99,-0.00,-0.00,47.27,6.99,6.76,0,1,0,1,0,1,0,1
2025-10-12,77e23ebd-6e10-4113-938c-bb55550710f5,Spice <> Capriotti's - Sep / Oct,promotion,2025-09-18,None,N/A,,,,day,,,$ Off,0.00,0.00,USD,Smithtown Bypass,23349427,0,0.00,0.00,0.00,0.00,0.00,-0.00,-0.00,0.00,0.00,0.00,0,0,0,0,0,0,0,0
2025-10-12,77e23ebd-6e10-4113-938c-bb55550710f5,Spice <> Capriotti's - Sep / Oct,promotion,2025-09-18,None,N/A,,,,day,,,$ Off,0.00,0.00,USD,Brayden Pkwy,2375657,0,0.00,0.00,0.00,0.00,0.00,-0.00,-0.00,0.00,0.00,0.00,0,0,0,0,0,0,0,0
2025-10-12,77e23ebd-6e10-4113-938c-bb55550710f5,Spice <> Capriotti's - Sep / Oct,promotion,2025-09-18,None,N/A,,43340528-e1b7-4f95-ab40-8dc92bf9c274,"Spend $35, Save $6 | High Price Sensitivity",day,all,Order Discount,$ Off,6.00,35.00,USD,Coeur d'Alene,23085790,0,0.00,0.00,0.00,0.00,0.00,-0.00,-0.00,0.00,0.00,0.00,0,0,0,0,0,0,0,0
2025-10-12,77e23ebd-6e10-4113-938c-bb55550710f5,Spice <> Capriotti's - Sep / Oct,promotion,2025-09-18,None,N/A,,d1d0b263-4918-4c81-8c97-630471e7185b,10% Happy Hour Discount - Medium Price Sensitivity,day,all,Order Discount,% Off,10.0%,25.00,USD,North Town Center,75721,0,0.00,0.00,0.00,0.00,0.00,-0.00,-0.00,0.00,0.00,0.00,0,0,0,0,0,0,0,0
2025-10-12,77e23ebd-6e10-4113-938c-bb55550710f5,Spice <> Capriotti's - Sep / Oct,promotion,2025-09-18,None,N/A,,,,day,,,$ Off,0.00,0.00,USD,Chicago River West,34048823,0,0.00,0.00,0.00,0.00,0.00,-0.00,-0.00,0.00,0.00,0.00,0,0,0,0,0,0,0,0
2025-10-12,02d2c45e-5b6f-4058-b05d-1fbcb475312e,"First order, 20% off 04/09/2025",promotion,2025-04-09,None,N/A,,,,,,,$ Off,0.00,0.00,USD,Sierra Hwy,27476315,0,0.00,0.00,0.00,0.00,0.00,-0.00,-0.00,0.00,0.00,0.00,0,0,0,0,0,0,0,0
2025-10-12,77e23ebd-6e10-4113-938c-bb55550710f5,Spice <> Capriotti's - Sep / Oct,promotion,2025-09-18,None,N/A,,91f90d8c-8a7d-41cf-9b6a-888400112024,10% Happy Hour Discount - Min  $25 | High Price Sensitivity,day,all,Order Discount,% Off,10.0%,25.00,USD,College Station,23349412,1,29.94,2.99,0.00,0.00,0.99,-0.00,-0.00,29.94,3.98,7.52,0,1,0,1,0,1,0,1
2025-10-12,77e23ebd-6e10-4113-938c-bb55550710f5,Spice <> Capriotti's - Sep / Oct,promotion,2025-09-18,None,N/A,,f06f33c5-bff5-4bb3-8dda-6cedeb2e6fc1,10% Happy hour Discount - Min $30 | Low Price Sensitivity,day,all,Order Discount,% Off,7.0%,30.00,USD,N Broad St,578662,4,166.99,11.68,0.00,0.00,3.96,-0.00,-0.00,41.75,3.91,10.68,0,4,0,4,0,4,0,4
2025-10-12,77e23ebd-6e10-4113-938c-bb55550710f5,Spice <> Capriotti's - Sep / Oct,promotion,2025-09-18,None,N/A,,d1d0b263-4918-4c81-8c97-630471e7185b,10% Happy Hour Discount - Medium Price Sensitivity,day,all,Order Discount,% Off,10.0%,25.00,USD,Marlboro - Easton,674514,1,25.37,2.54,0.00,0.00,0.99,-0.00,-0.00,25.37,3.53,7.19,0,1,0,1,0,1,0,1
2025-10-12,77e23ebd-6e10-4113-938c-bb55550710f5,Spice <> Capriotti's - Sep / Oct,promotion,2025-09-18,None,N/A,,,,day,,,$ Off,0.00,0.00,USD,The Old Road,24898774,0,0.00,0.00,0.00,0.00,0.00,-0.00,-0.00,0.00,0.00,0.00,0,0,0,0,0,0,0,0
2025-10-12,77e23ebd-6e10-4113-938c-bb55550710f5,Spice <> Capriotti's - Sep / Oct,promotion,2025-09-18,None,N/A,,d1d0b263-4918-4c81-8c97-630471e7185b,10% Happy Hour Discount - Medium Price Sensitivity,day,all,Order Discount,% Off,10.0%,25.00,USD,Moreno Beach Drive,23085788,1,31.78,3.18,0.00,0.00,0.99,-0.00,-0.00,31.78,4.17,7.62,0,1,0,1,0,1,0,1
2025-10-12,77e23ebd-6e10-4113-938c-bb55550710f5,Spice <> Capriotti's - Sep / Oct,promotion,2025-09-18,None,N/A,,,,day,,,$ Off,0.00,0.00,USD,Old Town,27964,0,0.00,0.00,0.00,0.00,0.00,-0.00,-0.00,0.00,0.00,0.00,0,0,0,0,0,0,0,0
2025-10-12,77e23ebd-6e10-4113-938c-bb55550710f5,Spice <> Capriotti's - Sep / Oct,promotion,2025-09-18,None,N/A,,d1d0b263-4918-4c81-8c97-630471e7185b,10% Happy Hour Discount - Medium Price Sensitivity,day,all,Order Discount,% Off,10.0%,25.00,USD,Dana Park - Mesa,126177,2,86.96,7.62,0.00,0.00,1.98,-0.00,-0.00,43.48,4.80,9.06,0,2,0,2,0,2,0,2
2025-10-12,02d2c45e-5b6f-4058-b05d-1fbcb475312e,"First order, 20% off 04/09/2025",promotion,2025-04-09,None,N/A,,,,,,,$ Off,0.00,0.00,USD,NE Cookingham Dr,23035356,1,19.28,3.86,0.00,0.00,0.99,-0.00,-0.00,19.28,4.85,3.98,1,0,0,1,0,0,0,0
2025-10-12,77e23ebd-6e10-4113-938c-bb55550710f5,Spice <> Capriotti's - Sep / Oct,promotion,2025-09-18,None,N/A,,f06f33c5-bff5-4bb3-8dda-6cedeb2e6fc1,10% Happy hour Discount - Min $30 | Low Price Sensitivity,day,all,Order Discount,% Off,7.0%,30.00,USD,Byers Dr,23186665,0,0.00,0.00,0.00,0.00,0.00,-0.00,-0.00,0.00,0.00,0.00,0,0,0,0,0,0,0,0
2025-10-12,77e23ebd-6e10-4113-938c-bb55550710f5,Spice <> Capriotti's - Sep / Oct,promotion,2025-09-18,None,N/A,,43340528-e1b7-4f95-ab40-8dc92bf9c274,"Spend $35, Save $6 | High Price Sensitivity",day,all,Order Discount,$ Off,6.00,35.00,USD,Millsboro Plaza,23360934,0,0.00,0.00,0.00,0.00,0.00,-0.00,-0.00,0.00,0.00,0.00,0,0,0,0,0,0,0,0
2025-10-12,77e23ebd-6e10-4113-938c-bb55550710f5,Spice <> Capriotti's - Sep / Oct,promotion,2025-09-18,None,N/A,,d1d0b263-4918-4c81-8c97-630471e7185b,10% Happy Hour Discount - Medium Price Sensitivity,day,all,Order Discount,% Off,10.0%,25.00,USD,Sahara & Las Vegas,75735,0,0.00,0.00,0.00,0.00,0.00,-0.00,-0.00,0.00,0.00,0.00,0,0,0,0,0,0,0,0
2025-10-12,77e23ebd-6e10-4113-938c-bb55550710f5,Spice <> Capriotti's - Sep / Oct,promotion,2025-09-18,None,N/A,,,,day,,,$ Off,0.00,0.00,USD,Murrieta Hot Springs Rd,29652192,0,0.00,0.00,0.00,0.00,0.00,-0.00,-0.00,0.00,0.00,0.00,0,0,0,0,0,0,0,0
2025-10-12,77e23ebd-6e10-4113-938c-bb55550710f5,Spice <> Capriotti's - Sep / Oct,promotion,2025-09-18,None,N/A,,91f90d8c-8a7d-41cf-9b6a-888400112024,10% Happy Hour Discount - Min  $25 | High Price Sensitivity,day,all,Order Discount,% Off,10.0%,25.00,USD,Millsboro Plaza,23360934,0,0.00,0.00,0.00,0.00,0.00,-0.00,-0.00,0.00,0.00,0.00,0,0,0,0,0,0,0,0
2025-10-12,77e23ebd-6e10-4113-938c-bb55550710f5,Spice <> Capriotti's - Sep / Oct,promotion,2025-09-18,None,N/A,,d1d0b263-4918-4c81-8c97-630471e7185b,10% Happy Hour Discount - Medium Price Sensitivity,day,all,Order Discount,% Off,10.0%,25.00,USD,Paradise Road,75734,0,0.00,0.00,0.00,0.00,0.00,-0.00,-0.00,0.00,0.00,0.00,0,0,0,0,0,0,0,0
2025-10-12,77e23ebd-6e10-4113-938c-bb55550710f5,Spice <> Capriotti's - Sep / Oct,promotion,2025-09-18,None,N/A,,,,day,,,$ Off,0.00,0.00,USD,North Union St,575293,0,0.00,0.00,0.00,0.00,0.00,-0.00,-0.00,0.00,0.00,0.00,0,0,0,0,0,0,0,0
2025-10-12,77e23ebd-6e10-4113-938c-bb55550710f5,Spice <> Capriotti's - Sep / Oct,promotion,2025-09-18,None,N/A,,43340528-e1b7-4f95-ab40-8dc92bf9c274,"Spend $35, Save $6 | High Price Sensitivity",day,all,Order Discount,$ Off,6.00,35.00,USD,Niles Cortland Rd SE,34043935,4,210.74,24.00,0.00,0.00,3.96,-0.00,-0.00,52.69,6.99,7.54,3,1,0,4,2,1,0,3
2025-10-12,77e23ebd-6e10-4113-938c-bb55550710f5,Spice <> Capriotti's - Sep / Oct,promotion,2025-09-18,None,N/A,,d1d0b263-4918-4c81-8c97-630471e7185b,10% Happy Hour Discount - Medium Price Sensitivity,day,all,Order Discount,% Off,10.0%,25.00,USD,Main Street - Anoka,34494893,2,89.10,8.92,0.00,0.00,1.98,-0.00,-0.00,44.55,5.45,8.17,1,1,0,2,0,0,0,0
2025-10-12,77e23ebd-6e10-4113-938c-bb55550710f5,Spice <> Capriotti's - Sep / Oct,promotion,2025-09-18,None,N/A,,f06f33c5-bff5-4bb3-8dda-6cedeb2e6fc1,10% Happy hour Discount - Min $30 | Low Price Sensitivity,day,all,Order Discount,% Off,7.0%,30.00,USD,Rancho Mirage,32864869,3,168.62,9.95,0.00,0.00,2.97,-0.00,-0.00,56.21,4.31,13.05,0,2,1,3,0,2,1,3
2025-10-12,77e23ebd-6e10-4113-938c-bb55550710f5,Spice <> Capriotti's - Sep / Oct,promotion,2025-09-18,None,N/A,,,,day,,,$ Off,0.00,0.00,USD,Overland Park,24110474,0,0.00,0.00,0.00,0.00,0.00,-0.00,-0.00,0.00,0.00,0.00,0,0,0,0,0,0,0,0
2025-10-12,77e23ebd-6e10-4113-938c-bb55550710f5,Spice <> Capriotti's - Sep / Oct,promotion,2025-09-18,None,N/A,,f06f33c5-bff5-4bb3-8dda-6cedeb2e6fc1,10% Happy hour Discount - Min $30 | Low Price Sensitivity,day,all,Order Discount,% Off,7.0%,30.00,USD,Brayden Pkwy,2375657,0,0.00,0.00,0.00,0.00,0.00,-0.00,-0.00,0.00,0.00,0.00,0,0,0,0,0,0,0,0
2025-10-12,77e23ebd-6e10-4113-938c-bb55550710f5,Spice <> Capriotti's - Sep / Oct,promotion,2025-09-18,None,N/A,,d1d0b263-4918-4c81-8c97-630471e7185b,10% Happy Hour Discount - Medium Price Sensitivity,day,all,Order Discount,% Off,10.0%,25.00,USD,Bridge St,35060561,3,107.91,10.80,0.00,0.00,2.97,-0.00,-0.00,35.97,4.59,7.84,2,1,0,3,0,1,0,1
2025-10-12,77e23ebd-6e10-4113-938c-bb55550710f5,Spice <> Capriotti's - Sep / Oct,promotion,2025-09-18,None,N/A,,f06f33c5-bff5-4bb3-8dda-6cedeb2e6fc1,10% Happy hour Discount - Min $30 | Low Price Sensitivity,day,all,Order Discount,% Off,7.0%,30.00,USD,Douglas Blvd,1018616,1,44.37,3.11,0.00,0.00,0.99,-0.00,-0.00,44.37,4.10,10.82,0,1,0,1,0,1,0,1
2025-10-12,77e23ebd-6e10-4113-938c-bb55550710f5,Spice <> Capriotti's - Sep / Oct,promotion,2025-09-18,None,N/A,,ba37e4d8-36c4-4cbe-8c7d-f4d1379109bd,"Spend $15, Save $3 | Low price Sensitivity",day,all,Order Discount,$ Off,3.00,15.00,USD,Bel Air,23733193,0,0.00,0.00,0.00,0.00,0.00,-0.00,-0.00,0.00,0.00,0.00,0,0,0,0,0,0,0,0
2025-10-12,77e23ebd-6e10-4113-938c-bb55550710f5,Spice <> Capriotti's - Sep / Oct,promotion,2025-09-18,None,N/A,,d1d0b263-4918-4c81-8c97-630471e7185b,10% Happy Hour Discount - Medium Price Sensitivity,day,all,Order Discount,% Off,10.0%,25.00,USD,E Robindale Road,27815740,0,0.00,0.00,0.00,0.00,0.00,-0.00,-0.00,0.00,0.00,0.00,0,0,0,0,0,0,0,0
2025-10-12,77e23ebd-6e10-4113-938c-bb55550710f5,Spice <> Capriotti's - Sep / Oct,promotion,2025-09-18,None,N/A,,ba37e4d8-36c4-4cbe-8c7d-f4d1379109bd,"Spend $15, Save $3 | Low price Sensitivity",day,all,Order Discount,$ Off,3.00,15.00,USD,South State Rd,1713806,6,172.42,18.00,0.00,0.00,5.94,-0.00,-0.00,28.74,3.99,7.20,0,5,1,6,0,4,1,5
2025-10-12,77e23ebd-6e10-4113-938c-bb55550710f5,Spice <> Capriotti's - Sep / Oct,promotion,2025-09-18,None,N/A,,91f90d8c-8a7d-41cf-9b6a-888400112024,10% Happy Hour Discount - Min  $25 | High Price Sensitivity,day,all,Order Discount,% Off,10.0%,25.00,USD,Catclaw - Abilene,29652227,1,29.38,2.94,0.00,0.00,0.99,-0.00,-0.00,29.38,3.93,7.48,0,1,0,1,0,0,0,0
2025-10-12,77e23ebd-6e10-4113-938c-bb55550710f5,Spice <> Capriotti's - Sep / Oct,promotion,2025-09-18,None,N/A,,d1d0b263-4918-4c81-8c97-630471e7185b,10% Happy Hour Discount - Medium Price Sensitivity,day,all,Order Discount,% Off,10.0%,25.00,USD,E William Street,1053361,2,89.95,8.36,0.00,0.00,1.98,-0.00,-0.00,44.98,5.17,8.70,0,2,0,2,0,0,0,0
2025-10-12,77e23ebd-6e10-4113-938c-bb55550710f5,Spice <> Capriotti's - Sep / Oct,promotion,2025-09-18,None,N/A,,f06f33c5-bff5-4bb3-8dda-6cedeb2e6fc1,10% Happy hour Discount - Min $30 | Low Price Sensitivity,day,all,Order Discount,% Off,7.0%,30.00,USD,Raccoon Rd,26015022,10,490.88,33.71,0.00,0.00,9.90,-0.00,-0.00,49.09,4.36,11.26,3,6,1,10,3,5,1,9
2025-10-12,77e23ebd-6e10-4113-938c-bb55550710f5,Spice <> Capriotti's - Sep / Oct,promotion,2025-09-18,None,N/A,,43340528-e1b7-4f95-ab40-8dc92bf9c274,"Spend $35, Save $6 | High Price Sensitivity",day,all,Order Discount,$ Off,6.00,35.00,USD,Broadway - Tucson,27829895,1,111.86,6.00,0.00,0.00,0.99,-0.00,-0.00,111.86,6.99,16.00,0,1,0,1,0,1,0,1
2025-10-12,77e23ebd-6e10-4113-938c-bb55550710f5,Spice <> Capriotti's - Sep / Oct,promotion,2025-09-18,None,N/A,,f06f33c5-bff5-4bb3-8dda-6cedeb2e6fc1,10% Happy hour Discount - Min $30 | Low Price Sensitivity,day,all,Order Discount,% Off,7.0%,30.00,USD,Stephanie St,75751,1,37.27,2.61,0.00,0.00,0.99,-0.00,-0.00,37.27,3.60,10.35,0,1,0,1,0,1,0,1
2025-10-12,77e23ebd-6e10-4113-938c-bb55550710f5,Spice <> Capriotti's - Sep / Oct,promotion,2025-09-18,None,N/A,,f06f33c5-bff5-4bb3-8dda-6cedeb2e6fc1,10% Happy hour Discount - Min $30 | Low Price Sensitivity,day,all,Order Discount,% Off,7.0%,30.00,USD,Overland Park,24110474,3,101.09,7.08,0.00,0.00,2.97,-0.00,-0.00,33.70,3.35,10.06,0,2,1,3,0,2,0,2
2025-10-12,77e23ebd-6e10-4113-938c-bb55550710f5,Spice <> Capriotti's - Sep / Oct,promotion,2025-09-18,None,N/A,,ba37e4d8-36c4-4cbe-8c7d-f4d1379109bd,"Spend $15, Save $3 | Low price Sensitivity",day,all,Order Discount,$ Off,3.00,15.00,USD,Overland Park,24110474,3,64.91,9.00,0.00,0.00,2.97,-0.00,-0.00,21.64,3.99,5.42,0,3,0,3,0,2,0,2
2025-10-12,77e23ebd-6e10-4113-938c-bb55550710f5,Spice <> Capriotti's - Sep / Oct,promotion,2025-09-18,None,N/A,,,,day,,,$ Off,0.00,0.00,USD,E 53rd - Davenport,582282,0,0.00,0.00,0.00,0.00,0.00,-0.00,-0.00,0.00,0.00,0.00,0,0,0,0,0,0,0,0
2025-10-12,77e23ebd-6e10-4113-938c-bb55550710f5,Spice <> Capriotti's - Sep / Oct,promotion,2025-09-18,None,N/A,,,,day,,,$ Off,0.00,0.00,USD,Arapahoe Rd,23349425,0,0.00,0.00,0.00,0.00,0.00,-0.00,-0.00,0.00,0.00,0.00,0,0,0,0,0,0,0,0
2025-10-12,77e23ebd-6e10-4113-938c-bb55550710f5,Spice <> Capriotti's - Sep / Oct,promotion,2025-09-18,None,N/A,,f06f33c5-bff5-4bb3-8dda-6cedeb2e6fc1,10% Happy hour Discount - Min $30 | Low Price Sensitivity,day,all,Order Discount,% Off,7.0%,30.00,USD,Collier Pkwy-Lutz,23057623,0,0.00,0.00,0.00,0.00,0.00,-0.00,-0.00,0.00,0.00,0.00,0,0,0,0,0,0,0,0
2025-10-12,77e23ebd-6e10-4113-938c-bb55550710f5,Spice <> Capriotti's - Sep / Oct,promotion,2025-09-18,None,N/A,,d1d0b263-4918-4c81-8c97-630471e7185b,10% Happy Hour Discount - Medium Price Sensitivity,day,all,Order Discount,% Off,10.0%,25.00,USD,West Cheyenne Ave,75722,2,56.54,5.66,0.00,0.00,1.98,-0.00,-0.00,28.27,3.82,7.40,0,2,0,2,0,2,0,2
2025-10-12,77e23ebd-6e10-4113-938c-bb55550710f5,Spice <> Capriotti's - Sep / Oct,promotion,2025-09-18,None,N/A,,d1d0b263-4918-4c81-8c97-630471e7185b,10% Happy Hour Discount - Medium Price Sensitivity,day,all,Order Discount,% Off,10.0%,25.00,USD,Grand Ave-Portland,1370229,1,27.08,2.71,0.00,0.00,0.99,-0.00,-0.00,27.08,3.70,7.32,0,0,1,1,0,0,0,0
2025-10-12,77e23ebd-6e10-4113-938c-bb55550710f5,Spice <> Capriotti's - Sep / Oct,promotion,2025-09-18,None,N/A,,f06f33c5-bff5-4bb3-8dda-6cedeb2e6fc1,10% Happy hour Discount - Min $30 | Low Price Sensitivity,day,all,Order Discount,% Off,7.0%,30.00,USD,Limonite Ave,2375675,2,76.34,5.34,0.00,0.00,1.98,-0.00,-0.00,38.17,3.66,10.43,0,0,2,2,0,0,2,2
2025-10-12,77e23ebd-6e10-4113-938c-bb55550710f5,Spice <> Capriotti's - Sep / Oct,promotion,2025-09-18,None,N/A,,d1d0b263-4918-4c81-8c97-630471e7185b,10% Happy Hour Discount - Medium Price Sensitivity,day,all,Order Discount,% Off,10.0%,25.00,USD,Highbrook Way,33551695,1,30.76,3.08,0.00,0.00,0.99,-0.00,-0.00,30.76,4.07,7.56,0,1,0,1,0,0,0,0
2025-10-12,77e23ebd-6e10-4113-938c-bb55550710f5,Spice <> Capriotti's - Sep / Oct,promotion,2025-09-18,None,N/A,,d1d0b263-4918-4c81-8c97-630471e7185b,10% Happy Hour Discount - Medium Price Sensitivity,day,all,Order Discount,% Off,10.0%,25.00,USD,Red Cliff Dr,578425,2,57.04,5.71,0.00,0.00,1.98,-0.00,-0.00,28.52,3.85,7.42,0,2,0,2,0,1,0,1
2025-10-12,77e23ebd-6e10-4113-938c-bb55550710f5,Spice <> Capriotti's - Sep / Oct,promotion,2025-09-18,None,N/A,,ba37e4d8-36c4-4cbe-8c7d-f4d1379109bd,"Spend $15, Save $3 | Low price Sensitivity",day,all,Order Discount,$ Off,3.00,15.00,USD,Murrieta Hot Springs Rd,29652192,1,40.07,3.00,0.00,0.00,0.99,-0.00,-0.00,40.07,3.99,10.04,0,1,0,1,0,1,0,1
2025-10-12,77e23ebd-6e10-4113-938c-bb55550710f5,Spice <> Capriotti's - Sep / Oct,promotion,2025-09-18,None,N/A,,ba37e4d8-36c4-4cbe-8c7d-f4d1379109bd,"Spend $15, Save $3 | Low price Sensitivity",day,all,Order Discount,$ Off,3.00,15.00,USD,Downingtown,33699763,6,179.18,18.00,0.00,0.00,5.94,-0.00,-0.00,29.86,3.99,7.48,0,5,1,6,0,2,1,3
2025-10-12,77e23ebd-6e10-4113-938c-bb55550710f5,Spice <> Capriotti's - Sep / Oct,promotion,2025-09-18,None,N/A,,,,day,,,$ Off,0.00,0.00,USD,Millsboro Plaza,23360934,0,0.00,0.00,0.00,0.00,0.00,-0.00,-0.00,0.00,0.00,0.00,0,0,0,0,0,0,0,0
2025-10-12,77e23ebd-6e10-4113-938c-bb55550710f5,Spice <> Capriotti's - Sep / Oct,promotion,2025-09-18,None,N/A,,f06f33c5-bff5-4bb3-8dda-6cedeb2e6fc1,10% Happy hour Discount - Min $30 | Low Price Sensitivity,day,all,Order Discount,% Off,7.0%,30.00,USD,St Rose Pkwy,1335286,0,0.00,0.00,0.00,0.00,0.00,-0.00,-0.00,0.00,0.00,0.00,0,0,0,0,0,0,0,0
2025-10-12,77e23ebd-6e10-4113-938c-bb55550710f5,Spice <> Capriotti's - Sep / Oct,promotion,2025-09-18,None,N/A,,d1d0b263-4918-4c81-8c97-630471e7185b,10% Happy Hour Discount - Medium Price Sensitivity,day,all,Order Discount,% Off,10.0%,25.00,USD,West Sahara Avenue,424852,1,29.49,2.95,0.00,0.00,0.99,-0.00,-0.00,29.49,3.94,7.48,0,1,0,1,0,1,0,1
2025-10-12,77e23ebd-6e10-4113-938c-bb55550710f5,Spice <> Capriotti's - Sep / Oct,promotion,2025-09-18,None,N/A,,d1d0b263-4918-4c81-8c97-630471e7185b,10% Happy Hour Discount - Medium Price Sensitivity,day,all,Order Discount,% Off,10.0%,25.00,USD,S Marion Road,1742411,0,0.00,0.00,0.00,0.00,0.00,-0.00,-0.00,0.00,0.00,0.00,0,0,0,0,0,0,0,0
2025-10-12,77e23ebd-6e10-4113-938c-bb55550710f5,Spice <> Capriotti's - Sep / Oct,promotion,2025-09-18,None,N/A,,f06f33c5-bff5-4bb3-8dda-6cedeb2e6fc1,10% Happy hour Discount - Min $30 | Low Price Sensitivity,day,all,Order Discount,% Off,7.0%,30.00,USD,Anthem,75750,2,112.43,7.48,0.00,0.00,1.98,-0.00,-0.00,56.22,4.73,11.88,0,1,1,2,0,0,0,0
2025-10-12,77e23ebd-6e10-4113-938c-bb55550710f5,Spice <> Capriotti's - Sep / Oct,promotion,2025-09-18,None,N/A,,ba37e4d8-36c4-4cbe-8c7d-f4d1379109bd,"Spend $15, Save $3 | Low price Sensitivity",day,all,Order Discount,$ Off,3.00,15.00,USD,Parker,24021312,3,102.34,9.00,0.00,0.00,2.97,-0.00,-0.00,34.11,3.99,8.55,0,1,1,2,0,0,1,1
2025-10-12,77e23ebd-6e10-4113-938c-bb55550710f5,Spice <> Capriotti's - Sep / Oct,promotion,2025-09-18,None,N/A,,,,day,,,$ Off,0.00,0.00,USD,Niles Cortland Rd SE,34043935,0,0.00,0.00,0.00,0.00,0.00,-0.00,-0.00,0.00,0.00,0.00,0,0,0,0,0,0,0,0
2025-10-12,77e23ebd-6e10-4113-938c-bb55550710f5,Spice <> Capriotti's - Sep / Oct,promotion,2025-09-18,None,N/A,,,,day,,,$ Off,0.00,0.00,USD,Silverside Road,691182,0,0.00,0.00,0.00,0.00,0.00,-0.00,-0.00,0.00,0.00,0.00,0,0,0,0,0,0,0,0
2025-10-12,02d2c45e-5b6f-4058-b05d-1fbcb475312e,"First order, 20% off 04/09/2025",promotion,2025-04-09,None,N/A,,,,,,,$ Off,0.00,0.00,USD,Bidwell - Folsom,26234909,0,0.00,0.00,0.00,0.00,0.00,-0.00,-0.00,0.00,0.00,0.00,0,0,0,0,0,0,0,0
2025-10-12,22011977-85b1-4624-ad97-926f3ebe49f4,Happy Hour discount 07/09/2025,promotion,2025-07-09,None,N/A,,,,,,,$ Off,0.00,0.00,USD,Niles Cortland Rd SE,34043935,7,242.07,44.33,0.00,0.00,6.93,-0.00,-0.00,34.58,7.32,4.72,3,4,0,7,2,4,0,6
2025-10-12,a82d49b2-a34a-4ce3-aa26-2a1d94c385eb,"All customers, $0 delivery fees 04/07/2025",promotion,2025-04-07,None,N/A,,,,,,,$ Off,0.00,0.00,USD,East Market Street,23256727,1,31.94,3.99,0.00,0.00,1.00,-0.00,-0.00,31.94,4.99,6.40,0,1,0,1,0,0,0,0
2025-10-12,9dd1f2bc-1053-4e77-925f-349afae361d5,Spend $30 get 15% off 01/02/2025,promotion,2025-01-02,None,N/A,,,,,,,$ Off,0.00,0.00,USD,Sunrise Blvd,31345439,8,344.20,51.64,0.00,0.00,7.92,-0.00,-0.00,43.03,7.45,5.78,2,5,1,8,1,5,1,7
2025-10-12,1dd4cf16-61f6-4935-beac-ad07a26422b3,"First order, 20% off 07/23/2025",promotion,2025-07-23,None,N/A,,,,,,,$ Off,0.00,0.00,USD,Happy Valley,23584856,2,42.07,8.42,0.00,0.00,1.98,-0.00,-0.00,21.04,5.20,4.05,2,0,0,2,0,0,0,0
2025-10-12,02d2c45e-5b6f-4058-b05d-1fbcb475312e,"First order, 20% off 04/09/2025",promotion,2025-04-09,None,N/A,,,,,,,$ Off,0.00,0.00,USD,Sierra St - Reno,719271,7,210.92,32.04,0.00,0.00,6.93,-0.00,-0.00,30.13,5.57,5.41,7,0,0,7,4,0,0,4
2025-10-12,02d2c45e-5b6f-4058-b05d-1fbcb475312e,"First order, 20% off 04/09/2025",promotion,2025-04-09,None,N/A,,,,,,,$ Off,0.00,0.00,USD,E 53rd - Davenport,582282,3,107.15,15.00,0.00,0.00,2.97,-0.00,-0.00,35.72,5.99,5.96,3,0,0,3,1,0,0,1
2025-10-12,83157f11-58f6-496d-bef9-af8b72eb8cf4,"Buy 1, get 1 free promotion 07/21/2025",promotion,2025-07-22,None,N/A,,,,,,,$ Off,0.00,0.00,USD,Chicago River West,34048823,5,234.55,29.15,0.00,0.00,4.95,-0.00,-0.00,46.91,6.82,6.88,2,1,2,5,1,1,1,3
2025-10-12,02d2c45e-5b6f-4058-b05d-1fbcb475312e,"First order, 20% off 04/09/2025",promotion,2025-04-09,None,N/A,,,,,,,$ Off,0.00,0.00,USD,Mountain View,2608887,3,105.11,15.00,0.00,0.00,2.97,-0.00,-0.00,35.04,5.99,5.85,3,0,0,3,3,0,0,3
2025-10-12,02d2c45e-5b6f-4058-b05d-1fbcb475312e,"First order, 20% off 04/09/2025",promotion,2025-04-09,None,N/A,,,,,,,$ Off,0.00,0.00,USD,Barnes Road,24892677,2,103.82,10.00,0.00,0.00,1.98,-0.00,-0.00,51.91,5.99,8.67,2,0,0,2,1,0,0,1
2025-10-12,1dd4cf16-61f6-4935-beac-ad07a26422b3,"First order, 20% off 07/23/2025",promotion,2025-07-23,None,N/A,,,,,,,$ Off,0.00,0.00,USD,Grand Ave-Portland,1370229,2,34.66,6.94,0.00,0.00,1.98,-0.00,-0.00,17.33,4.46,3.89,2,0,0,2,2,0,0,2
2025-10-12,ef08edf0-aabc-406a-bdf8-30534f44839a,Lunch specials item discount 09/25/2025,promotion,2025-09-25,2025-10-26,N/A,,,,,,,$ Off,0.00,0.00,USD,Raccoon Rd,26015022,2,76.36,16.89,0.00,0.00,0.00,-0.00,-0.00,38.18,8.45,4.52,0,2,0,2,0,2,0,2
2025-10-12,02d2c45e-5b6f-4058-b05d-1fbcb475312e,"First order, 20% off 04/09/2025",promotion,2025-04-09,None,N/A,,,,,,,$ Off,0.00,0.00,USD,Kent Island,691089,0,0.00,0.00,0.00,0.00,0.00,-0.00,-0.00,0.00,0.00,0.00,0,0,0,0,0,0,0,0
2025-10-12,4d5a689d-a212-46a2-91dc-8288a79ff11a,"First order, 20% off 01/02/2025",promotion,2025-01-02,None,N/A,,,,,,,$ Off,0.00,0.00,USD,Sunrise Blvd,31345439,2,54.77,9.46,0.00,0.00,1.98,-0.00,-0.00,27.39,5.72,4.79,2,0,0,2,1,0,0,1
2025-10-12,02d2c45e-5b6f-4058-b05d-1fbcb475312e,"First order, 20% off 04/09/2025",promotion,2025-04-09,None,N/A,,,,,,,$ Off,0.00,0.00,USD,Kenosha & 177th,1856591,2,42.26,8.46,0.00,0.00,1.98,-0.00,-0.00,21.13,5.22,4.05,2,0,0,2,1,0,0,1
2025-10-12,70d4cf5a-37fe-47ad-bac7-d5196b53b89c,Spend $30 get 20% off 09/03/2025,promotion,2025-09-03,None,N/A,,,,,,,$ Off,0.00,0.00,USD,Happy Valley,23584856,16,845.76,147.14,0.00,0.00,15.84,-0.00,-0.00,52.86,10.19,5.19,4,11,1,16,3,10,1,14
2025-10-12,492738a1-8e75-477a-b4bd-aec773e7d330,Spend $40 get $6 off 01/22/2025,promotion,2025-01-22,None,N/A,,,,,,,$ Off,0.00,0.00,USD,East Market Street,23256727,6,351.11,36.00,0.00,0.00,5.94,-0.00,-0.00,58.52,6.99,8.37,1,5,0,6,0,3,0,3
2025-10-12,02d2c45e-5b6f-4058-b05d-1fbcb475312e,"First order, 20% off 04/09/2025",promotion,2025-04-09,None,N/A,,,,,,,$ Off,0.00,0.00,USD,North Union St,575293,4,104.98,16.22,0.00,0.00,3.96,-0.00,-0.00,26.25,5.05,5.20,4,0,0,4,2,0,0,2
2025-10-12,4996d114-68d0-483f-963c-d124d822fc8f,"First order, 20% off 11/12/2024",promotion,2024-11-12,None,N/A,,,,,,,$ Off,0.00,0.00,USD,Northdale Blvd,24976449,1,21.48,4.30,0.00,0.00,0.99,-0.00,-0.00,21.48,5.29,4.06,1,0,0,1,0,0,0,0
2025-10-12,77e23ebd-6e10-4113-938c-bb55550710f5,Spice <> Capriotti's - Sep / Oct,promotion,2025-09-18,None,N/A,,,,day,,,$ Off,0.00,0.00,USD,"Capriotti's of Dover, Inc.",1617804,0,0.00,0.00,0.00,0.00,0.00,-0.00,-0.00,0.00,0.00,0.00,0,0,0,0,0,0,0,0
2025-10-12,02d2c45e-5b6f-4058-b05d-1fbcb475312e,"First order, 20% off 04/09/2025",promotion,2025-04-09,None,N/A,,,,,,,$ Off,0.00,0.00,USD,Santa Fe Station,75723,1,29.49,5.00,0.00,0.00,0.99,-0.00,-0.00,29.49,5.99,4.92,1,0,0,1,1,0,0,1
2025-10-12,02d2c45e-5b6f-4058-b05d-1fbcb475312e,"First order, 20% off 04/09/2025",promotion,2025-04-09,None,N/A,,,,,,,$ Off,0.00,0.00,USD,College Station,23349412,3,50.95,10.20,0.00,0.00,2.97,-0.00,-0.00,16.98,4.39,3.87,3,0,0,3,1,0,0,1
2025-10-12,02d2c45e-5b6f-4058-b05d-1fbcb475312e,"First order, 20% off 04/09/2025",promotion,2025-04-09,None,N/A,,,,,,,$ Off,0.00,0.00,USD,St Rose Pkwy,1335286,1,16.29,3.26,0.00,0.00,0.99,-0.00,-0.00,16.29,4.25,3.83,1,0,0,1,0,0,0,0
2025-10-12,10f22bff-32eb-477c-b8fd-70d17c151ce3,Happy Hour discount 10/02/2025,promotion,2025-10-02,2025-11-02,N/A,,,,,,,$ Off,0.00,0.00,USD,Manchester Rd,27715447,6,198.55,49.64,0.00,0.00,5.94,-0.00,-0.00,33.09,9.26,3.57,3,3,0,6,3,3,0,6
2025-10-12,77e23ebd-6e10-4113-938c-bb55550710f5,Spice <> Capriotti's - Sep / Oct,promotion,2025-09-18,None,N/A,,,,day,,,$ Off,0.00,0.00,USD,Horizon Ridge,75753,0,0.00,0.00,0.00,0.00,0.00,-0.00,-0.00,0.00,0.00,0.00,0,0,0,0,0,0,0,0
2025-10-12,02d2c45e-5b6f-4058-b05d-1fbcb475312e,"First order, 20% off 04/09/2025",promotion,2025-04-09,None,N/A,,,,,,,$ Off,0.00,0.00,USD,Downingtown,33699763,4,141.08,19.15,0.00,0.00,3.96,-0.00,-0.00,35.27,5.78,6.10,4,0,0,4,0,0,0,0
2025-10-12,77e23ebd-6e10-4113-938c-bb55550710f5,Spice <> Capriotti's - Sep / Oct,promotion,2025-09-18,None,N/A,,f06f33c5-bff5-4bb3-8dda-6cedeb2e6fc1,10% Happy hour Discount - Min $30 | Low Price Sensitivity,day,all,Order Discount,% Off,7.0%,30.00,USD,Old Town,27964,2,70.13,4.91,0.00,0.00,1.98,-0.00,-0.00,35.07,3.45,10.18,0,1,1,2,0,1,1,2
2025-10-12,77e23ebd-6e10-4113-938c-bb55550710f5,Spice <> Capriotti's - Sep / Oct,promotion,2025-09-18,None,N/A,,,,day,,,$ Off,0.00,0.00,USD,Dana Park - Mesa,126177,0,0.00,0.00,0.00,0.00,0.00,-0.00,-0.00,0.00,0.00,0.00,0,0,0,0,0,0,0,0
2025-10-12,77e23ebd-6e10-4113-938c-bb55550710f5,Spice <> Capriotti's - Sep / Oct,promotion,2025-09-18,None,N/A,,,,day,,,$ Off,0.00,0.00,USD,Gambrills,24415514,0,0.00,0.00,0.00,0.00,0.00,-0.00,-0.00,0.00,0.00,0.00,0,0,0,0,0,0,0,0
2025-10-12,77e23ebd-6e10-4113-938c-bb55550710f5,Spice <> Capriotti's - Sep / Oct,promotion,2025-09-18,None,N/A,,d1d0b263-4918-4c81-8c97-630471e7185b,10% Happy Hour Discount - Medium Price Sensitivity,day,all,Order Discount,% Off,10.0%,25.00,USD,Freeman Park,24404087,1,27.48,2.75,0.00,0.00,0.99,-0.00,-0.00,27.48,3.74,7.35,0,1,0,1,0,1,0,1
2025-10-12,77e23ebd-6e10-4113-938c-bb55550710f5,Spice <> Capriotti's - Sep / Oct,promotion,2025-09-18,None,N/A,,,,day,,,$ Off,0.00,0.00,USD,Bridge St,35060561,0,0.00,0.00,0.00,0.00,0.00,-0.00,-0.00,0.00,0.00,0.00,0,0,0,0,0,0,0,0
2025-10-12,77e23ebd-6e10-4113-938c-bb55550710f5,Spice <> Capriotti's - Sep / Oct,promotion,2025-09-18,None,N/A,,,,day,,,$ Off,0.00,0.00,USD,Riverwind Dr,34516256,0,0.00,0.00,0.00,0.00,0.00,-0.00,-0.00,0.00,0.00,0.00,0,0,0,0,0,0,0,0
2025-10-12,77e23ebd-6e10-4113-938c-bb55550710f5,Spice <> Capriotti's - Sep / Oct,promotion,2025-09-18,None,N/A,,f06f33c5-bff5-4bb3-8dda-6cedeb2e6fc1,10% Happy hour Discount - Min $30 | Low Price Sensitivity,day,all,Order Discount,% Off,7.0%,30.00,USD,Terrace Center,321047,2,69.05,4.84,0.00,0.00,1.98,-0.00,-0.00,34.53,3.41,10.12,0,2,0,2,0,1,0,1
2025-10-12,77e23ebd-6e10-4113-938c-bb55550710f5,Spice <> Capriotti's - Sep / Oct,promotion,2025-09-18,None,N/A,,d1d0b263-4918-4c81-8c97-630471e7185b,10% Happy Hour Discount - Medium Price Sensitivity,day,all,Order Discount,% Off,10.0%,25.00,USD,Northdale Blvd,24976449,0,0.00,0.00,0.00,0.00,0.00,-0.00,-0.00,0.00,0.00,0.00,0,0,0,0,0,0,0,0
2025-10-12,77e23ebd-6e10-4113-938c-bb55550710f5,Spice <> Capriotti's - Sep / Oct,promotion,2025-09-18,None,N/A,,d1d0b263-4918-4c81-8c97-630471e7185b,10% Happy Hour Discount - Medium Price Sensitivity,day,all,Order Discount,% Off,10.0%,25.00,USD,West Glenwood Ave,575295,5,216.99,20.12,0.00,0.00,4.95,-0.00,-0.00,43.40,5.01,8.66,0,4,1,5,0,2,1,3
2025-10-12,77e23ebd-6e10-4113-938c-bb55550710f5,Spice <> Capriotti's - Sep / Oct,promotion,2025-09-18,None,N/A,,d1d0b263-4918-4c81-8c97-630471e7185b,10% Happy Hour Discount - Medium Price Sensitivity,day,all,Order Discount,% Off,10.0%,25.00,USD,Meadows - Reno,705841,4,269.79,17.52,0.00,0.00,3.96,-0.00,-0.00,67.45,5.37,12.56,1,3,0,4,1,3,0,4
2025-10-12,02d2c45e-5b6f-4058-b05d-1fbcb475312e,"First order, 20% off 04/09/2025",promotion,2025-04-09,None,N/A,,,,,,,$ Off,0.00,0.00,USD,Brayden Pkwy,2375657,1,17.29,3.46,0.00,0.00,0.99,-0.00,-0.00,17.29,4.45,3.89,1,0,0,1,0,0,0,0
2025-10-12,77e23ebd-6e10-4113-938c-bb55550710f5,Spice <> Capriotti's - Sep / Oct,promotion,2025-09-18,None,N/A,,,,day,,,$ Off,0.00,0.00,USD,University Dr,29894178,0,0.00,0.00,0.00,0.00,0.00,-0.00,-0.00,0.00,0.00,0.00,0,0,0,0,0,0,0,0
2025-10-12,77e23ebd-6e10-4113-938c-bb55550710f5,Spice <> Capriotti's - Sep / Oct,promotion,2025-09-18,None,N/A,,ba37e4d8-36c4-4cbe-8c7d-f4d1379109bd,"Spend $15, Save $3 | Low price Sensitivity",day,all,Order Discount,$ Off,3.00,15.00,USD,Rancho Mirage,32864869,0,0.00,0.00,0.00,0.00,0.00,-0.00,-0.00,0.00,0.00,0.00,0,0,0,0,0,0,0,0
2025-10-12,77e23ebd-6e10-4113-938c-bb55550710f5,Spice <> Capriotti's - Sep / Oct,promotion,2025-09-18,None,N/A,,ba37e4d8-36c4-4cbe-8c7d-f4d1379109bd,"Spend $15, Save $3 | Low price Sensitivity",day,all,Order Discount,$ Off,3.00,15.00,USD,Collier Pkwy-Lutz,23057623,6,176.61,18.00,0.00,0.00,5.94,-0.00,-0.00,29.44,3.99,7.38,0,4,2,6,0,4,2,6
2025-10-12,77e23ebd-6e10-4113-938c-bb55550710f5,Spice <> Capriotti's - Sep / Oct,promotion,2025-09-18,None,N/A,,ba37e4d8-36c4-4cbe-8c7d-f4d1379109bd,"Spend $15, Save $3 | Low price Sensitivity",day,all,Order Discount,$ Off,3.00,15.00,USD,Terrace Center,321047,6,154.97,18.00,0.00,0.00,5.94,-0.00,-0.00,25.83,3.99,6.47,0,3,3,6,0,3,3,6
2025-10-12,77e23ebd-6e10-4113-938c-bb55550710f5,Spice <> Capriotti's - Sep / Oct,promotion,2025-09-18,None,N/A,,91f90d8c-8a7d-41cf-9b6a-888400112024,10% Happy Hour Discount - Min  $25 | High Price Sensitivity,day,all,Order Discount,% Off,10.0%,25.00,USD,Niles Cortland Rd SE,34043935,0,0.00,0.00,0.00,0.00,0.00,-0.00,-0.00,0.00,0.00,0.00,0,0,0,0,0,0,0,0
2025-10-12,77e23ebd-6e10-4113-938c-bb55550710f5,Spice <> Capriotti's - Sep / Oct,promotion,2025-09-18,None,N/A,,ba37e4d8-36c4-4cbe-8c7d-f4d1379109bd,"Spend $15, Save $3 | Low price Sensitivity",day,all,Order Discount,$ Off,3.00,15.00,USD,Old Town,27964,4,101.33,12.00,0.00,0.00,3.96,-0.00,-0.00,25.33,3.99,6.35,0,4,0,4,0,4,0,4
2025-10-12,77e23ebd-6e10-4113-938c-bb55550710f5,Spice <> Capriotti's - Sep / Oct,promotion,2025-09-18,None,N/A,,91f90d8c-8a7d-41cf-9b6a-888400112024,10% Happy Hour Discount - Min  $25 | High Price Sensitivity,day,all,Order Discount,% Off,10.0%,25.00,USD,E 53rd - Davenport,582282,2,97.84,8.50,0.00,0.00,1.98,-0.00,-0.00,48.92,5.24,9.34,0,2,0,2,0,2,0,2
2025-10-12,77e23ebd-6e10-4113-938c-bb55550710f5,Spice <> Capriotti's - Sep / Oct,promotion,2025-09-18,None,N/A,,f06f33c5-bff5-4bb3-8dda-6cedeb2e6fc1,10% Happy hour Discount - Min $30 | Low Price Sensitivity,day,all,Order Discount,% Off,7.0%,30.00,USD,Lantana Drive,390888,3,118.12,8.27,0.00,0.00,2.97,-0.00,-0.00,39.37,3.75,10.51,0,2,1,3,0,1,1,2
2025-10-12,77e23ebd-6e10-4113-938c-bb55550710f5,Spice <> Capriotti's - Sep / Oct,promotion,2025-09-18,None,N/A,,91f90d8c-8a7d-41cf-9b6a-888400112024,10% Happy Hour Discount - Min  $25 | High Price Sensitivity,day,all,Order Discount,% Off,10.0%,25.00,USD,Coeur d'Alene,23085790,0,0.00,0.00,0.00,0.00,0.00,-0.00,-0.00,0.00,0.00,0.00,0,0,0,0,0,0,0,0
2025-10-12,77e23ebd-6e10-4113-938c-bb55550710f5,Spice <> Capriotti's - Sep / Oct,promotion,2025-09-18,None,N/A,,43340528-e1b7-4f95-ab40-8dc92bf9c274,"Spend $35, Save $6 | High Price Sensitivity",day,all,Order Discount,$ Off,6.00,35.00,USD,Blackstone-Fresno,24415716,0,0.00,0.00,0.00,0.00,0.00,-0.00,-0.00,0.00,0.00,0.00,0,0,0,0,0,0,0,0
2025-10-12,77e23ebd-6e10-4113-938c-bb55550710f5,Spice <> Capriotti's - Sep / Oct,promotion,2025-09-18,None,N/A,,d1d0b263-4918-4c81-8c97-630471e7185b,10% Happy Hour Discount - Medium Price Sensitivity,day,all,Order Discount,% Off,10.0%,25.00,USD,Hwy 72 - Madison,27685318,2,60.85,6.09,0.00,0.00,1.98,-0.00,-0.00,30.43,4.04,7.54,0,2,0,2,0,2,0,2
2025-10-12,77e23ebd-6e10-4113-938c-bb55550710f5,Spice <> Capriotti's - Sep / Oct,promotion,2025-09-18,None,N/A,,43340528-e1b7-4f95-ab40-8dc92bf9c274,"Spend $35, Save $6 | High Price Sensitivity",day,all,Order Discount,$ Off,6.00,35.00,USD,Catclaw - Abilene,29652227,0,0.00,0.00,0.00,0.00,0.00,-0.00,-0.00,0.00,0.00,0.00,0,0,0,0,0,0,0,0
2025-10-12,77e23ebd-6e10-4113-938c-bb55550710f5,Spice <> Capriotti's - Sep / Oct,promotion,2025-09-18,None,N/A,,,,day,,,$ Off,0.00,0.00,USD,Rancho Mirage,32864869,0,0.00,0.00,0.00,0.00,0.00,-0.00,-0.00,0.00,0.00,0.00,0,0,0,0,0,0,0,0
2025-10-12,77e23ebd-6e10-4113-938c-bb55550710f5,Spice <> Capriotti's - Sep / Oct,promotion,2025-09-18,None,N/A,,d1d0b263-4918-4c81-8c97-630471e7185b,10% Happy Hour Discount - Medium Price Sensitivity,day,all,Order Discount,% Off,10.0%,25.00,USD,Eden Square Ctr,420646,6,241.14,23.29,0.00,0.00,5.94,-0.00,-0.00,40.19,4.87,8.25,1,2,3,6,0,1,3,4
2025-10-12,77e23ebd-6e10-4113-938c-bb55550710f5,Spice <> Capriotti's - Sep / Oct,promotion,2025-09-18,None,N/A,,,,day,,,$ Off,0.00,0.00,USD,N 87th Street,27965,0,0.00,0.00,0.00,0.00,0.00,-0.00,-0.00,0.00,0.00,0.00,0,0,0,0,0,0,0,0
2025-10-12,77e23ebd-6e10-4113-938c-bb55550710f5,Spice <> Capriotti's - Sep / Oct,promotion,2025-09-18,None,N/A,,43340528-e1b7-4f95-ab40-8dc92bf9c274,"Spend $35, Save $6 | High Price Sensitivity",day,all,Order Discount,$ Off,6.00,35.00,USD,"Capriotti's of Dover, Inc.",1617804,0,0.00,0.00,0.00,0.00,0.00,-0.00,-0.00,0.00,0.00,0.00,0,0,0,0,0,0,0,0
2025-10-12,77e23ebd-6e10-4113-938c-bb55550710f5,Spice <> Capriotti's - Sep / Oct,promotion,2025-09-18,None,N/A,,91f90d8c-8a7d-41cf-9b6a-888400112024,10% Happy Hour Discount - Min  $25 | High Price Sensitivity,day,all,Order Discount,% Off,10.0%,25.00,USD,North Union St,575293,3,117.51,11.76,0.00,0.00,2.97,-0.00,-0.00,39.17,4.91,7.98,0,1,2,3,0,1,1,2
2025-10-12,77e23ebd-6e10-4113-938c-bb55550710f5,Spice <> Capriotti's - Sep / Oct,promotion,2025-09-18,None,N/A,,,,day,,,$ Off,0.00,0.00,USD,Blackstone-Fresno,24415716,0,0.00,0.00,0.00,0.00,0.00,-0.00,-0.00,0.00,0.00,0.00,0,0,0,0,0,0,0,0
2025-10-12,77e23ebd-6e10-4113-938c-bb55550710f5,Spice <> Capriotti's - Sep / Oct,promotion,2025-09-18,None,N/A,,,,day,,,$ Off,0.00,0.00,USD,South  Walton Blvd,1616214,0,0.00,0.00,0.00,0.00,0.00,-0.00,-0.00,0.00,0.00,0.00,0,0,0,0,0,0,0,0
2025-10-12,77e23ebd-6e10-4113-938c-bb55550710f5,Spice <> Capriotti's - Sep / Oct,promotion,2025-09-18,None,N/A,,43340528-e1b7-4f95-ab40-8dc92bf9c274,"Spend $35, Save $6 | High Price Sensitivity",day,all,Order Discount,$ Off,6.00,35.00,USD,Silverside Road,691182,0,0.00,0.00,0.00,0.00,0.00,-0.00,-0.00,0.00,0.00,0.00,0,0,0,0,0,0,0,0
2025-10-12,77e23ebd-6e10-4113-938c-bb55550710f5,Spice <> Capriotti's - Sep / Oct,promotion,2025-09-18,None,N/A,,d1d0b263-4918-4c81-8c97-630471e7185b,10% Happy Hour Discount - Medium Price Sensitivity,day,all,Order Discount,% Off,10.0%,25.00,USD,San Luis Obispo,23900701,0,0.00,0.00,0.00,0.00,0.00,-0.00,-0.00,0.00,0.00,0.00,0,0,0,0,0,0,0,0
2025-10-12,02d2c45e-5b6f-4058-b05d-1fbcb475312e,"First order, 20% off 04/09/2025",promotion,2025-04-09,None,N/A,,,,,,,$ Off,0.00,0.00,USD,1st Ave NE,23128705,2,64.23,10.00,0.00,0.00,1.98,-0.00,-0.00,32.12,5.99,5.36,2,0,0,2,1,0,0,1
2025-10-12,77e23ebd-6e10-4113-938c-bb55550710f5,Spice <> Capriotti's - Sep / Oct,promotion,2025-09-18,None,N/A,,f06f33c5-bff5-4bb3-8dda-6cedeb2e6fc1,10% Happy hour Discount - Min $30 | Low Price Sensitivity,day,all,Order Discount,% Off,7.0%,30.00,USD,Happy Valley,23584856,0,0.00,0.00,0.00,0.00,0.00,-0.00,-0.00,0.00,0.00,0.00,0,0,0,0,0,0,0,0
2025-10-12,02d2c45e-5b6f-4058-b05d-1fbcb475312e,"First order, 20% off 04/09/2025",promotion,2025-04-09,None,N/A,,,,,,,$ Off,0.00,0.00,USD,Castle Rock,23057614,0,0.00,0.00,0.00,0.00,0.00,-0.00,-0.00,0.00,0.00,0.00,0,0,0,0,0,0,0,0
2025-10-12,25abde4d-2867-459b-9b99-b628e195401e,"Dormant customers, 20% off 07/24/2025",promotion,2025-07-24,None,N/A,,,,,,,$ Off,0.00,0.00,USD,West Fullerton Ave,23349403,1,32.38,6.48,0.00,0.00,0.99,-0.00,-0.00,32.38,7.47,4.33,0,0,1,1,0,0,1,1
2025-10-12,02d2c45e-5b6f-4058-b05d-1fbcb475312e,"First order, 20% off 04/09/2025",promotion,2025-04-09,None,N/A,,,,,,,$ Off,0.00,0.00,USD,Blue Diamond Road,333447,1,17.49,3.50,0.00,0.00,0.99,-0.00,-0.00,17.49,4.49,3.90,1,0,0,1,1,0,0,1
2025-10-12,02d2c45e-5b6f-4058-b05d-1fbcb475312e,"First order, 20% off 04/09/2025",promotion,2025-04-09,None,N/A,,,,,,,$ Off,0.00,0.00,USD,West Flamingo Road,75731,0,0.00,0.00,0.00,0.00,0.00,-0.00,-0.00,0.00,0.00,0.00,0,0,0,0,0,0,0,0
2025-10-12,02d2c45e-5b6f-4058-b05d-1fbcb475312e,"First order, 20% off 04/09/2025",promotion,2025-04-09,None,N/A,,,,,,,$ Off,0.00,0.00,USD,South  Walton Blvd,1616214,2,85.03,10.00,0.00,0.00,1.98,-0.00,-0.00,42.52,5.99,7.10,2,0,0,2,2,0,0,2
2025-10-12,02d2c45e-5b6f-4058-b05d-1fbcb475312e,"First order, 20% off 04/09/2025",promotion,2025-04-09,None,N/A,,,,,,,$ Off,0.00,0.00,USD,Old Town,27964,9,316.92,42.65,0.00,0.00,8.91,-0.00,-0.00,35.21,5.73,6.15,9,0,0,9,3,0,0,3
2025-10-12,77e23ebd-6e10-4113-938c-bb55550710f5,Spice <> Capriotti's - Sep / Oct,promotion,2025-09-18,None,N/A,,ba37e4d8-36c4-4cbe-8c7d-f4d1379109bd,"Spend $15, Save $3 | Low price Sensitivity",day,all,Order Discount,$ Off,3.00,15.00,USD,Arapahoe Rd,23349425,1,21.89,3.00,0.00,0.00,0.99,-0.00,-0.00,21.89,3.99,5.49,0,1,0,1,0,1,0,1
2025-10-12,77e23ebd-6e10-4113-938c-bb55550710f5,Spice <> Capriotti's - Sep / Oct,promotion,2025-09-18,None,N/A,,d1d0b263-4918-4c81-8c97-630471e7185b,10% Happy Hour Discount - Medium Price Sensitivity,day,all,Order Discount,% Off,10.0%,25.00,USD,Nellis Blvd,75755,1,36.58,3.66,0.00,0.00,0.99,-0.00,-0.00,36.58,4.65,7.87,0,1,0,1,0,1,0,1
2025-10-12,22a1aa22-01b8-4784-a262-c64e4855ebce,"Dormant customers, 20% off 07/31/2024",promotion,2024-07-31,None,N/A,,,,,,,$ Off,0.00,0.00,USD,The Old Road,24898774,1,23.78,4.76,0.00,0.00,0.99,-0.00,-0.00,23.78,5.75,4.14,0,0,1,1,0,0,0,0
2025-10-12,02d2c45e-5b6f-4058-b05d-1fbcb475312e,"First order, 20% off 04/09/2025",promotion,2025-04-09,None,N/A,,,,,,,$ Off,0.00,0.00,USD,Rancho Mirage,32864869,1,21.98,4.40,0.00,0.00,0.99,-0.00,-0.00,21.98,5.39,4.08,1,0,0,1,0,0,0,0
2025-10-12,02d2c45e-5b6f-4058-b05d-1fbcb475312e,"First order, 20% off 04/09/2025",promotion,2025-04-09,None,N/A,,,,,,,$ Off,0.00,0.00,USD,Kennett Square,575296,1,16.38,3.28,0.00,0.00,0.99,-0.00,-0.00,16.38,4.27,3.84,1,0,0,1,0,0,0,0
2025-10-12,77e23ebd-6e10-4113-938c-bb55550710f5,Spice <> Capriotti's - Sep / Oct,promotion,2025-09-18,None,N/A,,ba37e4d8-36c4-4cbe-8c7d-f4d1379109bd,"Spend $15, Save $3 | Low price Sensitivity",day,all,Order Discount,$ Off,3.00,15.00,USD,The Old Road,24898774,0,0.00,0.00,0.00,0.00,0.00,-0.00,-0.00,0.00,0.00,0.00,0,0,0,0,0,0,0,0
2025-10-12,02d2c45e-5b6f-4058-b05d-1fbcb475312e,"First order, 20% off 04/09/2025",promotion,2025-04-09,None,N/A,,,,,,,$ Off,0.00,0.00,USD,E Silverado Ranch,75746,2,52.77,10.00,0.00,0.00,1.98,-0.00,-0.00,26.39,5.99,4.40,2,0,0,2,2,0,0,2
2025-10-12,02d2c45e-5b6f-4058-b05d-1fbcb475312e,"First order, 20% off 04/09/2025",promotion,2025-04-09,None,N/A,,,,,,,$ Off,0.00,0.00,USD,S Stanford Way,699470,2,51.57,8.84,0.00,0.00,1.98,-0.00,-0.00,25.79,5.41,4.77,2,0,0,2,2,0,0,2
2025-10-12,02d2c45e-5b6f-4058-b05d-1fbcb475312e,"First order, 20% off 04/09/2025",promotion,2025-04-09,None,N/A,,,,,,,$ Off,0.00,0.00,USD,North Town Center,75721,0,0.00,0.00,0.00,0.00,0.00,-0.00,-0.00,0.00,0.00,0.00,0,0,0,0,0,0,0,0
2025-10-12,2bb77af0-6b48-46d5-97b3-e43758ea5314,"First order, 20% off 02/01/2025",promotion,2025-02-01,None,N/A,,,,,,,$ Off,0.00,0.00,USD,East Sepulveda,1743753,1,19.19,3.84,0.00,0.00,0.99,-0.00,-0.00,19.19,4.83,3.97,1,0,0,1,1,0,0,1
2025-10-12,6e2eeb77-e45d-427b-974e-9e6d639dce9e,"Buy 1, get 1 free promotion 10/02/2025",promotion,2025-10-02,2025-11-02,N/A,,,,,,,$ Off,0.00,0.00,USD,Manchester Rd,27715447,0,0.00,0.00,0.00,0.00,0.00,-0.00,-0.00,0.00,0.00,0.00,0,0,0,0,0,0,0,0
2025-10-12,667f7354-ea24-4ff4-8559-cbfb006cfdbe,"Dormant customers, 20% off 09/22/2025",promotion,2025-09-22,None,N/A,,,,,,,$ Off,0.00,0.00,USD,University Dr,29894178,0,0.00,0.00,0.00,0.00,0.00,-0.00,-0.00,0.00,0.00,0.00,0,0,0,0,0,0,0,0
2025-10-12,02d2c45e-5b6f-4058-b05d-1fbcb475312e,"First order, 20% off 04/09/2025",promotion,2025-04-09,None,N/A,,,,,,,$ Off,0.00,0.00,USD,Palm Ave - Fresno,1581092,1,39.57,5.00,0.00,0.00,0.99,-0.00,-0.00,39.57,5.99,6.61,1,0,0,1,1,0,0,1
2025-10-12,02d2c45e-5b6f-4058-b05d-1fbcb475312e,"First order, 20% off 04/09/2025",promotion,2025-04-09,None,N/A,,,,,,,$ Off,0.00,0.00,USD,East Sepulveda,1743753,0,0.00,0.00,0.00,0.00,0.00,-0.00,-0.00,0.00,0.00,0.00,0,0,0,0,0,0,0,0
2025-10-12,02d2c45e-5b6f-4058-b05d-1fbcb475312e,"First order, 20% off 04/09/2025",promotion,2025-04-09,None,N/A,,,,,,,$ Off,0.00,0.00,USD,International Pkwy,24671402,1,27.78,5.00,0.00,0.00,0.99,-0.00,-0.00,27.78,5.99,4.64,1,0,0,1,0,0,0,0
2025-10-12,02d2c45e-5b6f-4058-b05d-1fbcb475312e,"First order, 20% off 04/09/2025",promotion,2025-04-09,None,N/A,,,,,,,$ Off,0.00,0.00,USD,Hamilton Blvd,23066760,3,61.75,12.36,0.00,0.00,2.97,-0.00,-0.00,20.58,5.11,4.03,3,0,0,3,2,0,0,2
2025-10-12,02d2c45e-5b6f-4058-b05d-1fbcb475312e,"First order, 20% off 04/09/2025",promotion,2025-04-09,None,N/A,,,,,,,$ Off,0.00,0.00,USD,Roby Dr - Hammond,24891803,0,0.00,0.00,0.00,0.00,0.00,-0.00,-0.00,0.00,0.00,0.00,0,0,0,0,0,0,0,0
2025-10-12,02d2c45e-5b6f-4058-b05d-1fbcb475312e,"First order, 20% off 04/09/2025",promotion,2025-04-09,None,N/A,,,,,,,$ Off,0.00,0.00,USD,South Rainbow,75732,0,0.00,0.00,0.00,0.00,0.00,-0.00,-0.00,0.00,0.00,0.00,0,0,0,0,0,0,0,0
2025-10-12,77e23ebd-6e10-4113-938c-bb55550710f5,Spice <> Capriotti's - Sep / Oct,promotion,2025-09-18,None,N/A,,ba37e4d8-36c4-4cbe-8c7d-f4d1379109bd,"Spend $15, Save $3 | Low price Sensitivity",day,all,Order Discount,$ Off,3.00,15.00,USD,Bidwell - Folsom,26234909,1,17.49,3.00,0.00,0.00,0.99,-0.00,-0.00,17.49,3.99,4.38,0,1,0,1,0,1,0,1
2025-10-12,ed10ed86-5221-41d8-9af0-0ac62871adbb,"First Order, 20% Off",promotion,2022-05-17,None,N/A,,,,,,,$ Off,0.00,0.00,USD,Pioneer Pkwy,874359,0,0.00,0.00,0.00,0.00,0.00,-0.00,-0.00,0.00,0.00,0.00,0,0,0,0,0,0,0,0
2025-10-12,77e23ebd-6e10-4113-938c-bb55550710f5,Spice <> Capriotti's - Sep / Oct,promotion,2025-09-18,None,N/A,,f06f33c5-bff5-4bb3-8dda-6cedeb2e6fc1,10% Happy hour Discount - Min $30 | Low Price Sensitivity,day,all,Order Discount,% Off,7.0%,30.00,USD,Forest Drive,674540,0,0.00,0.00,0.00,0.00,0.00,-0.00,-0.00,0.00,0.00,0.00,0,0,0,0,0,0,0,0
2025-10-12,02d2c45e-5b6f-4058-b05d-1fbcb475312e,"First order, 20% off 04/09/2025",promotion,2025-04-09,None,N/A,,,,,,,$ Off,0.00,0.00,USD,"Capriotti's of Milford, LLC",1636430,1,15.59,3.12,0.00,0.00,0.99,-0.00,-0.00,15.59,4.11,3.79,1,0,0,1,0,0,0,0
2025-10-12,a895bc94-3910-43c9-b1b9-bc7f513286d7,Spend $25 get $5 off 07/31/2024,promotion,2024-07-31,None,N/A,,,,,,,$ Off,0.00,0.00,USD,The Old Road,24898774,3,123.07,15.00,0.00,0.00,2.97,-0.00,-0.00,41.02,5.99,6.85,0,1,2,3,0,1,1,2
2025-10-12,2bb77af0-6b48-46d5-97b3-e43758ea5314,"First order, 20% off 02/01/2025",promotion,2025-02-01,None,N/A,,,,,,,$ Off,0.00,0.00,USD,The Old Road,24898774,0,0.00,0.00,0.00,0.00,0.00,-0.00,-0.00,0.00,0.00,0.00,0,0,0,0,0,0,0,0
2025-10-12,02d2c45e-5b6f-4058-b05d-1fbcb475312e,"First order, 20% off 04/09/2025",promotion,2025-04-09,None,N/A,,,,,,,$ Off,0.00,0.00,USD,Coeur d'Alene,23085790,3,54.75,10.96,0.00,0.00,2.97,-0.00,-0.00,18.25,4.64,3.93,3,0,0,3,1,0,0,1
2025-10-12,02d2c45e-5b6f-4058-b05d-1fbcb475312e,"First order, 20% off 04/09/2025",promotion,2025-04-09,None,N/A,,,,,,,$ Off,0.00,0.00,USD,Newark,390890,3,73.42,13.54,0.00,0.00,2.97,-0.00,-0.00,24.47,5.50,4.45,3,0,0,3,1,0,0,1
2025-10-12,55ceb1d5-c2fa-48a3-8e52-3fbe10ad9c00,"Dormant customers, 20% off 07/15/2025",promotion,2025-07-16,None,N/A,,,,,,,$ Off,0.00,0.00,USD,Dana Park - Mesa,126177,3,117.20,20.77,0.00,0.00,2.97,-0.00,-0.00,39.07,7.91,4.94,0,0,3,3,0,0,3,3
2025-10-12,77e23ebd-6e10-4113-938c-bb55550710f5,Spice <> Capriotti's - Sep / Oct,promotion,2025-09-18,None,N/A,,43340528-e1b7-4f95-ab40-8dc92bf9c274,"Spend $35, Save $6 | High Price Sensitivity",day,all,Order Discount,$ Off,6.00,35.00,USD,Riverwind Dr,34516256,5,232.64,30.00,0.00,0.00,4.95,-0.00,-0.00,46.53,6.99,6.66,3,2,0,5,2,1,0,3
2025-10-12,02d2c45e-5b6f-4058-b05d-1fbcb475312e,"First order, 20% off 04/09/2025",promotion,2025-04-09,None,N/A,,,,,,,$ Off,0.00,0.00,USD,Concord Pike,23151390,2,37.27,7.46,0.00,0.00,1.98,-0.00,-0.00,18.64,4.72,3.95,2,0,0,2,0,0,0,0
2025-10-12,2bb77af0-6b48-46d5-97b3-e43758ea5314,"First order, 20% off 02/01/2025",promotion,2025-02-01,None,N/A,,,,,,,$ Off,0.00,0.00,USD,Sierra Hwy,27476315,3,106.03,15.00,0.00,0.00,2.97,-0.00,-0.00,35.34,5.99,5.90,3,0,0,3,1,0,0,1
2025-10-12,02d2c45e-5b6f-4058-b05d-1fbcb475312e,"First order, 20% off 04/09/2025",promotion,2025-04-09,None,N/A,,,,,,,$ Off,0.00,0.00,USD,West Glenwood Ave,575295,1,31.96,5.00,0.00,0.00,0.99,-0.00,-0.00,31.96,5.99,5.34,1,0,0,1,1,0,0,1
2025-10-12,f12a26e0-24e1-4d8e-ac05-d7e43f06d2bf,Happy Hour discount 11/12/2024,promotion,2024-11-12,None,N/A,,,,,,,$ Off,0.00,0.00,USD,Heart Pine-Odessa,2232632,5,141.77,30.55,0.00,0.00,4.95,-0.00,-0.00,28.35,7.10,3.99,1,4,0,5,1,2,0,3
2025-10-12,02d2c45e-5b6f-4058-b05d-1fbcb475312e,"First order, 20% off 04/09/2025",promotion,2025-04-09,None,N/A,,,,,,,$ Off,0.00,0.00,USD,South State Rd,1713806,3,114.50,15.00,0.00,0.00,2.97,-0.00,-0.00,38.17,5.99,6.37,3,0,0,3,0,0,0,0
2025-10-12,02d2c45e-5b6f-4058-b05d-1fbcb475312e,"First order, 20% off 04/09/2025",promotion,2025-04-09,None,N/A,,,,,,,$ Off,0.00,0.00,USD,Sumneytown Pike,24717004,4,229.98,20.00,0.00,0.00,3.96,-0.00,-0.00,57.50,5.99,9.60,4,0,0,4,1,0,0,1
2025-10-12,02d2c45e-5b6f-4058-b05d-1fbcb475312e,"First order, 20% off 04/09/2025",promotion,2025-04-09,None,N/A,,,,,,,$ Off,0.00,0.00,USD,Manchester Rd,27715447,5,127.68,21.36,0.00,0.00,4.95,-0.00,-0.00,25.54,5.26,4.85,5,0,0,5,3,0,0,3
2025-10-12,02d2c45e-5b6f-4058-b05d-1fbcb475312e,"First order, 20% off 04/09/2025",promotion,2025-04-09,None,N/A,,,,,,,$ Off,0.00,0.00,USD,N 87th Street,27965,1,167.70,5.00,0.00,0.00,0.99,-0.00,-0.00,167.70,5.99,28.00,1,0,0,1,1,0,0,1
2025-10-12,77e23ebd-6e10-4113-938c-bb55550710f5,Spice <> Capriotti's - Sep / Oct,promotion,2025-09-18,None,N/A,,91f90d8c-8a7d-41cf-9b6a-888400112024,10% Happy Hour Discount - Min  $25 | High Price Sensitivity,day,all,Order Discount,% Off,10.0%,25.00,USD,Riverwind Dr,34516256,2,52.45,5.25,0.00,0.00,1.98,-0.00,-0.00,26.23,3.62,7.25,1,1,0,2,0,1,0,1
2025-10-12,77e23ebd-6e10-4113-938c-bb55550710f5,Spice <> Capriotti's - Sep / Oct,promotion,2025-09-18,None,N/A,,d1d0b263-4918-4c81-8c97-630471e7185b,10% Happy Hour Discount - Medium Price Sensitivity,day,all,Order Discount,% Off,10.0%,25.00,USD,Plank Rd,27918503,0,0.00,0.00,0.00,0.00,0.00,-0.00,-0.00,0.00,0.00,0.00,0,0,0,0,0,0,0,0
2025-10-12,02d2c45e-5b6f-4058-b05d-1fbcb475312e,"First order, 20% off 04/09/2025",promotion,2025-04-09,None,N/A,,,,,,,$ Off,0.00,0.00,USD,Sunset and Sandhill,32849799,1,32.37,5.00,0.00,0.00,0.99,-0.00,-0.00,32.37,5.99,5.40,1,0,0,1,1,0,0,1
2025-10-12,02d2c45e-5b6f-4058-b05d-1fbcb475312e,"First order, 20% off 04/09/2025",promotion,2025-04-09,None,N/A,,,,,,,$ Off,0.00,0.00,USD,Shepherd - Fresno,24559604,3,72.72,13.74,0.00,0.00,2.97,-0.00,-0.00,24.24,5.57,4.35,3,0,0,3,3,0,0,3
2025-10-12,77e23ebd-6e10-4113-938c-bb55550710f5,Spice <> Capriotti's - Sep / Oct,promotion,2025-09-18,None,N/A,,91f90d8c-8a7d-41cf-9b6a-888400112024,10% Happy Hour Discount - Min  $25 | High Price Sensitivity,day,all,Order Discount,% Off,10.0%,25.00,USD,Shepherd - Fresno,24559604,0,0.00,0.00,0.00,0.00,0.00,-0.00,-0.00,0.00,0.00,0.00,0,0,0,0,0,0,0,0
2025-10-12,77e23ebd-6e10-4113-938c-bb55550710f5,Spice <> Capriotti's - Sep / Oct,promotion,2025-09-18,None,N/A,,ba37e4d8-36c4-4cbe-8c7d-f4d1379109bd,"Spend $15, Save $3 | Low price Sensitivity",day,all,Order Discount,$ Off,3.00,15.00,USD,Townpark Lane,128721,0,0.00,0.00,0.00,0.00,0.00,-0.00,-0.00,0.00,0.00,0.00,0,0,0,0,0,0,0,0
2025-10-12,02d2c45e-5b6f-4058-b05d-1fbcb475312e,"First order, 20% off 04/09/2025",promotion,2025-04-09,None,N/A,,,,,,,$ Off,0.00,0.00,USD,Olympia Ave-Tulsa,24892240,4,147.88,20.00,0.00,0.00,3.96,-0.00,-0.00,36.97,5.99,6.17,4,0,0,4,3,0,0,3
2025-10-12,22a1aa22-01b8-4784-a262-c64e4855ebce,"Dormant customers, 20% off 07/31/2024",promotion,2024-07-31,None,N/A,,,,,,,$ Off,0.00,0.00,USD,East Sepulveda,1743753,1,21.58,4.32,0.00,0.00,0.99,-0.00,-0.00,21.58,5.31,4.06,0,0,1,1,0,0,0,0
2025-10-12,77e23ebd-6e10-4113-938c-bb55550710f5,Spice <> Capriotti's - Sep / Oct,promotion,2025-09-18,None,N/A,,,,day,,,$ Off,0.00,0.00,USD,Kirkwood Hwy,390889,0,0.00,0.00,0.00,0.00,0.00,-0.00,-0.00,0.00,0.00,0.00,0,0,0,0,0,0,0,0
2025-10-12,77e23ebd-6e10-4113-938c-bb55550710f5,Spice <> Capriotti's - Sep / Oct,promotion,2025-09-18,None,N/A,,d1d0b263-4918-4c81-8c97-630471e7185b,10% Happy Hour Discount - Medium Price Sensitivity,day,all,Order Discount,% Off,10.0%,25.00,USD,Kenosha & 177th,1856591,0,0.00,0.00,0.00,0.00,0.00,-0.00,-0.00,0.00,0.00,0.00,0,0,0,0,0,0,0,0
2025-10-12,425a2568-d931-4baa-8593-d268f8a0c259,Happy Hour discount is 30% OFF,promotion,2025-01-24,None,Daily,28.57,,,,,,$ Off,0.00,0.00,USD,N 87th Street,27965,2,53.54,14.00,0.00,0.00,1.98,-0.00,-0.00,26.77,7.99,3.35,1,1,0,2,1,1,0,2
2025-10-12,77e23ebd-6e10-4113-938c-bb55550710f5,Spice <> Capriotti's - Sep / Oct,promotion,2025-09-18,None,N/A,,,,day,,,$ Off,0.00,0.00,USD,Forest Drive,674540,0,0.00,0.00,0.00,0.00,0.00,-0.00,-0.00,0.00,0.00,0.00,0,0,0,0,0,0,0,0
2025-10-12,425a2568-d931-4baa-8593-d268f8a0c259,Happy Hour discount is 30% OFF,promotion,2025-01-24,None,Daily,28.57,,,,,,$ Off,0.00,0.00,USD,Old Town,27964,2,37.17,11.15,0.00,0.00,1.98,-0.00,-0.00,18.59,6.57,2.83,2,0,0,2,2,0,0,2
2025-10-12,77e23ebd-6e10-4113-938c-bb55550710f5,Spice <> Capriotti's - Sep / Oct,promotion,2025-09-18,None,N/A,,,,day,,,$ Off,0.00,0.00,USD,University Ave,1084955,0,0.00,0.00,0.00,0.00,0.00,-0.00,-0.00,0.00,0.00,0.00,0,0,0,0,0,0,0,0
2025-10-12,77e23ebd-6e10-4113-938c-bb55550710f5,Spice <> Capriotti's - Sep / Oct,promotion,2025-09-18,None,N/A,,f06f33c5-bff5-4bb3-8dda-6cedeb2e6fc1,10% Happy hour Discount - Min $30 | Low Price Sensitivity,day,all,Order Discount,% Off,7.0%,30.00,USD,The Old Road,24898774,0,0.00,0.00,0.00,0.00,0.00,-0.00,-0.00,0.00,0.00,0.00,0,0,0,0,0,0,0,0
2025-10-12,77e23ebd-6e10-4113-938c-bb55550710f5,Spice <> Capriotti's - Sep / Oct,promotion,2025-09-18,None,N/A,,d1d0b263-4918-4c81-8c97-630471e7185b,10% Happy Hour Discount - Medium Price Sensitivity,day,all,Order Discount,% Off,10.0%,25.00,USD,"Lewes, DE",34776698,7,252.95,24.78,0.00,0.00,6.93,-0.00,-0.00,36.14,4.53,7.98,4,3,0,7,2,2,0,4
2025-10-12,77e23ebd-6e10-4113-938c-bb55550710f5,Spice <> Capriotti's - Sep / Oct,promotion,2025-09-18,None,N/A,,43340528-e1b7-4f95-ab40-8dc92bf9c274,"Spend $35, Save $6 | High Price Sensitivity",day,all,Order Discount,$ Off,6.00,35.00,USD,E 53rd - Davenport,582282,2,96.60,12.00,0.00,0.00,1.98,-0.00,-0.00,48.30,6.99,6.91,0,0,2,2,0,0,2,2
2025-10-12,14ad5a9c-e239-4129-b8dc-5284d46f80da,Spend $30 get 20% off 10/08/2025,promotion,2025-10-08,2025-11-08,N/A,,,,,,,$ Off,0.00,0.00,USD,Cortez Rd  West,26034424,8,291.66,58.34,0.00,0.00,7.92,-0.00,-0.00,36.46,8.28,4.40,1,5,1,7,0,5,1,6
2025-10-12,58fe435a-cdf8-4a86-abc7-b68d7b574ba5,Spend $25 Get 20% Off,promotion,2022-12-01,None,N/A,,,,,,,$ Off,0.00,0.00,USD,Boulder Station,23349419,3,133.59,22.58,0.00,0.00,2.97,-0.00,-0.00,44.53,8.52,5.23,0,3,0,3,0,3,0,3
2025-10-12,02d2c45e-5b6f-4058-b05d-1fbcb475312e,"First order, 20% off 04/09/2025",promotion,2025-04-09,None,N/A,,,,,,,$ Off,0.00,0.00,USD,West Sahara Avenue,424852,2,49.46,8.02,0.00,0.00,1.98,-0.00,-0.00,24.73,5.00,4.95,2,0,0,2,2,0,0,2
2025-10-12,77e23ebd-6e10-4113-938c-bb55550710f5,Spice <> Capriotti's - Sep / Oct,promotion,2025-09-18,None,N/A,,91f90d8c-8a7d-41cf-9b6a-888400112024,10% Happy Hour Discount - Min  $25 | High Price Sensitivity,day,all,Order Discount,% Off,10.0%,25.00,USD,West Basin Rd,575301,1,28.19,2.82,0.00,0.00,0.99,-0.00,-0.00,28.19,3.81,7.40,0,1,0,1,0,0,0,0
2025-10-12,02d2c45e-5b6f-4058-b05d-1fbcb475312e,"First order, 20% off 04/09/2025",promotion,2025-04-09,None,N/A,,,,,,,$ Off,0.00,0.00,USD,North Haven Ave,28834163,2,45.14,9.02,0.00,0.00,1.98,-0.00,-0.00,22.57,5.50,4.10,2,0,0,2,2,0,0,2
2025-10-12,1ca9d76f-7d83-41a6-b2a6-7ea37cf348bb,Happy Hour Item Discount 09/22/2025,promotion,2025-09-22,None,N/A,,,,,,,$ Off,0.00,0.00,USD,International Pkwy,24671402,1,26.58,2.22,0.00,0.00,0.99,-0.00,-0.00,26.58,3.21,8.28,0,0,1,1,0,0,1,1
2025-10-12,22a1aa22-01b8-4784-a262-c64e4855ebce,"Dormant customers, 20% off 07/31/2024",promotion,2024-07-31,None,N/A,,,,,,,$ Off,0.00,0.00,USD,De Soto-Chatsworth,651597,0,0.00,0.00,0.00,0.00,0.00,-0.00,-0.00,0.00,0.00,0.00,0,0,0,0,0,0,0,0
2025-10-12,02d2c45e-5b6f-4058-b05d-1fbcb475312e,"First order, 20% off 04/09/2025",promotion,2025-04-09,None,N/A,,,,,,,$ Off,0.00,0.00,USD,De Soto-Chatsworth,651597,0,0.00,0.00,0.00,0.00,0.00,-0.00,-0.00,0.00,0.00,0.00,0,0,0,0,0,0,0,0
2025-10-12,77e23ebd-6e10-4113-938c-bb55550710f5,Spice <> Capriotti's - Sep / Oct,promotion,2025-09-18,None,N/A,,d1d0b263-4918-4c81-8c97-630471e7185b,10% Happy Hour Discount - Medium Price Sensitivity,day,all,Order Discount,% Off,10.0%,25.00,USD,Sunrise Blvd,31345439,0,0.00,0.00,0.00,0.00,0.00,-0.00,-0.00,0.00,0.00,0.00,0,0,0,0,0,0,0,0
2025-10-12,02d2c45e-5b6f-4058-b05d-1fbcb475312e,"First order, 20% off 04/09/2025",promotion,2025-04-09,None,N/A,,,,,,,$ Off,0.00,0.00,USD,West Charleston,23641277,0,0.00,0.00,0.00,0.00,0.00,-0.00,-0.00,0.00,0.00,0.00,0,0,0,0,0,0,0,0
2025-10-12,02d2c45e-5b6f-4058-b05d-1fbcb475312e,"First order, 20% off 04/09/2025",promotion,2025-04-09,None,N/A,,,,,,,$ Off,0.00,0.00,USD,Catclaw - Abilene,29652227,4,113.20,17.04,0.00,0.00,3.96,-0.00,-0.00,28.30,5.25,5.39,4,0,0,4,2,0,0,2
2025-10-12,02d2c45e-5b6f-4058-b05d-1fbcb475312e,"First order, 20% off 04/09/2025",promotion,2025-04-09,None,N/A,,,,,,,$ Off,0.00,0.00,USD,Downtown Summerlin,75736,0,0.00,0.00,0.00,0.00,0.00,-0.00,-0.00,0.00,0.00,0.00,0,0,0,0,0,0,0,0
2025-10-12,77e23ebd-6e10-4113-938c-bb55550710f5,Spice <> Capriotti's - Sep / Oct,promotion,2025-09-18,None,N/A,,,,day,,,$ Off,0.00,0.00,USD,South State Rd,1713806,0,0.00,0.00,0.00,0.00,0.00,-0.00,-0.00,0.00,0.00,0.00,0,0,0,0,0,0,0,0
2025-10-12,77e23ebd-6e10-4113-938c-bb55550710f5,Spice <> Capriotti's - Sep / Oct,promotion,2025-09-18,None,N/A,,ba37e4d8-36c4-4cbe-8c7d-f4d1379109bd,"Spend $15, Save $3 | Low price Sensitivity",day,all,Order Discount,$ Off,3.00,15.00,USD,Raccoon Rd,26015022,8,250.38,24.00,0.00,0.00,7.92,-0.00,-0.00,31.30,3.99,7.84,5,2,1,8,3,2,0,5
2025-10-12,77e23ebd-6e10-4113-938c-bb55550710f5,Spice <> Capriotti's - Sep / Oct,promotion,2025-09-18,None,N/A,,,,day,,,$ Off,0.00,0.00,USD,"Marlton, NJ",35211042,0,0.00,0.00,0.00,0.00,0.00,-0.00,-0.00,0.00,0.00,0.00,0,0,0,0,0,0,0,0
2025-10-12,77e23ebd-6e10-4113-938c-bb55550710f5,Spice <> Capriotti's - Sep / Oct,promotion,2025-09-18,None,N/A,,f06f33c5-bff5-4bb3-8dda-6cedeb2e6fc1,10% Happy hour Discount - Min $30 | Low Price Sensitivity,day,all,Order Discount,% Off,7.0%,30.00,USD,Arapahoe Rd,23349425,0,0.00,0.00,0.00,0.00,0.00,-0.00,-0.00,0.00,0.00,0.00,0,0,0,0,0,0,0,0
2025-10-12,77e23ebd-6e10-4113-938c-bb55550710f5,Spice <> Capriotti's - Sep / Oct,promotion,2025-09-18,None,N/A,,,,day,,,$ Off,0.00,0.00,USD,East Market Street,23256727,0,0.00,0.00,0.00,0.00,0.00,-0.00,-0.00,0.00,0.00,0.00,0,0,0,0,0,0,0,0
2025-10-12,77e23ebd-6e10-4113-938c-bb55550710f5,Spice <> Capriotti's - Sep / Oct,promotion,2025-09-18,None,N/A,,,,day,,,$ Off,0.00,0.00,USD,Sierra Hwy,27476315,0,0.00,0.00,0.00,0.00,0.00,-0.00,-0.00,0.00,0.00,0.00,0,0,0,0,0,0,0,0
2025-10-12,7b3c5d68-2d5c-4d2d-b0b1-a1fb4346169d,Spend $20 Get $5 Off,promotion,2023-02-01,None,N/A,,,,,,,$ Off,0.00,0.00,USD,Gambrills,24415514,4,190.03,20.00,0.00,0.00,3.96,-0.00,-0.00,47.51,5.99,7.93,1,3,0,4,1,2,0,3
2025-10-12,02d2c45e-5b6f-4058-b05d-1fbcb475312e,"First order, 20% off 04/09/2025",promotion,2025-04-09,None,N/A,,,,,,,$ Off,0.00,0.00,USD,Cheyenne and 215,388423,0,0.00,0.00,0.00,0.00,0.00,-0.00,-0.00,0.00,0.00,0.00,0,0,0,0,0,0,0,0
2025-10-12,02d2c45e-5b6f-4058-b05d-1fbcb475312e,"First order, 20% off 04/09/2025",promotion,2025-04-09,None,N/A,,,,,,,$ Off,0.00,0.00,USD,Highlands Ranch,1791292,2,61.97,10.00,0.00,0.00,1.98,-0.00,-0.00,30.99,5.99,5.17,2,0,0,2,2,0,0,2
2025-10-12,02d2c45e-5b6f-4058-b05d-1fbcb475312e,"First order, 20% off 04/09/2025",promotion,2025-04-09,None,N/A,,,,,,,$ Off,0.00,0.00,USD,Byers Dr,23186665,2,62.53,9.59,0.00,0.00,1.98,-0.00,-0.00,31.27,5.79,5.40,2,0,0,2,2,0,0,2
2025-10-12,02d2c45e-5b6f-4058-b05d-1fbcb475312e,"First order, 20% off 04/09/2025",promotion,2025-04-09,None,N/A,,,,,,,$ Off,0.00,0.00,USD,Nellis Blvd,75755,1,21.06,4.21,0.00,0.00,0.99,-0.00,-0.00,21.06,5.20,4.05,1,0,0,1,1,0,0,1
2025-10-12,77e23ebd-6e10-4113-938c-bb55550710f5,Spice <> Capriotti's - Sep / Oct,promotion,2025-09-18,None,N/A,,ba37e4d8-36c4-4cbe-8c7d-f4d1379109bd,"Spend $15, Save $3 | Low price Sensitivity",day,all,Order Discount,$ Off,3.00,15.00,USD,Governor Ritchie,24121153,4,156.03,12.00,0.00,0.00,3.96,-0.00,-0.00,39.01,3.99,9.78,0,2,2,4,0,2,1,3
2025-10-12,77e23ebd-6e10-4113-938c-bb55550710f5,Spice <> Capriotti's - Sep / Oct,promotion,2025-09-18,None,N/A,,d1d0b263-4918-4c81-8c97-630471e7185b,10% Happy Hour Discount - Medium Price Sensitivity,day,all,Order Discount,% Off,10.0%,25.00,USD,WVC High Market,2608935,1,29.49,2.95,0.00,0.00,0.99,-0.00,-0.00,29.49,3.94,7.48,0,1,0,1,0,1,0,1
2025-10-12,e17f8f0c-31d2-4c57-af32-8d745f2af9df,Loyalty Promo - Capriotti's Sandwich Shop (bus id: 2324),promotion,2023-06-27,2033-06-27,N/A,,,,,,,$ Off,0.00,0.00,USD,Bel Air,23733193,5,206.41,25.00,0.00,0.00,0.00,-0.00,-0.00,41.28,5.00,8.26,0,4,1,5,0,4,1,5
2025-10-12,e149493c-c29f-452b-b0be-926022f5491a,Spend $20 get $3 off 09/20/2025,promotion,2025-09-20,None,N/A,,,,,,,$ Off,0.00,0.00,USD,Waialae Ave,25380836,8,340.05,24.00,0.00,0.00,7.92,-0.00,-0.00,42.51,3.99,10.65,4,3,1,8,3,3,1,7
2025-10-12,02d2c45e-5b6f-4058-b05d-1fbcb475312e,"First order, 20% off 04/09/2025",promotion,2025-04-09,None,N/A,,,,,,,$ Off,0.00,0.00,USD,Southern Highlands,1750142,1,18.70,3.74,0.00,0.00,0.99,-0.00,-0.00,18.70,4.73,3.95,1,0,0,1,1,0,0,1
2025-10-12,6f71233a-4f7b-43f5-b70b-89dc41af1fd0,Late night 5 off 25,promotion,2025-01-17,None,N/A,,,,,,,$ Off,0.00,0.00,USD,Cheyenne and 215,388423,1,31.98,5.00,0.00,0.00,0.99,-0.00,-0.00,31.98,5.99,5.34,0,1,0,1,0,1,0,1
2025-10-12,5164f786-a14b-4b5d-970f-ced7eba0593a,Spend $35 get 20% off 06/03/2025,promotion,2025-06-03,None,N/A,,,,,,,$ Off,0.00,0.00,USD,Hamilton Blvd,23066760,11,579.33,95.19,0.00,0.00,10.89,-0.00,-0.00,52.67,9.64,5.46,4,6,1,11,2,4,0,6
2025-10-12,58fe435a-cdf8-4a86-abc7-b68d7b574ba5,Spend $25 Get 20% Off,promotion,2022-12-01,None,N/A,,,,,,,$ Off,0.00,0.00,USD,Zionsville,24415273,9,321.20,56.34,0.00,0.00,8.91,-0.00,-0.00,35.69,7.25,4.92,0,8,1,9,0,7,1,8
2025-10-12,77e23ebd-6e10-4113-938c-bb55550710f5,Spice <> Capriotti's - Sep / Oct,promotion,2025-09-18,None,N/A,,,,day,,,$ Off,0.00,0.00,USD,GVR Casino,75749,0,0.00,0.00,0.00,0.00,0.00,-0.00,-0.00,0.00,0.00,0.00,0,0,0,0,0,0,0,0
2025-10-12,02d2c45e-5b6f-4058-b05d-1fbcb475312e,"First order, 20% off 04/09/2025",promotion,2025-04-09,None,N/A,,,,,,,$ Off,0.00,0.00,USD,East Ridge Pike,1640642,1,21.17,4.23,0.00,0.00,0.99,-0.00,-0.00,21.17,5.22,4.06,1,0,0,1,1,0,0,1
2025-10-12,77e23ebd-6e10-4113-938c-bb55550710f5,Spice <> Capriotti's - Sep / Oct,promotion,2025-09-18,None,N/A,,43340528-e1b7-4f95-ab40-8dc92bf9c274,"Spend $35, Save $6 | High Price Sensitivity",day,all,Order Discount,$ Off,6.00,35.00,USD,West Fullerton Ave,23349403,1,47.04,6.00,0.00,0.00,0.99,-0.00,-0.00,47.04,6.99,6.73,1,0,0,1,1,0,0,1
2025-10-12,77e23ebd-6e10-4113-938c-bb55550710f5,Spice <> Capriotti's - Sep / Oct,promotion,2025-09-18,None,N/A,,d1d0b263-4918-4c81-8c97-630471e7185b,10% Happy Hour Discount - Medium Price Sensitivity,day,all,Order Discount,% Off,10.0%,25.00,USD,Southern Highlands,1750142,1,43.20,4.32,0.00,0.00,0.99,-0.00,-0.00,43.20,5.31,8.14,0,1,0,1,0,1,0,1
2025-10-12,77e23ebd-6e10-4113-938c-bb55550710f5,Spice <> Capriotti's - Sep / Oct,promotion,2025-09-18,None,N/A,,d1d0b263-4918-4c81-8c97-630471e7185b,10% Happy Hour Discount - Medium Price Sensitivity,day,all,Order Discount,% Off,10.0%,25.00,USD,Nature Park Drive,75726,1,33.97,3.40,0.00,0.00,0.99,-0.00,-0.00,33.97,4.39,7.74,0,1,0,1,0,0,0,0
2025-10-12,77e23ebd-6e10-4113-938c-bb55550710f5,Spice <> Capriotti's - Sep / Oct,promotion,2025-09-18,None,N/A,,d1d0b263-4918-4c81-8c97-630471e7185b,10% Happy Hour Discount - Medium Price Sensitivity,day,all,Order Discount,% Off,10.0%,25.00,USD,Red Rock Casino,75737,1,32.27,3.23,0.00,0.00,0.99,-0.00,-0.00,32.27,4.22,7.65,0,1,0,1,0,1,0,1
2025-10-12,77e23ebd-6e10-4113-938c-bb55550710f5,Spice <> Capriotti's - Sep / Oct,promotion,2025-09-18,None,N/A,,d1d0b263-4918-4c81-8c97-630471e7185b,10% Happy Hour Discount - Medium Price Sensitivity,day,all,Order Discount,% Off,10.0%,25.00,USD,Ogletown Stanton,422117,2,106.23,10.00,0.00,0.00,1.98,-0.00,-0.00,53.12,5.99,8.87,0,1,1,2,0,0,0,0
2025-10-12,77e23ebd-6e10-4113-938c-bb55550710f5,Spice <> Capriotti's - Sep / Oct,promotion,2025-09-18,None,N/A,,f06f33c5-bff5-4bb3-8dda-6cedeb2e6fc1,10% Happy hour Discount - Min $30 | Low Price Sensitivity,day,all,Order Discount,% Off,7.0%,30.00,USD,Castle Rock,23057614,0,0.00,0.00,0.00,0.00,0.00,-0.00,-0.00,0.00,0.00,0.00,0,0,0,0,0,0,0,0
2025-10-12,77e23ebd-6e10-4113-938c-bb55550710f5,Spice <> Capriotti's - Sep / Oct,promotion,2025-09-18,None,N/A,,,,day,,,$ Off,0.00,0.00,USD,Sumneytown Pike,24717004,0,0.00,0.00,0.00,0.00,0.00,-0.00,-0.00,0.00,0.00,0.00,0,0,0,0,0,0,0,0
2025-10-12,4996d114-68d0-483f-963c-d124d822fc8f,"First order, 20% off 11/12/2024",promotion,2024-11-12,None,N/A,,,,,,,$ Off,0.00,0.00,USD,Collier Pkwy-Lutz,23057623,4,78.03,15.56,0.00,0.00,3.96,-0.00,-0.00,19.51,4.88,4.00,4,0,0,4,3,0,0,3
2025-10-12,02d2c45e-5b6f-4058-b05d-1fbcb475312e,"First order, 20% off 04/09/2025",promotion,2025-04-09,None,N/A,,,,,,,$ Off,0.00,0.00,USD,West Azure,75724,1,29.98,5.00,0.00,0.00,0.99,-0.00,-0.00,29.98,5.99,5.01,1,0,0,1,0,0,0,0
2025-10-12,02d2c45e-5b6f-4058-b05d-1fbcb475312e,"First order, 20% off 04/09/2025",promotion,2025-04-09,None,N/A,,,,,,,$ Off,0.00,0.00,USD,East Market Street,23256727,3,70.44,13.10,0.00,0.00,2.97,-0.00,-0.00,23.48,5.36,4.38,3,0,0,3,2,0,0,2
2025-10-12,02d2c45e-5b6f-4058-b05d-1fbcb475312e,"First order, 20% off 04/09/2025",promotion,2025-04-09,None,N/A,,,,,,,$ Off,0.00,0.00,USD,S Marion Road,1742411,7,189.08,30.65,0.00,0.00,6.93,-0.00,-0.00,27.01,5.37,5.03,7,0,0,7,4,0,0,4
2025-10-12,bf29a390-e14d-4578-af85-d658942a738b,Loyalty Promo - Capriotti's Sandwich Shop (bus id: 768909),promotion,2024-04-26,2034-04-26,N/A,,,,,,,$ Off,0.00,0.00,USD,"Capriotti's of Milford, LLC",1636430,1,29.57,5.00,0.00,0.00,0.00,-0.00,-0.00,29.57,5.00,5.91,0,1,0,1,0,1,0,1
2025-10-12,77e23ebd-6e10-4113-938c-bb55550710f5,Spice <> Capriotti's - Sep / Oct,promotion,2025-09-18,None,N/A,,43340528-e1b7-4f95-ab40-8dc92bf9c274,"Spend $35, Save $6 | High Price Sensitivity",day,all,Order Discount,$ Off,6.00,35.00,USD,Kirkwood Hwy,390889,0,0.00,0.00,0.00,0.00,0.00,-0.00,-0.00,0.00,0.00,0.00,0,0,0,0,0,0,0,0
2025-10-12,02d2c45e-5b6f-4058-b05d-1fbcb475312e,"First order, 20% off 04/09/2025",promotion,2025-04-09,None,N/A,,,,,,,$ Off,0.00,0.00,USD,N Broad St,578662,1,20.68,4.14,0.00,0.00,0.99,-0.00,-0.00,20.68,5.13,4.03,1,0,0,1,1,0,0,1
2025-10-12,02d2c45e-5b6f-4058-b05d-1fbcb475312e,"First order, 20% off 04/09/2025",promotion,2025-04-09,None,N/A,,,,,,,$ Off,0.00,0.00,USD,Terrace Center,321047,6,151.96,26.48,0.00,0.00,5.94,-0.00,-0.00,25.33,5.40,4.69,6,0,0,6,3,0,0,3
2025-10-12,9dd1f2bc-1053-4e77-925f-349afae361d5,Spend $30 get 15% off 01/02/2025,promotion,2025-01-02,None,N/A,,,,,,,$ Off,0.00,0.00,USD,Bidwell - Folsom,26234909,7,374.28,54.02,0.00,0.00,6.93,-0.00,-0.00,53.47,8.71,6.14,1,4,2,7,1,3,1,5
2025-10-12,77e23ebd-6e10-4113-938c-bb55550710f5,Spice <> Capriotti's - Sep / Oct,promotion,2025-09-18,None,N/A,,f06f33c5-bff5-4bb3-8dda-6cedeb2e6fc1,10% Happy hour Discount - Min $30 | Low Price Sensitivity,day,all,Order Discount,% Off,7.0%,30.00,USD,Frisco,34516355,0,0.00,0.00,0.00,0.00,0.00,-0.00,-0.00,0.00,0.00,0.00,0,0,0,0,0,0,0,0
2025-10-12,77e23ebd-6e10-4113-938c-bb55550710f5,Spice <> Capriotti's - Sep / Oct,promotion,2025-09-18,None,N/A,,ba37e4d8-36c4-4cbe-8c7d-f4d1379109bd,"Spend $15, Save $3 | Low price Sensitivity",day,all,Order Discount,$ Off,3.00,15.00,USD,Douglas Blvd,1018616,3,83.15,9.00,0.00,0.00,2.97,-0.00,-0.00,27.72,3.99,6.95,0,3,0,3,0,1,0,1
2025-10-12,77e23ebd-6e10-4113-938c-bb55550710f5,Spice <> Capriotti's - Sep / Oct,promotion,2025-09-18,None,N/A,,91f90d8c-8a7d-41cf-9b6a-888400112024,10% Happy Hour Discount - Min  $25 | High Price Sensitivity,day,all,Order Discount,% Off,10.0%,25.00,USD,Hamilton Blvd,23066760,1,32.98,3.30,0.00,0.00,0.99,-0.00,-0.00,32.98,4.29,7.69,0,0,1,1,0,0,0,0
2025-10-12,77e23ebd-6e10-4113-938c-bb55550710f5,Spice <> Capriotti's - Sep / Oct,promotion,2025-09-18,None,N/A,,ba37e4d8-36c4-4cbe-8c7d-f4d1379109bd,"Spend $15, Save $3 | Low price Sensitivity",day,all,Order Discount,$ Off,3.00,15.00,USD,International Pkwy,24671402,1,27.08,3.00,0.00,0.00,0.99,-0.00,-0.00,27.08,3.99,6.79,0,1,0,1,0,1,0,1
2025-10-12,bdd3cdcc-32b9-405e-97aa-aada053ce3df,aliante lunch 5 off 25,promotion,2025-01-17,None,N/A,,,,,,,$ Off,0.00,0.00,USD,Aliante Casino,75725,0,0.00,0.00,0.00,0.00,0.00,-0.00,-0.00,0.00,0.00,0.00,0,0,0,0,0,0,0,0
2025-10-12,178f54dc-804b-413e-b1bd-ffbdde7f61a1,"Dormant customers, 20% off 02/01/2025",promotion,2025-02-01,None,N/A,,,,,,,$ Off,0.00,0.00,USD,Sierra Hwy,27476315,1,18.39,3.68,0.00,0.00,0.99,-0.00,-0.00,18.39,4.67,3.94,0,0,1,1,0,0,1,1
2025-10-12,2c07ba1b-ffe7-48b6-b99f-17555cbc8290,Lunch specials item discount 07/25/2025,promotion,2025-07-25,None,N/A,,,,,,,$ Off,0.00,0.00,USD,Southern Highlands,1750142,0,0.00,0.00,0.00,0.00,0.00,-0.00,-0.00,0.00,0.00,0.00,0,0,0,0,0,0,0,0
2025-10-12,77e23ebd-6e10-4113-938c-bb55550710f5,Spice <> Capriotti's - Sep / Oct,promotion,2025-09-18,None,N/A,,f06f33c5-bff5-4bb3-8dda-6cedeb2e6fc1,10% Happy hour Discount - Min $30 | Low Price Sensitivity,day,all,Order Discount,% Off,7.0%,30.00,USD,Bidwell - Folsom,26234909,0,0.00,0.00,0.00,0.00,0.00,-0.00,-0.00,0.00,0.00,0.00,0,0,0,0,0,0,0,0
2025-10-12,77e23ebd-6e10-4113-938c-bb55550710f5,Spice <> Capriotti's - Sep / Oct,promotion,2025-09-18,None,N/A,,91f90d8c-8a7d-41cf-9b6a-888400112024,10% Happy Hour Discount - Min  $25 | High Price Sensitivity,day,all,Order Discount,% Off,10.0%,25.00,USD,"Capriotti's of Milford, LLC",1636430,1,26.98,2.70,0.00,0.00,0.99,-0.00,-0.00,26.98,3.69,7.31,0,1,0,1,0,1,0,1
2025-10-12,6f71233a-4f7b-43f5-b70b-89dc41af1fd0,Late night 5 off 25,promotion,2025-01-17,None,N/A,,,,,,,$ Off,0.00,0.00,USD,Oso Blanca Rd,178087,1,41.18,5.00,0.00,0.00,0.99,-0.00,-0.00,41.18,5.99,6.87,0,0,1,1,0,0,0,0
2025-10-12,77e23ebd-6e10-4113-938c-bb55550710f5,Spice <> Capriotti's - Sep / Oct,promotion,2025-09-18,None,N/A,,,,day,,,$ Off,0.00,0.00,USD,"Lewes, DE",34776698,0,0.00,0.00,0.00,0.00,0.00,-0.00,-0.00,0.00,0.00,0.00,0,0,0,0,0,0,0,0
2025-10-12,77e23ebd-6e10-4113-938c-bb55550710f5,Spice <> Capriotti's - Sep / Oct,promotion,2025-09-18,None,N/A,,,,day,,,$ Off,0.00,0.00,USD,Broadway - Tucson,27829895,0,0.00,0.00,0.00,0.00,0.00,-0.00,-0.00,0.00,0.00,0.00,0,0,0,0,0,0,0,0
2025-10-12,77e23ebd-6e10-4113-938c-bb55550710f5,Spice <> Capriotti's - Sep / Oct,promotion,2025-09-18,None,N/A,,f06f33c5-bff5-4bb3-8dda-6cedeb2e6fc1,10% Happy hour Discount - Min $30 | Low Price Sensitivity,day,all,Order Discount,% Off,7.0%,30.00,USD,East Market Street,23256727,0,0.00,0.00,0.00,0.00,0.00,-0.00,-0.00,0.00,0.00,0.00,0,0,0,0,0,0,0,0
2025-10-12,77e23ebd-6e10-4113-938c-bb55550710f5,Spice <> Capriotti's - Sep / Oct,promotion,2025-09-18,None,N/A,,,,day,,,$ Off,0.00,0.00,USD,Kennett Square,575296,0,0.00,0.00,0.00,0.00,0.00,-0.00,-0.00,0.00,0.00,0.00,0,0,0,0,0,0,0,0
2025-10-12,77e23ebd-6e10-4113-938c-bb55550710f5,Spice <> Capriotti's - Sep / Oct,promotion,2025-09-18,None,N/A,,,,day,,,$ Off,0.00,0.00,USD,St Rose Pkwy,1335286,0,0.00,0.00,0.00,0.00,0.00,-0.00,-0.00,0.00,0.00,0.00,0,0,0,0,0,0,0,0
2025-10-12,77e23ebd-6e10-4113-938c-bb55550710f5,Spice <> Capriotti's - Sep / Oct,promotion,2025-09-18,None,N/A,,d1d0b263-4918-4c81-8c97-630471e7185b,10% Happy Hour Discount - Medium Price Sensitivity,day,all,Order Discount,% Off,10.0%,25.00,USD,Sunset and Sandhill,32849799,1,43.77,4.38,0.00,0.00,0.99,-0.00,-0.00,43.77,5.37,8.15,0,0,1,1,0,0,1,1
2025-10-12,77e23ebd-6e10-4113-938c-bb55550710f5,Spice <> Capriotti's - Sep / Oct,promotion,2025-09-18,None,N/A,,43340528-e1b7-4f95-ab40-8dc92bf9c274,"Spend $35, Save $6 | High Price Sensitivity",day,all,Order Discount,$ Off,6.00,35.00,USD,Palm Ave - Fresno,1581092,1,61.15,6.00,0.00,0.00,0.99,-0.00,-0.00,61.15,6.99,8.75,0,1,0,1,0,1,0,1
2025-10-12,77e23ebd-6e10-4113-938c-bb55550710f5,Spice <> Capriotti's - Sep / Oct,promotion,2025-09-18,None,N/A,,91f90d8c-8a7d-41cf-9b6a-888400112024,10% Happy Hour Discount - Min  $25 | High Price Sensitivity,day,all,Order Discount,% Off,10.0%,25.00,USD,Kirkwood Hwy,390889,6,345.51,26.71,0.00,0.00,5.94,-0.00,-0.00,57.59,5.44,10.58,0,5,1,6,0,3,1,4
2025-10-12,77e23ebd-6e10-4113-938c-bb55550710f5,Spice <> Capriotti's - Sep / Oct,promotion,2025-09-18,None,N/A,,,,day,,,$ Off,0.00,0.00,USD,Happy Valley,23584856,0,0.00,0.00,0.00,0.00,0.00,-0.00,-0.00,0.00,0.00,0.00,0,0,0,0,0,0,0,0
2025-10-12,77e23ebd-6e10-4113-938c-bb55550710f5,Spice <> Capriotti's - Sep / Oct,promotion,2025-09-18,None,N/A,,ba37e4d8-36c4-4cbe-8c7d-f4d1379109bd,"Spend $15, Save $3 | Low price Sensitivity",day,all,Order Discount,$ Off,3.00,15.00,USD,Smithtown Bypass,23349427,1,46.86,3.00,0.00,0.00,0.99,-0.00,-0.00,46.86,3.99,11.74,0,1,0,1,0,1,0,1
2025-10-12,77e23ebd-6e10-4113-938c-bb55550710f5,Spice <> Capriotti's - Sep / Oct,promotion,2025-09-18,None,N/A,,f06f33c5-bff5-4bb3-8dda-6cedeb2e6fc1,10% Happy hour Discount - Min $30 | Low Price Sensitivity,day,all,Order Discount,% Off,7.0%,30.00,USD,Princeton,32118309,0,0.00,0.00,0.00,0.00,0.00,-0.00,-0.00,0.00,0.00,0.00,0,0,0,0,0,0,0,0
2025-10-12,02d2c45e-5b6f-4058-b05d-1fbcb475312e,"First order, 20% off 04/09/2025",promotion,2025-04-09,None,N/A,,,,,,,$ Off,0.00,0.00,USD,Blackstone-Fresno,24415716,1,28.87,5.00,0.00,0.00,0.99,-0.00,-0.00,28.87,5.99,4.82,1,0,0,1,1,0,0,1
2025-10-12,77e23ebd-6e10-4113-938c-bb55550710f5,Spice <> Capriotti's - Sep / Oct,promotion,2025-09-18,None,N/A,,91f90d8c-8a7d-41cf-9b6a-888400112024,10% Happy Hour Discount - Min  $25 | High Price Sensitivity,day,all,Order Discount,% Off,10.0%,25.00,USD,Roby Dr - Hammond,24891803,1,33.68,3.37,0.00,0.00,0.99,-0.00,-0.00,33.68,4.36,7.72,0,1,0,1,0,1,0,1
2025-10-12,02d2c45e-5b6f-4058-b05d-1fbcb475312e,"First order, 20% off 04/09/2025",promotion,2025-04-09,None,N/A,,,,,,,$ Off,0.00,0.00,USD,E William Street,1053361,3,95.33,13.36,0.00,0.00,2.97,-0.00,-0.00,31.78,5.44,5.84,3,0,0,3,2,0,0,2
2025-10-12,58fe435a-cdf8-4a86-abc7-b68d7b574ba5,Spend $25 Get 20% Off,promotion,2022-12-01,None,N/A,,,,,,,$ Off,0.00,0.00,USD,Happy Valley,23584856,1,25.78,5.16,0.00,0.00,0.99,-0.00,-0.00,25.78,6.15,4.19,0,1,0,1,0,1,0,1
2025-10-12,02d2c45e-5b6f-4058-b05d-1fbcb475312e,"First order, 20% off 04/09/2025",promotion,2025-04-09,None,N/A,,,,,,,$ Off,0.00,0.00,USD,San Luis Obispo,23900701,3,50.97,10.20,0.00,0.00,2.97,-0.00,-0.00,16.99,4.39,3.87,3,0,0,3,2,0,0,2
2025-10-12,77e23ebd-6e10-4113-938c-bb55550710f5,Spice <> Capriotti's - Sep / Oct,promotion,2025-09-18,None,N/A,,d1d0b263-4918-4c81-8c97-630471e7185b,10% Happy Hour Discount - Medium Price Sensitivity,day,all,Order Discount,% Off,10.0%,25.00,USD,Manchester Rd,27715447,0,0.00,0.00,0.00,0.00,0.00,-0.00,-0.00,0.00,0.00,0.00,0,0,0,0,0,0,0,0
2025-10-12,02d2c45e-5b6f-4058-b05d-1fbcb475312e,"First order, 20% off 04/09/2025",promotion,2025-04-09,None,N/A,,,,,,,$ Off,0.00,0.00,USD,West Cheyenne Ave,75722,0,0.00,0.00,0.00,0.00,0.00,-0.00,-0.00,0.00,0.00,0.00,0,0,0,0,0,0,0,0
2025-10-12,02d2c45e-5b6f-4058-b05d-1fbcb475312e,"First order, 20% off 04/09/2025",promotion,2025-04-09,None,N/A,,,,,,,$ Off,0.00,0.00,USD,Eden Square Ctr,420646,2,78.94,9.07,0.00,0.00,1.98,-0.00,-0.00,39.47,5.53,7.14,2,0,0,2,2,0,0,2
2025-10-12,02d2c45e-5b6f-4058-b05d-1fbcb475312e,"First order, 20% off 04/09/2025",promotion,2025-04-09,None,N/A,,,,,,,$ Off,0.00,0.00,USD,Nevada Way,75754,0,0.00,0.00,0.00,0.00,0.00,-0.00,-0.00,0.00,0.00,0.00,0,0,0,0,0,0,0,0
2025-10-12,77e23ebd-6e10-4113-938c-bb55550710f5,Spice <> Capriotti's - Sep / Oct,promotion,2025-09-18,None,N/A,,f06f33c5-bff5-4bb3-8dda-6cedeb2e6fc1,10% Happy hour Discount - Min $30 | Low Price Sensitivity,day,all,Order Discount,% Off,7.0%,30.00,USD,Kent Island,691089,0,0.00,0.00,0.00,0.00,0.00,-0.00,-0.00,0.00,0.00,0.00,0,0,0,0,0,0,0,0
2025-10-12,02d2c45e-5b6f-4058-b05d-1fbcb475312e,"First order, 20% off 04/09/2025",promotion,2025-04-09,None,N/A,,,,,,,$ Off,0.00,0.00,USD,WVC High Market,2608935,2,65.63,10.00,0.00,0.00,1.98,-0.00,-0.00,32.82,5.99,5.48,2,0,0,2,2,0,0,2
2025-10-12,02d2c45e-5b6f-4058-b05d-1fbcb475312e,"First order, 20% off 04/09/2025",promotion,2025-04-09,None,N/A,,,,,,,$ Off,0.00,0.00,USD,Pioneer Pkwy,874359,0,0.00,0.00,0.00,0.00,0.00,-0.00,-0.00,0.00,0.00,0.00,0,0,0,0,0,0,0,0
2025-10-12,02d2c45e-5b6f-4058-b05d-1fbcb475312e,"First order, 20% off 04/09/2025",promotion,2025-04-09,None,N/A,,,,,,,$ Off,0.00,0.00,USD,Roanoke,24637171,1,32.38,5.00,0.00,0.00,0.99,-0.00,-0.00,32.38,5.99,5.41,1,0,0,1,1,0,0,1
2025-10-12,77e23ebd-6e10-4113-938c-bb55550710f5,Spice <> Capriotti's - Sep / Oct,promotion,2025-09-18,None,N/A,,,,day,,,$ Off,0.00,0.00,USD,Mountain View,2608887,0,0.00,0.00,0.00,0.00,0.00,-0.00,-0.00,0.00,0.00,0.00,0,0,0,0,0,0,0,0
2025-10-12,2bb77af0-6b48-46d5-97b3-e43758ea5314,"First order, 20% off 02/01/2025",promotion,2025-02-01,None,N/A,,,,,,,$ Off,0.00,0.00,USD,De Soto-Chatsworth,651597,1,15.59,3.12,0.00,0.00,0.99,-0.00,-0.00,15.59,4.11,3.79,1,0,0,1,1,0,0,1
2025-10-12,02d2c45e-5b6f-4058-b05d-1fbcb475312e,"First order, 20% off 04/09/2025",promotion,2025-04-09,None,N/A,,,,,,,$ Off,0.00,0.00,USD,West Avera Dr,1742446,3,92.12,13.04,0.00,0.00,2.97,-0.00,-0.00,30.71,5.34,5.75,3,0,0,3,1,0,0,1
2025-10-12,77e23ebd-6e10-4113-938c-bb55550710f5,Spice <> Capriotti's - Sep / Oct,promotion,2025-09-18,None,N/A,,,,day,,,$ Off,0.00,0.00,USD,Townpark Lane,128721,0,0.00,0.00,0.00,0.00,0.00,-0.00,-0.00,0.00,0.00,0.00,0,0,0,0,0,0,0,0
2025-10-12,02d2c45e-5b6f-4058-b05d-1fbcb475312e,"First order, 20% off 04/09/2025",promotion,2025-04-09,None,N/A,,,,,,,$ Off,0.00,0.00,USD,Stephanie St,75751,0,0.00,0.00,0.00,0.00,0.00,-0.00,-0.00,0.00,0.00,0.00,0,0,0,0,0,0,0,0
2025-10-12,02d2c45e-5b6f-4058-b05d-1fbcb475312e,"First order, 20% off 04/09/2025",promotion,2025-04-09,None,N/A,,,,,,,$ Off,0.00,0.00,USD,Freeman Park,24404087,2,67.05,10.00,0.00,0.00,1.98,-0.00,-0.00,33.53,5.99,5.60,2,0,0,2,2,0,0,2
2025-10-12,02d2c45e-5b6f-4058-b05d-1fbcb475312e,"First order, 20% off 04/09/2025",promotion,2025-04-09,None,N/A,,,,,,,$ Off,0.00,0.00,USD,Park Road Center,27677423,7,226.72,32.80,0.00,0.00,6.93,-0.00,-0.00,32.39,5.68,5.71,7,0,0,7,6,0,0,6
2025-10-12,6c1ac2b8-1b1b-4277-8266-2ffa49f73156,Happy Hour Item Discount 09/22/2025,promotion,2025-09-22,None,N/A,,,,,,,$ Off,0.00,0.00,USD,Frisco,34516355,0,0.00,0.00,0.00,0.00,0.00,-0.00,-0.00,0.00,0.00,0.00,0,0,0,0,0,0,0,0
2025-10-12,02d2c45e-5b6f-4058-b05d-1fbcb475312e,"First order, 20% off 04/09/2025",promotion,2025-04-09,None,N/A,,,,,,,$ Off,0.00,0.00,USD,University Ave,1084955,2,58.74,8.84,0.00,0.00,1.98,-0.00,-0.00,29.37,5.41,5.43,2,0,0,2,1,0,0,1
2025-10-12,02d2c45e-5b6f-4058-b05d-1fbcb475312e,"First order, 20% off 04/09/2025",promotion,2025-04-09,None,N/A,,,,,,,$ Off,0.00,0.00,USD,17th St Ammon,24968543,3,80.71,13.24,0.00,0.00,2.97,-0.00,-0.00,26.90,5.40,4.98,3,0,0,3,1,0,0,1
2025-10-12,02d2c45e-5b6f-4058-b05d-1fbcb475312e,"First order, 20% off 04/09/2025",promotion,2025-04-09,None,N/A,,,,,,,$ Off,0.00,0.00,USD,Interquest Parkway,27558470,3,93.58,14.97,0.00,0.00,2.97,-0.00,-0.00,31.19,5.98,5.22,3,0,0,3,2,0,0,2
2025-10-12,02d2c45e-5b6f-4058-b05d-1fbcb475312e,"First order, 20% off 04/09/2025",promotion,2025-04-09,None,N/A,,,,,,,$ Off,0.00,0.00,USD,Plank Rd,27918503,2,61.85,8.84,0.00,0.00,1.98,-0.00,-0.00,30.93,5.41,5.72,2,0,0,2,2,0,0,2
2025-10-12,4996d114-68d0-483f-963c-d124d822fc8f,"First order, 20% off 11/12/2024",promotion,2024-11-12,None,N/A,,,,,,,$ Off,0.00,0.00,USD,Heart Pine-Odessa,2232632,2,99.51,10.00,0.00,0.00,1.98,-0.00,-0.00,49.76,5.99,8.31,2,0,0,2,1,0,0,1
2025-10-12,02d2c45e-5b6f-4058-b05d-1fbcb475312e,"First order, 20% off 04/09/2025",promotion,2025-04-09,None,N/A,,,,,,,$ Off,0.00,0.00,USD,Hwy 72 - Madison,27685318,7,227.81,30.24,0.00,0.00,6.93,-0.00,-0.00,32.54,5.31,6.13,7,0,0,7,5,0,0,5
2025-10-12,77e23ebd-6e10-4113-938c-bb55550710f5,Spice <> Capriotti's - Sep / Oct,promotion,2025-09-18,None,N/A,,,,day,,,$ Off,0.00,0.00,USD,Heart Pine-Odessa,2232632,0,0.00,0.00,0.00,0.00,0.00,-0.00,-0.00,0.00,0.00,0.00,0,0,0,0,0,0,0,0
2025-10-12,02d2c45e-5b6f-4058-b05d-1fbcb475312e,"First order, 20% off 04/09/2025",promotion,2025-04-09,None,N/A,,,,,,,$ Off,0.00,0.00,USD,West Craig Road,75727,0,0.00,0.00,0.00,0.00,0.00,-0.00,-0.00,0.00,0.00,0.00,0,0,0,0,0,0,0,0
2025-10-12,02d2c45e-5b6f-4058-b05d-1fbcb475312e,"First order, 20% off 04/09/2025",promotion,2025-04-09,None,N/A,,,,,,,$ Off,0.00,0.00,USD,Cortez Rd  West,26034424,1,20.79,4.16,0.00,0.00,0.99,-0.00,-0.00,20.79,5.15,4.04,1,0,0,1,1,0,0,1
2025-10-12,02d2c45e-5b6f-4058-b05d-1fbcb475312e,"First order, 20% off 04/09/2025",promotion,2025-04-09,None,N/A,,,,,,,$ Off,0.00,0.00,USD,Sunrise Blvd,31345439,0,0.00,0.00,0.00,0.00,0.00,-0.00,-0.00,0.00,0.00,0.00,0,0,0,0,0,0,0,0
2025-10-12,77e23ebd-6e10-4113-938c-bb55550710f5,Spice <> Capriotti's - Sep / Oct,promotion,2025-09-18,None,N/A,,ba37e4d8-36c4-4cbe-8c7d-f4d1379109bd,"Spend $15, Save $3 | Low price Sensitivity",day,all,Order Discount,$ Off,3.00,15.00,USD,East Sepulveda,1743753,1,21.58,3.00,0.00,0.00,0.99,-0.00,-0.00,21.58,3.99,5.41,0,1,0,1,0,1,0,1
2025-10-12,02d2c45e-5b6f-4058-b05d-1fbcb475312e,"First order, 20% off 04/09/2025",promotion,2025-04-09,None,N/A,,,,,,,$ Off,0.00,0.00,USD,Oso Blanca Rd,178087,3,137.39,14.93,0.00,0.00,2.97,-0.00,-0.00,45.80,5.97,7.68,3,0,0,3,3,0,0,3
2025-10-12,02d2c45e-5b6f-4058-b05d-1fbcb475312e,"First order, 20% off 04/09/2025",promotion,2025-04-09,None,N/A,,,,,,,$ Off,0.00,0.00,USD,State and 6100 S,2608908,10,259.04,41.84,0.00,0.00,9.90,-0.00,-0.00,25.90,5.17,5.01,10,0,0,10,3,0,0,3
2025-10-12,77e23ebd-6e10-4113-938c-bb55550710f5,Spice <> Capriotti's - Sep / Oct,promotion,2025-09-18,None,N/A,,,,day,,,$ Off,0.00,0.00,USD,Cortez Rd  West,26034424,0,0.00,0.00,0.00,0.00,0.00,-0.00,-0.00,0.00,0.00,0.00,0,0,0,0,0,0,0,0
2025-10-12,77e23ebd-6e10-4113-938c-bb55550710f5,Spice <> Capriotti's - Sep / Oct,promotion,2025-09-18,None,N/A,,,,day,,,$ Off,0.00,0.00,USD,Byers Dr,23186665,0,0.00,0.00,0.00,0.00,0.00,-0.00,-0.00,0.00,0.00,0.00,0,0,0,0,0,0,0,0
2025-10-12,77e23ebd-6e10-4113-938c-bb55550710f5,Spice <> Capriotti's - Sep / Oct,promotion,2025-09-18,None,N/A,,d1d0b263-4918-4c81-8c97-630471e7185b,10% Happy Hour Discount - Medium Price Sensitivity,day,all,Order Discount,% Off,10.0%,25.00,USD,Park Road Center,27677423,0,0.00,0.00,0.00,0.00,0.00,-0.00,-0.00,0.00,0.00,0.00,0,0,0,0,0,0,0,0
2025-10-12,77e23ebd-6e10-4113-938c-bb55550710f5,Spice <> Capriotti's - Sep / Oct,promotion,2025-09-18,None,N/A,,d1d0b263-4918-4c81-8c97-630471e7185b,10% Happy Hour Discount - Medium Price Sensitivity,day,all,Order Discount,% Off,10.0%,25.00,USD,Olympia Ave-Tulsa,24892240,0,0.00,0.00,0.00,0.00,0.00,-0.00,-0.00,0.00,0.00,0.00,0,0,0,0,0,0,0,0
2025-10-12,77e23ebd-6e10-4113-938c-bb55550710f5,Spice <> Capriotti's - Sep / Oct,promotion,2025-09-18,None,N/A,,,,day,,,$ Off,0.00,0.00,USD,Lantana Drive,390888,0,0.00,0.00,0.00,0.00,0.00,-0.00,-0.00,0.00,0.00,0.00,0,0,0,0,0,0,0,0
2025-10-12,77e23ebd-6e10-4113-938c-bb55550710f5,Spice <> Capriotti's - Sep / Oct,promotion,2025-09-18,None,N/A,,ba37e4d8-36c4-4cbe-8c7d-f4d1379109bd,"Spend $15, Save $3 | Low price Sensitivity",day,all,Order Discount,$ Off,3.00,15.00,USD,Forest Drive,674540,3,105.56,9.00,0.00,0.00,2.97,-0.00,-0.00,35.19,3.99,8.82,0,2,1,3,0,2,1,3
2025-10-12,77e23ebd-6e10-4113-938c-bb55550710f5,Spice <> Capriotti's - Sep / Oct,promotion,2025-09-18,None,N/A,,d1d0b263-4918-4c81-8c97-630471e7185b,10% Happy Hour Discount - Medium Price Sensitivity,day,all,Order Discount,% Off,10.0%,25.00,USD,Newark,390890,3,128.99,11.25,0.00,0.00,2.97,-0.00,-0.00,43.00,4.74,9.07,0,1,2,3,0,1,0,1
2025-10-12,77e23ebd-6e10-4113-938c-bb55550710f5,Spice <> Capriotti's - Sep / Oct,promotion,2025-09-18,None,N/A,,d1d0b263-4918-4c81-8c97-630471e7185b,10% Happy Hour Discount - Medium Price Sensitivity,day,all,Order Discount,% Off,10.0%,25.00,USD,Los Altos,33476901,4,135.28,13.54,0.00,0.00,3.96,-0.00,-0.00,33.82,4.38,7.73,0,4,0,4,0,4,0,4
2025-10-12,77e23ebd-6e10-4113-938c-bb55550710f5,Spice <> Capriotti's - Sep / Oct,promotion,2025-09-18,None,N/A,,ba37e4d8-36c4-4cbe-8c7d-f4d1379109bd,"Spend $15, Save $3 | Low price Sensitivity",day,all,Order Discount,$ Off,3.00,15.00,USD,Kent Island,691089,1,39.57,3.00,0.00,0.00,0.99,-0.00,-0.00,39.57,3.99,9.92,0,0,1,1,0,0,0,0
2025-10-12,77e23ebd-6e10-4113-938c-bb55550710f5,Spice <> Capriotti's - Sep / Oct,promotion,2025-09-18,None,N/A,,d1d0b263-4918-4c81-8c97-630471e7185b,10% Happy Hour Discount - Medium Price Sensitivity,day,all,Order Discount,% Off,10.0%,25.00,USD,Elm St,34052609,2,84.01,8.40,0.00,0.00,1.98,-0.00,-0.00,42.01,5.19,8.09,1,1,0,2,1,1,0,2
2025-10-12,77e23ebd-6e10-4113-938c-bb55550710f5,Spice <> Capriotti's - Sep / Oct,promotion,2025-09-18,None,N/A,,,,day,,,$ Off,0.00,0.00,USD,Highlands Ranch,1791292,0,0.00,0.00,0.00,0.00,0.00,-0.00,-0.00,0.00,0.00,0.00,0,0,0,0,0,0,0,0
2025-10-12,02d2c45e-5b6f-4058-b05d-1fbcb475312e,"First order, 20% off 04/09/2025",promotion,2025-04-09,None,N/A,,,,,,,$ Off,0.00,0.00,USD,South Sandhill Rd,75741,2,63.47,10.00,0.00,0.00,1.98,-0.00,-0.00,31.74,5.99,5.30,2,0,0,2,2,0,0,2
2025-10-12,77e23ebd-6e10-4113-938c-bb55550710f5,Spice <> Capriotti's - Sep / Oct,promotion,2025-09-18,None,N/A,,f06f33c5-bff5-4bb3-8dda-6cedeb2e6fc1,10% Happy hour Discount - Min $30 | Low Price Sensitivity,day,all,Order Discount,% Off,7.0%,30.00,USD,Kennett Square,575296,0,0.00,0.00,0.00,0.00,0.00,-0.00,-0.00,0.00,0.00,0.00,0,0,0,0,0,0,0,0
2025-10-12,77e23ebd-6e10-4113-938c-bb55550710f5,Spice <> Capriotti's - Sep / Oct,promotion,2025-09-18,None,N/A,,f06f33c5-bff5-4bb3-8dda-6cedeb2e6fc1,10% Happy hour Discount - Min $30 | Low Price Sensitivity,day,all,Order Discount,% Off,7.0%,30.00,USD,Murrieta Hot Springs Rd,29652192,1,32.49,2.27,0.00,0.00,0.99,-0.00,-0.00,32.49,3.26,9.97,0,1,0,1,0,1,0,1
2025-10-12,77e23ebd-6e10-4113-938c-bb55550710f5,Spice <> Capriotti's - Sep / Oct,promotion,2025-09-18,None,N/A,,91f90d8c-8a7d-41cf-9b6a-888400112024,10% Happy Hour Discount - Min  $25 | High Price Sensitivity,day,all,Order Discount,% Off,10.0%,25.00,USD,Palm Ave - Fresno,1581092,1,41.96,4.20,0.00,0.00,0.99,-0.00,-0.00,41.96,5.19,8.08,0,1,0,1,0,0,0,0
2025-10-12,77e23ebd-6e10-4113-938c-bb55550710f5,Spice <> Capriotti's - Sep / Oct,promotion,2025-09-18,None,N/A,,ba37e4d8-36c4-4cbe-8c7d-f4d1379109bd,"Spend $15, Save $3 | Low price Sensitivity",day,all,Order Discount,$ Off,3.00,15.00,USD,Frisco,34516355,2,63.47,6.00,0.00,0.00,1.98,-0.00,-0.00,31.74,3.99,7.95,0,2,0,2,0,2,0,2
2025-10-12,77e23ebd-6e10-4113-938c-bb55550710f5,Spice <> Capriotti's - Sep / Oct,promotion,2025-09-18,None,N/A,,d1d0b263-4918-4c81-8c97-630471e7185b,10% Happy Hour Discount - Medium Price Sensitivity,day,all,Order Discount,% Off,10.0%,25.00,USD,West Charleston,23641277,3,121.13,11.28,0.00,0.00,2.97,-0.00,-0.00,40.38,4.75,8.50,0,1,2,3,0,0,1,1
2025-10-12,77e23ebd-6e10-4113-938c-bb55550710f5,Spice <> Capriotti's - Sep / Oct,promotion,2025-09-18,None,N/A,,d1d0b263-4918-4c81-8c97-630471e7185b,10% Happy Hour Discount - Medium Price Sensitivity,day,all,Order Discount,% Off,10.0%,25.00,USD,West Flamingo Road,75731,0,0.00,0.00,0.00,0.00,0.00,-0.00,-0.00,0.00,0.00,0.00,0,0,0,0,0,0,0,0
2025-10-12,77e23ebd-6e10-4113-938c-bb55550710f5,Spice <> Capriotti's - Sep / Oct,promotion,2025-09-18,None,N/A,,91f90d8c-8a7d-41cf-9b6a-888400112024,10% Happy Hour Discount - Min  $25 | High Price Sensitivity,day,all,Order Discount,% Off,10.0%,25.00,USD,Broadway - Tucson,27829895,2,80.33,8.00,0.00,0.00,1.98,-0.00,-0.00,40.17,4.99,8.05,1,1,0,2,0,0,0,0
2025-10-12,77e23ebd-6e10-4113-938c-bb55550710f5,Spice <> Capriotti's - Sep / Oct,promotion,2025-09-18,None,N/A,,,,day,,,$ Off,0.00,0.00,USD,Stephanie St,75751,0,0.00,0.00,0.00,0.00,0.00,-0.00,-0.00,0.00,0.00,0.00,0,0,0,0,0,0,0,0
2025-10-12,77e23ebd-6e10-4113-938c-bb55550710f5,Spice <> Capriotti's - Sep / Oct,promotion,2025-09-18,None,N/A,,d1d0b263-4918-4c81-8c97-630471e7185b,10% Happy Hour Discount - Medium Price Sensitivity,day,all,Order Discount,% Off,10.0%,25.00,USD,Sierra St - Reno,719271,5,204.30,20.02,0.00,0.00,4.95,-0.00,-0.00,40.86,4.99,8.18,0,4,1,5,0,3,1,4
2025-10-12,77e23ebd-6e10-4113-938c-bb55550710f5,Spice <> Capriotti's - Sep / Oct,promotion,2025-09-18,None,N/A,,d1d0b263-4918-4c81-8c97-630471e7185b,10% Happy Hour Discount - Medium Price Sensitivity,day,all,Order Discount,% Off,10.0%,25.00,USD,Pioneer Pkwy,874359,0,0.00,0.00,0.00,0.00,0.00,-0.00,-0.00,0.00,0.00,0.00,0,0,0,0,0,0,0,0
2025-10-12,77e23ebd-6e10-4113-938c-bb55550710f5,Spice <> Capriotti's - Sep / Oct,promotion,2025-09-18,None,N/A,,ba37e4d8-36c4-4cbe-8c7d-f4d1379109bd,"Spend $15, Save $3 | Low price Sensitivity",day,all,Order Discount,$ Off,3.00,15.00,USD,Stephanie St,75751,1,28.18,3.00,0.00,0.00,0.99,-0.00,-0.00,28.18,3.99,7.06,0,1,0,1,0,1,0,1
2025-10-12,77e23ebd-6e10-4113-938c-bb55550710f5,Spice <> Capriotti's - Sep / Oct,promotion,2025-09-18,None,N/A,,ba37e4d8-36c4-4cbe-8c7d-f4d1379109bd,"Spend $15, Save $3 | Low price Sensitivity",day,all,Order Discount,$ Off,3.00,15.00,USD,East Market Street,23256727,1,23.98,3.00,0.00,0.00,0.99,-0.00,-0.00,23.98,3.99,6.01,0,0,1,1,0,0,0,0
2025-10-12,77e23ebd-6e10-4113-938c-bb55550710f5,Spice <> Capriotti's - Sep / Oct,promotion,2025-09-18,None,N/A,,f06f33c5-bff5-4bb3-8dda-6cedeb2e6fc1,10% Happy hour Discount - Min $30 | Low Price Sensitivity,day,all,Order Discount,% Off,7.0%,30.00,USD,Highlands Ranch,1791292,1,76.62,5.00,0.00,0.00,0.99,-0.00,-0.00,76.62,5.99,12.79,1,0,0,1,0,0,0,0
2025-10-12,77e23ebd-6e10-4113-938c-bb55550710f5,Spice <> Capriotti's - Sep / Oct,promotion,2025-09-18,None,N/A,,f06f33c5-bff5-4bb3-8dda-6cedeb2e6fc1,10% Happy hour Discount - Min $30 | Low Price Sensitivity,day,all,Order Discount,% Off,7.0%,30.00,USD,"Marlton, NJ",35211042,4,154.33,10.80,0.00,0.00,3.96,-0.00,-0.00,38.58,3.69,10.46,2,2,0,4,2,2,0,4
2025-10-12,77e23ebd-6e10-4113-938c-bb55550710f5,Spice <> Capriotti's - Sep / Oct,promotion,2025-09-18,None,N/A,,d1d0b263-4918-4c81-8c97-630471e7185b,10% Happy Hour Discount - Medium Price Sensitivity,day,all,Order Discount,% Off,10.0%,25.00,USD,Oso Blanca Rd,178087,0,0.00,0.00,0.00,0.00,0.00,-0.00,-0.00,0.00,0.00,0.00,0,0,0,0,0,0,0,0
2025-10-12,77e23ebd-6e10-4113-938c-bb55550710f5,Spice <> Capriotti's - Sep / Oct,promotion,2025-09-18,None,N/A,,ba37e4d8-36c4-4cbe-8c7d-f4d1379109bd,"Spend $15, Save $3 | Low price Sensitivity",day,all,Order Discount,$ Off,3.00,15.00,USD,Princeton,32118309,3,177.65,9.00,0.00,0.00,2.97,-0.00,-0.00,59.22,3.99,14.84,1,2,0,3,1,2,0,3
2025-10-12,77e23ebd-6e10-4113-938c-bb55550710f5,Spice <> Capriotti's - Sep / Oct,promotion,2025-09-18,None,N/A,,d1d0b263-4918-4c81-8c97-630471e7185b,10% Happy Hour Discount - Medium Price Sensitivity,day,all,Order Discount,% Off,10.0%,25.00,USD,Interquest Parkway,27558470,0,0.00,0.00,0.00,0.00,0.00,-0.00,-0.00,0.00,0.00,0.00,0,0,0,0,0,0,0,0
2025-10-12,750e00fa-6876-4d9b-8c15-6ca184c578b9,Happy Hour discount 03/17/2025,promotion,2025-03-17,None,N/A,,,,,,,$ Off,0.00,0.00,USD,Interquest Parkway,27558470,1,26.47,5.00,0.00,0.00,0.99,-0.00,-0.00,26.47,5.99,4.42,0,1,0,1,0,1,0,1
2025-10-12,02d2c45e-5b6f-4058-b05d-1fbcb475312e,"First order, 20% off 04/09/2025",promotion,2025-04-09,None,N/A,,,,,,,$ Off,0.00,0.00,USD,Townpark Lane,128721,3,67.94,11.84,0.00,0.00,2.97,-0.00,-0.00,22.65,4.94,4.59,3,0,0,3,2,0,0,2
2025-10-12,f632eba8-7caa-4715-8101-69a221822987,Spend $35 get $5 off 12/02/2024,promotion,2024-12-02,None,N/A,,,,,,,$ Off,0.00,0.00,USD,"Capriotti's of Milford, LLC",1636430,2,105.47,10.00,0.00,0.00,1.98,-0.00,-0.00,52.74,5.99,8.80,0,2,0,2,0,1,0,1
2025-10-12,c7538744-a515-43f8-97d0-b819c1419d1b,Happy Hour discount 09/19/2024,promotion,2024-09-19,None,N/A,,,,,,,$ Off,0.00,0.00,USD,Bidwell - Folsom,26234909,3,104.10,26.03,0.00,0.00,2.97,-0.00,-0.00,34.70,9.67,3.59,0,2,1,3,0,2,0,2
2025-10-12,178f54dc-804b-413e-b1bd-ffbdde7f61a1,"Dormant customers, 20% off 02/01/2025",promotion,2025-02-01,None,N/A,,,,,,,$ Off,0.00,0.00,USD,The Old Road,24898774,0,0.00,0.00,0.00,0.00,0.00,-0.00,-0.00,0.00,0.00,0.00,0,0,0,0,0,0,0,0
2025-10-12,77e23ebd-6e10-4113-938c-bb55550710f5,Spice <> Capriotti's - Sep / Oct,promotion,2025-09-18,None,N/A,,d1d0b263-4918-4c81-8c97-630471e7185b,10% Happy Hour Discount - Medium Price Sensitivity,day,all,Order Discount,% Off,10.0%,25.00,USD,South Rainbow,75732,2,56.46,5.65,0.00,0.00,1.98,-0.00,-0.00,28.23,3.82,7.40,0,1,1,2,0,1,1,2
2025-10-12,77e23ebd-6e10-4113-938c-bb55550710f5,Spice <> Capriotti's - Sep / Oct,promotion,2025-09-18,None,N/A,,d1d0b263-4918-4c81-8c97-630471e7185b,10% Happy Hour Discount - Medium Price Sensitivity,day,all,Order Discount,% Off,10.0%,25.00,USD,Maryland Pkwy,1007892,0,0.00,0.00,0.00,0.00,0.00,-0.00,-0.00,0.00,0.00,0.00,0,0,0,0,0,0,0,0
2025-10-12,6f71233a-4f7b-43f5-b70b-89dc41af1fd0,Late night 5 off 25,promotion,2025-01-17,None,N/A,,,,,,,$ Off,0.00,0.00,USD,West Craig Road,75727,0,0.00,0.00,0.00,0.00,0.00,-0.00,-0.00,0.00,0.00,0.00,0,0,0,0,0,0,0,0
2025-10-12,02d2c45e-5b6f-4058-b05d-1fbcb475312e,"First order, 20% off 04/09/2025",promotion,2025-04-09,None,N/A,,,,,,,$ Off,0.00,0.00,USD,GVR Casino,75749,0,0.00,0.00,0.00,0.00,0.00,-0.00,-0.00,0.00,0.00,0.00,0,0,0,0,0,0,0,0
2025-10-12,77e23ebd-6e10-4113-938c-bb55550710f5,Spice <> Capriotti's - Sep / Oct,promotion,2025-09-18,None,N/A,,43340528-e1b7-4f95-ab40-8dc92bf9c274,"Spend $35, Save $6 | High Price Sensitivity",day,all,Order Discount,$ Off,6.00,35.00,USD,Hamilton Blvd,23066760,0,0.00,0.00,0.00,0.00,0.00,-0.00,-0.00,0.00,0.00,0.00,0,0,0,0,0,0,0,0
2025-10-12,02d2c45e-5b6f-4058-b05d-1fbcb475312e,"First order, 20% off 04/09/2025",promotion,2025-04-09,None,N/A,,,,,,,$ Off,0.00,0.00,USD,Broadway - Tucson,27829895,5,143.86,23.88,0.00,0.00,4.95,-0.00,-0.00,28.77,5.77,4.99,5,0,0,5,5,0,0,5
2025-10-12,77e23ebd-6e10-4113-938c-bb55550710f5,Spice <> Capriotti's - Sep / Oct,promotion,2025-09-18,None,N/A,,ba37e4d8-36c4-4cbe-8c7d-f4d1379109bd,"Spend $15, Save $3 | Low price Sensitivity",day,all,Order Discount,$ Off,3.00,15.00,USD,Lantana Drive,390888,1,21.68,3.00,0.00,0.00,0.99,-0.00,-0.00,21.68,3.99,5.43,0,0,1,1,0,0,1,1
2025-10-12,598e2471-2c6e-4746-bf14-48fe760a14fb,Happy Hour discount 02/01/2025,promotion,2025-02-01,None,N/A,,,,,,,$ Off,0.00,0.00,USD,Sierra Hwy,27476315,0,0.00,0.00,0.00,0.00,0.00,-0.00,-0.00,0.00,0.00,0.00,0,0,0,0,0,0,0,0
2025-10-12,77e23ebd-6e10-4113-938c-bb55550710f5,Spice <> Capriotti's - Sep / Oct,promotion,2025-09-18,None,N/A,,f06f33c5-bff5-4bb3-8dda-6cedeb2e6fc1,10% Happy hour Discount - Min $30 | Low Price Sensitivity,day,all,Order Discount,% Off,7.0%,30.00,USD,Horizon Ridge,75753,1,58.34,4.08,0.00,0.00,0.99,-0.00,-0.00,58.34,5.07,11.51,0,1,0,1,0,1,0,1
2025-10-12,77e23ebd-6e10-4113-938c-bb55550710f5,Spice <> Capriotti's - Sep / Oct,promotion,2025-09-18,None,N/A,,,,day,,,$ Off,0.00,0.00,USD,International Pkwy,24671402,0,0.00,0.00,0.00,0.00,0.00,-0.00,-0.00,0.00,0.00,0.00,0,0,0,0,0,0,0,0
2025-10-12,77e23ebd-6e10-4113-938c-bb55550710f5,Spice <> Capriotti's - Sep / Oct,promotion,2025-09-18,None,N/A,,d1d0b263-4918-4c81-8c97-630471e7185b,10% Happy Hour Discount - Medium Price Sensitivity,day,all,Order Discount,% Off,10.0%,25.00,USD,South Sandhill Rd,75741,1,37.77,3.78,0.00,0.00,0.99,-0.00,-0.00,37.77,4.77,7.92,0,1,0,1,0,0,0,0
2025-10-12,02d2c45e-5b6f-4058-b05d-1fbcb475312e,"First order, 20% off 04/09/2025",promotion,2025-04-09,None,N/A,,,,,,,$ Off,0.00,0.00,USD,Gambrills,24415514,1,17.98,3.60,0.00,0.00,0.99,-0.00,-0.00,17.98,4.59,3.92,1,0,0,1,0,0,0,0
2025-10-12,02d2c45e-5b6f-4058-b05d-1fbcb475312e,"First order, 20% off 04/09/2025",promotion,2025-04-09,None,N/A,,,,,,,$ Off,0.00,0.00,USD,Moreno Beach Drive,23085788,2,70.71,10.00,0.00,0.00,1.98,-0.00,-0.00,35.36,5.99,5.90,2,0,0,2,2,0,0,2
2025-10-12,77e23ebd-6e10-4113-938c-bb55550710f5,Spice <> Capriotti's - Sep / Oct,promotion,2025-09-18,None,N/A,,ba37e4d8-36c4-4cbe-8c7d-f4d1379109bd,"Spend $15, Save $3 | Low price Sensitivity",day,all,Order Discount,$ Off,3.00,15.00,USD,Happy Valley,23584856,1,19.19,3.00,0.00,0.00,0.99,-0.00,-0.00,19.19,3.99,4.81,0,0,1,1,0,0,0,0
2025-10-12,77e23ebd-6e10-4113-938c-bb55550710f5,Spice <> Capriotti's - Sep / Oct,promotion,2025-09-18,None,N/A,,91f90d8c-8a7d-41cf-9b6a-888400112024,10% Happy Hour Discount - Min  $25 | High Price Sensitivity,day,all,Order Discount,% Off,10.0%,25.00,USD,Concord Pike,23151390,5,248.84,21.29,0.00,0.00,4.95,-0.00,-0.00,49.77,5.25,9.48,1,3,1,5,0,2,0,2
2025-10-12,77e23ebd-6e10-4113-938c-bb55550710f5,Spice <> Capriotti's - Sep / Oct,promotion,2025-09-18,None,N/A,,,,day,,,$ Off,0.00,0.00,USD,West Basin Rd,575301,0,0.00,0.00,0.00,0.00,0.00,-0.00,-0.00,0.00,0.00,0.00,0,0,0,0,0,0,0,0
2025-10-12,77e23ebd-6e10-4113-938c-bb55550710f5,Spice <> Capriotti's - Sep / Oct,promotion,2025-09-18,None,N/A,,ba37e4d8-36c4-4cbe-8c7d-f4d1379109bd,"Spend $15, Save $3 | Low price Sensitivity",day,all,Order Discount,$ Off,3.00,15.00,USD,N 87th Street,27965,3,184.68,9.00,0.00,0.00,2.97,-0.00,-0.00,61.56,3.99,15.43,0,1,2,3,0,0,2,2
2025-10-12,ef08edf0-aabc-406a-bdf8-30534f44839a,Lunch specials item discount 09/25/2025,promotion,2025-09-25,2025-10-26,N/A,,,,,,,$ Off,0.00,0.00,USD,Niles Cortland Rd SE,34043935,3,73.92,14.64,0.00,0.00,0.00,-0.00,-0.00,24.64,4.88,5.05,2,1,0,3,2,1,0,3
2025-10-12,ff18ac99-74db-48ce-9c94-2959c91b6665,Capriotti's Sandwich Shop's Promo Campaign,promotion,2025-10-02,None,N/A,,,,day,,,$ Off,0.00,0.00,USD,Waialae Ave,25380836,0,0.00,0.00,0.00,0.00,0.00,-0.00,-0.00,0.00,0.00,0.00,0,0,0,0,0,0,0,0
2025-10-12,ff18ac99-74db-48ce-9c94-2959c91b6665,Capriotti's Sandwich Shop's Promo Campaign,promotion,2025-10-02,None,N/A,,a9ea1f37-2ee8-4c9b-ba40-bf2e0f2e84cd,10% Off Happy Hour Discount,day,all,Order Discount,% Off,10.0%,30.00,USD,Waialae Ave,25380836,0,0.00,0.00,0.00,0.00,0.00,-0.00,-0.00,0.00,0.00,0.00,0,0,0,0,0,0,0,0
2025-10-12,77e23ebd-6e10-4113-938c-bb55550710f5,Spice <> Capriotti's - Sep / Oct,promotion,2025-09-18,None,N/A,,ba37e4d8-36c4-4cbe-8c7d-f4d1379109bd,"Spend $15, Save $3 | Low price Sensitivity",day,all,Order Discount,$ Off,3.00,15.00,USD,Brayden Pkwy,2375657,2,100.68,6.00,0.00,0.00,1.98,-0.00,-0.00,50.34,3.99,12.62,0,2,0,2,0,2,0,2
2025-10-12,77e23ebd-6e10-4113-938c-bb55550710f5,Spice <> Capriotti's - Sep / Oct,promotion,2025-09-18,None,N/A,,,,day,,,$ Off,0.00,0.00,USD,Princeton,32118309,0,0.00,0.00,0.00,0.00,0.00,-0.00,-0.00,0.00,0.00,0.00,0,0,0,0,0,0,0,0
2025-10-12,70d4cf5a-37fe-47ad-bac7-d5196b53b89c,Spend $30 get 20% off 09/03/2025,promotion,2025-09-03,None,N/A,,,,,,,$ Off,0.00,0.00,USD,Grand Ave-Portland,1370229,16,738.06,138.04,0.00,0.00,15.84,-0.00,-0.00,46.13,9.62,4.80,4,7,5,16,4,6,2,12
2025-10-12,77e23ebd-6e10-4113-938c-bb55550710f5,Spice <> Capriotti's - Sep / Oct,promotion,2025-09-18,None,N/A,,ba37e4d8-36c4-4cbe-8c7d-f4d1379109bd,"Spend $15, Save $3 | Low price Sensitivity",day,all,Order Discount,$ Off,3.00,15.00,USD,Highlands Ranch,1791292,0,0.00,0.00,0.00,0.00,0.00,-0.00,-0.00,0.00,0.00,0.00,0,0,0,0,0,0,0,0
2025-10-12,77e23ebd-6e10-4113-938c-bb55550710f5,Spice <> Capriotti's - Sep / Oct,promotion,2025-09-18,None,N/A,,d1d0b263-4918-4c81-8c97-630471e7185b,10% Happy Hour Discount - Medium Price Sensitivity,day,all,Order Discount,% Off,10.0%,25.00,USD,Cranberry Township,24851842,0,0.00,0.00,0.00,0.00,0.00,-0.00,-0.00,0.00,0.00,0.00,0,0,0,0,0,0,0,0
2025-10-12,77e23ebd-6e10-4113-938c-bb55550710f5,Spice <> Capriotti's - Sep / Oct,promotion,2025-09-18,None,N/A,,ba37e4d8-36c4-4cbe-8c7d-f4d1379109bd,"Spend $15, Save $3 | Low price Sensitivity",day,all,Order Discount,$ Off,3.00,15.00,USD,North Boulder Hwy,75752,4,83.53,12.00,0.00,0.00,3.96,-0.00,-0.00,20.88,3.99,5.23,0,0,4,4,0,0,3,3
2025-10-12,77e23ebd-6e10-4113-938c-bb55550710f5,Spice <> Capriotti's - Sep / Oct,promotion,2025-09-18,None,N/A,,f06f33c5-bff5-4bb3-8dda-6cedeb2e6fc1,10% Happy hour Discount - Min $30 | Low Price Sensitivity,day,all,Order Discount,% Off,7.0%,30.00,USD,Downingtown,33699763,0,0.00,0.00,0.00,0.00,0.00,-0.00,-0.00,0.00,0.00,0.00,0,0,0,0,0,0,0,0
2025-10-12,77e23ebd-6e10-4113-938c-bb55550710f5,Spice <> Capriotti's - Sep / Oct,promotion,2025-09-18,None,N/A,,ba37e4d8-36c4-4cbe-8c7d-f4d1379109bd,"Spend $15, Save $3 | Low price Sensitivity",day,all,Order Discount,$ Off,3.00,15.00,USD,University Dr,29894178,2,50.26,6.00,0.00,0.00,1.98,-0.00,-0.00,25.13,3.99,6.30,0,2,0,2,0,2,0,2
2025-10-12,77e23ebd-6e10-4113-938c-bb55550710f5,Spice <> Capriotti's - Sep / Oct,promotion,2025-09-18,None,N/A,,,,day,,,$ Off,0.00,0.00,USD,Raccoon Rd,26015022,0,0.00,0.00,0.00,0.00,0.00,-0.00,-0.00,0.00,0.00,0.00,0,0,0,0,0,0,0,0
2025-10-12,ff18ac99-74db-48ce-9c94-2959c91b6665,Capriotti's Sandwich Shop's Promo Campaign,promotion,2025-10-02,None,N/A,,348d5036-ec24-4cbc-aaf8-9cd8d2a19433,Spend $15 - Save $3,day,all,Order Discount,$ Off,3.00,15.00,USD,Waialae Ave,25380836,3,161.43,9.00,0.00,0.00,2.97,-0.00,-0.00,53.81,3.99,13.49,2,1,0,3,2,1,0,3
2025-10-12,02d2c45e-5b6f-4058-b05d-1fbcb475312e,"First order, 20% off 04/09/2025",promotion,2025-04-09,None,N/A,,,,,,,$ Off,0.00,0.00,USD,South Eastern Ave,75744,1,15.07,3.01,0.00,0.00,0.99,-0.00,-0.00,15.07,4.00,3.77,1,0,0,1,1,0,0,1
2025-10-12,77e23ebd-6e10-4113-938c-bb55550710f5,Spice <> Capriotti's - Sep / Oct,promotion,2025-09-18,None,N/A,,,,day,,,$ Off,0.00,0.00,USD,East Sepulveda,1743753,0,0.00,0.00,0.00,0.00,0.00,-0.00,-0.00,0.00,0.00,0.00,0,0,0,0,0,0,0,0
2025-10-12,77e23ebd-6e10-4113-938c-bb55550710f5,Spice <> Capriotti's - Sep / Oct,promotion,2025-09-18,None,N/A,,,,day,,,$ Off,0.00,0.00,USD,Zionsville,24415273,0,0.00,0.00,0.00,0.00,0.00,-0.00,-0.00,0.00,0.00,0.00,0,0,0,0,0,0,0,0
2025-10-12,77e23ebd-6e10-4113-938c-bb55550710f5,Spice <> Capriotti's - Sep / Oct,promotion,2025-09-18,None,N/A,,91f90d8c-8a7d-41cf-9b6a-888400112024,10% Happy Hour Discount - Min  $25 | High Price Sensitivity,day,all,Order Discount,% Off,10.0%,25.00,USD,South  Walton Blvd,1616214,5,176.73,17.69,0.00,0.00,4.95,-0.00,-0.00,35.35,4.53,7.81,0,4,1,5,0,3,0,3
2025-10-12,02d2c45e-5b6f-4058-b05d-1fbcb475312e,"First order, 20% off 04/09/2025",promotion,2025-04-09,None,N/A,,,,,,,$ Off,0.00,0.00,USD,Governor Ritchie,24121153,8,292.76,36.56,0.00,0.00,7.92,-0.00,-0.00,36.60,5.56,6.58,8,0,0,8,3,0,0,3
2025-10-12,02d2c45e-5b6f-4058-b05d-1fbcb475312e,"First order, 20% off 04/09/2025",promotion,2025-04-09,None,N/A,,,,,,,$ Off,0.00,0.00,USD,Los Altos,33476901,5,162.08,24.56,0.00,0.00,4.95,-0.00,-0.00,32.42,5.90,5.49,5,0,0,5,1,0,0,1
2025-10-12,77e23ebd-6e10-4113-938c-bb55550710f5,Spice <> Capriotti's - Sep / Oct,promotion,2025-09-18,None,N/A,,f06f33c5-bff5-4bb3-8dda-6cedeb2e6fc1,10% Happy hour Discount - Min $30 | Low Price Sensitivity,day,all,Order Discount,% Off,7.0%,30.00,USD,South State Rd,1713806,3,205.29,13.50,0.00,0.00,2.97,-0.00,-0.00,68.43,5.49,12.46,1,2,0,3,1,2,0,3
2025-10-12,f12a26e0-24e1-4d8e-ac05-d7e43f06d2bf,Happy Hour discount 11/12/2024,promotion,2024-11-12,None,N/A,,,,,,,$ Off,0.00,0.00,USD,Collier Pkwy-Lutz,23057623,1,29.68,7.00,0.00,0.00,0.99,-0.00,-0.00,29.68,7.99,3.71,0,1,0,1,0,1,0,1
2025-10-12,02d2c45e-5b6f-4058-b05d-1fbcb475312e,"First order, 20% off 04/09/2025",promotion,2025-04-09,None,N/A,,,,,,,$ Off,0.00,0.00,USD,Millsboro Plaza,23360934,0,0.00,0.00,0.00,0.00,0.00,-0.00,-0.00,0.00,0.00,0.00,0,0,0,0,0,0,0,0
2025-10-12,02d2c45e-5b6f-4058-b05d-1fbcb475312e,"First order, 20% off 04/09/2025",promotion,2025-04-09,None,N/A,,,,,,,$ Off,0.00,0.00,USD,Meadows - Reno,705841,3,63.42,11.97,0.00,0.00,2.97,-0.00,-0.00,21.14,4.98,4.24,3,0,0,3,1,0,0,1
2025-10-12,02d2c45e-5b6f-4058-b05d-1fbcb475312e,"First order, 20% off 04/09/2025",promotion,2025-04-09,None,N/A,,,,,,,$ Off,0.00,0.00,USD,Heart Pine-Odessa,2232632,0,0.00,0.00,0.00,0.00,0.00,-0.00,-0.00,0.00,0.00,0.00,0,0,0,0,0,0,0,0
2025-10-12,02d2c45e-5b6f-4058-b05d-1fbcb475312e,"First order, 20% off 04/09/2025",promotion,2025-04-09,None,N/A,,,,,,,$ Off,0.00,0.00,USD,Horizon Ridge,75753,2,61.75,10.00,0.00,0.00,1.98,-0.00,-0.00,30.88,5.99,5.15,2,0,0,2,1,0,0,1
2025-10-12,b0ba6428-e0e2-4625-9d44-870d349157d5,Lunch specials discount 03/18/2025,promotion,2025-03-18,None,N/A,,,,,,,$ Off,0.00,0.00,USD,Townpark Lane,128721,4,77.62,18.05,0.00,0.00,0.00,-0.00,-0.00,19.41,4.51,4.30,2,2,0,4,0,1,0,1
2025-10-12,b1b17c93-8403-4c3e-a886-f72875e9d017,Spend $25 get $5 off 07/31/2024,promotion,2024-07-31,None,N/A,,,,,,,$ Off,0.00,0.00,USD,East Sepulveda,1743753,12,773.05,60.00,0.00,0.00,11.88,-0.00,-0.00,64.42,5.99,10.75,4,6,2,12,3,4,2,9
2025-10-12,02d2c45e-5b6f-4058-b05d-1fbcb475312e,"First order, 20% off 04/09/2025",promotion,2025-04-09,None,N/A,,,,,,,$ Off,0.00,0.00,USD,Paradise Road,75734,2,43.46,8.60,0.00,0.00,1.98,-0.00,-0.00,21.73,5.29,4.11,2,0,0,2,1,0,0,1
2025-10-12,02d2c45e-5b6f-4058-b05d-1fbcb475312e,"First order, 20% off 04/09/2025",promotion,2025-04-09,None,N/A,,,,,,,$ Off,0.00,0.00,USD,Magnolia Ave,31345441,3,118.01,15.00,0.00,0.00,2.97,-0.00,-0.00,39.34,5.99,6.57,3,0,0,3,2,0,0,2
2025-10-12,02d2c45e-5b6f-4058-b05d-1fbcb475312e,"First order, 20% off 04/09/2025",promotion,2025-04-09,None,N/A,,,,,,,$ Off,0.00,0.00,USD,Collier Pkwy-Lutz,23057623,0,0.00,0.00,0.00,0.00,0.00,-0.00,-0.00,0.00,0.00,0.00,0,0,0,0,0,0,0,0
2025-10-12,02d2c45e-5b6f-4058-b05d-1fbcb475312e,"First order, 20% off 04/09/2025",promotion,2025-04-09,None,N/A,,,,,,,$ Off,0.00,0.00,USD,Red Rock Casino,75737,0,0.00,0.00,0.00,0.00,0.00,-0.00,-0.00,0.00,0.00,0.00,0,0,0,0,0,0,0,0
2025-10-12,77e23ebd-6e10-4113-938c-bb55550710f5,Spice <> Capriotti's - Sep / Oct,promotion,2025-09-18,None,N/A,,ba37e4d8-36c4-4cbe-8c7d-f4d1379109bd,"Spend $15, Save $3 | Low price Sensitivity",day,all,Order Discount,$ Off,3.00,15.00,USD,Limonite Ave,2375675,2,61.55,6.00,0.00,0.00,1.98,-0.00,-0.00,30.78,3.99,7.71,0,1,1,2,0,1,0,1
2025-10-12,77e23ebd-6e10-4113-938c-bb55550710f5,Spice <> Capriotti's - Sep / Oct,promotion,2025-09-18,None,N/A,,d1d0b263-4918-4c81-8c97-630471e7185b,10% Happy Hour Discount - Medium Price Sensitivity,day,all,Order Discount,% Off,10.0%,25.00,USD,Barnes Road,24892677,1,43.78,4.38,0.00,0.00,0.99,-0.00,-0.00,43.78,5.37,8.15,0,1,0,1,0,0,0,0
2025-10-12,58fe435a-cdf8-4a86-abc7-b68d7b574ba5,Spend $25 Get 20% Off,promotion,2022-12-01,None,N/A,,,,,,,$ Off,0.00,0.00,USD,Coeur d'Alene,23085790,7,302.23,51.64,0.00,0.00,6.93,-0.00,-0.00,43.18,8.37,5.16,1,3,3,7,0,3,2,5
2025-10-12,02d2c45e-5b6f-4058-b05d-1fbcb475312e,"First order, 20% off 04/09/2025",promotion,2025-04-09,None,N/A,,,,,,,$ Off,0.00,0.00,USD,Bel Air,23733193,5,188.64,25.00,0.00,0.00,4.95,-0.00,-0.00,37.73,5.99,6.30,5,0,0,5,2,0,0,2
2025-10-12,02d2c45e-5b6f-4058-b05d-1fbcb475312e,"First order, 20% off 04/09/2025",promotion,2025-04-09,None,N/A,,,,,,,$ Off,0.00,0.00,USD,Limonite Ave,2375675,2,51.57,8.72,0.00,0.00,1.98,-0.00,-0.00,25.79,5.35,4.82,2,0,0,2,1,0,0,1
2025-10-12,02d2c45e-5b6f-4058-b05d-1fbcb475312e,"First order, 20% off 04/09/2025",promotion,2025-04-09,None,N/A,,,,,,,$ Off,0.00,0.00,USD,S Fort Apache,75730,4,107.82,16.94,0.00,0.00,3.96,-0.00,-0.00,26.96,5.23,5.16,4,0,0,4,4,0,0,4
2025-10-12,bf29a390-e14d-4578-af85-d658942a738b,Loyalty Promo - Capriotti's Sandwich Shop (bus id: 768909),promotion,2024-04-26,2034-04-26,N/A,,,,,,,$ Off,0.00,0.00,USD,"Capriotti's of Dover, Inc.",1617804,0,0.00,0.00,0.00,0.00,0.00,-0.00,-0.00,0.00,0.00,0.00,0,0,0,0,0,0,0,0
2025-10-12,77e23ebd-6e10-4113-938c-bb55550710f5,Spice <> Capriotti's - Sep / Oct,promotion,2025-09-18,None,N/A,,,,day,,,$ Off,0.00,0.00,USD,Catclaw - Abilene,29652227,0,0.00,0.00,0.00,0.00,0.00,-0.00,-0.00,0.00,0.00,0.00,0,0,0,0,0,0,0,0
2025-10-12,77e23ebd-6e10-4113-938c-bb55550710f5,Spice <> Capriotti's - Sep / Oct,promotion,2025-09-18,None,N/A,,ba37e4d8-36c4-4cbe-8c7d-f4d1379109bd,"Spend $15, Save $3 | Low price Sensitivity",day,all,Order Discount,$ Off,3.00,15.00,USD,Gambrills,24415514,0,0.00,0.00,0.00,0.00,0.00,-0.00,-0.00,0.00,0.00,0.00,0,0,0,0,0,0,0,0
2025-10-12,02d2c45e-5b6f-4058-b05d-1fbcb475312e,"First order, 20% off 04/09/2025",promotion,2025-04-09,None,N/A,,,,,,,$ Off,0.00,0.00,USD,Forest Drive,674540,1,23.26,4.65,0.00,0.00,0.99,-0.00,-0.00,23.26,5.64,4.12,1,0,0,1,0,0,0,0
2025-10-12,9708621d-8c94-41e7-8a63-2da71ea0199e,"Dormant customers, 20% off 07/02/2025",promotion,2025-07-02,None,N/A,,,,,,,$ Off,0.00,0.00,USD,Southern Highlands,1750142,0,0.00,0.00,0.00,0.00,0.00,-0.00,-0.00,0.00,0.00,0.00,0,0,0,0,0,0,0,0
2025-10-12,77e23ebd-6e10-4113-938c-bb55550710f5,Spice <> Capriotti's - Sep / Oct,promotion,2025-09-18,None,N/A,,ba37e4d8-36c4-4cbe-8c7d-f4d1379109bd,"Spend $15, Save $3 | Low price Sensitivity",day,all,Order Discount,$ Off,3.00,15.00,USD,Zionsville,24415273,0,0.00,0.00,0.00,0.00,0.00,-0.00,-0.00,0.00,0.00,0.00,0,0,0,0,0,0,0,0
2025-10-12,02d2c45e-5b6f-4058-b05d-1fbcb475312e,"First order, 20% off 04/09/2025",promotion,2025-04-09,None,N/A,,,,,,,$ Off,0.00,0.00,USD,Anthem,75750,0,0.00,0.00,0.00,0.00,0.00,-0.00,-0.00,0.00,0.00,0.00,0,0,0,0,0,0,0,0
2025-10-12,02d2c45e-5b6f-4058-b05d-1fbcb475312e,"First order, 20% off 04/09/2025",promotion,2025-04-09,None,N/A,,,,,,,$ Off,0.00,0.00,USD,Maryland Pkwy,1007892,0,0.00,0.00,0.00,0.00,0.00,-0.00,-0.00,0.00,0.00,0.00,0,0,0,0,0,0,0,0
2025-10-12,77e23ebd-6e10-4113-938c-bb55550710f5,Spice <> Capriotti's - Sep / Oct,promotion,2025-09-18,None,N/A,,,,day,,,$ Off,0.00,0.00,USD,Bidwell - Folsom,26234909,0,0.00,0.00,0.00,0.00,0.00,-0.00,-0.00,0.00,0.00,0.00,0,0,0,0,0,0,0,0
2025-10-12,02d2c45e-5b6f-4058-b05d-1fbcb475312e,"First order, 20% off 04/09/2025",promotion,2025-04-09,None,N/A,,,,,,,$ Off,0.00,0.00,USD,Cheyenne Rd,2375637,1,36.76,5.00,0.00,0.00,0.99,-0.00,-0.00,36.76,5.99,6.14,1,0,0,1,0,0,0,0
2025-10-12,02d2c45e-5b6f-4058-b05d-1fbcb475312e,"First order, 20% off 04/09/2025",promotion,2025-04-09,None,N/A,,,,,,,$ Off,0.00,0.00,USD,Zionsville,24415273,0,0.00,0.00,0.00,0.00,0.00,-0.00,-0.00,0.00,0.00,0.00,0,0,0,0,0,0,0,0
2025-10-12,77e23ebd-6e10-4113-938c-bb55550710f5,Spice <> Capriotti's - Sep / Oct,promotion,2025-09-18,None,N/A,,91f90d8c-8a7d-41cf-9b6a-888400112024,10% Happy Hour Discount - Min  $25 | High Price Sensitivity,day,all,Order Discount,% Off,10.0%,25.00,USD,Silverside Road,691182,4,172.00,15.12,0.00,0.00,3.96,-0.00,-0.00,43.00,4.77,9.01,1,2,1,4,0,2,0,2
2025-10-12,77e23ebd-6e10-4113-938c-bb55550710f5,Spice <> Capriotti's - Sep / Oct,promotion,2025-09-18,None,N/A,,,,day,,,$ Off,0.00,0.00,USD,Downingtown,33699763,0,0.00,0.00,0.00,0.00,0.00,-0.00,-0.00,0.00,0.00,0.00,0,0,0,0,0,0,0,0
2025-10-12,77e23ebd-6e10-4113-938c-bb55550710f5,Spice <> Capriotti's - Sep / Oct,promotion,2025-09-18,None,N/A,,91f90d8c-8a7d-41cf-9b6a-888400112024,10% Happy Hour Discount - Min  $25 | High Price Sensitivity,day,all,Order Discount,% Off,10.0%,25.00,USD,Chicago River West,34048823,3,95.24,9.53,0.00,0.00,2.97,-0.00,-0.00,31.75,4.17,7.62,1,2,0,3,0,2,0,2
2025-10-12,77e23ebd-6e10-4113-938c-bb55550710f5,Spice <> Capriotti's - Sep / Oct,promotion,2025-09-18,None,N/A,,d1d0b263-4918-4c81-8c97-630471e7185b,10% Happy Hour Discount - Medium Price Sensitivity,day,all,Order Discount,% Off,10.0%,25.00,USD,Plumb Lane,439577,0,0.00,0.00,0.00,0.00,0.00,-0.00,-0.00,0.00,0.00,0.00,0,0,0,0,0,0,0,0
2025-10-12,77e23ebd-6e10-4113-938c-bb55550710f5,Spice <> Capriotti's - Sep / Oct,promotion,2025-09-18,None,N/A,,d1d0b263-4918-4c81-8c97-630471e7185b,10% Happy Hour Discount - Medium Price Sensitivity,day,all,Order Discount,% Off,10.0%,25.00,USD,Magnolia Ave,31345441,2,88.54,8.05,0.00,0.00,1.98,-0.00,-0.00,44.27,5.02,8.83,0,2,0,2,0,1,0,1
2025-10-12,77e23ebd-6e10-4113-938c-bb55550710f5,Spice <> Capriotti's - Sep / Oct,promotion,2025-09-18,None,N/A,,,,day,,,$ Off,0.00,0.00,USD,Douglas Blvd,1018616,0,0.00,0.00,0.00,0.00,0.00,-0.00,-0.00,0.00,0.00,0.00,0,0,0,0,0,0,0,0
2025-10-12,77e23ebd-6e10-4113-938c-bb55550710f5,Spice <> Capriotti's - Sep / Oct,promotion,2025-09-18,None,N/A,,,,day,,,$ Off,0.00,0.00,USD,Parker,24021312,0,0.00,0.00,0.00,0.00,0.00,-0.00,-0.00,0.00,0.00,0.00,0,0,0,0,0,0,0,0
2025-10-12,77e23ebd-6e10-4113-938c-bb55550710f5,Spice <> Capriotti's - Sep / Oct,promotion,2025-09-18,None,N/A,,d1d0b263-4918-4c81-8c97-630471e7185b,10% Happy Hour Discount - Medium Price Sensitivity,day,all,Order Discount,% Off,10.0%,25.00,USD,Roanoke,24637171,3,109.14,10.64,0.00,0.00,2.97,-0.00,-0.00,36.38,4.54,8.02,0,1,2,3,0,1,2,3
2025-10-12,77e23ebd-6e10-4113-938c-bb55550710f5,Spice <> Capriotti's - Sep / Oct,promotion,2025-09-18,None,N/A,,ba37e4d8-36c4-4cbe-8c7d-f4d1379109bd,"Spend $15, Save $3 | Low price Sensitivity",day,all,Order Discount,$ Off,3.00,15.00,USD,Anthem,75750,1,18.47,3.00,0.00,0.00,0.99,-0.00,-0.00,18.47,3.99,4.63,0,1,0,1,0,1,0,1
2025-10-12,77e23ebd-6e10-4113-938c-bb55550710f5,Spice <> Capriotti's - Sep / Oct,promotion,2025-09-18,None,N/A,,f06f33c5-bff5-4bb3-8dda-6cedeb2e6fc1,10% Happy hour Discount - Min $30 | Low Price Sensitivity,day,all,Order Discount,% Off,7.0%,30.00,USD,North Boulder Hwy,75752,2,100.32,7.02,0.00,0.00,1.98,-0.00,-0.00,50.16,4.50,11.15,0,1,1,2,0,1,0,1
2025-10-12,77e23ebd-6e10-4113-938c-bb55550710f5,Spice <> Capriotti's - Sep / Oct,promotion,2025-09-18,None,N/A,,,,day,,,$ Off,0.00,0.00,USD,Coeur d'Alene,23085790,0,0.00,0.00,0.00,0.00,0.00,-0.00,-0.00,0.00,0.00,0.00,0,0,0,0,0,0,0,0
2025-10-12,77e23ebd-6e10-4113-938c-bb55550710f5,Spice <> Capriotti's - Sep / Oct,promotion,2025-09-18,None,N/A,,d1d0b263-4918-4c81-8c97-630471e7185b,10% Happy Hour Discount - Medium Price Sensitivity,day,all,Order Discount,% Off,10.0%,25.00,USD,1st Ave NE,23128705,0,0.00,0.00,0.00,0.00,0.00,-0.00,-0.00,0.00,0.00,0.00,0,0,0,0,0,0,0,0
2025-10-12,77e23ebd-6e10-4113-938c-bb55550710f5,Spice <> Capriotti's - Sep / Oct,promotion,2025-09-18,None,N/A,,ba37e4d8-36c4-4cbe-8c7d-f4d1379109bd,"Spend $15, Save $3 | Low price Sensitivity",day,all,Order Discount,$ Off,3.00,15.00,USD,Sumneytown Pike,24717004,4,99.11,12.00,0.00,0.00,3.96,-0.00,-0.00,24.78,3.99,6.21,0,4,0,4,0,2,0,2
2025-10-12,77e23ebd-6e10-4113-938c-bb55550710f5,Spice <> Capriotti's - Sep / Oct,promotion,2025-09-18,None,N/A,,f06f33c5-bff5-4bb3-8dda-6cedeb2e6fc1,10% Happy hour Discount - Min $30 | Low Price Sensitivity,day,all,Order Discount,% Off,7.0%,30.00,USD,Mountain View,2608887,0,0.00,0.00,0.00,0.00,0.00,-0.00,-0.00,0.00,0.00,0.00,0,0,0,0,0,0,0,0
2025-10-12,77e23ebd-6e10-4113-938c-bb55550710f5,Spice <> Capriotti's - Sep / Oct,promotion,2025-09-18,None,N/A,,d1d0b263-4918-4c81-8c97-630471e7185b,10% Happy Hour Discount - Medium Price Sensitivity,day,all,Order Discount,% Off,10.0%,25.00,USD,Downtown Summerlin,75736,0,0.00,0.00,0.00,0.00,0.00,-0.00,-0.00,0.00,0.00,0.00,0,0,0,0,0,0,0,0
2025-10-12,77e23ebd-6e10-4113-938c-bb55550710f5,Spice <> Capriotti's - Sep / Oct,promotion,2025-09-18,None,N/A,,ba37e4d8-36c4-4cbe-8c7d-f4d1379109bd,"Spend $15, Save $3 | Low price Sensitivity",day,all,Order Discount,$ Off,3.00,15.00,USD,GVR Casino,75749,1,15.99,3.00,0.00,0.00,0.99,-0.00,-0.00,15.99,3.99,4.01,0,1,0,1,0,1,0,1
2025-10-12,77e23ebd-6e10-4113-938c-bb55550710f5,Spice <> Capriotti's - Sep / Oct,promotion,2025-09-18,None,N/A,,,,day,,,$ Off,0.00,0.00,USD,Anthem,75750,0,0.00,0.00,0.00,0.00,0.00,-0.00,-0.00,0.00,0.00,0.00,0,0,0,0,0,0,0,0
2025-10-12,77e23ebd-6e10-4113-938c-bb55550710f5,Spice <> Capriotti's - Sep / Oct,promotion,2025-09-18,None,N/A,,ba37e4d8-36c4-4cbe-8c7d-f4d1379109bd,"Spend $15, Save $3 | Low price Sensitivity",day,all,Order Discount,$ Off,3.00,15.00,USD,Sierra Hwy,27476315,0,0.00,0.00,0.00,0.00,0.00,-0.00,-0.00,0.00,0.00,0.00,0,0,0,0,0,0,0,0
2025-10-12,77e23ebd-6e10-4113-938c-bb55550710f5,Spice <> Capriotti's - Sep / Oct,promotion,2025-09-18,None,N/A,,,,day,,,$ Off,0.00,0.00,USD,Frisco,34516355,0,0.00,0.00,0.00,0.00,0.00,-0.00,-0.00,0.00,0.00,0.00,0,0,0,0,0,0,0,0
2025-10-12,77e23ebd-6e10-4113-938c-bb55550710f5,Spice <> Capriotti's - Sep / Oct,promotion,2025-09-18,None,N/A,,d1d0b263-4918-4c81-8c97-630471e7185b,10% Happy Hour Discount - Medium Price Sensitivity,day,all,Order Discount,% Off,10.0%,25.00,USD,State and 6100 S,2608908,3,122.39,11.53,0.00,0.00,2.97,-0.00,-0.00,40.80,4.83,8.44,1,2,0,3,0,2,0,2
2025-10-12,77e23ebd-6e10-4113-938c-bb55550710f5,Spice <> Capriotti's - Sep / Oct,promotion,2025-09-18,None,N/A,,d1d0b263-4918-4c81-8c97-630471e7185b,10% Happy Hour Discount - Medium Price Sensitivity,day,all,Order Discount,% Off,10.0%,25.00,USD,S Stanford Way,699470,2,91.84,8.43,0.00,0.00,1.98,-0.00,-0.00,45.92,5.21,8.82,0,1,1,2,0,0,1,1
2025-10-12,77e23ebd-6e10-4113-938c-bb55550710f5,Spice <> Capriotti's - Sep / Oct,promotion,2025-09-18,None,N/A,,f06f33c5-bff5-4bb3-8dda-6cedeb2e6fc1,10% Happy hour Discount - Min $30 | Low Price Sensitivity,day,all,Order Discount,% Off,7.0%,30.00,USD,Cortez Rd  West,26034424,0,0.00,0.00,0.00,0.00,0.00,-0.00,-0.00,0.00,0.00,0.00,0,0,0,0,0,0,0,0
2025-10-12,77e23ebd-6e10-4113-938c-bb55550710f5,Spice <> Capriotti's - Sep / Oct,promotion,2025-09-18,None,N/A,,d1d0b263-4918-4c81-8c97-630471e7185b,10% Happy Hour Discount - Medium Price Sensitivity,day,all,Order Discount,% Off,10.0%,25.00,USD,Blue Diamond Road,333447,1,27.49,2.75,0.00,0.00,0.99,-0.00,-0.00,27.49,3.74,7.35,0,1,0,1,0,1,0,1
2025-10-12,77e23ebd-6e10-4113-938c-bb55550710f5,Spice <> Capriotti's - Sep / Oct,promotion,2025-09-18,None,N/A,,,,day,,,$ Off,0.00,0.00,USD,Hamilton Blvd,23066760,0,0.00,0.00,0.00,0.00,0.00,-0.00,-0.00,0.00,0.00,0.00,0,0,0,0,0,0,0,0
2025-10-12,77e23ebd-6e10-4113-938c-bb55550710f5,Spice <> Capriotti's - Sep / Oct,promotion,2025-09-18,None,N/A,,,,day,,,$ Off,0.00,0.00,USD,Palm Ave - Fresno,1581092,0,0.00,0.00,0.00,0.00,0.00,-0.00,-0.00,0.00,0.00,0.00,0,0,0,0,0,0,0,0
2025-10-12,77e23ebd-6e10-4113-938c-bb55550710f5,Spice <> Capriotti's - Sep / Oct,promotion,2025-09-18,None,N/A,,ba37e4d8-36c4-4cbe-8c7d-f4d1379109bd,"Spend $15, Save $3 | Low price Sensitivity",day,all,Order Discount,$ Off,3.00,15.00,USD,St Rose Pkwy,1335286,3,94.02,9.00,0.00,0.00,2.97,-0.00,-0.00,31.34,3.99,7.85,0,3,0,3,0,2,0,2
2025-10-12,77e23ebd-6e10-4113-938c-bb55550710f5,Spice <> Capriotti's - Sep / Oct,promotion,2025-09-18,None,N/A,,,,day,,,$ Off,0.00,0.00,USD,West Fullerton Ave,23349403,0,0.00,0.00,0.00,0.00,0.00,-0.00,-0.00,0.00,0.00,0.00,0,0,0,0,0,0,0,0
2025-10-12,77e23ebd-6e10-4113-938c-bb55550710f5,Spice <> Capriotti's - Sep / Oct,promotion,2025-09-18,None,N/A,,d1d0b263-4918-4c81-8c97-630471e7185b,10% Happy Hour Discount - Medium Price Sensitivity,day,all,Order Discount,% Off,10.0%,25.00,USD,Cheyenne and 215,388423,0,0.00,0.00,0.00,0.00,0.00,-0.00,-0.00,0.00,0.00,0.00,0,0,0,0,0,0,0,0
2025-10-12,77e23ebd-6e10-4113-938c-bb55550710f5,Spice <> Capriotti's - Sep / Oct,promotion,2025-09-18,None,N/A,,d1d0b263-4918-4c81-8c97-630471e7185b,10% Happy Hour Discount - Medium Price Sensitivity,day,all,Order Discount,% Off,10.0%,25.00,USD,Aliante Casino,75725,1,53.46,5.00,0.00,0.00,0.99,-0.00,-0.00,53.46,5.99,8.92,0,1,0,1,0,1,0,1
2025-10-12,77e23ebd-6e10-4113-938c-bb55550710f5,Spice <> Capriotti's - Sep / Oct,promotion,2025-09-18,None,N/A,,d1d0b263-4918-4c81-8c97-630471e7185b,10% Happy Hour Discount - Medium Price Sensitivity,day,all,Order Discount,% Off,10.0%,25.00,USD,West Avera Dr,1742446,0,0.00,0.00,0.00,0.00,0.00,-0.00,-0.00,0.00,0.00,0.00,0,0,0,0,0,0,0,0
2025-10-12,77e23ebd-6e10-4113-938c-bb55550710f5,Spice <> Capriotti's - Sep / Oct,promotion,2025-09-18,None,N/A,,,,day,,,$ Off,0.00,0.00,USD,North Boulder Hwy,75752,0,0.00,0.00,0.00,0.00,0.00,-0.00,-0.00,0.00,0.00,0.00,0,0,0,0,0,0,0,0
2025-10-12,77e23ebd-6e10-4113-938c-bb55550710f5,Spice <> Capriotti's - Sep / Oct,promotion,2025-09-18,None,N/A,,f06f33c5-bff5-4bb3-8dda-6cedeb2e6fc1,10% Happy hour Discount - Min $30 | Low Price Sensitivity,day,all,Order Discount,% Off,7.0%,30.00,USD,Bel Air,23733193,0,0.00,0.00,0.00,0.00,0.00,-0.00,-0.00,0.00,0.00,0.00,0,0,0,0,0,0,0,0
2025-10-12,77e23ebd-6e10-4113-938c-bb55550710f5,Spice <> Capriotti's - Sep / Oct,promotion,2025-09-18,None,N/A,,d1d0b263-4918-4c81-8c97-630471e7185b,10% Happy Hour Discount - Medium Price Sensitivity,day,all,Order Discount,% Off,10.0%,25.00,USD,Cheyenne Rd,2375637,0,0.00,0.00,0.00,0.00,0.00,-0.00,-0.00,0.00,0.00,0.00,0,0,0,0,0,0,0,0
2025-10-12,77e23ebd-6e10-4113-938c-bb55550710f5,Spice <> Capriotti's - Sep / Oct,promotion,2025-09-18,None,N/A,,,,day,,,$ Off,0.00,0.00,USD,Bel Air,23733193,0,0.00,0.00,0.00,0.00,0.00,-0.00,-0.00,0.00,0.00,0.00,0,0,0,0,0,0,0,0
2025-10-12,77e23ebd-6e10-4113-938c-bb55550710f5,Spice <> Capriotti's - Sep / Oct,promotion,2025-09-18,None,N/A,,ba37e4d8-36c4-4cbe-8c7d-f4d1379109bd,"Spend $15, Save $3 | Low price Sensitivity",day,all,Order Discount,$ Off,3.00,15.00,USD,University Ave,1084955,6,173.32,18.00,0.00,0.00,5.94,-0.00,-0.00,28.89,3.99,7.24,0,4,2,6,0,2,2,4
2025-10-12,77e23ebd-6e10-4113-938c-bb55550710f5,Spice <> Capriotti's - Sep / Oct,promotion,2025-09-18,None,N/A,,ba37e4d8-36c4-4cbe-8c7d-f4d1379109bd,"Spend $15, Save $3 | Low price Sensitivity",day,all,Order Discount,$ Off,3.00,15.00,USD,N Broad St,578662,4,119.90,12.00,0.00,0.00,3.96,-0.00,-0.00,29.98,3.99,7.51,0,3,1,4,0,2,1,3
2025-10-12,77e23ebd-6e10-4113-938c-bb55550710f5,Spice <> Capriotti's - Sep / Oct,promotion,2025-09-18,None,N/A,,43340528-e1b7-4f95-ab40-8dc92bf9c274,"Spend $35, Save $6 | High Price Sensitivity",day,all,Order Discount,$ Off,6.00,35.00,USD,Concord Pike,23151390,0,0.00,0.00,0.00,0.00,0.00,-0.00,-0.00,0.00,0.00,0.00,0,0,0,0,0,0,0,0
2025-10-12,77e23ebd-6e10-4113-938c-bb55550710f5,Spice <> Capriotti's - Sep / Oct,promotion,2025-09-18,None,N/A,,,,day,,,$ Off,0.00,0.00,USD,Limonite Ave,2375675,0,0.00,0.00,0.00,0.00,0.00,-0.00,-0.00,0.00,0.00,0.00,0,0,0,0,0,0,0,0
2025-10-12,178f54dc-804b-413e-b1bd-ffbdde7f61a1,"Dormant customers, 20% off 02/01/2025",promotion,2025-02-01,None,N/A,,,,,,,$ Off,0.00,0.00,USD,De Soto-Chatsworth,651597,2,38.86,7.78,0.00,0.00,1.98,-0.00,-0.00,19.43,4.88,3.98,0,0,2,2,0,0,2,2
2025-10-12,77e23ebd-6e10-4113-938c-bb55550710f5,Spice <> Capriotti's - Sep / Oct,promotion,2025-09-18,None,N/A,,ba37e4d8-36c4-4cbe-8c7d-f4d1379109bd,"Spend $15, Save $3 | Low price Sensitivity",day,all,Order Discount,$ Off,3.00,15.00,USD,Nevada Way,75754,0,0.00,0.00,0.00,0.00,0.00,-0.00,-0.00,0.00,0.00,0.00,0,0,0,0,0,0,0,0
2025-10-12,02d2c45e-5b6f-4058-b05d-1fbcb475312e,"First order, 20% off 04/09/2025",promotion,2025-04-09,None,N/A,,,,,,,$ Off,0.00,0.00,USD,Jennersville Rd,433075,1,40.06,5.00,0.00,0.00,0.99,-0.00,-0.00,40.06,5.99,6.69,1,0,0,1,0,0,0,0
2025-10-12,77e23ebd-6e10-4113-938c-bb55550710f5,Spice <> Capriotti's - Sep / Oct,promotion,2025-09-18,None,N/A,,,,day,,,$ Off,0.00,0.00,USD,Governor Ritchie,24121153,0,0.00,0.00,0.00,0.00,0.00,-0.00,-0.00,0.00,0.00,0.00,0,0,0,0,0,0,0,0
2025-10-12,02d2c45e-5b6f-4058-b05d-1fbcb475312e,"First order, 20% off 04/09/2025",promotion,2025-04-09,None,N/A,,,,,,,$ Off,0.00,0.00,USD,Lantana Drive,390888,2,74.41,10.00,0.00,0.00,1.98,-0.00,-0.00,37.21,5.99,6.21,1,0,1,2,0,0,0,0
2025-10-12,03e9f5c4-3136-4c5b-bb26-18b988f441f5,"Buy 1, get 1 free promotion 07/24/2025",promotion,2025-07-24,None,N/A,,,,,,,$ Off,0.00,0.00,USD,West Fullerton Ave,23349403,1,29.76,4.69,0.00,0.00,0.99,-0.00,-0.00,29.76,5.68,5.24,1,0,0,1,0,0,0,0
2025-10-12,77e23ebd-6e10-4113-938c-bb55550710f5,Spice <> Capriotti's - Sep / Oct,promotion,2025-09-18,None,N/A,,f06f33c5-bff5-4bb3-8dda-6cedeb2e6fc1,10% Happy hour Discount - Min $30 | Low Price Sensitivity,day,all,Order Discount,% Off,7.0%,30.00,USD,East Sepulveda,1743753,0,0.00,0.00,0.00,0.00,0.00,-0.00,-0.00,0.00,0.00,0.00,0,0,0,0,0,0,0,0
2025-10-12,77e23ebd-6e10-4113-938c-bb55550710f5,Spice <> Capriotti's - Sep / Oct,promotion,2025-09-18,None,N/A,,f06f33c5-bff5-4bb3-8dda-6cedeb2e6fc1,10% Happy hour Discount - Min $30 | Low Price Sensitivity,day,all,Order Discount,% Off,7.0%,30.00,USD,Heart Pine-Odessa,2232632,0,0.00,0.00,0.00,0.00,0.00,-0.00,-0.00,0.00,0.00,0.00,0,0,0,0,0,0,0,0
2025-10-12,77e23ebd-6e10-4113-938c-bb55550710f5,Spice <> Capriotti's - Sep / Oct,promotion,2025-09-18,None,N/A,,d1d0b263-4918-4c81-8c97-630471e7185b,10% Happy Hour Discount - Medium Price Sensitivity,day,all,Order Discount,% Off,10.0%,25.00,USD,Post Falls,34326515,1,41.87,4.19,0.00,0.00,0.99,-0.00,-0.00,41.87,5.18,8.08,0,1,0,1,0,0,0,0
2025-10-12,02d2c45e-5b6f-4058-b05d-1fbcb475312e,"First order, 20% off 04/09/2025",promotion,2025-04-09,None,N/A,,,,,,,$ Off,0.00,0.00,USD,Cranberry Township,24851842,0,0.00,0.00,0.00,0.00,0.00,-0.00,-0.00,0.00,0.00,0.00,0,0,0,0,0,0,0,0
2025-10-12,bb58e40c-0a14-4e1f-bb4a-73209746887e,Spend $35 get 20% off 02/17/2025,promotion,2025-02-17,None,N/A,,,,,,,$ Off,0.00,0.00,USD,Cranberry Township,24851842,1,43.15,8.63,0.00,0.00,0.99,-0.00,-0.00,43.15,9.62,4.49,0,0,1,1,0,0,1,1
2025-10-12,02d2c45e-5b6f-4058-b05d-1fbcb475312e,"First order, 20% off 04/09/2025",promotion,2025-04-09,None,N/A,,,,,,,$ Off,0.00,0.00,USD,Arapahoe Rd,23349425,4,143.06,19.35,0.00,0.00,3.96,-0.00,-0.00,35.77,5.83,6.14,4,0,0,4,3,0,0,3
2025-10-12,02d2c45e-5b6f-4058-b05d-1fbcb475312e,"First order, 20% off 04/09/2025",promotion,2025-04-09,None,N/A,,,,,,,$ Off,0.00,0.00,USD,Aliante Casino,75725,0,0.00,0.00,0.00,0.00,0.00,-0.00,-0.00,0.00,0.00,0.00,0,0,0,0,0,0,0,0
2025-10-12,77e23ebd-6e10-4113-938c-bb55550710f5,Spice <> Capriotti's - Sep / Oct,promotion,2025-09-18,None,N/A,,ba37e4d8-36c4-4cbe-8c7d-f4d1379109bd,"Spend $15, Save $3 | Low price Sensitivity",day,all,Order Discount,$ Off,3.00,15.00,USD,Heart Pine-Odessa,2232632,1,28.58,3.00,0.00,0.00,0.99,-0.00,-0.00,28.58,3.99,7.16,0,1,0,1,0,0,0,0
2025-10-12,02d2c45e-5b6f-4058-b05d-1fbcb475312e,"First order, 20% off 04/09/2025",promotion,2025-04-09,None,N/A,,,,,,,$ Off,0.00,0.00,USD,East Craig Road,75739,6,158.82,26.62,0.00,0.00,5.94,-0.00,-0.00,26.47,5.43,4.88,6,0,0,6,3,0,0,3
2025-10-12,02d2c45e-5b6f-4058-b05d-1fbcb475312e,"First order, 20% off 04/09/2025",promotion,2025-04-09,None,N/A,,,,,,,$ Off,0.00,0.00,USD,Marlboro - Easton,674514,1,34.86,5.00,0.00,0.00,0.99,-0.00,-0.00,34.86,5.99,5.82,1,0,0,1,1,0,0,1
2025-10-12,02d2c45e-5b6f-4058-b05d-1fbcb475312e,"First order, 20% off 04/09/2025",promotion,2025-04-09,None,N/A,,,,,,,$ Off,0.00,0.00,USD,"Capriotti's of Dover, Inc.",1617804,0,0.00,0.00,0.00,0.00,0.00,-0.00,-0.00,0.00,0.00,0.00,0,0,0,0,0,0,0,0
2025-10-12,02d2c45e-5b6f-4058-b05d-1fbcb475312e,"First order, 20% off 04/09/2025",promotion,2025-04-09,None,N/A,,,,,,,$ Off,0.00,0.00,USD,W Blue Diamond Rd,75738,2,71.86,10.00,0.00,0.00,1.98,-0.00,-0.00,35.93,5.99,6.00,2,0,0,2,1,0,0,1
2025-10-12,02d2c45e-5b6f-4058-b05d-1fbcb475312e,"First order, 20% off 04/09/2025",promotion,2025-04-09,None,N/A,,,,,,,$ Off,0.00,0.00,USD,Nature Park Drive,75726,0,0.00,0.00,0.00,0.00,0.00,-0.00,-0.00,0.00,0.00,0.00,0,0,0,0,0,0,0,0
2025-10-12,50157030-02ee-4b4c-b1a0-c9d30675c82e,Spend $30 get 20% off 03/10/2025,promotion,2025-03-10,None,N/A,,,,,,,$ Off,0.00,0.00,USD,Kenosha & 177th,1856591,14,732.28,115.12,0.00,0.00,13.86,-0.00,-0.00,52.31,9.21,5.68,3,8,3,14,3,8,1,12
2025-10-12,77e23ebd-6e10-4113-938c-bb55550710f5,Spice <> Capriotti's - Sep / Oct,promotion,2025-09-18,None,N/A,,ba37e4d8-36c4-4cbe-8c7d-f4d1379109bd,"Spend $15, Save $3 | Low price Sensitivity",day,all,Order Discount,$ Off,3.00,15.00,USD,Mountain View,2608887,1,28.88,3.00,0.00,0.00,0.99,-0.00,-0.00,28.88,3.99,7.24,0,1,0,1,0,1,0,1
2025-10-12,02d2c45e-5b6f-4058-b05d-1fbcb475312e,"First order, 20% off 04/09/2025",promotion,2025-04-09,None,N/A,,,,,,,$ Off,0.00,0.00,USD,North Boulder Hwy,75752,4,122.27,18.86,0.00,0.00,3.96,-0.00,-0.00,30.57,5.71,5.36,4,0,0,4,2,0,0,2
2025-10-12,77e23ebd-6e10-4113-938c-bb55550710f5,Spice <> Capriotti's - Sep / Oct,promotion,2025-09-18,None,N/A,,f06f33c5-bff5-4bb3-8dda-6cedeb2e6fc1,10% Happy hour Discount - Min $30 | Low Price Sensitivity,day,all,Order Discount,% Off,7.0%,30.00,USD,University Dr,29894178,0,0.00,0.00,0.00,0.00,0.00,-0.00,-0.00,0.00,0.00,0.00,0,0,0,0,0,0,0,0
2025-10-12,02d2c45e-5b6f-4058-b05d-1fbcb475312e,"First order, 20% off 04/09/2025",promotion,2025-04-09,None,N/A,,,,,,,$ Off,0.00,0.00,USD,Boulder Station,23349419,0,0.00,0.00,0.00,0.00,0.00,-0.00,-0.00,0.00,0.00,0.00,0,0,0,0,0,0,0,0
2025-10-12,02d2c45e-5b6f-4058-b05d-1fbcb475312e,"First order, 20% off 04/09/2025",promotion,2025-04-09,None,N/A,,,,,,,$ Off,0.00,0.00,USD,Red Cliff Dr,578425,1,18.19,3.64,0.00,0.00,0.99,-0.00,-0.00,18.19,4.63,3.93,1,0,0,1,0,0,0,0
2025-10-12,77e23ebd-6e10-4113-938c-bb55550710f5,Spice <> Capriotti's - Sep / Oct,promotion,2025-09-18,None,N/A,,91f90d8c-8a7d-41cf-9b6a-888400112024,10% Happy Hour Discount - Min  $25 | High Price Sensitivity,day,all,Order Discount,% Off,10.0%,25.00,USD,"Capriotti's of Dover, Inc.",1617804,0,0.00,0.00,0.00,0.00,0.00,-0.00,-0.00,0.00,0.00,0.00,0,0,0,0,0,0,0,0
2025-10-12,02d2c45e-5b6f-4058-b05d-1fbcb475312e,"First order, 20% off 04/09/2025",promotion,2025-04-09,None,N/A,,,,,,,$ Off,0.00,0.00,USD,Overland Park,24110474,6,165.89,27.16,0.00,0.00,5.94,-0.00,-0.00,27.65,5.52,5.01,6,0,0,6,5,0,0,5
2025-10-12,77e23ebd-6e10-4113-938c-bb55550710f5,Spice <> Capriotti's - Sep / Oct,promotion,2025-09-18,None,N/A,,d1d0b263-4918-4c81-8c97-630471e7185b,10% Happy Hour Discount - Medium Price Sensitivity,day,all,Order Discount,% Off,10.0%,25.00,USD,South Eastern Ave,75744,1,35.17,3.52,0.00,0.00,0.99,-0.00,-0.00,35.17,4.51,7.80,0,1,0,1,0,1,0,1
2025-10-12,02d2c45e-5b6f-4058-b05d-1fbcb475312e,"First order, 20% off 04/09/2025",promotion,2025-04-09,None,N/A,,,,,,,$ Off,0.00,0.00,USD,Douglas Blvd,1018616,1,64.25,5.00,0.00,0.00,0.99,-0.00,-0.00,64.25,5.99,10.73,1,0,0,1,1,0,0,1
2025-10-12,f12a26e0-24e1-4d8e-ac05-d7e43f06d2bf,Happy Hour discount 11/12/2024,promotion,2024-11-12,None,N/A,,,,,,,$ Off,0.00,0.00,USD,Northdale Blvd,24976449,4,162.22,28.00,0.00,0.00,3.96,-0.00,-0.00,40.56,7.99,5.08,2,2,0,4,1,2,0,3
2025-10-12,77e23ebd-6e10-4113-938c-bb55550710f5,Spice <> Capriotti's - Sep / Oct,promotion,2025-09-18,None,N/A,,f06f33c5-bff5-4bb3-8dda-6cedeb2e6fc1,10% Happy hour Discount - Min $30 | Low Price Sensitivity,day,all,Order Discount,% Off,7.0%,30.00,USD,Sumneytown Pike,24717004,3,134.17,9.40,0.00,0.00,2.97,-0.00,-0.00,44.72,4.12,10.85,0,3,0,3,0,3,0,3
2025-10-12,58fe435a-cdf8-4a86-abc7-b68d7b574ba5,Spend $25 Get 20% Off,promotion,2022-12-01,None,N/A,,,,,,,$ Off,0.00,0.00,USD,San Luis Obispo,23900701,5,208.89,36.85,0.00,0.00,4.95,-0.00,-0.00,41.78,8.36,5.00,0,5,0,5,0,5,0,5
2025-10-12,6f71233a-4f7b-43f5-b70b-89dc41af1fd0,Late night 5 off 25,promotion,2025-01-17,None,N/A,,,,,,,$ Off,0.00,0.00,USD,West Cheyenne Ave,75722,1,25.77,5.00,0.00,0.00,0.99,-0.00,-0.00,25.77,5.99,4.30,0,0,1,1,0,0,1,1
2025-10-12,4d5a689d-a212-46a2-91dc-8288a79ff11a,"First order, 20% off 01/02/2025",promotion,2025-01-02,None,N/A,,,,,,,$ Off,0.00,0.00,USD,Bidwell - Folsom,26234909,1,31.98,5.00,0.00,0.00,0.99,-0.00,-0.00,31.98,5.99,5.34,1,0,0,1,0,0,0,0
2025-10-12,77e23ebd-6e10-4113-938c-bb55550710f5,Spice <> Capriotti's - Sep / Oct,promotion,2025-09-18,None,N/A,,43340528-e1b7-4f95-ab40-8dc92bf9c274,"Spend $35, Save $6 | High Price Sensitivity",day,all,Order Discount,$ Off,6.00,35.00,USD,Roby Dr - Hammond,24891803,0,0.00,0.00,0.00,0.00,0.00,-0.00,-0.00,0.00,0.00,0.00,0,0,0,0,0,0,0,0
2025-10-12,1f4f856e-e43b-49d1-95e9-9c3ab42f5144,"Dormant customers, 20% off 09/22/2025",promotion,2025-09-22,None,N/A,,,,,,,$ Off,0.00,0.00,USD,Frisco,34516355,3,69.25,13.78,0.00,0.00,2.97,-0.00,-0.00,23.08,5.58,4.13,0,0,3,3,0,0,3,3
2025-10-12,02d2c45e-5b6f-4058-b05d-1fbcb475312e,"First order, 20% off 04/09/2025",promotion,2025-04-09,None,N/A,,,,,,,$ Off,0.00,0.00,USD,Murrieta Hot Springs Rd,29652192,7,246.37,32.52,0.00,0.00,6.93,-0.00,-0.00,35.20,5.64,6.25,7,0,0,7,5,0,0,5
2025-10-12,77e23ebd-6e10-4113-938c-bb55550710f5,Spice <> Capriotti's - Sep / Oct,promotion,2025-09-18,None,N/A,,43340528-e1b7-4f95-ab40-8dc92bf9c274,"Spend $35, Save $6 | High Price Sensitivity",day,all,Order Discount,$ Off,6.00,35.00,USD,Chicago River West,34048823,5,297.14,30.00,0.00,0.00,4.95,-0.00,-0.00,59.43,6.99,8.50,1,4,0,5,0,4,0,4
2025-10-12,02d2c45e-5b6f-4058-b05d-1fbcb475312e,"First order, 20% off 04/09/2025",promotion,2025-04-09,None,N/A,,,,,,,$ Off,0.00,0.00,USD,Ogletown Stanton,422117,0,0.00,0.00,0.00,0.00,0.00,-0.00,-0.00,0.00,0.00,0.00,0,0,0,0,0,0,0,0
2025-10-12,77e23ebd-6e10-4113-938c-bb55550710f5,Spice <> Capriotti's - Sep / Oct,promotion,2025-09-18,None,N/A,,d1d0b263-4918-4c81-8c97-630471e7185b,10% Happy Hour Discount - Medium Price Sensitivity,day,all,Order Discount,% Off,10.0%,25.00,USD,17th St Ammon,24968543,1,26.39,2.64,0.00,0.00,0.99,-0.00,-0.00,26.39,3.63,7.27,0,1,0,1,0,1,0,1
2025-10-12,77e23ebd-6e10-4113-938c-bb55550710f5,Spice <> Capriotti's - Sep / Oct,promotion,2025-09-18,None,N/A,,,,day,,,$ Off,0.00,0.00,USD,Kent Island,691089,0,0.00,0.00,0.00,0.00,0.00,-0.00,-0.00,0.00,0.00,0.00,0,0,0,0,0,0,0,0
2025-10-12,77e23ebd-6e10-4113-938c-bb55550710f5,Spice <> Capriotti's - Sep / Oct,promotion,2025-09-18,None,N/A,,,,day,,,$ Off,0.00,0.00,USD,Nevada Way,75754,0,0.00,0.00,0.00,0.00,0.00,-0.00,-0.00,0.00,0.00,0.00,0,0,0,0,0,0,0,0
2025-10-12,77e23ebd-6e10-4113-938c-bb55550710f5,Spice <> Capriotti's - Sep / Oct,promotion,2025-09-18,None,N/A,,f06f33c5-bff5-4bb3-8dda-6cedeb2e6fc1,10% Happy hour Discount - Min $30 | Low Price Sensitivity,day,all,Order Discount,% Off,7.0%,30.00,USD,N 87th Street,27965,2,84.62,5.92,0.00,0.00,1.98,-0.00,-0.00,42.31,3.95,10.71,0,2,0,2,0,2,0,2
2025-10-12,77e23ebd-6e10-4113-938c-bb55550710f5,Spice <> Capriotti's - Sep / Oct,promotion,2025-09-18,None,N/A,,ba37e4d8-36c4-4cbe-8c7d-f4d1379109bd,"Spend $15, Save $3 | Low price Sensitivity",day,all,Order Discount,$ Off,3.00,15.00,USD,Kennett Square,575296,2,65.21,6.00,0.00,0.00,1.98,-0.00,-0.00,32.61,3.99,8.17,0,1,1,2,0,0,0,0
2025-10-12,77e23ebd-6e10-4113-938c-bb55550710f5,Spice <> Capriotti's - Sep / Oct,promotion,2025-09-18,None,N/A,,d1d0b263-4918-4c81-8c97-630471e7185b,10% Happy Hour Discount - Medium Price Sensitivity,day,all,Order Discount,% Off,10.0%,25.00,USD,S Fort Apache,75730,1,29.49,2.95,0.00,0.00,0.99,-0.00,-0.00,29.49,3.94,7.48,0,1,0,1,0,1,0,1
2025-10-12,77e23ebd-6e10-4113-938c-bb55550710f5,Spice <> Capriotti's - Sep / Oct,promotion,2025-09-18,None,N/A,,d1d0b263-4918-4c81-8c97-630471e7185b,10% Happy Hour Discount - Medium Price Sensitivity,day,all,Order Discount,% Off,10.0%,25.00,USD,Whitesburg Dr (Medical District),34051357,5,221.77,21.43,0.00,0.00,4.95,-0.00,-0.00,44.35,5.28,8.41,2,3,0,5,1,3,0,4
2025-10-12,77e23ebd-6e10-4113-938c-bb55550710f5,Spice <> Capriotti's - Sep / Oct,promotion,2025-09-18,None,N/A,,d1d0b263-4918-4c81-8c97-630471e7185b,10% Happy Hour Discount - Medium Price Sensitivity,day,all,Order Discount,% Off,10.0%,25.00,USD,North Haven Ave,28834163,1,126.57,5.00,0.00,0.00,0.99,-0.00,-0.00,126.57,5.99,21.13,1,0,0,1,1,0,0,1
2025-10-12,77e23ebd-6e10-4113-938c-bb55550710f5,Spice <> Capriotti's - Sep / Oct,promotion,2025-09-18,None,N/A,,,,day,,,$ Off,0.00,0.00,USD,Terrace Center,321047,0,0.00,0.00,0.00,0.00,0.00,-0.00,-0.00,0.00,0.00,0.00,0,0,0,0,0,0,0,0
2025-10-12,77e23ebd-6e10-4113-938c-bb55550710f5,Spice <> Capriotti's - Sep / Oct,promotion,2025-09-18,None,N/A,,91f90d8c-8a7d-41cf-9b6a-888400112024,10% Happy Hour Discount - Min  $25 | High Price Sensitivity,day,all,Order Discount,% Off,10.0%,25.00,USD,Blackstone-Fresno,24415716,2,98.01,8.98,0.00,0.00,1.98,-0.00,-0.00,49.01,5.48,8.94,0,2,0,2,0,1,0,1
2025-10-12,ab8ae3e5-4758-4b2a-b268-d7fb378c5caa,Spend $15 Get 20% Off,promotion,2022-05-17,None,N/A,,,,,,,$ Off,0.00,0.00,USD,Pioneer Pkwy,874359,3,66.53,12.77,0.00,0.00,2.97,-0.00,-0.00,22.18,5.25,4.23,0,3,0,3,0,2,0,2
2025-10-12,77e23ebd-6e10-4113-938c-bb55550710f5,Spice <> Capriotti's - Sep / Oct,promotion,2025-09-18,None,N/A,,d1d0b263-4918-4c81-8c97-630471e7185b,10% Happy Hour Discount - Medium Price Sensitivity,day,all,Order Discount,% Off,10.0%,25.00,USD,West Azure,75724,0,0.00,0.00,0.00,0.00,0.00,-0.00,-0.00,0.00,0.00,0.00,0,0,0,0,0,0,0,0
2025-10-12,02d2c45e-5b6f-4058-b05d-1fbcb475312e,"First order, 20% off 04/09/2025",promotion,2025-04-09,None,N/A,,,,,,,$ Off,0.00,0.00,USD,Highbrook Way,33551695,7,176.21,33.35,0.00,0.00,6.93,-0.00,-0.00,25.17,5.75,4.37,7,0,0,7,5,0,0,5
2025-10-12,02d2c45e-5b6f-4058-b05d-1fbcb475312e,"First order, 20% off 04/09/2025",promotion,2025-04-09,None,N/A,,,,,,,$ Off,0.00,0.00,USD,Kirkwood Hwy,390889,1,28.19,5.00,0.00,0.00,0.99,-0.00,-0.00,28.19,5.99,4.71,1,0,0,1,0,0,0,0
2025-10-12,77e23ebd-6e10-4113-938c-bb55550710f5,Spice <> Capriotti's - Sep / Oct,promotion,2025-09-18,None,N/A,,f06f33c5-bff5-4bb3-8dda-6cedeb2e6fc1,10% Happy hour Discount - Min $30 | Low Price Sensitivity,day,all,Order Discount,% Off,7.0%,30.00,USD,Sierra Hwy,27476315,0,0.00,0.00,0.00,0.00,0.00,-0.00,-0.00,0.00,0.00,0.00,0,0,0,0,0,0,0,0
2025-10-12,77e23ebd-6e10-4113-938c-bb55550710f5,Spice <> Capriotti's - Sep / Oct,promotion,2025-09-18,None,N/A,,43340528-e1b7-4f95-ab40-8dc92bf9c274,"Spend $35, Save $6 | High Price Sensitivity",day,all,Order Discount,$ Off,6.00,35.00,USD,"Capriotti's of Milford, LLC",1636430,0,0.00,0.00,0.00,0.00,0.00,-0.00,-0.00,0.00,0.00,0.00,0,0,0,0,0,0,0,0
2025-10-12,a685c20e-2ab7-43e8-a7a8-447ab209f7f8,Spend $25 get $5 off 07/31/2024,promotion,2024-07-31,None,N/A,,,,,,,$ Off,0.00,0.00,USD,De Soto-Chatsworth,651597,6,299.71,30.00,0.00,0.00,5.94,-0.00,-0.00,49.95,5.99,8.34,3,2,1,6,3,2,0,5
2025-10-12,77e23ebd-6e10-4113-938c-bb55550710f5,Spice <> Capriotti's - Sep / Oct,promotion,2025-09-18,None,N/A,,,,day,,,$ Off,0.00,0.00,USD,Collier Pkwy-Lutz,23057623,0,0.00,0.00,0.00,0.00,0.00,-0.00,-0.00,0.00,0.00,0.00,0,0,0,0,0,0,0,0
2025-10-12,02d2c45e-5b6f-4058-b05d-1fbcb475312e,"First order, 20% off 04/09/2025",promotion,2025-04-09,None,N/A,,,,,,,$ Off,0.00,0.00,USD,Dana Park - Mesa,126177,2,52.45,8.96,0.00,0.00,1.98,-0.00,-0.00,26.23,5.47,4.79,2,0,0,2,1,0,0,1
2025-10-12,77e23ebd-6e10-4113-938c-bb55550710f5,Spice <> Capriotti's - Sep / Oct,promotion,2025-09-18,None,N/A,,f06f33c5-bff5-4bb3-8dda-6cedeb2e6fc1,10% Happy hour Discount - Min $30 | Low Price Sensitivity,day,all,Order Discount,% Off,7.0%,30.00,USD,International Pkwy,24671402,0,0.00,0.00,0.00,0.00,0.00,-0.00,-0.00,0.00,0.00,0.00,0,0,0,0,0,0,0,0
2025-10-12,77e23ebd-6e10-4113-938c-bb55550710f5,Spice <> Capriotti's - Sep / Oct,promotion,2025-09-18,None,N/A,,91f90d8c-8a7d-41cf-9b6a-888400112024,10% Happy Hour Discount - Min  $25 | High Price Sensitivity,day,all,Order Discount,% Off,10.0%,25.00,USD,West Fullerton Ave,23349403,1,33.16,3.32,0.00,0.00,0.99,-0.00,-0.00,33.16,4.31,7.69,0,1,0,1,0,1,0,1
2025-10-12,02d2c45e-5b6f-4058-b05d-1fbcb475312e,"First order, 20% off 04/09/2025",promotion,2025-04-09,None,N/A,,,,,,,$ Off,0.00,0.00,USD,The Old Road,24898774,0,0.00,0.00,0.00,0.00,0.00,-0.00,-0.00,0.00,0.00,0.00,0,0,0,0,0,0,0,0
2025-10-12,77e23ebd-6e10-4113-938c-bb55550710f5,Spice <> Capriotti's - Sep / Oct,promotion,2025-09-18,None,N/A,,f06f33c5-bff5-4bb3-8dda-6cedeb2e6fc1,10% Happy hour Discount - Min $30 | Low Price Sensitivity,day,all,Order Discount,% Off,7.0%,30.00,USD,Nevada Way,75754,0,0.00,0.00,0.00,0.00,0.00,-0.00,-0.00,0.00,0.00,0.00,0,0,0,0,0,0,0,0
2025-10-12,02d2c45e-5b6f-4058-b05d-1fbcb475312e,"First order, 20% off 04/09/2025",promotion,2025-04-09,None,N/A,,,,,,,$ Off,0.00,0.00,USD,Smithtown Bypass,23349427,2,182.44,10.00,0.00,0.00,1.98,-0.00,-0.00,91.22,5.99,15.23,2,0,0,2,1,0,0,1
2025-10-12,77e23ebd-6e10-4113-938c-bb55550710f5,Spice <> Capriotti's - Sep / Oct,promotion,2025-09-18,None,N/A,,ba37e4d8-36c4-4cbe-8c7d-f4d1379109bd,"Spend $15, Save $3 | Low price Sensitivity",day,all,Order Discount,$ Off,3.00,15.00,USD,Horizon Ridge,75753,1,37.55,3.00,0.00,0.00,0.99,-0.00,-0.00,37.55,3.99,9.41,0,0,1,1,0,0,1,1
2025-10-12,77e23ebd-6e10-4113-938c-bb55550710f5,Spice <> Capriotti's - Sep / Oct,promotion,2025-09-18,None,N/A,,ba37e4d8-36c4-4cbe-8c7d-f4d1379109bd,"Spend $15, Save $3 | Low price Sensitivity",day,all,Order Discount,$ Off,3.00,15.00,USD,Byers Dr,23186665,3,70.43,9.00,0.00,0.00,2.97,-0.00,-0.00,23.48,3.99,5.88,0,3,0,3,0,3,0,3
2025-10-12,77e23ebd-6e10-4113-938c-bb55550710f5,Spice <> Capriotti's - Sep / Oct,promotion,2025-09-18,None,N/A,,,,day,,,$ Off,0.00,0.00,USD,Roby Dr - Hammond,24891803,0,0.00,0.00,0.00,0.00,0.00,-0.00,-0.00,0.00,0.00,0.00,0,0,0,0,0,0,0,0
2025-10-12,02d2c45e-5b6f-4058-b05d-1fbcb475312e,"First order, 20% off 04/09/2025",promotion,2025-04-09,None,N/A,,,,,,,$ Off,0.00,0.00,USD,Plumb Lane,439577,3,86.21,13.97,0.00,0.00,2.97,-0.00,-0.00,28.74,5.65,5.09,3,0,0,3,1,0,0,1
2025-10-12,02d2c45e-5b6f-4058-b05d-1fbcb475312e,"First order, 20% off 04/09/2025",promotion,2025-04-09,None,N/A,,,,,,,$ Off,0.00,0.00,USD,Northdale Blvd,24976449,0,0.00,0.00,0.00,0.00,0.00,-0.00,-0.00,0.00,0.00,0.00,0,0,0,0,0,0,0,0
2025-10-12,77e23ebd-6e10-4113-938c-bb55550710f5,Spice <> Capriotti's - Sep / Oct,promotion,2025-09-18,None,N/A,,f06f33c5-bff5-4bb3-8dda-6cedeb2e6fc1,10% Happy hour Discount - Min $30 | Low Price Sensitivity,day,all,Order Discount,% Off,7.0%,30.00,USD,Townpark Lane,128721,0,0.00,0.00,0.00,0.00,0.00,-0.00,-0.00,0.00,0.00,0.00,0,0,0,0,0,0,0,0
2025-10-12,77e23ebd-6e10-4113-938c-bb55550710f5,Spice <> Capriotti's - Sep / Oct,promotion,2025-09-18,None,N/A,,f06f33c5-bff5-4bb3-8dda-6cedeb2e6fc1,10% Happy hour Discount - Min $30 | Low Price Sensitivity,day,all,Order Discount,% Off,7.0%,30.00,USD,Governor Ritchie,24121153,1,114.68,5.00,0.00,0.00,0.99,-0.00,-0.00,114.68,5.99,19.15,0,1,0,1,0,1,0,1
2025-10-12,02d2c45e-5b6f-4058-b05d-1fbcb475312e,"First order, 20% off 04/09/2025",promotion,2025-04-09,None,N/A,,,,,,,$ Off,0.00,0.00,USD,East 82nd St,184537,5,154.07,22.86,0.00,0.00,4.95,-0.00,-0.00,30.81,5.56,5.54,5,0,0,5,3,0,0,3
2025-10-12,02d2c45e-5b6f-4058-b05d-1fbcb475312e,"First order, 20% off 04/09/2025",promotion,2025-04-09,None,N/A,,,,,,,$ Off,0.00,0.00,USD,E Robindale Road,27815740,1,15.59,3.12,0.00,0.00,0.99,-0.00,-0.00,15.59,4.11,3.79,1,0,0,1,1,0,0,1
2025-10-12,dd85331b-3d89-4ea9-af73-88a1fb0e8003,Spend $20 Get $5 Off,promotion,2022-06-20,None,N/A,,,,,,,$ Off,0.00,0.00,USD,Millsboro Plaza,23360934,11,466.98,55.00,0.00,0.00,10.89,-0.00,-0.00,42.45,5.99,7.09,3,6,2,11,1,3,0,4
2025-10-12,77e23ebd-6e10-4113-938c-bb55550710f5,Spice <> Capriotti's - Sep / Oct,promotion,2025-09-18,None,N/A,,,,day,,,$ Off,0.00,0.00,USD,Shepherd - Fresno,24559604,0,0.00,0.00,0.00,0.00,0.00,-0.00,-0.00,0.00,0.00,0.00,0,0,0,0,0,0,0,0
2025-10-12,02d2c45e-5b6f-4058-b05d-1fbcb475312e,"First order, 20% off 04/09/2025",promotion,2025-04-09,None,N/A,,,,,,,$ Off,0.00,0.00,USD,Parker,24021312,2,89.41,10.00,0.00,0.00,1.98,-0.00,-0.00,44.71,5.99,7.46,2,0,0,2,1,0,0,1
2025-10-11,70d4cf5a-37fe-47ad-bac7-d5196b53b89c,Spend $30 get 20% off 09/03/2025,promotion,2025-09-03,None,N/A,,,,,,,$ Off,0.00,0.00,USD,Happy Valley,23584856,8,370.70,67.01,0.00,0.00,7.92,-0.00,-0.00,46.34,9.37,4.95,2,5,1,8,2,4,0,6
2025-10-11,02d2c45e-5b6f-4058-b05d-1fbcb475312e,"First order, 20% off 04/09/2025",promotion,2025-04-09,None,N/A,,,,,,,$ Off,0.00,0.00,USD,University Ave,1084955,6,190.44,29.27,0.00,0.00,5.94,-0.00,-0.00,31.74,5.87,5.41,6,0,0,6,3,0,0,3
2025-10-11,77e23ebd-6e10-4113-938c-bb55550710f5,Spice <> Capriotti's - Sep / Oct,promotion,2025-09-18,None,N/A,,f06f33c5-bff5-4bb3-8dda-6cedeb2e6fc1,10% Happy hour Discount - Min $30 | Low Price Sensitivity,day,all,Order Discount,% Off,7.0%,30.00,USD,Horizon Ridge,75753,0,0.00,0.00,0.00,0.00,0.00,-0.00,-0.00,0.00,0.00,0.00,0,0,0,0,0,0,0,0
2025-10-11,77e23ebd-6e10-4113-938c-bb55550710f5,Spice <> Capriotti's - Sep / Oct,promotion,2025-09-18,None,N/A,,43340528-e1b7-4f95-ab40-8dc92bf9c274,"Spend $35, Save $6 | High Price Sensitivity",day,all,Order Discount,$ Off,6.00,35.00,USD,Concord Pike,23151390,0,0.00,0.00,0.00,0.00,0.00,-0.00,-0.00,0.00,0.00,0.00,0,0,0,0,0,0,0,0
2025-10-11,02d2c45e-5b6f-4058-b05d-1fbcb475312e,"First order, 20% off 04/09/2025",promotion,2025-04-09,None,N/A,,,,,,,$ Off,0.00,0.00,USD,North Union St,575293,7,182.95,30.65,0.00,0.00,6.93,-0.00,-0.00,26.14,5.37,4.87,7,0,0,7,3,0,0,3
2025-10-11,77e23ebd-6e10-4113-938c-bb55550710f5,Spice <> Capriotti's - Sep / Oct,promotion,2025-09-18,None,N/A,,d1d0b263-4918-4c81-8c97-630471e7185b,10% Happy Hour Discount - Medium Price Sensitivity,day,all,Order Discount,% Off,10.0%,25.00,USD,Moreno Beach Drive,23085788,0,0.00,0.00,0.00,0.00,0.00,-0.00,-0.00,0.00,0.00,0.00,0,0,0,0,0,0,0,0
2025-10-11,77e23ebd-6e10-4113-938c-bb55550710f5,Spice <> Capriotti's - Sep / Oct,promotion,2025-09-18,None,N/A,,d1d0b263-4918-4c81-8c97-630471e7185b,10% Happy Hour Discount - Medium Price Sensitivity,day,all,Order Discount,% Off,10.0%,25.00,USD,East Craig Road,75739,0,0.00,0.00,0.00,0.00,0.00,-0.00,-0.00,0.00,0.00,0.00,0,0,0,0,0,0,0,0
2025-10-11,77e23ebd-6e10-4113-938c-bb55550710f5,Spice <> Capriotti's - Sep / Oct,promotion,2025-09-18,None,N/A,,,,day,,,$ Off,0.00,0.00,USD,Chicago River West,34048823,0,0.00,0.00,0.00,0.00,0.00,-0.00,-0.00,0.00,0.00,0.00,0,0,0,0,0,0,0,0
2025-10-11,77e23ebd-6e10-4113-938c-bb55550710f5,Spice <> Capriotti's - Sep / Oct,promotion,2025-09-18,None,N/A,,d1d0b263-4918-4c81-8c97-630471e7185b,10% Happy Hour Discount - Medium Price Sensitivity,day,all,Order Discount,% Off,10.0%,25.00,USD,Roanoke,24637171,3,104.69,10.48,0.00,0.00,2.97,-0.00,-0.00,34.90,4.48,7.78,0,3,0,3,0,2,0,2
2025-10-11,77e23ebd-6e10-4113-938c-bb55550710f5,Spice <> Capriotti's - Sep / Oct,promotion,2025-09-18,None,N/A,,d1d0b263-4918-4c81-8c97-630471e7185b,10% Happy Hour Discount - Medium Price Sensitivity,day,all,Order Discount,% Off,10.0%,25.00,USD,Dana Park - Mesa,126177,1,31.16,3.12,0.00,0.00,0.99,-0.00,-0.00,31.16,4.11,7.58,1,0,0,1,1,0,0,1
2025-10-11,77e23ebd-6e10-4113-938c-bb55550710f5,Spice <> Capriotti's - Sep / Oct,promotion,2025-09-18,None,N/A,,d1d0b263-4918-4c81-8c97-630471e7185b,10% Happy Hour Discount - Medium Price Sensitivity,day,all,Order Discount,% Off,10.0%,25.00,USD,W Blue Diamond Rd,75738,2,68.84,6.89,0.00,0.00,1.98,-0.00,-0.00,34.42,4.44,7.76,0,2,0,2,0,1,0,1
2025-10-11,77e23ebd-6e10-4113-938c-bb55550710f5,Spice <> Capriotti's - Sep / Oct,promotion,2025-09-18,None,N/A,,d1d0b263-4918-4c81-8c97-630471e7185b,10% Happy Hour Discount - Medium Price Sensitivity,day,all,Order Discount,% Off,10.0%,25.00,USD,West Craig Road,75727,2,84.81,8.49,0.00,0.00,1.98,-0.00,-0.00,42.41,5.24,8.10,0,2,0,2,0,2,0,2
2025-10-11,77e23ebd-6e10-4113-938c-bb55550710f5,Spice <> Capriotti's - Sep / Oct,promotion,2025-09-18,None,N/A,,f06f33c5-bff5-4bb3-8dda-6cedeb2e6fc1,10% Happy hour Discount - Min $30 | Low Price Sensitivity,day,all,Order Discount,% Off,7.0%,30.00,USD,Old Town,27964,0,0.00,0.00,0.00,0.00,0.00,-0.00,-0.00,0.00,0.00,0.00,0,0,0,0,0,0,0,0
2025-10-11,77e23ebd-6e10-4113-938c-bb55550710f5,Spice <> Capriotti's - Sep / Oct,promotion,2025-09-18,None,N/A,,91f90d8c-8a7d-41cf-9b6a-888400112024,10% Happy Hour Discount - Min  $25 | High Price Sensitivity,day,all,Order Discount,% Off,10.0%,25.00,USD,Shepherd - Fresno,24559604,0,0.00,0.00,0.00,0.00,0.00,-0.00,-0.00,0.00,0.00,0.00,0,0,0,0,0,0,0,0
2025-10-11,77e23ebd-6e10-4113-938c-bb55550710f5,Spice <> Capriotti's - Sep / Oct,promotion,2025-09-18,None,N/A,,d1d0b263-4918-4c81-8c97-630471e7185b,10% Happy Hour Discount - Medium Price Sensitivity,day,all,Order Discount,% Off,10.0%,25.00,USD,Barnes Road,24892677,0,0.00,0.00,0.00,0.00,0.00,-0.00,-0.00,0.00,0.00,0.00,0,0,0,0,0,0,0,0
2025-10-11,77e23ebd-6e10-4113-938c-bb55550710f5,Spice <> Capriotti's - Sep / Oct,promotion,2025-09-18,None,N/A,,d1d0b263-4918-4c81-8c97-630471e7185b,10% Happy Hour Discount - Medium Price Sensitivity,day,all,Order Discount,% Off,10.0%,25.00,USD,Cheyenne Rd,2375637,1,61.83,5.00,0.00,0.00,0.99,-0.00,-0.00,61.83,5.99,10.32,0,1,0,1,0,0,0,0
2025-10-11,77e23ebd-6e10-4113-938c-bb55550710f5,Spice <> Capriotti's - Sep / Oct,promotion,2025-09-18,None,N/A,,f06f33c5-bff5-4bb3-8dda-6cedeb2e6fc1,10% Happy hour Discount - Min $30 | Low Price Sensitivity,day,all,Order Discount,% Off,7.0%,30.00,USD,Douglas Blvd,1018616,1,41.64,2.91,0.00,0.00,0.99,-0.00,-0.00,41.64,3.90,10.68,0,1,0,1,0,1,0,1
2025-10-11,77e23ebd-6e10-4113-938c-bb55550710f5,Spice <> Capriotti's - Sep / Oct,promotion,2025-09-18,None,N/A,,d1d0b263-4918-4c81-8c97-630471e7185b,10% Happy Hour Discount - Medium Price Sensitivity,day,all,Order Discount,% Off,10.0%,25.00,USD,Interquest Parkway,27558470,0,0.00,0.00,0.00,0.00,0.00,-0.00,-0.00,0.00,0.00,0.00,0,0,0,0,0,0,0,0
2025-10-11,77e23ebd-6e10-4113-938c-bb55550710f5,Spice <> Capriotti's - Sep / Oct,promotion,2025-09-18,None,N/A,,d1d0b263-4918-4c81-8c97-630471e7185b,10% Happy Hour Discount - Medium Price Sensitivity,day,all,Order Discount,% Off,10.0%,25.00,USD,S Stanford Way,699470,1,31.18,3.12,0.00,0.00,0.99,-0.00,-0.00,31.18,4.11,7.59,0,1,0,1,0,0,0,0
2025-10-11,77e23ebd-6e10-4113-938c-bb55550710f5,Spice <> Capriotti's - Sep / Oct,promotion,2025-09-18,None,N/A,,91f90d8c-8a7d-41cf-9b6a-888400112024,10% Happy Hour Discount - Min  $25 | High Price Sensitivity,day,all,Order Discount,% Off,10.0%,25.00,USD,Coeur d'Alene,23085790,0,0.00,0.00,0.00,0.00,0.00,-0.00,-0.00,0.00,0.00,0.00,0,0,0,0,0,0,0,0
2025-10-11,77e23ebd-6e10-4113-938c-bb55550710f5,Spice <> Capriotti's - Sep / Oct,promotion,2025-09-18,None,N/A,,d1d0b263-4918-4c81-8c97-630471e7185b,10% Happy Hour Discount - Medium Price Sensitivity,day,all,Order Discount,% Off,10.0%,25.00,USD,De Soto-Chatsworth,651597,0,0.00,0.00,0.00,0.00,0.00,-0.00,-0.00,0.00,0.00,0.00,0,0,0,0,0,0,0,0
2025-10-11,77e23ebd-6e10-4113-938c-bb55550710f5,Spice <> Capriotti's - Sep / Oct,promotion,2025-09-18,None,N/A,,ba37e4d8-36c4-4cbe-8c7d-f4d1379109bd,"Spend $15, Save $3 | Low price Sensitivity",day,all,Order Discount,$ Off,3.00,15.00,USD,Douglas Blvd,1018616,4,122.89,12.00,0.00,0.00,3.96,-0.00,-0.00,30.72,3.99,7.70,0,4,0,4,0,4,0,4
2025-10-11,77e23ebd-6e10-4113-938c-bb55550710f5,Spice <> Capriotti's - Sep / Oct,promotion,2025-09-18,None,N/A,,,,day,,,$ Off,0.00,0.00,USD,Millsboro Plaza,23360934,0,0.00,0.00,0.00,0.00,0.00,-0.00,-0.00,0.00,0.00,0.00,0,0,0,0,0,0,0,0
2025-10-11,77e23ebd-6e10-4113-938c-bb55550710f5,Spice <> Capriotti's - Sep / Oct,promotion,2025-09-18,None,N/A,,91f90d8c-8a7d-41cf-9b6a-888400112024,10% Happy Hour Discount - Min  $25 | High Price Sensitivity,day,all,Order Discount,% Off,10.0%,25.00,USD,North Union St,575293,4,176.58,15.80,0.00,0.00,3.96,-0.00,-0.00,44.15,4.94,8.94,0,4,0,4,0,2,0,2
2025-10-11,77e23ebd-6e10-4113-938c-bb55550710f5,Spice <> Capriotti's - Sep / Oct,promotion,2025-09-18,None,N/A,,,,day,,,$ Off,0.00,0.00,USD,Hamilton Blvd,23066760,0,0.00,0.00,0.00,0.00,0.00,-0.00,-0.00,0.00,0.00,0.00,0,0,0,0,0,0,0,0
2025-10-11,77e23ebd-6e10-4113-938c-bb55550710f5,Spice <> Capriotti's - Sep / Oct,promotion,2025-09-18,None,N/A,,ba37e4d8-36c4-4cbe-8c7d-f4d1379109bd,"Spend $15, Save $3 | Low price Sensitivity",day,all,Order Discount,$ Off,3.00,15.00,USD,Mountain View,2608887,4,159.74,12.00,0.00,0.00,3.96,-0.00,-0.00,39.94,3.99,10.01,0,3,1,4,0,2,1,3
2025-10-11,77e23ebd-6e10-4113-938c-bb55550710f5,Spice <> Capriotti's - Sep / Oct,promotion,2025-09-18,None,N/A,,f06f33c5-bff5-4bb3-8dda-6cedeb2e6fc1,10% Happy hour Discount - Min $30 | Low Price Sensitivity,day,all,Order Discount,% Off,7.0%,30.00,USD,N Broad St,578662,1,44.48,3.11,0.00,0.00,0.99,-0.00,-0.00,44.48,4.10,10.85,0,1,0,1,0,1,0,1
2025-10-11,77e23ebd-6e10-4113-938c-bb55550710f5,Spice <> Capriotti's - Sep / Oct,promotion,2025-09-18,None,N/A,,d1d0b263-4918-4c81-8c97-630471e7185b,10% Happy Hour Discount - Medium Price Sensitivity,day,all,Order Discount,% Off,10.0%,25.00,USD,E William Street,1053361,1,34.78,3.48,0.00,0.00,0.99,-0.00,-0.00,34.78,4.47,7.78,0,1,0,1,0,1,0,1
2025-10-11,77e23ebd-6e10-4113-938c-bb55550710f5,Spice <> Capriotti's - Sep / Oct,promotion,2025-09-18,None,N/A,,43340528-e1b7-4f95-ab40-8dc92bf9c274,"Spend $35, Save $6 | High Price Sensitivity",day,all,Order Discount,$ Off,6.00,35.00,USD,College Station,23349412,0,0.00,0.00,0.00,0.00,0.00,-0.00,-0.00,0.00,0.00,0.00,0,0,0,0,0,0,0,0
2025-10-11,77e23ebd-6e10-4113-938c-bb55550710f5,Spice <> Capriotti's - Sep / Oct,promotion,2025-09-18,None,N/A,,d1d0b263-4918-4c81-8c97-630471e7185b,10% Happy Hour Discount - Medium Price Sensitivity,day,all,Order Discount,% Off,10.0%,25.00,USD,Jennersville Rd,433075,3,128.01,12.38,0.00,0.00,2.97,-0.00,-0.00,42.67,5.12,8.34,0,2,1,3,0,1,1,2
2025-10-11,77e23ebd-6e10-4113-938c-bb55550710f5,Spice <> Capriotti's - Sep / Oct,promotion,2025-09-18,None,N/A,,d1d0b263-4918-4c81-8c97-630471e7185b,10% Happy Hour Discount - Medium Price Sensitivity,day,all,Order Discount,% Off,10.0%,25.00,USD,"Lewes, DE",34776698,0,0.00,0.00,0.00,0.00,0.00,-0.00,-0.00,0.00,0.00,0.00,0,0,0,0,0,0,0,0
2025-10-11,77e23ebd-6e10-4113-938c-bb55550710f5,Spice <> Capriotti's - Sep / Oct,promotion,2025-09-18,None,N/A,,,,day,,,$ Off,0.00,0.00,USD,Zionsville,24415273,0,0.00,0.00,0.00,0.00,0.00,-0.00,-0.00,0.00,0.00,0.00,0,0,0,0,0,0,0,0
2025-10-11,77e23ebd-6e10-4113-938c-bb55550710f5,Spice <> Capriotti's - Sep / Oct,promotion,2025-09-18,None,N/A,,,,day,,,$ Off,0.00,0.00,USD,Coeur d'Alene,23085790,0,0.00,0.00,0.00,0.00,0.00,-0.00,-0.00,0.00,0.00,0.00,0,0,0,0,0,0,0,0
2025-10-11,77e23ebd-6e10-4113-938c-bb55550710f5,Spice <> Capriotti's - Sep / Oct,promotion,2025-09-18,None,N/A,,d1d0b263-4918-4c81-8c97-630471e7185b,10% Happy Hour Discount - Medium Price Sensitivity,day,all,Order Discount,% Off,10.0%,25.00,USD,Santa Fe Station,75723,0,0.00,0.00,0.00,0.00,0.00,-0.00,-0.00,0.00,0.00,0.00,0,0,0,0,0,0,0,0
2025-10-11,77e23ebd-6e10-4113-938c-bb55550710f5,Spice <> Capriotti's - Sep / Oct,promotion,2025-09-18,None,N/A,,,,day,,,$ Off,0.00,0.00,USD,Lantana Drive,390888,0,0.00,0.00,0.00,0.00,0.00,-0.00,-0.00,0.00,0.00,0.00,0,0,0,0,0,0,0,0
2025-10-11,77e23ebd-6e10-4113-938c-bb55550710f5,Spice <> Capriotti's - Sep / Oct,promotion,2025-09-18,None,N/A,,d1d0b263-4918-4c81-8c97-630471e7185b,10% Happy Hour Discount - Medium Price Sensitivity,day,all,Order Discount,% Off,10.0%,25.00,USD,Marlboro - Easton,674514,1,36.35,3.64,0.00,0.00,0.99,-0.00,-0.00,36.35,4.63,7.85,0,1,0,1,0,1,0,1
2025-10-11,77e23ebd-6e10-4113-938c-bb55550710f5,Spice <> Capriotti's - Sep / Oct,promotion,2025-09-18,None,N/A,,ba37e4d8-36c4-4cbe-8c7d-f4d1379109bd,"Spend $15, Save $3 | Low price Sensitivity",day,all,Order Discount,$ Off,3.00,15.00,USD,Parker,24021312,6,201.04,18.00,0.00,0.00,5.94,-0.00,-0.00,33.51,3.99,8.40,0,5,1,6,0,3,0,3
2025-10-11,77e23ebd-6e10-4113-938c-bb55550710f5,Spice <> Capriotti's - Sep / Oct,promotion,2025-09-18,None,N/A,,91f90d8c-8a7d-41cf-9b6a-888400112024,10% Happy Hour Discount - Min  $25 | High Price Sensitivity,day,all,Order Discount,% Off,10.0%,25.00,USD,Niles Cortland Rd SE,34043935,0,0.00,0.00,0.00,0.00,0.00,-0.00,-0.00,0.00,0.00,0.00,0,0,0,0,0,0,0,0
2025-10-11,77e23ebd-6e10-4113-938c-bb55550710f5,Spice <> Capriotti's - Sep / Oct,promotion,2025-09-18,None,N/A,,43340528-e1b7-4f95-ab40-8dc92bf9c274,"Spend $35, Save $6 | High Price Sensitivity",day,all,Order Discount,$ Off,6.00,35.00,USD,Coeur d'Alene,23085790,0,0.00,0.00,0.00,0.00,0.00,-0.00,-0.00,0.00,0.00,0.00,0,0,0,0,0,0,0,0
2025-10-11,77e23ebd-6e10-4113-938c-bb55550710f5,Spice <> Capriotti's - Sep / Oct,promotion,2025-09-18,None,N/A,,43340528-e1b7-4f95-ab40-8dc92bf9c274,"Spend $35, Save $6 | High Price Sensitivity",day,all,Order Discount,$ Off,6.00,35.00,USD,North Union St,575293,1,41.97,6.00,0.00,0.00,0.99,-0.00,-0.00,41.97,6.99,6.00,0,0,1,1,0,0,1,1
2025-10-11,77e23ebd-6e10-4113-938c-bb55550710f5,Spice <> Capriotti's - Sep / Oct,promotion,2025-09-18,None,N/A,,91f90d8c-8a7d-41cf-9b6a-888400112024,10% Happy Hour Discount - Min  $25 | High Price Sensitivity,day,all,Order Discount,% Off,10.0%,25.00,USD,West Fullerton Ave,23349403,1,91.15,5.00,0.00,0.00,0.99,-0.00,-0.00,91.15,5.99,15.22,0,1,0,1,0,1,0,1
2025-10-11,77e23ebd-6e10-4113-938c-bb55550710f5,Spice <> Capriotti's - Sep / Oct,promotion,2025-09-18,None,N/A,,,,day,,,$ Off,0.00,0.00,USD,Blackstone-Fresno,24415716,0,0.00,0.00,0.00,0.00,0.00,-0.00,-0.00,0.00,0.00,0.00,0,0,0,0,0,0,0,0
2025-10-11,77e23ebd-6e10-4113-938c-bb55550710f5,Spice <> Capriotti's - Sep / Oct,promotion,2025-09-18,None,N/A,,f06f33c5-bff5-4bb3-8dda-6cedeb2e6fc1,10% Happy hour Discount - Min $30 | Low Price Sensitivity,day,all,Order Discount,% Off,7.0%,30.00,USD,Raccoon Rd,26015022,3,112.29,7.86,0.00,0.00,2.97,-0.00,-0.00,37.43,3.61,10.37,1,2,0,3,1,1,0,2
2025-10-11,77e23ebd-6e10-4113-938c-bb55550710f5,Spice <> Capriotti's - Sep / Oct,promotion,2025-09-18,None,N/A,,,,day,,,$ Off,0.00,0.00,USD,Stephanie St,75751,0,0.00,0.00,0.00,0.00,0.00,-0.00,-0.00,0.00,0.00,0.00,0,0,0,0,0,0,0,0
2025-10-11,77e23ebd-6e10-4113-938c-bb55550710f5,Spice <> Capriotti's - Sep / Oct,promotion,2025-09-18,None,N/A,,f06f33c5-bff5-4bb3-8dda-6cedeb2e6fc1,10% Happy hour Discount - Min $30 | Low Price Sensitivity,day,all,Order Discount,% Off,7.0%,30.00,USD,Bel Air,23733193,0,0.00,0.00,0.00,0.00,0.00,-0.00,-0.00,0.00,0.00,0.00,0,0,0,0,0,0,0,0
2025-10-11,77e23ebd-6e10-4113-938c-bb55550710f5,Spice <> Capriotti's - Sep / Oct,promotion,2025-09-18,None,N/A,,91f90d8c-8a7d-41cf-9b6a-888400112024,10% Happy Hour Discount - Min  $25 | High Price Sensitivity,day,all,Order Discount,% Off,10.0%,25.00,USD,West Basin Rd,575301,4,156.12,14.98,0.00,0.00,3.96,-0.00,-0.00,39.03,4.74,8.24,0,3,1,4,0,2,1,3
2025-10-11,77e23ebd-6e10-4113-938c-bb55550710f5,Spice <> Capriotti's - Sep / Oct,promotion,2025-09-18,None,N/A,,f06f33c5-bff5-4bb3-8dda-6cedeb2e6fc1,10% Happy hour Discount - Min $30 | Low Price Sensitivity,day,all,Order Discount,% Off,7.0%,30.00,USD,North Boulder Hwy,75752,0,0.00,0.00,0.00,0.00,0.00,-0.00,-0.00,0.00,0.00,0.00,0,0,0,0,0,0,0,0
2025-10-11,77e23ebd-6e10-4113-938c-bb55550710f5,Spice <> Capriotti's - Sep / Oct,promotion,2025-09-18,None,N/A,,ba37e4d8-36c4-4cbe-8c7d-f4d1379109bd,"Spend $15, Save $3 | Low price Sensitivity",day,all,Order Discount,$ Off,3.00,15.00,USD,Princeton,32118309,1,23.67,3.00,0.00,0.00,0.99,-0.00,-0.00,23.67,3.99,5.93,0,1,0,1,0,1,0,1
2025-10-11,77e23ebd-6e10-4113-938c-bb55550710f5,Spice <> Capriotti's - Sep / Oct,promotion,2025-09-18,None,N/A,,d1d0b263-4918-4c81-8c97-630471e7185b,10% Happy Hour Discount - Medium Price Sensitivity,day,all,Order Discount,% Off,10.0%,25.00,USD,State and 6100 S,2608908,0,0.00,0.00,0.00,0.00,0.00,-0.00,-0.00,0.00,0.00,0.00,0,0,0,0,0,0,0,0
2025-10-11,77e23ebd-6e10-4113-938c-bb55550710f5,Spice <> Capriotti's - Sep / Oct,promotion,2025-09-18,None,N/A,,f06f33c5-bff5-4bb3-8dda-6cedeb2e6fc1,10% Happy hour Discount - Min $30 | Low Price Sensitivity,day,all,Order Discount,% Off,7.0%,30.00,USD,N 87th Street,27965,0,0.00,0.00,0.00,0.00,0.00,-0.00,-0.00,0.00,0.00,0.00,0,0,0,0,0,0,0,0
2025-10-11,77e23ebd-6e10-4113-938c-bb55550710f5,Spice <> Capriotti's - Sep / Oct,promotion,2025-09-18,None,N/A,,43340528-e1b7-4f95-ab40-8dc92bf9c274,"Spend $35, Save $6 | High Price Sensitivity",day,all,Order Discount,$ Off,6.00,35.00,USD,Riverwind Dr,34516256,2,91.03,12.00,0.00,0.00,1.98,-0.00,-0.00,45.52,6.99,6.51,2,0,0,2,0,0,0,0
2025-10-11,77e23ebd-6e10-4113-938c-bb55550710f5,Spice <> Capriotti's - Sep / Oct,promotion,2025-09-18,None,N/A,,ba37e4d8-36c4-4cbe-8c7d-f4d1379109bd,"Spend $15, Save $3 | Low price Sensitivity",day,all,Order Discount,$ Off,3.00,15.00,USD,Raccoon Rd,26015022,4,130.89,12.00,0.00,0.00,3.96,-0.00,-0.00,32.72,3.99,8.20,1,2,1,4,0,2,1,3
2025-10-11,77e23ebd-6e10-4113-938c-bb55550710f5,Spice <> Capriotti's - Sep / Oct,promotion,2025-09-18,None,N/A,,d1d0b263-4918-4c81-8c97-630471e7185b,10% Happy Hour Discount - Medium Price Sensitivity,day,all,Order Discount,% Off,10.0%,25.00,USD,Highbrook Way,33551695,1,38.87,3.89,0.00,0.00,0.99,-0.00,-0.00,38.87,4.88,7.97,0,1,0,1,0,0,0,0
2025-10-11,77e23ebd-6e10-4113-938c-bb55550710f5,Spice <> Capriotti's - Sep / Oct,promotion,2025-09-18,None,N/A,,ba37e4d8-36c4-4cbe-8c7d-f4d1379109bd,"Spend $15, Save $3 | Low price Sensitivity",day,all,Order Discount,$ Off,3.00,15.00,USD,Bel Air,23733193,0,0.00,0.00,0.00,0.00,0.00,-0.00,-0.00,0.00,0.00,0.00,0,0,0,0,0,0,0,0
2025-10-11,77e23ebd-6e10-4113-938c-bb55550710f5,Spice <> Capriotti's - Sep / Oct,promotion,2025-09-18,None,N/A,,,,day,,,$ Off,0.00,0.00,USD,Gambrills,24415514,0,0.00,0.00,0.00,0.00,0.00,-0.00,-0.00,0.00,0.00,0.00,0,0,0,0,0,0,0,0
2025-10-11,77e23ebd-6e10-4113-938c-bb55550710f5,Spice <> Capriotti's - Sep / Oct,promotion,2025-09-18,None,N/A,,d1d0b263-4918-4c81-8c97-630471e7185b,10% Happy Hour Discount - Medium Price Sensitivity,day,all,Order Discount,% Off,10.0%,25.00,USD,S Fort Apache,75730,0,0.00,0.00,0.00,0.00,0.00,-0.00,-0.00,0.00,0.00,0.00,0,0,0,0,0,0,0,0
2025-10-11,77e23ebd-6e10-4113-938c-bb55550710f5,Spice <> Capriotti's - Sep / Oct,promotion,2025-09-18,None,N/A,,,,day,,,$ Off,0.00,0.00,USD,"Marlton, NJ",35211042,0,0.00,0.00,0.00,0.00,0.00,-0.00,-0.00,0.00,0.00,0.00,0,0,0,0,0,0,0,0
2025-10-11,77e23ebd-6e10-4113-938c-bb55550710f5,Spice <> Capriotti's - Sep / Oct,promotion,2025-09-18,None,N/A,,,,day,,,$ Off,0.00,0.00,USD,Broadway - Tucson,27829895,0,0.00,0.00,0.00,0.00,0.00,-0.00,-0.00,0.00,0.00,0.00,0,0,0,0,0,0,0,0
2025-10-11,77e23ebd-6e10-4113-938c-bb55550710f5,Spice <> Capriotti's - Sep / Oct,promotion,2025-09-18,None,N/A,,f06f33c5-bff5-4bb3-8dda-6cedeb2e6fc1,10% Happy hour Discount - Min $30 | Low Price Sensitivity,day,all,Order Discount,% Off,7.0%,30.00,USD,Overland Park,24110474,2,65.94,4.61,0.00,0.00,1.98,-0.00,-0.00,32.97,3.30,10.01,0,2,0,2,0,2,0,2
2025-10-11,77e23ebd-6e10-4113-938c-bb55550710f5,Spice <> Capriotti's - Sep / Oct,promotion,2025-09-18,None,N/A,,43340528-e1b7-4f95-ab40-8dc92bf9c274,"Spend $35, Save $6 | High Price Sensitivity",day,all,Order Discount,$ Off,6.00,35.00,USD,Silverside Road,691182,5,218.45,30.00,0.00,0.00,4.95,-0.00,-0.00,43.69,6.99,6.25,0,3,2,5,0,2,2,4
2025-10-11,77e23ebd-6e10-4113-938c-bb55550710f5,Spice <> Capriotti's - Sep / Oct,promotion,2025-09-18,None,N/A,,ba37e4d8-36c4-4cbe-8c7d-f4d1379109bd,"Spend $15, Save $3 | Low price Sensitivity",day,all,Order Discount,$ Off,3.00,15.00,USD,Stephanie St,75751,0,0.00,0.00,0.00,0.00,0.00,-0.00,-0.00,0.00,0.00,0.00,0,0,0,0,0,0,0,0
2025-10-11,77e23ebd-6e10-4113-938c-bb55550710f5,Spice <> Capriotti's - Sep / Oct,promotion,2025-09-18,None,N/A,,d1d0b263-4918-4c81-8c97-630471e7185b,10% Happy Hour Discount - Medium Price Sensitivity,day,all,Order Discount,% Off,10.0%,25.00,USD,West Cheyenne Ave,75722,2,56.64,5.67,0.00,0.00,1.98,-0.00,-0.00,28.32,3.83,7.40,0,1,1,2,0,1,1,2
2025-10-11,77e23ebd-6e10-4113-938c-bb55550710f5,Spice <> Capriotti's - Sep / Oct,promotion,2025-09-18,None,N/A,,ba37e4d8-36c4-4cbe-8c7d-f4d1379109bd,"Spend $15, Save $3 | Low price Sensitivity",day,all,Order Discount,$ Off,3.00,15.00,USD,Downingtown,33699763,3,88.82,9.00,0.00,0.00,2.97,-0.00,-0.00,29.61,3.99,7.42,0,3,0,3,0,3,0,3
2025-10-11,03e9f5c4-3136-4c5b-bb26-18b988f441f5,"Buy 1, get 1 free promotion 07/24/2025",promotion,2025-07-24,None,N/A,,,,,,,$ Off,0.00,0.00,USD,West Fullerton Ave,23349403,1,60.83,4.69,0.00,0.00,0.99,-0.00,-0.00,60.83,5.68,10.71,0,1,0,1,0,0,0,0
2025-10-11,77e23ebd-6e10-4113-938c-bb55550710f5,Spice <> Capriotti's - Sep / Oct,promotion,2025-09-18,None,N/A,,,,day,,,$ Off,0.00,0.00,USD,Smithtown Bypass,23349427,0,0.00,0.00,0.00,0.00,0.00,-0.00,-0.00,0.00,0.00,0.00,0,0,0,0,0,0,0,0
2025-10-11,77e23ebd-6e10-4113-938c-bb55550710f5,Spice <> Capriotti's - Sep / Oct,promotion,2025-09-18,None,N/A,,ba37e4d8-36c4-4cbe-8c7d-f4d1379109bd,"Spend $15, Save $3 | Low price Sensitivity",day,all,Order Discount,$ Off,3.00,15.00,USD,Arapahoe Rd,23349425,1,71.45,3.00,0.00,0.00,0.99,-0.00,-0.00,71.45,3.99,17.91,0,0,1,1,0,0,1,1
2025-10-11,02d2c45e-5b6f-4058-b05d-1fbcb475312e,"First order, 20% off 04/09/2025",promotion,2025-04-09,None,N/A,,,,,,,$ Off,0.00,0.00,USD,Kenosha & 177th,1856591,1,18.18,3.64,0.00,0.00,0.99,-0.00,-0.00,18.18,4.63,3.93,1,0,0,1,1,0,0,1
2025-10-11,f12a26e0-24e1-4d8e-ac05-d7e43f06d2bf,Happy Hour discount 11/12/2024,promotion,2024-11-12,None,N/A,,,,,,,$ Off,0.00,0.00,USD,Collier Pkwy-Lutz,23057623,2,67.62,14.00,0.00,0.00,1.98,-0.00,-0.00,33.81,7.99,4.23,0,2,0,2,0,2,0,2
2025-10-11,02d2c45e-5b6f-4058-b05d-1fbcb475312e,"First order, 20% off 04/09/2025",promotion,2025-04-09,None,N/A,,,,,,,$ Off,0.00,0.00,USD,North Boulder Hwy,75752,1,42.57,5.00,0.00,0.00,0.99,-0.00,-0.00,42.57,5.99,7.11,1,0,0,1,1,0,0,1
2025-10-11,2bb77af0-6b48-46d5-97b3-e43758ea5314,"First order, 20% off 02/01/2025",promotion,2025-02-01,None,N/A,,,,,,,$ Off,0.00,0.00,USD,The Old Road,24898774,0,0.00,0.00,0.00,0.00,0.00,-0.00,-0.00,0.00,0.00,0.00,0,0,0,0,0,0,0,0
2025-10-11,6e2eeb77-e45d-427b-974e-9e6d639dce9e,"Buy 1, get 1 free promotion 10/02/2025",promotion,2025-10-02,2025-11-02,N/A,,,,,,,$ Off,0.00,0.00,USD,Manchester Rd,27715447,0,0.00,0.00,0.00,0.00,0.00,-0.00,-0.00,0.00,0.00,0.00,0,0,0,0,0,0,0,0
2025-10-11,77e23ebd-6e10-4113-938c-bb55550710f5,Spice <> Capriotti's - Sep / Oct,promotion,2025-09-18,None,N/A,,91f90d8c-8a7d-41cf-9b6a-888400112024,10% Happy Hour Discount - Min  $25 | High Price Sensitivity,day,all,Order Discount,% Off,10.0%,25.00,USD,E 53rd - Davenport,582282,2,68.53,6.86,0.00,0.00,1.98,-0.00,-0.00,34.27,4.42,7.75,0,2,0,2,0,2,0,2
2025-10-11,77e23ebd-6e10-4113-938c-bb55550710f5,Spice <> Capriotti's - Sep / Oct,promotion,2025-09-18,None,N/A,,,,day,,,$ Off,0.00,0.00,USD,Highlands Ranch,1791292,0,0.00,0.00,0.00,0.00,0.00,-0.00,-0.00,0.00,0.00,0.00,0,0,0,0,0,0,0,0
2025-10-11,02d2c45e-5b6f-4058-b05d-1fbcb475312e,"First order, 20% off 04/09/2025",promotion,2025-04-09,None,N/A,,,,,,,$ Off,0.00,0.00,USD,West Basin Rd,575301,0,0.00,0.00,0.00,0.00,0.00,-0.00,-0.00,0.00,0.00,0.00,0,0,0,0,0,0,0,0
2025-10-11,02d2c45e-5b6f-4058-b05d-1fbcb475312e,"First order, 20% off 04/09/2025",promotion,2025-04-09,None,N/A,,,,,,,$ Off,0.00,0.00,USD,Bidwell - Folsom,26234909,0,0.00,0.00,0.00,0.00,0.00,-0.00,-0.00,0.00,0.00,0.00,0,0,0,0,0,0,0,0
2025-10-11,77e23ebd-6e10-4113-938c-bb55550710f5,Spice <> Capriotti's - Sep / Oct,promotion,2025-09-18,None,N/A,,,,day,,,$ Off,0.00,0.00,USD,Mountain View,2608887,0,0.00,0.00,0.00,0.00,0.00,-0.00,-0.00,0.00,0.00,0.00,0,0,0,0,0,0,0,0
2025-10-11,77e23ebd-6e10-4113-938c-bb55550710f5,Spice <> Capriotti's - Sep / Oct,promotion,2025-09-18,None,N/A,,ba37e4d8-36c4-4cbe-8c7d-f4d1379109bd,"Spend $15, Save $3 | Low price Sensitivity",day,all,Order Discount,$ Off,3.00,15.00,USD,Rancho Mirage,32864869,2,66.97,6.00,0.00,0.00,1.98,-0.00,-0.00,33.49,3.99,8.39,0,2,0,2,0,1,0,1
2025-10-11,178f54dc-804b-413e-b1bd-ffbdde7f61a1,"Dormant customers, 20% off 02/01/2025",promotion,2025-02-01,None,N/A,,,,,,,$ Off,0.00,0.00,USD,East Sepulveda,1743753,0,0.00,0.00,0.00,0.00,0.00,-0.00,-0.00,0.00,0.00,0.00,0,0,0,0,0,0,0,0
2025-10-11,6c1ac2b8-1b1b-4277-8266-2ffa49f73156,Happy Hour Item Discount 09/22/2025,promotion,2025-09-22,None,N/A,,,,,,,$ Off,0.00,0.00,USD,Frisco,34516355,0,0.00,0.00,0.00,0.00,0.00,-0.00,-0.00,0.00,0.00,0.00,0,0,0,0,0,0,0,0
2025-10-11,77e23ebd-6e10-4113-938c-bb55550710f5,Spice <> Capriotti's - Sep / Oct,promotion,2025-09-18,None,N/A,,d1d0b263-4918-4c81-8c97-630471e7185b,10% Happy Hour Discount - Medium Price Sensitivity,day,all,Order Discount,% Off,10.0%,25.00,USD,Sunset and Sandhill,32849799,0,0.00,0.00,0.00,0.00,0.00,-0.00,-0.00,0.00,0.00,0.00,0,0,0,0,0,0,0,0
2025-10-11,2bb77af0-6b48-46d5-97b3-e43758ea5314,"First order, 20% off 02/01/2025",promotion,2025-02-01,None,N/A,,,,,,,$ Off,0.00,0.00,USD,East Sepulveda,1743753,2,37.78,7.56,0.00,0.00,1.98,-0.00,-0.00,18.89,4.77,3.96,2,0,0,2,2,0,0,2
2025-10-11,77e23ebd-6e10-4113-938c-bb55550710f5,Spice <> Capriotti's - Sep / Oct,promotion,2025-09-18,None,N/A,,d1d0b263-4918-4c81-8c97-630471e7185b,10% Happy Hour Discount - Medium Price Sensitivity,day,all,Order Discount,% Off,10.0%,25.00,USD,Plank Rd,27918503,0,0.00,0.00,0.00,0.00,0.00,-0.00,-0.00,0.00,0.00,0.00,0,0,0,0,0,0,0,0
2025-10-11,02d2c45e-5b6f-4058-b05d-1fbcb475312e,"First order, 20% off 04/09/2025",promotion,2025-04-09,None,N/A,,,,,,,$ Off,0.00,0.00,USD,Santa Fe Station,75723,3,73.06,12.44,0.00,0.00,2.97,-0.00,-0.00,24.35,5.14,4.74,3,0,0,3,2,0,0,2
2025-10-11,77e23ebd-6e10-4113-938c-bb55550710f5,Spice <> Capriotti's - Sep / Oct,promotion,2025-09-18,None,N/A,,ba37e4d8-36c4-4cbe-8c7d-f4d1379109bd,"Spend $15, Save $3 | Low price Sensitivity",day,all,Order Discount,$ Off,3.00,15.00,USD,Collier Pkwy-Lutz,23057623,5,127.04,15.00,0.00,0.00,4.95,-0.00,-0.00,25.41,3.99,6.37,0,4,1,5,0,3,1,4
2025-10-11,77e23ebd-6e10-4113-938c-bb55550710f5,Spice <> Capriotti's - Sep / Oct,promotion,2025-09-18,None,N/A,,,,day,,,$ Off,0.00,0.00,USD,Bidwell - Folsom,26234909,0,0.00,0.00,0.00,0.00,0.00,-0.00,-0.00,0.00,0.00,0.00,0,0,0,0,0,0,0,0
2025-10-11,02d2c45e-5b6f-4058-b05d-1fbcb475312e,"First order, 20% off 04/09/2025",promotion,2025-04-09,None,N/A,,,,,,,$ Off,0.00,0.00,USD,Newark,390890,4,95.62,17.45,0.00,0.00,3.96,-0.00,-0.00,23.91,5.35,4.47,4,0,0,4,3,0,0,3
2025-10-11,77e23ebd-6e10-4113-938c-bb55550710f5,Spice <> Capriotti's - Sep / Oct,promotion,2025-09-18,None,N/A,,91f90d8c-8a7d-41cf-9b6a-888400112024,10% Happy Hour Discount - Min  $25 | High Price Sensitivity,day,all,Order Discount,% Off,10.0%,25.00,USD,Palm Ave - Fresno,1581092,0,0.00,0.00,0.00,0.00,0.00,-0.00,-0.00,0.00,0.00,0.00,0,0,0,0,0,0,0,0
2025-10-11,02d2c45e-5b6f-4058-b05d-1fbcb475312e,"First order, 20% off 04/09/2025",promotion,2025-04-09,None,N/A,,,,,,,$ Off,0.00,0.00,USD,Nevada Way,75754,0,0.00,0.00,0.00,0.00,0.00,-0.00,-0.00,0.00,0.00,0.00,0,0,0,0,0,0,0,0
2025-10-11,02d2c45e-5b6f-4058-b05d-1fbcb475312e,"First order, 20% off 04/09/2025",promotion,2025-04-09,None,N/A,,,,,,,$ Off,0.00,0.00,USD,The Old Road,24898774,0,0.00,0.00,0.00,0.00,0.00,-0.00,-0.00,0.00,0.00,0.00,0,0,0,0,0,0,0,0
2025-10-11,02d2c45e-5b6f-4058-b05d-1fbcb475312e,"First order, 20% off 04/09/2025",promotion,2025-04-09,None,N/A,,,,,,,$ Off,0.00,0.00,USD,Dana Park - Mesa,126177,1,36.77,5.00,0.00,0.00,0.99,-0.00,-0.00,36.77,5.99,6.14,1,0,0,1,1,0,0,1
2025-10-11,25abde4d-2867-459b-9b99-b628e195401e,"Dormant customers, 20% off 07/24/2025",promotion,2025-07-24,None,N/A,,,,,,,$ Off,0.00,0.00,USD,West Fullerton Ave,23349403,1,32.99,6.60,0.00,0.00,0.99,-0.00,-0.00,32.99,7.59,4.35,0,0,1,1,0,0,1,1
2025-10-11,02d2c45e-5b6f-4058-b05d-1fbcb475312e,"First order, 20% off 04/09/2025",promotion,2025-04-09,None,N/A,,,,,,,$ Off,0.00,0.00,USD,Downtown Summerlin,75736,2,73.93,8.84,0.00,0.00,1.98,-0.00,-0.00,36.97,5.41,6.83,2,0,0,2,1,0,0,1
2025-10-11,77e23ebd-6e10-4113-938c-bb55550710f5,Spice <> Capriotti's - Sep / Oct,promotion,2025-09-18,None,N/A,,,,day,,,$ Off,0.00,0.00,USD,Kirkwood Hwy,390889,0,0.00,0.00,0.00,0.00,0.00,-0.00,-0.00,0.00,0.00,0.00,0,0,0,0,0,0,0,0
2025-10-11,02d2c45e-5b6f-4058-b05d-1fbcb475312e,"First order, 20% off 04/09/2025",promotion,2025-04-09,None,N/A,,,,,,,$ Off,0.00,0.00,USD,Interquest Parkway,27558470,1,20.28,4.06,0.00,0.00,0.99,-0.00,-0.00,20.28,5.05,4.02,1,0,0,1,1,0,0,1
2025-10-11,77e23ebd-6e10-4113-938c-bb55550710f5,Spice <> Capriotti's - Sep / Oct,promotion,2025-09-18,None,N/A,,d1d0b263-4918-4c81-8c97-630471e7185b,10% Happy Hour Discount - Medium Price Sensitivity,day,all,Order Discount,% Off,10.0%,25.00,USD,West Avera Dr,1742446,0,0.00,0.00,0.00,0.00,0.00,-0.00,-0.00,0.00,0.00,0.00,0,0,0,0,0,0,0,0
2025-10-11,02d2c45e-5b6f-4058-b05d-1fbcb475312e,"First order, 20% off 04/09/2025",promotion,2025-04-09,None,N/A,,,,,,,$ Off,0.00,0.00,USD,N 87th Street,27965,1,24.58,4.92,0.00,0.00,0.99,-0.00,-0.00,24.58,5.91,4.16,1,0,0,1,0,0,0,0
2025-10-11,9dd1f2bc-1053-4e77-925f-349afae361d5,Spend $30 get 15% off 01/02/2025,promotion,2025-01-02,None,N/A,,,,,,,$ Off,0.00,0.00,USD,Sunrise Blvd,31345439,7,332.47,44.32,0.00,0.00,6.93,-0.00,-0.00,47.50,7.32,6.49,1,5,1,7,1,4,0,5
2025-10-11,77e23ebd-6e10-4113-938c-bb55550710f5,Spice <> Capriotti's - Sep / Oct,promotion,2025-09-18,None,N/A,,,,day,,,$ Off,0.00,0.00,USD,Byers Dr,23186665,0,0.00,0.00,0.00,0.00,0.00,-0.00,-0.00,0.00,0.00,0.00,0,0,0,0,0,0,0,0
2025-10-11,77e23ebd-6e10-4113-938c-bb55550710f5,Spice <> Capriotti's - Sep / Oct,promotion,2025-09-18,None,N/A,,,,day,,,$ Off,0.00,0.00,USD,Old Town,27964,0,0.00,0.00,0.00,0.00,0.00,-0.00,-0.00,0.00,0.00,0.00,0,0,0,0,0,0,0,0
2025-10-11,77e23ebd-6e10-4113-938c-bb55550710f5,Spice <> Capriotti's - Sep / Oct,promotion,2025-09-18,None,N/A,,f06f33c5-bff5-4bb3-8dda-6cedeb2e6fc1,10% Happy hour Discount - Min $30 | Low Price Sensitivity,day,all,Order Discount,% Off,7.0%,30.00,USD,East Market Street,23256727,0,0.00,0.00,0.00,0.00,0.00,-0.00,-0.00,0.00,0.00,0.00,0,0,0,0,0,0,0,0
2025-10-11,77e23ebd-6e10-4113-938c-bb55550710f5,Spice <> Capriotti's - Sep / Oct,promotion,2025-09-18,None,N/A,,d1d0b263-4918-4c81-8c97-630471e7185b,10% Happy Hour Discount - Medium Price Sensitivity,day,all,Order Discount,% Off,10.0%,25.00,USD,1st Ave NE,23128705,0,0.00,0.00,0.00,0.00,0.00,-0.00,-0.00,0.00,0.00,0.00,0,0,0,0,0,0,0,0
2025-10-11,77e23ebd-6e10-4113-938c-bb55550710f5,Spice <> Capriotti's - Sep / Oct,promotion,2025-09-18,None,N/A,,d1d0b263-4918-4c81-8c97-630471e7185b,10% Happy Hour Discount - Medium Price Sensitivity,day,all,Order Discount,% Off,10.0%,25.00,USD,Eden Square Ctr,420646,5,304.83,23.41,0.00,0.00,4.95,-0.00,-0.00,60.97,5.67,10.75,0,4,1,5,0,2,1,3
2025-10-11,77e23ebd-6e10-4113-938c-bb55550710f5,Spice <> Capriotti's - Sep / Oct,promotion,2025-09-18,None,N/A,,ba37e4d8-36c4-4cbe-8c7d-f4d1379109bd,"Spend $15, Save $3 | Low price Sensitivity",day,all,Order Discount,$ Off,3.00,15.00,USD,Kennett Square,575296,1,17.18,3.00,0.00,0.00,0.99,-0.00,-0.00,17.18,3.99,4.31,0,1,0,1,0,0,0,0
2025-10-11,77e23ebd-6e10-4113-938c-bb55550710f5,Spice <> Capriotti's - Sep / Oct,promotion,2025-09-18,None,N/A,,d1d0b263-4918-4c81-8c97-630471e7185b,10% Happy Hour Discount - Medium Price Sensitivity,day,all,Order Discount,% Off,10.0%,25.00,USD,Whitesburg Dr (Medical District),34051357,2,61.34,6.14,0.00,0.00,1.98,-0.00,-0.00,30.67,4.06,7.55,1,1,0,2,1,1,0,2
2025-10-11,77e23ebd-6e10-4113-938c-bb55550710f5,Spice <> Capriotti's - Sep / Oct,promotion,2025-09-18,None,N/A,,d1d0b263-4918-4c81-8c97-630471e7185b,10% Happy Hour Discount - Medium Price Sensitivity,day,all,Order Discount,% Off,10.0%,25.00,USD,Post Falls,34326515,2,80.27,8.03,0.00,0.00,1.98,-0.00,-0.00,40.14,5.01,8.02,0,2,0,2,0,2,0,2
2025-10-11,77e23ebd-6e10-4113-938c-bb55550710f5,Spice <> Capriotti's - Sep / Oct,promotion,2025-09-18,None,N/A,,,,day,,,$ Off,0.00,0.00,USD,Horizon Ridge,75753,0,0.00,0.00,0.00,0.00,0.00,-0.00,-0.00,0.00,0.00,0.00,0,0,0,0,0,0,0,0
2025-10-11,77e23ebd-6e10-4113-938c-bb55550710f5,Spice <> Capriotti's - Sep / Oct,promotion,2025-09-18,None,N/A,,,,day,,,$ Off,0.00,0.00,USD,Nevada Way,75754,0,0.00,0.00,0.00,0.00,0.00,-0.00,-0.00,0.00,0.00,0.00,0,0,0,0,0,0,0,0
2025-10-11,77e23ebd-6e10-4113-938c-bb55550710f5,Spice <> Capriotti's - Sep / Oct,promotion,2025-09-18,None,N/A,,,,day,,,$ Off,0.00,0.00,USD,Sumneytown Pike,24717004,0,0.00,0.00,0.00,0.00,0.00,-0.00,-0.00,0.00,0.00,0.00,0,0,0,0,0,0,0,0
2025-10-11,77e23ebd-6e10-4113-938c-bb55550710f5,Spice <> Capriotti's - Sep / Oct,promotion,2025-09-18,None,N/A,,43340528-e1b7-4f95-ab40-8dc92bf9c274,"Spend $35, Save $6 | High Price Sensitivity",day,all,Order Discount,$ Off,6.00,35.00,USD,E 53rd - Davenport,582282,0,0.00,0.00,0.00,0.00,0.00,-0.00,-0.00,0.00,0.00,0.00,0,0,0,0,0,0,0,0
2025-10-11,77e23ebd-6e10-4113-938c-bb55550710f5,Spice <> Capriotti's - Sep / Oct,promotion,2025-09-18,None,N/A,,f06f33c5-bff5-4bb3-8dda-6cedeb2e6fc1,10% Happy hour Discount - Min $30 | Low Price Sensitivity,day,all,Order Discount,% Off,7.0%,30.00,USD,Murrieta Hot Springs Rd,29652192,1,36.76,2.57,0.00,0.00,0.99,-0.00,-0.00,36.76,3.56,10.33,0,1,0,1,0,1,0,1
2025-10-11,77e23ebd-6e10-4113-938c-bb55550710f5,Spice <> Capriotti's - Sep / Oct,promotion,2025-09-18,None,N/A,,,,day,,,$ Off,0.00,0.00,USD,The Old Road,24898774,0,0.00,0.00,0.00,0.00,0.00,-0.00,-0.00,0.00,0.00,0.00,0,0,0,0,0,0,0,0
2025-10-11,77e23ebd-6e10-4113-938c-bb55550710f5,Spice <> Capriotti's - Sep / Oct,promotion,2025-09-18,None,N/A,,f06f33c5-bff5-4bb3-8dda-6cedeb2e6fc1,10% Happy hour Discount - Min $30 | Low Price Sensitivity,day,all,Order Discount,% Off,7.0%,30.00,USD,Terrace Center,321047,1,30.76,2.15,0.00,0.00,0.99,-0.00,-0.00,30.76,3.14,9.80,0,1,0,1,0,1,0,1
2025-10-11,77e23ebd-6e10-4113-938c-bb55550710f5,Spice <> Capriotti's - Sep / Oct,promotion,2025-09-18,None,N/A,,ba37e4d8-36c4-4cbe-8c7d-f4d1379109bd,"Spend $15, Save $3 | Low price Sensitivity",day,all,Order Discount,$ Off,3.00,15.00,USD,N 87th Street,27965,7,207.86,21.00,0.00,0.00,6.93,-0.00,-0.00,29.69,3.99,7.44,0,6,1,7,0,5,0,5
2025-10-11,77e23ebd-6e10-4113-938c-bb55550710f5,Spice <> Capriotti's - Sep / Oct,promotion,2025-09-18,None,N/A,,43340528-e1b7-4f95-ab40-8dc92bf9c274,"Spend $35, Save $6 | High Price Sensitivity",day,all,Order Discount,$ Off,6.00,35.00,USD,Niles Cortland Rd SE,34043935,4,247.82,24.00,0.00,0.00,3.96,-0.00,-0.00,61.96,6.99,8.86,1,3,0,4,1,2,0,3
2025-10-11,77e23ebd-6e10-4113-938c-bb55550710f5,Spice <> Capriotti's - Sep / Oct,promotion,2025-09-18,None,N/A,,d1d0b263-4918-4c81-8c97-630471e7185b,10% Happy Hour Discount - Medium Price Sensitivity,day,all,Order Discount,% Off,10.0%,25.00,USD,Plumb Lane,439577,0,0.00,0.00,0.00,0.00,0.00,-0.00,-0.00,0.00,0.00,0.00,0,0,0,0,0,0,0,0
2025-10-11,77e23ebd-6e10-4113-938c-bb55550710f5,Spice <> Capriotti's - Sep / Oct,promotion,2025-09-18,None,N/A,,,,day,,,$ Off,0.00,0.00,USD,St Rose Pkwy,1335286,0,0.00,0.00,0.00,0.00,0.00,-0.00,-0.00,0.00,0.00,0.00,0,0,0,0,0,0,0,0
2025-10-11,77e23ebd-6e10-4113-938c-bb55550710f5,Spice <> Capriotti's - Sep / Oct,promotion,2025-09-18,None,N/A,,,,day,,,$ Off,0.00,0.00,USD,Riverwind Dr,34516256,0,0.00,0.00,0.00,0.00,0.00,-0.00,-0.00,0.00,0.00,0.00,0,0,0,0,0,0,0,0
2025-10-11,77e23ebd-6e10-4113-938c-bb55550710f5,Spice <> Capriotti's - Sep / Oct,promotion,2025-09-18,None,N/A,,,,day,,,$ Off,0.00,0.00,USD,Collier Pkwy-Lutz,23057623,0,0.00,0.00,0.00,0.00,0.00,-0.00,-0.00,0.00,0.00,0.00,0,0,0,0,0,0,0,0
2025-10-11,77e23ebd-6e10-4113-938c-bb55550710f5,Spice <> Capriotti's - Sep / Oct,promotion,2025-09-18,None,N/A,,ba37e4d8-36c4-4cbe-8c7d-f4d1379109bd,"Spend $15, Save $3 | Low price Sensitivity",day,all,Order Discount,$ Off,3.00,15.00,USD,Bidwell - Folsom,26234909,1,25.68,3.00,0.00,0.00,0.99,-0.00,-0.00,25.68,3.99,6.44,0,0,1,1,0,0,1,1
2025-10-11,77e23ebd-6e10-4113-938c-bb55550710f5,Spice <> Capriotti's - Sep / Oct,promotion,2025-09-18,None,N/A,,f06f33c5-bff5-4bb3-8dda-6cedeb2e6fc1,10% Happy hour Discount - Min $30 | Low Price Sensitivity,day,all,Order Discount,% Off,7.0%,30.00,USD,South State Rd,1713806,0,0.00,0.00,0.00,0.00,0.00,-0.00,-0.00,0.00,0.00,0.00,0,0,0,0,0,0,0,0
2025-10-11,77e23ebd-6e10-4113-938c-bb55550710f5,Spice <> Capriotti's - Sep / Oct,promotion,2025-09-18,None,N/A,,ba37e4d8-36c4-4cbe-8c7d-f4d1379109bd,"Spend $15, Save $3 | Low price Sensitivity",day,all,Order Discount,$ Off,3.00,15.00,USD,The Old Road,24898774,0,0.00,0.00,0.00,0.00,0.00,-0.00,-0.00,0.00,0.00,0.00,0,0,0,0,0,0,0,0
2025-10-11,77e23ebd-6e10-4113-938c-bb55550710f5,Spice <> Capriotti's - Sep / Oct,promotion,2025-09-18,None,N/A,,91f90d8c-8a7d-41cf-9b6a-888400112024,10% Happy Hour Discount - Min  $25 | High Price Sensitivity,day,all,Order Discount,% Off,10.0%,25.00,USD,Blackstone-Fresno,24415716,0,0.00,0.00,0.00,0.00,0.00,-0.00,-0.00,0.00,0.00,0.00,0,0,0,0,0,0,0,0
2025-10-11,77e23ebd-6e10-4113-938c-bb55550710f5,Spice <> Capriotti's - Sep / Oct,promotion,2025-09-18,None,N/A,,d1d0b263-4918-4c81-8c97-630471e7185b,10% Happy Hour Discount - Medium Price Sensitivity,day,all,Order Discount,% Off,10.0%,25.00,USD,Aliante Casino,75725,0,0.00,0.00,0.00,0.00,0.00,-0.00,-0.00,0.00,0.00,0.00,0,0,0,0,0,0,0,0
2025-10-11,77e23ebd-6e10-4113-938c-bb55550710f5,Spice <> Capriotti's - Sep / Oct,promotion,2025-09-18,None,N/A,,f06f33c5-bff5-4bb3-8dda-6cedeb2e6fc1,10% Happy hour Discount - Min $30 | Low Price Sensitivity,day,all,Order Discount,% Off,7.0%,30.00,USD,Princeton,32118309,0,0.00,0.00,0.00,0.00,0.00,-0.00,-0.00,0.00,0.00,0.00,0,0,0,0,0,0,0,0
2025-10-11,77e23ebd-6e10-4113-938c-bb55550710f5,Spice <> Capriotti's - Sep / Oct,promotion,2025-09-18,None,N/A,,,,day,,,$ Off,0.00,0.00,USD,Forest Drive,674540,0,0.00,0.00,0.00,0.00,0.00,-0.00,-0.00,0.00,0.00,0.00,0,0,0,0,0,0,0,0
2025-10-11,77e23ebd-6e10-4113-938c-bb55550710f5,Spice <> Capriotti's - Sep / Oct,promotion,2025-09-18,None,N/A,,d1d0b263-4918-4c81-8c97-630471e7185b,10% Happy Hour Discount - Medium Price Sensitivity,day,all,Order Discount,% Off,10.0%,25.00,USD,West Flamingo Road,75731,1,45.98,4.60,0.00,0.00,0.99,-0.00,-0.00,45.98,5.59,8.23,0,1,0,1,0,0,0,0
2025-10-11,77e23ebd-6e10-4113-938c-bb55550710f5,Spice <> Capriotti's - Sep / Oct,promotion,2025-09-18,None,N/A,,f06f33c5-bff5-4bb3-8dda-6cedeb2e6fc1,10% Happy hour Discount - Min $30 | Low Price Sensitivity,day,all,Order Discount,% Off,7.0%,30.00,USD,Castle Rock,23057614,1,69.93,4.90,0.00,0.00,0.99,-0.00,-0.00,69.93,5.89,11.87,0,0,1,1,0,0,0,0
2025-10-11,9dd1f2bc-1053-4e77-925f-349afae361d5,Spend $30 get 15% off 01/02/2025,promotion,2025-01-02,None,N/A,,,,,,,$ Off,0.00,0.00,USD,Bidwell - Folsom,26234909,8,364.54,54.68,0.00,0.00,7.92,-0.00,-0.00,45.57,7.83,5.82,2,5,1,8,2,5,0,7
2025-10-11,02d2c45e-5b6f-4058-b05d-1fbcb475312e,"First order, 20% off 04/09/2025",promotion,2025-04-09,None,N/A,,,,,,,$ Off,0.00,0.00,USD,Heart Pine-Odessa,2232632,0,0.00,0.00,0.00,0.00,0.00,-0.00,-0.00,0.00,0.00,0.00,0,0,0,0,0,0,0,0
2025-10-11,02d2c45e-5b6f-4058-b05d-1fbcb475312e,"First order, 20% off 04/09/2025",promotion,2025-04-09,None,N/A,,,,,,,$ Off,0.00,0.00,USD,Anthem,75750,0,0.00,0.00,0.00,0.00,0.00,-0.00,-0.00,0.00,0.00,0.00,0,0,0,0,0,0,0,0
2025-10-11,02d2c45e-5b6f-4058-b05d-1fbcb475312e,"First order, 20% off 04/09/2025",promotion,2025-04-09,None,N/A,,,,,,,$ Off,0.00,0.00,USD,"Capriotti's of Dover, Inc.",1617804,0,0.00,0.00,0.00,0.00,0.00,-0.00,-0.00,0.00,0.00,0.00,0,0,0,0,0,0,0,0
2025-10-11,750e00fa-6876-4d9b-8c15-6ca184c578b9,Happy Hour discount 03/17/2025,promotion,2025-03-17,None,N/A,,,,,,,$ Off,0.00,0.00,USD,Interquest Parkway,27558470,4,118.20,20.00,0.00,0.00,3.96,-0.00,-0.00,29.55,5.99,4.93,1,2,1,4,1,2,1,4
2025-10-11,02d2c45e-5b6f-4058-b05d-1fbcb475312e,"First order, 20% off 04/09/2025",promotion,2025-04-09,None,N/A,,,,,,,$ Off,0.00,0.00,USD,Bel Air,23733193,6,256.89,29.16,0.00,0.00,5.94,-0.00,-0.00,42.82,5.85,7.32,6,0,0,6,3,0,0,3
2025-10-11,02d2c45e-5b6f-4058-b05d-1fbcb475312e,"First order, 20% off 04/09/2025",promotion,2025-04-09,None,N/A,,,,,,,$ Off,0.00,0.00,USD,East Market Street,23256727,0,0.00,0.00,0.00,0.00,0.00,-0.00,-0.00,0.00,0.00,0.00,0,0,0,0,0,0,0,0
2025-10-11,02d2c45e-5b6f-4058-b05d-1fbcb475312e,"First order, 20% off 04/09/2025",promotion,2025-04-09,None,N/A,,,,,,,$ Off,0.00,0.00,USD,Eden Square Ctr,420646,3,68.45,11.84,0.00,0.00,2.97,-0.00,-0.00,22.82,4.94,4.62,3,0,0,3,2,0,0,2
2025-10-11,02d2c45e-5b6f-4058-b05d-1fbcb475312e,"First order, 20% off 04/09/2025",promotion,2025-04-09,None,N/A,,,,,,,$ Off,0.00,0.00,USD,Coeur d'Alene,23085790,1,17.29,3.46,0.00,0.00,0.99,-0.00,-0.00,17.29,4.45,3.89,1,0,0,1,1,0,0,1
2025-10-11,02d2c45e-5b6f-4058-b05d-1fbcb475312e,"First order, 20% off 04/09/2025",promotion,2025-04-09,None,N/A,,,,,,,$ Off,0.00,0.00,USD,Manchester Rd,27715447,4,185.81,19.26,0.00,0.00,3.96,-0.00,-0.00,46.45,5.81,8.00,4,0,0,4,1,0,0,1
2025-10-11,77e23ebd-6e10-4113-938c-bb55550710f5,Spice <> Capriotti's - Sep / Oct,promotion,2025-09-18,None,N/A,,,,day,,,$ Off,0.00,0.00,USD,Frisco,34516355,0,0.00,0.00,0.00,0.00,0.00,-0.00,-0.00,0.00,0.00,0.00,0,0,0,0,0,0,0,0
2025-10-11,77e23ebd-6e10-4113-938c-bb55550710f5,Spice <> Capriotti's - Sep / Oct,promotion,2025-09-18,None,N/A,,,,day,,,$ Off,0.00,0.00,USD,Palm Ave - Fresno,1581092,0,0.00,0.00,0.00,0.00,0.00,-0.00,-0.00,0.00,0.00,0.00,0,0,0,0,0,0,0,0
2025-10-11,77e23ebd-6e10-4113-938c-bb55550710f5,Spice <> Capriotti's - Sep / Oct,promotion,2025-09-18,None,N/A,,ba37e4d8-36c4-4cbe-8c7d-f4d1379109bd,"Spend $15, Save $3 | Low price Sensitivity",day,all,Order Discount,$ Off,3.00,15.00,USD,East Sepulveda,1743753,0,0.00,0.00,0.00,0.00,0.00,-0.00,-0.00,0.00,0.00,0.00,0,0,0,0,0,0,0,0
2025-10-11,02d2c45e-5b6f-4058-b05d-1fbcb475312e,"First order, 20% off 04/09/2025",promotion,2025-04-09,None,N/A,,,,,,,$ Off,0.00,0.00,USD,Brayden Pkwy,2375657,5,163.48,23.46,0.00,0.00,4.95,-0.00,-0.00,32.70,5.68,5.75,5,0,0,5,3,0,0,3
2025-10-11,02d2c45e-5b6f-4058-b05d-1fbcb475312e,"First order, 20% off 04/09/2025",promotion,2025-04-09,None,N/A,,,,,,,$ Off,0.00,0.00,USD,Concord Pike,23151390,1,31.66,5.00,0.00,0.00,0.99,-0.00,-0.00,31.66,5.99,5.29,1,0,0,1,1,0,0,1
2025-10-11,22011977-85b1-4624-ad97-926f3ebe49f4,Happy Hour discount 07/09/2025,promotion,2025-07-09,None,N/A,,,,,,,$ Off,0.00,0.00,USD,Niles Cortland Rd SE,34043935,5,143.55,29.63,0.00,0.00,4.95,-0.00,-0.00,28.71,6.92,4.15,0,5,0,5,0,5,0,5
2025-10-11,77e23ebd-6e10-4113-938c-bb55550710f5,Spice <> Capriotti's - Sep / Oct,promotion,2025-09-18,None,N/A,,d1d0b263-4918-4c81-8c97-630471e7185b,10% Happy Hour Discount - Medium Price Sensitivity,day,all,Order Discount,% Off,10.0%,25.00,USD,Nellis Blvd,75755,1,31.39,3.14,0.00,0.00,0.99,-0.00,-0.00,31.39,4.13,7.60,0,1,0,1,0,0,0,0
2025-10-11,1dd4cf16-61f6-4935-beac-ad07a26422b3,"First order, 20% off 07/23/2025",promotion,2025-07-23,None,N/A,,,,,,,$ Off,0.00,0.00,USD,Happy Valley,23584856,0,0.00,0.00,0.00,0.00,0.00,-0.00,-0.00,0.00,0.00,0.00,0,0,0,0,0,0,0,0
2025-10-11,02d2c45e-5b6f-4058-b05d-1fbcb475312e,"First order, 20% off 04/09/2025",promotion,2025-04-09,None,N/A,,,,,,,$ Off,0.00,0.00,USD,University Dr,29894178,3,73.31,12.92,0.00,0.00,2.97,-0.00,-0.00,24.44,5.30,4.61,3,0,0,3,3,0,0,3
2025-10-11,02d2c45e-5b6f-4058-b05d-1fbcb475312e,"First order, 20% off 04/09/2025",promotion,2025-04-09,None,N/A,,,,,,,$ Off,0.00,0.00,USD,Collier Pkwy-Lutz,23057623,0,0.00,0.00,0.00,0.00,0.00,-0.00,-0.00,0.00,0.00,0.00,0,0,0,0,0,0,0,0
2025-10-11,4996d114-68d0-483f-963c-d124d822fc8f,"First order, 20% off 11/12/2024",promotion,2024-11-12,None,N/A,,,,,,,$ Off,0.00,0.00,USD,Northdale Blvd,24976449,1,21.48,4.30,0.00,0.00,0.99,-0.00,-0.00,21.48,5.29,4.06,1,0,0,1,1,0,0,1
2025-10-11,02d2c45e-5b6f-4058-b05d-1fbcb475312e,"First order, 20% off 04/09/2025",promotion,2025-04-09,None,N/A,,,,,,,$ Off,0.00,0.00,USD,Mountain View,2608887,5,182.77,24.64,0.00,0.00,4.95,-0.00,-0.00,36.55,5.92,6.18,5,0,0,5,2,0,0,2
2025-10-11,ed10ed86-5221-41d8-9af0-0ac62871adbb,"First Order, 20% Off",promotion,2022-05-17,None,N/A,,,,,,,$ Off,0.00,0.00,USD,Pioneer Pkwy,874359,0,0.00,0.00,0.00,0.00,0.00,-0.00,-0.00,0.00,0.00,0.00,0,0,0,0,0,0,0,0
2025-10-11,77e23ebd-6e10-4113-938c-bb55550710f5,Spice <> Capriotti's - Sep / Oct,promotion,2025-09-18,None,N/A,,,,day,,,$ Off,0.00,0.00,USD,South State Rd,1713806,0,0.00,0.00,0.00,0.00,0.00,-0.00,-0.00,0.00,0.00,0.00,0,0,0,0,0,0,0,0
2025-10-11,02d2c45e-5b6f-4058-b05d-1fbcb475312e,"First order, 20% off 04/09/2025",promotion,2025-04-09,None,N/A,,,,,,,$ Off,0.00,0.00,USD,Red Cliff Dr,578425,2,86.36,10.00,0.00,0.00,1.98,-0.00,-0.00,43.18,5.99,7.21,2,0,0,2,1,0,0,1
2025-10-11,02d2c45e-5b6f-4058-b05d-1fbcb475312e,"First order, 20% off 04/09/2025",promotion,2025-04-09,None,N/A,,,,,,,$ Off,0.00,0.00,USD,1st Ave NE,23128705,4,94.75,16.24,0.00,0.00,3.96,-0.00,-0.00,23.69,5.05,4.69,4,0,0,4,2,0,0,2
2025-10-11,77e23ebd-6e10-4113-938c-bb55550710f5,Spice <> Capriotti's - Sep / Oct,promotion,2025-09-18,None,N/A,,43340528-e1b7-4f95-ab40-8dc92bf9c274,"Spend $35, Save $6 | High Price Sensitivity",day,all,Order Discount,$ Off,6.00,35.00,USD,Roby Dr - Hammond,24891803,2,103.27,12.00,0.00,0.00,1.98,-0.00,-0.00,51.64,6.99,7.39,1,0,1,2,1,0,1,2
2025-10-11,77e23ebd-6e10-4113-938c-bb55550710f5,Spice <> Capriotti's - Sep / Oct,promotion,2025-09-18,None,N/A,,,,day,,,$ Off,0.00,0.00,USD,Happy Valley,23584856,0,0.00,0.00,0.00,0.00,0.00,-0.00,-0.00,0.00,0.00,0.00,0,0,0,0,0,0,0,0
2025-10-11,02d2c45e-5b6f-4058-b05d-1fbcb475312e,"First order, 20% off 04/09/2025",promotion,2025-04-09,None,N/A,,,,,,,$ Off,0.00,0.00,USD,South State Rd,1713806,2,98.73,8.76,0.00,0.00,1.98,-0.00,-0.00,49.37,5.37,9.19,2,0,0,2,0,0,0,0
2025-10-11,02d2c45e-5b6f-4058-b05d-1fbcb475312e,"First order, 20% off 04/09/2025",promotion,2025-04-09,None,N/A,,,,,,,$ Off,0.00,0.00,USD,Townpark Lane,128721,1,48.15,5.00,0.00,0.00,0.99,-0.00,-0.00,48.15,5.99,8.04,1,0,0,1,1,0,0,1
2025-10-11,77e23ebd-6e10-4113-938c-bb55550710f5,Spice <> Capriotti's - Sep / Oct,promotion,2025-09-18,None,N/A,,43340528-e1b7-4f95-ab40-8dc92bf9c274,"Spend $35, Save $6 | High Price Sensitivity",day,all,Order Discount,$ Off,6.00,35.00,USD,Palm Ave - Fresno,1581092,4,162.50,24.00,0.00,0.00,3.96,-0.00,-0.00,40.63,6.99,5.81,1,2,1,4,0,1,1,2
2025-10-11,02d2c45e-5b6f-4058-b05d-1fbcb475312e,"First order, 20% off 04/09/2025",promotion,2025-04-09,None,N/A,,,,,,,$ Off,0.00,0.00,USD,Sahara & Las Vegas,75735,4,136.31,17.35,0.00,0.00,3.96,-0.00,-0.00,34.08,5.33,6.40,4,0,0,4,3,0,0,3
2025-10-11,77e23ebd-6e10-4113-938c-bb55550710f5,Spice <> Capriotti's - Sep / Oct,promotion,2025-09-18,None,N/A,,91f90d8c-8a7d-41cf-9b6a-888400112024,10% Happy Hour Discount - Min  $25 | High Price Sensitivity,day,all,Order Discount,% Off,10.0%,25.00,USD,"Capriotti's of Milford, LLC",1636430,0,0.00,0.00,0.00,0.00,0.00,-0.00,-0.00,0.00,0.00,0.00,0,0,0,0,0,0,0,0
2025-10-11,77e23ebd-6e10-4113-938c-bb55550710f5,Spice <> Capriotti's - Sep / Oct,promotion,2025-09-18,None,N/A,,,,day,,,$ Off,0.00,0.00,USD,Heart Pine-Odessa,2232632,0,0.00,0.00,0.00,0.00,0.00,-0.00,-0.00,0.00,0.00,0.00,0,0,0,0,0,0,0,0
2025-10-11,77e23ebd-6e10-4113-938c-bb55550710f5,Spice <> Capriotti's - Sep / Oct,promotion,2025-09-18,None,N/A,,91f90d8c-8a7d-41cf-9b6a-888400112024,10% Happy Hour Discount - Min  $25 | High Price Sensitivity,day,all,Order Discount,% Off,10.0%,25.00,USD,Roby Dr - Hammond,24891803,2,98.88,7.62,0.00,0.00,1.98,-0.00,-0.00,49.44,4.80,10.30,0,1,1,2,0,0,1,1
2025-10-11,58fe435a-cdf8-4a86-abc7-b68d7b574ba5,Spend $25 Get 20% Off,promotion,2022-12-01,None,N/A,,,,,,,$ Off,0.00,0.00,USD,Happy Valley,23584856,4,107.47,21.49,0.00,0.00,3.96,-0.00,-0.00,26.87,6.36,4.22,0,4,0,4,0,4,0,4
2025-10-11,02d2c45e-5b6f-4058-b05d-1fbcb475312e,"First order, 20% off 04/09/2025",promotion,2025-04-09,None,N/A,,,,,,,$ Off,0.00,0.00,USD,WVC High Market,2608935,1,39.86,5.00,0.00,0.00,0.99,-0.00,-0.00,39.86,5.99,6.65,1,0,0,1,0,0,0,0
2025-10-11,02d2c45e-5b6f-4058-b05d-1fbcb475312e,"First order, 20% off 04/09/2025",promotion,2025-04-09,None,N/A,,,,,,,$ Off,0.00,0.00,USD,Hamilton Blvd,23066760,2,40.86,8.18,0.00,0.00,1.98,-0.00,-0.00,20.43,5.08,4.02,2,0,0,2,0,0,0,0
2025-10-11,02d2c45e-5b6f-4058-b05d-1fbcb475312e,"First order, 20% off 04/09/2025",promotion,2025-04-09,None,N/A,,,,,,,$ Off,0.00,0.00,USD,Zionsville,24415273,1,20.77,4.15,0.00,0.00,0.99,-0.00,-0.00,20.77,5.14,4.04,1,0,0,1,0,0,0,0
2025-10-11,02d2c45e-5b6f-4058-b05d-1fbcb475312e,"First order, 20% off 04/09/2025",promotion,2025-04-09,None,N/A,,,,,,,$ Off,0.00,0.00,USD,Olympia Ave-Tulsa,24892240,6,235.11,29.54,0.00,0.00,5.94,-0.00,-0.00,39.19,5.91,6.63,6,0,0,6,2,0,0,2
2025-10-11,77e23ebd-6e10-4113-938c-bb55550710f5,Spice <> Capriotti's - Sep / Oct,promotion,2025-09-18,None,N/A,,,,day,,,$ Off,0.00,0.00,USD,Rancho Mirage,32864869,0,0.00,0.00,0.00,0.00,0.00,-0.00,-0.00,0.00,0.00,0.00,0,0,0,0,0,0,0,0
2025-10-11,77e23ebd-6e10-4113-938c-bb55550710f5,Spice <> Capriotti's - Sep / Oct,promotion,2025-09-18,None,N/A,,d1d0b263-4918-4c81-8c97-630471e7185b,10% Happy Hour Discount - Medium Price Sensitivity,day,all,Order Discount,% Off,10.0%,25.00,USD,Kenosha & 177th,1856591,1,25.76,2.58,0.00,0.00,0.99,-0.00,-0.00,25.76,3.57,7.22,0,1,0,1,0,0,0,0
2025-10-11,02d2c45e-5b6f-4058-b05d-1fbcb475312e,"First order, 20% off 04/09/2025",promotion,2025-04-09,None,N/A,,,,,,,$ Off,0.00,0.00,USD,Sierra St - Reno,719271,6,129.88,25.70,0.00,0.00,5.94,-0.00,-0.00,21.65,5.27,4.10,6,0,0,6,4,0,0,4
2025-10-11,02d2c45e-5b6f-4058-b05d-1fbcb475312e,"First order, 20% off 04/09/2025",promotion,2025-04-09,None,N/A,,,,,,,$ Off,0.00,0.00,USD,Roanoke,24637171,5,124.16,22.11,0.00,0.00,4.95,-0.00,-0.00,24.83,5.41,4.59,5,0,0,5,4,0,0,4
2025-10-11,02d2c45e-5b6f-4058-b05d-1fbcb475312e,"First order, 20% off 04/09/2025",promotion,2025-04-09,None,N/A,,,,,,,$ Off,0.00,0.00,USD,Blue Diamond Road,333447,0,0.00,0.00,0.00,0.00,0.00,-0.00,-0.00,0.00,0.00,0.00,0,0,0,0,0,0,0,0
2025-10-11,77e23ebd-6e10-4113-938c-bb55550710f5,Spice <> Capriotti's - Sep / Oct,promotion,2025-09-18,None,N/A,,ba37e4d8-36c4-4cbe-8c7d-f4d1379109bd,"Spend $15, Save $3 | Low price Sensitivity",day,all,Order Discount,$ Off,3.00,15.00,USD,GVR Casino,75749,1,28.76,3.00,0.00,0.00,0.99,-0.00,-0.00,28.76,3.99,7.21,0,1,0,1,0,1,0,1
2025-10-11,77e23ebd-6e10-4113-938c-bb55550710f5,Spice <> Capriotti's - Sep / Oct,promotion,2025-09-18,None,N/A,,43340528-e1b7-4f95-ab40-8dc92bf9c274,"Spend $35, Save $6 | High Price Sensitivity",day,all,Order Discount,$ Off,6.00,35.00,USD,Hamilton Blvd,23066760,0,0.00,0.00,0.00,0.00,0.00,-0.00,-0.00,0.00,0.00,0.00,0,0,0,0,0,0,0,0
2025-10-11,77e23ebd-6e10-4113-938c-bb55550710f5,Spice <> Capriotti's - Sep / Oct,promotion,2025-09-18,None,N/A,,d1d0b263-4918-4c81-8c97-630471e7185b,10% Happy Hour Discount - Medium Price Sensitivity,day,all,Order Discount,% Off,10.0%,25.00,USD,South Sandhill Rd,75741,0,0.00,0.00,0.00,0.00,0.00,-0.00,-0.00,0.00,0.00,0.00,0,0,0,0,0,0,0,0
2025-10-11,ff18ac99-74db-48ce-9c94-2959c91b6665,Capriotti's Sandwich Shop's Promo Campaign,promotion,2025-10-02,None,N/A,,a9ea1f37-2ee8-4c9b-ba40-bf2e0f2e84cd,10% Off Happy Hour Discount,day,all,Order Discount,% Off,10.0%,30.00,USD,Waialae Ave,25380836,2,77.34,7.74,0.00,0.00,1.98,-0.00,-0.00,38.67,4.86,7.96,0,1,1,2,0,0,1,1
2025-10-11,02d2c45e-5b6f-4058-b05d-1fbcb475312e,"First order, 20% off 04/09/2025",promotion,2025-04-09,None,N/A,,,,,,,$ Off,0.00,0.00,USD,Marlboro - Easton,674514,3,54.43,10.89,0.00,0.00,2.97,-0.00,-0.00,18.14,4.62,3.93,3,0,0,3,0,0,0,0
2025-10-11,77e23ebd-6e10-4113-938c-bb55550710f5,Spice <> Capriotti's - Sep / Oct,promotion,2025-09-18,None,N/A,,91f90d8c-8a7d-41cf-9b6a-888400112024,10% Happy Hour Discount - Min  $25 | High Price Sensitivity,day,all,Order Discount,% Off,10.0%,25.00,USD,Hamilton Blvd,23066760,2,59.94,6.00,0.00,0.00,1.98,-0.00,-0.00,29.97,3.99,7.51,0,2,0,2,0,2,0,2
2025-10-11,02d2c45e-5b6f-4058-b05d-1fbcb475312e,"First order, 20% off 04/09/2025",promotion,2025-04-09,None,N/A,,,,,,,$ Off,0.00,0.00,USD,Rancho Mirage,32864869,0,0.00,0.00,0.00,0.00,0.00,-0.00,-0.00,0.00,0.00,0.00,0,0,0,0,0,0,0,0
2025-10-11,77e23ebd-6e10-4113-938c-bb55550710f5,Spice <> Capriotti's - Sep / Oct,promotion,2025-09-18,None,N/A,,,,day,,,$ Off,0.00,0.00,USD,Terrace Center,321047,0,0.00,0.00,0.00,0.00,0.00,-0.00,-0.00,0.00,0.00,0.00,0,0,0,0,0,0,0,0
2025-10-11,77e23ebd-6e10-4113-938c-bb55550710f5,Spice <> Capriotti's - Sep / Oct,promotion,2025-09-18,None,N/A,,43340528-e1b7-4f95-ab40-8dc92bf9c274,"Spend $35, Save $6 | High Price Sensitivity",day,all,Order Discount,$ Off,6.00,35.00,USD,Broadway - Tucson,27829895,2,112.58,12.00,0.00,0.00,1.98,-0.00,-0.00,56.29,6.99,8.05,0,1,1,2,0,0,1,1
2025-10-11,02d2c45e-5b6f-4058-b05d-1fbcb475312e,"First order, 20% off 04/09/2025",promotion,2025-04-09,None,N/A,,,,,,,$ Off,0.00,0.00,USD,"Capriotti's of Milford, LLC",1636430,1,22.27,4.45,0.00,0.00,0.99,-0.00,-0.00,22.27,5.44,4.09,1,0,0,1,0,0,0,0
2025-10-11,f632eba8-7caa-4715-8101-69a221822987,Spend $35 get $5 off 12/02/2024,promotion,2024-12-02,None,N/A,,,,,,,$ Off,0.00,0.00,USD,"Capriotti's of Milford, LLC",1636430,5,263.30,25.00,0.00,0.00,4.95,-0.00,-0.00,52.66,5.99,8.79,0,5,0,5,0,2,0,2
2025-10-11,02d2c45e-5b6f-4058-b05d-1fbcb475312e,"First order, 20% off 04/09/2025",promotion,2025-04-09,None,N/A,,,,,,,$ Off,0.00,0.00,USD,Barnes Road,24892677,4,111.38,18.40,0.00,0.00,3.96,-0.00,-0.00,27.85,5.59,4.98,4,0,0,4,2,0,0,2
2025-10-11,4d5a689d-a212-46a2-91dc-8288a79ff11a,"First order, 20% off 01/02/2025",promotion,2025-01-02,None,N/A,,,,,,,$ Off,0.00,0.00,USD,Bidwell - Folsom,26234909,0,0.00,0.00,0.00,0.00,0.00,-0.00,-0.00,0.00,0.00,0.00,0,0,0,0,0,0,0,0
2025-10-11,02d2c45e-5b6f-4058-b05d-1fbcb475312e,"First order, 20% off 04/09/2025",promotion,2025-04-09,None,N/A,,,,,,,$ Off,0.00,0.00,USD,NE Cookingham Dr,23035356,2,42.63,8.53,0.00,0.00,1.98,-0.00,-0.00,21.32,5.26,4.06,2,0,0,2,1,0,0,1
2025-10-11,77e23ebd-6e10-4113-938c-bb55550710f5,Spice <> Capriotti's - Sep / Oct,promotion,2025-09-18,None,N/A,,,,day,,,$ Off,0.00,0.00,USD,East Market Street,23256727,0,0.00,0.00,0.00,0.00,0.00,-0.00,-0.00,0.00,0.00,0.00,0,0,0,0,0,0,0,0
2025-10-11,77e23ebd-6e10-4113-938c-bb55550710f5,Spice <> Capriotti's - Sep / Oct,promotion,2025-09-18,None,N/A,,f06f33c5-bff5-4bb3-8dda-6cedeb2e6fc1,10% Happy hour Discount - Min $30 | Low Price Sensitivity,day,all,Order Discount,% Off,7.0%,30.00,USD,East Sepulveda,1743753,0,0.00,0.00,0.00,0.00,0.00,-0.00,-0.00,0.00,0.00,0.00,0,0,0,0,0,0,0,0
2025-10-11,02d2c45e-5b6f-4058-b05d-1fbcb475312e,"First order, 20% off 04/09/2025",promotion,2025-04-09,None,N/A,,,,,,,$ Off,0.00,0.00,USD,Nellis Blvd,75755,2,56.15,9.55,0.00,0.00,1.98,-0.00,-0.00,28.08,5.77,4.87,2,0,0,2,2,0,0,2
2025-10-11,667f7354-ea24-4ff4-8559-cbfb006cfdbe,"Dormant customers, 20% off 09/22/2025",promotion,2025-09-22,None,N/A,,,,,,,$ Off,0.00,0.00,USD,University Dr,29894178,0,0.00,0.00,0.00,0.00,0.00,-0.00,-0.00,0.00,0.00,0.00,0,0,0,0,0,0,0,0
2025-10-11,02d2c45e-5b6f-4058-b05d-1fbcb475312e,"First order, 20% off 04/09/2025",promotion,2025-04-09,None,N/A,,,,,,,$ Off,0.00,0.00,USD,Boulder Station,23349419,0,0.00,0.00,0.00,0.00,0.00,-0.00,-0.00,0.00,0.00,0.00,0,0,0,0,0,0,0,0
2025-10-11,02d2c45e-5b6f-4058-b05d-1fbcb475312e,"First order, 20% off 04/09/2025",promotion,2025-04-09,None,N/A,,,,,,,$ Off,0.00,0.00,USD,Cheyenne and 215,388423,1,18.77,3.75,0.00,0.00,0.99,-0.00,-0.00,18.77,4.74,3.96,1,0,0,1,1,0,0,1
2025-10-11,02d2c45e-5b6f-4058-b05d-1fbcb475312e,"First order, 20% off 04/09/2025",promotion,2025-04-09,None,N/A,,,,,,,$ Off,0.00,0.00,USD,GVR Casino,75749,2,49.76,9.06,0.00,0.00,1.98,-0.00,-0.00,24.88,5.52,4.51,2,0,0,2,1,0,0,1
2025-10-11,77e23ebd-6e10-4113-938c-bb55550710f5,Spice <> Capriotti's - Sep / Oct,promotion,2025-09-18,None,N/A,,d1d0b263-4918-4c81-8c97-630471e7185b,10% Happy Hour Discount - Medium Price Sensitivity,day,all,Order Discount,% Off,10.0%,25.00,USD,Ogletown Stanton,422117,1,34.58,3.46,0.00,0.00,0.99,-0.00,-0.00,34.58,4.45,7.77,0,1,0,1,0,1,0,1
2025-10-11,58fe435a-cdf8-4a86-abc7-b68d7b574ba5,Spend $25 Get 20% Off,promotion,2022-12-01,None,N/A,,,,,,,$ Off,0.00,0.00,USD,Zionsville,24415273,10,420.02,74.85,0.00,0.00,9.90,-0.00,-0.00,42.00,8.48,4.96,2,7,1,10,1,6,1,8
2025-10-11,77e23ebd-6e10-4113-938c-bb55550710f5,Spice <> Capriotti's - Sep / Oct,promotion,2025-09-18,None,N/A,,ba37e4d8-36c4-4cbe-8c7d-f4d1379109bd,"Spend $15, Save $3 | Low price Sensitivity",day,all,Order Discount,$ Off,3.00,15.00,USD,Townpark Lane,128721,0,0.00,0.00,0.00,0.00,0.00,-0.00,-0.00,0.00,0.00,0.00,0,0,0,0,0,0,0,0
2025-10-11,77e23ebd-6e10-4113-938c-bb55550710f5,Spice <> Capriotti's - Sep / Oct,promotion,2025-09-18,None,N/A,,ba37e4d8-36c4-4cbe-8c7d-f4d1379109bd,"Spend $15, Save $3 | Low price Sensitivity",day,all,Order Discount,$ Off,3.00,15.00,USD,Sumneytown Pike,24717004,4,140.86,12.00,0.00,0.00,3.96,-0.00,-0.00,35.22,3.99,8.83,0,4,0,4,0,2,0,2
2025-10-11,77e23ebd-6e10-4113-938c-bb55550710f5,Spice <> Capriotti's - Sep / Oct,promotion,2025-09-18,None,N/A,,d1d0b263-4918-4c81-8c97-630471e7185b,10% Happy Hour Discount - Medium Price Sensitivity,day,all,Order Discount,% Off,10.0%,25.00,USD,Olympia Ave-Tulsa,24892240,0,0.00,0.00,0.00,0.00,0.00,-0.00,-0.00,0.00,0.00,0.00,0,0,0,0,0,0,0,0
2025-10-11,77e23ebd-6e10-4113-938c-bb55550710f5,Spice <> Capriotti's - Sep / Oct,promotion,2025-09-18,None,N/A,,ba37e4d8-36c4-4cbe-8c7d-f4d1379109bd,"Spend $15, Save $3 | Low price Sensitivity",day,all,Order Discount,$ Off,3.00,15.00,USD,Overland Park,24110474,2,59.06,6.00,0.00,0.00,1.98,-0.00,-0.00,29.53,3.99,7.40,0,1,1,2,0,0,1,1
2025-10-11,02d2c45e-5b6f-4058-b05d-1fbcb475312e,"First order, 20% off 04/09/2025",promotion,2025-04-09,None,N/A,,,,,,,$ Off,0.00,0.00,USD,Forest Drive,674540,0,0.00,0.00,0.00,0.00,0.00,-0.00,-0.00,0.00,0.00,0.00,0,0,0,0,0,0,0,0
2025-10-11,a685c20e-2ab7-43e8-a7a8-447ab209f7f8,Spend $25 get $5 off 07/31/2024,promotion,2024-07-31,None,N/A,,,,,,,$ Off,0.00,0.00,USD,De Soto-Chatsworth,651597,7,252.13,35.00,0.00,0.00,6.93,-0.00,-0.00,36.02,5.99,6.01,2,4,1,7,2,3,1,6
2025-10-11,55ceb1d5-c2fa-48a3-8e52-3fbe10ad9c00,"Dormant customers, 20% off 07/15/2025",promotion,2025-07-16,None,N/A,,,,,,,$ Off,0.00,0.00,USD,Dana Park - Mesa,126177,1,73.84,7.00,0.00,0.00,0.99,-0.00,-0.00,73.84,7.99,9.24,0,0,1,1,0,0,1,1
2025-10-11,77e23ebd-6e10-4113-938c-bb55550710f5,Spice <> Capriotti's - Sep / Oct,promotion,2025-09-18,None,N/A,,,,day,,,$ Off,0.00,0.00,USD,Kennett Square,575296,0,0.00,0.00,0.00,0.00,0.00,-0.00,-0.00,0.00,0.00,0.00,0,0,0,0,0,0,0,0
2025-10-11,77e23ebd-6e10-4113-938c-bb55550710f5,Spice <> Capriotti's - Sep / Oct,promotion,2025-09-18,None,N/A,,f06f33c5-bff5-4bb3-8dda-6cedeb2e6fc1,10% Happy hour Discount - Min $30 | Low Price Sensitivity,day,all,Order Discount,% Off,7.0%,30.00,USD,Arapahoe Rd,23349425,1,34.87,2.44,0.00,0.00,0.99,-0.00,-0.00,34.87,3.43,10.17,0,1,0,1,0,1,0,1
2025-10-11,02d2c45e-5b6f-4058-b05d-1fbcb475312e,"First order, 20% off 04/09/2025",promotion,2025-04-09,None,N/A,,,,,,,$ Off,0.00,0.00,USD,West Sahara Avenue,424852,1,18.59,3.72,0.00,0.00,0.99,-0.00,-0.00,18.59,4.71,3.95,1,0,0,1,1,0,0,1
2025-10-11,02d2c45e-5b6f-4058-b05d-1fbcb475312e,"First order, 20% off 04/09/2025",promotion,2025-04-09,None,N/A,,,,,,,$ Off,0.00,0.00,USD,Hwy 72 - Madison,27685318,4,112.18,17.40,0.00,0.00,3.96,-0.00,-0.00,28.05,5.34,5.25,4,0,0,4,2,0,0,2
2025-10-11,02d2c45e-5b6f-4058-b05d-1fbcb475312e,"First order, 20% off 04/09/2025",promotion,2025-04-09,None,N/A,,,,,,,$ Off,0.00,0.00,USD,Catclaw - Abilene,29652227,5,107.19,19.97,0.00,0.00,4.95,-0.00,-0.00,21.44,4.98,4.30,5,0,0,5,3,0,0,3
2025-10-11,77e23ebd-6e10-4113-938c-bb55550710f5,Spice <> Capriotti's - Sep / Oct,promotion,2025-09-18,None,N/A,,43340528-e1b7-4f95-ab40-8dc92bf9c274,"Spend $35, Save $6 | High Price Sensitivity",day,all,Order Discount,$ Off,6.00,35.00,USD,West Basin Rd,575301,0,0.00,0.00,0.00,0.00,0.00,-0.00,-0.00,0.00,0.00,0.00,0,0,0,0,0,0,0,0
2025-10-11,77e23ebd-6e10-4113-938c-bb55550710f5,Spice <> Capriotti's - Sep / Oct,promotion,2025-09-18,None,N/A,,ba37e4d8-36c4-4cbe-8c7d-f4d1379109bd,"Spend $15, Save $3 | Low price Sensitivity",day,all,Order Discount,$ Off,3.00,15.00,USD,Horizon Ridge,75753,1,25.18,3.00,0.00,0.00,0.99,-0.00,-0.00,25.18,3.99,6.31,0,1,0,1,0,1,0,1
2025-10-11,77e23ebd-6e10-4113-938c-bb55550710f5,Spice <> Capriotti's - Sep / Oct,promotion,2025-09-18,None,N/A,,f06f33c5-bff5-4bb3-8dda-6cedeb2e6fc1,10% Happy hour Discount - Min $30 | Low Price Sensitivity,day,all,Order Discount,% Off,7.0%,30.00,USD,Highlands Ranch,1791292,0,0.00,0.00,0.00,0.00,0.00,-0.00,-0.00,0.00,0.00,0.00,0,0,0,0,0,0,0,0
2025-10-11,77e23ebd-6e10-4113-938c-bb55550710f5,Spice <> Capriotti's - Sep / Oct,promotion,2025-09-18,None,N/A,,f06f33c5-bff5-4bb3-8dda-6cedeb2e6fc1,10% Happy hour Discount - Min $30 | Low Price Sensitivity,day,all,Order Discount,% Off,7.0%,30.00,USD,Stephanie St,75751,2,117.19,8.21,0.00,0.00,1.98,-0.00,-0.00,58.60,5.10,11.50,0,2,0,2,0,2,0,2
2025-10-11,02d2c45e-5b6f-4058-b05d-1fbcb475312e,"First order, 20% off 04/09/2025",promotion,2025-04-09,None,N/A,,,,,,,$ Off,0.00,0.00,USD,Northdale Blvd,24976449,0,0.00,0.00,0.00,0.00,0.00,-0.00,-0.00,0.00,0.00,0.00,0,0,0,0,0,0,0,0
2025-10-11,77e23ebd-6e10-4113-938c-bb55550710f5,Spice <> Capriotti's - Sep / Oct,promotion,2025-09-18,None,N/A,,ba37e4d8-36c4-4cbe-8c7d-f4d1379109bd,"Spend $15, Save $3 | Low price Sensitivity",day,all,Order Discount,$ Off,3.00,15.00,USD,Byers Dr,23186665,0,0.00,0.00,0.00,0.00,0.00,-0.00,-0.00,0.00,0.00,0.00,0,0,0,0,0,0,0,0
2025-10-11,02d2c45e-5b6f-4058-b05d-1fbcb475312e,"First order, 20% off 04/09/2025",promotion,2025-04-09,None,N/A,,,,,,,$ Off,0.00,0.00,USD,Parker,24021312,1,23.78,4.76,0.00,0.00,0.99,-0.00,-0.00,23.78,5.75,4.14,1,0,0,1,1,0,0,1
2025-10-11,77e23ebd-6e10-4113-938c-bb55550710f5,Spice <> Capriotti's - Sep / Oct,promotion,2025-09-18,None,N/A,,ba37e4d8-36c4-4cbe-8c7d-f4d1379109bd,"Spend $15, Save $3 | Low price Sensitivity",day,all,Order Discount,$ Off,3.00,15.00,USD,Castle Rock,23057614,4,102.70,12.00,0.00,0.00,3.96,-0.00,-0.00,25.68,3.99,6.43,0,3,1,4,0,3,1,4
2025-10-11,1dd4cf16-61f6-4935-beac-ad07a26422b3,"First order, 20% off 07/23/2025",promotion,2025-07-23,None,N/A,,,,,,,$ Off,0.00,0.00,USD,Grand Ave-Portland,1370229,0,0.00,0.00,0.00,0.00,0.00,-0.00,-0.00,0.00,0.00,0.00,0,0,0,0,0,0,0,0
2025-10-11,77e23ebd-6e10-4113-938c-bb55550710f5,Spice <> Capriotti's - Sep / Oct,promotion,2025-09-18,None,N/A,,d1d0b263-4918-4c81-8c97-630471e7185b,10% Happy Hour Discount - Medium Price Sensitivity,day,all,Order Discount,% Off,10.0%,25.00,USD,Magnolia Ave,31345441,1,25.69,2.57,0.00,0.00,0.99,-0.00,-0.00,25.69,3.56,7.22,0,1,0,1,0,1,0,1
2025-10-11,77e23ebd-6e10-4113-938c-bb55550710f5,Spice <> Capriotti's - Sep / Oct,promotion,2025-09-18,None,N/A,,,,day,,,$ Off,0.00,0.00,USD,Kent Island,691089,0,0.00,0.00,0.00,0.00,0.00,-0.00,-0.00,0.00,0.00,0.00,0,0,0,0,0,0,0,0
2025-10-11,02d2c45e-5b6f-4058-b05d-1fbcb475312e,"First order, 20% off 04/09/2025",promotion,2025-04-09,None,N/A,,,,,,,$ Off,0.00,0.00,USD,Los Altos,33476901,9,325.58,41.02,0.00,0.00,8.91,-0.00,-0.00,36.18,5.55,6.52,9,0,0,9,5,0,0,5
2025-10-11,77e23ebd-6e10-4113-938c-bb55550710f5,Spice <> Capriotti's - Sep / Oct,promotion,2025-09-18,None,N/A,,f06f33c5-bff5-4bb3-8dda-6cedeb2e6fc1,10% Happy hour Discount - Min $30 | Low Price Sensitivity,day,all,Order Discount,% Off,7.0%,30.00,USD,Downingtown,33699763,1,34.66,2.43,0.00,0.00,0.99,-0.00,-0.00,34.66,3.42,10.13,0,1,0,1,0,0,0,0
2025-10-11,77e23ebd-6e10-4113-938c-bb55550710f5,Spice <> Capriotti's - Sep / Oct,promotion,2025-09-18,None,N/A,,d1d0b263-4918-4c81-8c97-630471e7185b,10% Happy Hour Discount - Medium Price Sensitivity,day,all,Order Discount,% Off,10.0%,25.00,USD,Paradise Road,75734,0,0.00,0.00,0.00,0.00,0.00,-0.00,-0.00,0.00,0.00,0.00,0,0,0,0,0,0,0,0
2025-10-11,77e23ebd-6e10-4113-938c-bb55550710f5,Spice <> Capriotti's - Sep / Oct,promotion,2025-09-18,None,N/A,,,,day,,,$ Off,0.00,0.00,USD,Sierra Hwy,27476315,0,0.00,0.00,0.00,0.00,0.00,-0.00,-0.00,0.00,0.00,0.00,0,0,0,0,0,0,0,0
2025-10-11,77e23ebd-6e10-4113-938c-bb55550710f5,Spice <> Capriotti's - Sep / Oct,promotion,2025-09-18,None,N/A,,91f90d8c-8a7d-41cf-9b6a-888400112024,10% Happy Hour Discount - Min  $25 | High Price Sensitivity,day,all,Order Discount,% Off,10.0%,25.00,USD,Millsboro Plaza,23360934,0,0.00,0.00,0.00,0.00,0.00,-0.00,-0.00,0.00,0.00,0.00,0,0,0,0,0,0,0,0
2025-10-11,77e23ebd-6e10-4113-938c-bb55550710f5,Spice <> Capriotti's - Sep / Oct,promotion,2025-09-18,None,N/A,,d1d0b263-4918-4c81-8c97-630471e7185b,10% Happy Hour Discount - Medium Price Sensitivity,day,all,Order Discount,% Off,10.0%,25.00,USD,Southern Highlands,1750142,1,51.95,5.00,0.00,0.00,0.99,-0.00,-0.00,51.95,5.99,8.67,0,1,0,1,0,0,0,0
2025-10-11,77e23ebd-6e10-4113-938c-bb55550710f5,Spice <> Capriotti's - Sep / Oct,promotion,2025-09-18,None,N/A,,,,day,,,$ Off,0.00,0.00,USD,Niles Cortland Rd SE,34043935,0,0.00,0.00,0.00,0.00,0.00,-0.00,-0.00,0.00,0.00,0.00,0,0,0,0,0,0,0,0
2025-10-11,77e23ebd-6e10-4113-938c-bb55550710f5,Spice <> Capriotti's - Sep / Oct,promotion,2025-09-18,None,N/A,,f06f33c5-bff5-4bb3-8dda-6cedeb2e6fc1,10% Happy hour Discount - Min $30 | Low Price Sensitivity,day,all,Order Discount,% Off,7.0%,30.00,USD,Kent Island,691089,1,34.77,2.43,0.00,0.00,0.99,-0.00,-0.00,34.77,3.42,10.17,0,1,0,1,0,1,0,1
2025-10-11,77e23ebd-6e10-4113-938c-bb55550710f5,Spice <> Capriotti's - Sep / Oct,promotion,2025-09-18,None,N/A,,f06f33c5-bff5-4bb3-8dda-6cedeb2e6fc1,10% Happy hour Discount - Min $30 | Low Price Sensitivity,day,all,Order Discount,% Off,7.0%,30.00,USD,Rancho Mirage,32864869,0,0.00,0.00,0.00,0.00,0.00,-0.00,-0.00,0.00,0.00,0.00,0,0,0,0,0,0,0,0
2025-10-11,77e23ebd-6e10-4113-938c-bb55550710f5,Spice <> Capriotti's - Sep / Oct,promotion,2025-09-18,None,N/A,,ba37e4d8-36c4-4cbe-8c7d-f4d1379109bd,"Spend $15, Save $3 | Low price Sensitivity",day,all,Order Discount,$ Off,3.00,15.00,USD,South State Rd,1713806,3,158.91,9.00,0.00,0.00,2.97,-0.00,-0.00,52.97,3.99,13.28,0,3,0,3,0,1,0,1
2025-10-11,77e23ebd-6e10-4113-938c-bb55550710f5,Spice <> Capriotti's - Sep / Oct,promotion,2025-09-18,None,N/A,,ba37e4d8-36c4-4cbe-8c7d-f4d1379109bd,"Spend $15, Save $3 | Low price Sensitivity",day,all,Order Discount,$ Off,3.00,15.00,USD,Brayden Pkwy,2375657,1,23.77,3.00,0.00,0.00,0.99,-0.00,-0.00,23.77,3.99,5.96,0,1,0,1,0,1,0,1
2025-10-11,77e23ebd-6e10-4113-938c-bb55550710f5,Spice <> Capriotti's - Sep / Oct,promotion,2025-09-18,None,N/A,,ba37e4d8-36c4-4cbe-8c7d-f4d1379109bd,"Spend $15, Save $3 | Low price Sensitivity",day,all,Order Discount,$ Off,3.00,15.00,USD,Cortez Rd  West,26034424,1,60.26,3.00,0.00,0.00,0.99,-0.00,-0.00,60.26,3.99,15.10,0,1,0,1,0,1,0,1
2025-10-11,77e23ebd-6e10-4113-938c-bb55550710f5,Spice <> Capriotti's - Sep / Oct,promotion,2025-09-18,None,N/A,,d1d0b263-4918-4c81-8c97-630471e7185b,10% Happy Hour Discount - Medium Price Sensitivity,day,all,Order Discount,% Off,10.0%,25.00,USD,West Charleston,23641277,0,0.00,0.00,0.00,0.00,0.00,-0.00,-0.00,0.00,0.00,0.00,0,0,0,0,0,0,0,0
2025-10-11,77e23ebd-6e10-4113-938c-bb55550710f5,Spice <> Capriotti's - Sep / Oct,promotion,2025-09-18,None,N/A,,91f90d8c-8a7d-41cf-9b6a-888400112024,10% Happy Hour Discount - Min  $25 | High Price Sensitivity,day,all,Order Discount,% Off,10.0%,25.00,USD,South  Walton Blvd,1616214,0,0.00,0.00,0.00,0.00,0.00,-0.00,-0.00,0.00,0.00,0.00,0,0,0,0,0,0,0,0
2025-10-11,77e23ebd-6e10-4113-938c-bb55550710f5,Spice <> Capriotti's - Sep / Oct,promotion,2025-09-18,None,N/A,,d1d0b263-4918-4c81-8c97-630471e7185b,10% Happy Hour Discount - Medium Price Sensitivity,day,all,Order Discount,% Off,10.0%,25.00,USD,Nature Park Drive,75726,1,31.18,3.12,0.00,0.00,0.99,-0.00,-0.00,31.18,4.11,7.59,0,1,0,1,0,1,0,1
2025-10-11,77e23ebd-6e10-4113-938c-bb55550710f5,Spice <> Capriotti's - Sep / Oct,promotion,2025-09-18,None,N/A,,f06f33c5-bff5-4bb3-8dda-6cedeb2e6fc1,10% Happy hour Discount - Min $30 | Low Price Sensitivity,day,all,Order Discount,% Off,7.0%,30.00,USD,Brayden Pkwy,2375657,1,57.83,4.05,0.00,0.00,0.99,-0.00,-0.00,57.83,5.04,11.47,0,1,0,1,0,1,0,1
2025-10-11,77e23ebd-6e10-4113-938c-bb55550710f5,Spice <> Capriotti's - Sep / Oct,promotion,2025-09-18,None,N/A,,91f90d8c-8a7d-41cf-9b6a-888400112024,10% Happy Hour Discount - Min  $25 | High Price Sensitivity,day,all,Order Discount,% Off,10.0%,25.00,USD,Riverwind Dr,34516256,2,88.68,7.91,0.00,0.00,1.98,-0.00,-0.00,44.34,4.95,8.97,1,1,0,2,1,1,0,2
2025-10-11,02d2c45e-5b6f-4058-b05d-1fbcb475312e,"First order, 20% off 04/09/2025",promotion,2025-04-09,None,N/A,,,,,,,$ Off,0.00,0.00,USD,Broadway - Tucson,27829895,2,46.34,9.27,0.00,0.00,1.98,-0.00,-0.00,23.17,5.63,4.12,2,0,0,2,2,0,0,2
2025-10-11,77e23ebd-6e10-4113-938c-bb55550710f5,Spice <> Capriotti's - Sep / Oct,promotion,2025-09-18,None,N/A,,d1d0b263-4918-4c81-8c97-630471e7185b,10% Happy Hour Discount - Medium Price Sensitivity,day,all,Order Discount,% Off,10.0%,25.00,USD,South Rainbow,75732,0,0.00,0.00,0.00,0.00,0.00,-0.00,-0.00,0.00,0.00,0.00,0,0,0,0,0,0,0,0
2025-10-11,6f71233a-4f7b-43f5-b70b-89dc41af1fd0,Late night 5 off 25,promotion,2025-01-17,None,N/A,,,,,,,$ Off,0.00,0.00,USD,West Cheyenne Ave,75722,0,0.00,0.00,0.00,0.00,0.00,-0.00,-0.00,0.00,0.00,0.00,0,0,0,0,0,0,0,0
2025-10-11,77e23ebd-6e10-4113-938c-bb55550710f5,Spice <> Capriotti's - Sep / Oct,promotion,2025-09-18,None,N/A,,,,day,,,$ Off,0.00,0.00,USD,Raccoon Rd,26015022,0,0.00,0.00,0.00,0.00,0.00,-0.00,-0.00,0.00,0.00,0.00,0,0,0,0,0,0,0,0
2025-10-11,77e23ebd-6e10-4113-938c-bb55550710f5,Spice <> Capriotti's - Sep / Oct,promotion,2025-09-18,None,N/A,,f06f33c5-bff5-4bb3-8dda-6cedeb2e6fc1,10% Happy hour Discount - Min $30 | Low Price Sensitivity,day,all,Order Discount,% Off,7.0%,30.00,USD,Anthem,75750,0,0.00,0.00,0.00,0.00,0.00,-0.00,-0.00,0.00,0.00,0.00,0,0,0,0,0,0,0,0
2025-10-11,77e23ebd-6e10-4113-938c-bb55550710f5,Spice <> Capriotti's - Sep / Oct,promotion,2025-09-18,None,N/A,,f06f33c5-bff5-4bb3-8dda-6cedeb2e6fc1,10% Happy hour Discount - Min $30 | Low Price Sensitivity,day,all,Order Discount,% Off,7.0%,30.00,USD,Byers Dr,23186665,0,0.00,0.00,0.00,0.00,0.00,-0.00,-0.00,0.00,0.00,0.00,0,0,0,0,0,0,0,0
2025-10-11,77e23ebd-6e10-4113-938c-bb55550710f5,Spice <> Capriotti's - Sep / Oct,promotion,2025-09-18,None,N/A,,,,day,,,$ Off,0.00,0.00,USD,Governor Ritchie,24121153,0,0.00,0.00,0.00,0.00,0.00,-0.00,-0.00,0.00,0.00,0.00,0,0,0,0,0,0,0,0
2025-10-11,77e23ebd-6e10-4113-938c-bb55550710f5,Spice <> Capriotti's - Sep / Oct,promotion,2025-09-18,None,N/A,,f06f33c5-bff5-4bb3-8dda-6cedeb2e6fc1,10% Happy hour Discount - Min $30 | Low Price Sensitivity,day,all,Order Discount,% Off,7.0%,30.00,USD,Parker,24021312,1,53.31,3.73,0.00,0.00,0.99,-0.00,-0.00,53.31,4.72,11.29,0,1,0,1,0,1,0,1
2025-10-11,b2e42382-0262-4b42-bbf3-d1a2efa87346,Happy Hour discount 09/24/2024,promotion,2024-09-24,None,N/A,,,,,,,$ Off,0.00,0.00,USD,Townpark Lane,128721,2,72.73,12.68,0.00,0.00,1.98,-0.00,-0.00,36.37,7.33,4.96,1,1,0,2,1,1,0,2
2025-10-11,e17f8f0c-31d2-4c57-af32-8d745f2af9df,Loyalty Promo - Capriotti's Sandwich Shop (bus id: 2324),promotion,2023-06-27,2033-06-27,N/A,,,,,,,$ Off,0.00,0.00,USD,Bel Air,23733193,0,0.00,0.00,0.00,0.00,0.00,-0.00,-0.00,0.00,0.00,0.00,0,0,0,0,0,0,0,0
2025-10-11,492738a1-8e75-477a-b4bd-aec773e7d330,Spend $40 get $6 off 01/22/2025,promotion,2025-01-22,None,N/A,,,,,,,$ Off,0.00,0.00,USD,East Market Street,23256727,1,45.57,6.00,0.00,0.00,0.99,-0.00,-0.00,45.57,6.99,6.52,1,0,0,1,1,0,0,1
2025-10-11,77e23ebd-6e10-4113-938c-bb55550710f5,Spice <> Capriotti's - Sep / Oct,promotion,2025-09-18,None,N/A,,ba37e4d8-36c4-4cbe-8c7d-f4d1379109bd,"Spend $15, Save $3 | Low price Sensitivity",day,all,Order Discount,$ Off,3.00,15.00,USD,Terrace Center,321047,3,116.39,9.00,0.00,0.00,2.97,-0.00,-0.00,38.80,3.99,9.72,0,3,0,3,0,2,0,2
2025-10-11,02d2c45e-5b6f-4058-b05d-1fbcb475312e,"First order, 20% off 04/09/2025",promotion,2025-04-09,None,N/A,,,,,,,$ Off,0.00,0.00,USD,Plumb Lane,439577,0,0.00,0.00,0.00,0.00,0.00,-0.00,-0.00,0.00,0.00,0.00,0,0,0,0,0,0,0,0
2025-10-11,02d2c45e-5b6f-4058-b05d-1fbcb475312e,"First order, 20% off 04/09/2025",promotion,2025-04-09,None,N/A,,,,,,,$ Off,0.00,0.00,USD,East Craig Road,75739,5,124.52,24.07,0.00,0.00,4.95,-0.00,-0.00,24.90,5.80,4.29,5,0,0,5,1,0,0,1
2025-10-11,77e23ebd-6e10-4113-938c-bb55550710f5,Spice <> Capriotti's - Sep / Oct,promotion,2025-09-18,None,N/A,,f06f33c5-bff5-4bb3-8dda-6cedeb2e6fc1,10% Happy hour Discount - Min $30 | Low Price Sensitivity,day,all,Order Discount,% Off,7.0%,30.00,USD,Heart Pine-Odessa,2232632,0,0.00,0.00,0.00,0.00,0.00,-0.00,-0.00,0.00,0.00,0.00,0,0,0,0,0,0,0,0
2025-10-11,425a2568-d931-4baa-8593-d268f8a0c259,Happy Hour discount is 30% OFF,promotion,2025-01-24,None,Daily,28.57,,,,,,$ Off,0.00,0.00,USD,N 87th Street,27965,2,48.97,12.04,0.00,0.00,1.98,-0.00,-0.00,24.49,7.01,3.49,2,0,0,2,2,0,0,2
2025-10-11,02d2c45e-5b6f-4058-b05d-1fbcb475312e,"First order, 20% off 04/09/2025",promotion,2025-04-09,None,N/A,,,,,,,$ Off,0.00,0.00,USD,Aliante Casino,75725,1,26.38,5.00,0.00,0.00,0.99,-0.00,-0.00,26.38,5.99,4.40,1,0,0,1,1,0,0,1
2025-10-11,02d2c45e-5b6f-4058-b05d-1fbcb475312e,"First order, 20% off 04/09/2025",promotion,2025-04-09,None,N/A,,,,,,,$ Off,0.00,0.00,USD,Sunrise Blvd,31345439,0,0.00,0.00,0.00,0.00,0.00,-0.00,-0.00,0.00,0.00,0.00,0,0,0,0,0,0,0,0
2025-10-11,58fe435a-cdf8-4a86-abc7-b68d7b574ba5,Spend $25 Get 20% Off,promotion,2022-12-01,None,N/A,,,,,,,$ Off,0.00,0.00,USD,San Luis Obispo,23900701,7,322.05,45.43,0.00,0.00,6.93,-0.00,-0.00,46.01,7.48,6.15,0,4,3,7,0,2,1,3
2025-10-11,02d2c45e-5b6f-4058-b05d-1fbcb475312e,"First order, 20% off 04/09/2025",promotion,2025-04-09,None,N/A,,,,,,,$ Off,0.00,0.00,USD,Red Rock Casino,75737,5,159.28,22.32,0.00,0.00,4.95,-0.00,-0.00,31.86,5.45,5.84,5,0,0,5,2,0,0,2
2025-10-11,77e23ebd-6e10-4113-938c-bb55550710f5,Spice <> Capriotti's - Sep / Oct,promotion,2025-09-18,None,N/A,,,,day,,,$ Off,0.00,0.00,USD,E 53rd - Davenport,582282,0,0.00,0.00,0.00,0.00,0.00,-0.00,-0.00,0.00,0.00,0.00,0,0,0,0,0,0,0,0
2025-10-11,a82d49b2-a34a-4ce3-aa26-2a1d94c385eb,"All customers, $0 delivery fees 04/07/2025",promotion,2025-04-07,None,N/A,,,,,,,$ Off,0.00,0.00,USD,East Market Street,23256727,0,0.00,0.00,0.00,0.00,0.00,-0.00,-0.00,0.00,0.00,0.00,0,0,0,0,0,0,0,0
2025-10-11,02d2c45e-5b6f-4058-b05d-1fbcb475312e,"First order, 20% off 04/09/2025",promotion,2025-04-09,None,N/A,,,,,,,$ Off,0.00,0.00,USD,Ogletown Stanton,422117,1,20.87,4.17,0.00,0.00,0.99,-0.00,-0.00,20.87,5.16,4.04,1,0,0,1,0,0,0,0
2025-10-11,77e23ebd-6e10-4113-938c-bb55550710f5,Spice <> Capriotti's - Sep / Oct,promotion,2025-09-18,None,N/A,,,,day,,,$ Off,0.00,0.00,USD,Brayden Pkwy,2375657,0,0.00,0.00,0.00,0.00,0.00,-0.00,-0.00,0.00,0.00,0.00,0,0,0,0,0,0,0,0
2025-10-11,02d2c45e-5b6f-4058-b05d-1fbcb475312e,"First order, 20% off 04/09/2025",promotion,2025-04-09,None,N/A,,,,,,,$ Off,0.00,0.00,USD,Cranberry Township,24851842,1,28.18,5.00,0.00,0.00,0.99,-0.00,-0.00,28.18,5.99,4.70,1,0,0,1,0,0,0,0
2025-10-11,02d2c45e-5b6f-4058-b05d-1fbcb475312e,"First order, 20% off 04/09/2025",promotion,2025-04-09,None,N/A,,,,,,,$ Off,0.00,0.00,USD,Smithtown Bypass,23349427,1,55.36,5.00,0.00,0.00,0.99,-0.00,-0.00,55.36,5.99,9.24,1,0,0,1,0,0,0,0
2025-10-11,02d2c45e-5b6f-4058-b05d-1fbcb475312e,"First order, 20% off 04/09/2025",promotion,2025-04-09,None,N/A,,,,,,,$ Off,0.00,0.00,USD,Limonite Ave,2375675,2,123.05,8.96,0.00,0.00,1.98,-0.00,-0.00,61.53,5.47,11.25,2,0,0,2,0,0,0,0
2025-10-11,a895bc94-3910-43c9-b1b9-bc7f513286d7,Spend $25 get $5 off 07/31/2024,promotion,2024-07-31,None,N/A,,,,,,,$ Off,0.00,0.00,USD,The Old Road,24898774,1,41.56,5.00,0.00,0.00,0.99,-0.00,-0.00,41.56,5.99,6.94,0,1,0,1,0,1,0,1
2025-10-11,02d2c45e-5b6f-4058-b05d-1fbcb475312e,"First order, 20% off 04/09/2025",promotion,2025-04-09,None,N/A,,,,,,,$ Off,0.00,0.00,USD,Castle Rock,23057614,0,0.00,0.00,0.00,0.00,0.00,-0.00,-0.00,0.00,0.00,0.00,0,0,0,0,0,0,0,0
2025-10-11,02d2c45e-5b6f-4058-b05d-1fbcb475312e,"First order, 20% off 04/09/2025",promotion,2025-04-09,None,N/A,,,,,,,$ Off,0.00,0.00,USD,South  Walton Blvd,1616214,5,187.20,23.24,0.00,0.00,4.95,-0.00,-0.00,37.44,5.64,6.64,5,0,0,5,2,0,0,2
2025-10-11,02d2c45e-5b6f-4058-b05d-1fbcb475312e,"First order, 20% off 04/09/2025",promotion,2025-04-09,None,N/A,,,,,,,$ Off,0.00,0.00,USD,Kennett Square,575296,1,35.46,5.00,0.00,0.00,0.99,-0.00,-0.00,35.46,5.99,5.92,1,0,0,1,0,0,0,0
2025-10-11,02d2c45e-5b6f-4058-b05d-1fbcb475312e,"First order, 20% off 04/09/2025",promotion,2025-04-09,None,N/A,,,,,,,$ Off,0.00,0.00,USD,West Flamingo Road,75731,5,194.74,24.77,0.00,0.00,4.95,-0.00,-0.00,38.95,5.94,6.55,5,0,0,5,2,0,0,2
2025-10-11,2bb77af0-6b48-46d5-97b3-e43758ea5314,"First order, 20% off 02/01/2025",promotion,2025-02-01,None,N/A,,,,,,,$ Off,0.00,0.00,USD,Sierra Hwy,27476315,0,0.00,0.00,0.00,0.00,0.00,-0.00,-0.00,0.00,0.00,0.00,0,0,0,0,0,0,0,0
2025-10-11,02d2c45e-5b6f-4058-b05d-1fbcb475312e,"First order, 20% off 04/09/2025",promotion,2025-04-09,None,N/A,,,,,,,$ Off,0.00,0.00,USD,East 82nd St,184537,6,134.86,24.29,0.00,0.00,5.94,-0.00,-0.00,22.48,5.04,4.46,6,0,0,6,2,0,0,2
2025-10-11,ab8ae3e5-4758-4b2a-b268-d7fb378c5caa,Spend $15 Get 20% Off,promotion,2022-05-17,None,N/A,,,,,,,$ Off,0.00,0.00,USD,Pioneer Pkwy,874359,2,62.14,10.00,0.00,0.00,1.98,-0.00,-0.00,31.07,5.99,5.19,0,1,1,2,0,1,0,1
2025-10-11,58fe435a-cdf8-4a86-abc7-b68d7b574ba5,Spend $25 Get 20% Off,promotion,2022-12-01,None,N/A,,,,,,,$ Off,0.00,0.00,USD,Boulder Station,23349419,2,60.17,12.04,0.00,0.00,1.98,-0.00,-0.00,30.09,7.01,4.29,0,2,0,2,0,2,0,2
2025-10-11,02d2c45e-5b6f-4058-b05d-1fbcb475312e,"First order, 20% off 04/09/2025",promotion,2025-04-09,None,N/A,,,,,,,$ Off,0.00,0.00,USD,South Rainbow,75732,0,0.00,0.00,0.00,0.00,0.00,-0.00,-0.00,0.00,0.00,0.00,0,0,0,0,0,0,0,0
2025-10-11,77e23ebd-6e10-4113-938c-bb55550710f5,Spice <> Capriotti's - Sep / Oct,promotion,2025-09-18,None,N/A,,d1d0b263-4918-4c81-8c97-630471e7185b,10% Happy Hour Discount - Medium Price Sensitivity,day,all,Order Discount,% Off,10.0%,25.00,USD,Sierra St - Reno,719271,2,90.59,7.85,0.00,0.00,1.98,-0.00,-0.00,45.30,4.92,9.22,0,1,1,2,0,1,1,2
2025-10-11,e149493c-c29f-452b-b0be-926022f5491a,Spend $20 get $3 off 09/20/2025,promotion,2025-09-20,None,N/A,,,,,,,$ Off,0.00,0.00,USD,Waialae Ave,25380836,5,251.02,15.00,0.00,0.00,4.95,-0.00,-0.00,50.20,3.99,12.58,2,2,0,4,1,2,0,3
2025-10-11,77e23ebd-6e10-4113-938c-bb55550710f5,Spice <> Capriotti's - Sep / Oct,promotion,2025-09-18,None,N/A,,ba37e4d8-36c4-4cbe-8c7d-f4d1379109bd,"Spend $15, Save $3 | Low price Sensitivity",day,all,Order Discount,$ Off,3.00,15.00,USD,Heart Pine-Odessa,2232632,2,46.75,6.00,0.00,0.00,1.98,-0.00,-0.00,23.38,3.99,5.86,0,2,0,2,0,2,0,2
2025-10-11,02d2c45e-5b6f-4058-b05d-1fbcb475312e,"First order, 20% off 04/09/2025",promotion,2025-04-09,None,N/A,,,,,,,$ Off,0.00,0.00,USD,North Haven Ave,28834163,2,81.81,10.00,0.00,0.00,1.98,-0.00,-0.00,40.91,5.99,6.83,2,0,0,2,2,0,0,2
2025-10-11,77e23ebd-6e10-4113-938c-bb55550710f5,Spice <> Capriotti's - Sep / Oct,promotion,2025-09-18,None,N/A,,ba37e4d8-36c4-4cbe-8c7d-f4d1379109bd,"Spend $15, Save $3 | Low price Sensitivity",day,all,Order Discount,$ Off,3.00,15.00,USD,Sierra Hwy,27476315,0,0.00,0.00,0.00,0.00,0.00,-0.00,-0.00,0.00,0.00,0.00,0,0,0,0,0,0,0,0
2025-10-11,77e23ebd-6e10-4113-938c-bb55550710f5,Spice <> Capriotti's - Sep / Oct,promotion,2025-09-18,None,N/A,,d1d0b263-4918-4c81-8c97-630471e7185b,10% Happy Hour Discount - Medium Price Sensitivity,day,all,Order Discount,% Off,10.0%,25.00,USD,Los Altos,33476901,5,189.82,18.64,0.00,0.00,4.95,-0.00,-0.00,37.96,4.72,8.05,1,2,2,5,0,2,1,3
2025-10-11,77e23ebd-6e10-4113-938c-bb55550710f5,Spice <> Capriotti's - Sep / Oct,promotion,2025-09-18,None,N/A,,d1d0b263-4918-4c81-8c97-630471e7185b,10% Happy Hour Discount - Medium Price Sensitivity,day,all,Order Discount,% Off,10.0%,25.00,USD,West Sahara Avenue,424852,0,0.00,0.00,0.00,0.00,0.00,-0.00,-0.00,0.00,0.00,0.00,0,0,0,0,0,0,0,0
2025-10-11,77e23ebd-6e10-4113-938c-bb55550710f5,Spice <> Capriotti's - Sep / Oct,promotion,2025-09-18,None,N/A,,ba37e4d8-36c4-4cbe-8c7d-f4d1379109bd,"Spend $15, Save $3 | Low price Sensitivity",day,all,Order Discount,$ Off,3.00,15.00,USD,Lantana Drive,390888,2,125.12,6.00,0.00,0.00,1.98,-0.00,-0.00,62.56,3.99,15.68,0,1,1,2,0,0,0,0
2025-10-11,77e23ebd-6e10-4113-938c-bb55550710f5,Spice <> Capriotti's - Sep / Oct,promotion,2025-09-18,None,N/A,,,,day,,,$ Off,0.00,0.00,USD,Roby Dr - Hammond,24891803,0,0.00,0.00,0.00,0.00,0.00,-0.00,-0.00,0.00,0.00,0.00,0,0,0,0,0,0,0,0
2025-10-11,77e23ebd-6e10-4113-938c-bb55550710f5,Spice <> Capriotti's - Sep / Oct,promotion,2025-09-18,None,N/A,,d1d0b263-4918-4c81-8c97-630471e7185b,10% Happy Hour Discount - Medium Price Sensitivity,day,all,Order Discount,% Off,10.0%,25.00,USD,Newark,390890,1,55.05,5.00,0.00,0.00,0.99,-0.00,-0.00,55.05,5.99,9.19,0,1,0,1,0,0,0,0
2025-10-11,77e23ebd-6e10-4113-938c-bb55550710f5,Spice <> Capriotti's - Sep / Oct,promotion,2025-09-18,None,N/A,,43340528-e1b7-4f95-ab40-8dc92bf9c274,"Spend $35, Save $6 | High Price Sensitivity",day,all,Order Discount,$ Off,6.00,35.00,USD,West Fullerton Ave,23349403,0,0.00,0.00,0.00,0.00,0.00,-0.00,-0.00,0.00,0.00,0.00,0,0,0,0,0,0,0,0
2025-10-11,02d2c45e-5b6f-4058-b05d-1fbcb475312e,"First order, 20% off 04/09/2025",promotion,2025-04-09,None,N/A,,,,,,,$ Off,0.00,0.00,USD,Roby Dr - Hammond,24891803,1,24.87,4.97,0.00,0.00,0.99,-0.00,-0.00,24.87,5.96,4.17,1,0,0,1,0,0,0,0
2025-10-11,77e23ebd-6e10-4113-938c-bb55550710f5,Spice <> Capriotti's - Sep / Oct,promotion,2025-09-18,None,N/A,,ba37e4d8-36c4-4cbe-8c7d-f4d1379109bd,"Spend $15, Save $3 | Low price Sensitivity",day,all,Order Discount,$ Off,3.00,15.00,USD,Highlands Ranch,1791292,0,0.00,0.00,0.00,0.00,0.00,-0.00,-0.00,0.00,0.00,0.00,0,0,0,0,0,0,0,0
2025-10-11,77e23ebd-6e10-4113-938c-bb55550710f5,Spice <> Capriotti's - Sep / Oct,promotion,2025-09-18,None,N/A,,,,day,,,$ Off,0.00,0.00,USD,Arapahoe Rd,23349425,0,0.00,0.00,0.00,0.00,0.00,-0.00,-0.00,0.00,0.00,0.00,0,0,0,0,0,0,0,0
2025-10-11,77e23ebd-6e10-4113-938c-bb55550710f5,Spice <> Capriotti's - Sep / Oct,promotion,2025-09-18,None,N/A,,d1d0b263-4918-4c81-8c97-630471e7185b,10% Happy Hour Discount - Medium Price Sensitivity,day,all,Order Discount,% Off,10.0%,25.00,USD,Sunrise Blvd,31345439,0,0.00,0.00,0.00,0.00,0.00,-0.00,-0.00,0.00,0.00,0.00,0,0,0,0,0,0,0,0
2025-10-11,77e23ebd-6e10-4113-938c-bb55550710f5,Spice <> Capriotti's - Sep / Oct,promotion,2025-09-18,None,N/A,,f06f33c5-bff5-4bb3-8dda-6cedeb2e6fc1,10% Happy hour Discount - Min $30 | Low Price Sensitivity,day,all,Order Discount,% Off,7.0%,30.00,USD,The Old Road,24898774,0,0.00,0.00,0.00,0.00,0.00,-0.00,-0.00,0.00,0.00,0.00,0,0,0,0,0,0,0,0
2025-10-11,77e23ebd-6e10-4113-938c-bb55550710f5,Spice <> Capriotti's - Sep / Oct,promotion,2025-09-18,None,N/A,,43340528-e1b7-4f95-ab40-8dc92bf9c274,"Spend $35, Save $6 | High Price Sensitivity",day,all,Order Discount,$ Off,6.00,35.00,USD,Catclaw - Abilene,29652227,3,165.95,18.00,0.00,0.00,2.97,-0.00,-0.00,55.32,6.99,7.91,0,3,0,3,0,2,0,2
2025-10-11,77e23ebd-6e10-4113-938c-bb55550710f5,Spice <> Capriotti's - Sep / Oct,promotion,2025-09-18,None,N/A,,,,day,,,$ Off,0.00,0.00,USD,Cortez Rd  West,26034424,0,0.00,0.00,0.00,0.00,0.00,-0.00,-0.00,0.00,0.00,0.00,0,0,0,0,0,0,0,0
2025-10-11,02d2c45e-5b6f-4058-b05d-1fbcb475312e,"First order, 20% off 04/09/2025",promotion,2025-04-09,None,N/A,,,,,,,$ Off,0.00,0.00,USD,West Glenwood Ave,575295,6,213.68,29.58,0.00,0.00,5.94,-0.00,-0.00,35.61,5.92,6.02,6,0,0,6,1,0,0,1
2025-10-11,77e23ebd-6e10-4113-938c-bb55550710f5,Spice <> Capriotti's - Sep / Oct,promotion,2025-09-18,None,N/A,,43340528-e1b7-4f95-ab40-8dc92bf9c274,"Spend $35, Save $6 | High Price Sensitivity",day,all,Order Discount,$ Off,6.00,35.00,USD,Blackstone-Fresno,24415716,0,0.00,0.00,0.00,0.00,0.00,-0.00,-0.00,0.00,0.00,0.00,0,0,0,0,0,0,0,0
2025-10-11,77e23ebd-6e10-4113-938c-bb55550710f5,Spice <> Capriotti's - Sep / Oct,promotion,2025-09-18,None,N/A,,,,day,,,$ Off,0.00,0.00,USD,West Basin Rd,575301,0,0.00,0.00,0.00,0.00,0.00,-0.00,-0.00,0.00,0.00,0.00,0,0,0,0,0,0,0,0
2025-10-11,77e23ebd-6e10-4113-938c-bb55550710f5,Spice <> Capriotti's - Sep / Oct,promotion,2025-09-18,None,N/A,,91f90d8c-8a7d-41cf-9b6a-888400112024,10% Happy Hour Discount - Min  $25 | High Price Sensitivity,day,all,Order Discount,% Off,10.0%,25.00,USD,Broadway - Tucson,27829895,1,27.59,2.76,0.00,0.00,0.99,-0.00,-0.00,27.59,3.75,7.36,0,1,0,1,0,1,0,1
2025-10-11,77e23ebd-6e10-4113-938c-bb55550710f5,Spice <> Capriotti's - Sep / Oct,promotion,2025-09-18,None,N/A,,d1d0b263-4918-4c81-8c97-630471e7185b,10% Happy Hour Discount - Medium Price Sensitivity,day,all,Order Discount,% Off,10.0%,25.00,USD,Maryland Pkwy,1007892,0,0.00,0.00,0.00,0.00,0.00,-0.00,-0.00,0.00,0.00,0.00,0,0,0,0,0,0,0,0
2025-10-11,77e23ebd-6e10-4113-938c-bb55550710f5,Spice <> Capriotti's - Sep / Oct,promotion,2025-09-18,None,N/A,,,,day,,,$ Off,0.00,0.00,USD,Bel Air,23733193,0,0.00,0.00,0.00,0.00,0.00,-0.00,-0.00,0.00,0.00,0.00,0,0,0,0,0,0,0,0
2025-10-11,77e23ebd-6e10-4113-938c-bb55550710f5,Spice <> Capriotti's - Sep / Oct,promotion,2025-09-18,None,N/A,,91f90d8c-8a7d-41cf-9b6a-888400112024,10% Happy Hour Discount - Min  $25 | High Price Sensitivity,day,all,Order Discount,% Off,10.0%,25.00,USD,Kirkwood Hwy,390889,4,192.62,16.53,0.00,0.00,3.96,-0.00,-0.00,48.16,5.12,9.40,0,4,0,4,0,1,0,1
2025-10-11,77e23ebd-6e10-4113-938c-bb55550710f5,Spice <> Capriotti's - Sep / Oct,promotion,2025-09-18,None,N/A,,d1d0b263-4918-4c81-8c97-630471e7185b,10% Happy Hour Discount - Medium Price Sensitivity,day,all,Order Discount,% Off,10.0%,25.00,USD,North Town Center,75721,2,73.24,7.33,0.00,0.00,1.98,-0.00,-0.00,36.62,4.66,7.87,0,1,1,2,0,1,1,2
2025-10-11,77e23ebd-6e10-4113-938c-bb55550710f5,Spice <> Capriotti's - Sep / Oct,promotion,2025-09-18,None,N/A,,ba37e4d8-36c4-4cbe-8c7d-f4d1379109bd,"Spend $15, Save $3 | Low price Sensitivity",day,all,Order Discount,$ Off,3.00,15.00,USD,Frisco,34516355,1,20.99,3.00,0.00,0.00,0.99,-0.00,-0.00,20.99,3.99,5.26,1,0,0,1,1,0,0,1
2025-10-11,77e23ebd-6e10-4113-938c-bb55550710f5,Spice <> Capriotti's - Sep / Oct,promotion,2025-09-18,None,N/A,,,,day,,,$ Off,0.00,0.00,USD,East Sepulveda,1743753,0,0.00,0.00,0.00,0.00,0.00,-0.00,-0.00,0.00,0.00,0.00,0,0,0,0,0,0,0,0
2025-10-11,77e23ebd-6e10-4113-938c-bb55550710f5,Spice <> Capriotti's - Sep / Oct,promotion,2025-09-18,None,N/A,,f06f33c5-bff5-4bb3-8dda-6cedeb2e6fc1,10% Happy hour Discount - Min $30 | Low Price Sensitivity,day,all,Order Discount,% Off,7.0%,30.00,USD,University Ave,1084955,0,0.00,0.00,0.00,0.00,0.00,-0.00,-0.00,0.00,0.00,0.00,0,0,0,0,0,0,0,0
2025-10-11,5164f786-a14b-4b5d-970f-ced7eba0593a,Spend $35 get 20% off 06/03/2025,promotion,2025-06-03,None,N/A,,,,,,,$ Off,0.00,0.00,USD,Hamilton Blvd,23066760,8,414.49,75.45,0.00,0.00,7.92,-0.00,-0.00,51.81,10.42,4.97,1,6,1,8,1,5,1,7
2025-10-11,77e23ebd-6e10-4113-938c-bb55550710f5,Spice <> Capriotti's - Sep / Oct,promotion,2025-09-18,None,N/A,,,,day,,,$ Off,0.00,0.00,USD,North Union St,575293,0,0.00,0.00,0.00,0.00,0.00,-0.00,-0.00,0.00,0.00,0.00,0,0,0,0,0,0,0,0
2025-10-11,77e23ebd-6e10-4113-938c-bb55550710f5,Spice <> Capriotti's - Sep / Oct,promotion,2025-09-18,None,N/A,,ba37e4d8-36c4-4cbe-8c7d-f4d1379109bd,"Spend $15, Save $3 | Low price Sensitivity",day,all,Order Discount,$ Off,3.00,15.00,USD,Happy Valley,23584856,2,43.67,6.00,0.00,0.00,1.98,-0.00,-0.00,21.84,3.99,5.47,0,1,1,2,0,1,1,2
2025-10-11,6f71233a-4f7b-43f5-b70b-89dc41af1fd0,Late night 5 off 25,promotion,2025-01-17,None,N/A,,,,,,,$ Off,0.00,0.00,USD,West Craig Road,75727,0,0.00,0.00,0.00,0.00,0.00,-0.00,-0.00,0.00,0.00,0.00,0,0,0,0,0,0,0,0
2025-10-11,77e23ebd-6e10-4113-938c-bb55550710f5,Spice <> Capriotti's - Sep / Oct,promotion,2025-09-18,None,N/A,,d1d0b263-4918-4c81-8c97-630471e7185b,10% Happy Hour Discount - Medium Price Sensitivity,day,all,Order Discount,% Off,10.0%,25.00,USD,Red Cliff Dr,578425,0,0.00,0.00,0.00,0.00,0.00,-0.00,-0.00,0.00,0.00,0.00,0,0,0,0,0,0,0,0
2025-10-11,77e23ebd-6e10-4113-938c-bb55550710f5,Spice <> Capriotti's - Sep / Oct,promotion,2025-09-18,None,N/A,,f06f33c5-bff5-4bb3-8dda-6cedeb2e6fc1,10% Happy hour Discount - Min $30 | Low Price Sensitivity,day,all,Order Discount,% Off,7.0%,30.00,USD,Governor Ritchie,24121153,0,0.00,0.00,0.00,0.00,0.00,-0.00,-0.00,0.00,0.00,0.00,0,0,0,0,0,0,0,0
2025-10-11,77e23ebd-6e10-4113-938c-bb55550710f5,Spice <> Capriotti's - Sep / Oct,promotion,2025-09-18,None,N/A,,d1d0b263-4918-4c81-8c97-630471e7185b,10% Happy Hour Discount - Medium Price Sensitivity,day,all,Order Discount,% Off,10.0%,25.00,USD,Bridge St,35060561,3,99.11,9.92,0.00,0.00,2.97,-0.00,-0.00,33.04,4.30,7.69,1,0,2,3,1,0,0,1
2025-10-11,02d2c45e-5b6f-4058-b05d-1fbcb475312e,"First order, 20% off 04/09/2025",promotion,2025-04-09,None,N/A,,,,,,,$ Off,0.00,0.00,USD,South Eastern Ave,75744,2,44.56,8.32,0.00,0.00,1.98,-0.00,-0.00,22.28,5.15,4.33,2,0,0,2,0,0,0,0
2025-10-11,77e23ebd-6e10-4113-938c-bb55550710f5,Spice <> Capriotti's - Sep / Oct,promotion,2025-09-18,None,N/A,,d1d0b263-4918-4c81-8c97-630471e7185b,10% Happy Hour Discount - Medium Price Sensitivity,day,all,Order Discount,% Off,10.0%,25.00,USD,Cranberry Township,24851842,0,0.00,0.00,0.00,0.00,0.00,-0.00,-0.00,0.00,0.00,0.00,0,0,0,0,0,0,0,0
2025-10-11,77e23ebd-6e10-4113-938c-bb55550710f5,Spice <> Capriotti's - Sep / Oct,promotion,2025-09-18,None,N/A,,f06f33c5-bff5-4bb3-8dda-6cedeb2e6fc1,10% Happy hour Discount - Min $30 | Low Price Sensitivity,day,all,Order Discount,% Off,7.0%,30.00,USD,St Rose Pkwy,1335286,0,0.00,0.00,0.00,0.00,0.00,-0.00,-0.00,0.00,0.00,0.00,0,0,0,0,0,0,0,0
2025-10-11,178f54dc-804b-413e-b1bd-ffbdde7f61a1,"Dormant customers, 20% off 02/01/2025",promotion,2025-02-01,None,N/A,,,,,,,$ Off,0.00,0.00,USD,Sierra Hwy,27476315,0,0.00,0.00,0.00,0.00,0.00,-0.00,-0.00,0.00,0.00,0.00,0,0,0,0,0,0,0,0
2025-10-11,02d2c45e-5b6f-4058-b05d-1fbcb475312e,"First order, 20% off 04/09/2025",promotion,2025-04-09,None,N/A,,,,,,,$ Off,0.00,0.00,USD,West Azure,75724,1,29.98,5.00,0.00,0.00,0.99,-0.00,-0.00,29.98,5.99,5.01,1,0,0,1,0,0,0,0
2025-10-11,77e23ebd-6e10-4113-938c-bb55550710f5,Spice <> Capriotti's - Sep / Oct,promotion,2025-09-18,None,N/A,,,,day,,,$ Off,0.00,0.00,USD,West Fullerton Ave,23349403,0,0.00,0.00,0.00,0.00,0.00,-0.00,-0.00,0.00,0.00,0.00,0,0,0,0,0,0,0,0
2025-10-11,77e23ebd-6e10-4113-938c-bb55550710f5,Spice <> Capriotti's - Sep / Oct,promotion,2025-09-18,None,N/A,,d1d0b263-4918-4c81-8c97-630471e7185b,10% Happy Hour Discount - Medium Price Sensitivity,day,all,Order Discount,% Off,10.0%,25.00,USD,Northdale Blvd,24976449,0,0.00,0.00,0.00,0.00,0.00,-0.00,-0.00,0.00,0.00,0.00,0,0,0,0,0,0,0,0
2025-10-11,77e23ebd-6e10-4113-938c-bb55550710f5,Spice <> Capriotti's - Sep / Oct,promotion,2025-09-18,None,N/A,,,,day,,,$ Off,0.00,0.00,USD,"Capriotti's of Dover, Inc.",1617804,0,0.00,0.00,0.00,0.00,0.00,-0.00,-0.00,0.00,0.00,0.00,0,0,0,0,0,0,0,0
2025-10-11,77e23ebd-6e10-4113-938c-bb55550710f5,Spice <> Capriotti's - Sep / Oct,promotion,2025-09-18,None,N/A,,d1d0b263-4918-4c81-8c97-630471e7185b,10% Happy Hour Discount - Medium Price Sensitivity,day,all,Order Discount,% Off,10.0%,25.00,USD,San Luis Obispo,23900701,0,0.00,0.00,0.00,0.00,0.00,-0.00,-0.00,0.00,0.00,0.00,0,0,0,0,0,0,0,0
2025-10-11,02d2c45e-5b6f-4058-b05d-1fbcb475312e,"First order, 20% off 04/09/2025",promotion,2025-04-09,None,N/A,,,,,,,$ Off,0.00,0.00,USD,S Marion Road,1742411,2,56.24,9.59,0.00,0.00,1.98,-0.00,-0.00,28.12,5.79,4.86,2,0,0,2,1,0,0,1
2025-10-11,77e23ebd-6e10-4113-938c-bb55550710f5,Spice <> Capriotti's - Sep / Oct,promotion,2025-09-18,None,N/A,,f06f33c5-bff5-4bb3-8dda-6cedeb2e6fc1,10% Happy hour Discount - Min $30 | Low Price Sensitivity,day,all,Order Discount,% Off,7.0%,30.00,USD,Collier Pkwy-Lutz,23057623,0,0.00,0.00,0.00,0.00,0.00,-0.00,-0.00,0.00,0.00,0.00,0,0,0,0,0,0,0,0
2025-10-11,77e23ebd-6e10-4113-938c-bb55550710f5,Spice <> Capriotti's - Sep / Oct,promotion,2025-09-18,None,N/A,,,,day,,,$ Off,0.00,0.00,USD,Downingtown,33699763,0,0.00,0.00,0.00,0.00,0.00,-0.00,-0.00,0.00,0.00,0.00,0,0,0,0,0,0,0,0
2025-10-11,4996d114-68d0-483f-963c-d124d822fc8f,"First order, 20% off 11/12/2024",promotion,2024-11-12,None,N/A,,,,,,,$ Off,0.00,0.00,USD,Collier Pkwy-Lutz,23057623,1,76.96,5.00,0.00,0.00,0.99,-0.00,-0.00,76.96,5.99,12.85,1,0,0,1,1,0,0,1
2025-10-11,02d2c45e-5b6f-4058-b05d-1fbcb475312e,"First order, 20% off 04/09/2025",promotion,2025-04-09,None,N/A,,,,,,,$ Off,0.00,0.00,USD,West Charleston,23641277,3,102.11,15.00,0.00,0.00,2.97,-0.00,-0.00,34.04,5.99,5.68,3,0,0,3,2,0,0,2
2025-10-11,77e23ebd-6e10-4113-938c-bb55550710f5,Spice <> Capriotti's - Sep / Oct,promotion,2025-09-18,None,N/A,,43340528-e1b7-4f95-ab40-8dc92bf9c274,"Spend $35, Save $6 | High Price Sensitivity",day,all,Order Discount,$ Off,6.00,35.00,USD,Shepherd - Fresno,24559604,2,93.32,12.00,0.00,0.00,1.98,-0.00,-0.00,46.66,6.99,6.68,0,0,2,2,0,0,0,0
2025-10-11,02d2c45e-5b6f-4058-b05d-1fbcb475312e,"First order, 20% off 04/09/2025",promotion,2025-04-09,None,N/A,,,,,,,$ Off,0.00,0.00,USD,Douglas Blvd,1018616,3,139.59,15.00,0.00,0.00,2.97,-0.00,-0.00,46.53,5.99,7.77,3,0,0,3,2,0,0,2
2025-10-11,02d2c45e-5b6f-4058-b05d-1fbcb475312e,"First order, 20% off 04/09/2025",promotion,2025-04-09,None,N/A,,,,,,,$ Off,0.00,0.00,USD,Magnolia Ave,31345441,4,143.69,19.40,0.00,0.00,3.96,-0.00,-0.00,35.92,5.84,6.15,4,0,0,4,0,0,0,0
2025-10-11,77e23ebd-6e10-4113-938c-bb55550710f5,Spice <> Capriotti's - Sep / Oct,promotion,2025-09-18,None,N/A,,d1d0b263-4918-4c81-8c97-630471e7185b,10% Happy Hour Discount - Medium Price Sensitivity,day,all,Order Discount,% Off,10.0%,25.00,USD,Pioneer Pkwy,874359,0,0.00,0.00,0.00,0.00,0.00,-0.00,-0.00,0.00,0.00,0.00,0,0,0,0,0,0,0,0
2025-10-11,178f54dc-804b-413e-b1bd-ffbdde7f61a1,"Dormant customers, 20% off 02/01/2025",promotion,2025-02-01,None,N/A,,,,,,,$ Off,0.00,0.00,USD,De Soto-Chatsworth,651597,0,0.00,0.00,0.00,0.00,0.00,-0.00,-0.00,0.00,0.00,0.00,0,0,0,0,0,0,0,0
2025-10-11,b0ba6428-e0e2-4625-9d44-870d349157d5,Lunch specials discount 03/18/2025,promotion,2025-03-18,None,N/A,,,,,,,$ Off,0.00,0.00,USD,Townpark Lane,128721,4,135.70,18.90,0.00,0.00,0.00,-0.00,-0.00,33.93,4.73,7.18,1,1,2,4,1,0,1,2
2025-10-11,77e23ebd-6e10-4113-938c-bb55550710f5,Spice <> Capriotti's - Sep / Oct,promotion,2025-09-18,None,N/A,,ba37e4d8-36c4-4cbe-8c7d-f4d1379109bd,"Spend $15, Save $3 | Low price Sensitivity",day,all,Order Discount,$ Off,3.00,15.00,USD,University Dr,29894178,0,0.00,0.00,0.00,0.00,0.00,-0.00,-0.00,0.00,0.00,0.00,0,0,0,0,0,0,0,0
2025-10-11,77e23ebd-6e10-4113-938c-bb55550710f5,Spice <> Capriotti's - Sep / Oct,promotion,2025-09-18,None,N/A,,f06f33c5-bff5-4bb3-8dda-6cedeb2e6fc1,10% Happy hour Discount - Min $30 | Low Price Sensitivity,day,all,Order Discount,% Off,7.0%,30.00,USD,Forest Drive,674540,1,41.98,2.94,0.00,0.00,0.99,-0.00,-0.00,41.98,3.93,10.68,0,1,0,1,0,1,0,1
2025-10-11,77e23ebd-6e10-4113-938c-bb55550710f5,Spice <> Capriotti's - Sep / Oct,promotion,2025-09-18,None,N/A,,f06f33c5-bff5-4bb3-8dda-6cedeb2e6fc1,10% Happy hour Discount - Min $30 | Low Price Sensitivity,day,all,Order Discount,% Off,7.0%,30.00,USD,Bidwell - Folsom,26234909,0,0.00,0.00,0.00,0.00,0.00,-0.00,-0.00,0.00,0.00,0.00,0,0,0,0,0,0,0,0
2025-10-11,c7538744-a515-43f8-97d0-b819c1419d1b,Happy Hour discount 09/19/2024,promotion,2024-09-19,None,N/A,,,,,,,$ Off,0.00,0.00,USD,Bidwell - Folsom,26234909,4,144.30,36.08,0.00,0.00,3.96,-0.00,-0.00,36.08,10.01,3.60,3,1,0,4,1,1,0,2
2025-10-11,77e23ebd-6e10-4113-938c-bb55550710f5,Spice <> Capriotti's - Sep / Oct,promotion,2025-09-18,None,N/A,,43340528-e1b7-4f95-ab40-8dc92bf9c274,"Spend $35, Save $6 | High Price Sensitivity",day,all,Order Discount,$ Off,6.00,35.00,USD,Kirkwood Hwy,390889,2,88.03,12.00,0.00,0.00,1.98,-0.00,-0.00,44.02,6.99,6.30,0,2,0,2,0,1,0,1
2025-10-11,02d2c45e-5b6f-4058-b05d-1fbcb475312e,"First order, 20% off 04/09/2025",promotion,2025-04-09,None,N/A,,,,,,,$ Off,0.00,0.00,USD,Highbrook Way,33551695,5,190.69,20.78,0.00,0.00,4.95,-0.00,-0.00,38.14,5.15,7.41,5,0,0,5,2,0,0,2
2025-10-11,02d2c45e-5b6f-4058-b05d-1fbcb475312e,"First order, 20% off 04/09/2025",promotion,2025-04-09,None,N/A,,,,,,,$ Off,0.00,0.00,USD,Cheyenne Rd,2375637,2,60.54,8.78,0.00,0.00,1.98,-0.00,-0.00,30.27,5.38,5.63,2,0,0,2,1,0,0,1
2025-10-11,77e23ebd-6e10-4113-938c-bb55550710f5,Spice <> Capriotti's - Sep / Oct,promotion,2025-09-18,None,N/A,,d1d0b263-4918-4c81-8c97-630471e7185b,10% Happy Hour Discount - Medium Price Sensitivity,day,all,Order Discount,% Off,10.0%,25.00,USD,West Glenwood Ave,575295,0,0.00,0.00,0.00,0.00,0.00,-0.00,-0.00,0.00,0.00,0.00,0,0,0,0,0,0,0,0
2025-10-11,4d5a689d-a212-46a2-91dc-8288a79ff11a,"First order, 20% off 01/02/2025",promotion,2025-01-02,None,N/A,,,,,,,$ Off,0.00,0.00,USD,Sunrise Blvd,31345439,2,58.95,10.00,0.00,0.00,1.98,-0.00,-0.00,29.48,5.99,4.92,2,0,0,2,2,0,0,2
2025-10-11,77e23ebd-6e10-4113-938c-bb55550710f5,Spice <> Capriotti's - Sep / Oct,promotion,2025-09-18,None,N/A,,f06f33c5-bff5-4bb3-8dda-6cedeb2e6fc1,10% Happy hour Discount - Min $30 | Low Price Sensitivity,day,all,Order Discount,% Off,7.0%,30.00,USD,Kennett Square,575296,0,0.00,0.00,0.00,0.00,0.00,-0.00,-0.00,0.00,0.00,0.00,0,0,0,0,0,0,0,0
2025-10-11,77e23ebd-6e10-4113-938c-bb55550710f5,Spice <> Capriotti's - Sep / Oct,promotion,2025-09-18,None,N/A,,,,day,,,$ Off,0.00,0.00,USD,North Boulder Hwy,75752,0,0.00,0.00,0.00,0.00,0.00,-0.00,-0.00,0.00,0.00,0.00,0,0,0,0,0,0,0,0
2025-10-11,02d2c45e-5b6f-4058-b05d-1fbcb475312e,"First order, 20% off 04/09/2025",promotion,2025-04-09,None,N/A,,,,,,,$ Off,0.00,0.00,USD,Downingtown,33699763,4,100.99,18.23,0.00,0.00,3.96,-0.00,-0.00,25.25,5.55,4.55,4,0,0,4,2,0,0,2
2025-10-11,77e23ebd-6e10-4113-938c-bb55550710f5,Spice <> Capriotti's - Sep / Oct,promotion,2025-09-18,None,N/A,,,,day,,,$ Off,0.00,0.00,USD,GVR Casino,75749,0,0.00,0.00,0.00,0.00,0.00,-0.00,-0.00,0.00,0.00,0.00,0,0,0,0,0,0,0,0
2025-10-11,02d2c45e-5b6f-4058-b05d-1fbcb475312e,"First order, 20% off 04/09/2025",promotion,2025-04-09,None,N/A,,,,,,,$ Off,0.00,0.00,USD,Kirkwood Hwy,390889,2,67.92,9.04,0.00,0.00,1.98,-0.00,-0.00,33.96,5.51,6.16,2,0,0,2,2,0,0,2
2025-10-11,77e23ebd-6e10-4113-938c-bb55550710f5,Spice <> Capriotti's - Sep / Oct,promotion,2025-09-18,None,N/A,,,,day,,,$ Off,0.00,0.00,USD,"Capriotti's of Milford, LLC",1636430,0,0.00,0.00,0.00,0.00,0.00,-0.00,-0.00,0.00,0.00,0.00,0,0,0,0,0,0,0,0
2025-10-11,9708621d-8c94-41e7-8a63-2da71ea0199e,"Dormant customers, 20% off 07/02/2025",promotion,2025-07-02,None,N/A,,,,,,,$ Off,0.00,0.00,USD,Southern Highlands,1750142,2,45.35,8.84,0.00,0.00,1.98,-0.00,-0.00,22.68,5.41,4.19,0,0,2,2,0,0,0,0
2025-10-11,77e23ebd-6e10-4113-938c-bb55550710f5,Spice <> Capriotti's - Sep / Oct,promotion,2025-09-18,None,N/A,,f06f33c5-bff5-4bb3-8dda-6cedeb2e6fc1,10% Happy hour Discount - Min $30 | Low Price Sensitivity,day,all,Order Discount,% Off,7.0%,30.00,USD,Lantana Drive,390888,3,207.01,12.46,0.00,0.00,2.97,-0.00,-0.00,69.00,5.14,13.42,0,3,0,3,0,3,0,3
2025-10-11,77e23ebd-6e10-4113-938c-bb55550710f5,Spice <> Capriotti's - Sep / Oct,promotion,2025-09-18,None,N/A,,f06f33c5-bff5-4bb3-8dda-6cedeb2e6fc1,10% Happy hour Discount - Min $30 | Low Price Sensitivity,day,all,Order Discount,% Off,7.0%,30.00,USD,Cortez Rd  West,26034424,0,0.00,0.00,0.00,0.00,0.00,-0.00,-0.00,0.00,0.00,0.00,0,0,0,0,0,0,0,0
2025-10-11,77e23ebd-6e10-4113-938c-bb55550710f5,Spice <> Capriotti's - Sep / Oct,promotion,2025-09-18,None,N/A,,43340528-e1b7-4f95-ab40-8dc92bf9c274,"Spend $35, Save $6 | High Price Sensitivity",day,all,Order Discount,$ Off,6.00,35.00,USD,"Capriotti's of Milford, LLC",1636430,1,39.97,6.00,0.00,0.00,0.99,-0.00,-0.00,39.97,6.99,5.72,0,1,0,1,0,1,0,1
2025-10-11,6f71233a-4f7b-43f5-b70b-89dc41af1fd0,Late night 5 off 25,promotion,2025-01-17,None,N/A,,,,,,,$ Off,0.00,0.00,USD,Oso Blanca Rd,178087,0,0.00,0.00,0.00,0.00,0.00,-0.00,-0.00,0.00,0.00,0.00,0,0,0,0,0,0,0,0
2025-10-11,77e23ebd-6e10-4113-938c-bb55550710f5,Spice <> Capriotti's - Sep / Oct,promotion,2025-09-18,None,N/A,,f06f33c5-bff5-4bb3-8dda-6cedeb2e6fc1,10% Happy hour Discount - Min $30 | Low Price Sensitivity,day,all,Order Discount,% Off,7.0%,30.00,USD,Frisco,34516355,0,0.00,0.00,0.00,0.00,0.00,-0.00,-0.00,0.00,0.00,0.00,0,0,0,0,0,0,0,0
2025-10-11,77e23ebd-6e10-4113-938c-bb55550710f5,Spice <> Capriotti's - Sep / Oct,promotion,2025-09-18,None,N/A,,ba37e4d8-36c4-4cbe-8c7d-f4d1379109bd,"Spend $15, Save $3 | Low price Sensitivity",day,all,Order Discount,$ Off,3.00,15.00,USD,Gambrills,24415514,0,0.00,0.00,0.00,0.00,0.00,-0.00,-0.00,0.00,0.00,0.00,0,0,0,0,0,0,0,0
2025-10-11,02d2c45e-5b6f-4058-b05d-1fbcb475312e,"First order, 20% off 04/09/2025",promotion,2025-04-09,None,N/A,,,,,,,$ Off,0.00,0.00,USD,E 53rd - Davenport,582282,2,58.25,8.50,0.00,0.00,1.98,-0.00,-0.00,29.13,5.24,5.56,2,0,0,2,1,0,0,1
2025-10-11,02d2c45e-5b6f-4058-b05d-1fbcb475312e,"First order, 20% off 04/09/2025",promotion,2025-04-09,None,N/A,,,,,,,$ Off,0.00,0.00,USD,Freeman Park,24404087,2,71.72,8.46,0.00,0.00,1.98,-0.00,-0.00,35.86,5.22,6.87,2,0,0,2,2,0,0,2
2025-10-11,77e23ebd-6e10-4113-938c-bb55550710f5,Spice <> Capriotti's - Sep / Oct,promotion,2025-09-18,None,N/A,,d1d0b263-4918-4c81-8c97-630471e7185b,10% Happy Hour Discount - Medium Price Sensitivity,day,all,Order Discount,% Off,10.0%,25.00,USD,Sahara & Las Vegas,75735,0,0.00,0.00,0.00,0.00,0.00,-0.00,-0.00,0.00,0.00,0.00,0,0,0,0,0,0,0,0
2025-10-11,10f22bff-32eb-477c-b8fd-70d17c151ce3,Happy Hour discount 10/02/2025,promotion,2025-10-02,2025-11-02,N/A,,,,,,,$ Off,0.00,0.00,USD,Manchester Rd,27715447,2,66.42,16.61,0.00,0.00,1.98,-0.00,-0.00,33.21,9.30,3.57,0,1,1,2,0,1,1,2
2025-10-11,77e23ebd-6e10-4113-938c-bb55550710f5,Spice <> Capriotti's - Sep / Oct,promotion,2025-09-18,None,N/A,,d1d0b263-4918-4c81-8c97-630471e7185b,10% Happy Hour Discount - Medium Price Sensitivity,day,all,Order Discount,% Off,10.0%,25.00,USD,E Silverado Ranch,75746,0,0.00,0.00,0.00,0.00,0.00,-0.00,-0.00,0.00,0.00,0.00,0,0,0,0,0,0,0,0
2025-10-11,77e23ebd-6e10-4113-938c-bb55550710f5,Spice <> Capriotti's - Sep / Oct,promotion,2025-09-18,None,N/A,,,,day,,,$ Off,0.00,0.00,USD,South  Walton Blvd,1616214,0,0.00,0.00,0.00,0.00,0.00,-0.00,-0.00,0.00,0.00,0.00,0,0,0,0,0,0,0,0
2025-10-11,02d2c45e-5b6f-4058-b05d-1fbcb475312e,"First order, 20% off 04/09/2025",promotion,2025-04-09,None,N/A,,,,,,,$ Off,0.00,0.00,USD,Arapahoe Rd,23349425,5,214.67,21.52,0.00,0.00,4.95,-0.00,-0.00,42.93,5.29,8.11,5,0,0,5,4,0,0,4
2025-10-11,50157030-02ee-4b4c-b1a0-c9d30675c82e,Spend $30 get 20% off 03/10/2025,promotion,2025-03-10,None,N/A,,,,,,,$ Off,0.00,0.00,USD,Kenosha & 177th,1856591,6,220.57,44.88,0.00,0.00,5.16,-0.00,-0.00,36.76,8.34,4.41,1,3,2,6,1,1,1,3
2025-10-11,70d4cf5a-37fe-47ad-bac7-d5196b53b89c,Spend $30 get 20% off 09/03/2025,promotion,2025-09-03,None,N/A,,,,,,,$ Off,0.00,0.00,USD,Grand Ave-Portland,1370229,7,320.20,60.09,0.00,0.00,6.93,-0.00,-0.00,45.74,9.57,4.78,1,5,1,7,1,3,1,5
2025-10-11,598e2471-2c6e-4746-bf14-48fe760a14fb,Happy Hour discount 02/01/2025,promotion,2025-02-01,None,N/A,,,,,,,$ Off,0.00,0.00,USD,Sierra Hwy,27476315,1,35.76,7.00,0.00,0.00,0.99,-0.00,-0.00,35.76,7.99,4.48,1,0,0,1,1,0,0,1
2025-10-11,02d2c45e-5b6f-4058-b05d-1fbcb475312e,"First order, 20% off 04/09/2025",promotion,2025-04-09,None,N/A,,,,,,,$ Off,0.00,0.00,USD,N Broad St,578662,2,76.15,10.00,0.00,0.00,1.98,-0.00,-0.00,38.08,5.99,6.36,2,0,0,2,2,0,0,2
2025-10-11,77e23ebd-6e10-4113-938c-bb55550710f5,Spice <> Capriotti's - Sep / Oct,promotion,2025-09-18,None,N/A,,,,day,,,$ Off,0.00,0.00,USD,International Pkwy,24671402,0,0.00,0.00,0.00,0.00,0.00,-0.00,-0.00,0.00,0.00,0.00,0,0,0,0,0,0,0,0
2025-10-11,f12a26e0-24e1-4d8e-ac05-d7e43f06d2bf,Happy Hour discount 11/12/2024,promotion,2024-11-12,None,N/A,,,,,,,$ Off,0.00,0.00,USD,Northdale Blvd,24976449,3,74.82,18.64,0.00,0.00,2.97,-0.00,-0.00,24.94,7.20,3.46,0,3,0,3,0,3,0,3
2025-10-11,02d2c45e-5b6f-4058-b05d-1fbcb475312e,"First order, 20% off 04/09/2025",promotion,2025-04-09,None,N/A,,,,,,,$ Off,0.00,0.00,USD,Stephanie St,75751,1,70.45,5.00,0.00,0.00,0.99,-0.00,-0.00,70.45,5.99,11.76,1,0,0,1,1,0,0,1
2025-10-11,77e23ebd-6e10-4113-938c-bb55550710f5,Spice <> Capriotti's - Sep / Oct,promotion,2025-09-18,None,N/A,,d1d0b263-4918-4c81-8c97-630471e7185b,10% Happy Hour Discount - Medium Price Sensitivity,day,all,Order Discount,% Off,10.0%,25.00,USD,Freeman Park,24404087,0,0.00,0.00,0.00,0.00,0.00,-0.00,-0.00,0.00,0.00,0.00,0,0,0,0,0,0,0,0
2025-10-11,77e23ebd-6e10-4113-938c-bb55550710f5,Spice <> Capriotti's - Sep / Oct,promotion,2025-09-18,None,N/A,,ba37e4d8-36c4-4cbe-8c7d-f4d1379109bd,"Spend $15, Save $3 | Low price Sensitivity",day,all,Order Discount,$ Off,3.00,15.00,USD,N Broad St,578662,3,71.25,9.00,0.00,0.00,2.97,-0.00,-0.00,23.75,3.99,5.95,0,3,0,3,0,2,0,2
2025-10-11,02d2c45e-5b6f-4058-b05d-1fbcb475312e,"First order, 20% off 04/09/2025",promotion,2025-04-09,None,N/A,,,,,,,$ Off,0.00,0.00,USD,Lantana Drive,390888,4,111.60,19.17,0.00,0.00,3.96,-0.00,-0.00,27.90,5.78,4.82,4,0,0,4,2,0,0,2
2025-10-11,77e23ebd-6e10-4113-938c-bb55550710f5,Spice <> Capriotti's - Sep / Oct,promotion,2025-09-18,None,N/A,,ba37e4d8-36c4-4cbe-8c7d-f4d1379109bd,"Spend $15, Save $3 | Low price Sensitivity",day,all,Order Discount,$ Off,3.00,15.00,USD,Governor Ritchie,24121153,0,0.00,0.00,0.00,0.00,0.00,-0.00,-0.00,0.00,0.00,0.00,0,0,0,0,0,0,0,0
2025-10-11,02d2c45e-5b6f-4058-b05d-1fbcb475312e,"First order, 20% off 04/09/2025",promotion,2025-04-09,None,N/A,,,,,,,$ Off,0.00,0.00,USD,Plank Rd,27918503,1,22.78,4.56,0.00,0.00,0.99,-0.00,-0.00,22.78,5.55,4.10,1,0,0,1,1,0,0,1
2025-10-11,02d2c45e-5b6f-4058-b05d-1fbcb475312e,"First order, 20% off 04/09/2025",promotion,2025-04-09,None,N/A,,,,,,,$ Off,0.00,0.00,USD,Millsboro Plaza,23360934,0,0.00,0.00,0.00,0.00,0.00,-0.00,-0.00,0.00,0.00,0.00,0,0,0,0,0,0,0,0
2025-10-11,02d2c45e-5b6f-4058-b05d-1fbcb475312e,"First order, 20% off 04/09/2025",promotion,2025-04-09,None,N/A,,,,,,,$ Off,0.00,0.00,USD,Meadows - Reno,705841,3,70.74,12.20,0.00,0.00,2.97,-0.00,-0.00,23.58,5.06,4.66,3,0,0,3,0,0,0,0
2025-10-11,bdd3cdcc-32b9-405e-97aa-aada053ce3df,aliante lunch 5 off 25,promotion,2025-01-17,None,N/A,,,,,,,$ Off,0.00,0.00,USD,Aliante Casino,75725,0,0.00,0.00,0.00,0.00,0.00,-0.00,-0.00,0.00,0.00,0.00,0,0,0,0,0,0,0,0
2025-10-11,02d2c45e-5b6f-4058-b05d-1fbcb475312e,"First order, 20% off 04/09/2025",promotion,2025-04-09,None,N/A,,,,,,,$ Off,0.00,0.00,USD,Shepherd - Fresno,24559604,2,90.54,9.56,0.00,0.00,1.98,-0.00,-0.00,45.27,5.77,7.85,2,0,0,2,1,0,0,1
2025-10-11,02d2c45e-5b6f-4058-b05d-1fbcb475312e,"First order, 20% off 04/09/2025",promotion,2025-04-09,None,N/A,,,,,,,$ Off,0.00,0.00,USD,17th St Ammon,24968543,1,32.38,5.00,0.00,0.00,0.99,-0.00,-0.00,32.38,5.99,5.41,1,0,0,1,0,0,0,0
2025-10-11,77e23ebd-6e10-4113-938c-bb55550710f5,Spice <> Capriotti's - Sep / Oct,promotion,2025-09-18,None,N/A,,f06f33c5-bff5-4bb3-8dda-6cedeb2e6fc1,10% Happy hour Discount - Min $30 | Low Price Sensitivity,day,all,Order Discount,% Off,7.0%,30.00,USD,Limonite Ave,2375675,1,57.57,4.03,0.00,0.00,0.99,-0.00,-0.00,57.57,5.02,11.47,0,1,0,1,0,1,0,1
2025-10-11,02d2c45e-5b6f-4058-b05d-1fbcb475312e,"First order, 20% off 04/09/2025",promotion,2025-04-09,None,N/A,,,,,,,$ Off,0.00,0.00,USD,North Town Center,75721,1,63.85,5.00,0.00,0.00,0.99,-0.00,-0.00,63.85,5.99,10.66,1,0,0,1,1,0,0,1
2025-10-11,58fe435a-cdf8-4a86-abc7-b68d7b574ba5,Spend $25 Get 20% Off,promotion,2022-12-01,None,N/A,,,,,,,$ Off,0.00,0.00,USD,Coeur d'Alene,23085790,14,486.18,93.89,0.00,0.00,13.86,-0.00,-0.00,34.73,7.70,4.51,6,7,1,14,3,5,1,9
2025-10-11,02d2c45e-5b6f-4058-b05d-1fbcb475312e,"First order, 20% off 04/09/2025",promotion,2025-04-09,None,N/A,,,,,,,$ Off,0.00,0.00,USD,E Silverado Ranch,75746,4,124.81,18.17,0.00,0.00,3.96,-0.00,-0.00,31.20,5.53,5.64,4,0,0,4,1,0,0,1
2025-10-11,77e23ebd-6e10-4113-938c-bb55550710f5,Spice <> Capriotti's - Sep / Oct,promotion,2025-09-18,None,N/A,,f06f33c5-bff5-4bb3-8dda-6cedeb2e6fc1,10% Happy hour Discount - Min $30 | Low Price Sensitivity,day,all,Order Discount,% Off,7.0%,30.00,USD,Nevada Way,75754,0,0.00,0.00,0.00,0.00,0.00,-0.00,-0.00,0.00,0.00,0.00,0,0,0,0,0,0,0,0
2025-10-11,02d2c45e-5b6f-4058-b05d-1fbcb475312e,"First order, 20% off 04/09/2025",promotion,2025-04-09,None,N/A,,,,,,,$ Off,0.00,0.00,USD,Blackstone-Fresno,24415716,2,41.37,8.28,0.00,0.00,1.98,-0.00,-0.00,20.69,5.13,4.03,2,0,0,2,1,0,0,1
2025-10-11,77e23ebd-6e10-4113-938c-bb55550710f5,Spice <> Capriotti's - Sep / Oct,promotion,2025-09-18,None,N/A,,91f90d8c-8a7d-41cf-9b6a-888400112024,10% Happy Hour Discount - Min  $25 | High Price Sensitivity,day,all,Order Discount,% Off,10.0%,25.00,USD,Concord Pike,23151390,2,53.25,5.33,0.00,0.00,1.98,-0.00,-0.00,26.63,3.66,7.28,0,2,0,2,0,1,0,1
2025-10-11,77e23ebd-6e10-4113-938c-bb55550710f5,Spice <> Capriotti's - Sep / Oct,promotion,2025-09-18,None,N/A,,f06f33c5-bff5-4bb3-8dda-6cedeb2e6fc1,10% Happy hour Discount - Min $30 | Low Price Sensitivity,day,all,Order Discount,% Off,7.0%,30.00,USD,GVR Casino,75749,0,0.00,0.00,0.00,0.00,0.00,-0.00,-0.00,0.00,0.00,0.00,0,0,0,0,0,0,0,0
2025-10-11,77e23ebd-6e10-4113-938c-bb55550710f5,Spice <> Capriotti's - Sep / Oct,promotion,2025-09-18,None,N/A,,,,day,,,$ Off,0.00,0.00,USD,Parker,24021312,0,0.00,0.00,0.00,0.00,0.00,-0.00,-0.00,0.00,0.00,0.00,0,0,0,0,0,0,0,0
2025-10-11,77e23ebd-6e10-4113-938c-bb55550710f5,Spice <> Capriotti's - Sep / Oct,promotion,2025-09-18,None,N/A,,91f90d8c-8a7d-41cf-9b6a-888400112024,10% Happy Hour Discount - Min  $25 | High Price Sensitivity,day,all,Order Discount,% Off,10.0%,25.00,USD,College Station,23349412,0,0.00,0.00,0.00,0.00,0.00,-0.00,-0.00,0.00,0.00,0.00,0,0,0,0,0,0,0,0
2025-10-11,77e23ebd-6e10-4113-938c-bb55550710f5,Spice <> Capriotti's - Sep / Oct,promotion,2025-09-18,None,N/A,,43340528-e1b7-4f95-ab40-8dc92bf9c274,"Spend $35, Save $6 | High Price Sensitivity",day,all,Order Discount,$ Off,6.00,35.00,USD,Millsboro Plaza,23360934,0,0.00,0.00,0.00,0.00,0.00,-0.00,-0.00,0.00,0.00,0.00,0,0,0,0,0,0,0,0
2025-10-11,77e23ebd-6e10-4113-938c-bb55550710f5,Spice <> Capriotti's - Sep / Oct,promotion,2025-09-18,None,N/A,,,,day,,,$ Off,0.00,0.00,USD,N 87th Street,27965,0,0.00,0.00,0.00,0.00,0.00,-0.00,-0.00,0.00,0.00,0.00,0,0,0,0,0,0,0,0
2025-10-11,77e23ebd-6e10-4113-938c-bb55550710f5,Spice <> Capriotti's - Sep / Oct,promotion,2025-09-18,None,N/A,,43340528-e1b7-4f95-ab40-8dc92bf9c274,"Spend $35, Save $6 | High Price Sensitivity",day,all,Order Discount,$ Off,6.00,35.00,USD,Chicago River West,34048823,5,212.23,30.00,0.00,0.00,4.95,-0.00,-0.00,42.45,6.99,6.07,0,3,2,5,0,3,2,5
2025-10-11,77e23ebd-6e10-4113-938c-bb55550710f5,Spice <> Capriotti's - Sep / Oct,promotion,2025-09-18,None,N/A,,d1d0b263-4918-4c81-8c97-630471e7185b,10% Happy Hour Discount - Medium Price Sensitivity,day,all,Order Discount,% Off,10.0%,25.00,USD,Oso Blanca Rd,178087,2,56.17,5.61,0.00,0.00,1.98,-0.00,-0.00,28.09,3.80,7.40,0,1,1,2,0,1,1,2
2025-10-11,77e23ebd-6e10-4113-938c-bb55550710f5,Spice <> Capriotti's - Sep / Oct,promotion,2025-09-18,None,N/A,,d1d0b263-4918-4c81-8c97-630471e7185b,10% Happy Hour Discount - Medium Price Sensitivity,day,all,Order Discount,% Off,10.0%,25.00,USD,Manchester Rd,27715447,0,0.00,0.00,0.00,0.00,0.00,-0.00,-0.00,0.00,0.00,0.00,0,0,0,0,0,0,0,0
2025-10-11,77e23ebd-6e10-4113-938c-bb55550710f5,Spice <> Capriotti's - Sep / Oct,promotion,2025-09-18,None,N/A,,d1d0b263-4918-4c81-8c97-630471e7185b,10% Happy Hour Discount - Medium Price Sensitivity,day,all,Order Discount,% Off,10.0%,25.00,USD,Elm St,34052609,1,27.09,2.71,0.00,0.00,0.99,-0.00,-0.00,27.09,3.70,7.32,1,0,0,1,1,0,0,1
2025-10-11,77e23ebd-6e10-4113-938c-bb55550710f5,Spice <> Capriotti's - Sep / Oct,promotion,2025-09-18,None,N/A,,,,day,,,$ Off,0.00,0.00,USD,Princeton,32118309,0,0.00,0.00,0.00,0.00,0.00,-0.00,-0.00,0.00,0.00,0.00,0,0,0,0,0,0,0,0
2025-10-11,77e23ebd-6e10-4113-938c-bb55550710f5,Spice <> Capriotti's - Sep / Oct,promotion,2025-09-18,None,N/A,,ba37e4d8-36c4-4cbe-8c7d-f4d1379109bd,"Spend $15, Save $3 | Low price Sensitivity",day,all,Order Discount,$ Off,3.00,15.00,USD,Murrieta Hot Springs Rd,29652192,1,16.38,3.00,0.00,0.00,0.99,-0.00,-0.00,16.38,3.99,4.11,0,1,0,1,0,1,0,1
2025-10-11,77e23ebd-6e10-4113-938c-bb55550710f5,Spice <> Capriotti's - Sep / Oct,promotion,2025-09-18,None,N/A,,43340528-e1b7-4f95-ab40-8dc92bf9c274,"Spend $35, Save $6 | High Price Sensitivity",day,all,Order Discount,$ Off,6.00,35.00,USD,South  Walton Blvd,1616214,4,189.29,24.00,0.00,0.00,3.96,-0.00,-0.00,47.32,6.99,6.77,1,3,0,4,0,3,0,3
2025-10-11,77e23ebd-6e10-4113-938c-bb55550710f5,Spice <> Capriotti's - Sep / Oct,promotion,2025-09-18,None,N/A,,ba37e4d8-36c4-4cbe-8c7d-f4d1379109bd,"Spend $15, Save $3 | Low price Sensitivity",day,all,Order Discount,$ Off,3.00,15.00,USD,St Rose Pkwy,1335286,3,87.52,9.00,0.00,0.00,2.97,-0.00,-0.00,29.17,3.99,7.31,0,1,2,3,0,1,2,3
2025-10-11,77e23ebd-6e10-4113-938c-bb55550710f5,Spice <> Capriotti's - Sep / Oct,promotion,2025-09-18,None,N/A,,d1d0b263-4918-4c81-8c97-630471e7185b,10% Happy Hour Discount - Medium Price Sensitivity,day,all,Order Discount,% Off,10.0%,25.00,USD,Blue Diamond Road,333447,0,0.00,0.00,0.00,0.00,0.00,-0.00,-0.00,0.00,0.00,0.00,0,0,0,0,0,0,0,0
2025-10-11,77e23ebd-6e10-4113-938c-bb55550710f5,Spice <> Capriotti's - Sep / Oct,promotion,2025-09-18,None,N/A,,ba37e4d8-36c4-4cbe-8c7d-f4d1379109bd,"Spend $15, Save $3 | Low price Sensitivity",day,all,Order Discount,$ Off,3.00,15.00,USD,North Boulder Hwy,75752,3,73.53,9.00,0.00,0.00,2.97,-0.00,-0.00,24.51,3.99,6.14,0,2,1,3,0,2,1,3
2025-10-11,77e23ebd-6e10-4113-938c-bb55550710f5,Spice <> Capriotti's - Sep / Oct,promotion,2025-09-18,None,N/A,,ba37e4d8-36c4-4cbe-8c7d-f4d1379109bd,"Spend $15, Save $3 | Low price Sensitivity",day,all,Order Discount,$ Off,3.00,15.00,USD,Anthem,75750,0,0.00,0.00,0.00,0.00,0.00,-0.00,-0.00,0.00,0.00,0.00,0,0,0,0,0,0,0,0
2025-10-11,77e23ebd-6e10-4113-938c-bb55550710f5,Spice <> Capriotti's - Sep / Oct,promotion,2025-09-18,None,N/A,,,,day,,,$ Off,0.00,0.00,USD,Shepherd - Fresno,24559604,0,0.00,0.00,0.00,0.00,0.00,-0.00,-0.00,0.00,0.00,0.00,0,0,0,0,0,0,0,0
2025-10-11,77e23ebd-6e10-4113-938c-bb55550710f5,Spice <> Capriotti's - Sep / Oct,promotion,2025-09-18,None,N/A,,f06f33c5-bff5-4bb3-8dda-6cedeb2e6fc1,10% Happy hour Discount - Min $30 | Low Price Sensitivity,day,all,Order Discount,% Off,7.0%,30.00,USD,Gambrills,24415514,0,0.00,0.00,0.00,0.00,0.00,-0.00,-0.00,0.00,0.00,0.00,0,0,0,0,0,0,0,0
2025-10-11,77e23ebd-6e10-4113-938c-bb55550710f5,Spice <> Capriotti's - Sep / Oct,promotion,2025-09-18,None,N/A,,,,day,,,$ Off,0.00,0.00,USD,Anthem,75750,0,0.00,0.00,0.00,0.00,0.00,-0.00,-0.00,0.00,0.00,0.00,0,0,0,0,0,0,0,0
2025-10-11,77e23ebd-6e10-4113-938c-bb55550710f5,Spice <> Capriotti's - Sep / Oct,promotion,2025-09-18,None,N/A,,91f90d8c-8a7d-41cf-9b6a-888400112024,10% Happy Hour Discount - Min  $25 | High Price Sensitivity,day,all,Order Discount,% Off,10.0%,25.00,USD,Silverside Road,691182,4,129.60,12.97,0.00,0.00,3.96,-0.00,-0.00,32.40,4.23,7.66,0,4,0,4,0,4,0,4
2025-10-11,77e23ebd-6e10-4113-938c-bb55550710f5,Spice <> Capriotti's - Sep / Oct,promotion,2025-09-18,None,N/A,,,,day,,,$ Off,0.00,0.00,USD,Douglas Blvd,1018616,0,0.00,0.00,0.00,0.00,0.00,-0.00,-0.00,0.00,0.00,0.00,0,0,0,0,0,0,0,0
2025-10-11,77e23ebd-6e10-4113-938c-bb55550710f5,Spice <> Capriotti's - Sep / Oct,promotion,2025-09-18,None,N/A,,ba37e4d8-36c4-4cbe-8c7d-f4d1379109bd,"Spend $15, Save $3 | Low price Sensitivity",day,all,Order Discount,$ Off,3.00,15.00,USD,Zionsville,24415273,4,76.61,12.00,0.00,0.00,3.96,-0.00,-0.00,19.15,3.99,4.80,0,4,0,4,0,3,0,3
2025-10-11,77e23ebd-6e10-4113-938c-bb55550710f5,Spice <> Capriotti's - Sep / Oct,promotion,2025-09-18,None,N/A,,d1d0b263-4918-4c81-8c97-630471e7185b,10% Happy Hour Discount - Medium Price Sensitivity,day,all,Order Discount,% Off,10.0%,25.00,USD,Main Street - Anoka,34494893,2,60.04,6.01,0.00,0.00,1.98,-0.00,-0.00,30.02,4.00,7.51,2,0,0,2,1,0,0,1
2025-10-11,77e23ebd-6e10-4113-938c-bb55550710f5,Spice <> Capriotti's - Sep / Oct,promotion,2025-09-18,None,N/A,,ba37e4d8-36c4-4cbe-8c7d-f4d1379109bd,"Spend $15, Save $3 | Low price Sensitivity",day,all,Order Discount,$ Off,3.00,15.00,USD,Old Town,27964,4,129.10,12.00,0.00,0.00,3.96,-0.00,-0.00,32.28,3.99,8.09,0,3,1,4,0,3,0,3
2025-10-11,77e23ebd-6e10-4113-938c-bb55550710f5,Spice <> Capriotti's - Sep / Oct,promotion,2025-09-18,None,N/A,,,,day,,,$ Off,0.00,0.00,USD,Murrieta Hot Springs Rd,29652192,0,0.00,0.00,0.00,0.00,0.00,-0.00,-0.00,0.00,0.00,0.00,0,0,0,0,0,0,0,0
2025-10-11,77e23ebd-6e10-4113-938c-bb55550710f5,Spice <> Capriotti's - Sep / Oct,promotion,2025-09-18,None,N/A,,91f90d8c-8a7d-41cf-9b6a-888400112024,10% Happy Hour Discount - Min  $25 | High Price Sensitivity,day,all,Order Discount,% Off,10.0%,25.00,USD,Chicago River West,34048823,1,31.37,3.14,0.00,0.00,0.99,-0.00,-0.00,31.37,4.13,7.60,1,0,0,1,1,0,0,1
2025-10-11,77e23ebd-6e10-4113-938c-bb55550710f5,Spice <> Capriotti's - Sep / Oct,promotion,2025-09-18,None,N/A,,d1d0b263-4918-4c81-8c97-630471e7185b,10% Happy Hour Discount - Medium Price Sensitivity,day,all,Order Discount,% Off,10.0%,25.00,USD,Red Rock Casino,75737,0,0.00,0.00,0.00,0.00,0.00,-0.00,-0.00,0.00,0.00,0.00,0,0,0,0,0,0,0,0
2025-10-11,77e23ebd-6e10-4113-938c-bb55550710f5,Spice <> Capriotti's - Sep / Oct,promotion,2025-09-18,None,N/A,,f06f33c5-bff5-4bb3-8dda-6cedeb2e6fc1,10% Happy hour Discount - Min $30 | Low Price Sensitivity,day,all,Order Discount,% Off,7.0%,30.00,USD,Zionsville,24415273,0,0.00,0.00,0.00,0.00,0.00,-0.00,-0.00,0.00,0.00,0.00,0,0,0,0,0,0,0,0
2025-10-11,77e23ebd-6e10-4113-938c-bb55550710f5,Spice <> Capriotti's - Sep / Oct,promotion,2025-09-18,None,N/A,,d1d0b263-4918-4c81-8c97-630471e7185b,10% Happy Hour Discount - Medium Price Sensitivity,day,all,Order Discount,% Off,10.0%,25.00,USD,East 82nd St,184537,2,65.96,6.60,0.00,0.00,1.98,-0.00,-0.00,32.98,4.29,7.69,0,2,0,2,0,1,0,1
2025-10-11,77e23ebd-6e10-4113-938c-bb55550710f5,Spice <> Capriotti's - Sep / Oct,promotion,2025-09-18,None,N/A,,,,day,,,$ Off,0.00,0.00,USD,Silverside Road,691182,0,0.00,0.00,0.00,0.00,0.00,-0.00,-0.00,0.00,0.00,0.00,0,0,0,0,0,0,0,0
2025-10-11,77e23ebd-6e10-4113-938c-bb55550710f5,Spice <> Capriotti's - Sep / Oct,promotion,2025-09-18,None,N/A,,,,day,,,$ Off,0.00,0.00,USD,University Ave,1084955,0,0.00,0.00,0.00,0.00,0.00,-0.00,-0.00,0.00,0.00,0.00,0,0,0,0,0,0,0,0
2025-10-11,77e23ebd-6e10-4113-938c-bb55550710f5,Spice <> Capriotti's - Sep / Oct,promotion,2025-09-18,None,N/A,,d1d0b263-4918-4c81-8c97-630471e7185b,10% Happy Hour Discount - Medium Price Sensitivity,day,all,Order Discount,% Off,10.0%,25.00,USD,East Ridge Pike,1640642,1,29.96,3.00,0.00,0.00,0.99,-0.00,-0.00,29.96,3.99,7.51,0,1,0,1,0,0,0,0
2025-10-11,77e23ebd-6e10-4113-938c-bb55550710f5,Spice <> Capriotti's - Sep / Oct,promotion,2025-09-18,None,N/A,,,,day,,,$ Off,0.00,0.00,USD,Overland Park,24110474,0,0.00,0.00,0.00,0.00,0.00,-0.00,-0.00,0.00,0.00,0.00,0,0,0,0,0,0,0,0
2025-10-11,77e23ebd-6e10-4113-938c-bb55550710f5,Spice <> Capriotti's - Sep / Oct,promotion,2025-09-18,None,N/A,,d1d0b263-4918-4c81-8c97-630471e7185b,10% Happy Hour Discount - Medium Price Sensitivity,day,all,Order Discount,% Off,10.0%,25.00,USD,NE Cookingham Dr,23035356,2,68.02,6.81,0.00,0.00,1.98,-0.00,-0.00,34.01,4.40,7.74,0,2,0,2,0,2,0,2
2025-10-11,77e23ebd-6e10-4113-938c-bb55550710f5,Spice <> Capriotti's - Sep / Oct,promotion,2025-09-18,None,N/A,,f06f33c5-bff5-4bb3-8dda-6cedeb2e6fc1,10% Happy hour Discount - Min $30 | Low Price Sensitivity,day,all,Order Discount,% Off,7.0%,30.00,USD,Smithtown Bypass,23349427,0,0.00,0.00,0.00,0.00,0.00,-0.00,-0.00,0.00,0.00,0.00,0,0,0,0,0,0,0,0
2025-10-11,77e23ebd-6e10-4113-938c-bb55550710f5,Spice <> Capriotti's - Sep / Oct,promotion,2025-09-18,None,N/A,,f06f33c5-bff5-4bb3-8dda-6cedeb2e6fc1,10% Happy hour Discount - Min $30 | Low Price Sensitivity,day,all,Order Discount,% Off,7.0%,30.00,USD,"Marlton, NJ",35211042,2,94.80,6.64,0.00,0.00,1.98,-0.00,-0.00,47.40,4.31,11.00,2,0,0,2,1,0,0,1
2025-10-11,77e23ebd-6e10-4113-938c-bb55550710f5,Spice <> Capriotti's - Sep / Oct,promotion,2025-09-18,None,N/A,,f06f33c5-bff5-4bb3-8dda-6cedeb2e6fc1,10% Happy hour Discount - Min $30 | Low Price Sensitivity,day,all,Order Discount,% Off,7.0%,30.00,USD,Happy Valley,23584856,0,0.00,0.00,0.00,0.00,0.00,-0.00,-0.00,0.00,0.00,0.00,0,0,0,0,0,0,0,0
2025-10-11,77e23ebd-6e10-4113-938c-bb55550710f5,Spice <> Capriotti's - Sep / Oct,promotion,2025-09-18,None,N/A,,ba37e4d8-36c4-4cbe-8c7d-f4d1379109bd,"Spend $15, Save $3 | Low price Sensitivity",day,all,Order Discount,$ Off,3.00,15.00,USD,University Ave,1084955,3,75.92,9.00,0.00,0.00,2.97,-0.00,-0.00,25.31,3.99,6.34,0,3,0,3,0,2,0,2
2025-10-11,77e23ebd-6e10-4113-938c-bb55550710f5,Spice <> Capriotti's - Sep / Oct,promotion,2025-09-18,None,N/A,,d1d0b263-4918-4c81-8c97-630471e7185b,10% Happy Hour Discount - Medium Price Sensitivity,day,all,Order Discount,% Off,10.0%,25.00,USD,Park Road Center,27677423,1,28.49,2.85,0.00,0.00,0.99,-0.00,-0.00,28.49,3.84,7.42,0,1,0,1,0,1,0,1
2025-10-11,77e23ebd-6e10-4113-938c-bb55550710f5,Spice <> Capriotti's - Sep / Oct,promotion,2025-09-18,None,N/A,,ba37e4d8-36c4-4cbe-8c7d-f4d1379109bd,"Spend $15, Save $3 | Low price Sensitivity",day,all,Order Discount,$ Off,3.00,15.00,USD,Smithtown Bypass,23349427,1,22.28,3.00,0.00,0.00,0.99,-0.00,-0.00,22.28,3.99,5.58,0,1,0,1,0,1,0,1
2025-10-11,02d2c45e-5b6f-4058-b05d-1fbcb475312e,"First order, 20% off 04/09/2025",promotion,2025-04-09,None,N/A,,,,,,,$ Off,0.00,0.00,USD,Moreno Beach Drive,23085788,0,0.00,0.00,0.00,0.00,0.00,-0.00,-0.00,0.00,0.00,0.00,0,0,0,0,0,0,0,0
2025-10-11,77e23ebd-6e10-4113-938c-bb55550710f5,Spice <> Capriotti's - Sep / Oct,promotion,2025-09-18,None,N/A,,d1d0b263-4918-4c81-8c97-630471e7185b,10% Happy Hour Discount - Medium Price Sensitivity,day,all,Order Discount,% Off,10.0%,25.00,USD,Hwy 72 - Madison,27685318,1,31.27,3.13,0.00,0.00,0.99,-0.00,-0.00,31.27,4.12,7.59,0,0,1,1,0,0,0,0
2025-10-11,77e23ebd-6e10-4113-938c-bb55550710f5,Spice <> Capriotti's - Sep / Oct,promotion,2025-09-18,None,N/A,,d1d0b263-4918-4c81-8c97-630471e7185b,10% Happy Hour Discount - Medium Price Sensitivity,day,all,Order Discount,% Off,10.0%,25.00,USD,Meadows - Reno,705841,0,0.00,0.00,0.00,0.00,0.00,-0.00,-0.00,0.00,0.00,0.00,0,0,0,0,0,0,0,0
2025-10-11,bf29a390-e14d-4578-af85-d658942a738b,Loyalty Promo - Capriotti's Sandwich Shop (bus id: 768909),promotion,2024-04-26,2034-04-26,N/A,,,,,,,$ Off,0.00,0.00,USD,"Capriotti's of Milford, LLC",1636430,2,60.36,10.00,0.00,0.00,0.00,-0.00,-0.00,30.18,5.00,6.04,0,2,0,2,0,2,0,2
2025-10-11,77e23ebd-6e10-4113-938c-bb55550710f5,Spice <> Capriotti's - Sep / Oct,promotion,2025-09-18,None,N/A,,d1d0b263-4918-4c81-8c97-630471e7185b,10% Happy Hour Discount - Medium Price Sensitivity,day,all,Order Discount,% Off,10.0%,25.00,USD,17th St Ammon,24968543,2,83.13,8.32,0.00,0.00,1.98,-0.00,-0.00,41.57,5.15,8.07,0,2,0,2,0,1,0,1
2025-10-11,02d2c45e-5b6f-4058-b05d-1fbcb475312e,"First order, 20% off 04/09/2025",promotion,2025-04-09,None,N/A,,,,,,,$ Off,0.00,0.00,USD,Horizon Ridge,75753,2,50.35,8.12,0.00,0.00,1.98,-0.00,-0.00,25.18,5.05,4.99,2,0,0,2,2,0,0,2
2025-10-11,02d2c45e-5b6f-4058-b05d-1fbcb475312e,"First order, 20% off 04/09/2025",promotion,2025-04-09,None,N/A,,,,,,,$ Off,0.00,0.00,USD,Palm Ave - Fresno,1581092,7,218.24,32.54,0.00,0.00,6.93,-0.00,-0.00,31.18,5.64,5.53,7,0,0,7,5,0,0,5
2025-10-11,14ad5a9c-e239-4129-b8dc-5284d46f80da,Spend $30 get 20% off 10/08/2025,promotion,2025-10-08,2025-11-08,N/A,,,,,,,$ Off,0.00,0.00,USD,Cortez Rd  West,26034424,11,547.04,91.50,0.00,0.00,10.89,-0.00,-0.00,49.73,9.31,5.34,4,7,0,11,3,6,0,9
2025-10-11,2c07ba1b-ffe7-48b6-b99f-17555cbc8290,Lunch specials item discount 07/25/2025,promotion,2025-07-25,None,N/A,,,,,,,$ Off,0.00,0.00,USD,Southern Highlands,1750142,1,29.98,1.08,0.00,0.00,0.00,-0.00,-0.00,29.98,1.08,27.76,0,1,0,1,0,0,0,0
2025-10-11,02d2c45e-5b6f-4058-b05d-1fbcb475312e,"First order, 20% off 04/09/2025",promotion,2025-04-09,None,N/A,,,,,,,$ Off,0.00,0.00,USD,West Craig Road,75727,3,83.10,13.44,0.00,0.00,2.97,-0.00,-0.00,27.70,5.47,5.06,3,0,0,3,1,0,0,1
2025-10-11,02d2c45e-5b6f-4058-b05d-1fbcb475312e,"First order, 20% off 04/09/2025",promotion,2025-04-09,None,N/A,,,,,,,$ Off,0.00,0.00,USD,College Station,23349412,2,41.98,8.12,0.00,0.00,1.98,-0.00,-0.00,20.99,5.05,4.16,2,0,0,2,2,0,0,2
2025-10-11,425a2568-d931-4baa-8593-d268f8a0c259,Happy Hour discount is 30% OFF,promotion,2025-01-24,None,Daily,28.57,,,,,,$ Off,0.00,0.00,USD,Old Town,27964,2,59.95,12.04,0.00,0.00,1.98,-0.00,-0.00,29.98,7.01,4.28,1,0,1,2,0,0,1,1
2025-10-11,bb58e40c-0a14-4e1f-bb4a-73209746887e,Spend $35 get 20% off 02/17/2025,promotion,2025-02-17,None,N/A,,,,,,,$ Off,0.00,0.00,USD,Cranberry Township,24851842,1,73.34,11.00,0.00,0.00,0.99,-0.00,-0.00,73.34,11.99,6.12,0,0,1,1,0,0,1,1
2025-10-11,02d2c45e-5b6f-4058-b05d-1fbcb475312e,"First order, 20% off 04/09/2025",promotion,2025-04-09,None,N/A,,,,,,,$ Off,0.00,0.00,USD,Sierra Hwy,27476315,0,0.00,0.00,0.00,0.00,0.00,-0.00,-0.00,0.00,0.00,0.00,0,0,0,0,0,0,0,0
2025-10-11,02d2c45e-5b6f-4058-b05d-1fbcb475312e,"First order, 20% off 04/09/2025",promotion,2025-04-09,None,N/A,,,,,,,$ Off,0.00,0.00,USD,Byers Dr,23186665,2,50.37,8.60,0.00,0.00,1.98,-0.00,-0.00,25.19,5.29,4.76,2,0,0,2,0,0,0,0
2025-10-11,77e23ebd-6e10-4113-938c-bb55550710f5,Spice <> Capriotti's - Sep / Oct,promotion,2025-09-18,None,N/A,,,,day,,,$ Off,0.00,0.00,USD,Catclaw - Abilene,29652227,0,0.00,0.00,0.00,0.00,0.00,-0.00,-0.00,0.00,0.00,0.00,0,0,0,0,0,0,0,0
2025-10-11,02d2c45e-5b6f-4058-b05d-1fbcb475312e,"First order, 20% off 04/09/2025",promotion,2025-04-09,None,N/A,,,,,,,$ Off,0.00,0.00,USD,De Soto-Chatsworth,651597,0,0.00,0.00,0.00,0.00,0.00,-0.00,-0.00,0.00,0.00,0.00,0,0,0,0,0,0,0,0
2025-10-11,02d2c45e-5b6f-4058-b05d-1fbcb475312e,"First order, 20% off 04/09/2025",promotion,2025-04-09,None,N/A,,,,,,,$ Off,0.00,0.00,USD,South Sandhill Rd,75741,0,0.00,0.00,0.00,0.00,0.00,-0.00,-0.00,0.00,0.00,0.00,0,0,0,0,0,0,0,0
2025-10-11,02d2c45e-5b6f-4058-b05d-1fbcb475312e,"First order, 20% off 04/09/2025",promotion,2025-04-09,None,N/A,,,,,,,$ Off,0.00,0.00,USD,International Pkwy,24671402,1,36.08,5.00,0.00,0.00,0.99,-0.00,-0.00,36.08,5.99,6.02,1,0,0,1,1,0,0,1
2025-10-11,77e23ebd-6e10-4113-938c-bb55550710f5,Spice <> Capriotti's - Sep / Oct,promotion,2025-09-18,None,N/A,,d1d0b263-4918-4c81-8c97-630471e7185b,10% Happy Hour Discount - Medium Price Sensitivity,day,all,Order Discount,% Off,10.0%,25.00,USD,North Haven Ave,28834163,1,36.58,3.66,0.00,0.00,0.99,-0.00,-0.00,36.58,4.65,7.87,0,1,0,1,0,1,0,1
2025-10-11,02d2c45e-5b6f-4058-b05d-1fbcb475312e,"First order, 20% off 04/09/2025",promotion,2025-04-09,None,N/A,,,,,,,$ Off,0.00,0.00,USD,Highlands Ranch,1791292,1,16.29,3.26,0.00,0.00,0.99,-0.00,-0.00,16.29,4.25,3.83,1,0,0,1,1,0,0,1
2025-10-11,02d2c45e-5b6f-4058-b05d-1fbcb475312e,"First order, 20% off 04/09/2025",promotion,2025-04-09,None,N/A,,,,,,,$ Off,0.00,0.00,USD,Overland Park,24110474,4,94.92,16.99,0.00,0.00,3.96,-0.00,-0.00,23.73,5.24,4.53,4,0,0,4,3,0,0,3
2025-10-11,dd85331b-3d89-4ea9-af73-88a1fb0e8003,Spend $20 Get $5 Off,promotion,2022-06-20,None,N/A,,,,,,,$ Off,0.00,0.00,USD,Millsboro Plaza,23360934,16,660.67,80.00,0.00,0.00,15.84,-0.00,-0.00,41.29,5.99,6.89,0,12,4,16,0,10,2,12
2025-10-11,02d2c45e-5b6f-4058-b05d-1fbcb475312e,"First order, 20% off 04/09/2025",promotion,2025-04-09,None,N/A,,,,,,,$ Off,0.00,0.00,USD,W Blue Diamond Rd,75738,2,39.47,7.90,0.00,0.00,1.98,-0.00,-0.00,19.74,4.94,3.99,2,0,0,2,0,0,0,0
2025-10-11,02d2c45e-5b6f-4058-b05d-1fbcb475312e,"First order, 20% off 04/09/2025",promotion,2025-04-09,None,N/A,,,,,,,$ Off,0.00,0.00,USD,Old Town,27964,4,119.94,18.12,0.00,0.00,3.96,-0.00,-0.00,29.99,5.52,5.43,4,0,0,4,0,0,0,0
2025-10-11,02d2c45e-5b6f-4058-b05d-1fbcb475312e,"First order, 20% off 04/09/2025",promotion,2025-04-09,None,N/A,,,,,,,$ Off,0.00,0.00,USD,Jennersville Rd,433075,3,133.68,15.00,0.00,0.00,2.97,-0.00,-0.00,44.56,5.99,7.44,3,0,0,3,2,0,0,2
2025-10-11,02d2c45e-5b6f-4058-b05d-1fbcb475312e,"First order, 20% off 04/09/2025",promotion,2025-04-09,None,N/A,,,,,,,$ Off,0.00,0.00,USD,Maryland Pkwy,1007892,1,15.59,3.12,0.00,0.00,0.99,-0.00,-0.00,15.59,4.11,3.79,1,0,0,1,1,0,0,1
2025-10-11,02d2c45e-5b6f-4058-b05d-1fbcb475312e,"First order, 20% off 04/09/2025",promotion,2025-04-09,None,N/A,,,,,,,$ Off,0.00,0.00,USD,Southern Highlands,1750142,1,51.80,5.00,0.00,0.00,0.99,-0.00,-0.00,51.80,5.99,8.65,1,0,0,1,0,0,0,0
2025-10-11,77e23ebd-6e10-4113-938c-bb55550710f5,Spice <> Capriotti's - Sep / Oct,promotion,2025-09-18,None,N/A,,d1d0b263-4918-4c81-8c97-630471e7185b,10% Happy Hour Discount - Medium Price Sensitivity,day,all,Order Discount,% Off,10.0%,25.00,USD,Downtown Summerlin,75736,2,106.89,9.89,0.00,0.00,1.98,-0.00,-0.00,53.45,5.94,9.01,0,2,0,2,0,2,0,2
2025-10-11,02d2c45e-5b6f-4058-b05d-1fbcb475312e,"First order, 20% off 04/09/2025",promotion,2025-04-09,None,N/A,,,,,,,$ Off,0.00,0.00,USD,Nature Park Drive,75726,3,72.13,12.15,0.00,0.00,2.97,-0.00,-0.00,24.04,5.04,4.77,3,0,0,3,1,0,0,1
2025-10-11,02d2c45e-5b6f-4058-b05d-1fbcb475312e,"First order, 20% off 04/09/2025",promotion,2025-04-09,None,N/A,,,,,,,$ Off,0.00,0.00,USD,State and 6100 S,2608908,1,18.38,3.68,0.00,0.00,0.99,-0.00,-0.00,18.38,4.67,3.94,1,0,0,1,1,0,0,1
2025-10-11,6f71233a-4f7b-43f5-b70b-89dc41af1fd0,Late night 5 off 25,promotion,2025-01-17,None,N/A,,,,,,,$ Off,0.00,0.00,USD,Cheyenne and 215,388423,0,0.00,0.00,0.00,0.00,0.00,-0.00,-0.00,0.00,0.00,0.00,0,0,0,0,0,0,0,0
2025-10-11,02d2c45e-5b6f-4058-b05d-1fbcb475312e,"First order, 20% off 04/09/2025",promotion,2025-04-09,None,N/A,,,,,,,$ Off,0.00,0.00,USD,Cortez Rd  West,26034424,0,0.00,0.00,0.00,0.00,0.00,-0.00,-0.00,0.00,0.00,0.00,0,0,0,0,0,0,0,0
2025-10-11,02d2c45e-5b6f-4058-b05d-1fbcb475312e,"First order, 20% off 04/09/2025",promotion,2025-04-09,None,N/A,,,,,,,$ Off,0.00,0.00,USD,Murrieta Hot Springs Rd,29652192,6,212.05,28.00,0.00,0.00,5.94,-0.00,-0.00,35.34,5.66,6.25,6,0,0,6,4,0,0,4
2025-10-11,02d2c45e-5b6f-4058-b05d-1fbcb475312e,"First order, 20% off 04/09/2025",promotion,2025-04-09,None,N/A,,,,,,,$ Off,0.00,0.00,USD,E Robindale Road,27815740,3,100.51,13.12,0.00,0.00,2.97,-0.00,-0.00,33.50,5.36,6.25,3,0,0,3,1,0,0,1
2025-10-11,77e23ebd-6e10-4113-938c-bb55550710f5,Spice <> Capriotti's - Sep / Oct,promotion,2025-09-18,None,N/A,,ba37e4d8-36c4-4cbe-8c7d-f4d1379109bd,"Spend $15, Save $3 | Low price Sensitivity",day,all,Order Discount,$ Off,3.00,15.00,USD,East Market Street,23256727,0,0.00,0.00,0.00,0.00,0.00,-0.00,-0.00,0.00,0.00,0.00,0,0,0,0,0,0,0,0
2025-10-11,02d2c45e-5b6f-4058-b05d-1fbcb475312e,"First order, 20% off 04/09/2025",promotion,2025-04-09,None,N/A,,,,,,,$ Off,0.00,0.00,USD,Oso Blanca Rd,178087,4,131.89,20.00,0.00,0.00,3.96,-0.00,-0.00,32.97,5.99,5.50,4,0,0,4,1,0,0,1
2025-10-11,77e23ebd-6e10-4113-938c-bb55550710f5,Spice <> Capriotti's - Sep / Oct,promotion,2025-09-18,None,N/A,,f06f33c5-bff5-4bb3-8dda-6cedeb2e6fc1,10% Happy hour Discount - Min $30 | Low Price Sensitivity,day,all,Order Discount,% Off,7.0%,30.00,USD,University Dr,29894178,0,0.00,0.00,0.00,0.00,0.00,-0.00,-0.00,0.00,0.00,0.00,0,0,0,0,0,0,0,0
2025-10-11,02d2c45e-5b6f-4058-b05d-1fbcb475312e,"First order, 20% off 04/09/2025",promotion,2025-04-09,None,N/A,,,,,,,$ Off,0.00,0.00,USD,Governor Ritchie,24121153,4,127.36,19.08,0.00,0.00,3.96,-0.00,-0.00,31.84,5.76,5.53,4,0,0,4,2,0,0,2
2025-10-11,2bb77af0-6b48-46d5-97b3-e43758ea5314,"First order, 20% off 02/01/2025",promotion,2025-02-01,None,N/A,,,,,,,$ Off,0.00,0.00,USD,De Soto-Chatsworth,651597,0,0.00,0.00,0.00,0.00,0.00,-0.00,-0.00,0.00,0.00,0.00,0,0,0,0,0,0,0,0
2025-10-11,02d2c45e-5b6f-4058-b05d-1fbcb475312e,"First order, 20% off 04/09/2025",promotion,2025-04-09,None,N/A,,,,,,,$ Off,0.00,0.00,USD,West Cheyenne Ave,75722,1,18.48,3.70,0.00,0.00,0.99,-0.00,-0.00,18.48,4.69,3.94,1,0,0,1,0,0,0,0
2025-10-11,02d2c45e-5b6f-4058-b05d-1fbcb475312e,"First order, 20% off 04/09/2025",promotion,2025-04-09,None,N/A,,,,,,,$ Off,0.00,0.00,USD,East Sepulveda,1743753,0,0.00,0.00,0.00,0.00,0.00,-0.00,-0.00,0.00,0.00,0.00,0,0,0,0,0,0,0,0
2025-10-11,77e23ebd-6e10-4113-938c-bb55550710f5,Spice <> Capriotti's - Sep / Oct,promotion,2025-09-18,None,N/A,,ba37e4d8-36c4-4cbe-8c7d-f4d1379109bd,"Spend $15, Save $3 | Low price Sensitivity",day,all,Order Discount,$ Off,3.00,15.00,USD,International Pkwy,24671402,0,0.00,0.00,0.00,0.00,0.00,-0.00,-0.00,0.00,0.00,0.00,0,0,0,0,0,0,0,0
2025-10-11,02d2c45e-5b6f-4058-b05d-1fbcb475312e,"First order, 20% off 04/09/2025",promotion,2025-04-09,None,N/A,,,,,,,$ Off,0.00,0.00,USD,Sumneytown Pike,24717004,3,88.91,14.08,0.00,0.00,2.97,-0.00,-0.00,29.64,5.68,5.21,3,0,0,3,0,0,0,0
2025-10-11,02d2c45e-5b6f-4058-b05d-1fbcb475312e,"First order, 20% off 04/09/2025",promotion,2025-04-09,None,N/A,,,,,,,$ Off,0.00,0.00,USD,Kent Island,691089,2,124.61,10.00,0.00,0.00,1.98,-0.00,-0.00,62.31,5.99,10.40,2,0,0,2,1,0,0,1
2025-10-11,77e23ebd-6e10-4113-938c-bb55550710f5,Spice <> Capriotti's - Sep / Oct,promotion,2025-09-18,None,N/A,,91f90d8c-8a7d-41cf-9b6a-888400112024,10% Happy Hour Discount - Min  $25 | High Price Sensitivity,day,all,Order Discount,% Off,10.0%,25.00,USD,Catclaw - Abilene,29652227,3,123.22,11.95,0.00,0.00,2.97,-0.00,-0.00,41.07,4.97,8.26,1,2,0,3,0,1,0,1
2025-10-11,02d2c45e-5b6f-4058-b05d-1fbcb475312e,"First order, 20% off 04/09/2025",promotion,2025-04-09,None,N/A,,,,,,,$ Off,0.00,0.00,USD,S Stanford Way,699470,2,54.76,10.00,0.00,0.00,1.98,-0.00,-0.00,27.38,5.99,4.57,2,0,0,2,0,0,0,0
2025-10-11,22a1aa22-01b8-4784-a262-c64e4855ebce,"Dormant customers, 20% off 07/31/2024",promotion,2024-07-31,None,N/A,,,,,,,$ Off,0.00,0.00,USD,The Old Road,24898774,0,0.00,0.00,0.00,0.00,0.00,-0.00,-0.00,0.00,0.00,0.00,0,0,0,0,0,0,0,0
2025-10-11,77e23ebd-6e10-4113-938c-bb55550710f5,Spice <> Capriotti's - Sep / Oct,promotion,2025-09-18,None,N/A,,ba37e4d8-36c4-4cbe-8c7d-f4d1379109bd,"Spend $15, Save $3 | Low price Sensitivity",day,all,Order Discount,$ Off,3.00,15.00,USD,Nevada Way,75754,0,0.00,0.00,0.00,0.00,0.00,-0.00,-0.00,0.00,0.00,0.00,0,0,0,0,0,0,0,0
2025-10-11,77e23ebd-6e10-4113-938c-bb55550710f5,Spice <> Capriotti's - Sep / Oct,promotion,2025-09-18,None,N/A,,,,day,,,$ Off,0.00,0.00,USD,Townpark Lane,128721,0,0.00,0.00,0.00,0.00,0.00,-0.00,-0.00,0.00,0.00,0.00,0,0,0,0,0,0,0,0
2025-10-11,02d2c45e-5b6f-4058-b05d-1fbcb475312e,"First order, 20% off 04/09/2025",promotion,2025-04-09,None,N/A,,,,,,,$ Off,0.00,0.00,USD,Silverside Road,691182,5,190.15,22.65,0.00,0.00,4.95,-0.00,-0.00,38.03,5.52,6.89,5,0,0,5,3,0,0,3
2025-10-11,1ca9d76f-7d83-41a6-b2a6-7ea37cf348bb,Happy Hour Item Discount 09/22/2025,promotion,2025-09-22,None,N/A,,,,,,,$ Off,0.00,0.00,USD,International Pkwy,24671402,0,0.00,0.00,0.00,0.00,0.00,-0.00,-0.00,0.00,0.00,0.00,0,0,0,0,0,0,0,0
2025-10-11,02d2c45e-5b6f-4058-b05d-1fbcb475312e,"First order, 20% off 04/09/2025",promotion,2025-04-09,None,N/A,,,,,,,$ Off,0.00,0.00,USD,West Avera Dr,1742446,4,110.14,17.48,0.00,0.00,3.96,-0.00,-0.00,27.54,5.36,5.14,4,0,0,4,2,0,0,2
2025-10-11,02d2c45e-5b6f-4058-b05d-1fbcb475312e,"First order, 20% off 04/09/2025",promotion,2025-04-09,None,N/A,,,,,,,$ Off,0.00,0.00,USD,St Rose Pkwy,1335286,2,58.77,10.00,0.00,0.00,1.98,-0.00,-0.00,29.39,5.99,4.91,2,0,0,2,0,0,0,0
2025-10-11,ef08edf0-aabc-406a-bdf8-30534f44839a,Lunch specials item discount 09/25/2025,promotion,2025-09-25,2025-10-26,N/A,,,,,,,$ Off,0.00,0.00,USD,Raccoon Rd,26015022,1,12.49,3.75,0.00,0.00,0.00,-0.00,-0.00,12.49,3.75,3.33,0,1,0,1,0,1,0,1
2025-10-11,77e23ebd-6e10-4113-938c-bb55550710f5,Spice <> Capriotti's - Sep / Oct,promotion,2025-09-18,None,N/A,,f06f33c5-bff5-4bb3-8dda-6cedeb2e6fc1,10% Happy hour Discount - Min $30 | Low Price Sensitivity,day,all,Order Discount,% Off,7.0%,30.00,USD,Mountain View,2608887,1,61.65,4.32,0.00,0.00,0.99,-0.00,-0.00,61.65,5.31,11.61,0,1,0,1,0,0,0,0
2025-10-11,77e23ebd-6e10-4113-938c-bb55550710f5,Spice <> Capriotti's - Sep / Oct,promotion,2025-09-18,None,N/A,,,,day,,,$ Off,0.00,0.00,USD,Limonite Ave,2375675,0,0.00,0.00,0.00,0.00,0.00,-0.00,-0.00,0.00,0.00,0.00,0,0,0,0,0,0,0,0
2025-10-11,7b3c5d68-2d5c-4d2d-b0b1-a1fb4346169d,Spend $20 Get $5 Off,promotion,2023-02-01,None,N/A,,,,,,,$ Off,0.00,0.00,USD,Gambrills,24415514,16,609.42,80.00,0.00,0.00,15.84,-0.00,-0.00,38.09,5.99,6.36,3,11,2,16,1,7,1,9
2025-10-11,02d2c45e-5b6f-4058-b05d-1fbcb475312e,"First order, 20% off 04/09/2025",promotion,2025-04-09,None,N/A,,,,,,,$ Off,0.00,0.00,USD,Terrace Center,321047,2,74.44,10.00,0.00,0.00,1.98,-0.00,-0.00,37.22,5.99,6.21,2,0,0,2,0,0,0,0
2025-10-11,02d2c45e-5b6f-4058-b05d-1fbcb475312e,"First order, 20% off 04/09/2025",promotion,2025-04-09,None,N/A,,,,,,,$ Off,0.00,0.00,USD,Gambrills,24415514,1,16.78,3.36,0.00,0.00,0.99,-0.00,-0.00,16.78,4.35,3.86,1,0,0,1,1,0,0,1
2025-10-11,77e23ebd-6e10-4113-938c-bb55550710f5,Spice <> Capriotti's - Sep / Oct,promotion,2025-09-18,None,N/A,,d1d0b263-4918-4c81-8c97-630471e7185b,10% Happy Hour Discount - Medium Price Sensitivity,day,all,Order Discount,% Off,10.0%,25.00,USD,Grand Ave-Portland,1370229,0,0.00,0.00,0.00,0.00,0.00,-0.00,-0.00,0.00,0.00,0.00,0,0,0,0,0,0,0,0
2025-10-11,77e23ebd-6e10-4113-938c-bb55550710f5,Spice <> Capriotti's - Sep / Oct,promotion,2025-09-18,None,N/A,,f06f33c5-bff5-4bb3-8dda-6cedeb2e6fc1,10% Happy hour Discount - Min $30 | Low Price Sensitivity,day,all,Order Discount,% Off,7.0%,30.00,USD,Sumneytown Pike,24717004,0,0.00,0.00,0.00,0.00,0.00,-0.00,-0.00,0.00,0.00,0.00,0,0,0,0,0,0,0,0
2025-10-11,77e23ebd-6e10-4113-938c-bb55550710f5,Spice <> Capriotti's - Sep / Oct,promotion,2025-09-18,None,N/A,,ba37e4d8-36c4-4cbe-8c7d-f4d1379109bd,"Spend $15, Save $3 | Low price Sensitivity",day,all,Order Discount,$ Off,3.00,15.00,USD,"Marlton, NJ",35211042,1,17.28,3.00,0.00,0.00,0.99,-0.00,-0.00,17.28,3.99,4.33,0,1,0,1,0,0,0,0
2025-10-11,77e23ebd-6e10-4113-938c-bb55550710f5,Spice <> Capriotti's - Sep / Oct,promotion,2025-09-18,None,N/A,,d1d0b263-4918-4c81-8c97-630471e7185b,10% Happy Hour Discount - Medium Price Sensitivity,day,all,Order Discount,% Off,10.0%,25.00,USD,S Marion Road,1742411,1,39.96,4.00,0.00,0.00,0.99,-0.00,-0.00,39.96,4.99,8.01,0,0,1,1,0,0,0,0
2025-10-11,02d2c45e-5b6f-4058-b05d-1fbcb475312e,"First order, 20% off 04/09/2025",promotion,2025-04-09,None,N/A,,,,,,,$ Off,0.00,0.00,USD,Paradise Road,75734,2,88.32,10.00,0.00,0.00,1.98,-0.00,-0.00,44.16,5.99,7.37,2,0,0,2,1,0,0,1
2025-10-11,b1b17c93-8403-4c3e-a886-f72875e9d017,Spend $25 get $5 off 07/31/2024,promotion,2024-07-31,None,N/A,,,,,,,$ Off,0.00,0.00,USD,East Sepulveda,1743753,8,273.20,40.00,0.00,0.00,7.92,-0.00,-0.00,34.15,5.99,5.70,1,7,0,8,1,3,0,4
2025-10-11,77e23ebd-6e10-4113-938c-bb55550710f5,Spice <> Capriotti's - Sep / Oct,promotion,2025-09-18,None,N/A,,43340528-e1b7-4f95-ab40-8dc92bf9c274,"Spend $35, Save $6 | High Price Sensitivity",day,all,Order Discount,$ Off,6.00,35.00,USD,"Capriotti's of Dover, Inc.",1617804,0,0.00,0.00,0.00,0.00,0.00,-0.00,-0.00,0.00,0.00,0.00,0,0,0,0,0,0,0,0
2025-10-11,77e23ebd-6e10-4113-938c-bb55550710f5,Spice <> Capriotti's - Sep / Oct,promotion,2025-09-18,None,N/A,,d1d0b263-4918-4c81-8c97-630471e7185b,10% Happy Hour Discount - Medium Price Sensitivity,day,all,Order Discount,% Off,10.0%,25.00,USD,WVC High Market,2608935,0,0.00,0.00,0.00,0.00,0.00,-0.00,-0.00,0.00,0.00,0.00,0,0,0,0,0,0,0,0
2025-10-11,f12a26e0-24e1-4d8e-ac05-d7e43f06d2bf,Happy Hour discount 11/12/2024,promotion,2024-11-12,None,N/A,,,,,,,$ Off,0.00,0.00,USD,Heart Pine-Odessa,2232632,4,96.72,24.80,0.00,0.00,3.96,-0.00,-0.00,24.18,7.19,3.36,0,4,0,4,0,4,0,4
2025-10-11,02d2c45e-5b6f-4058-b05d-1fbcb475312e,"First order, 20% off 04/09/2025",promotion,2025-04-09,None,N/A,,,,,,,$ Off,0.00,0.00,USD,S Fort Apache,75730,4,166.76,18.08,0.00,0.00,3.96,-0.00,-0.00,41.69,5.51,7.57,4,0,0,4,4,0,0,4
2025-10-11,77e23ebd-6e10-4113-938c-bb55550710f5,Spice <> Capriotti's - Sep / Oct,promotion,2025-09-18,None,N/A,,ba37e4d8-36c4-4cbe-8c7d-f4d1379109bd,"Spend $15, Save $3 | Low price Sensitivity",day,all,Order Discount,$ Off,3.00,15.00,USD,Kent Island,691089,4,150.76,12.00,0.00,0.00,3.96,-0.00,-0.00,37.69,3.99,9.45,0,4,0,4,0,2,0,2
2025-10-11,77e23ebd-6e10-4113-938c-bb55550710f5,Spice <> Capriotti's - Sep / Oct,promotion,2025-09-18,None,N/A,,d1d0b263-4918-4c81-8c97-630471e7185b,10% Happy Hour Discount - Medium Price Sensitivity,day,all,Order Discount,% Off,10.0%,25.00,USD,South Eastern Ave,75744,0,0.00,0.00,0.00,0.00,0.00,-0.00,-0.00,0.00,0.00,0.00,0,0,0,0,0,0,0,0
2025-10-11,02d2c45e-5b6f-4058-b05d-1fbcb475312e,"First order, 20% off 04/09/2025",promotion,2025-04-09,None,N/A,,,,,,,$ Off,0.00,0.00,USD,San Luis Obispo,23900701,1,22.28,4.46,0.00,0.00,0.99,-0.00,-0.00,22.28,5.45,4.09,1,0,0,1,1,0,0,1
2025-10-11,77e23ebd-6e10-4113-938c-bb55550710f5,Spice <> Capriotti's - Sep / Oct,promotion,2025-09-18,None,N/A,,,,day,,,$ Off,0.00,0.00,USD,University Dr,29894178,0,0.00,0.00,0.00,0.00,0.00,-0.00,-0.00,0.00,0.00,0.00,0,0,0,0,0,0,0,0
2025-10-11,77e23ebd-6e10-4113-938c-bb55550710f5,Spice <> Capriotti's - Sep / Oct,promotion,2025-09-18,None,N/A,,,,day,,,$ Off,0.00,0.00,USD,Concord Pike,23151390,0,0.00,0.00,0.00,0.00,0.00,-0.00,-0.00,0.00,0.00,0.00,0,0,0,0,0,0,0,0
2025-10-11,bf29a390-e14d-4578-af85-d658942a738b,Loyalty Promo - Capriotti's Sandwich Shop (bus id: 768909),promotion,2024-04-26,2034-04-26,N/A,,,,,,,$ Off,0.00,0.00,USD,"Capriotti's of Dover, Inc.",1617804,0,0.00,0.00,0.00,0.00,0.00,-0.00,-0.00,0.00,0.00,0.00,0,0,0,0,0,0,0,0
2025-10-11,178f54dc-804b-413e-b1bd-ffbdde7f61a1,"Dormant customers, 20% off 02/01/2025",promotion,2025-02-01,None,N/A,,,,,,,$ Off,0.00,0.00,USD,The Old Road,24898774,0,0.00,0.00,0.00,0.00,0.00,-0.00,-0.00,0.00,0.00,0.00,0,0,0,0,0,0,0,0
2025-10-11,83157f11-58f6-496d-bef9-af8b72eb8cf4,"Buy 1, get 1 free promotion 07/21/2025",promotion,2025-07-22,None,N/A,,,,,,,$ Off,0.00,0.00,USD,Chicago River West,34048823,3,128.66,20.66,0.00,0.00,2.97,-0.00,-0.00,42.89,7.88,5.44,2,0,1,3,2,0,1,3
2025-10-11,02d2c45e-5b6f-4058-b05d-1fbcb475312e,"First order, 20% off 04/09/2025",promotion,2025-04-09,None,N/A,,,,,,,$ Off,0.00,0.00,USD,E William Street,1053361,1,15.59,3.12,0.00,0.00,0.99,-0.00,-0.00,15.59,4.11,3.79,1,0,0,1,0,0,0,0
2025-10-11,ff18ac99-74db-48ce-9c94-2959c91b6665,Capriotti's Sandwich Shop's Promo Campaign,promotion,2025-10-02,None,N/A,,348d5036-ec24-4cbc-aaf8-9cd8d2a19433,Spend $15 - Save $3,day,all,Order Discount,$ Off,3.00,15.00,USD,Waialae Ave,25380836,3,121.30,9.00,0.00,0.00,2.97,-0.00,-0.00,40.43,3.99,10.13,1,2,0,3,1,2,0,3
2025-10-11,02d2c45e-5b6f-4058-b05d-1fbcb475312e,"First order, 20% off 04/09/2025",promotion,2025-04-09,None,N/A,,,,,,,$ Off,0.00,0.00,USD,Pioneer Pkwy,874359,0,0.00,0.00,0.00,0.00,0.00,-0.00,-0.00,0.00,0.00,0.00,0,0,0,0,0,0,0,0
2025-10-11,77e23ebd-6e10-4113-938c-bb55550710f5,Spice <> Capriotti's - Sep / Oct,promotion,2025-09-18,None,N/A,,,,day,,,$ Off,0.00,0.00,USD,Castle Rock,23057614,0,0.00,0.00,0.00,0.00,0.00,-0.00,-0.00,0.00,0.00,0.00,0,0,0,0,0,0,0,0
2025-10-11,ef08edf0-aabc-406a-bdf8-30534f44839a,Lunch specials item discount 09/25/2025,promotion,2025-09-25,2025-10-26,N/A,,,,,,,$ Off,0.00,0.00,USD,Niles Cortland Rd SE,34043935,2,63.32,11.25,0.00,0.00,0.00,-0.00,-0.00,31.66,5.63,5.63,0,2,0,2,0,2,0,2
2025-10-11,77e23ebd-6e10-4113-938c-bb55550710f5,Spice <> Capriotti's - Sep / Oct,promotion,2025-09-18,None,N/A,,,,day,,,$ Off,0.00,0.00,USD,N Broad St,578662,0,0.00,0.00,0.00,0.00,0.00,-0.00,-0.00,0.00,0.00,0.00,0,0,0,0,0,0,0,0
2025-10-11,77e23ebd-6e10-4113-938c-bb55550710f5,Spice <> Capriotti's - Sep / Oct,promotion,2025-09-18,None,N/A,,ba37e4d8-36c4-4cbe-8c7d-f4d1379109bd,"Spend $15, Save $3 | Low price Sensitivity",day,all,Order Discount,$ Off,3.00,15.00,USD,Limonite Ave,2375675,0,0.00,0.00,0.00,0.00,0.00,-0.00,-0.00,0.00,0.00,0.00,0,0,0,0,0,0,0,0
2025-10-11,02d2c45e-5b6f-4058-b05d-1fbcb475312e,"First order, 20% off 04/09/2025",promotion,2025-04-09,None,N/A,,,,,,,$ Off,0.00,0.00,USD,Sunset and Sandhill,32849799,0,0.00,0.00,0.00,0.00,0.00,-0.00,-0.00,0.00,0.00,0.00,0,0,0,0,0,0,0,0
2025-10-11,02d2c45e-5b6f-4058-b05d-1fbcb475312e,"First order, 20% off 04/09/2025",promotion,2025-04-09,None,N/A,,,,,,,$ Off,0.00,0.00,USD,Park Road Center,27677423,3,149.65,15.00,0.00,0.00,2.97,-0.00,-0.00,49.88,5.99,8.33,3,0,0,3,2,0,0,2
2025-10-11,02d2c45e-5b6f-4058-b05d-1fbcb475312e,"First order, 20% off 04/09/2025",promotion,2025-04-09,None,N/A,,,,,,,$ Off,0.00,0.00,USD,East Ridge Pike,1640642,2,50.14,9.32,0.00,0.00,1.98,-0.00,-0.00,25.07,5.65,4.44,2,0,0,2,1,0,0,1
2025-10-11,77e23ebd-6e10-4113-938c-bb55550710f5,Spice <> Capriotti's - Sep / Oct,promotion,2025-09-18,None,N/A,,ba37e4d8-36c4-4cbe-8c7d-f4d1379109bd,"Spend $15, Save $3 | Low price Sensitivity",day,all,Order Discount,$ Off,3.00,15.00,USD,Forest Drive,674540,1,20.97,3.00,0.00,0.00,0.99,-0.00,-0.00,20.97,3.99,5.26,0,1,0,1,0,0,0,0
2025-10-11,4996d114-68d0-483f-963c-d124d822fc8f,"First order, 20% off 11/12/2024",promotion,2024-11-12,None,N/A,,,,,,,$ Off,0.00,0.00,USD,Heart Pine-Odessa,2232632,1,76.92,5.00,0.00,0.00,0.99,-0.00,-0.00,76.92,5.99,12.84,1,0,0,1,1,0,0,1
2025-10-11,77e23ebd-6e10-4113-938c-bb55550710f5,Spice <> Capriotti's - Sep / Oct,promotion,2025-09-18,None,N/A,,f06f33c5-bff5-4bb3-8dda-6cedeb2e6fc1,10% Happy hour Discount - Min $30 | Low Price Sensitivity,day,all,Order Discount,% Off,7.0%,30.00,USD,Townpark Lane,128721,0,0.00,0.00,0.00,0.00,0.00,-0.00,-0.00,0.00,0.00,0.00,0,0,0,0,0,0,0,0
2025-10-11,77e23ebd-6e10-4113-938c-bb55550710f5,Spice <> Capriotti's - Sep / Oct,promotion,2025-09-18,None,N/A,,,,day,,,$ Off,0.00,0.00,USD,Eden Square Ctr,420646,0,0.00,0.00,0.00,0.00,0.00,-0.00,-0.00,0.00,0.00,0.00,0,0,0,0,0,0,0,0
2025-10-11,ff18ac99-74db-48ce-9c94-2959c91b6665,Capriotti's Sandwich Shop's Promo Campaign,promotion,2025-10-02,None,N/A,,,,day,,,$ Off,0.00,0.00,USD,Waialae Ave,25380836,0,0.00,0.00,0.00,0.00,0.00,-0.00,-0.00,0.00,0.00,0.00,0,0,0,0,0,0,0,0
2025-10-11,77e23ebd-6e10-4113-938c-bb55550710f5,Spice <> Capriotti's - Sep / Oct,promotion,2025-09-18,None,N/A,,,,day,,,$ Off,0.00,0.00,USD,College Station,23349412,0,0.00,0.00,0.00,0.00,0.00,-0.00,-0.00,0.00,0.00,0.00,0,0,0,0,0,0,0,0
2025-10-11,1f4f856e-e43b-49d1-95e9-9c3ab42f5144,"Dormant customers, 20% off 09/22/2025",promotion,2025-09-22,None,N/A,,,,,,,$ Off,0.00,0.00,USD,Frisco,34516355,2,88.43,9.46,0.00,0.00,1.98,-0.00,-0.00,44.22,5.72,7.73,0,0,2,2,0,0,2,2
2025-10-10,b1b17c93-8403-4c3e-a886-f72875e9d017,Spend $25 get $5 off 07/31/2024,promotion,2024-07-31,None,N/A,,,,,,,$ Off,0.00,0.00,USD,East Sepulveda,1743753,6,223.33,30.00,0.00,0.00,5.94,-0.00,-0.00,37.22,5.99,6.21,0,5,1,6,0,2,0,2
2025-10-10,77e23ebd-6e10-4113-938c-bb55550710f5,Spice <> Capriotti's - Sep / Oct,promotion,2025-09-18,None,N/A,,f06f33c5-bff5-4bb3-8dda-6cedeb2e6fc1,10% Happy hour Discount - Min $30 | Low Price Sensitivity,day,all,Order Discount,% Off,7.0%,30.00,USD,East Sepulveda,1743753,0,0.00,0.00,0.00,0.00,0.00,-0.00,-0.00,0.00,0.00,0.00,0,0,0,0,0,0,0,0
2025-10-10,77e23ebd-6e10-4113-938c-bb55550710f5,Spice <> Capriotti's - Sep / Oct,promotion,2025-09-18,None,N/A,,,,day,,,$ Off,0.00,0.00,USD,Horizon Ridge,75753,0,0.00,0.00,0.00,0.00,0.00,-0.00,-0.00,0.00,0.00,0.00,0,0,0,0,0,0,0,0
2025-10-10,77e23ebd-6e10-4113-938c-bb55550710f5,Spice <> Capriotti's - Sep / Oct,promotion,2025-09-18,None,N/A,,ba37e4d8-36c4-4cbe-8c7d-f4d1379109bd,"Spend $15, Save $3 | Low price Sensitivity",day,all,Order Discount,$ Off,3.00,15.00,USD,Castle Rock,23057614,0,0.00,0.00,0.00,0.00,0.00,-0.00,-0.00,0.00,0.00,0.00,0,0,0,0,0,0,0,0
2025-10-10,77e23ebd-6e10-4113-938c-bb55550710f5,Spice <> Capriotti's - Sep / Oct,promotion,2025-09-18,None,N/A,,,,day,,,$ Off,0.00,0.00,USD,Catclaw - Abilene,29652227,0,0.00,0.00,0.00,0.00,0.00,-0.00,-0.00,0.00,0.00,0.00,0,0,0,0,0,0,0,0
2025-10-10,77e23ebd-6e10-4113-938c-bb55550710f5,Spice <> Capriotti's - Sep / Oct,promotion,2025-09-18,None,N/A,,,,day,,,$ Off,0.00,0.00,USD,East Sepulveda,1743753,0,0.00,0.00,0.00,0.00,0.00,-0.00,-0.00,0.00,0.00,0.00,0,0,0,0,0,0,0,0
2025-10-10,77e23ebd-6e10-4113-938c-bb55550710f5,Spice <> Capriotti's - Sep / Oct,promotion,2025-09-18,None,N/A,,,,day,,,$ Off,0.00,0.00,USD,South State Rd,1713806,0,0.00,0.00,0.00,0.00,0.00,-0.00,-0.00,0.00,0.00,0.00,0,0,0,0,0,0,0,0
2025-10-10,77e23ebd-6e10-4113-938c-bb55550710f5,Spice <> Capriotti's - Sep / Oct,promotion,2025-09-18,None,N/A,,d1d0b263-4918-4c81-8c97-630471e7185b,10% Happy Hour Discount - Medium Price Sensitivity,day,all,Order Discount,% Off,10.0%,25.00,USD,South Eastern Ave,75744,0,0.00,0.00,0.00,0.00,0.00,-0.00,-0.00,0.00,0.00,0.00,0,0,0,0,0,0,0,0
2025-10-10,a895bc94-3910-43c9-b1b9-bc7f513286d7,Spend $25 get $5 off 07/31/2024,promotion,2024-07-31,None,N/A,,,,,,,$ Off,0.00,0.00,USD,The Old Road,24898774,9,469.49,45.00,0.00,0.00,8.91,-0.00,-0.00,52.17,5.99,8.71,2,7,0,9,2,5,0,7
2025-10-10,77e23ebd-6e10-4113-938c-bb55550710f5,Spice <> Capriotti's - Sep / Oct,promotion,2025-09-18,None,N/A,,,,day,,,$ Off,0.00,0.00,USD,University Dr,29894178,0,0.00,0.00,0.00,0.00,0.00,-0.00,-0.00,0.00,0.00,0.00,0,0,0,0,0,0,0,0
2025-10-10,77e23ebd-6e10-4113-938c-bb55550710f5,Spice <> Capriotti's - Sep / Oct,promotion,2025-09-18,None,N/A,,91f90d8c-8a7d-41cf-9b6a-888400112024,10% Happy Hour Discount - Min  $25 | High Price Sensitivity,day,all,Order Discount,% Off,10.0%,25.00,USD,Millsboro Plaza,23360934,0,0.00,0.00,0.00,0.00,0.00,-0.00,-0.00,0.00,0.00,0.00,0,0,0,0,0,0,0,0
2025-10-10,77e23ebd-6e10-4113-938c-bb55550710f5,Spice <> Capriotti's - Sep / Oct,promotion,2025-09-18,None,N/A,,,,day,,,$ Off,0.00,0.00,USD,West Charleston,23641277,0,0.00,0.00,0.00,0.00,0.00,-0.00,-0.00,0.00,0.00,0.00,0,0,0,0,0,0,0,0
2025-10-10,77e23ebd-6e10-4113-938c-bb55550710f5,Spice <> Capriotti's - Sep / Oct,promotion,2025-09-18,None,N/A,,d1d0b263-4918-4c81-8c97-630471e7185b,10% Happy Hour Discount - Medium Price Sensitivity,day,all,Order Discount,% Off,10.0%,25.00,USD,Moreno Beach Drive,23085788,2,112.52,10.00,0.00,0.00,1.98,-0.00,-0.00,56.26,5.99,9.39,1,1,0,2,1,1,0,2
2025-10-10,77e23ebd-6e10-4113-938c-bb55550710f5,Spice <> Capriotti's - Sep / Oct,promotion,2025-09-18,None,N/A,,d1d0b263-4918-4c81-8c97-630471e7185b,10% Happy Hour Discount - Medium Price Sensitivity,day,all,Order Discount,% Off,10.0%,25.00,USD,W Blue Diamond Rd,75738,1,42.55,4.26,0.00,0.00,0.99,-0.00,-0.00,42.55,5.25,8.10,0,1,0,1,0,1,0,1
2025-10-10,77e23ebd-6e10-4113-938c-bb55550710f5,Spice <> Capriotti's - Sep / Oct,promotion,2025-09-18,None,N/A,,ba37e4d8-36c4-4cbe-8c7d-f4d1379109bd,"Spend $15, Save $3 | Low price Sensitivity",day,all,Order Discount,$ Off,3.00,15.00,USD,Bel Air,23733193,0,0.00,0.00,0.00,0.00,0.00,-0.00,-0.00,0.00,0.00,0.00,0,0,0,0,0,0,0,0
2025-10-10,77e23ebd-6e10-4113-938c-bb55550710f5,Spice <> Capriotti's - Sep / Oct,promotion,2025-09-18,None,N/A,,,,day,,,$ Off,0.00,0.00,USD,"Marlton, NJ",35211042,0,0.00,0.00,0.00,0.00,0.00,-0.00,-0.00,0.00,0.00,0.00,0,0,0,0,0,0,0,0
2025-10-10,77e23ebd-6e10-4113-938c-bb55550710f5,Spice <> Capriotti's - Sep / Oct,promotion,2025-09-18,None,N/A,,,,day,,,$ Off,0.00,0.00,USD,South  Walton Blvd,1616214,0,0.00,0.00,0.00,0.00,0.00,-0.00,-0.00,0.00,0.00,0.00,0,0,0,0,0,0,0,0
2025-10-10,77e23ebd-6e10-4113-938c-bb55550710f5,Spice <> Capriotti's - Sep / Oct,promotion,2025-09-18,None,N/A,,,,day,,,$ Off,0.00,0.00,USD,West Fullerton Ave,23349403,0,0.00,0.00,0.00,0.00,0.00,-0.00,-0.00,0.00,0.00,0.00,0,0,0,0,0,0,0,0
2025-10-10,77e23ebd-6e10-4113-938c-bb55550710f5,Spice <> Capriotti's - Sep / Oct,promotion,2025-09-18,None,N/A,,43340528-e1b7-4f95-ab40-8dc92bf9c274,"Spend $35, Save $6 | High Price Sensitivity",day,all,Order Discount,$ Off,6.00,35.00,USD,College Station,23349412,0,0.00,0.00,0.00,0.00,0.00,-0.00,-0.00,0.00,0.00,0.00,0,0,0,0,0,0,0,0
2025-10-10,77e23ebd-6e10-4113-938c-bb55550710f5,Spice <> Capriotti's - Sep / Oct,promotion,2025-09-18,None,N/A,,d1d0b263-4918-4c81-8c97-630471e7185b,10% Happy Hour Discount - Medium Price Sensitivity,day,all,Order Discount,% Off,10.0%,25.00,USD,Red Cliff Dr,578425,0,0.00,0.00,0.00,0.00,0.00,-0.00,-0.00,0.00,0.00,0.00,0,0,0,0,0,0,0,0
2025-10-10,77e23ebd-6e10-4113-938c-bb55550710f5,Spice <> Capriotti's - Sep / Oct,promotion,2025-09-18,None,N/A,,f06f33c5-bff5-4bb3-8dda-6cedeb2e6fc1,10% Happy hour Discount - Min $30 | Low Price Sensitivity,day,all,Order Discount,% Off,7.0%,30.00,USD,Castle Rock,23057614,0,0.00,0.00,0.00,0.00,0.00,-0.00,-0.00,0.00,0.00,0.00,0,0,0,0,0,0,0,0
2025-10-10,77e23ebd-6e10-4113-938c-bb55550710f5,Spice <> Capriotti's - Sep / Oct,promotion,2025-09-18,None,N/A,,,,day,,,$ Off,0.00,0.00,USD,College Station,23349412,0,0.00,0.00,0.00,0.00,0.00,-0.00,-0.00,0.00,0.00,0.00,0,0,0,0,0,0,0,0
2025-10-10,77e23ebd-6e10-4113-938c-bb55550710f5,Spice <> Capriotti's - Sep / Oct,promotion,2025-09-18,None,N/A,,d1d0b263-4918-4c81-8c97-630471e7185b,10% Happy Hour Discount - Medium Price Sensitivity,day,all,Order Discount,% Off,10.0%,25.00,USD,Marlboro - Easton,674514,2,88.90,7.88,0.00,0.00,1.98,-0.00,-0.00,44.45,4.93,9.02,0,2,0,2,0,0,0,0
2025-10-10,77e23ebd-6e10-4113-938c-bb55550710f5,Spice <> Capriotti's - Sep / Oct,promotion,2025-09-18,None,N/A,,ba37e4d8-36c4-4cbe-8c7d-f4d1379109bd,"Spend $15, Save $3 | Low price Sensitivity",day,all,Order Discount,$ Off,3.00,15.00,USD,N Broad St,578662,1,25.48,3.00,0.00,0.00,0.99,-0.00,-0.00,25.48,3.99,6.39,0,1,0,1,0,0,0,0
2025-10-10,77e23ebd-6e10-4113-938c-bb55550710f5,Spice <> Capriotti's - Sep / Oct,promotion,2025-09-18,None,N/A,,ba37e4d8-36c4-4cbe-8c7d-f4d1379109bd,"Spend $15, Save $3 | Low price Sensitivity",day,all,Order Discount,$ Off,3.00,15.00,USD,"Marlton, NJ",35211042,3,82.32,9.00,0.00,0.00,2.97,-0.00,-0.00,27.44,3.99,6.88,2,1,0,3,1,1,0,2
2025-10-10,77e23ebd-6e10-4113-938c-bb55550710f5,Spice <> Capriotti's - Sep / Oct,promotion,2025-09-18,None,N/A,,d1d0b263-4918-4c81-8c97-630471e7185b,10% Happy Hour Discount - Medium Price Sensitivity,day,all,Order Discount,% Off,10.0%,25.00,USD,State and 6100 S,2608908,0,0.00,0.00,0.00,0.00,0.00,-0.00,-0.00,0.00,0.00,0.00,0,0,0,0,0,0,0,0
2025-10-10,77e23ebd-6e10-4113-938c-bb55550710f5,Spice <> Capriotti's - Sep / Oct,promotion,2025-09-18,None,N/A,,f06f33c5-bff5-4bb3-8dda-6cedeb2e6fc1,10% Happy hour Discount - Min $30 | Low Price Sensitivity,day,all,Order Discount,% Off,7.0%,30.00,USD,Kennett Square,575296,0,0.00,0.00,0.00,0.00,0.00,-0.00,-0.00,0.00,0.00,0.00,0,0,0,0,0,0,0,0
2025-10-10,77e23ebd-6e10-4113-938c-bb55550710f5,Spice <> Capriotti's - Sep / Oct,promotion,2025-09-18,None,N/A,,,,day,,,$ Off,0.00,0.00,USD,Parker,24021312,0,0.00,0.00,0.00,0.00,0.00,-0.00,-0.00,0.00,0.00,0.00,0,0,0,0,0,0,0,0
2025-10-10,77e23ebd-6e10-4113-938c-bb55550710f5,Spice <> Capriotti's - Sep / Oct,promotion,2025-09-18,None,N/A,,d1d0b263-4918-4c81-8c97-630471e7185b,10% Happy Hour Discount - Medium Price Sensitivity,day,all,Order Discount,% Off,10.0%,25.00,USD,Sahara & Las Vegas,75735,0,0.00,0.00,0.00,0.00,0.00,-0.00,-0.00,0.00,0.00,0.00,0,0,0,0,0,0,0,0
2025-10-10,77e23ebd-6e10-4113-938c-bb55550710f5,Spice <> Capriotti's - Sep / Oct,promotion,2025-09-18,None,N/A,,f06f33c5-bff5-4bb3-8dda-6cedeb2e6fc1,10% Happy hour Discount - Min $30 | Low Price Sensitivity,day,all,Order Discount,% Off,7.0%,30.00,USD,N 87th Street,27965,0,0.00,0.00,0.00,0.00,0.00,-0.00,-0.00,0.00,0.00,0.00,0,0,0,0,0,0,0,0
2025-10-10,77e23ebd-6e10-4113-938c-bb55550710f5,Spice <> Capriotti's - Sep / Oct,promotion,2025-09-18,None,N/A,,ba37e4d8-36c4-4cbe-8c7d-f4d1379109bd,"Spend $15, Save $3 | Low price Sensitivity",day,all,Order Discount,$ Off,3.00,15.00,USD,Frisco,34516355,3,110.89,9.00,0.00,0.00,2.97,-0.00,-0.00,36.96,3.99,9.26,0,2,1,3,0,1,1,2
2025-10-10,77e23ebd-6e10-4113-938c-bb55550710f5,Spice <> Capriotti's - Sep / Oct,promotion,2025-09-18,None,N/A,,ba37e4d8-36c4-4cbe-8c7d-f4d1379109bd,"Spend $15, Save $3 | Low price Sensitivity",day,all,Order Discount,$ Off,3.00,15.00,USD,Raccoon Rd,26015022,10,361.49,30.00,0.00,0.00,9.90,-0.00,-0.00,36.15,3.99,9.06,3,7,0,10,1,6,0,7
2025-10-10,77e23ebd-6e10-4113-938c-bb55550710f5,Spice <> Capriotti's - Sep / Oct,promotion,2025-09-18,None,N/A,,f06f33c5-bff5-4bb3-8dda-6cedeb2e6fc1,10% Happy hour Discount - Min $30 | Low Price Sensitivity,day,all,Order Discount,% Off,7.0%,30.00,USD,Collier Pkwy-Lutz,23057623,0,0.00,0.00,0.00,0.00,0.00,-0.00,-0.00,0.00,0.00,0.00,0,0,0,0,0,0,0,0
2025-10-10,77e23ebd-6e10-4113-938c-bb55550710f5,Spice <> Capriotti's - Sep / Oct,promotion,2025-09-18,None,N/A,,ba37e4d8-36c4-4cbe-8c7d-f4d1379109bd,"Spend $15, Save $3 | Low price Sensitivity",day,all,Order Discount,$ Off,3.00,15.00,USD,University Ave,1084955,9,228.12,27.00,0.00,0.00,8.91,-0.00,-0.00,25.35,3.99,6.35,0,8,1,9,0,5,1,6
2025-10-10,77e23ebd-6e10-4113-938c-bb55550710f5,Spice <> Capriotti's - Sep / Oct,promotion,2025-09-18,None,N/A,,f06f33c5-bff5-4bb3-8dda-6cedeb2e6fc1,10% Happy hour Discount - Min $30 | Low Price Sensitivity,day,all,Order Discount,% Off,7.0%,30.00,USD,N Broad St,578662,0,0.00,0.00,0.00,0.00,0.00,-0.00,-0.00,0.00,0.00,0.00,0,0,0,0,0,0,0,0
2025-10-10,77e23ebd-6e10-4113-938c-bb55550710f5,Spice <> Capriotti's - Sep / Oct,promotion,2025-09-18,None,N/A,,,,day,,,$ Off,0.00,0.00,USD,N Broad St,578662,0,0.00,0.00,0.00,0.00,0.00,-0.00,-0.00,0.00,0.00,0.00,0,0,0,0,0,0,0,0
2025-10-10,77e23ebd-6e10-4113-938c-bb55550710f5,Spice <> Capriotti's - Sep / Oct,promotion,2025-09-18,None,N/A,,43340528-e1b7-4f95-ab40-8dc92bf9c274,"Spend $35, Save $6 | High Price Sensitivity",day,all,Order Discount,$ Off,6.00,35.00,USD,Niles Cortland Rd SE,34043935,10,489.46,60.00,0.00,0.00,9.90,-0.00,-0.00,48.95,6.99,7.00,4,6,0,10,4,3,0,7
2025-10-10,77e23ebd-6e10-4113-938c-bb55550710f5,Spice <> Capriotti's - Sep / Oct,promotion,2025-09-18,None,N/A,,43340528-e1b7-4f95-ab40-8dc92bf9c274,"Spend $35, Save $6 | High Price Sensitivity",day,all,Order Discount,$ Off,6.00,35.00,USD,Riverwind Dr,34516256,2,93.11,12.00,0.00,0.00,1.98,-0.00,-0.00,46.56,6.99,6.66,1,1,0,2,1,0,0,1
2025-10-10,77e23ebd-6e10-4113-938c-bb55550710f5,Spice <> Capriotti's - Sep / Oct,promotion,2025-09-18,None,N/A,,d1d0b263-4918-4c81-8c97-630471e7185b,10% Happy Hour Discount - Medium Price Sensitivity,day,all,Order Discount,% Off,10.0%,25.00,USD,S Marion Road,1742411,0,0.00,0.00,0.00,0.00,0.00,-0.00,-0.00,0.00,0.00,0.00,0,0,0,0,0,0,0,0
2025-10-10,77e23ebd-6e10-4113-938c-bb55550710f5,Spice <> Capriotti's - Sep / Oct,promotion,2025-09-18,None,N/A,,91f90d8c-8a7d-41cf-9b6a-888400112024,10% Happy Hour Discount - Min  $25 | High Price Sensitivity,day,all,Order Discount,% Off,10.0%,25.00,USD,Silverside Road,691182,3,121.42,12.15,0.00,0.00,2.97,-0.00,-0.00,40.47,5.04,8.03,0,3,0,3,0,3,0,3
2025-10-10,77e23ebd-6e10-4113-938c-bb55550710f5,Spice <> Capriotti's - Sep / Oct,promotion,2025-09-18,None,N/A,,d1d0b263-4918-4c81-8c97-630471e7185b,10% Happy Hour Discount - Medium Price Sensitivity,day,all,Order Discount,% Off,10.0%,25.00,USD,De Soto-Chatsworth,651597,0,0.00,0.00,0.00,0.00,0.00,-0.00,-0.00,0.00,0.00,0.00,0,0,0,0,0,0,0,0
2025-10-10,77e23ebd-6e10-4113-938c-bb55550710f5,Spice <> Capriotti's - Sep / Oct,promotion,2025-09-18,None,N/A,,d1d0b263-4918-4c81-8c97-630471e7185b,10% Happy Hour Discount - Medium Price Sensitivity,day,all,Order Discount,% Off,10.0%,25.00,USD,Jennersville Rd,433075,1,36.37,3.64,0.00,0.00,0.99,-0.00,-0.00,36.37,4.63,7.86,0,1,0,1,0,1,0,1
2025-10-10,77e23ebd-6e10-4113-938c-bb55550710f5,Spice <> Capriotti's - Sep / Oct,promotion,2025-09-18,None,N/A,,d1d0b263-4918-4c81-8c97-630471e7185b,10% Happy Hour Discount - Medium Price Sensitivity,day,all,Order Discount,% Off,10.0%,25.00,USD,Interquest Parkway,27558470,0,0.00,0.00,0.00,0.00,0.00,-0.00,-0.00,0.00,0.00,0.00,0,0,0,0,0,0,0,0
2025-10-10,77e23ebd-6e10-4113-938c-bb55550710f5,Spice <> Capriotti's - Sep / Oct,promotion,2025-09-18,None,N/A,,ba37e4d8-36c4-4cbe-8c7d-f4d1379109bd,"Spend $15, Save $3 | Low price Sensitivity",day,all,Order Discount,$ Off,3.00,15.00,USD,Smithtown Bypass,23349427,2,94.63,6.00,0.00,0.00,1.98,-0.00,-0.00,47.32,3.99,11.86,0,2,0,2,0,2,0,2
2025-10-10,2c07ba1b-ffe7-48b6-b99f-17555cbc8290,Lunch specials item discount 07/25/2025,promotion,2025-07-25,None,N/A,,,,,,,$ Off,0.00,0.00,USD,Southern Highlands,1750142,0,0.00,0.00,0.00,0.00,0.00,-0.00,-0.00,0.00,0.00,0.00,0,0,0,0,0,0,0,0
2025-10-10,02d2c45e-5b6f-4058-b05d-1fbcb475312e,"First order, 20% off 04/09/2025",promotion,2025-04-09,None,N/A,,,,,,,$ Off,0.00,0.00,USD,Freeman Park,24404087,1,31.87,5.00,0.00,0.00,0.99,-0.00,-0.00,31.87,5.99,5.32,1,0,0,1,1,0,0,1
2025-10-10,02d2c45e-5b6f-4058-b05d-1fbcb475312e,"First order, 20% off 04/09/2025",promotion,2025-04-09,None,N/A,,,,,,,$ Off,0.00,0.00,USD,Interquest Parkway,27558470,1,17.29,3.46,0.00,0.00,0.99,-0.00,-0.00,17.29,4.45,3.89,1,0,0,1,0,0,0,0
2025-10-10,77e23ebd-6e10-4113-938c-bb55550710f5,Spice <> Capriotti's - Sep / Oct,promotion,2025-09-18,None,N/A,,ba37e4d8-36c4-4cbe-8c7d-f4d1379109bd,"Spend $15, Save $3 | Low price Sensitivity",day,all,Order Discount,$ Off,3.00,15.00,USD,Heart Pine-Odessa,2232632,3,104.90,9.00,0.00,0.00,2.97,-0.00,-0.00,34.97,3.99,8.76,0,3,0,3,0,3,0,3
2025-10-10,77e23ebd-6e10-4113-938c-bb55550710f5,Spice <> Capriotti's - Sep / Oct,promotion,2025-09-18,None,N/A,,43340528-e1b7-4f95-ab40-8dc92bf9c274,"Spend $35, Save $6 | High Price Sensitivity",day,all,Order Discount,$ Off,6.00,35.00,USD,North Union St,575293,3,167.49,18.00,0.00,0.00,2.97,-0.00,-0.00,55.83,6.99,7.99,0,3,0,3,0,3,0,3
2025-10-10,77e23ebd-6e10-4113-938c-bb55550710f5,Spice <> Capriotti's - Sep / Oct,promotion,2025-09-18,None,N/A,,d1d0b263-4918-4c81-8c97-630471e7185b,10% Happy Hour Discount - Medium Price Sensitivity,day,all,Order Discount,% Off,10.0%,25.00,USD,Freeman Park,24404087,1,28.58,2.86,0.00,0.00,0.99,-0.00,-0.00,28.58,3.85,7.42,0,1,0,1,0,1,0,1
2025-10-10,77e23ebd-6e10-4113-938c-bb55550710f5,Spice <> Capriotti's - Sep / Oct,promotion,2025-09-18,None,N/A,,,,day,,,$ Off,0.00,0.00,USD,Gambrills,24415514,0,0.00,0.00,0.00,0.00,0.00,-0.00,-0.00,0.00,0.00,0.00,0,0,0,0,0,0,0,0
2025-10-10,77e23ebd-6e10-4113-938c-bb55550710f5,Spice <> Capriotti's - Sep / Oct,promotion,2025-09-18,None,N/A,,,,day,,,$ Off,0.00,0.00,USD,Highlands Ranch,1791292,0,0.00,0.00,0.00,0.00,0.00,-0.00,-0.00,0.00,0.00,0.00,0,0,0,0,0,0,0,0
2025-10-10,77e23ebd-6e10-4113-938c-bb55550710f5,Spice <> Capriotti's - Sep / Oct,promotion,2025-09-18,None,N/A,,d1d0b263-4918-4c81-8c97-630471e7185b,10% Happy Hour Discount - Medium Price Sensitivity,day,all,Order Discount,% Off,10.0%,25.00,USD,NE Cookingham Dr,23035356,2,65.43,6.55,0.00,0.00,1.98,-0.00,-0.00,32.72,4.27,7.67,0,2,0,2,0,0,0,0
2025-10-10,77e23ebd-6e10-4113-938c-bb55550710f5,Spice <> Capriotti's - Sep / Oct,promotion,2025-09-18,None,N/A,,,,day,,,$ Off,0.00,0.00,USD,Mountain View,2608887,0,0.00,0.00,0.00,0.00,0.00,-0.00,-0.00,0.00,0.00,0.00,0,0,0,0,0,0,0,0
2025-10-10,77e23ebd-6e10-4113-938c-bb55550710f5,Spice <> Capriotti's - Sep / Oct,promotion,2025-09-18,None,N/A,,,,day,,,$ Off,0.00,0.00,USD,Coeur d'Alene,23085790,0,0.00,0.00,0.00,0.00,0.00,-0.00,-0.00,0.00,0.00,0.00,0,0,0,0,0,0,0,0
2025-10-10,77e23ebd-6e10-4113-938c-bb55550710f5,Spice <> Capriotti's - Sep / Oct,promotion,2025-09-18,None,N/A,,ba37e4d8-36c4-4cbe-8c7d-f4d1379109bd,"Spend $15, Save $3 | Low price Sensitivity",day,all,Order Discount,$ Off,3.00,15.00,USD,Horizon Ridge,75753,2,31.18,6.00,0.00,0.00,1.98,-0.00,-0.00,15.59,3.99,3.91,0,1,1,2,0,1,0,1
2025-10-10,77e23ebd-6e10-4113-938c-bb55550710f5,Spice <> Capriotti's - Sep / Oct,promotion,2025-09-18,None,N/A,,,,day,,,$ Off,0.00,0.00,USD,West Basin Rd,575301,0,0.00,0.00,0.00,0.00,0.00,-0.00,-0.00,0.00,0.00,0.00,0,0,0,0,0,0,0,0
2025-10-10,77e23ebd-6e10-4113-938c-bb55550710f5,Spice <> Capriotti's - Sep / Oct,promotion,2025-09-18,None,N/A,,d1d0b263-4918-4c81-8c97-630471e7185b,10% Happy Hour Discount - Medium Price Sensitivity,day,all,Order Discount,% Off,10.0%,25.00,USD,Highbrook Way,33551695,0,0.00,0.00,0.00,0.00,0.00,-0.00,-0.00,0.00,0.00,0.00,0,0,0,0,0,0,0,0
2025-10-10,02d2c45e-5b6f-4058-b05d-1fbcb475312e,"First order, 20% off 04/09/2025",promotion,2025-04-09,None,N/A,,,,,,,$ Off,0.00,0.00,USD,University Ave,1084955,1,32.17,5.00,0.00,0.00,0.99,-0.00,-0.00,32.17,5.99,5.37,1,0,0,1,0,0,0,0
2025-10-10,77e23ebd-6e10-4113-938c-bb55550710f5,Spice <> Capriotti's - Sep / Oct,promotion,2025-09-18,None,N/A,,d1d0b263-4918-4c81-8c97-630471e7185b,10% Happy Hour Discount - Medium Price Sensitivity,day,all,Order Discount,% Off,10.0%,25.00,USD,West Charleston,23641277,2,58.56,5.86,0.00,0.00,1.98,-0.00,-0.00,29.28,3.92,7.47,0,2,0,2,0,2,0,2
2025-10-10,77e23ebd-6e10-4113-938c-bb55550710f5,Spice <> Capriotti's - Sep / Oct,promotion,2025-09-18,None,N/A,,d1d0b263-4918-4c81-8c97-630471e7185b,10% Happy Hour Discount - Medium Price Sensitivity,day,all,Order Discount,% Off,10.0%,25.00,USD,Meadows - Reno,705841,2,86.33,8.64,0.00,0.00,1.98,-0.00,-0.00,43.17,5.31,8.13,0,1,1,2,0,1,0,1
2025-10-10,77e23ebd-6e10-4113-938c-bb55550710f5,Spice <> Capriotti's - Sep / Oct,promotion,2025-09-18,None,N/A,,,,day,,,$ Off,0.00,0.00,USD,Broadway - Tucson,27829895,0,0.00,0.00,0.00,0.00,0.00,-0.00,-0.00,0.00,0.00,0.00,0,0,0,0,0,0,0,0
2025-10-10,77e23ebd-6e10-4113-938c-bb55550710f5,Spice <> Capriotti's - Sep / Oct,promotion,2025-09-18,None,N/A,,43340528-e1b7-4f95-ab40-8dc92bf9c274,"Spend $35, Save $6 | High Price Sensitivity",day,all,Order Discount,$ Off,6.00,35.00,USD,Chicago River West,34048823,2,92.02,12.00,0.00,0.00,1.98,-0.00,-0.00,46.01,6.99,6.58,1,1,0,2,1,1,0,2
2025-10-10,77e23ebd-6e10-4113-938c-bb55550710f5,Spice <> Capriotti's - Sep / Oct,promotion,2025-09-18,None,N/A,,,,day,,,$ Off,0.00,0.00,USD,Silverside Road,691182,0,0.00,0.00,0.00,0.00,0.00,-0.00,-0.00,0.00,0.00,0.00,0,0,0,0,0,0,0,0
2025-10-10,77e23ebd-6e10-4113-938c-bb55550710f5,Spice <> Capriotti's - Sep / Oct,promotion,2025-09-18,None,N/A,,43340528-e1b7-4f95-ab40-8dc92bf9c274,"Spend $35, Save $6 | High Price Sensitivity",day,all,Order Discount,$ Off,6.00,35.00,USD,West Fullerton Ave,23349403,2,107.13,12.00,0.00,0.00,1.98,-0.00,-0.00,53.57,6.99,7.66,0,2,0,2,0,2,0,2
2025-10-10,77e23ebd-6e10-4113-938c-bb55550710f5,Spice <> Capriotti's - Sep / Oct,promotion,2025-09-18,None,N/A,,,,day,,,$ Off,0.00,0.00,USD,Millsboro Plaza,23360934,0,0.00,0.00,0.00,0.00,0.00,-0.00,-0.00,0.00,0.00,0.00,0,0,0,0,0,0,0,0
2025-10-10,77e23ebd-6e10-4113-938c-bb55550710f5,Spice <> Capriotti's - Sep / Oct,promotion,2025-09-18,None,N/A,,91f90d8c-8a7d-41cf-9b6a-888400112024,10% Happy Hour Discount - Min  $25 | High Price Sensitivity,day,all,Order Discount,% Off,10.0%,25.00,USD,Niles Cortland Rd SE,34043935,0,0.00,0.00,0.00,0.00,0.00,-0.00,-0.00,0.00,0.00,0.00,0,0,0,0,0,0,0,0
2025-10-10,77e23ebd-6e10-4113-938c-bb55550710f5,Spice <> Capriotti's - Sep / Oct,promotion,2025-09-18,None,N/A,,d1d0b263-4918-4c81-8c97-630471e7185b,10% Happy Hour Discount - Medium Price Sensitivity,day,all,Order Discount,% Off,10.0%,25.00,USD,Olympia Ave-Tulsa,24892240,1,57.16,5.00,0.00,0.00,0.99,-0.00,-0.00,57.16,5.99,9.54,1,0,0,1,1,0,0,1
2025-10-10,77e23ebd-6e10-4113-938c-bb55550710f5,Spice <> Capriotti's - Sep / Oct,promotion,2025-09-18,None,N/A,,d1d0b263-4918-4c81-8c97-630471e7185b,10% Happy Hour Discount - Medium Price Sensitivity,day,all,Order Discount,% Off,10.0%,25.00,USD,Barnes Road,24892677,0,0.00,0.00,0.00,0.00,0.00,-0.00,-0.00,0.00,0.00,0.00,0,0,0,0,0,0,0,0
2025-10-10,77e23ebd-6e10-4113-938c-bb55550710f5,Spice <> Capriotti's - Sep / Oct,promotion,2025-09-18,None,N/A,,ba37e4d8-36c4-4cbe-8c7d-f4d1379109bd,"Spend $15, Save $3 | Low price Sensitivity",day,all,Order Discount,$ Off,3.00,15.00,USD,Overland Park,24110474,3,86.30,9.00,0.00,0.00,2.97,-0.00,-0.00,28.77,3.99,7.21,0,3,0,3,0,3,0,3
2025-10-10,77e23ebd-6e10-4113-938c-bb55550710f5,Spice <> Capriotti's - Sep / Oct,promotion,2025-09-18,None,N/A,,ba37e4d8-36c4-4cbe-8c7d-f4d1379109bd,"Spend $15, Save $3 | Low price Sensitivity",day,all,Order Discount,$ Off,3.00,15.00,USD,Sierra Hwy,27476315,2,62.33,6.00,0.00,0.00,1.98,-0.00,-0.00,31.17,3.99,7.81,0,2,0,2,0,2,0,2
2025-10-10,77e23ebd-6e10-4113-938c-bb55550710f5,Spice <> Capriotti's - Sep / Oct,promotion,2025-09-18,None,N/A,,d1d0b263-4918-4c81-8c97-630471e7185b,10% Happy Hour Discount - Medium Price Sensitivity,day,all,Order Discount,% Off,10.0%,25.00,USD,Downtown Summerlin,75736,1,47.51,4.75,0.00,0.00,0.99,-0.00,-0.00,47.51,5.74,8.28,0,1,0,1,0,1,0,1
2025-10-10,77e23ebd-6e10-4113-938c-bb55550710f5,Spice <> Capriotti's - Sep / Oct,promotion,2025-09-18,None,N/A,,91f90d8c-8a7d-41cf-9b6a-888400112024,10% Happy Hour Discount - Min  $25 | High Price Sensitivity,day,all,Order Discount,% Off,10.0%,25.00,USD,Kirkwood Hwy,390889,3,111.83,11.19,0.00,0.00,2.97,-0.00,-0.00,37.28,4.72,7.90,0,2,1,3,0,2,1,3
2025-10-10,77e23ebd-6e10-4113-938c-bb55550710f5,Spice <> Capriotti's - Sep / Oct,promotion,2025-09-18,None,N/A,,91f90d8c-8a7d-41cf-9b6a-888400112024,10% Happy Hour Discount - Min  $25 | High Price Sensitivity,day,all,Order Discount,% Off,10.0%,25.00,USD,Chicago River West,34048823,2,90.03,7.78,0.00,0.00,1.98,-0.00,-0.00,45.02,4.88,9.22,1,1,0,2,1,1,0,2
2025-10-10,77e23ebd-6e10-4113-938c-bb55550710f5,Spice <> Capriotti's - Sep / Oct,promotion,2025-09-18,None,N/A,,d1d0b263-4918-4c81-8c97-630471e7185b,10% Happy Hour Discount - Medium Price Sensitivity,day,all,Order Discount,% Off,10.0%,25.00,USD,South Rainbow,75732,1,26.96,2.70,0.00,0.00,0.99,-0.00,-0.00,26.96,3.69,7.31,0,1,0,1,0,1,0,1
2025-10-10,77e23ebd-6e10-4113-938c-bb55550710f5,Spice <> Capriotti's - Sep / Oct,promotion,2025-09-18,None,N/A,,,,day,,,$ Off,0.00,0.00,USD,Anthem,75750,0,0.00,0.00,0.00,0.00,0.00,-0.00,-0.00,0.00,0.00,0.00,0,0,0,0,0,0,0,0
2025-10-10,77e23ebd-6e10-4113-938c-bb55550710f5,Spice <> Capriotti's - Sep / Oct,promotion,2025-09-18,None,N/A,,91f90d8c-8a7d-41cf-9b6a-888400112024,10% Happy Hour Discount - Min  $25 | High Price Sensitivity,day,all,Order Discount,% Off,10.0%,25.00,USD,Broadway - Tucson,27829895,0,0.00,0.00,0.00,0.00,0.00,-0.00,-0.00,0.00,0.00,0.00,0,0,0,0,0,0,0,0
2025-10-10,77e23ebd-6e10-4113-938c-bb55550710f5,Spice <> Capriotti's - Sep / Oct,promotion,2025-09-18,None,N/A,,f06f33c5-bff5-4bb3-8dda-6cedeb2e6fc1,10% Happy hour Discount - Min $30 | Low Price Sensitivity,day,all,Order Discount,% Off,7.0%,30.00,USD,Stephanie St,75751,1,51.62,3.61,0.00,0.00,0.99,-0.00,-0.00,51.62,4.60,11.22,0,1,0,1,0,0,0,0
2025-10-10,77e23ebd-6e10-4113-938c-bb55550710f5,Spice <> Capriotti's - Sep / Oct,promotion,2025-09-18,None,N/A,,,,day,,,$ Off,0.00,0.00,USD,Palm Ave - Fresno,1581092,0,0.00,0.00,0.00,0.00,0.00,-0.00,-0.00,0.00,0.00,0.00,0,0,0,0,0,0,0,0
2025-10-10,77e23ebd-6e10-4113-938c-bb55550710f5,Spice <> Capriotti's - Sep / Oct,promotion,2025-09-18,None,N/A,,91f90d8c-8a7d-41cf-9b6a-888400112024,10% Happy Hour Discount - Min  $25 | High Price Sensitivity,day,all,Order Discount,% Off,10.0%,25.00,USD,South  Walton Blvd,1616214,2,89.62,8.97,0.00,0.00,1.98,-0.00,-0.00,44.81,5.48,8.18,0,1,1,2,0,0,1,1
2025-10-10,77e23ebd-6e10-4113-938c-bb55550710f5,Spice <> Capriotti's - Sep / Oct,promotion,2025-09-18,None,N/A,,f06f33c5-bff5-4bb3-8dda-6cedeb2e6fc1,10% Happy hour Discount - Min $30 | Low Price Sensitivity,day,all,Order Discount,% Off,7.0%,30.00,USD,Downingtown,33699763,1,33.58,2.35,0.00,0.00,0.99,-0.00,-0.00,33.58,3.34,10.05,0,1,0,1,0,1,0,1
2025-10-10,77e23ebd-6e10-4113-938c-bb55550710f5,Spice <> Capriotti's - Sep / Oct,promotion,2025-09-18,None,N/A,,f06f33c5-bff5-4bb3-8dda-6cedeb2e6fc1,10% Happy hour Discount - Min $30 | Low Price Sensitivity,day,all,Order Discount,% Off,7.0%,30.00,USD,The Old Road,24898774,0,0.00,0.00,0.00,0.00,0.00,-0.00,-0.00,0.00,0.00,0.00,0,0,0,0,0,0,0,0
2025-10-10,77e23ebd-6e10-4113-938c-bb55550710f5,Spice <> Capriotti's - Sep / Oct,promotion,2025-09-18,None,N/A,,91f90d8c-8a7d-41cf-9b6a-888400112024,10% Happy Hour Discount - Min  $25 | High Price Sensitivity,day,all,Order Discount,% Off,10.0%,25.00,USD,West Basin Rd,575301,1,40.47,4.05,0.00,0.00,0.99,-0.00,-0.00,40.47,5.04,8.03,0,1,0,1,0,0,0,0
2025-10-10,77e23ebd-6e10-4113-938c-bb55550710f5,Spice <> Capriotti's - Sep / Oct,promotion,2025-09-18,None,N/A,,43340528-e1b7-4f95-ab40-8dc92bf9c274,"Spend $35, Save $6 | High Price Sensitivity",day,all,Order Discount,$ Off,6.00,35.00,USD,Millsboro Plaza,23360934,0,0.00,0.00,0.00,0.00,0.00,-0.00,-0.00,0.00,0.00,0.00,0,0,0,0,0,0,0,0
2025-10-10,77e23ebd-6e10-4113-938c-bb55550710f5,Spice <> Capriotti's - Sep / Oct,promotion,2025-09-18,None,N/A,,,,day,,,$ Off,0.00,0.00,USD,Old Town,27964,0,0.00,0.00,0.00,0.00,0.00,-0.00,-0.00,0.00,0.00,0.00,0,0,0,0,0,0,0,0
2025-10-10,77e23ebd-6e10-4113-938c-bb55550710f5,Spice <> Capriotti's - Sep / Oct,promotion,2025-09-18,None,N/A,,,,day,,,$ Off,0.00,0.00,USD,Riverwind Dr,34516256,0,0.00,0.00,0.00,0.00,0.00,-0.00,-0.00,0.00,0.00,0.00,0,0,0,0,0,0,0,0
2025-10-10,77e23ebd-6e10-4113-938c-bb55550710f5,Spice <> Capriotti's - Sep / Oct,promotion,2025-09-18,None,N/A,,,,day,,,$ Off,0.00,0.00,USD,Townpark Lane,128721,0,0.00,0.00,0.00,0.00,0.00,-0.00,-0.00,0.00,0.00,0.00,0,0,0,0,0,0,0,0
2025-10-10,77e23ebd-6e10-4113-938c-bb55550710f5,Spice <> Capriotti's - Sep / Oct,promotion,2025-09-18,None,N/A,,d1d0b263-4918-4c81-8c97-630471e7185b,10% Happy Hour Discount - Medium Price Sensitivity,day,all,Order Discount,% Off,10.0%,25.00,USD,Park Road Center,27677423,0,0.00,0.00,0.00,0.00,0.00,-0.00,-0.00,0.00,0.00,0.00,0,0,0,0,0,0,0,0
2025-10-10,77e23ebd-6e10-4113-938c-bb55550710f5,Spice <> Capriotti's - Sep / Oct,promotion,2025-09-18,None,N/A,,,,day,,,$ Off,0.00,0.00,USD,Chicago River West,34048823,0,0.00,0.00,0.00,0.00,0.00,-0.00,-0.00,0.00,0.00,0.00,0,0,0,0,0,0,0,0
2025-10-10,178f54dc-804b-413e-b1bd-ffbdde7f61a1,"Dormant customers, 20% off 02/01/2025",promotion,2025-02-01,None,N/A,,,,,,,$ Off,0.00,0.00,USD,De Soto-Chatsworth,651597,0,0.00,0.00,0.00,0.00,0.00,-0.00,-0.00,0.00,0.00,0.00,0,0,0,0,0,0,0,0
2025-10-10,02d2c45e-5b6f-4058-b05d-1fbcb475312e,"First order, 20% off 04/09/2025",promotion,2025-04-09,None,N/A,,,,,,,$ Off,0.00,0.00,USD,Sumneytown Pike,24717004,1,23.98,4.80,0.00,0.00,0.99,-0.00,-0.00,23.98,5.79,4.14,1,0,0,1,1,0,0,1
2025-10-10,02d2c45e-5b6f-4058-b05d-1fbcb475312e,"First order, 20% off 04/09/2025",promotion,2025-04-09,None,N/A,,,,,,,$ Off,0.00,0.00,USD,Millsboro Plaza,23360934,3,53.77,10.76,0.00,0.00,2.97,-0.00,-0.00,17.92,4.58,3.92,3,0,0,3,0,0,0,0
2025-10-10,02d2c45e-5b6f-4058-b05d-1fbcb475312e,"First order, 20% off 04/09/2025",promotion,2025-04-09,None,N/A,,,,,,,$ Off,0.00,0.00,USD,Blue Diamond Road,333447,0,0.00,0.00,0.00,0.00,0.00,-0.00,-0.00,0.00,0.00,0.00,0,0,0,0,0,0,0,0
2025-10-10,f12a26e0-24e1-4d8e-ac05-d7e43f06d2bf,Happy Hour discount 11/12/2024,promotion,2024-11-12,None,N/A,,,,,,,$ Off,0.00,0.00,USD,Heart Pine-Odessa,2232632,2,44.86,11.94,0.00,0.00,1.98,-0.00,-0.00,22.43,6.96,3.22,0,2,0,2,0,1,0,1
2025-10-10,6f71233a-4f7b-43f5-b70b-89dc41af1fd0,Late night 5 off 25,promotion,2025-01-17,None,N/A,,,,,,,$ Off,0.00,0.00,USD,Oso Blanca Rd,178087,0,0.00,0.00,0.00,0.00,0.00,-0.00,-0.00,0.00,0.00,0.00,0,0,0,0,0,0,0,0
2025-10-10,02d2c45e-5b6f-4058-b05d-1fbcb475312e,"First order, 20% off 04/09/2025",promotion,2025-04-09,None,N/A,,,,,,,$ Off,0.00,0.00,USD,GVR Casino,75749,0,0.00,0.00,0.00,0.00,0.00,-0.00,-0.00,0.00,0.00,0.00,0,0,0,0,0,0,0,0
2025-10-10,58fe435a-cdf8-4a86-abc7-b68d7b574ba5,Spend $25 Get 20% Off,promotion,2022-12-01,None,N/A,,,,,,,$ Off,0.00,0.00,USD,San Luis Obispo,23900701,7,264.39,52.59,0.00,0.00,6.93,-0.00,-0.00,37.77,8.50,4.44,2,4,1,7,1,3,0,4
2025-10-10,02d2c45e-5b6f-4058-b05d-1fbcb475312e,"First order, 20% off 04/09/2025",promotion,2025-04-09,None,N/A,,,,,,,$ Off,0.00,0.00,USD,Hwy 72 - Madison,27685318,2,97.23,10.00,0.00,0.00,1.98,-0.00,-0.00,48.62,5.99,8.12,2,0,0,2,1,0,0,1
2025-10-10,02d2c45e-5b6f-4058-b05d-1fbcb475312e,"First order, 20% off 04/09/2025",promotion,2025-04-09,None,N/A,,,,,,,$ Off,0.00,0.00,USD,Palm Ave - Fresno,1581092,1,16.79,3.36,0.00,0.00,0.99,-0.00,-0.00,16.79,4.35,3.86,1,0,0,1,1,0,0,1
2025-10-10,02d2c45e-5b6f-4058-b05d-1fbcb475312e,"First order, 20% off 04/09/2025",promotion,2025-04-09,None,N/A,,,,,,,$ Off,0.00,0.00,USD,Plumb Lane,439577,0,0.00,0.00,0.00,0.00,0.00,-0.00,-0.00,0.00,0.00,0.00,0,0,0,0,0,0,0,0
2025-10-10,02d2c45e-5b6f-4058-b05d-1fbcb475312e,"First order, 20% off 04/09/2025",promotion,2025-04-09,None,N/A,,,,,,,$ Off,0.00,0.00,USD,Kent Island,691089,2,41.65,8.33,0.00,0.00,1.98,-0.00,-0.00,20.83,5.16,4.04,2,0,0,2,1,0,0,1
2025-10-10,77e23ebd-6e10-4113-938c-bb55550710f5,Spice <> Capriotti's - Sep / Oct,promotion,2025-09-18,None,N/A,,ba37e4d8-36c4-4cbe-8c7d-f4d1379109bd,"Spend $15, Save $3 | Low price Sensitivity",day,all,Order Discount,$ Off,3.00,15.00,USD,East Sepulveda,1743753,1,19.19,3.00,0.00,0.00,0.99,-0.00,-0.00,19.19,3.99,4.81,0,1,0,1,0,0,0,0
2025-10-10,02d2c45e-5b6f-4058-b05d-1fbcb475312e,"First order, 20% off 04/09/2025",promotion,2025-04-09,None,N/A,,,,,,,$ Off,0.00,0.00,USD,Shepherd - Fresno,24559604,2,68.36,8.72,0.00,0.00,1.98,-0.00,-0.00,34.18,5.35,6.39,2,0,0,2,2,0,0,2
2025-10-10,02d2c45e-5b6f-4058-b05d-1fbcb475312e,"First order, 20% off 04/09/2025",promotion,2025-04-09,None,N/A,,,,,,,$ Off,0.00,0.00,USD,University Dr,29894178,3,81.82,14.59,0.00,0.00,2.97,-0.00,-0.00,27.27,5.85,4.66,3,0,0,3,2,0,0,2
2025-10-10,02d2c45e-5b6f-4058-b05d-1fbcb475312e,"First order, 20% off 04/09/2025",promotion,2025-04-09,None,N/A,,,,,,,$ Off,0.00,0.00,USD,Cheyenne and 215,388423,1,26.99,5.00,0.00,0.00,0.99,-0.00,-0.00,26.99,5.99,4.51,1,0,0,1,1,0,0,1
2025-10-10,02d2c45e-5b6f-4058-b05d-1fbcb475312e,"First order, 20% off 04/09/2025",promotion,2025-04-09,None,N/A,,,,,,,$ Off,0.00,0.00,USD,Boulder Station,23349419,0,0.00,0.00,0.00,0.00,0.00,-0.00,-0.00,0.00,0.00,0.00,0,0,0,0,0,0,0,0
2025-10-10,667f7354-ea24-4ff4-8559-cbfb006cfdbe,"Dormant customers, 20% off 09/22/2025",promotion,2025-09-22,None,N/A,,,,,,,$ Off,0.00,0.00,USD,University Dr,29894178,1,40.95,5.00,0.00,0.00,0.99,-0.00,-0.00,40.95,5.99,6.84,0,0,1,1,0,0,1,1
2025-10-10,77e23ebd-6e10-4113-938c-bb55550710f5,Spice <> Capriotti's - Sep / Oct,promotion,2025-09-18,None,N/A,,ba37e4d8-36c4-4cbe-8c7d-f4d1379109bd,"Spend $15, Save $3 | Low price Sensitivity",day,all,Order Discount,$ Off,3.00,15.00,USD,Happy Valley,23584856,0,0.00,0.00,0.00,0.00,0.00,-0.00,-0.00,0.00,0.00,0.00,0,0,0,0,0,0,0,0
2025-10-10,02d2c45e-5b6f-4058-b05d-1fbcb475312e,"First order, 20% off 04/09/2025",promotion,2025-04-09,None,N/A,,,,,,,$ Off,0.00,0.00,USD,Meadows - Reno,705841,2,33.58,6.72,0.00,0.00,1.98,-0.00,-0.00,16.79,4.35,3.86,2,0,0,2,2,0,0,2
2025-10-10,77e23ebd-6e10-4113-938c-bb55550710f5,Spice <> Capriotti's - Sep / Oct,promotion,2025-09-18,None,N/A,,f06f33c5-bff5-4bb3-8dda-6cedeb2e6fc1,10% Happy hour Discount - Min $30 | Low Price Sensitivity,day,all,Order Discount,% Off,7.0%,30.00,USD,Bidwell - Folsom,26234909,0,0.00,0.00,0.00,0.00,0.00,-0.00,-0.00,0.00,0.00,0.00,0,0,0,0,0,0,0,0
2025-10-10,77e23ebd-6e10-4113-938c-bb55550710f5,Spice <> Capriotti's - Sep / Oct,promotion,2025-09-18,None,N/A,,f06f33c5-bff5-4bb3-8dda-6cedeb2e6fc1,10% Happy hour Discount - Min $30 | Low Price Sensitivity,day,all,Order Discount,% Off,7.0%,30.00,USD,Sumneytown Pike,24717004,0,0.00,0.00,0.00,0.00,0.00,-0.00,-0.00,0.00,0.00,0.00,0,0,0,0,0,0,0,0
2025-10-10,77e23ebd-6e10-4113-938c-bb55550710f5,Spice <> Capriotti's - Sep / Oct,promotion,2025-09-18,None,N/A,,f06f33c5-bff5-4bb3-8dda-6cedeb2e6fc1,10% Happy hour Discount - Min $30 | Low Price Sensitivity,day,all,Order Discount,% Off,7.0%,30.00,USD,International Pkwy,24671402,4,303.52,12.73,0.00,0.00,3.96,-0.00,-0.00,75.88,4.17,18.19,1,3,0,4,0,3,0,3
2025-10-10,77e23ebd-6e10-4113-938c-bb55550710f5,Spice <> Capriotti's - Sep / Oct,promotion,2025-09-18,None,N/A,,d1d0b263-4918-4c81-8c97-630471e7185b,10% Happy Hour Discount - Medium Price Sensitivity,day,all,Order Discount,% Off,10.0%,25.00,USD,Post Falls,34326515,0,0.00,0.00,0.00,0.00,0.00,-0.00,-0.00,0.00,0.00,0.00,0,0,0,0,0,0,0,0
2025-10-10,77e23ebd-6e10-4113-938c-bb55550710f5,Spice <> Capriotti's - Sep / Oct,promotion,2025-09-18,None,N/A,,d1d0b263-4918-4c81-8c97-630471e7185b,10% Happy Hour Discount - Medium Price Sensitivity,day,all,Order Discount,% Off,10.0%,25.00,USD,Ogletown Stanton,422117,0,0.00,0.00,0.00,0.00,0.00,-0.00,-0.00,0.00,0.00,0.00,0,0,0,0,0,0,0,0
2025-10-10,77e23ebd-6e10-4113-938c-bb55550710f5,Spice <> Capriotti's - Sep / Oct,promotion,2025-09-18,None,N/A,,d1d0b263-4918-4c81-8c97-630471e7185b,10% Happy Hour Discount - Medium Price Sensitivity,day,all,Order Discount,% Off,10.0%,25.00,USD,Plumb Lane,439577,0,0.00,0.00,0.00,0.00,0.00,-0.00,-0.00,0.00,0.00,0.00,0,0,0,0,0,0,0,0
2025-10-10,77e23ebd-6e10-4113-938c-bb55550710f5,Spice <> Capriotti's - Sep / Oct,promotion,2025-09-18,None,N/A,,ba37e4d8-36c4-4cbe-8c7d-f4d1379109bd,"Spend $15, Save $3 | Low price Sensitivity",day,all,Order Discount,$ Off,3.00,15.00,USD,Douglas Blvd,1018616,5,122.92,15.00,0.00,0.00,4.95,-0.00,-0.00,24.58,3.99,6.16,0,3,2,5,0,3,1,4
2025-10-10,77e23ebd-6e10-4113-938c-bb55550710f5,Spice <> Capriotti's - Sep / Oct,promotion,2025-09-18,None,N/A,,ba37e4d8-36c4-4cbe-8c7d-f4d1379109bd,"Spend $15, Save $3 | Low price Sensitivity",day,all,Order Discount,$ Off,3.00,15.00,USD,Governor Ritchie,24121153,5,124.05,15.00,0.00,0.00,4.95,-0.00,-0.00,24.81,3.99,6.22,0,4,1,5,0,2,1,3
2025-10-10,77e23ebd-6e10-4113-938c-bb55550710f5,Spice <> Capriotti's - Sep / Oct,promotion,2025-09-18,None,N/A,,91f90d8c-8a7d-41cf-9b6a-888400112024,10% Happy Hour Discount - Min  $25 | High Price Sensitivity,day,all,Order Discount,% Off,10.0%,25.00,USD,Palm Ave - Fresno,1581092,1,44.13,4.41,0.00,0.00,0.99,-0.00,-0.00,44.13,5.40,8.17,0,1,0,1,0,1,0,1
2025-10-10,77e23ebd-6e10-4113-938c-bb55550710f5,Spice <> Capriotti's - Sep / Oct,promotion,2025-09-18,None,N/A,,f06f33c5-bff5-4bb3-8dda-6cedeb2e6fc1,10% Happy hour Discount - Min $30 | Low Price Sensitivity,day,all,Order Discount,% Off,7.0%,30.00,USD,"Marlton, NJ",35211042,1,32.28,2.26,0.00,0.00,0.99,-0.00,-0.00,32.28,3.25,9.93,1,0,0,1,1,0,0,1
2025-10-10,77e23ebd-6e10-4113-938c-bb55550710f5,Spice <> Capriotti's - Sep / Oct,promotion,2025-09-18,None,N/A,,,,day,,,$ Off,0.00,0.00,USD,Niles Cortland Rd SE,34043935,0,0.00,0.00,0.00,0.00,0.00,-0.00,-0.00,0.00,0.00,0.00,0,0,0,0,0,0,0,0
2025-10-10,77e23ebd-6e10-4113-938c-bb55550710f5,Spice <> Capriotti's - Sep / Oct,promotion,2025-09-18,None,N/A,,,,day,,,$ Off,0.00,0.00,USD,Blackstone-Fresno,24415716,0,0.00,0.00,0.00,0.00,0.00,-0.00,-0.00,0.00,0.00,0.00,0,0,0,0,0,0,0,0
2025-10-10,77e23ebd-6e10-4113-938c-bb55550710f5,Spice <> Capriotti's - Sep / Oct,promotion,2025-09-18,None,N/A,,ba37e4d8-36c4-4cbe-8c7d-f4d1379109bd,"Spend $15, Save $3 | Low price Sensitivity",day,all,Order Discount,$ Off,3.00,15.00,USD,Townpark Lane,128721,0,0.00,0.00,0.00,0.00,0.00,-0.00,-0.00,0.00,0.00,0.00,0,0,0,0,0,0,0,0
2025-10-10,77e23ebd-6e10-4113-938c-bb55550710f5,Spice <> Capriotti's - Sep / Oct,promotion,2025-09-18,None,N/A,,ba37e4d8-36c4-4cbe-8c7d-f4d1379109bd,"Spend $15, Save $3 | Low price Sensitivity",day,all,Order Discount,$ Off,3.00,15.00,USD,Sumneytown Pike,24717004,3,66.61,9.00,0.00,0.00,2.97,-0.00,-0.00,22.20,3.99,5.56,0,2,1,3,0,2,0,2
2025-10-10,77e23ebd-6e10-4113-938c-bb55550710f5,Spice <> Capriotti's - Sep / Oct,promotion,2025-09-18,None,N/A,,d1d0b263-4918-4c81-8c97-630471e7185b,10% Happy Hour Discount - Medium Price Sensitivity,day,all,Order Discount,% Off,10.0%,25.00,USD,Maryland Pkwy,1007892,1,26.39,2.64,0.00,0.00,0.99,-0.00,-0.00,26.39,3.63,7.27,0,1,0,1,0,0,0,0
2025-10-10,77e23ebd-6e10-4113-938c-bb55550710f5,Spice <> Capriotti's - Sep / Oct,promotion,2025-09-18,None,N/A,,ba37e4d8-36c4-4cbe-8c7d-f4d1379109bd,"Spend $15, Save $3 | Low price Sensitivity",day,all,Order Discount,$ Off,3.00,15.00,USD,Gambrills,24415514,0,0.00,0.00,0.00,0.00,0.00,-0.00,-0.00,0.00,0.00,0.00,0,0,0,0,0,0,0,0
2025-10-10,77e23ebd-6e10-4113-938c-bb55550710f5,Spice <> Capriotti's - Sep / Oct,promotion,2025-09-18,None,N/A,,ba37e4d8-36c4-4cbe-8c7d-f4d1379109bd,"Spend $15, Save $3 | Low price Sensitivity",day,all,Order Discount,$ Off,3.00,15.00,USD,Anthem,75750,0,0.00,0.00,0.00,0.00,0.00,-0.00,-0.00,0.00,0.00,0.00,0,0,0,0,0,0,0,0
2025-10-10,77e23ebd-6e10-4113-938c-bb55550710f5,Spice <> Capriotti's - Sep / Oct,promotion,2025-09-18,None,N/A,,,,day,,,$ Off,0.00,0.00,USD,Stephanie St,75751,0,0.00,0.00,0.00,0.00,0.00,-0.00,-0.00,0.00,0.00,0.00,0,0,0,0,0,0,0,0
2025-10-10,77e23ebd-6e10-4113-938c-bb55550710f5,Spice <> Capriotti's - Sep / Oct,promotion,2025-09-18,None,N/A,,f06f33c5-bff5-4bb3-8dda-6cedeb2e6fc1,10% Happy hour Discount - Min $30 | Low Price Sensitivity,day,all,Order Discount,% Off,7.0%,30.00,USD,Murrieta Hot Springs Rd,29652192,2,94.13,6.59,0.00,0.00,1.98,-0.00,-0.00,47.07,4.29,10.98,0,2,0,2,0,2,0,2
2025-10-10,ff18ac99-74db-48ce-9c94-2959c91b6665,Capriotti's Sandwich Shop's Promo Campaign,promotion,2025-10-02,None,N/A,,a9ea1f37-2ee8-4c9b-ba40-bf2e0f2e84cd,10% Off Happy Hour Discount,day,all,Order Discount,% Off,10.0%,30.00,USD,Waialae Ave,25380836,3,121.14,12.12,0.00,0.00,2.97,-0.00,-0.00,40.38,5.03,8.03,0,3,0,3,0,2,0,2
2025-10-10,77e23ebd-6e10-4113-938c-bb55550710f5,Spice <> Capriotti's - Sep / Oct,promotion,2025-09-18,None,N/A,,ba37e4d8-36c4-4cbe-8c7d-f4d1379109bd,"Spend $15, Save $3 | Low price Sensitivity",day,all,Order Discount,$ Off,3.00,15.00,USD,St Rose Pkwy,1335286,4,98.82,12.00,0.00,0.00,3.96,-0.00,-0.00,24.71,3.99,6.19,0,4,0,4,0,3,0,3
2025-10-10,02d2c45e-5b6f-4058-b05d-1fbcb475312e,"First order, 20% off 04/09/2025",promotion,2025-04-09,None,N/A,,,,,,,$ Off,0.00,0.00,USD,Santa Fe Station,75723,1,19.88,3.98,0.00,0.00,0.99,-0.00,-0.00,19.88,4.97,4.00,1,0,0,1,1,0,0,1
2025-10-10,6f71233a-4f7b-43f5-b70b-89dc41af1fd0,Late night 5 off 25,promotion,2025-01-17,None,N/A,,,,,,,$ Off,0.00,0.00,USD,Cheyenne and 215,388423,1,31.38,5.00,0.00,0.00,0.99,-0.00,-0.00,31.38,5.99,5.24,0,1,0,1,0,1,0,1
2025-10-10,77e23ebd-6e10-4113-938c-bb55550710f5,Spice <> Capriotti's - Sep / Oct,promotion,2025-09-18,None,N/A,,d1d0b263-4918-4c81-8c97-630471e7185b,10% Happy Hour Discount - Medium Price Sensitivity,day,all,Order Discount,% Off,10.0%,25.00,USD,West Sahara Avenue,424852,0,0.00,0.00,0.00,0.00,0.00,-0.00,-0.00,0.00,0.00,0.00,0,0,0,0,0,0,0,0
2025-10-10,77e23ebd-6e10-4113-938c-bb55550710f5,Spice <> Capriotti's - Sep / Oct,promotion,2025-09-18,None,N/A,,91f90d8c-8a7d-41cf-9b6a-888400112024,10% Happy Hour Discount - Min  $25 | High Price Sensitivity,day,all,Order Discount,% Off,10.0%,25.00,USD,Riverwind Dr,34516256,0,0.00,0.00,0.00,0.00,0.00,-0.00,-0.00,0.00,0.00,0.00,0,0,0,0,0,0,0,0
2025-10-10,77e23ebd-6e10-4113-938c-bb55550710f5,Spice <> Capriotti's - Sep / Oct,promotion,2025-09-18,None,N/A,,43340528-e1b7-4f95-ab40-8dc92bf9c274,"Spend $35, Save $6 | High Price Sensitivity",day,all,Order Discount,$ Off,6.00,35.00,USD,Silverside Road,691182,5,213.42,30.00,0.00,0.00,4.95,-0.00,-0.00,42.68,6.99,6.11,0,5,0,5,0,4,0,4
2025-10-10,77e23ebd-6e10-4113-938c-bb55550710f5,Spice <> Capriotti's - Sep / Oct,promotion,2025-09-18,None,N/A,,,,day,,,$ Off,0.00,0.00,USD,Rancho Mirage,32864869,0,0.00,0.00,0.00,0.00,0.00,-0.00,-0.00,0.00,0.00,0.00,0,0,0,0,0,0,0,0
2025-10-10,77e23ebd-6e10-4113-938c-bb55550710f5,Spice <> Capriotti's - Sep / Oct,promotion,2025-09-18,None,N/A,,ba37e4d8-36c4-4cbe-8c7d-f4d1379109bd,"Spend $15, Save $3 | Low price Sensitivity",day,all,Order Discount,$ Off,3.00,15.00,USD,Stephanie St,75751,1,62.65,3.00,0.00,0.00,0.99,-0.00,-0.00,62.65,3.99,15.70,0,0,1,1,0,0,1,1
2025-10-10,77e23ebd-6e10-4113-938c-bb55550710f5,Spice <> Capriotti's - Sep / Oct,promotion,2025-09-18,None,N/A,,d1d0b263-4918-4c81-8c97-630471e7185b,10% Happy Hour Discount - Medium Price Sensitivity,day,all,Order Discount,% Off,10.0%,25.00,USD,WVC High Market,2608935,0,0.00,0.00,0.00,0.00,0.00,-0.00,-0.00,0.00,0.00,0.00,0,0,0,0,0,0,0,0
2025-10-10,77e23ebd-6e10-4113-938c-bb55550710f5,Spice <> Capriotti's - Sep / Oct,promotion,2025-09-18,None,N/A,,d1d0b263-4918-4c81-8c97-630471e7185b,10% Happy Hour Discount - Medium Price Sensitivity,day,all,Order Discount,% Off,10.0%,25.00,USD,Dana Park - Mesa,126177,2,78.73,7.52,0.00,0.00,1.98,-0.00,-0.00,39.37,4.75,8.29,0,2,0,2,0,2,0,2
2025-10-10,77e23ebd-6e10-4113-938c-bb55550710f5,Spice <> Capriotti's - Sep / Oct,promotion,2025-09-18,None,N/A,,d1d0b263-4918-4c81-8c97-630471e7185b,10% Happy Hour Discount - Medium Price Sensitivity,day,all,Order Discount,% Off,10.0%,25.00,USD,West Azure,75724,0,0.00,0.00,0.00,0.00,0.00,-0.00,-0.00,0.00,0.00,0.00,0,0,0,0,0,0,0,0
2025-10-10,77e23ebd-6e10-4113-938c-bb55550710f5,Spice <> Capriotti's - Sep / Oct,promotion,2025-09-18,None,N/A,,f06f33c5-bff5-4bb3-8dda-6cedeb2e6fc1,10% Happy hour Discount - Min $30 | Low Price Sensitivity,day,all,Order Discount,% Off,7.0%,30.00,USD,St Rose Pkwy,1335286,0,0.00,0.00,0.00,0.00,0.00,-0.00,-0.00,0.00,0.00,0.00,0,0,0,0,0,0,0,0
2025-10-10,77e23ebd-6e10-4113-938c-bb55550710f5,Spice <> Capriotti's - Sep / Oct,promotion,2025-09-18,None,N/A,,ba37e4d8-36c4-4cbe-8c7d-f4d1379109bd,"Spend $15, Save $3 | Low price Sensitivity",day,all,Order Discount,$ Off,3.00,15.00,USD,East Market Street,23256727,2,35.97,6.00,0.00,0.00,1.98,-0.00,-0.00,17.99,3.99,4.51,0,1,1,2,0,0,0,0
2025-10-10,02d2c45e-5b6f-4058-b05d-1fbcb475312e,"First order, 20% off 04/09/2025",promotion,2025-04-09,None,N/A,,,,,,,$ Off,0.00,0.00,USD,Broadway - Tucson,27829895,4,100.41,17.15,0.00,0.00,3.96,-0.00,-0.00,25.10,5.28,4.76,4,0,0,4,3,0,0,3
2025-10-10,77e23ebd-6e10-4113-938c-bb55550710f5,Spice <> Capriotti's - Sep / Oct,promotion,2025-09-18,None,N/A,,d1d0b263-4918-4c81-8c97-630471e7185b,10% Happy Hour Discount - Medium Price Sensitivity,day,all,Order Discount,% Off,10.0%,25.00,USD,Newark,390890,1,31.29,3.13,0.00,0.00,0.99,-0.00,-0.00,31.29,4.12,7.59,0,1,0,1,0,1,0,1
2025-10-10,77e23ebd-6e10-4113-938c-bb55550710f5,Spice <> Capriotti's - Sep / Oct,promotion,2025-09-18,None,N/A,,ba37e4d8-36c4-4cbe-8c7d-f4d1379109bd,"Spend $15, Save $3 | Low price Sensitivity",day,all,Order Discount,$ Off,3.00,15.00,USD,Terrace Center,321047,7,454.40,21.00,0.00,0.00,6.93,-0.00,-0.00,64.91,3.99,16.27,0,5,2,7,0,5,1,6
2025-10-10,77e23ebd-6e10-4113-938c-bb55550710f5,Spice <> Capriotti's - Sep / Oct,promotion,2025-09-18,None,N/A,,f06f33c5-bff5-4bb3-8dda-6cedeb2e6fc1,10% Happy hour Discount - Min $30 | Low Price Sensitivity,day,all,Order Discount,% Off,7.0%,30.00,USD,Terrace Center,321047,0,0.00,0.00,0.00,0.00,0.00,-0.00,-0.00,0.00,0.00,0.00,0,0,0,0,0,0,0,0
2025-10-10,02d2c45e-5b6f-4058-b05d-1fbcb475312e,"First order, 20% off 04/09/2025",promotion,2025-04-09,None,N/A,,,,,,,$ Off,0.00,0.00,USD,Eden Square Ctr,420646,3,61.57,11.68,0.00,0.00,2.97,-0.00,-0.00,20.52,4.88,4.20,3,0,0,3,0,0,0,0
2025-10-10,02d2c45e-5b6f-4058-b05d-1fbcb475312e,"First order, 20% off 04/09/2025",promotion,2025-04-09,None,N/A,,,,,,,$ Off,0.00,0.00,USD,Northdale Blvd,24976449,0,0.00,0.00,0.00,0.00,0.00,-0.00,-0.00,0.00,0.00,0.00,0,0,0,0,0,0,0,0
2025-10-10,4d5a689d-a212-46a2-91dc-8288a79ff11a,"First order, 20% off 01/02/2025",promotion,2025-01-02,None,N/A,,,,,,,$ Off,0.00,0.00,USD,Sunrise Blvd,31345439,3,61.84,12.37,0.00,0.00,2.97,-0.00,-0.00,20.61,5.11,4.03,3,0,0,3,3,0,0,3
2025-10-10,02d2c45e-5b6f-4058-b05d-1fbcb475312e,"First order, 20% off 04/09/2025",promotion,2025-04-09,None,N/A,,,,,,,$ Off,0.00,0.00,USD,West Charleston,23641277,1,17.39,3.48,0.00,0.00,0.99,-0.00,-0.00,17.39,4.47,3.89,1,0,0,1,0,0,0,0
2025-10-10,598e2471-2c6e-4746-bf14-48fe760a14fb,Happy Hour discount 02/01/2025,promotion,2025-02-01,None,N/A,,,,,,,$ Off,0.00,0.00,USD,Sierra Hwy,27476315,1,40.84,7.00,0.00,0.00,0.99,-0.00,-0.00,40.84,7.99,5.11,1,0,0,1,0,0,0,0
2025-10-10,77e23ebd-6e10-4113-938c-bb55550710f5,Spice <> Capriotti's - Sep / Oct,promotion,2025-09-18,None,N/A,,f06f33c5-bff5-4bb3-8dda-6cedeb2e6fc1,10% Happy hour Discount - Min $30 | Low Price Sensitivity,day,all,Order Discount,% Off,7.0%,30.00,USD,Frisco,34516355,0,0.00,0.00,0.00,0.00,0.00,-0.00,-0.00,0.00,0.00,0.00,0,0,0,0,0,0,0,0
2025-10-10,02d2c45e-5b6f-4058-b05d-1fbcb475312e,"First order, 20% off 04/09/2025",promotion,2025-04-09,None,N/A,,,,,,,$ Off,0.00,0.00,USD,West Avera Dr,1742446,1,19.98,4.00,0.00,0.00,0.99,-0.00,-0.00,19.98,4.99,4.00,1,0,0,1,0,0,0,0
2025-10-10,e149493c-c29f-452b-b0be-926022f5491a,Spend $20 get $3 off 09/20/2025,promotion,2025-09-20,None,N/A,,,,,,,$ Off,0.00,0.00,USD,Waialae Ave,25380836,5,146.19,15.00,0.00,0.00,4.95,-0.00,-0.00,29.24,3.99,7.33,1,3,1,5,1,3,1,5
2025-10-10,02d2c45e-5b6f-4058-b05d-1fbcb475312e,"First order, 20% off 04/09/2025",promotion,2025-04-09,None,N/A,,,,,,,$ Off,0.00,0.00,USD,Stephanie St,75751,0,0.00,0.00,0.00,0.00,0.00,-0.00,-0.00,0.00,0.00,0.00,0,0,0,0,0,0,0,0
2025-10-10,02d2c45e-5b6f-4058-b05d-1fbcb475312e,"First order, 20% off 04/09/2025",promotion,2025-04-09,None,N/A,,,,,,,$ Off,0.00,0.00,USD,East Ridge Pike,1640642,0,0.00,0.00,0.00,0.00,0.00,-0.00,-0.00,0.00,0.00,0.00,0,0,0,0,0,0,0,0
2025-10-10,02d2c45e-5b6f-4058-b05d-1fbcb475312e,"First order, 20% off 04/09/2025",promotion,2025-04-09,None,N/A,,,,,,,$ Off,0.00,0.00,USD,De Soto-Chatsworth,651597,0,0.00,0.00,0.00,0.00,0.00,-0.00,-0.00,0.00,0.00,0.00,0,0,0,0,0,0,0,0
2025-10-10,2bb77af0-6b48-46d5-97b3-e43758ea5314,"First order, 20% off 02/01/2025",promotion,2025-02-01,None,N/A,,,,,,,$ Off,0.00,0.00,USD,East Sepulveda,1743753,1,19.19,3.84,0.00,0.00,0.99,-0.00,-0.00,19.19,4.83,3.97,1,0,0,1,1,0,0,1
2025-10-10,58fe435a-cdf8-4a86-abc7-b68d7b574ba5,Spend $25 Get 20% Off,promotion,2022-12-01,None,N/A,,,,,,,$ Off,0.00,0.00,USD,Zionsville,24415273,9,418.86,72.74,0.00,0.00,8.91,-0.00,-0.00,46.54,9.07,5.13,1,4,4,9,0,3,4,7
2025-10-10,77e23ebd-6e10-4113-938c-bb55550710f5,Spice <> Capriotti's - Sep / Oct,promotion,2025-09-18,None,N/A,,f06f33c5-bff5-4bb3-8dda-6cedeb2e6fc1,10% Happy hour Discount - Min $30 | Low Price Sensitivity,day,all,Order Discount,% Off,7.0%,30.00,USD,North Boulder Hwy,75752,1,45.41,3.18,0.00,0.00,0.99,-0.00,-0.00,45.41,4.17,10.89,0,0,1,1,0,0,1,1
2025-10-10,7b3c5d68-2d5c-4d2d-b0b1-a1fb4346169d,Spend $20 Get $5 Off,promotion,2023-02-01,None,N/A,,,,,,,$ Off,0.00,0.00,USD,Gambrills,24415514,5,162.65,25.00,0.00,0.00,4.95,-0.00,-0.00,32.53,5.99,5.43,0,4,1,5,0,3,1,4
2025-10-10,77e23ebd-6e10-4113-938c-bb55550710f5,Spice <> Capriotti's - Sep / Oct,promotion,2025-09-18,None,N/A,,d1d0b263-4918-4c81-8c97-630471e7185b,10% Happy Hour Discount - Medium Price Sensitivity,day,all,Order Discount,% Off,10.0%,25.00,USD,Boulder Station,23349419,0,0.00,0.00,0.00,0.00,0.00,-0.00,-0.00,0.00,0.00,0.00,0,0,0,0,0,0,0,0
2025-10-10,c7538744-a515-43f8-97d0-b819c1419d1b,Happy Hour discount 09/19/2024,promotion,2024-09-19,None,N/A,,,,,,,$ Off,0.00,0.00,USD,Bidwell - Folsom,26234909,8,278.24,63.67,0.00,0.00,7.92,-0.00,-0.00,34.78,8.95,3.89,0,5,2,7,0,4,2,6
2025-10-10,02d2c45e-5b6f-4058-b05d-1fbcb475312e,"First order, 20% off 04/09/2025",promotion,2025-04-09,None,N/A,,,,,,,$ Off,0.00,0.00,USD,Downtown Summerlin,75736,1,36.57,5.00,0.00,0.00,0.99,-0.00,-0.00,36.57,5.99,6.11,1,0,0,1,1,0,0,1
2025-10-10,02d2c45e-5b6f-4058-b05d-1fbcb475312e,"First order, 20% off 04/09/2025",promotion,2025-04-09,None,N/A,,,,,,,$ Off,0.00,0.00,USD,Moreno Beach Drive,23085788,1,35.98,5.00,0.00,0.00,0.99,-0.00,-0.00,35.98,5.99,6.01,1,0,0,1,1,0,0,1
2025-10-10,02d2c45e-5b6f-4058-b05d-1fbcb475312e,"First order, 20% off 04/09/2025",promotion,2025-04-09,None,N/A,,,,,,,$ Off,0.00,0.00,USD,Olympia Ave-Tulsa,24892240,7,215.35,31.74,0.00,0.00,6.93,-0.00,-0.00,30.76,5.52,5.57,7,0,0,7,2,0,0,2
2025-10-10,ed10ed86-5221-41d8-9af0-0ac62871adbb,"First Order, 20% Off",promotion,2022-05-17,None,N/A,,,,,,,$ Off,0.00,0.00,USD,Pioneer Pkwy,874359,0,0.00,0.00,0.00,0.00,0.00,-0.00,-0.00,0.00,0.00,0.00,0,0,0,0,0,0,0,0
2025-10-10,f632eba8-7caa-4715-8101-69a221822987,Spend $35 get $5 off 12/02/2024,promotion,2024-12-02,None,N/A,,,,,,,$ Off,0.00,0.00,USD,"Capriotti's of Milford, LLC",1636430,4,321.83,20.00,0.00,0.00,3.96,-0.00,-0.00,80.46,5.99,13.43,2,2,0,4,1,2,0,3
2025-10-10,6c1ac2b8-1b1b-4277-8266-2ffa49f73156,Happy Hour Item Discount 09/22/2025,promotion,2025-09-22,None,N/A,,,,,,,$ Off,0.00,0.00,USD,Frisco,34516355,0,0.00,0.00,0.00,0.00,0.00,-0.00,-0.00,0.00,0.00,0.00,0,0,0,0,0,0,0,0
2025-10-10,02d2c45e-5b6f-4058-b05d-1fbcb475312e,"First order, 20% off 04/09/2025",promotion,2025-04-09,None,N/A,,,,,,,$ Off,0.00,0.00,USD,Lantana Drive,390888,0,0.00,0.00,0.00,0.00,0.00,-0.00,-0.00,0.00,0.00,0.00,0,0,0,0,0,0,0,0
2025-10-10,02d2c45e-5b6f-4058-b05d-1fbcb475312e,"First order, 20% off 04/09/2025",promotion,2025-04-09,None,N/A,,,,,,,$ Off,0.00,0.00,USD,Horizon Ridge,75753,0,0.00,0.00,0.00,0.00,0.00,-0.00,-0.00,0.00,0.00,0.00,0,0,0,0,0,0,0,0
2025-10-10,77e23ebd-6e10-4113-938c-bb55550710f5,Spice <> Capriotti's - Sep / Oct,promotion,2025-09-18,None,N/A,,91f90d8c-8a7d-41cf-9b6a-888400112024,10% Happy Hour Discount - Min  $25 | High Price Sensitivity,day,all,Order Discount,% Off,10.0%,25.00,USD,West Fullerton Ave,23349403,1,41.06,4.11,0.00,0.00,0.99,-0.00,-0.00,41.06,5.10,8.05,1,0,0,1,1,0,0,1
2025-10-10,02d2c45e-5b6f-4058-b05d-1fbcb475312e,"First order, 20% off 04/09/2025",promotion,2025-04-09,None,N/A,,,,,,,$ Off,0.00,0.00,USD,Ogletown Stanton,422117,4,97.64,15.52,0.00,0.00,3.96,-0.00,-0.00,24.41,4.87,5.01,4,0,0,4,1,0,0,1
2025-10-10,02d2c45e-5b6f-4058-b05d-1fbcb475312e,"First order, 20% off 04/09/2025",promotion,2025-04-09,None,N/A,,,,,,,$ Off,0.00,0.00,USD,State and 6100 S,2608908,6,165.35,25.74,0.00,0.00,5.94,-0.00,-0.00,27.56,5.28,5.22,6,0,0,6,3,0,0,3
2025-10-10,02d2c45e-5b6f-4058-b05d-1fbcb475312e,"First order, 20% off 04/09/2025",promotion,2025-04-09,None,N/A,,,,,,,$ Off,0.00,0.00,USD,NE Cookingham Dr,23035356,0,0.00,0.00,0.00,0.00,0.00,-0.00,-0.00,0.00,0.00,0.00,0,0,0,0,0,0,0,0
2025-10-10,77e23ebd-6e10-4113-938c-bb55550710f5,Spice <> Capriotti's - Sep / Oct,promotion,2025-09-18,None,N/A,,ba37e4d8-36c4-4cbe-8c7d-f4d1379109bd,"Spend $15, Save $3 | Low price Sensitivity",day,all,Order Discount,$ Off,3.00,15.00,USD,Highlands Ranch,1791292,2,50.02,6.00,0.00,0.00,1.98,-0.00,-0.00,25.01,3.99,6.27,0,2,0,2,0,0,0,0
2025-10-10,02d2c45e-5b6f-4058-b05d-1fbcb475312e,"First order, 20% off 04/09/2025",promotion,2025-04-09,None,N/A,,,,,,,$ Off,0.00,0.00,USD,Mountain View,2608887,2,55.77,10.00,0.00,0.00,1.98,-0.00,-0.00,27.89,5.99,4.66,2,0,0,2,1,0,0,1
2025-10-10,02d2c45e-5b6f-4058-b05d-1fbcb475312e,"First order, 20% off 04/09/2025",promotion,2025-04-09,None,N/A,,,,,,,$ Off,0.00,0.00,USD,17th St Ammon,24968543,0,0.00,0.00,0.00,0.00,0.00,-0.00,-0.00,0.00,0.00,0.00,0,0,0,0,0,0,0,0
2025-10-10,02d2c45e-5b6f-4058-b05d-1fbcb475312e,"First order, 20% off 04/09/2025",promotion,2025-04-09,None,N/A,,,,,,,$ Off,0.00,0.00,USD,The Old Road,24898774,0,0.00,0.00,0.00,0.00,0.00,-0.00,-0.00,0.00,0.00,0.00,0,0,0,0,0,0,0,0
2025-10-10,77e23ebd-6e10-4113-938c-bb55550710f5,Spice <> Capriotti's - Sep / Oct,promotion,2025-09-18,None,N/A,,,,day,,,$ Off,0.00,0.00,USD,Roby Dr - Hammond,24891803,0,0.00,0.00,0.00,0.00,0.00,-0.00,-0.00,0.00,0.00,0.00,0,0,0,0,0,0,0,0
2025-10-10,02d2c45e-5b6f-4058-b05d-1fbcb475312e,"First order, 20% off 04/09/2025",promotion,2025-04-09,None,N/A,,,,,,,$ Off,0.00,0.00,USD,E 53rd - Davenport,582282,5,153.78,20.85,0.00,0.00,4.95,-0.00,-0.00,30.76,5.16,5.96,5,0,0,5,4,0,0,4
2025-10-10,02d2c45e-5b6f-4058-b05d-1fbcb475312e,"First order, 20% off 04/09/2025",promotion,2025-04-09,None,N/A,,,,,,,$ Off,0.00,0.00,USD,Blackstone-Fresno,24415716,2,57.03,8.84,0.00,0.00,1.98,-0.00,-0.00,28.52,5.41,5.27,2,0,0,2,1,0,0,1
2025-10-10,02d2c45e-5b6f-4058-b05d-1fbcb475312e,"First order, 20% off 04/09/2025",promotion,2025-04-09,None,N/A,,,,,,,$ Off,0.00,0.00,USD,Brayden Pkwy,2375657,7,155.91,29.19,0.00,0.00,6.93,-0.00,-0.00,22.27,5.16,4.32,7,0,0,7,5,0,0,5
2025-10-10,02d2c45e-5b6f-4058-b05d-1fbcb475312e,"First order, 20% off 04/09/2025",promotion,2025-04-09,None,N/A,,,,,,,$ Off,0.00,0.00,USD,Overland Park,24110474,4,122.70,17.08,0.00,0.00,3.96,-0.00,-0.00,30.68,5.26,5.83,4,0,0,4,1,0,0,1
2025-10-10,02d2c45e-5b6f-4058-b05d-1fbcb475312e,"First order, 20% off 04/09/2025",promotion,2025-04-09,None,N/A,,,,,,,$ Off,0.00,0.00,USD,South State Rd,1713806,5,115.31,20.48,0.00,0.00,4.95,-0.00,-0.00,23.06,5.09,4.53,5,0,0,5,3,0,0,3
2025-10-10,77e23ebd-6e10-4113-938c-bb55550710f5,Spice <> Capriotti's - Sep / Oct,promotion,2025-09-18,None,N/A,,43340528-e1b7-4f95-ab40-8dc92bf9c274,"Spend $35, Save $6 | High Price Sensitivity",day,all,Order Discount,$ Off,6.00,35.00,USD,Concord Pike,23151390,0,0.00,0.00,0.00,0.00,0.00,-0.00,-0.00,0.00,0.00,0.00,0,0,0,0,0,0,0,0
2025-10-10,02d2c45e-5b6f-4058-b05d-1fbcb475312e,"First order, 20% off 04/09/2025",promotion,2025-04-09,None,N/A,,,,,,,$ Off,0.00,0.00,USD,N Broad St,578662,2,69.56,10.00,0.00,0.00,1.98,-0.00,-0.00,34.78,5.99,5.81,2,0,0,2,0,0,0,0
2025-10-10,1dd4cf16-61f6-4935-beac-ad07a26422b3,"First order, 20% off 07/23/2025",promotion,2025-07-23,None,N/A,,,,,,,$ Off,0.00,0.00,USD,Happy Valley,23584856,1,21.88,4.38,0.00,0.00,0.99,-0.00,-0.00,21.88,5.37,4.07,1,0,0,1,1,0,0,1
2025-10-10,02d2c45e-5b6f-4058-b05d-1fbcb475312e,"First order, 20% off 04/09/2025",promotion,2025-04-09,None,N/A,,,,,,,$ Off,0.00,0.00,USD,West Craig Road,75727,7,373.48,31.75,0.00,0.00,6.93,-0.00,-0.00,53.35,5.53,9.66,7,0,0,7,4,0,0,4
2025-10-10,77e23ebd-6e10-4113-938c-bb55550710f5,Spice <> Capriotti's - Sep / Oct,promotion,2025-09-18,None,N/A,,d1d0b263-4918-4c81-8c97-630471e7185b,10% Happy Hour Discount - Medium Price Sensitivity,day,all,Order Discount,% Off,10.0%,25.00,USD,Red Rock Casino,75737,1,59.58,5.00,0.00,0.00,0.99,-0.00,-0.00,59.58,5.99,9.95,0,1,0,1,0,1,0,1
2025-10-10,77e23ebd-6e10-4113-938c-bb55550710f5,Spice <> Capriotti's - Sep / Oct,promotion,2025-09-18,None,N/A,,ba37e4d8-36c4-4cbe-8c7d-f4d1379109bd,"Spend $15, Save $3 | Low price Sensitivity",day,all,Order Discount,$ Off,3.00,15.00,USD,Byers Dr,23186665,2,40.96,6.00,0.00,0.00,1.98,-0.00,-0.00,20.48,3.99,5.13,0,2,0,2,0,1,0,1
2025-10-10,77e23ebd-6e10-4113-938c-bb55550710f5,Spice <> Capriotti's - Sep / Oct,promotion,2025-09-18,None,N/A,,ba37e4d8-36c4-4cbe-8c7d-f4d1379109bd,"Spend $15, Save $3 | Low price Sensitivity",day,all,Order Discount,$ Off,3.00,15.00,USD,Murrieta Hot Springs Rd,29652192,5,109.70,15.00,0.00,0.00,4.95,-0.00,-0.00,21.94,3.99,5.50,0,4,1,5,0,4,1,5
2025-10-10,4996d114-68d0-483f-963c-d124d822fc8f,"First order, 20% off 11/12/2024",promotion,2024-11-12,None,N/A,,,,,,,$ Off,0.00,0.00,USD,Collier Pkwy-Lutz,23057623,0,0.00,0.00,0.00,0.00,0.00,-0.00,-0.00,0.00,0.00,0.00,0,0,0,0,0,0,0,0
2025-10-10,77e23ebd-6e10-4113-938c-bb55550710f5,Spice <> Capriotti's - Sep / Oct,promotion,2025-09-18,None,N/A,,f06f33c5-bff5-4bb3-8dda-6cedeb2e6fc1,10% Happy hour Discount - Min $30 | Low Price Sensitivity,day,all,Order Discount,% Off,7.0%,30.00,USD,South State Rd,1713806,3,117.51,8.22,0.00,0.00,2.97,-0.00,-0.00,39.17,3.73,10.50,0,2,1,3,0,0,0,0
2025-10-10,77e23ebd-6e10-4113-938c-bb55550710f5,Spice <> Capriotti's - Sep / Oct,promotion,2025-09-18,None,N/A,,ba37e4d8-36c4-4cbe-8c7d-f4d1379109bd,"Spend $15, Save $3 | Low price Sensitivity",day,all,Order Discount,$ Off,3.00,15.00,USD,Nevada Way,75754,2,112.81,6.00,0.00,0.00,1.98,-0.00,-0.00,56.41,3.99,14.14,0,1,1,2,0,1,0,1
2025-10-10,5164f786-a14b-4b5d-970f-ced7eba0593a,Spend $35 get 20% off 06/03/2025,promotion,2025-06-03,None,N/A,,,,,,,$ Off,0.00,0.00,USD,Hamilton Blvd,23066760,6,272.64,54.52,0.00,0.00,5.94,-0.00,-0.00,45.44,10.08,4.51,3,3,0,6,1,2,0,3
2025-10-10,77e23ebd-6e10-4113-938c-bb55550710f5,Spice <> Capriotti's - Sep / Oct,promotion,2025-09-18,None,N/A,,ba37e4d8-36c4-4cbe-8c7d-f4d1379109bd,"Spend $15, Save $3 | Low price Sensitivity",day,all,Order Discount,$ Off,3.00,15.00,USD,Collier Pkwy-Lutz,23057623,1,46.85,3.00,0.00,0.00,0.99,-0.00,-0.00,46.85,3.99,11.74,0,1,0,1,0,1,0,1
2025-10-10,02d2c45e-5b6f-4058-b05d-1fbcb475312e,"First order, 20% off 04/09/2025",promotion,2025-04-09,None,N/A,,,,,,,$ Off,0.00,0.00,USD,Douglas Blvd,1018616,3,59.06,11.82,0.00,0.00,2.97,-0.00,-0.00,19.69,4.93,3.99,3,0,0,3,2,0,0,2
2025-10-10,77e23ebd-6e10-4113-938c-bb55550710f5,Spice <> Capriotti's - Sep / Oct,promotion,2025-09-18,None,N/A,,d1d0b263-4918-4c81-8c97-630471e7185b,10% Happy Hour Discount - Medium Price Sensitivity,day,all,Order Discount,% Off,10.0%,25.00,USD,East Craig Road,75739,1,46.77,4.68,0.00,0.00,0.99,-0.00,-0.00,46.77,5.67,8.25,0,1,0,1,0,1,0,1
2025-10-10,55ceb1d5-c2fa-48a3-8e52-3fbe10ad9c00,"Dormant customers, 20% off 07/15/2025",promotion,2025-07-16,None,N/A,,,,,,,$ Off,0.00,0.00,USD,Dana Park - Mesa,126177,2,77.96,14.00,0.00,0.00,1.98,-0.00,-0.00,38.98,7.99,4.88,0,0,2,2,0,0,1,1
2025-10-10,77e23ebd-6e10-4113-938c-bb55550710f5,Spice <> Capriotti's - Sep / Oct,promotion,2025-09-18,None,N/A,,f06f33c5-bff5-4bb3-8dda-6cedeb2e6fc1,10% Happy hour Discount - Min $30 | Low Price Sensitivity,day,all,Order Discount,% Off,7.0%,30.00,USD,University Ave,1084955,1,33.97,2.38,0.00,0.00,0.99,-0.00,-0.00,33.97,3.37,10.08,0,1,0,1,0,1,0,1
2025-10-10,77e23ebd-6e10-4113-938c-bb55550710f5,Spice <> Capriotti's - Sep / Oct,promotion,2025-09-18,None,N/A,,f06f33c5-bff5-4bb3-8dda-6cedeb2e6fc1,10% Happy hour Discount - Min $30 | Low Price Sensitivity,day,all,Order Discount,% Off,7.0%,30.00,USD,Mountain View,2608887,1,37.18,2.60,0.00,0.00,0.99,-0.00,-0.00,37.18,3.59,10.36,0,1,0,1,0,0,0,0
2025-10-10,02d2c45e-5b6f-4058-b05d-1fbcb475312e,"First order, 20% off 04/09/2025",promotion,2025-04-09,None,N/A,,,,,,,$ Off,0.00,0.00,USD,Old Town,27964,5,214.41,23.36,0.00,0.00,4.95,-0.00,-0.00,42.88,5.66,7.57,5,0,0,5,0,0,0,0
2025-10-10,f12a26e0-24e1-4d8e-ac05-d7e43f06d2bf,Happy Hour discount 11/12/2024,promotion,2024-11-12,None,N/A,,,,,,,$ Off,0.00,0.00,USD,Northdale Blvd,24976449,0,0.00,0.00,0.00,0.00,0.00,-0.00,-0.00,0.00,0.00,0.00,0,0,0,0,0,0,0,0
2025-10-10,77e23ebd-6e10-4113-938c-bb55550710f5,Spice <> Capriotti's - Sep / Oct,promotion,2025-09-18,None,N/A,,d1d0b263-4918-4c81-8c97-630471e7185b,10% Happy Hour Discount - Medium Price Sensitivity,day,all,Order Discount,% Off,10.0%,25.00,USD,Roanoke,24637171,0,0.00,0.00,0.00,0.00,0.00,-0.00,-0.00,0.00,0.00,0.00,0,0,0,0,0,0,0,0
2025-10-10,02d2c45e-5b6f-4058-b05d-1fbcb475312e,"First order, 20% off 04/09/2025",promotion,2025-04-09,None,N/A,,,,,,,$ Off,0.00,0.00,USD,S Fort Apache,75730,1,24.17,4.83,0.00,0.00,0.99,-0.00,-0.00,24.17,5.82,4.15,1,0,0,1,0,0,0,0
2025-10-10,77e23ebd-6e10-4113-938c-bb55550710f5,Spice <> Capriotti's - Sep / Oct,promotion,2025-09-18,None,N/A,,ba37e4d8-36c4-4cbe-8c7d-f4d1379109bd,"Spend $15, Save $3 | Low price Sensitivity",day,all,Order Discount,$ Off,3.00,15.00,USD,GVR Casino,75749,1,32.68,3.00,0.00,0.00,0.99,-0.00,-0.00,32.68,3.99,8.19,0,0,1,1,0,0,1,1
2025-10-10,e17f8f0c-31d2-4c57-af32-8d745f2af9df,Loyalty Promo - Capriotti's Sandwich Shop (bus id: 2324),promotion,2023-06-27,2033-06-27,N/A,,,,,,,$ Off,0.00,0.00,USD,Bel Air,23733193,12,625.96,60.00,0.00,0.00,0.00,-0.00,-0.00,52.16,5.00,10.43,0,12,0,12,0,9,0,9
2025-10-10,02d2c45e-5b6f-4058-b05d-1fbcb475312e,"First order, 20% off 04/09/2025",promotion,2025-04-09,None,N/A,,,,,,,$ Off,0.00,0.00,USD,West Cheyenne Ave,75722,1,26.38,5.00,0.00,0.00,0.99,-0.00,-0.00,26.38,5.99,4.40,1,0,0,1,1,0,0,1
2025-10-10,77e23ebd-6e10-4113-938c-bb55550710f5,Spice <> Capriotti's - Sep / Oct,promotion,2025-09-18,None,N/A,,f06f33c5-bff5-4bb3-8dda-6cedeb2e6fc1,10% Happy hour Discount - Min $30 | Low Price Sensitivity,day,all,Order Discount,% Off,7.0%,30.00,USD,Forest Drive,674540,0,0.00,0.00,0.00,0.00,0.00,-0.00,-0.00,0.00,0.00,0.00,0,0,0,0,0,0,0,0
2025-10-10,a82d49b2-a34a-4ce3-aa26-2a1d94c385eb,"All customers, $0 delivery fees 04/07/2025",promotion,2025-04-07,None,N/A,,,,,,,$ Off,0.00,0.00,USD,East Market Street,23256727,0,0.00,0.00,0.00,0.00,0.00,-0.00,-0.00,0.00,0.00,0.00,0,0,0,0,0,0,0,0
2025-10-10,77e23ebd-6e10-4113-938c-bb55550710f5,Spice <> Capriotti's - Sep / Oct,promotion,2025-09-18,None,N/A,,f06f33c5-bff5-4bb3-8dda-6cedeb2e6fc1,10% Happy hour Discount - Min $30 | Low Price Sensitivity,day,all,Order Discount,% Off,7.0%,30.00,USD,Rancho Mirage,32864869,0,0.00,0.00,0.00,0.00,0.00,-0.00,-0.00,0.00,0.00,0.00,0,0,0,0,0,0,0,0
2025-10-10,4d5a689d-a212-46a2-91dc-8288a79ff11a,"First order, 20% off 01/02/2025",promotion,2025-01-02,None,N/A,,,,,,,$ Off,0.00,0.00,USD,Bidwell - Folsom,26234909,1,30.08,5.00,0.00,0.00,0.99,-0.00,-0.00,30.08,5.99,5.02,1,0,0,1,1,0,0,1
2025-10-10,02d2c45e-5b6f-4058-b05d-1fbcb475312e,"First order, 20% off 04/09/2025",promotion,2025-04-09,None,N/A,,,,,,,$ Off,0.00,0.00,USD,South Rainbow,75732,2,56.44,9.35,0.00,0.00,1.98,-0.00,-0.00,28.22,5.67,4.98,2,0,0,2,2,0,0,2
2025-10-10,77e23ebd-6e10-4113-938c-bb55550710f5,Spice <> Capriotti's - Sep / Oct,promotion,2025-09-18,None,N/A,,91f90d8c-8a7d-41cf-9b6a-888400112024,10% Happy Hour Discount - Min  $25 | High Price Sensitivity,day,all,Order Discount,% Off,10.0%,25.00,USD,Roby Dr - Hammond,24891803,0,0.00,0.00,0.00,0.00,0.00,-0.00,-0.00,0.00,0.00,0.00,0,0,0,0,0,0,0,0
2025-10-10,02d2c45e-5b6f-4058-b05d-1fbcb475312e,"First order, 20% off 04/09/2025",promotion,2025-04-09,None,N/A,,,,,,,$ Off,0.00,0.00,USD,San Luis Obispo,23900701,3,59.46,11.90,0.00,0.00,2.97,-0.00,-0.00,19.82,4.96,4.00,3,0,0,3,0,0,0,0
2025-10-10,77e23ebd-6e10-4113-938c-bb55550710f5,Spice <> Capriotti's - Sep / Oct,promotion,2025-09-18,None,N/A,,,,day,,,$ Off,0.00,0.00,USD,N 87th Street,27965,0,0.00,0.00,0.00,0.00,0.00,-0.00,-0.00,0.00,0.00,0.00,0,0,0,0,0,0,0,0
2025-10-10,02d2c45e-5b6f-4058-b05d-1fbcb475312e,"First order, 20% off 04/09/2025",promotion,2025-04-09,None,N/A,,,,,,,$ Off,0.00,0.00,USD,Highbrook Way,33551695,2,39.86,7.97,0.00,0.00,1.98,-0.00,-0.00,19.93,4.98,4.01,2,0,0,2,1,0,0,1
2025-10-10,77e23ebd-6e10-4113-938c-bb55550710f5,Spice <> Capriotti's - Sep / Oct,promotion,2025-09-18,None,N/A,,,,day,,,$ Off,0.00,0.00,USD,"Capriotti's of Dover, Inc.",1617804,0,0.00,0.00,0.00,0.00,0.00,-0.00,-0.00,0.00,0.00,0.00,0,0,0,0,0,0,0,0
2025-10-10,02d2c45e-5b6f-4058-b05d-1fbcb475312e,"First order, 20% off 04/09/2025",promotion,2025-04-09,None,N/A,,,,,,,$ Off,0.00,0.00,USD,West Glenwood Ave,575295,0,0.00,0.00,0.00,0.00,0.00,-0.00,-0.00,0.00,0.00,0.00,0,0,0,0,0,0,0,0
2025-10-10,bdd3cdcc-32b9-405e-97aa-aada053ce3df,aliante lunch 5 off 25,promotion,2025-01-17,None,N/A,,,,,,,$ Off,0.00,0.00,USD,Aliante Casino,75725,1,28.48,5.00,0.00,0.00,0.99,-0.00,-0.00,28.48,5.99,4.75,0,1,0,1,0,1,0,1
2025-10-10,77e23ebd-6e10-4113-938c-bb55550710f5,Spice <> Capriotti's - Sep / Oct,promotion,2025-09-18,None,N/A,,f06f33c5-bff5-4bb3-8dda-6cedeb2e6fc1,10% Happy hour Discount - Min $30 | Low Price Sensitivity,day,all,Order Discount,% Off,7.0%,30.00,USD,Anthem,75750,0,0.00,0.00,0.00,0.00,0.00,-0.00,-0.00,0.00,0.00,0.00,0,0,0,0,0,0,0,0
2025-10-10,02d2c45e-5b6f-4058-b05d-1fbcb475312e,"First order, 20% off 04/09/2025",promotion,2025-04-09,None,N/A,,,,,,,$ Off,0.00,0.00,USD,Bidwell - Folsom,26234909,0,0.00,0.00,0.00,0.00,0.00,-0.00,-0.00,0.00,0.00,0.00,0,0,0,0,0,0,0,0
2025-10-10,02d2c45e-5b6f-4058-b05d-1fbcb475312e,"First order, 20% off 04/09/2025",promotion,2025-04-09,None,N/A,,,,,,,$ Off,0.00,0.00,USD,Jennersville Rd,433075,1,66.91,5.00,0.00,0.00,0.99,-0.00,-0.00,66.91,5.99,11.17,1,0,0,1,0,0,0,0
2025-10-10,02d2c45e-5b6f-4058-b05d-1fbcb475312e,"First order, 20% off 04/09/2025",promotion,2025-04-09,None,N/A,,,,,,,$ Off,0.00,0.00,USD,Sierra Hwy,27476315,0,0.00,0.00,0.00,0.00,0.00,-0.00,-0.00,0.00,0.00,0.00,0,0,0,0,0,0,0,0
2025-10-10,02d2c45e-5b6f-4058-b05d-1fbcb475312e,"First order, 20% off 04/09/2025",promotion,2025-04-09,None,N/A,,,,,,,$ Off,0.00,0.00,USD,E Silverado Ranch,75746,1,21.57,4.31,0.00,0.00,0.99,-0.00,-0.00,21.57,5.30,4.07,1,0,0,1,0,0,0,0
2025-10-10,2bb77af0-6b48-46d5-97b3-e43758ea5314,"First order, 20% off 02/01/2025",promotion,2025-02-01,None,N/A,,,,,,,$ Off,0.00,0.00,USD,The Old Road,24898774,0,0.00,0.00,0.00,0.00,0.00,-0.00,-0.00,0.00,0.00,0.00,0,0,0,0,0,0,0,0
2025-10-10,02d2c45e-5b6f-4058-b05d-1fbcb475312e,"First order, 20% off 04/09/2025",promotion,2025-04-09,None,N/A,,,,,,,$ Off,0.00,0.00,USD,East 82nd St,184537,3,72.92,13.58,0.00,0.00,2.97,-0.00,-0.00,24.31,5.52,4.41,3,0,0,3,0,0,0,0
2025-10-10,02d2c45e-5b6f-4058-b05d-1fbcb475312e,"First order, 20% off 04/09/2025",promotion,2025-04-09,None,N/A,,,,,,,$ Off,0.00,0.00,USD,"Capriotti's of Dover, Inc.",1617804,0,0.00,0.00,0.00,0.00,0.00,-0.00,-0.00,0.00,0.00,0.00,0,0,0,0,0,0,0,0
2025-10-10,02d2c45e-5b6f-4058-b05d-1fbcb475312e,"First order, 20% off 04/09/2025",promotion,2025-04-09,None,N/A,,,,,,,$ Off,0.00,0.00,USD,Heart Pine-Odessa,2232632,0,0.00,0.00,0.00,0.00,0.00,-0.00,-0.00,0.00,0.00,0.00,0,0,0,0,0,0,0,0
2025-10-10,22a1aa22-01b8-4784-a262-c64e4855ebce,"Dormant customers, 20% off 07/31/2024",promotion,2024-07-31,None,N/A,,,,,,,$ Off,0.00,0.00,USD,East Sepulveda,1743753,0,0.00,0.00,0.00,0.00,0.00,-0.00,-0.00,0.00,0.00,0.00,0,0,0,0,0,0,0,0
2025-10-10,77e23ebd-6e10-4113-938c-bb55550710f5,Spice <> Capriotti's - Sep / Oct,promotion,2025-09-18,None,N/A,,f06f33c5-bff5-4bb3-8dda-6cedeb2e6fc1,10% Happy hour Discount - Min $30 | Low Price Sensitivity,day,all,Order Discount,% Off,7.0%,30.00,USD,Highlands Ranch,1791292,0,0.00,0.00,0.00,0.00,0.00,-0.00,-0.00,0.00,0.00,0.00,0,0,0,0,0,0,0,0
2025-10-10,77e23ebd-6e10-4113-938c-bb55550710f5,Spice <> Capriotti's - Sep / Oct,promotion,2025-09-18,None,N/A,,d1d0b263-4918-4c81-8c97-630471e7185b,10% Happy Hour Discount - Medium Price Sensitivity,day,all,Order Discount,% Off,10.0%,25.00,USD,West Craig Road,75727,1,30.69,3.07,0.00,0.00,0.99,-0.00,-0.00,30.69,4.06,7.56,0,1,0,1,0,1,0,1
2025-10-10,77e23ebd-6e10-4113-938c-bb55550710f5,Spice <> Capriotti's - Sep / Oct,promotion,2025-09-18,None,N/A,,ba37e4d8-36c4-4cbe-8c7d-f4d1379109bd,"Spend $15, Save $3 | Low price Sensitivity",day,all,Order Discount,$ Off,3.00,15.00,USD,Brayden Pkwy,2375657,4,80.13,12.00,0.00,0.00,3.96,-0.00,-0.00,20.03,3.99,5.02,0,3,1,4,0,2,1,3
2025-10-10,77e23ebd-6e10-4113-938c-bb55550710f5,Spice <> Capriotti's - Sep / Oct,promotion,2025-09-18,None,N/A,,ba37e4d8-36c4-4cbe-8c7d-f4d1379109bd,"Spend $15, Save $3 | Low price Sensitivity",day,all,Order Discount,$ Off,3.00,15.00,USD,International Pkwy,24671402,0,0.00,0.00,0.00,0.00,0.00,-0.00,-0.00,0.00,0.00,0.00,0,0,0,0,0,0,0,0
2025-10-10,77e23ebd-6e10-4113-938c-bb55550710f5,Spice <> Capriotti's - Sep / Oct,promotion,2025-09-18,None,N/A,,d1d0b263-4918-4c81-8c97-630471e7185b,10% Happy Hour Discount - Medium Price Sensitivity,day,all,Order Discount,% Off,10.0%,25.00,USD,Paradise Road,75734,1,26.77,2.68,0.00,0.00,0.99,-0.00,-0.00,26.77,3.67,7.29,0,1,0,1,0,0,0,0
2025-10-10,02d2c45e-5b6f-4058-b05d-1fbcb475312e,"First order, 20% off 04/09/2025",promotion,2025-04-09,None,N/A,,,,,,,$ Off,0.00,0.00,USD,St Rose Pkwy,1335286,1,16.88,3.38,0.00,0.00,0.99,-0.00,-0.00,16.88,4.37,3.86,1,0,0,1,0,0,0,0
2025-10-10,77e23ebd-6e10-4113-938c-bb55550710f5,Spice <> Capriotti's - Sep / Oct,promotion,2025-09-18,None,N/A,,f06f33c5-bff5-4bb3-8dda-6cedeb2e6fc1,10% Happy hour Discount - Min $30 | Low Price Sensitivity,day,all,Order Discount,% Off,7.0%,30.00,USD,Overland Park,24110474,1,36.96,2.59,0.00,0.00,0.99,-0.00,-0.00,36.96,3.58,10.32,0,1,0,1,0,1,0,1
2025-10-10,02d2c45e-5b6f-4058-b05d-1fbcb475312e,"First order, 20% off 04/09/2025",promotion,2025-04-09,None,N/A,,,,,,,$ Off,0.00,0.00,USD,Maryland Pkwy,1007892,3,86.61,13.24,0.00,0.00,2.97,-0.00,-0.00,28.87,5.40,5.34,3,0,0,3,1,0,0,1
2025-10-10,77e23ebd-6e10-4113-938c-bb55550710f5,Spice <> Capriotti's - Sep / Oct,promotion,2025-09-18,None,N/A,,d1d0b263-4918-4c81-8c97-630471e7185b,10% Happy Hour Discount - Medium Price Sensitivity,day,all,Order Discount,% Off,10.0%,25.00,USD,Blue Diamond Road,333447,0,0.00,0.00,0.00,0.00,0.00,-0.00,-0.00,0.00,0.00,0.00,0,0,0,0,0,0,0,0
2025-10-10,77e23ebd-6e10-4113-938c-bb55550710f5,Spice <> Capriotti's - Sep / Oct,promotion,2025-09-18,None,N/A,,,,day,,,$ Off,0.00,0.00,USD,Ogletown Stanton,422117,0,0.00,0.00,0.00,0.00,0.00,-0.00,-0.00,0.00,0.00,0.00,0,0,0,0,0,0,0,0
2025-10-10,77e23ebd-6e10-4113-938c-bb55550710f5,Spice <> Capriotti's - Sep / Oct,promotion,2025-09-18,None,N/A,,43340528-e1b7-4f95-ab40-8dc92bf9c274,"Spend $35, Save $6 | High Price Sensitivity",day,all,Order Discount,$ Off,6.00,35.00,USD,"Capriotti's of Milford, LLC",1636430,2,84.44,12.00,0.00,0.00,1.98,-0.00,-0.00,42.22,6.99,6.04,2,0,0,2,1,0,0,1
2025-10-10,77e23ebd-6e10-4113-938c-bb55550710f5,Spice <> Capriotti's - Sep / Oct,promotion,2025-09-18,None,N/A,,d1d0b263-4918-4c81-8c97-630471e7185b,10% Happy Hour Discount - Medium Price Sensitivity,day,all,Order Discount,% Off,10.0%,25.00,USD,Hwy 72 - Madison,27685318,4,146.86,14.70,0.00,0.00,3.96,-0.00,-0.00,36.72,4.67,7.87,0,4,0,4,0,4,0,4
2025-10-10,77e23ebd-6e10-4113-938c-bb55550710f5,Spice <> Capriotti's - Sep / Oct,promotion,2025-09-18,None,N/A,,43340528-e1b7-4f95-ab40-8dc92bf9c274,"Spend $35, Save $6 | High Price Sensitivity",day,all,Order Discount,$ Off,6.00,35.00,USD,Blackstone-Fresno,24415716,0,0.00,0.00,0.00,0.00,0.00,-0.00,-0.00,0.00,0.00,0.00,0,0,0,0,0,0,0,0
2025-10-10,77e23ebd-6e10-4113-938c-bb55550710f5,Spice <> Capriotti's - Sep / Oct,promotion,2025-09-18,None,N/A,,d1d0b263-4918-4c81-8c97-630471e7185b,10% Happy Hour Discount - Medium Price Sensitivity,day,all,Order Discount,% Off,10.0%,25.00,USD,Sunset and Sandhill,32849799,1,37.75,3.78,0.00,0.00,0.99,-0.00,-0.00,37.75,4.77,7.91,0,0,1,1,0,0,0,0
2025-10-10,77e23ebd-6e10-4113-938c-bb55550710f5,Spice <> Capriotti's - Sep / Oct,promotion,2025-09-18,None,N/A,,91f90d8c-8a7d-41cf-9b6a-888400112024,10% Happy Hour Discount - Min  $25 | High Price Sensitivity,day,all,Order Discount,% Off,10.0%,25.00,USD,Blackstone-Fresno,24415716,1,50.95,5.00,0.00,0.00,0.99,-0.00,-0.00,50.95,5.99,8.51,0,1,0,1,0,0,0,0
2025-10-10,77e23ebd-6e10-4113-938c-bb55550710f5,Spice <> Capriotti's - Sep / Oct,promotion,2025-09-18,None,N/A,,ba37e4d8-36c4-4cbe-8c7d-f4d1379109bd,"Spend $15, Save $3 | Low price Sensitivity",day,all,Order Discount,$ Off,3.00,15.00,USD,South State Rd,1713806,4,160.32,12.00,0.00,0.00,3.96,-0.00,-0.00,40.08,3.99,10.05,0,4,0,4,0,4,0,4
2025-10-10,77e23ebd-6e10-4113-938c-bb55550710f5,Spice <> Capriotti's - Sep / Oct,promotion,2025-09-18,None,N/A,,f06f33c5-bff5-4bb3-8dda-6cedeb2e6fc1,10% Happy hour Discount - Min $30 | Low Price Sensitivity,day,all,Order Discount,% Off,7.0%,30.00,USD,Heart Pine-Odessa,2232632,0,0.00,0.00,0.00,0.00,0.00,-0.00,-0.00,0.00,0.00,0.00,0,0,0,0,0,0,0,0
2025-10-10,77e23ebd-6e10-4113-938c-bb55550710f5,Spice <> Capriotti's - Sep / Oct,promotion,2025-09-18,None,N/A,,d1d0b263-4918-4c81-8c97-630471e7185b,10% Happy Hour Discount - Medium Price Sensitivity,day,all,Order Discount,% Off,10.0%,25.00,USD,Manchester Rd,27715447,0,0.00,0.00,0.00,0.00,0.00,-0.00,-0.00,0.00,0.00,0.00,0,0,0,0,0,0,0,0
2025-10-10,77e23ebd-6e10-4113-938c-bb55550710f5,Spice <> Capriotti's - Sep / Oct,promotion,2025-09-18,None,N/A,,ba37e4d8-36c4-4cbe-8c7d-f4d1379109bd,"Spend $15, Save $3 | Low price Sensitivity",day,all,Order Discount,$ Off,3.00,15.00,USD,Kent Island,691089,1,19.27,3.00,0.00,0.00,0.99,-0.00,-0.00,19.27,3.99,4.83,0,1,0,1,0,0,0,0
2025-10-10,ff18ac99-74db-48ce-9c94-2959c91b6665,Capriotti's Sandwich Shop's Promo Campaign,promotion,2025-10-02,None,N/A,,,,day,,,$ Off,0.00,0.00,USD,Waialae Ave,25380836,0,0.00,0.00,0.00,0.00,0.00,-0.00,-0.00,0.00,0.00,0.00,0,0,0,0,0,0,0,0
2025-10-10,77e23ebd-6e10-4113-938c-bb55550710f5,Spice <> Capriotti's - Sep / Oct,promotion,2025-09-18,None,N/A,,d1d0b263-4918-4c81-8c97-630471e7185b,10% Happy Hour Discount - Medium Price Sensitivity,day,all,Order Discount,% Off,10.0%,25.00,USD,West Flamingo Road,75731,0,0.00,0.00,0.00,0.00,0.00,-0.00,-0.00,0.00,0.00,0.00,0,0,0,0,0,0,0,0
2025-10-10,77e23ebd-6e10-4113-938c-bb55550710f5,Spice <> Capriotti's - Sep / Oct,promotion,2025-09-18,None,N/A,,43340528-e1b7-4f95-ab40-8dc92bf9c274,"Spend $35, Save $6 | High Price Sensitivity",day,all,Order Discount,$ Off,6.00,35.00,USD,South  Walton Blvd,1616214,7,280.99,42.00,0.00,0.00,6.93,-0.00,-0.00,40.14,6.99,5.74,1,4,2,7,1,3,1,5
2025-10-10,02d2c45e-5b6f-4058-b05d-1fbcb475312e,"First order, 20% off 04/09/2025",promotion,2025-04-09,None,N/A,,,,,,,$ Off,0.00,0.00,USD,Catclaw - Abilene,29652227,2,46.48,8.92,0.00,0.00,1.98,-0.00,-0.00,23.24,5.45,4.26,2,0,0,2,1,0,0,1
2025-10-10,77e23ebd-6e10-4113-938c-bb55550710f5,Spice <> Capriotti's - Sep / Oct,promotion,2025-09-18,None,N/A,,f06f33c5-bff5-4bb3-8dda-6cedeb2e6fc1,10% Happy hour Discount - Min $30 | Low Price Sensitivity,day,all,Order Discount,% Off,7.0%,30.00,USD,Kent Island,691089,0,0.00,0.00,0.00,0.00,0.00,-0.00,-0.00,0.00,0.00,0.00,0,0,0,0,0,0,0,0
2025-10-10,77e23ebd-6e10-4113-938c-bb55550710f5,Spice <> Capriotti's - Sep / Oct,promotion,2025-09-18,None,N/A,,,,day,,,$ Off,0.00,0.00,USD,Zionsville,24415273,0,0.00,0.00,0.00,0.00,0.00,-0.00,-0.00,0.00,0.00,0.00,0,0,0,0,0,0,0,0
2025-10-10,77e23ebd-6e10-4113-938c-bb55550710f5,Spice <> Capriotti's - Sep / Oct,promotion,2025-09-18,None,N/A,,d1d0b263-4918-4c81-8c97-630471e7185b,10% Happy Hour Discount - Medium Price Sensitivity,day,all,Order Discount,% Off,10.0%,25.00,USD,E William Street,1053361,0,0.00,0.00,0.00,0.00,0.00,-0.00,-0.00,0.00,0.00,0.00,0,0,0,0,0,0,0,0
2025-10-10,77e23ebd-6e10-4113-938c-bb55550710f5,Spice <> Capriotti's - Sep / Oct,promotion,2025-09-18,None,N/A,,,,day,,,$ Off,0.00,0.00,USD,Raccoon Rd,26015022,0,0.00,0.00,0.00,0.00,0.00,-0.00,-0.00,0.00,0.00,0.00,0,0,0,0,0,0,0,0
2025-10-10,83157f11-58f6-496d-bef9-af8b72eb8cf4,"Buy 1, get 1 free promotion 07/21/2025",promotion,2025-07-22,None,N/A,,,,,,,$ Off,0.00,0.00,USD,Chicago River West,34048823,5,206.87,25.35,0.00,0.00,4.95,-0.00,-0.00,41.37,6.06,6.83,3,2,0,5,3,2,0,5
2025-10-10,77e23ebd-6e10-4113-938c-bb55550710f5,Spice <> Capriotti's - Sep / Oct,promotion,2025-09-18,None,N/A,,f06f33c5-bff5-4bb3-8dda-6cedeb2e6fc1,10% Happy hour Discount - Min $30 | Low Price Sensitivity,day,all,Order Discount,% Off,7.0%,30.00,USD,Sierra Hwy,27476315,0,0.00,0.00,0.00,0.00,0.00,-0.00,-0.00,0.00,0.00,0.00,0,0,0,0,0,0,0,0
2025-10-10,77e23ebd-6e10-4113-938c-bb55550710f5,Spice <> Capriotti's - Sep / Oct,promotion,2025-09-18,None,N/A,,43340528-e1b7-4f95-ab40-8dc92bf9c274,"Spend $35, Save $6 | High Price Sensitivity",day,all,Order Discount,$ Off,6.00,35.00,USD,Catclaw - Abilene,29652227,2,81.73,12.00,0.00,0.00,1.98,-0.00,-0.00,40.87,6.99,5.85,0,2,0,2,0,2,0,2
2025-10-10,77e23ebd-6e10-4113-938c-bb55550710f5,Spice <> Capriotti's - Sep / Oct,promotion,2025-09-18,None,N/A,,ba37e4d8-36c4-4cbe-8c7d-f4d1379109bd,"Spend $15, Save $3 | Low price Sensitivity",day,all,Order Discount,$ Off,3.00,15.00,USD,Forest Drive,674540,3,66.74,9.00,0.00,0.00,2.97,-0.00,-0.00,22.25,3.99,5.58,0,3,0,3,0,3,0,3
2025-10-10,77e23ebd-6e10-4113-938c-bb55550710f5,Spice <> Capriotti's - Sep / Oct,promotion,2025-09-18,None,N/A,,,,day,,,$ Off,0.00,0.00,USD,International Pkwy,24671402,0,0.00,0.00,0.00,0.00,0.00,-0.00,-0.00,0.00,0.00,0.00,0,0,0,0,0,0,0,0
2025-10-10,02d2c45e-5b6f-4058-b05d-1fbcb475312e,"First order, 20% off 04/09/2025",promotion,2025-04-09,None,N/A,,,,,,,$ Off,0.00,0.00,USD,Gambrills,24415514,0,0.00,0.00,0.00,0.00,0.00,-0.00,-0.00,0.00,0.00,0.00,0,0,0,0,0,0,0,0
2025-10-10,77e23ebd-6e10-4113-938c-bb55550710f5,Spice <> Capriotti's - Sep / Oct,promotion,2025-09-18,None,N/A,,f06f33c5-bff5-4bb3-8dda-6cedeb2e6fc1,10% Happy hour Discount - Min $30 | Low Price Sensitivity,day,all,Order Discount,% Off,7.0%,30.00,USD,Townpark Lane,128721,0,0.00,0.00,0.00,0.00,0.00,-0.00,-0.00,0.00,0.00,0.00,0,0,0,0,0,0,0,0
2025-10-10,77e23ebd-6e10-4113-938c-bb55550710f5,Spice <> Capriotti's - Sep / Oct,promotion,2025-09-18,None,N/A,,ba37e4d8-36c4-4cbe-8c7d-f4d1379109bd,"Spend $15, Save $3 | Low price Sensitivity",day,all,Order Discount,$ Off,3.00,15.00,USD,Downingtown,33699763,2,36.46,6.00,0.00,0.00,1.98,-0.00,-0.00,18.23,3.99,4.57,0,1,1,2,0,1,1,2
2025-10-10,77e23ebd-6e10-4113-938c-bb55550710f5,Spice <> Capriotti's - Sep / Oct,promotion,2025-09-18,None,N/A,,d1d0b263-4918-4c81-8c97-630471e7185b,10% Happy Hour Discount - Medium Price Sensitivity,day,all,Order Discount,% Off,10.0%,25.00,USD,Nature Park Drive,75726,1,26.39,2.64,0.00,0.00,0.99,-0.00,-0.00,26.39,3.63,7.27,0,1,0,1,0,0,0,0
2025-10-10,77e23ebd-6e10-4113-938c-bb55550710f5,Spice <> Capriotti's - Sep / Oct,promotion,2025-09-18,None,N/A,,d1d0b263-4918-4c81-8c97-630471e7185b,10% Happy Hour Discount - Medium Price Sensitivity,day,all,Order Discount,% Off,10.0%,25.00,USD,17th St Ammon,24968543,0,0.00,0.00,0.00,0.00,0.00,-0.00,-0.00,0.00,0.00,0.00,0,0,0,0,0,0,0,0
2025-10-10,77e23ebd-6e10-4113-938c-bb55550710f5,Spice <> Capriotti's - Sep / Oct,promotion,2025-09-18,None,N/A,,91f90d8c-8a7d-41cf-9b6a-888400112024,10% Happy Hour Discount - Min  $25 | High Price Sensitivity,day,all,Order Discount,% Off,10.0%,25.00,USD,Shepherd - Fresno,24559604,1,74.35,5.00,0.00,0.00,0.99,-0.00,-0.00,74.35,5.99,12.41,1,0,0,1,0,0,0,0
2025-10-10,77e23ebd-6e10-4113-938c-bb55550710f5,Spice <> Capriotti's - Sep / Oct,promotion,2025-09-18,None,N/A,,ba37e4d8-36c4-4cbe-8c7d-f4d1379109bd,"Spend $15, Save $3 | Low price Sensitivity",day,all,Order Discount,$ Off,3.00,15.00,USD,Princeton,32118309,2,436.12,6.00,0.00,0.00,1.98,-0.00,-0.00,218.06,3.99,54.65,1,1,0,2,1,1,0,2
2025-10-10,58fe435a-cdf8-4a86-abc7-b68d7b574ba5,Spend $25 Get 20% Off,promotion,2022-12-01,None,N/A,,,,,,,$ Off,0.00,0.00,USD,Boulder Station,23349419,1,163.89,9.00,0.00,0.00,0.99,-0.00,-0.00,163.89,9.99,16.41,0,1,0,1,0,0,0,0
2025-10-10,02d2c45e-5b6f-4058-b05d-1fbcb475312e,"First order, 20% off 04/09/2025",promotion,2025-04-09,None,N/A,,,,,,,$ Off,0.00,0.00,USD,North Boulder Hwy,75752,3,76.04,13.84,0.00,0.00,2.97,-0.00,-0.00,25.35,5.60,4.52,3,0,0,3,0,0,0,0
2025-10-10,b2e42382-0262-4b42-bbf3-d1a2efa87346,Happy Hour discount 09/24/2024,promotion,2024-09-24,None,N/A,,,,,,,$ Off,0.00,0.00,USD,Townpark Lane,128721,6,155.18,39.39,0.00,0.00,5.94,-0.00,-0.00,25.86,7.56,3.42,2,3,1,6,1,3,0,4
2025-10-10,02d2c45e-5b6f-4058-b05d-1fbcb475312e,"First order, 20% off 04/09/2025",promotion,2025-04-09,None,N/A,,,,,,,$ Off,0.00,0.00,USD,Rancho Mirage,32864869,7,178.15,33.84,0.00,0.00,6.93,-0.00,-0.00,25.45,5.82,4.37,7,0,0,7,4,0,0,4
2025-10-10,02d2c45e-5b6f-4058-b05d-1fbcb475312e,"First order, 20% off 04/09/2025",promotion,2025-04-09,None,N/A,,,,,,,$ Off,0.00,0.00,USD,Sunrise Blvd,31345439,0,0.00,0.00,0.00,0.00,0.00,-0.00,-0.00,0.00,0.00,0.00,0,0,0,0,0,0,0,0
2025-10-10,02d2c45e-5b6f-4058-b05d-1fbcb475312e,"First order, 20% off 04/09/2025",promotion,2025-04-09,None,N/A,,,,,,,$ Off,0.00,0.00,USD,Nevada Way,75754,1,17.28,3.46,0.00,0.00,0.99,-0.00,-0.00,17.28,4.45,3.88,1,0,0,1,1,0,0,1
2025-10-10,77e23ebd-6e10-4113-938c-bb55550710f5,Spice <> Capriotti's - Sep / Oct,promotion,2025-09-18,None,N/A,,,,day,,,$ Off,0.00,0.00,USD,"Capriotti's of Milford, LLC",1636430,0,0.00,0.00,0.00,0.00,0.00,-0.00,-0.00,0.00,0.00,0.00,0,0,0,0,0,0,0,0
2025-10-10,02d2c45e-5b6f-4058-b05d-1fbcb475312e,"First order, 20% off 04/09/2025",promotion,2025-04-09,None,N/A,,,,,,,$ Off,0.00,0.00,USD,Kirkwood Hwy,390889,0,0.00,0.00,0.00,0.00,0.00,-0.00,-0.00,0.00,0.00,0.00,0,0,0,0,0,0,0,0
2025-10-10,77e23ebd-6e10-4113-938c-bb55550710f5,Spice <> Capriotti's - Sep / Oct,promotion,2025-09-18,None,N/A,,,,day,,,$ Off,0.00,0.00,USD,Cortez Rd  West,26034424,0,0.00,0.00,0.00,0.00,0.00,-0.00,-0.00,0.00,0.00,0.00,0,0,0,0,0,0,0,0
2025-10-10,77e23ebd-6e10-4113-938c-bb55550710f5,Spice <> Capriotti's - Sep / Oct,promotion,2025-09-18,None,N/A,,91f90d8c-8a7d-41cf-9b6a-888400112024,10% Happy Hour Discount - Min  $25 | High Price Sensitivity,day,all,Order Discount,% Off,10.0%,25.00,USD,"Capriotti's of Milford, LLC",1636430,0,0.00,0.00,0.00,0.00,0.00,-0.00,-0.00,0.00,0.00,0.00,0,0,0,0,0,0,0,0
2025-10-10,02d2c45e-5b6f-4058-b05d-1fbcb475312e,"First order, 20% off 04/09/2025",promotion,2025-04-09,None,N/A,,,,,,,$ Off,0.00,0.00,USD,Southern Highlands,1750142,2,59.00,9.03,0.00,0.00,1.98,-0.00,-0.00,29.50,5.51,5.36,2,0,0,2,0,0,0,0
2025-10-10,02d2c45e-5b6f-4058-b05d-1fbcb475312e,"First order, 20% off 04/09/2025",promotion,2025-04-09,None,N/A,,,,,,,$ Off,0.00,0.00,USD,Kennett Square,575296,0,0.00,0.00,0.00,0.00,0.00,-0.00,-0.00,0.00,0.00,0.00,0,0,0,0,0,0,0,0
2025-10-10,02d2c45e-5b6f-4058-b05d-1fbcb475312e,"First order, 20% off 04/09/2025",promotion,2025-04-09,None,N/A,,,,,,,$ Off,0.00,0.00,USD,S Stanford Way,699470,2,77.25,10.00,0.00,0.00,1.98,-0.00,-0.00,38.63,5.99,6.45,2,0,0,2,0,0,0,0
2025-10-10,bb58e40c-0a14-4e1f-bb4a-73209746887e,Spend $35 get 20% off 02/17/2025,promotion,2025-02-17,None,N/A,,,,,,,$ Off,0.00,0.00,USD,Cranberry Township,24851842,6,263.81,51.35,0.00,0.00,5.94,-0.00,-0.00,43.97,9.55,4.60,2,4,0,6,2,2,0,4
2025-10-10,03e9f5c4-3136-4c5b-bb26-18b988f441f5,"Buy 1, get 1 free promotion 07/24/2025",promotion,2025-07-24,None,N/A,,,,,,,$ Off,0.00,0.00,USD,West Fullerton Ave,23349403,3,123.94,14.07,0.00,0.00,2.97,-0.00,-0.00,41.31,5.68,7.27,2,1,0,3,1,0,0,1
2025-10-10,02d2c45e-5b6f-4058-b05d-1fbcb475312e,"First order, 20% off 04/09/2025",promotion,2025-04-09,None,N/A,,,,,,,$ Off,0.00,0.00,USD,Silverside Road,691182,2,39.16,7.84,0.00,0.00,1.98,-0.00,-0.00,19.58,4.91,3.99,2,0,0,2,1,0,0,1
2025-10-10,02d2c45e-5b6f-4058-b05d-1fbcb475312e,"First order, 20% off 04/09/2025",promotion,2025-04-09,None,N/A,,,,,,,$ Off,0.00,0.00,USD,S Marion Road,1742411,3,88.54,14.56,0.00,0.00,2.97,-0.00,-0.00,29.51,5.84,5.05,3,0,0,3,2,0,0,2
2025-10-10,02d2c45e-5b6f-4058-b05d-1fbcb475312e,"First order, 20% off 04/09/2025",promotion,2025-04-09,None,N/A,,,,,,,$ Off,0.00,0.00,USD,Byers Dr,23186665,1,15.59,3.12,0.00,0.00,0.99,-0.00,-0.00,15.59,4.11,3.79,1,0,0,1,0,0,0,0
2025-10-10,02d2c45e-5b6f-4058-b05d-1fbcb475312e,"First order, 20% off 04/09/2025",promotion,2025-04-09,None,N/A,,,,,,,$ Off,0.00,0.00,USD,West Flamingo Road,75731,4,132.09,18.91,0.00,0.00,3.96,-0.00,-0.00,33.02,5.72,5.78,4,0,0,4,1,0,0,1
2025-10-10,02d2c45e-5b6f-4058-b05d-1fbcb475312e,"First order, 20% off 04/09/2025",promotion,2025-04-09,None,N/A,,,,,,,$ Off,0.00,0.00,USD,International Pkwy,24671402,3,105.81,14.97,0.00,0.00,2.97,-0.00,-0.00,35.27,5.98,5.90,3,0,0,3,2,0,0,2
2025-10-10,02d2c45e-5b6f-4058-b05d-1fbcb475312e,"First order, 20% off 04/09/2025",promotion,2025-04-09,None,N/A,,,,,,,$ Off,0.00,0.00,USD,Castle Rock,23057614,4,136.52,19.38,0.00,0.00,3.96,-0.00,-0.00,34.13,5.84,5.85,4,0,0,4,2,0,0,2
2025-10-10,02d2c45e-5b6f-4058-b05d-1fbcb475312e,"First order, 20% off 04/09/2025",promotion,2025-04-09,None,N/A,,,,,,,$ Off,0.00,0.00,USD,Smithtown Bypass,23349427,0,0.00,0.00,0.00,0.00,0.00,-0.00,-0.00,0.00,0.00,0.00,0,0,0,0,0,0,0,0
2025-10-10,77e23ebd-6e10-4113-938c-bb55550710f5,Spice <> Capriotti's - Sep / Oct,promotion,2025-09-18,None,N/A,,,,day,,,$ Off,0.00,0.00,USD,Governor Ritchie,24121153,0,0.00,0.00,0.00,0.00,0.00,-0.00,-0.00,0.00,0.00,0.00,0,0,0,0,0,0,0,0
2025-10-10,178f54dc-804b-413e-b1bd-ffbdde7f61a1,"Dormant customers, 20% off 02/01/2025",promotion,2025-02-01,None,N/A,,,,,,,$ Off,0.00,0.00,USD,Sierra Hwy,27476315,0,0.00,0.00,0.00,0.00,0.00,-0.00,-0.00,0.00,0.00,0.00,0,0,0,0,0,0,0,0
2025-10-10,77e23ebd-6e10-4113-938c-bb55550710f5,Spice <> Capriotti's - Sep / Oct,promotion,2025-09-18,None,N/A,,91f90d8c-8a7d-41cf-9b6a-888400112024,10% Happy Hour Discount - Min  $25 | High Price Sensitivity,day,all,Order Discount,% Off,10.0%,25.00,USD,North Union St,575293,3,160.91,12.46,0.00,0.00,2.97,-0.00,-0.00,53.64,5.14,10.43,0,2,1,3,0,1,1,2
2025-10-10,02d2c45e-5b6f-4058-b05d-1fbcb475312e,"First order, 20% off 04/09/2025",promotion,2025-04-09,None,N/A,,,,,,,$ Off,0.00,0.00,USD,Red Rock Casino,75737,0,0.00,0.00,0.00,0.00,0.00,-0.00,-0.00,0.00,0.00,0.00,0,0,0,0,0,0,0,0
2025-10-10,14ad5a9c-e239-4129-b8dc-5284d46f80da,Spend $30 get 20% off 10/08/2025,promotion,2025-10-08,2025-11-08,N/A,,,,,,,$ Off,0.00,0.00,USD,Cortez Rd  West,26034424,6,315.97,52.21,0.00,0.00,5.94,-0.00,-0.00,52.66,9.69,5.43,0,5,1,6,0,5,1,6
2025-10-10,77e23ebd-6e10-4113-938c-bb55550710f5,Spice <> Capriotti's - Sep / Oct,promotion,2025-09-18,None,N/A,,,,day,,,$ Off,0.00,0.00,USD,Terrace Center,321047,0,0.00,0.00,0.00,0.00,0.00,-0.00,-0.00,0.00,0.00,0.00,0,0,0,0,0,0,0,0
2025-10-10,22a1aa22-01b8-4784-a262-c64e4855ebce,"Dormant customers, 20% off 07/31/2024",promotion,2024-07-31,None,N/A,,,,,,,$ Off,0.00,0.00,USD,De Soto-Chatsworth,651597,1,21.07,4.21,0.00,0.00,0.99,-0.00,-0.00,21.07,5.20,4.05,0,0,1,1,0,0,1,1
2025-10-10,77e23ebd-6e10-4113-938c-bb55550710f5,Spice <> Capriotti's - Sep / Oct,promotion,2025-09-18,None,N/A,,d1d0b263-4918-4c81-8c97-630471e7185b,10% Happy Hour Discount - Medium Price Sensitivity,day,all,Order Discount,% Off,10.0%,25.00,USD,Northdale Blvd,24976449,0,0.00,0.00,0.00,0.00,0.00,-0.00,-0.00,0.00,0.00,0.00,0,0,0,0,0,0,0,0
2025-10-10,77e23ebd-6e10-4113-938c-bb55550710f5,Spice <> Capriotti's - Sep / Oct,promotion,2025-09-18,None,N/A,,,,day,,,$ Off,0.00,0.00,USD,Douglas Blvd,1018616,0,0.00,0.00,0.00,0.00,0.00,-0.00,-0.00,0.00,0.00,0.00,0,0,0,0,0,0,0,0
2025-10-10,77e23ebd-6e10-4113-938c-bb55550710f5,Spice <> Capriotti's - Sep / Oct,promotion,2025-09-18,None,N/A,,43340528-e1b7-4f95-ab40-8dc92bf9c274,"Spend $35, Save $6 | High Price Sensitivity",day,all,Order Discount,$ Off,6.00,35.00,USD,Palm Ave - Fresno,1581092,2,84.56,12.00,0.00,0.00,1.98,-0.00,-0.00,42.28,6.99,6.05,0,1,1,2,0,0,0,0
2025-10-10,77e23ebd-6e10-4113-938c-bb55550710f5,Spice <> Capriotti's - Sep / Oct,promotion,2025-09-18,None,N/A,,f06f33c5-bff5-4bb3-8dda-6cedeb2e6fc1,10% Happy hour Discount - Min $30 | Low Price Sensitivity,day,all,Order Discount,% Off,7.0%,30.00,USD,Gambrills,24415514,0,0.00,0.00,0.00,0.00,0.00,-0.00,-0.00,0.00,0.00,0.00,0,0,0,0,0,0,0,0
2025-10-10,77e23ebd-6e10-4113-938c-bb55550710f5,Spice <> Capriotti's - Sep / Oct,promotion,2025-09-18,None,N/A,,43340528-e1b7-4f95-ab40-8dc92bf9c274,"Spend $35, Save $6 | High Price Sensitivity",day,all,Order Discount,$ Off,6.00,35.00,USD,Kirkwood Hwy,390889,3,152.00,18.00,0.00,0.00,2.97,-0.00,-0.00,50.67,6.99,7.25,0,2,1,3,0,0,1,1
2025-10-10,77e23ebd-6e10-4113-938c-bb55550710f5,Spice <> Capriotti's - Sep / Oct,promotion,2025-09-18,None,N/A,,f06f33c5-bff5-4bb3-8dda-6cedeb2e6fc1,10% Happy hour Discount - Min $30 | Low Price Sensitivity,day,all,Order Discount,% Off,7.0%,30.00,USD,Cortez Rd  West,26034424,0,0.00,0.00,0.00,0.00,0.00,-0.00,-0.00,0.00,0.00,0.00,0,0,0,0,0,0,0,0
2025-10-10,77e23ebd-6e10-4113-938c-bb55550710f5,Spice <> Capriotti's - Sep / Oct,promotion,2025-09-18,None,N/A,,d1d0b263-4918-4c81-8c97-630471e7185b,10% Happy Hour Discount - Medium Price Sensitivity,day,all,Order Discount,% Off,10.0%,25.00,USD,North Haven Ave,28834163,1,47.96,4.80,0.00,0.00,0.99,-0.00,-0.00,47.96,5.79,8.28,0,1,0,1,0,1,0,1
2025-10-10,77e23ebd-6e10-4113-938c-bb55550710f5,Spice <> Capriotti's - Sep / Oct,promotion,2025-09-18,None,N/A,,f06f33c5-bff5-4bb3-8dda-6cedeb2e6fc1,10% Happy hour Discount - Min $30 | Low Price Sensitivity,day,all,Order Discount,% Off,7.0%,30.00,USD,Smithtown Bypass,23349427,0,0.00,0.00,0.00,0.00,0.00,-0.00,-0.00,0.00,0.00,0.00,0,0,0,0,0,0,0,0
2025-10-10,77e23ebd-6e10-4113-938c-bb55550710f5,Spice <> Capriotti's - Sep / Oct,promotion,2025-09-18,None,N/A,,f06f33c5-bff5-4bb3-8dda-6cedeb2e6fc1,10% Happy hour Discount - Min $30 | Low Price Sensitivity,day,all,Order Discount,% Off,7.0%,30.00,USD,Lantana Drive,390888,1,35.47,2.48,0.00,0.00,0.99,-0.00,-0.00,35.47,3.47,10.22,0,1,0,1,0,1,0,1
2025-10-10,77e23ebd-6e10-4113-938c-bb55550710f5,Spice <> Capriotti's - Sep / Oct,promotion,2025-09-18,None,N/A,,ba37e4d8-36c4-4cbe-8c7d-f4d1379109bd,"Spend $15, Save $3 | Low price Sensitivity",day,all,Order Discount,$ Off,3.00,15.00,USD,University Dr,29894178,0,0.00,0.00,0.00,0.00,0.00,-0.00,-0.00,0.00,0.00,0.00,0,0,0,0,0,0,0,0
2025-10-10,77e23ebd-6e10-4113-938c-bb55550710f5,Spice <> Capriotti's - Sep / Oct,promotion,2025-09-18,None,N/A,,,,day,,,$ Off,0.00,0.00,USD,Limonite Ave,2375675,0,0.00,0.00,0.00,0.00,0.00,-0.00,-0.00,0.00,0.00,0.00,0,0,0,0,0,0,0,0
2025-10-10,02d2c45e-5b6f-4058-b05d-1fbcb475312e,"First order, 20% off 04/09/2025",promotion,2025-04-09,None,N/A,,,,,,,$ Off,0.00,0.00,USD,E William Street,1053361,3,74.24,13.12,0.00,0.00,2.97,-0.00,-0.00,24.75,5.36,4.61,3,0,0,3,0,0,0,0
2025-10-10,77e23ebd-6e10-4113-938c-bb55550710f5,Spice <> Capriotti's - Sep / Oct,promotion,2025-09-18,None,N/A,,91f90d8c-8a7d-41cf-9b6a-888400112024,10% Happy Hour Discount - Min  $25 | High Price Sensitivity,day,all,Order Discount,% Off,10.0%,25.00,USD,Hamilton Blvd,23066760,1,30.19,3.02,0.00,0.00,0.99,-0.00,-0.00,30.19,4.01,7.53,0,1,0,1,0,1,0,1
2025-10-10,77e23ebd-6e10-4113-938c-bb55550710f5,Spice <> Capriotti's - Sep / Oct,promotion,2025-09-18,None,N/A,,91f90d8c-8a7d-41cf-9b6a-888400112024,10% Happy Hour Discount - Min  $25 | High Price Sensitivity,day,all,Order Discount,% Off,10.0%,25.00,USD,Coeur d'Alene,23085790,0,0.00,0.00,0.00,0.00,0.00,-0.00,-0.00,0.00,0.00,0.00,0,0,0,0,0,0,0,0
2025-10-10,77e23ebd-6e10-4113-938c-bb55550710f5,Spice <> Capriotti's - Sep / Oct,promotion,2025-09-18,None,N/A,,,,day,,,$ Off,0.00,0.00,USD,Downingtown,33699763,0,0.00,0.00,0.00,0.00,0.00,-0.00,-0.00,0.00,0.00,0.00,0,0,0,0,0,0,0,0
2025-10-10,77e23ebd-6e10-4113-938c-bb55550710f5,Spice <> Capriotti's - Sep / Oct,promotion,2025-09-18,None,N/A,,f06f33c5-bff5-4bb3-8dda-6cedeb2e6fc1,10% Happy hour Discount - Min $30 | Low Price Sensitivity,day,all,Order Discount,% Off,7.0%,30.00,USD,Old Town,27964,0,0.00,0.00,0.00,0.00,0.00,-0.00,-0.00,0.00,0.00,0.00,0,0,0,0,0,0,0,0
2025-10-10,77e23ebd-6e10-4113-938c-bb55550710f5,Spice <> Capriotti's - Sep / Oct,promotion,2025-09-18,None,N/A,,ba37e4d8-36c4-4cbe-8c7d-f4d1379109bd,"Spend $15, Save $3 | Low price Sensitivity",day,all,Order Discount,$ Off,3.00,15.00,USD,Cortez Rd  West,26034424,1,27.28,3.00,0.00,0.00,0.99,-0.00,-0.00,27.28,3.99,6.84,0,1,0,1,0,1,0,1
2025-10-10,02d2c45e-5b6f-4058-b05d-1fbcb475312e,"First order, 20% off 04/09/2025",promotion,2025-04-09,None,N/A,,,,,,,$ Off,0.00,0.00,USD,Highlands Ranch,1791292,1,35.47,5.00,0.00,0.00,0.99,-0.00,-0.00,35.47,5.99,5.92,1,0,0,1,0,0,0,0
2025-10-10,77e23ebd-6e10-4113-938c-bb55550710f5,Spice <> Capriotti's - Sep / Oct,promotion,2025-09-18,None,N/A,,f06f33c5-bff5-4bb3-8dda-6cedeb2e6fc1,10% Happy hour Discount - Min $30 | Low Price Sensitivity,day,all,Order Discount,% Off,7.0%,30.00,USD,Brayden Pkwy,2375657,0,0.00,0.00,0.00,0.00,0.00,-0.00,-0.00,0.00,0.00,0.00,0,0,0,0,0,0,0,0
2025-10-10,77e23ebd-6e10-4113-938c-bb55550710f5,Spice <> Capriotti's - Sep / Oct,promotion,2025-09-18,None,N/A,,d1d0b263-4918-4c81-8c97-630471e7185b,10% Happy Hour Discount - Medium Price Sensitivity,day,all,Order Discount,% Off,10.0%,25.00,USD,Plank Rd,27918503,0,0.00,0.00,0.00,0.00,0.00,-0.00,-0.00,0.00,0.00,0.00,0,0,0,0,0,0,0,0
2025-10-10,77e23ebd-6e10-4113-938c-bb55550710f5,Spice <> Capriotti's - Sep / Oct,promotion,2025-09-18,None,N/A,,,,day,,,$ Off,0.00,0.00,USD,St Rose Pkwy,1335286,0,0.00,0.00,0.00,0.00,0.00,-0.00,-0.00,0.00,0.00,0.00,0,0,0,0,0,0,0,0
2025-10-10,77e23ebd-6e10-4113-938c-bb55550710f5,Spice <> Capriotti's - Sep / Oct,promotion,2025-09-18,None,N/A,,43340528-e1b7-4f95-ab40-8dc92bf9c274,"Spend $35, Save $6 | High Price Sensitivity",day,all,Order Discount,$ Off,6.00,35.00,USD,West Basin Rd,575301,3,146.27,18.00,0.00,0.00,2.97,-0.00,-0.00,48.76,6.99,6.98,0,2,1,3,0,1,1,2
2025-10-10,77e23ebd-6e10-4113-938c-bb55550710f5,Spice <> Capriotti's - Sep / Oct,promotion,2025-09-18,None,N/A,,d1d0b263-4918-4c81-8c97-630471e7185b,10% Happy Hour Discount - Medium Price Sensitivity,day,all,Order Discount,% Off,10.0%,25.00,USD,Elm St,34052609,0,0.00,0.00,0.00,0.00,0.00,-0.00,-0.00,0.00,0.00,0.00,0,0,0,0,0,0,0,0
2025-10-10,77e23ebd-6e10-4113-938c-bb55550710f5,Spice <> Capriotti's - Sep / Oct,promotion,2025-09-18,None,N/A,,,,day,,,$ Off,0.00,0.00,USD,Kennett Square,575296,0,0.00,0.00,0.00,0.00,0.00,-0.00,-0.00,0.00,0.00,0.00,0,0,0,0,0,0,0,0
2025-10-10,77e23ebd-6e10-4113-938c-bb55550710f5,Spice <> Capriotti's - Sep / Oct,promotion,2025-09-18,None,N/A,,,,day,,,$ Off,0.00,0.00,USD,Bidwell - Folsom,26234909,0,0.00,0.00,0.00,0.00,0.00,-0.00,-0.00,0.00,0.00,0.00,0,0,0,0,0,0,0,0
2025-10-10,77e23ebd-6e10-4113-938c-bb55550710f5,Spice <> Capriotti's - Sep / Oct,promotion,2025-09-18,None,N/A,,,,day,,,$ Off,0.00,0.00,USD,Kirkwood Hwy,390889,0,0.00,0.00,0.00,0.00,0.00,-0.00,-0.00,0.00,0.00,0.00,0,0,0,0,0,0,0,0
2025-10-10,77e23ebd-6e10-4113-938c-bb55550710f5,Spice <> Capriotti's - Sep / Oct,promotion,2025-09-18,None,N/A,,,,day,,,$ Off,0.00,0.00,USD,Lantana Drive,390888,0,0.00,0.00,0.00,0.00,0.00,-0.00,-0.00,0.00,0.00,0.00,0,0,0,0,0,0,0,0
2025-10-10,02d2c45e-5b6f-4058-b05d-1fbcb475312e,"First order, 20% off 04/09/2025",promotion,2025-04-09,None,N/A,,,,,,,$ Off,0.00,0.00,USD,East Market Street,23256727,2,50.95,8.47,0.00,0.00,1.98,-0.00,-0.00,25.48,5.23,4.88,2,0,0,2,0,0,0,0
2025-10-10,f12a26e0-24e1-4d8e-ac05-d7e43f06d2bf,Happy Hour discount 11/12/2024,promotion,2024-11-12,None,N/A,,,,,,,$ Off,0.00,0.00,USD,Collier Pkwy-Lutz,23057623,3,90.16,18.64,0.00,0.00,2.97,-0.00,-0.00,30.05,7.20,4.17,1,2,0,3,0,2,0,2
2025-10-10,750e00fa-6876-4d9b-8c15-6ca184c578b9,Happy Hour discount 03/17/2025,promotion,2025-03-17,None,N/A,,,,,,,$ Off,0.00,0.00,USD,Interquest Parkway,27558470,2,42.64,10.00,0.00,0.00,1.98,-0.00,-0.00,21.32,5.99,3.56,1,1,0,2,1,1,0,2
2025-10-10,02d2c45e-5b6f-4058-b05d-1fbcb475312e,"First order, 20% off 04/09/2025",promotion,2025-04-09,None,N/A,,,,,,,$ Off,0.00,0.00,USD,Governor Ritchie,24121153,3,107.24,13.35,0.00,0.00,2.97,-0.00,-0.00,35.75,5.44,6.57,3,0,0,3,2,0,0,2
2025-10-10,02d2c45e-5b6f-4058-b05d-1fbcb475312e,"First order, 20% off 04/09/2025",promotion,2025-04-09,None,N/A,,,,,,,$ Off,0.00,0.00,USD,Bel Air,23733193,3,67.04,11.92,0.00,0.00,2.97,-0.00,-0.00,22.35,4.96,4.50,3,0,0,3,1,0,0,1
2025-10-10,58fe435a-cdf8-4a86-abc7-b68d7b574ba5,Spend $25 Get 20% Off,promotion,2022-12-01,None,N/A,,,,,,,$ Off,0.00,0.00,USD,Happy Valley,23584856,2,57.45,11.49,0.00,0.00,1.98,-0.00,-0.00,28.73,6.74,4.27,0,2,0,2,0,1,0,1
2025-10-10,02d2c45e-5b6f-4058-b05d-1fbcb475312e,"First order, 20% off 04/09/2025",promotion,2025-04-09,None,N/A,,,,,,,$ Off,0.00,0.00,USD,Newark,390890,2,40.66,8.13,0.00,0.00,1.98,-0.00,-0.00,20.33,5.06,4.02,2,0,0,2,1,0,0,1
2025-10-10,02d2c45e-5b6f-4058-b05d-1fbcb475312e,"First order, 20% off 04/09/2025",promotion,2025-04-09,None,N/A,,,,,,,$ Off,0.00,0.00,USD,West Basin Rd,575301,2,43.76,8.76,0.00,0.00,1.98,-0.00,-0.00,21.88,5.37,4.07,2,0,0,2,0,0,0,0
2025-10-10,492738a1-8e75-477a-b4bd-aec773e7d330,Spend $40 get $6 off 01/22/2025,promotion,2025-01-22,None,N/A,,,,,,,$ Off,0.00,0.00,USD,East Market Street,23256727,2,114.27,12.00,0.00,0.00,1.98,-0.00,-0.00,57.14,6.99,8.17,0,1,1,2,0,0,0,0
2025-10-10,02d2c45e-5b6f-4058-b05d-1fbcb475312e,"First order, 20% off 04/09/2025",promotion,2025-04-09,None,N/A,,,,,,,$ Off,0.00,0.00,USD,Collier Pkwy-Lutz,23057623,0,0.00,0.00,0.00,0.00,0.00,-0.00,-0.00,0.00,0.00,0.00,0,0,0,0,0,0,0,0
2025-10-10,02d2c45e-5b6f-4058-b05d-1fbcb475312e,"First order, 20% off 04/09/2025",promotion,2025-04-09,None,N/A,,,,,,,$ Off,0.00,0.00,USD,Oso Blanca Rd,178087,6,214.95,28.20,0.00,0.00,5.94,-0.00,-0.00,35.83,5.69,6.30,6,0,0,6,3,0,0,3
2025-10-10,77e23ebd-6e10-4113-938c-bb55550710f5,Spice <> Capriotti's - Sep / Oct,promotion,2025-09-18,None,N/A,,,,day,,,$ Off,0.00,0.00,USD,Shepherd - Fresno,24559604,0,0.00,0.00,0.00,0.00,0.00,-0.00,-0.00,0.00,0.00,0.00,0,0,0,0,0,0,0,0
2025-10-10,77e23ebd-6e10-4113-938c-bb55550710f5,Spice <> Capriotti's - Sep / Oct,promotion,2025-09-18,None,N/A,,ba37e4d8-36c4-4cbe-8c7d-f4d1379109bd,"Spend $15, Save $3 | Low price Sensitivity",day,all,Order Discount,$ Off,3.00,15.00,USD,North Boulder Hwy,75752,2,35.56,6.00,0.00,0.00,1.98,-0.00,-0.00,17.78,3.99,4.46,0,1,1,2,0,0,1,1
2025-10-10,77e23ebd-6e10-4113-938c-bb55550710f5,Spice <> Capriotti's - Sep / Oct,promotion,2025-09-18,None,N/A,,f06f33c5-bff5-4bb3-8dda-6cedeb2e6fc1,10% Happy hour Discount - Min $30 | Low Price Sensitivity,day,all,Order Discount,% Off,7.0%,30.00,USD,Bel Air,23733193,0,0.00,0.00,0.00,0.00,0.00,-0.00,-0.00,0.00,0.00,0.00,0,0,0,0,0,0,0,0
2025-10-10,bf29a390-e14d-4578-af85-d658942a738b,Loyalty Promo - Capriotti's Sandwich Shop (bus id: 768909),promotion,2024-04-26,2034-04-26,N/A,,,,,,,$ Off,0.00,0.00,USD,"Capriotti's of Milford, LLC",1636430,0,0.00,0.00,0.00,0.00,0.00,-0.00,-0.00,0.00,0.00,0.00,0,0,0,0,0,0,0,0
2025-10-10,77e23ebd-6e10-4113-938c-bb55550710f5,Spice <> Capriotti's - Sep / Oct,promotion,2025-09-18,None,N/A,,d1d0b263-4918-4c81-8c97-630471e7185b,10% Happy Hour Discount - Medium Price Sensitivity,day,all,Order Discount,% Off,10.0%,25.00,USD,West Avera Dr,1742446,0,0.00,0.00,0.00,0.00,0.00,-0.00,-0.00,0.00,0.00,0.00,0,0,0,0,0,0,0,0
2025-10-10,77e23ebd-6e10-4113-938c-bb55550710f5,Spice <> Capriotti's - Sep / Oct,promotion,2025-09-18,None,N/A,,,,day,,,$ Off,0.00,0.00,USD,Forest Drive,674540,0,0.00,0.00,0.00,0.00,0.00,-0.00,-0.00,0.00,0.00,0.00,0,0,0,0,0,0,0,0
2025-10-10,77e23ebd-6e10-4113-938c-bb55550710f5,Spice <> Capriotti's - Sep / Oct,promotion,2025-09-18,None,N/A,,f06f33c5-bff5-4bb3-8dda-6cedeb2e6fc1,10% Happy hour Discount - Min $30 | Low Price Sensitivity,day,all,Order Discount,% Off,7.0%,30.00,USD,Byers Dr,23186665,0,0.00,0.00,0.00,0.00,0.00,-0.00,-0.00,0.00,0.00,0.00,0,0,0,0,0,0,0,0
2025-10-10,77e23ebd-6e10-4113-938c-bb55550710f5,Spice <> Capriotti's - Sep / Oct,promotion,2025-09-18,None,N/A,,91f90d8c-8a7d-41cf-9b6a-888400112024,10% Happy Hour Discount - Min  $25 | High Price Sensitivity,day,all,Order Discount,% Off,10.0%,25.00,USD,Concord Pike,23151390,3,150.99,13.84,0.00,0.00,2.97,-0.00,-0.00,50.33,5.60,8.98,0,2,1,3,0,1,1,2
2025-10-10,1dd4cf16-61f6-4935-beac-ad07a26422b3,"First order, 20% off 07/23/2025",promotion,2025-07-23,None,N/A,,,,,,,$ Off,0.00,0.00,USD,Grand Ave-Portland,1370229,3,75.44,14.34,0.00,0.00,2.97,-0.00,-0.00,25.15,5.77,4.36,3,0,0,3,1,0,0,1
2025-10-10,77e23ebd-6e10-4113-938c-bb55550710f5,Spice <> Capriotti's - Sep / Oct,promotion,2025-09-18,None,N/A,,,,day,,,$ Off,0.00,0.00,USD,Collier Pkwy-Lutz,23057623,0,0.00,0.00,0.00,0.00,0.00,-0.00,-0.00,0.00,0.00,0.00,0,0,0,0,0,0,0,0
2025-10-10,02d2c45e-5b6f-4058-b05d-1fbcb475312e,"First order, 20% off 04/09/2025",promotion,2025-04-09,None,N/A,,,,,,,$ Off,0.00,0.00,USD,Cranberry Township,24851842,3,53.15,10.64,0.00,0.00,2.97,-0.00,-0.00,17.72,4.54,3.91,3,0,0,3,2,0,0,2
2025-10-10,2bb77af0-6b48-46d5-97b3-e43758ea5314,"First order, 20% off 02/01/2025",promotion,2025-02-01,None,N/A,,,,,,,$ Off,0.00,0.00,USD,De Soto-Chatsworth,651597,0,0.00,0.00,0.00,0.00,0.00,-0.00,-0.00,0.00,0.00,0.00,0,0,0,0,0,0,0,0
2025-10-10,02d2c45e-5b6f-4058-b05d-1fbcb475312e,"First order, 20% off 04/09/2025",promotion,2025-04-09,None,N/A,,,,,,,$ Off,0.00,0.00,USD,E Robindale Road,27815740,1,15.59,3.12,0.00,0.00,0.99,-0.00,-0.00,15.59,4.11,3.79,1,0,0,1,0,0,0,0
2025-10-10,02d2c45e-5b6f-4058-b05d-1fbcb475312e,"First order, 20% off 04/09/2025",promotion,2025-04-09,None,N/A,,,,,,,$ Off,0.00,0.00,USD,Barnes Road,24892677,2,66.13,8.52,0.00,0.00,1.98,-0.00,-0.00,33.07,5.25,6.30,2,0,0,2,1,0,0,1
2025-10-10,77e23ebd-6e10-4113-938c-bb55550710f5,Spice <> Capriotti's - Sep / Oct,promotion,2025-09-18,None,N/A,,91f90d8c-8a7d-41cf-9b6a-888400112024,10% Happy Hour Discount - Min  $25 | High Price Sensitivity,day,all,Order Discount,% Off,10.0%,25.00,USD,College Station,23349412,0,0.00,0.00,0.00,0.00,0.00,-0.00,-0.00,0.00,0.00,0.00,0,0,0,0,0,0,0,0
2025-10-10,77e23ebd-6e10-4113-938c-bb55550710f5,Spice <> Capriotti's - Sep / Oct,promotion,2025-09-18,None,N/A,,d1d0b263-4918-4c81-8c97-630471e7185b,10% Happy Hour Discount - Medium Price Sensitivity,day,all,Order Discount,% Off,10.0%,25.00,USD,Kenosha & 177th,1856591,3,81.83,8.19,0.00,0.00,2.97,-0.00,-0.00,27.28,3.72,7.33,0,3,0,3,0,3,0,3
2025-10-10,77e23ebd-6e10-4113-938c-bb55550710f5,Spice <> Capriotti's - Sep / Oct,promotion,2025-09-18,None,N/A,,f06f33c5-bff5-4bb3-8dda-6cedeb2e6fc1,10% Happy hour Discount - Min $30 | Low Price Sensitivity,day,all,Order Discount,% Off,7.0%,30.00,USD,Raccoon Rd,26015022,2,100.90,7.07,0.00,0.00,1.98,-0.00,-0.00,50.45,4.53,11.15,1,1,0,2,0,1,0,1
2025-10-10,77e23ebd-6e10-4113-938c-bb55550710f5,Spice <> Capriotti's - Sep / Oct,promotion,2025-09-18,None,N/A,,,,day,,,$ Off,0.00,0.00,USD,Sierra Hwy,27476315,0,0.00,0.00,0.00,0.00,0.00,-0.00,-0.00,0.00,0.00,0.00,0,0,0,0,0,0,0,0
2025-10-10,77e23ebd-6e10-4113-938c-bb55550710f5,Spice <> Capriotti's - Sep / Oct,promotion,2025-09-18,None,N/A,,d1d0b263-4918-4c81-8c97-630471e7185b,10% Happy Hour Discount - Medium Price Sensitivity,day,all,Order Discount,% Off,10.0%,25.00,USD,Oso Blanca Rd,178087,1,54.24,5.00,0.00,0.00,0.99,-0.00,-0.00,54.24,5.99,9.06,1,0,0,1,0,0,0,0
2025-10-10,77e23ebd-6e10-4113-938c-bb55550710f5,Spice <> Capriotti's - Sep / Oct,promotion,2025-09-18,None,N/A,,43340528-e1b7-4f95-ab40-8dc92bf9c274,"Spend $35, Save $6 | High Price Sensitivity",day,all,Order Discount,$ Off,6.00,35.00,USD,Coeur d'Alene,23085790,0,0.00,0.00,0.00,0.00,0.00,-0.00,-0.00,0.00,0.00,0.00,0,0,0,0,0,0,0,0
2025-10-10,77e23ebd-6e10-4113-938c-bb55550710f5,Spice <> Capriotti's - Sep / Oct,promotion,2025-09-18,None,N/A,,91f90d8c-8a7d-41cf-9b6a-888400112024,10% Happy Hour Discount - Min  $25 | High Price Sensitivity,day,all,Order Discount,% Off,10.0%,25.00,USD,E 53rd - Davenport,582282,0,0.00,0.00,0.00,0.00,0.00,-0.00,-0.00,0.00,0.00,0.00,0,0,0,0,0,0,0,0
2025-10-10,77e23ebd-6e10-4113-938c-bb55550710f5,Spice <> Capriotti's - Sep / Oct,promotion,2025-09-18,None,N/A,,,,day,,,$ Off,0.00,0.00,USD,Byers Dr,23186665,0,0.00,0.00,0.00,0.00,0.00,-0.00,-0.00,0.00,0.00,0.00,0,0,0,0,0,0,0,0
2025-10-10,02d2c45e-5b6f-4058-b05d-1fbcb475312e,"First order, 20% off 04/09/2025",promotion,2025-04-09,None,N/A,,,,,,,$ Off,0.00,0.00,USD,W Blue Diamond Rd,75738,4,145.15,17.33,0.00,0.00,3.96,-0.00,-0.00,36.29,5.32,6.82,4,0,0,4,1,0,0,1
2025-10-10,77e23ebd-6e10-4113-938c-bb55550710f5,Spice <> Capriotti's - Sep / Oct,promotion,2025-09-18,None,N/A,,d1d0b263-4918-4c81-8c97-630471e7185b,10% Happy Hour Discount - Medium Price Sensitivity,day,all,Order Discount,% Off,10.0%,25.00,USD,Cheyenne Rd,2375637,1,35.77,3.58,0.00,0.00,0.99,-0.00,-0.00,35.77,4.57,7.83,0,1,0,1,0,1,0,1
2025-10-10,02d2c45e-5b6f-4058-b05d-1fbcb475312e,"First order, 20% off 04/09/2025",promotion,2025-04-09,None,N/A,,,,,,,$ Off,0.00,0.00,USD,Marlboro - Easton,674514,4,114.17,16.28,0.00,0.00,3.96,-0.00,-0.00,28.54,5.06,5.64,4,0,0,4,2,0,0,2
2025-10-10,77e23ebd-6e10-4113-938c-bb55550710f5,Spice <> Capriotti's - Sep / Oct,promotion,2025-09-18,None,N/A,,ba37e4d8-36c4-4cbe-8c7d-f4d1379109bd,"Spend $15, Save $3 | Low price Sensitivity",day,all,Order Discount,$ Off,3.00,15.00,USD,Old Town,27964,7,203.42,21.00,0.00,0.00,6.93,-0.00,-0.00,29.06,3.99,7.28,0,4,3,7,0,4,2,6
2025-10-10,77e23ebd-6e10-4113-938c-bb55550710f5,Spice <> Capriotti's - Sep / Oct,promotion,2025-09-18,None,N/A,,d1d0b263-4918-4c81-8c97-630471e7185b,10% Happy Hour Discount - Medium Price Sensitivity,day,all,Order Discount,% Off,10.0%,25.00,USD,Southern Highlands,1750142,2,161.20,8.60,0.00,0.00,1.98,-0.00,-0.00,80.60,5.29,15.24,0,2,0,2,0,2,0,2
2025-10-10,77e23ebd-6e10-4113-938c-bb55550710f5,Spice <> Capriotti's - Sep / Oct,promotion,2025-09-18,None,N/A,,f06f33c5-bff5-4bb3-8dda-6cedeb2e6fc1,10% Happy hour Discount - Min $30 | Low Price Sensitivity,day,all,Order Discount,% Off,7.0%,30.00,USD,East Market Street,23256727,0,0.00,0.00,0.00,0.00,0.00,-0.00,-0.00,0.00,0.00,0.00,0,0,0,0,0,0,0,0
2025-10-10,77e23ebd-6e10-4113-938c-bb55550710f5,Spice <> Capriotti's - Sep / Oct,promotion,2025-09-18,None,N/A,,d1d0b263-4918-4c81-8c97-630471e7185b,10% Happy Hour Discount - Medium Price Sensitivity,day,all,Order Discount,% Off,10.0%,25.00,USD,South Sandhill Rd,75741,1,26.37,2.64,0.00,0.00,0.99,-0.00,-0.00,26.37,3.63,7.26,0,1,0,1,0,0,0,0
2025-10-10,77e23ebd-6e10-4113-938c-bb55550710f5,Spice <> Capriotti's - Sep / Oct,promotion,2025-09-18,None,N/A,,43340528-e1b7-4f95-ab40-8dc92bf9c274,"Spend $35, Save $6 | High Price Sensitivity",day,all,Order Discount,$ Off,6.00,35.00,USD,Hamilton Blvd,23066760,0,0.00,0.00,0.00,0.00,0.00,-0.00,-0.00,0.00,0.00,0.00,0,0,0,0,0,0,0,0
2025-10-10,02d2c45e-5b6f-4058-b05d-1fbcb475312e,"First order, 20% off 04/09/2025",promotion,2025-04-09,None,N/A,,,,,,,$ Off,0.00,0.00,USD,Pioneer Pkwy,874359,0,0.00,0.00,0.00,0.00,0.00,-0.00,-0.00,0.00,0.00,0.00,0,0,0,0,0,0,0,0
2025-10-10,77e23ebd-6e10-4113-938c-bb55550710f5,Spice <> Capriotti's - Sep / Oct,promotion,2025-09-18,None,N/A,,43340528-e1b7-4f95-ab40-8dc92bf9c274,"Spend $35, Save $6 | High Price Sensitivity",day,all,Order Discount,$ Off,6.00,35.00,USD,Broadway - Tucson,27829895,2,88.51,12.00,0.00,0.00,1.98,-0.00,-0.00,44.26,6.99,6.33,0,2,0,2,0,2,0,2
2025-10-10,77e23ebd-6e10-4113-938c-bb55550710f5,Spice <> Capriotti's - Sep / Oct,promotion,2025-09-18,None,N/A,,,,day,,,$ Off,0.00,0.00,USD,Bel Air,23733193,0,0.00,0.00,0.00,0.00,0.00,-0.00,-0.00,0.00,0.00,0.00,0,0,0,0,0,0,0,0
2025-10-10,02d2c45e-5b6f-4058-b05d-1fbcb475312e,"First order, 20% off 04/09/2025",promotion,2025-04-09,None,N/A,,,,,,,$ Off,0.00,0.00,USD,South  Walton Blvd,1616214,10,269.51,44.33,0.00,0.00,9.90,-0.00,-0.00,26.95,5.42,4.97,10,0,0,10,4,0,0,4
2025-10-10,77e23ebd-6e10-4113-938c-bb55550710f5,Spice <> Capriotti's - Sep / Oct,promotion,2025-09-18,None,N/A,,d1d0b263-4918-4c81-8c97-630471e7185b,10% Happy Hour Discount - Medium Price Sensitivity,day,all,Order Discount,% Off,10.0%,25.00,USD,Eden Square Ctr,420646,4,242.95,16.66,0.00,0.00,3.96,-0.00,-0.00,60.74,5.16,11.78,0,1,3,4,0,1,1,2
2025-10-10,77e23ebd-6e10-4113-938c-bb55550710f5,Spice <> Capriotti's - Sep / Oct,promotion,2025-09-18,None,N/A,,d1d0b263-4918-4c81-8c97-630471e7185b,10% Happy Hour Discount - Medium Price Sensitivity,day,all,Order Discount,% Off,10.0%,25.00,USD,Los Altos,33476901,2,67.24,6.73,0.00,0.00,1.98,-0.00,-0.00,33.62,4.36,7.72,0,2,0,2,0,2,0,2
2025-10-10,ff18ac99-74db-48ce-9c94-2959c91b6665,Capriotti's Sandwich Shop's Promo Campaign,promotion,2025-10-02,None,N/A,,348d5036-ec24-4cbc-aaf8-9cd8d2a19433,Spend $15 - Save $3,day,all,Order Discount,$ Off,3.00,15.00,USD,Waialae Ave,25380836,6,184.44,18.00,0.00,0.00,5.94,-0.00,-0.00,30.74,3.99,7.70,1,5,0,6,1,3,0,4
2025-10-10,02d2c45e-5b6f-4058-b05d-1fbcb475312e,"First order, 20% off 04/09/2025",promotion,2025-04-09,None,N/A,,,,,,,$ Off,0.00,0.00,USD,Sahara & Las Vegas,75735,1,29.08,5.00,0.00,0.00,0.99,-0.00,-0.00,29.08,5.99,4.85,1,0,0,1,0,0,0,0
2025-10-10,77e23ebd-6e10-4113-938c-bb55550710f5,Spice <> Capriotti's - Sep / Oct,promotion,2025-09-18,None,N/A,,,,day,,,$ Off,0.00,0.00,USD,East Market Street,23256727,0,0.00,0.00,0.00,0.00,0.00,-0.00,-0.00,0.00,0.00,0.00,0,0,0,0,0,0,0,0
2025-10-10,77e23ebd-6e10-4113-938c-bb55550710f5,Spice <> Capriotti's - Sep / Oct,promotion,2025-09-18,None,N/A,,d1d0b263-4918-4c81-8c97-630471e7185b,10% Happy Hour Discount - Medium Price Sensitivity,day,all,Order Discount,% Off,10.0%,25.00,USD,Cranberry Township,24851842,0,0.00,0.00,0.00,0.00,0.00,-0.00,-0.00,0.00,0.00,0.00,0,0,0,0,0,0,0,0
2025-10-10,77e23ebd-6e10-4113-938c-bb55550710f5,Spice <> Capriotti's - Sep / Oct,promotion,2025-09-18,None,N/A,,ba37e4d8-36c4-4cbe-8c7d-f4d1379109bd,"Spend $15, Save $3 | Low price Sensitivity",day,all,Order Discount,$ Off,3.00,15.00,USD,The Old Road,24898774,0,0.00,0.00,0.00,0.00,0.00,-0.00,-0.00,0.00,0.00,0.00,0,0,0,0,0,0,0,0
2025-10-10,77e23ebd-6e10-4113-938c-bb55550710f5,Spice <> Capriotti's - Sep / Oct,promotion,2025-09-18,None,N/A,,f06f33c5-bff5-4bb3-8dda-6cedeb2e6fc1,10% Happy hour Discount - Min $30 | Low Price Sensitivity,day,all,Order Discount,% Off,7.0%,30.00,USD,Nevada Way,75754,0,0.00,0.00,0.00,0.00,0.00,-0.00,-0.00,0.00,0.00,0.00,0,0,0,0,0,0,0,0
2025-10-10,02d2c45e-5b6f-4058-b05d-1fbcb475312e,"First order, 20% off 04/09/2025",promotion,2025-04-09,None,N/A,,,,,,,$ Off,0.00,0.00,USD,Park Road Center,27677423,5,162.84,25.00,0.00,0.00,4.95,-0.00,-0.00,32.57,5.99,5.44,5,0,0,5,5,0,0,5
2025-10-10,b0ba6428-e0e2-4625-9d44-870d349157d5,Lunch specials discount 03/18/2025,promotion,2025-03-18,None,N/A,,,,,,,$ Off,0.00,0.00,USD,Townpark Lane,128721,5,117.77,23.57,0.00,0.00,0.00,-0.00,-0.00,23.55,4.71,5.00,0,5,0,5,0,2,0,2
2025-10-10,02d2c45e-5b6f-4058-b05d-1fbcb475312e,"First order, 20% off 04/09/2025",promotion,2025-04-09,None,N/A,,,,,,,$ Off,0.00,0.00,USD,Paradise Road,75734,4,122.58,16.60,0.00,0.00,3.96,-0.00,-0.00,30.65,5.14,5.96,4,0,0,4,2,0,0,2
2025-10-10,02d2c45e-5b6f-4058-b05d-1fbcb475312e,"First order, 20% off 04/09/2025",promotion,2025-04-09,None,N/A,,,,,,,$ Off,0.00,0.00,USD,1st Ave NE,23128705,7,251.47,32.37,0.00,0.00,6.93,-0.00,-0.00,35.92,5.61,6.40,7,0,0,7,6,0,0,6
2025-10-10,02d2c45e-5b6f-4058-b05d-1fbcb475312e,"First order, 20% off 04/09/2025",promotion,2025-04-09,None,N/A,,,,,,,$ Off,0.00,0.00,USD,N 87th Street,27965,2,34.77,6.96,0.00,0.00,1.98,-0.00,-0.00,17.39,4.47,3.89,2,0,0,2,1,0,0,1
2025-10-10,02d2c45e-5b6f-4058-b05d-1fbcb475312e,"First order, 20% off 04/09/2025",promotion,2025-04-09,None,N/A,,,,,,,$ Off,0.00,0.00,USD,Downingtown,33699763,4,78.22,15.66,0.00,0.00,3.96,-0.00,-0.00,19.56,4.91,3.99,4,0,0,4,2,0,0,2
2025-10-10,02d2c45e-5b6f-4058-b05d-1fbcb475312e,"First order, 20% off 04/09/2025",promotion,2025-04-09,None,N/A,,,,,,,$ Off,0.00,0.00,USD,East Sepulveda,1743753,0,0.00,0.00,0.00,0.00,0.00,-0.00,-0.00,0.00,0.00,0.00,0,0,0,0,0,0,0,0
2025-10-10,77e23ebd-6e10-4113-938c-bb55550710f5,Spice <> Capriotti's - Sep / Oct,promotion,2025-09-18,None,N/A,,d1d0b263-4918-4c81-8c97-630471e7185b,10% Happy Hour Discount - Medium Price Sensitivity,day,all,Order Discount,% Off,10.0%,25.00,USD,Main Street - Anoka,34494893,3,160.70,13.12,0.00,0.00,2.97,-0.00,-0.00,53.57,5.36,9.99,0,3,0,3,0,2,0,2
2025-10-10,02d2c45e-5b6f-4058-b05d-1fbcb475312e,"First order, 20% off 04/09/2025",promotion,2025-04-09,None,N/A,,,,,,,$ Off,0.00,0.00,USD,Terrace Center,321047,0,0.00,0.00,0.00,0.00,0.00,-0.00,-0.00,0.00,0.00,0.00,0,0,0,0,0,0,0,0
2025-10-10,02d2c45e-5b6f-4058-b05d-1fbcb475312e,"First order, 20% off 04/09/2025",promotion,2025-04-09,None,N/A,,,,,,,$ Off,0.00,0.00,USD,Murrieta Hot Springs Rd,29652192,3,110.42,13.98,0.00,0.00,2.97,-0.00,-0.00,36.81,5.65,6.51,3,0,0,3,1,0,0,1
2025-10-10,22011977-85b1-4624-ad97-926f3ebe49f4,Happy Hour discount 07/09/2025,promotion,2025-07-09,None,N/A,,,,,,,$ Off,0.00,0.00,USD,Niles Cortland Rd SE,34043935,8,222.46,49.98,0.00,0.00,7.92,-0.00,-0.00,27.81,7.24,3.84,3,4,1,8,1,4,1,6
2025-10-10,02d2c45e-5b6f-4058-b05d-1fbcb475312e,"First order, 20% off 04/09/2025",promotion,2025-04-09,None,N/A,,,,,,,$ Off,0.00,0.00,USD,Cortez Rd  West,26034424,2,40.95,8.19,0.00,0.00,1.98,-0.00,-0.00,20.48,5.09,4.03,2,0,0,2,0,0,0,0
2025-10-10,02d2c45e-5b6f-4058-b05d-1fbcb475312e,"First order, 20% off 04/09/2025",promotion,2025-04-09,None,N/A,,,,,,,$ Off,0.00,0.00,USD,WVC High Market,2608935,3,143.67,15.00,0.00,0.00,2.97,-0.00,-0.00,47.89,5.99,7.99,3,0,0,3,0,0,0,0
2025-10-10,70d4cf5a-37fe-47ad-bac7-d5196b53b89c,Spend $30 get 20% off 09/03/2025,promotion,2025-09-03,None,N/A,,,,,,,$ Off,0.00,0.00,USD,Grand Ave-Portland,1370229,6,255.84,43.78,0.00,0.00,5.94,-0.00,-0.00,42.64,8.29,5.15,0,2,4,6,0,2,4,6
2025-10-10,02d2c45e-5b6f-4058-b05d-1fbcb475312e,"First order, 20% off 04/09/2025",promotion,2025-04-09,None,N/A,,,,,,,$ Off,0.00,0.00,USD,Coeur d'Alene,23085790,3,61.62,12.32,0.00,0.00,2.97,-0.00,-0.00,20.54,5.10,4.03,3,0,0,3,2,0,0,2
2025-10-10,02d2c45e-5b6f-4058-b05d-1fbcb475312e,"First order, 20% off 04/09/2025",promotion,2025-04-09,None,N/A,,,,,,,$ Off,0.00,0.00,USD,Plank Rd,27918503,2,49.57,8.24,0.00,0.00,1.98,-0.00,-0.00,24.79,5.11,4.85,2,0,0,2,1,0,0,1
2025-10-10,02d2c45e-5b6f-4058-b05d-1fbcb475312e,"First order, 20% off 04/09/2025",promotion,2025-04-09,None,N/A,,,,,,,$ Off,0.00,0.00,USD,Dana Park - Mesa,126177,0,0.00,0.00,0.00,0.00,0.00,-0.00,-0.00,0.00,0.00,0.00,0,0,0,0,0,0,0,0
2025-10-10,02d2c45e-5b6f-4058-b05d-1fbcb475312e,"First order, 20% off 04/09/2025",promotion,2025-04-09,None,N/A,,,,,,,$ Off,0.00,0.00,USD,"Capriotti's of Milford, LLC",1636430,3,71.35,13.08,0.00,0.00,2.97,-0.00,-0.00,23.78,5.35,4.45,3,0,0,3,1,0,0,1
2025-10-10,77e23ebd-6e10-4113-938c-bb55550710f5,Spice <> Capriotti's - Sep / Oct,promotion,2025-09-18,None,N/A,,d1d0b263-4918-4c81-8c97-630471e7185b,10% Happy Hour Discount - Medium Price Sensitivity,day,all,Order Discount,% Off,10.0%,25.00,USD,Magnolia Ave,31345441,1,27.58,2.76,0.00,0.00,0.99,-0.00,-0.00,27.58,3.75,7.35,0,1,0,1,0,1,0,1
2025-10-10,77e23ebd-6e10-4113-938c-bb55550710f5,Spice <> Capriotti's - Sep / Oct,promotion,2025-09-18,None,N/A,,d1d0b263-4918-4c81-8c97-630471e7185b,10% Happy Hour Discount - Medium Price Sensitivity,day,all,Order Discount,% Off,10.0%,25.00,USD,East Ridge Pike,1640642,1,33.57,3.36,0.00,0.00,0.99,-0.00,-0.00,33.57,4.35,7.72,0,1,0,1,0,0,0,0
2025-10-10,77e23ebd-6e10-4113-938c-bb55550710f5,Spice <> Capriotti's - Sep / Oct,promotion,2025-09-18,None,N/A,,,,day,,,$ Off,0.00,0.00,USD,Brayden Pkwy,2375657,0,0.00,0.00,0.00,0.00,0.00,-0.00,-0.00,0.00,0.00,0.00,0,0,0,0,0,0,0,0
2025-10-10,77e23ebd-6e10-4113-938c-bb55550710f5,Spice <> Capriotti's - Sep / Oct,promotion,2025-09-18,None,N/A,,d1d0b263-4918-4c81-8c97-630471e7185b,10% Happy Hour Discount - Medium Price Sensitivity,day,all,Order Discount,% Off,10.0%,25.00,USD,E Robindale Road,27815740,0,0.00,0.00,0.00,0.00,0.00,-0.00,-0.00,0.00,0.00,0.00,0,0,0,0,0,0,0,0
2025-10-10,77e23ebd-6e10-4113-938c-bb55550710f5,Spice <> Capriotti's - Sep / Oct,promotion,2025-09-18,None,N/A,,d1d0b263-4918-4c81-8c97-630471e7185b,10% Happy Hour Discount - Medium Price Sensitivity,day,all,Order Discount,% Off,10.0%,25.00,USD,Whitesburg Dr (Medical District),34051357,1,49.53,4.95,0.00,0.00,0.99,-0.00,-0.00,49.53,5.94,8.34,0,1,0,1,0,0,0,0
2025-10-10,77e23ebd-6e10-4113-938c-bb55550710f5,Spice <> Capriotti's - Sep / Oct,promotion,2025-09-18,None,N/A,,,,day,,,$ Off,0.00,0.00,USD,Hamilton Blvd,23066760,0,0.00,0.00,0.00,0.00,0.00,-0.00,-0.00,0.00,0.00,0.00,0,0,0,0,0,0,0,0
2025-10-10,77e23ebd-6e10-4113-938c-bb55550710f5,Spice <> Capriotti's - Sep / Oct,promotion,2025-09-18,None,N/A,,d1d0b263-4918-4c81-8c97-630471e7185b,10% Happy Hour Discount - Medium Price Sensitivity,day,all,Order Discount,% Off,10.0%,25.00,USD,East 82nd St,184537,1,33.58,3.36,0.00,0.00,0.99,-0.00,-0.00,33.58,4.35,7.72,0,1,0,1,0,1,0,1
2025-10-10,77e23ebd-6e10-4113-938c-bb55550710f5,Spice <> Capriotti's - Sep / Oct,promotion,2025-09-18,None,N/A,,,,day,,,$ Off,0.00,0.00,USD,North Union St,575293,0,0.00,0.00,0.00,0.00,0.00,-0.00,-0.00,0.00,0.00,0.00,0,0,0,0,0,0,0,0
2025-10-10,77e23ebd-6e10-4113-938c-bb55550710f5,Spice <> Capriotti's - Sep / Oct,promotion,2025-09-18,None,N/A,,d1d0b263-4918-4c81-8c97-630471e7185b,10% Happy Hour Discount - Medium Price Sensitivity,day,all,Order Discount,% Off,10.0%,25.00,USD,West Cheyenne Ave,75722,0,0.00,0.00,0.00,0.00,0.00,-0.00,-0.00,0.00,0.00,0.00,0,0,0,0,0,0,0,0
2025-10-10,77e23ebd-6e10-4113-938c-bb55550710f5,Spice <> Capriotti's - Sep / Oct,promotion,2025-09-18,None,N/A,,ba37e4d8-36c4-4cbe-8c7d-f4d1379109bd,"Spend $15, Save $3 | Low price Sensitivity",day,all,Order Discount,$ Off,3.00,15.00,USD,Lantana Drive,390888,3,90.41,9.00,0.00,0.00,2.97,-0.00,-0.00,30.14,3.99,7.55,0,3,0,3,0,2,0,2
2025-10-10,77e23ebd-6e10-4113-938c-bb55550710f5,Spice <> Capriotti's - Sep / Oct,promotion,2025-09-18,None,N/A,,d1d0b263-4918-4c81-8c97-630471e7185b,10% Happy Hour Discount - Medium Price Sensitivity,day,all,Order Discount,% Off,10.0%,25.00,USD,Aliante Casino,75725,0,0.00,0.00,0.00,0.00,0.00,-0.00,-0.00,0.00,0.00,0.00,0,0,0,0,0,0,0,0
2025-10-10,77e23ebd-6e10-4113-938c-bb55550710f5,Spice <> Capriotti's - Sep / Oct,promotion,2025-09-18,None,N/A,,d1d0b263-4918-4c81-8c97-630471e7185b,10% Happy Hour Discount - Medium Price Sensitivity,day,all,Order Discount,% Off,10.0%,25.00,USD,1st Ave NE,23128705,0,0.00,0.00,0.00,0.00,0.00,-0.00,-0.00,0.00,0.00,0.00,0,0,0,0,0,0,0,0
2025-10-10,77e23ebd-6e10-4113-938c-bb55550710f5,Spice <> Capriotti's - Sep / Oct,promotion,2025-09-18,None,N/A,,f06f33c5-bff5-4bb3-8dda-6cedeb2e6fc1,10% Happy hour Discount - Min $30 | Low Price Sensitivity,day,all,Order Discount,% Off,7.0%,30.00,USD,Horizon Ridge,75753,1,31.57,2.21,0.00,0.00,0.99,-0.00,-0.00,31.57,3.20,9.87,0,0,1,1,0,0,1,1
2025-10-10,77e23ebd-6e10-4113-938c-bb55550710f5,Spice <> Capriotti's - Sep / Oct,promotion,2025-09-18,None,N/A,,ba37e4d8-36c4-4cbe-8c7d-f4d1379109bd,"Spend $15, Save $3 | Low price Sensitivity",day,all,Order Discount,$ Off,3.00,15.00,USD,Arapahoe Rd,23349425,5,152.51,15.00,0.00,0.00,4.95,-0.00,-0.00,30.50,3.99,7.64,0,3,2,5,0,3,2,5
2025-10-10,77e23ebd-6e10-4113-938c-bb55550710f5,Spice <> Capriotti's - Sep / Oct,promotion,2025-09-18,None,N/A,,ba37e4d8-36c4-4cbe-8c7d-f4d1379109bd,"Spend $15, Save $3 | Low price Sensitivity",day,all,Order Discount,$ Off,3.00,15.00,USD,Mountain View,2608887,3,51.76,9.00,0.00,0.00,2.97,-0.00,-0.00,17.25,3.99,4.32,0,2,1,3,0,1,1,2
2025-10-10,77e23ebd-6e10-4113-938c-bb55550710f5,Spice <> Capriotti's - Sep / Oct,promotion,2025-09-18,None,N/A,,ba37e4d8-36c4-4cbe-8c7d-f4d1379109bd,"Spend $15, Save $3 | Low price Sensitivity",day,all,Order Discount,$ Off,3.00,15.00,USD,Limonite Ave,2375675,3,139.33,9.00,0.00,0.00,2.97,-0.00,-0.00,46.44,3.99,11.64,0,1,1,2,0,0,0,0
2025-10-10,77e23ebd-6e10-4113-938c-bb55550710f5,Spice <> Capriotti's - Sep / Oct,promotion,2025-09-18,None,N/A,,d1d0b263-4918-4c81-8c97-630471e7185b,10% Happy Hour Discount - Medium Price Sensitivity,day,all,Order Discount,% Off,10.0%,25.00,USD,E Silverado Ranch,75746,1,137.34,5.00,0.00,0.00,0.99,-0.00,-0.00,137.34,5.99,22.93,0,0,1,1,0,0,1,1
2025-10-10,77e23ebd-6e10-4113-938c-bb55550710f5,Spice <> Capriotti's - Sep / Oct,promotion,2025-09-18,None,N/A,,,,day,,,$ Off,0.00,0.00,USD,Castle Rock,23057614,0,0.00,0.00,0.00,0.00,0.00,-0.00,-0.00,0.00,0.00,0.00,0,0,0,0,0,0,0,0
2025-10-10,77e23ebd-6e10-4113-938c-bb55550710f5,Spice <> Capriotti's - Sep / Oct,promotion,2025-09-18,None,N/A,,d1d0b263-4918-4c81-8c97-630471e7185b,10% Happy Hour Discount - Medium Price Sensitivity,day,all,Order Discount,% Off,10.0%,25.00,USD,"Lewes, DE",34776698,2,67.36,6.74,0.00,0.00,1.98,-0.00,-0.00,33.68,4.36,7.72,0,1,1,2,0,1,1,2
2025-10-10,77e23ebd-6e10-4113-938c-bb55550710f5,Spice <> Capriotti's - Sep / Oct,promotion,2025-09-18,None,N/A,,,,day,,,$ Off,0.00,0.00,USD,University Ave,1084955,0,0.00,0.00,0.00,0.00,0.00,-0.00,-0.00,0.00,0.00,0.00,0,0,0,0,0,0,0,0
2025-10-10,77e23ebd-6e10-4113-938c-bb55550710f5,Spice <> Capriotti's - Sep / Oct,promotion,2025-09-18,None,N/A,,43340528-e1b7-4f95-ab40-8dc92bf9c274,"Spend $35, Save $6 | High Price Sensitivity",day,all,Order Discount,$ Off,6.00,35.00,USD,Shepherd - Fresno,24559604,3,114.00,18.00,0.00,0.00,2.97,-0.00,-0.00,38.00,6.99,5.44,0,3,0,3,0,3,0,3
2025-10-10,77e23ebd-6e10-4113-938c-bb55550710f5,Spice <> Capriotti's - Sep / Oct,promotion,2025-09-18,None,N/A,,ba37e4d8-36c4-4cbe-8c7d-f4d1379109bd,"Spend $15, Save $3 | Low price Sensitivity",day,all,Order Discount,$ Off,3.00,15.00,USD,Kennett Square,575296,1,41.98,3.00,0.00,0.00,0.99,-0.00,-0.00,41.98,3.99,10.52,0,1,0,1,0,1,0,1
2025-10-10,77e23ebd-6e10-4113-938c-bb55550710f5,Spice <> Capriotti's - Sep / Oct,promotion,2025-09-18,None,N/A,,,,day,,,$ Off,0.00,0.00,USD,Princeton,32118309,0,0.00,0.00,0.00,0.00,0.00,-0.00,-0.00,0.00,0.00,0.00,0,0,0,0,0,0,0,0
2025-10-10,77e23ebd-6e10-4113-938c-bb55550710f5,Spice <> Capriotti's - Sep / Oct,promotion,2025-09-18,None,N/A,,f06f33c5-bff5-4bb3-8dda-6cedeb2e6fc1,10% Happy hour Discount - Min $30 | Low Price Sensitivity,day,all,Order Discount,% Off,7.0%,30.00,USD,Parker,24021312,1,81.36,5.00,0.00,0.00,0.99,-0.00,-0.00,81.36,5.99,13.58,0,1,0,1,0,0,0,0
2025-10-10,77e23ebd-6e10-4113-938c-bb55550710f5,Spice <> Capriotti's - Sep / Oct,promotion,2025-09-18,None,N/A,,ba37e4d8-36c4-4cbe-8c7d-f4d1379109bd,"Spend $15, Save $3 | Low price Sensitivity",day,all,Order Discount,$ Off,3.00,15.00,USD,Rancho Mirage,32864869,2,66.33,6.00,0.00,0.00,1.98,-0.00,-0.00,33.17,3.99,8.31,0,2,0,2,0,2,0,2
2025-10-10,77e23ebd-6e10-4113-938c-bb55550710f5,Spice <> Capriotti's - Sep / Oct,promotion,2025-09-18,None,N/A,,,,day,,,$ Off,0.00,0.00,USD,Concord Pike,23151390,0,0.00,0.00,0.00,0.00,0.00,-0.00,-0.00,0.00,0.00,0.00,0,0,0,0,0,0,0,0
2025-10-10,77e23ebd-6e10-4113-938c-bb55550710f5,Spice <> Capriotti's - Sep / Oct,promotion,2025-09-18,None,N/A,,d1d0b263-4918-4c81-8c97-630471e7185b,10% Happy Hour Discount - Medium Price Sensitivity,day,all,Order Discount,% Off,10.0%,25.00,USD,Cheyenne and 215,388423,0,0.00,0.00,0.00,0.00,0.00,-0.00,-0.00,0.00,0.00,0.00,0,0,0,0,0,0,0,0
2025-10-10,77e23ebd-6e10-4113-938c-bb55550710f5,Spice <> Capriotti's - Sep / Oct,promotion,2025-09-18,None,N/A,,d1d0b263-4918-4c81-8c97-630471e7185b,10% Happy Hour Discount - Medium Price Sensitivity,day,all,Order Discount,% Off,10.0%,25.00,USD,Grand Ave-Portland,1370229,0,0.00,0.00,0.00,0.00,0.00,-0.00,-0.00,0.00,0.00,0.00,0,0,0,0,0,0,0,0
2025-10-10,77e23ebd-6e10-4113-938c-bb55550710f5,Spice <> Capriotti's - Sep / Oct,promotion,2025-09-18,None,N/A,,,,day,,,$ Off,0.00,0.00,USD,Smithtown Bypass,23349427,0,0.00,0.00,0.00,0.00,0.00,-0.00,-0.00,0.00,0.00,0.00,0,0,0,0,0,0,0,0
2025-10-10,77e23ebd-6e10-4113-938c-bb55550710f5,Spice <> Capriotti's - Sep / Oct,promotion,2025-09-18,None,N/A,,f06f33c5-bff5-4bb3-8dda-6cedeb2e6fc1,10% Happy hour Discount - Min $30 | Low Price Sensitivity,day,all,Order Discount,% Off,7.0%,30.00,USD,GVR Casino,75749,0,0.00,0.00,0.00,0.00,0.00,-0.00,-0.00,0.00,0.00,0.00,0,0,0,0,0,0,0,0
2025-10-10,77e23ebd-6e10-4113-938c-bb55550710f5,Spice <> Capriotti's - Sep / Oct,promotion,2025-09-18,None,N/A,,d1d0b263-4918-4c81-8c97-630471e7185b,10% Happy Hour Discount - Medium Price Sensitivity,day,all,Order Discount,% Off,10.0%,25.00,USD,S Stanford Way,699470,0,0.00,0.00,0.00,0.00,0.00,-0.00,-0.00,0.00,0.00,0.00,0,0,0,0,0,0,0,0
2025-10-10,77e23ebd-6e10-4113-938c-bb55550710f5,Spice <> Capriotti's - Sep / Oct,promotion,2025-09-18,None,N/A,,,,day,,,$ Off,0.00,0.00,USD,Overland Park,24110474,0,0.00,0.00,0.00,0.00,0.00,-0.00,-0.00,0.00,0.00,0.00,0,0,0,0,0,0,0,0
2025-10-10,02d2c45e-5b6f-4058-b05d-1fbcb475312e,"First order, 20% off 04/09/2025",promotion,2025-04-09,None,N/A,,,,,,,$ Off,0.00,0.00,USD,North Haven Ave,28834163,3,138.40,14.35,0.00,0.00,2.97,-0.00,-0.00,46.13,5.77,7.99,3,0,0,3,2,0,0,2
2025-10-10,02d2c45e-5b6f-4058-b05d-1fbcb475312e,"First order, 20% off 04/09/2025",promotion,2025-04-09,None,N/A,,,,,,,$ Off,0.00,0.00,USD,North Town Center,75721,1,29.49,5.00,0.00,0.00,0.99,-0.00,-0.00,29.49,5.99,4.92,1,0,0,1,0,0,0,0
2025-10-10,02d2c45e-5b6f-4058-b05d-1fbcb475312e,"First order, 20% off 04/09/2025",promotion,2025-04-09,None,N/A,,,,,,,$ Off,0.00,0.00,USD,Nature Park Drive,75726,0,0.00,0.00,0.00,0.00,0.00,-0.00,-0.00,0.00,0.00,0.00,0,0,0,0,0,0,0,0
2025-10-10,10f22bff-32eb-477c-b8fd-70d17c151ce3,Happy Hour discount 10/02/2025,promotion,2025-10-02,2025-11-02,N/A,,,,,,,$ Off,0.00,0.00,USD,Manchester Rd,27715447,0,0.00,0.00,0.00,0.00,0.00,-0.00,-0.00,0.00,0.00,0.00,0,0,0,0,0,0,0,0
2025-10-10,178f54dc-804b-413e-b1bd-ffbdde7f61a1,"Dormant customers, 20% off 02/01/2025",promotion,2025-02-01,None,N/A,,,,,,,$ Off,0.00,0.00,USD,East Sepulveda,1743753,0,0.00,0.00,0.00,0.00,0.00,-0.00,-0.00,0.00,0.00,0.00,0,0,0,0,0,0,0,0
2025-10-10,02d2c45e-5b6f-4058-b05d-1fbcb475312e,"First order, 20% off 04/09/2025",promotion,2025-04-09,None,N/A,,,,,,,$ Off,0.00,0.00,USD,Anthem,75750,1,19.98,4.00,0.00,0.00,0.99,-0.00,-0.00,19.98,4.99,4.00,1,0,0,1,0,0,0,0
2025-10-10,02d2c45e-5b6f-4058-b05d-1fbcb475312e,"First order, 20% off 04/09/2025",promotion,2025-04-09,None,N/A,,,,,,,$ Off,0.00,0.00,USD,Townpark Lane,128721,1,38.38,5.00,0.00,0.00,0.99,-0.00,-0.00,38.38,5.99,6.41,1,0,0,1,1,0,0,1
2025-10-10,77e23ebd-6e10-4113-938c-bb55550710f5,Spice <> Capriotti's - Sep / Oct,promotion,2025-09-18,None,N/A,,,,day,,,$ Off,0.00,0.00,USD,North Boulder Hwy,75752,0,0.00,0.00,0.00,0.00,0.00,-0.00,-0.00,0.00,0.00,0.00,0,0,0,0,0,0,0,0
2025-10-10,2bb77af0-6b48-46d5-97b3-e43758ea5314,"First order, 20% off 02/01/2025",promotion,2025-02-01,None,N/A,,,,,,,$ Off,0.00,0.00,USD,Sierra Hwy,27476315,2,84.15,10.00,0.00,0.00,1.98,-0.00,-0.00,42.08,5.99,7.02,2,0,0,2,1,0,0,1
2025-10-10,77e23ebd-6e10-4113-938c-bb55550710f5,Spice <> Capriotti's - Sep / Oct,promotion,2025-09-18,None,N/A,,,,day,,,$ Off,0.00,0.00,USD,Sumneytown Pike,24717004,0,0.00,0.00,0.00,0.00,0.00,-0.00,-0.00,0.00,0.00,0.00,0,0,0,0,0,0,0,0
2025-10-10,ab8ae3e5-4758-4b2a-b268-d7fb378c5caa,Spend $15 Get 20% Off,promotion,2022-05-17,None,N/A,,,,,,,$ Off,0.00,0.00,USD,Pioneer Pkwy,874359,0,0.00,0.00,0.00,0.00,0.00,-0.00,-0.00,0.00,0.00,0.00,0,0,0,0,0,0,0,0
2025-10-10,77e23ebd-6e10-4113-938c-bb55550710f5,Spice <> Capriotti's - Sep / Oct,promotion,2025-09-18,None,N/A,,43340528-e1b7-4f95-ab40-8dc92bf9c274,"Spend $35, Save $6 | High Price Sensitivity",day,all,Order Discount,$ Off,6.00,35.00,USD,Roby Dr - Hammond,24891803,0,0.00,0.00,0.00,0.00,0.00,-0.00,-0.00,0.00,0.00,0.00,0,0,0,0,0,0,0,0
2025-10-10,02d2c45e-5b6f-4058-b05d-1fbcb475312e,"First order, 20% off 04/09/2025",promotion,2025-04-09,None,N/A,,,,,,,$ Off,0.00,0.00,USD,Parker,24021312,0,0.00,0.00,0.00,0.00,0.00,-0.00,-0.00,0.00,0.00,0.00,0,0,0,0,0,0,0,0
2025-10-10,77e23ebd-6e10-4113-938c-bb55550710f5,Spice <> Capriotti's - Sep / Oct,promotion,2025-09-18,None,N/A,,43340528-e1b7-4f95-ab40-8dc92bf9c274,"Spend $35, Save $6 | High Price Sensitivity",day,all,Order Discount,$ Off,6.00,35.00,USD,"Capriotti's of Dover, Inc.",1617804,0,0.00,0.00,0.00,0.00,0.00,-0.00,-0.00,0.00,0.00,0.00,0,0,0,0,0,0,0,0
2025-10-10,02d2c45e-5b6f-4058-b05d-1fbcb475312e,"First order, 20% off 04/09/2025",promotion,2025-04-09,None,N/A,,,,,,,$ Off,0.00,0.00,USD,Arapahoe Rd,23349425,3,266.26,14.47,0.00,0.00,2.97,-0.00,-0.00,88.75,5.81,15.27,3,0,0,3,1,0,0,1
2025-10-10,77e23ebd-6e10-4113-938c-bb55550710f5,Spice <> Capriotti's - Sep / Oct,promotion,2025-09-18,None,N/A,,d1d0b263-4918-4c81-8c97-630471e7185b,10% Happy Hour Discount - Medium Price Sensitivity,day,all,Order Discount,% Off,10.0%,25.00,USD,Nellis Blvd,75755,0,0.00,0.00,0.00,0.00,0.00,-0.00,-0.00,0.00,0.00,0.00,0,0,0,0,0,0,0,0
2025-10-10,a685c20e-2ab7-43e8-a7a8-447ab209f7f8,Spend $25 get $5 off 07/31/2024,promotion,2024-07-31,None,N/A,,,,,,,$ Off,0.00,0.00,USD,De Soto-Chatsworth,651597,3,101.74,15.00,0.00,0.00,2.97,-0.00,-0.00,33.91,5.99,5.66,0,2,1,3,0,1,1,2
2025-10-10,02d2c45e-5b6f-4058-b05d-1fbcb475312e,"First order, 20% off 04/09/2025",promotion,2025-04-09,None,N/A,,,,,,,$ Off,0.00,0.00,USD,Concord Pike,23151390,0,0.00,0.00,0.00,0.00,0.00,-0.00,-0.00,0.00,0.00,0.00,0,0,0,0,0,0,0,0
2025-10-10,77e23ebd-6e10-4113-938c-bb55550710f5,Spice <> Capriotti's - Sep / Oct,promotion,2025-09-18,None,N/A,,d1d0b263-4918-4c81-8c97-630471e7185b,10% Happy Hour Discount - Medium Price Sensitivity,day,all,Order Discount,% Off,10.0%,25.00,USD,Bridge St,35060561,3,128.49,12.58,0.00,0.00,2.97,-0.00,-0.00,42.83,5.18,8.26,1,1,1,3,0,0,0,0
2025-10-10,ef08edf0-aabc-406a-bdf8-30534f44839a,Lunch specials item discount 09/25/2025,promotion,2025-09-25,2025-10-26,N/A,,,,,,,$ Off,0.00,0.00,USD,Niles Cortland Rd SE,34043935,1,88.21,8.25,0.00,0.00,0.00,-0.00,-0.00,88.21,8.25,10.69,1,0,0,1,1,0,0,1
2025-10-10,77e23ebd-6e10-4113-938c-bb55550710f5,Spice <> Capriotti's - Sep / Oct,promotion,2025-09-18,None,N/A,,f06f33c5-bff5-4bb3-8dda-6cedeb2e6fc1,10% Happy hour Discount - Min $30 | Low Price Sensitivity,day,all,Order Discount,% Off,7.0%,30.00,USD,Limonite Ave,2375675,1,44.37,3.11,0.00,0.00,0.99,-0.00,-0.00,44.37,4.10,10.82,0,0,1,1,0,0,1,1
2025-10-10,1ca9d76f-7d83-41a6-b2a6-7ea37cf348bb,Happy Hour Item Discount 09/22/2025,promotion,2025-09-22,None,N/A,,,,,,,$ Off,0.00,0.00,USD,International Pkwy,24671402,0,0.00,0.00,0.00,0.00,0.00,-0.00,-0.00,0.00,0.00,0.00,0,0,0,0,0,0,0,0
2025-10-10,02d2c45e-5b6f-4058-b05d-1fbcb475312e,"First order, 20% off 04/09/2025",promotion,2025-04-09,None,N/A,,,,,,,$ Off,0.00,0.00,USD,Roanoke,24637171,5,130.57,19.22,0.00,0.00,4.95,-0.00,-0.00,26.11,4.83,5.40,5,0,0,5,3,0,0,3
2025-10-10,4996d114-68d0-483f-963c-d124d822fc8f,"First order, 20% off 11/12/2024",promotion,2024-11-12,None,N/A,,,,,,,$ Off,0.00,0.00,USD,Heart Pine-Odessa,2232632,1,26.97,5.00,0.00,0.00,0.99,-0.00,-0.00,26.97,5.99,4.50,1,0,0,1,1,0,0,1
2025-10-10,02d2c45e-5b6f-4058-b05d-1fbcb475312e,"First order, 20% off 04/09/2025",promotion,2025-04-09,None,N/A,,,,,,,$ Off,0.00,0.00,USD,West Sahara Avenue,424852,1,46.77,5.00,0.00,0.00,0.99,-0.00,-0.00,46.77,5.99,7.81,1,0,0,1,0,0,0,0
2025-10-10,02d2c45e-5b6f-4058-b05d-1fbcb475312e,"First order, 20% off 04/09/2025",promotion,2025-04-09,None,N/A,,,,,,,$ Off,0.00,0.00,USD,Cheyenne Rd,2375637,1,17.29,3.46,0.00,0.00,0.99,-0.00,-0.00,17.29,4.45,3.89,1,0,0,1,1,0,0,1
2025-10-10,02d2c45e-5b6f-4058-b05d-1fbcb475312e,"First order, 20% off 04/09/2025",promotion,2025-04-09,None,N/A,,,,,,,$ Off,0.00,0.00,USD,Limonite Ave,2375675,0,0.00,0.00,0.00,0.00,0.00,-0.00,-0.00,0.00,0.00,0.00,0,0,0,0,0,0,0,0
2025-10-10,02d2c45e-5b6f-4058-b05d-1fbcb475312e,"First order, 20% off 04/09/2025",promotion,2025-04-09,None,N/A,,,,,,,$ Off,0.00,0.00,USD,Los Altos,33476901,2,103.17,10.00,0.00,0.00,1.98,-0.00,-0.00,51.59,5.99,8.61,2,0,0,2,1,0,0,1
2025-10-10,bf29a390-e14d-4578-af85-d658942a738b,Loyalty Promo - Capriotti's Sandwich Shop (bus id: 768909),promotion,2024-04-26,2034-04-26,N/A,,,,,,,$ Off,0.00,0.00,USD,"Capriotti's of Dover, Inc.",1617804,0,0.00,0.00,0.00,0.00,0.00,-0.00,-0.00,0.00,0.00,0.00,0,0,0,0,0,0,0,0
2025-10-10,02d2c45e-5b6f-4058-b05d-1fbcb475312e,"First order, 20% off 04/09/2025",promotion,2025-04-09,None,N/A,,,,,,,$ Off,0.00,0.00,USD,North Union St,575293,3,80.53,12.59,0.00,0.00,2.97,-0.00,-0.00,26.84,5.19,5.18,3,0,0,3,3,0,0,3
2025-10-10,ef08edf0-aabc-406a-bdf8-30534f44839a,Lunch specials item discount 09/25/2025,promotion,2025-09-25,2025-10-26,N/A,,,,,,,$ Off,0.00,0.00,USD,Raccoon Rd,26015022,2,55.14,15.00,0.00,0.00,0.00,-0.00,-0.00,27.57,7.50,3.68,0,2,0,2,0,1,0,1
2025-10-10,77e23ebd-6e10-4113-938c-bb55550710f5,Spice <> Capriotti's - Sep / Oct,promotion,2025-09-18,None,N/A,,d1d0b263-4918-4c81-8c97-630471e7185b,10% Happy Hour Discount - Medium Price Sensitivity,day,all,Order Discount,% Off,10.0%,25.00,USD,Sunrise Blvd,31345439,0,0.00,0.00,0.00,0.00,0.00,-0.00,-0.00,0.00,0.00,0.00,0,0,0,0,0,0,0,0
2025-10-10,6f71233a-4f7b-43f5-b70b-89dc41af1fd0,Late night 5 off 25,promotion,2025-01-17,None,N/A,,,,,,,$ Off,0.00,0.00,USD,West Craig Road,75727,0,0.00,0.00,0.00,0.00,0.00,-0.00,-0.00,0.00,0.00,0.00,0,0,0,0,0,0,0,0
2025-10-10,9dd1f2bc-1053-4e77-925f-349afae361d5,Spend $30 get 15% off 01/02/2025,promotion,2025-01-02,None,N/A,,,,,,,$ Off,0.00,0.00,USD,Sunrise Blvd,31345439,8,321.90,48.28,0.00,0.00,7.92,-0.00,-0.00,40.24,7.03,5.73,1,3,4,8,1,2,2,5
2025-10-10,02d2c45e-5b6f-4058-b05d-1fbcb475312e,"First order, 20% off 04/09/2025",promotion,2025-04-09,None,N/A,,,,,,,$ Off,0.00,0.00,USD,Roby Dr - Hammond,24891803,1,18.88,3.78,0.00,0.00,0.99,-0.00,-0.00,18.88,4.77,3.96,1,0,0,1,0,0,0,0
2025-10-10,dd85331b-3d89-4ea9-af73-88a1fb0e8003,Spend $20 Get $5 Off,promotion,2022-06-20,None,N/A,,,,,,,$ Off,0.00,0.00,USD,Millsboro Plaza,23360934,8,200.92,40.00,0.00,0.00,7.92,-0.00,-0.00,25.12,5.99,4.19,1,3,4,8,1,3,2,6
2025-10-10,178f54dc-804b-413e-b1bd-ffbdde7f61a1,"Dormant customers, 20% off 02/01/2025",promotion,2025-02-01,None,N/A,,,,,,,$ Off,0.00,0.00,USD,The Old Road,24898774,0,0.00,0.00,0.00,0.00,0.00,-0.00,-0.00,0.00,0.00,0.00,0,0,0,0,0,0,0,0
2025-10-10,77e23ebd-6e10-4113-938c-bb55550710f5,Spice <> Capriotti's - Sep / Oct,promotion,2025-09-18,None,N/A,,,,day,,,$ Off,0.00,0.00,USD,Happy Valley,23584856,0,0.00,0.00,0.00,0.00,0.00,-0.00,-0.00,0.00,0.00,0.00,0,0,0,0,0,0,0,0
2025-10-10,9708621d-8c94-41e7-8a63-2da71ea0199e,"Dormant customers, 20% off 07/02/2025",promotion,2025-07-02,None,N/A,,,,,,,$ Off,0.00,0.00,USD,Southern Highlands,1750142,1,16.20,3.24,0.00,0.00,0.99,-0.00,-0.00,16.20,4.23,3.83,0,0,1,1,0,0,1,1
2025-10-10,50157030-02ee-4b4c-b1a0-c9d30675c82e,Spend $30 get 20% off 03/10/2025,promotion,2025-03-10,None,N/A,,,,,,,$ Off,0.00,0.00,USD,Kenosha & 177th,1856591,10,426.94,78.63,0.00,0.00,9.90,-0.00,-0.00,42.69,8.85,4.82,3,7,0,10,3,6,0,9
2025-10-10,02d2c45e-5b6f-4058-b05d-1fbcb475312e,"First order, 20% off 04/09/2025",promotion,2025-04-09,None,N/A,,,,,,,$ Off,0.00,0.00,USD,Manchester Rd,27715447,3,95.03,15.00,0.00,0.00,2.97,-0.00,-0.00,31.68,5.99,5.29,3,0,0,3,3,0,0,3
2025-10-10,77e23ebd-6e10-4113-938c-bb55550710f5,Spice <> Capriotti's - Sep / Oct,promotion,2025-09-18,None,N/A,,,,day,,,$ Off,0.00,0.00,USD,Kent Island,691089,0,0.00,0.00,0.00,0.00,0.00,-0.00,-0.00,0.00,0.00,0.00,0,0,0,0,0,0,0,0
2025-10-10,4996d114-68d0-483f-963c-d124d822fc8f,"First order, 20% off 11/12/2024",promotion,2024-11-12,None,N/A,,,,,,,$ Off,0.00,0.00,USD,Northdale Blvd,24976449,0,0.00,0.00,0.00,0.00,0.00,-0.00,-0.00,0.00,0.00,0.00,0,0,0,0,0,0,0,0
2025-10-10,425a2568-d931-4baa-8593-d268f8a0c259,Happy Hour discount is 30% OFF,promotion,2025-01-24,None,Daily,28.57,,,,,,$ Off,0.00,0.00,USD,Old Town,27964,2,53.43,13.11,0.00,0.00,1.98,-0.00,-0.00,26.72,7.55,3.54,1,1,0,2,1,1,0,2
2025-10-10,77e23ebd-6e10-4113-938c-bb55550710f5,Spice <> Capriotti's - Sep / Oct,promotion,2025-09-18,None,N/A,,,,day,,,$ Off,0.00,0.00,USD,Frisco,34516355,0,0.00,0.00,0.00,0.00,0.00,-0.00,-0.00,0.00,0.00,0.00,0,0,0,0,0,0,0,0
2025-10-10,77e23ebd-6e10-4113-938c-bb55550710f5,Spice <> Capriotti's - Sep / Oct,promotion,2025-09-18,None,N/A,,,,day,,,$ Off,0.00,0.00,USD,E 53rd - Davenport,582282,0,0.00,0.00,0.00,0.00,0.00,-0.00,-0.00,0.00,0.00,0.00,0,0,0,0,0,0,0,0
2025-10-10,77e23ebd-6e10-4113-938c-bb55550710f5,Spice <> Capriotti's - Sep / Oct,promotion,2025-09-18,None,N/A,,91f90d8c-8a7d-41cf-9b6a-888400112024,10% Happy Hour Discount - Min  $25 | High Price Sensitivity,day,all,Order Discount,% Off,10.0%,25.00,USD,Catclaw - Abilene,29652227,1,25.08,2.51,0.00,0.00,0.99,-0.00,-0.00,25.08,3.50,7.17,0,1,0,1,0,0,0,0
2025-10-10,425a2568-d931-4baa-8593-d268f8a0c259,Happy Hour discount is 30% OFF,promotion,2025-01-24,None,Daily,28.57,,,,,,$ Off,0.00,0.00,USD,N 87th Street,27965,3,68.64,18.77,0.00,0.00,2.97,-0.00,-0.00,22.88,7.25,3.16,1,2,0,3,1,0,0,1
2025-10-10,1f4f856e-e43b-49d1-95e9-9c3ab42f5144,"Dormant customers, 20% off 09/22/2025",promotion,2025-09-22,None,N/A,,,,,,,$ Off,0.00,0.00,USD,Frisco,34516355,3,80.13,13.82,0.00,0.00,2.97,-0.00,-0.00,26.71,5.60,4.77,0,0,3,3,0,0,3,3
2025-10-10,77e23ebd-6e10-4113-938c-bb55550710f5,Spice <> Capriotti's - Sep / Oct,promotion,2025-09-18,None,N/A,,d1d0b263-4918-4c81-8c97-630471e7185b,10% Happy Hour Discount - Medium Price Sensitivity,day,all,Order Discount,% Off,10.0%,25.00,USD,S Fort Apache,75730,1,57.85,5.00,0.00,0.00,0.99,-0.00,-0.00,57.85,5.99,9.66,0,1,0,1,0,1,0,1
2025-10-10,02d2c45e-5b6f-4058-b05d-1fbcb475312e,"First order, 20% off 04/09/2025",promotion,2025-04-09,None,N/A,,,,,,,$ Off,0.00,0.00,USD,Zionsville,24415273,6,125.49,25.11,0.00,0.00,5.94,-0.00,-0.00,20.92,5.18,4.04,5,0,0,5,5,0,0,5
2025-10-10,70d4cf5a-37fe-47ad-bac7-d5196b53b89c,Spend $30 get 20% off 09/03/2025,promotion,2025-09-03,None,N/A,,,,,,,$ Off,0.00,0.00,USD,Happy Valley,23584856,7,343.24,62.12,0.00,0.00,6.93,-0.00,-0.00,49.03,9.86,4.97,1,4,2,7,0,3,1,4
2025-10-10,77e23ebd-6e10-4113-938c-bb55550710f5,Spice <> Capriotti's - Sep / Oct,promotion,2025-09-18,None,N/A,,,,day,,,$ Off,0.00,0.00,USD,Heart Pine-Odessa,2232632,0,0.00,0.00,0.00,0.00,0.00,-0.00,-0.00,0.00,0.00,0.00,0,0,0,0,0,0,0,0
2025-10-10,77e23ebd-6e10-4113-938c-bb55550710f5,Spice <> Capriotti's - Sep / Oct,promotion,2025-09-18,None,N/A,,,,day,,,$ Off,0.00,0.00,USD,The Old Road,24898774,0,0.00,0.00,0.00,0.00,0.00,-0.00,-0.00,0.00,0.00,0.00,0,0,0,0,0,0,0,0
2025-10-10,25abde4d-2867-459b-9b99-b628e195401e,"Dormant customers, 20% off 07/24/2025",promotion,2025-07-24,None,N/A,,,,,,,$ Off,0.00,0.00,USD,West Fullerton Ave,23349403,2,75.32,14.09,0.00,0.00,1.98,-0.00,-0.00,37.66,8.04,4.69,0,0,2,2,0,0,2,2
2025-10-10,6e2eeb77-e45d-427b-974e-9e6d639dce9e,"Buy 1, get 1 free promotion 10/02/2025",promotion,2025-10-02,2025-11-02,N/A,,,,,,,$ Off,0.00,0.00,USD,Manchester Rd,27715447,0,0.00,0.00,0.00,0.00,0.00,-0.00,-0.00,0.00,0.00,0.00,0,0,0,0,0,0,0,0
2025-10-10,77e23ebd-6e10-4113-938c-bb55550710f5,Spice <> Capriotti's - Sep / Oct,promotion,2025-09-18,None,N/A,,ba37e4d8-36c4-4cbe-8c7d-f4d1379109bd,"Spend $15, Save $3 | Low price Sensitivity",day,all,Order Discount,$ Off,3.00,15.00,USD,N 87th Street,27965,0,0.00,0.00,0.00,0.00,0.00,-0.00,-0.00,0.00,0.00,0.00,0,0,0,0,0,0,0,0
2025-10-10,02d2c45e-5b6f-4058-b05d-1fbcb475312e,"First order, 20% off 04/09/2025",promotion,2025-04-09,None,N/A,,,,,,,$ Off,0.00,0.00,USD,Nellis Blvd,75755,1,23.08,4.62,0.00,0.00,0.99,-0.00,-0.00,23.08,5.61,4.11,1,0,0,1,1,0,0,1
2025-10-10,02d2c45e-5b6f-4058-b05d-1fbcb475312e,"First order, 20% off 04/09/2025",promotion,2025-04-09,None,N/A,,,,,,,$ Off,0.00,0.00,USD,Hamilton Blvd,23066760,1,17.49,3.50,0.00,0.00,0.99,-0.00,-0.00,17.49,4.49,3.90,1,0,0,1,1,0,0,1
2025-10-10,77e23ebd-6e10-4113-938c-bb55550710f5,Spice <> Capriotti's - Sep / Oct,promotion,2025-09-18,None,N/A,,f06f33c5-bff5-4bb3-8dda-6cedeb2e6fc1,10% Happy hour Discount - Min $30 | Low Price Sensitivity,day,all,Order Discount,% Off,7.0%,30.00,USD,Douglas Blvd,1018616,1,62.96,4.41,0.00,0.00,0.99,-0.00,-0.00,62.96,5.40,11.66,0,0,1,1,0,0,1,1
2025-10-10,02d2c45e-5b6f-4058-b05d-1fbcb475312e,"First order, 20% off 04/09/2025",promotion,2025-04-09,None,N/A,,,,,,,$ Off,0.00,0.00,USD,West Azure,75724,0,0.00,0.00,0.00,0.00,0.00,-0.00,-0.00,0.00,0.00,0.00,0,0,0,0,0,0,0,0
2025-10-10,77e23ebd-6e10-4113-938c-bb55550710f5,Spice <> Capriotti's - Sep / Oct,promotion,2025-09-18,None,N/A,,,,day,,,$ Off,0.00,0.00,USD,GVR Casino,75749,0,0.00,0.00,0.00,0.00,0.00,-0.00,-0.00,0.00,0.00,0.00,0,0,0,0,0,0,0,0
2025-10-10,02d2c45e-5b6f-4058-b05d-1fbcb475312e,"First order, 20% off 04/09/2025",promotion,2025-04-09,None,N/A,,,,,,,$ Off,0.00,0.00,USD,College Station,23349412,1,50.37,5.00,0.00,0.00,0.99,-0.00,-0.00,50.37,5.99,8.41,1,0,0,1,1,0,0,1
2025-10-10,02d2c45e-5b6f-4058-b05d-1fbcb475312e,"First order, 20% off 04/09/2025",promotion,2025-04-09,None,N/A,,,,,,,$ Off,0.00,0.00,USD,Magnolia Ave,31345441,2,142.53,10.00,0.00,0.00,1.98,-0.00,-0.00,71.27,5.99,11.90,2,0,0,2,0,0,0,0
2025-10-10,02d2c45e-5b6f-4058-b05d-1fbcb475312e,"First order, 20% off 04/09/2025",promotion,2025-04-09,None,N/A,,,,,,,$ Off,0.00,0.00,USD,South Eastern Ave,75744,3,71.13,12.79,0.00,0.00,2.97,-0.00,-0.00,23.71,5.25,4.51,3,0,0,3,1,0,0,1
2025-10-10,77e23ebd-6e10-4113-938c-bb55550710f5,Spice <> Capriotti's - Sep / Oct,promotion,2025-09-18,None,N/A,,d1d0b263-4918-4c81-8c97-630471e7185b,10% Happy Hour Discount - Medium Price Sensitivity,day,all,Order Discount,% Off,10.0%,25.00,USD,Sierra St - Reno,719271,5,164.38,16.45,0.00,0.00,4.95,-0.00,-0.00,32.88,4.28,7.68,0,3,2,5,0,3,1,4
2025-10-10,58fe435a-cdf8-4a86-abc7-b68d7b574ba5,Spend $25 Get 20% Off,promotion,2022-12-01,None,N/A,,,,,,,$ Off,0.00,0.00,USD,Coeur d'Alene,23085790,11,626.51,78.34,0.00,0.00,10.89,-0.00,-0.00,56.96,8.11,7.02,3,7,1,11,1,5,1,7
2025-10-10,77e23ebd-6e10-4113-938c-bb55550710f5,Spice <> Capriotti's - Sep / Oct,promotion,2025-09-18,None,N/A,,d1d0b263-4918-4c81-8c97-630471e7185b,10% Happy Hour Discount - Medium Price Sensitivity,day,all,Order Discount,% Off,10.0%,25.00,USD,San Luis Obispo,23900701,0,0.00,0.00,0.00,0.00,0.00,-0.00,-0.00,0.00,0.00,0.00,0,0,0,0,0,0,0,0
2025-10-10,77e23ebd-6e10-4113-938c-bb55550710f5,Spice <> Capriotti's - Sep / Oct,promotion,2025-09-18,None,N/A,,,,day,,,$ Off,0.00,0.00,USD,Whitesburg Dr (Medical District),34051357,0,0.00,0.00,0.00,0.00,0.00,-0.00,-0.00,0.00,0.00,0.00,0,0,0,0,0,0,0,0
2025-10-10,02d2c45e-5b6f-4058-b05d-1fbcb475312e,"First order, 20% off 04/09/2025",promotion,2025-04-09,None,N/A,,,,,,,$ Off,0.00,0.00,USD,East Craig Road,75739,5,244.87,22.06,0.00,0.00,4.95,-0.00,-0.00,48.97,5.40,9.07,5,0,0,5,4,0,0,4
2025-10-10,6f71233a-4f7b-43f5-b70b-89dc41af1fd0,Late night 5 off 25,promotion,2025-01-17,None,N/A,,,,,,,$ Off,0.00,0.00,USD,West Cheyenne Ave,75722,0,0.00,0.00,0.00,0.00,0.00,-0.00,-0.00,0.00,0.00,0.00,0,0,0,0,0,0,0,0
2025-10-10,02d2c45e-5b6f-4058-b05d-1fbcb475312e,"First order, 20% off 04/09/2025",promotion,2025-04-09,None,N/A,,,,,,,$ Off,0.00,0.00,USD,Forest Drive,674540,2,43.36,8.68,0.00,0.00,1.98,-0.00,-0.00,21.68,5.33,4.07,2,0,0,2,1,0,0,1
2025-10-10,9dd1f2bc-1053-4e77-925f-349afae361d5,Spend $30 get 15% off 01/02/2025,promotion,2025-01-02,None,N/A,,,,,,,$ Off,0.00,0.00,USD,Bidwell - Folsom,26234909,8,475.25,62.79,0.00,0.00,7.92,-0.00,-0.00,59.41,8.84,6.72,4,3,1,8,3,3,1,7
2025-10-10,77e23ebd-6e10-4113-938c-bb55550710f5,Spice <> Capriotti's - Sep / Oct,promotion,2025-09-18,None,N/A,,,,day,,,$ Off,0.00,0.00,USD,Murrieta Hot Springs Rd,29652192,0,0.00,0.00,0.00,0.00,0.00,-0.00,-0.00,0.00,0.00,0.00,0,0,0,0,0,0,0,0
2025-10-10,02d2c45e-5b6f-4058-b05d-1fbcb475312e,"First order, 20% off 04/09/2025",promotion,2025-04-09,None,N/A,,,,,,,$ Off,0.00,0.00,USD,Aliante Casino,75725,0,0.00,0.00,0.00,0.00,0.00,-0.00,-0.00,0.00,0.00,0.00,0,0,0,0,0,0,0,0
2025-10-10,77e23ebd-6e10-4113-938c-bb55550710f5,Spice <> Capriotti's - Sep / Oct,promotion,2025-09-18,None,N/A,,f06f33c5-bff5-4bb3-8dda-6cedeb2e6fc1,10% Happy hour Discount - Min $30 | Low Price Sensitivity,day,all,Order Discount,% Off,7.0%,30.00,USD,Happy Valley,23584856,0,0.00,0.00,0.00,0.00,0.00,-0.00,-0.00,0.00,0.00,0.00,0,0,0,0,0,0,0,0
2025-10-10,77e23ebd-6e10-4113-938c-bb55550710f5,Spice <> Capriotti's - Sep / Oct,promotion,2025-09-18,None,N/A,,f06f33c5-bff5-4bb3-8dda-6cedeb2e6fc1,10% Happy hour Discount - Min $30 | Low Price Sensitivity,day,all,Order Discount,% Off,7.0%,30.00,USD,Arapahoe Rd,23349425,1,45.15,3.16,0.00,0.00,0.99,-0.00,-0.00,45.15,4.15,10.88,0,1,0,1,0,1,0,1
2025-10-10,77e23ebd-6e10-4113-938c-bb55550710f5,Spice <> Capriotti's - Sep / Oct,promotion,2025-09-18,None,N/A,,ba37e4d8-36c4-4cbe-8c7d-f4d1379109bd,"Spend $15, Save $3 | Low price Sensitivity",day,all,Order Discount,$ Off,3.00,15.00,USD,Zionsville,24415273,5,104.19,15.00,0.00,0.00,4.95,-0.00,-0.00,20.84,3.99,5.22,0,5,0,5,0,5,0,5
2025-10-10,02d2c45e-5b6f-4058-b05d-1fbcb475312e,"First order, 20% off 04/09/2025",promotion,2025-04-09,None,N/A,,,,,,,$ Off,0.00,0.00,USD,Sierra St - Reno,719271,10,238.67,40.67,0.00,0.00,9.90,-0.00,-0.00,23.87,5.06,4.72,10,0,0,10,4,0,0,4
2025-10-10,77e23ebd-6e10-4113-938c-bb55550710f5,Spice <> Capriotti's - Sep / Oct,promotion,2025-09-18,None,N/A,,43340528-e1b7-4f95-ab40-8dc92bf9c274,"Spend $35, Save $6 | High Price Sensitivity",day,all,Order Discount,$ Off,6.00,35.00,USD,E 53rd - Davenport,582282,3,115.08,18.00,0.00,0.00,2.97,-0.00,-0.00,38.36,6.99,5.49,0,3,0,3,0,2,0,2
2025-10-10,02d2c45e-5b6f-4058-b05d-1fbcb475312e,"First order, 20% off 04/09/2025",promotion,2025-04-09,None,N/A,,,,,,,$ Off,0.00,0.00,USD,South Sandhill Rd,75741,1,15.68,3.14,0.00,0.00,0.99,-0.00,-0.00,15.68,4.13,3.80,1,0,0,1,0,0,0,0
2025-10-10,77e23ebd-6e10-4113-938c-bb55550710f5,Spice <> Capriotti's - Sep / Oct,promotion,2025-09-18,None,N/A,,,,day,,,$ Off,0.00,0.00,USD,Arapahoe Rd,23349425,0,0.00,0.00,0.00,0.00,0.00,-0.00,-0.00,0.00,0.00,0.00,0,0,0,0,0,0,0,0
2025-10-10,77e23ebd-6e10-4113-938c-bb55550710f5,Spice <> Capriotti's - Sep / Oct,promotion,2025-09-18,None,N/A,,,,day,,,$ Off,0.00,0.00,USD,Nevada Way,75754,0,0.00,0.00,0.00,0.00,0.00,-0.00,-0.00,0.00,0.00,0.00,0,0,0,0,0,0,0,0
2025-10-10,77e23ebd-6e10-4113-938c-bb55550710f5,Spice <> Capriotti's - Sep / Oct,promotion,2025-09-18,None,N/A,,ba37e4d8-36c4-4cbe-8c7d-f4d1379109bd,"Spend $15, Save $3 | Low price Sensitivity",day,all,Order Discount,$ Off,3.00,15.00,USD,Bidwell - Folsom,26234909,3,58.15,9.00,0.00,0.00,2.97,-0.00,-0.00,19.38,3.99,4.86,0,3,0,3,0,2,0,2
2025-10-10,77e23ebd-6e10-4113-938c-bb55550710f5,Spice <> Capriotti's - Sep / Oct,promotion,2025-09-18,None,N/A,,ba37e4d8-36c4-4cbe-8c7d-f4d1379109bd,"Spend $15, Save $3 | Low price Sensitivity",day,all,Order Discount,$ Off,3.00,15.00,USD,Parker,24021312,3,67.82,9.00,0.00,0.00,2.97,-0.00,-0.00,22.61,3.99,5.67,0,3,0,3,0,2,0,2
2025-10-10,02d2c45e-5b6f-4058-b05d-1fbcb475312e,"First order, 20% off 04/09/2025",promotion,2025-04-09,None,N/A,,,,,,,$ Off,0.00,0.00,USD,Red Cliff Dr,578425,1,28.48,5.00,0.00,0.00,0.99,-0.00,-0.00,28.48,5.99,4.75,1,0,0,1,0,0,0,0
2025-10-10,77e23ebd-6e10-4113-938c-bb55550710f5,Spice <> Capriotti's - Sep / Oct,promotion,2025-09-18,None,N/A,,d1d0b263-4918-4c81-8c97-630471e7185b,10% Happy Hour Discount - Medium Price Sensitivity,day,all,Order Discount,% Off,10.0%,25.00,USD,West Glenwood Ave,575295,3,147.16,14.08,0.00,0.00,2.97,-0.00,-0.00,49.05,5.68,8.63,0,2,1,3,0,1,0,1
2025-10-10,02d2c45e-5b6f-4058-b05d-1fbcb475312e,"First order, 20% off 04/09/2025",promotion,2025-04-09,None,N/A,,,,,,,$ Off,0.00,0.00,USD,Kenosha & 177th,1856591,4,86.44,16.58,0.00,0.00,3.96,-0.00,-0.00,21.61,5.14,4.21,4,0,0,4,1,0,0,1
2025-10-10,02d2c45e-5b6f-4058-b05d-1fbcb475312e,"First order, 20% off 04/09/2025",promotion,2025-04-09,None,N/A,,,,,,,$ Off,0.00,0.00,USD,Sunset and Sandhill,32849799,0,0.00,0.00,0.00,0.00,0.00,-0.00,-0.00,0.00,0.00,0.00,0,0,0,0,0,0,0,0
2025-10-10,77e23ebd-6e10-4113-938c-bb55550710f5,Spice <> Capriotti's - Sep / Oct,promotion,2025-09-18,None,N/A,,f06f33c5-bff5-4bb3-8dda-6cedeb2e6fc1,10% Happy hour Discount - Min $30 | Low Price Sensitivity,day,all,Order Discount,% Off,7.0%,30.00,USD,Governor Ritchie,24121153,0,0.00,0.00,0.00,0.00,0.00,-0.00,-0.00,0.00,0.00,0.00,0,0,0,0,0,0,0,0
2025-10-09,77e23ebd-6e10-4113-938c-bb55550710f5,Spice <> Capriotti's - Sep / Oct,promotion,2025-09-18,None,N/A,,43340528-e1b7-4f95-ab40-8dc92bf9c274,"Spend $35, Save $6 | High Price Sensitivity",day,all,Order Discount,$ Off,6.00,35.00,USD,Catclaw - Abilene,29652227,4,159.11,24.00,0.00,0.00,3.96,-0.00,-0.00,39.78,6.99,5.69,2,2,0,4,0,1,0,1
2025-10-09,77e23ebd-6e10-4113-938c-bb55550710f5,Spice <> Capriotti's - Sep / Oct,promotion,2025-09-18,None,N/A,,,,day,,,$ Off,0.00,0.00,USD,Princeton,32118309,0,0.00,0.00,0.00,0.00,0.00,-0.00,-0.00,0.00,0.00,0.00,0,0,0,0,0,0,0,0
2025-10-09,77e23ebd-6e10-4113-938c-bb55550710f5,Spice <> Capriotti's - Sep / Oct,promotion,2025-09-18,None,N/A,,,,day,,,$ Off,0.00,0.00,USD,The Old Road,24898774,0,0.00,0.00,0.00,0.00,0.00,-0.00,-0.00,0.00,0.00,0.00,0,0,0,0,0,0,0,0
2025-10-09,77e23ebd-6e10-4113-938c-bb55550710f5,Spice <> Capriotti's - Sep / Oct,promotion,2025-09-18,None,N/A,,d1d0b263-4918-4c81-8c97-630471e7185b,10% Happy Hour Discount - Medium Price Sensitivity,day,all,Order Discount,% Off,10.0%,25.00,USD,West Azure,75724,0,0.00,0.00,0.00,0.00,0.00,-0.00,-0.00,0.00,0.00,0.00,0,0,0,0,0,0,0,0
2025-10-09,c7538744-a515-43f8-97d0-b819c1419d1b,Happy Hour discount 09/19/2024,promotion,2024-09-19,None,N/A,,,,,,,$ Off,0.00,0.00,USD,Bidwell - Folsom,26234909,3,152.18,32.47,0.00,0.00,2.97,-0.00,-0.00,50.73,11.81,4.29,1,2,0,3,1,2,0,3
2025-10-09,77e23ebd-6e10-4113-938c-bb55550710f5,Spice <> Capriotti's - Sep / Oct,promotion,2025-09-18,None,N/A,,d1d0b263-4918-4c81-8c97-630471e7185b,10% Happy Hour Discount - Medium Price Sensitivity,day,all,Order Discount,% Off,10.0%,25.00,USD,Plumb Lane,439577,1,26.39,2.64,0.00,0.00,0.99,-0.00,-0.00,26.39,3.63,7.27,0,1,0,1,0,1,0,1
2025-10-09,77e23ebd-6e10-4113-938c-bb55550710f5,Spice <> Capriotti's - Sep / Oct,promotion,2025-09-18,None,N/A,,43340528-e1b7-4f95-ab40-8dc92bf9c274,"Spend $35, Save $6 | High Price Sensitivity",day,all,Order Discount,$ Off,6.00,35.00,USD,Niles Cortland Rd SE,34043935,5,229.59,30.00,0.00,0.00,4.95,-0.00,-0.00,45.92,6.99,6.57,1,4,0,5,1,4,0,5
2025-10-09,77e23ebd-6e10-4113-938c-bb55550710f5,Spice <> Capriotti's - Sep / Oct,promotion,2025-09-18,None,N/A,,f06f33c5-bff5-4bb3-8dda-6cedeb2e6fc1,10% Happy hour Discount - Min $30 | Low Price Sensitivity,day,all,Order Discount,% Off,7.0%,30.00,USD,Sumneytown Pike,24717004,0,0.00,0.00,0.00,0.00,0.00,-0.00,-0.00,0.00,0.00,0.00,0,0,0,0,0,0,0,0
2025-10-09,77e23ebd-6e10-4113-938c-bb55550710f5,Spice <> Capriotti's - Sep / Oct,promotion,2025-09-18,None,N/A,,,,day,,,$ Off,0.00,0.00,USD,West Charleston,23641277,0,0.00,0.00,0.00,0.00,0.00,-0.00,-0.00,0.00,0.00,0.00,0,0,0,0,0,0,0,0
2025-10-09,77e23ebd-6e10-4113-938c-bb55550710f5,Spice <> Capriotti's - Sep / Oct,promotion,2025-09-18,None,N/A,,d1d0b263-4918-4c81-8c97-630471e7185b,10% Happy Hour Discount - Medium Price Sensitivity,day,all,Order Discount,% Off,10.0%,25.00,USD,S Marion Road,1742411,0,0.00,0.00,0.00,0.00,0.00,-0.00,-0.00,0.00,0.00,0.00,0,0,0,0,0,0,0,0
2025-10-09,77e23ebd-6e10-4113-938c-bb55550710f5,Spice <> Capriotti's - Sep / Oct,promotion,2025-09-18,None,N/A,,43340528-e1b7-4f95-ab40-8dc92bf9c274,"Spend $35, Save $6 | High Price Sensitivity",day,all,Order Discount,$ Off,6.00,35.00,USD,South  Walton Blvd,1616214,1,53.65,6.00,0.00,0.00,0.99,-0.00,-0.00,53.65,6.99,7.68,0,0,1,1,0,0,0,0
2025-10-09,77e23ebd-6e10-4113-938c-bb55550710f5,Spice <> Capriotti's - Sep / Oct,promotion,2025-09-18,None,N/A,,f06f33c5-bff5-4bb3-8dda-6cedeb2e6fc1,10% Happy hour Discount - Min $30 | Low Price Sensitivity,day,all,Order Discount,% Off,7.0%,30.00,USD,"Marlton, NJ",35211042,0,0.00,0.00,0.00,0.00,0.00,-0.00,-0.00,0.00,0.00,0.00,0,0,0,0,0,0,0,0
2025-10-09,77e23ebd-6e10-4113-938c-bb55550710f5,Spice <> Capriotti's - Sep / Oct,promotion,2025-09-18,None,N/A,,d1d0b263-4918-4c81-8c97-630471e7185b,10% Happy Hour Discount - Medium Price Sensitivity,day,all,Order Discount,% Off,10.0%,25.00,USD,Blue Diamond Road,333447,1,28.25,2.83,0.00,0.00,0.99,-0.00,-0.00,28.25,3.82,7.40,0,1,0,1,0,0,0,0
2025-10-09,77e23ebd-6e10-4113-938c-bb55550710f5,Spice <> Capriotti's - Sep / Oct,promotion,2025-09-18,None,N/A,,91f90d8c-8a7d-41cf-9b6a-888400112024,10% Happy Hour Discount - Min  $25 | High Price Sensitivity,day,all,Order Discount,% Off,10.0%,25.00,USD,Palm Ave - Fresno,1581092,2,115.29,9.87,0.00,0.00,1.98,-0.00,-0.00,57.65,5.93,9.73,1,1,0,2,0,1,0,1
2025-10-09,77e23ebd-6e10-4113-938c-bb55550710f5,Spice <> Capriotti's - Sep / Oct,promotion,2025-09-18,None,N/A,,f06f33c5-bff5-4bb3-8dda-6cedeb2e6fc1,10% Happy hour Discount - Min $30 | Low Price Sensitivity,day,all,Order Discount,% Off,7.0%,30.00,USD,Kennett Square,575296,1,81.56,5.00,0.00,0.00,0.99,-0.00,-0.00,81.56,5.99,13.62,0,1,0,1,0,0,0,0
2025-10-09,77e23ebd-6e10-4113-938c-bb55550710f5,Spice <> Capriotti's - Sep / Oct,promotion,2025-09-18,None,N/A,,,,day,,,$ Off,0.00,0.00,USD,Chicago River West,34048823,0,0.00,0.00,0.00,0.00,0.00,-0.00,-0.00,0.00,0.00,0.00,0,0,0,0,0,0,0,0
2025-10-09,77e23ebd-6e10-4113-938c-bb55550710f5,Spice <> Capriotti's - Sep / Oct,promotion,2025-09-18,None,N/A,,,,day,,,$ Off,0.00,0.00,USD,Coeur d'Alene,23085790,0,0.00,0.00,0.00,0.00,0.00,-0.00,-0.00,0.00,0.00,0.00,0,0,0,0,0,0,0,0
2025-10-09,77e23ebd-6e10-4113-938c-bb55550710f5,Spice <> Capriotti's - Sep / Oct,promotion,2025-09-18,None,N/A,,d1d0b263-4918-4c81-8c97-630471e7185b,10% Happy Hour Discount - Medium Price Sensitivity,day,all,Order Discount,% Off,10.0%,25.00,USD,Roanoke,24637171,2,71.88,7.18,0.00,0.00,1.98,-0.00,-0.00,35.94,4.58,7.85,0,2,0,2,0,2,0,2
2025-10-09,77e23ebd-6e10-4113-938c-bb55550710f5,Spice <> Capriotti's - Sep / Oct,promotion,2025-09-18,None,N/A,,d1d0b263-4918-4c81-8c97-630471e7185b,10% Happy Hour Discount - Medium Price Sensitivity,day,all,Order Discount,% Off,10.0%,25.00,USD,NE Cookingham Dr,23035356,1,42.56,4.26,0.00,0.00,0.99,-0.00,-0.00,42.56,5.25,8.11,0,0,1,1,0,0,0,0
2025-10-09,77e23ebd-6e10-4113-938c-bb55550710f5,Spice <> Capriotti's - Sep / Oct,promotion,2025-09-18,None,N/A,,,,day,,,$ Off,0.00,0.00,USD,Downingtown,33699763,0,0.00,0.00,0.00,0.00,0.00,-0.00,-0.00,0.00,0.00,0.00,0,0,0,0,0,0,0,0
2025-10-09,77e23ebd-6e10-4113-938c-bb55550710f5,Spice <> Capriotti's - Sep / Oct,promotion,2025-09-18,None,N/A,,ba37e4d8-36c4-4cbe-8c7d-f4d1379109bd,"Spend $15, Save $3 | Low price Sensitivity",day,all,Order Discount,$ Off,3.00,15.00,USD,Parker,24021312,2,85.19,6.00,0.00,0.00,1.98,-0.00,-0.00,42.60,3.99,10.68,0,2,0,2,0,1,0,1
2025-10-09,77e23ebd-6e10-4113-938c-bb55550710f5,Spice <> Capriotti's - Sep / Oct,promotion,2025-09-18,None,N/A,,f06f33c5-bff5-4bb3-8dda-6cedeb2e6fc1,10% Happy hour Discount - Min $30 | Low Price Sensitivity,day,all,Order Discount,% Off,7.0%,30.00,USD,Byers Dr,23186665,0,0.00,0.00,0.00,0.00,0.00,-0.00,-0.00,0.00,0.00,0.00,0,0,0,0,0,0,0,0
2025-10-09,77e23ebd-6e10-4113-938c-bb55550710f5,Spice <> Capriotti's - Sep / Oct,promotion,2025-09-18,None,N/A,,,,day,,,$ Off,0.00,0.00,USD,Stephanie St,75751,0,0.00,0.00,0.00,0.00,0.00,-0.00,-0.00,0.00,0.00,0.00,0,0,0,0,0,0,0,0
2025-10-09,77e23ebd-6e10-4113-938c-bb55550710f5,Spice <> Capriotti's - Sep / Oct,promotion,2025-09-18,None,N/A,,f06f33c5-bff5-4bb3-8dda-6cedeb2e6fc1,10% Happy hour Discount - Min $30 | Low Price Sensitivity,day,all,Order Discount,% Off,7.0%,30.00,USD,Stephanie St,75751,0,0.00,0.00,0.00,0.00,0.00,-0.00,-0.00,0.00,0.00,0.00,0,0,0,0,0,0,0,0
2025-10-09,77e23ebd-6e10-4113-938c-bb55550710f5,Spice <> Capriotti's - Sep / Oct,promotion,2025-09-18,None,N/A,,,,day,,,$ Off,0.00,0.00,USD,Millsboro Plaza,23360934,0,0.00,0.00,0.00,0.00,0.00,-0.00,-0.00,0.00,0.00,0.00,0,0,0,0,0,0,0,0
2025-10-09,77e23ebd-6e10-4113-938c-bb55550710f5,Spice <> Capriotti's - Sep / Oct,promotion,2025-09-18,None,N/A,,d1d0b263-4918-4c81-8c97-630471e7185b,10% Happy Hour Discount - Medium Price Sensitivity,day,all,Order Discount,% Off,10.0%,25.00,USD,Elm St,34052609,0,0.00,0.00,0.00,0.00,0.00,-0.00,-0.00,0.00,0.00,0.00,0,0,0,0,0,0,0,0
2025-10-09,77e23ebd-6e10-4113-938c-bb55550710f5,Spice <> Capriotti's - Sep / Oct,promotion,2025-09-18,None,N/A,,,,day,,,$ Off,0.00,0.00,USD,Castle Rock,23057614,0,0.00,0.00,0.00,0.00,0.00,-0.00,-0.00,0.00,0.00,0.00,0,0,0,0,0,0,0,0
2025-10-09,77e23ebd-6e10-4113-938c-bb55550710f5,Spice <> Capriotti's - Sep / Oct,promotion,2025-09-18,None,N/A,,d1d0b263-4918-4c81-8c97-630471e7185b,10% Happy Hour Discount - Medium Price Sensitivity,day,all,Order Discount,% Off,10.0%,25.00,USD,Aliante Casino,75725,0,0.00,0.00,0.00,0.00,0.00,-0.00,-0.00,0.00,0.00,0.00,0,0,0,0,0,0,0,0
2025-10-09,77e23ebd-6e10-4113-938c-bb55550710f5,Spice <> Capriotti's - Sep / Oct,promotion,2025-09-18,None,N/A,,d1d0b263-4918-4c81-8c97-630471e7185b,10% Happy Hour Discount - Medium Price Sensitivity,day,all,Order Discount,% Off,10.0%,25.00,USD,Jennersville Rd,433075,1,48.46,4.85,0.00,0.00,0.99,-0.00,-0.00,48.46,5.84,8.30,0,1,0,1,0,1,0,1
2025-10-09,77e23ebd-6e10-4113-938c-bb55550710f5,Spice <> Capriotti's - Sep / Oct,promotion,2025-09-18,None,N/A,,d1d0b263-4918-4c81-8c97-630471e7185b,10% Happy Hour Discount - Medium Price Sensitivity,day,all,Order Discount,% Off,10.0%,25.00,USD,W Blue Diamond Rd,75738,0,0.00,0.00,0.00,0.00,0.00,-0.00,-0.00,0.00,0.00,0.00,0,0,0,0,0,0,0,0
2025-10-09,77e23ebd-6e10-4113-938c-bb55550710f5,Spice <> Capriotti's - Sep / Oct,promotion,2025-09-18,None,N/A,,d1d0b263-4918-4c81-8c97-630471e7185b,10% Happy Hour Discount - Medium Price Sensitivity,day,all,Order Discount,% Off,10.0%,25.00,USD,Santa Fe Station,75723,0,0.00,0.00,0.00,0.00,0.00,-0.00,-0.00,0.00,0.00,0.00,0,0,0,0,0,0,0,0
2025-10-09,77e23ebd-6e10-4113-938c-bb55550710f5,Spice <> Capriotti's - Sep / Oct,promotion,2025-09-18,None,N/A,,,,day,,,$ Off,0.00,0.00,USD,College Station,23349412,0,0.00,0.00,0.00,0.00,0.00,-0.00,-0.00,0.00,0.00,0.00,0,0,0,0,0,0,0,0
2025-10-09,77e23ebd-6e10-4113-938c-bb55550710f5,Spice <> Capriotti's - Sep / Oct,promotion,2025-09-18,None,N/A,,f06f33c5-bff5-4bb3-8dda-6cedeb2e6fc1,10% Happy hour Discount - Min $30 | Low Price Sensitivity,day,all,Order Discount,% Off,7.0%,30.00,USD,Parker,24021312,0,0.00,0.00,0.00,0.00,0.00,-0.00,-0.00,0.00,0.00,0.00,0,0,0,0,0,0,0,0
2025-10-09,77e23ebd-6e10-4113-938c-bb55550710f5,Spice <> Capriotti's - Sep / Oct,promotion,2025-09-18,None,N/A,,d1d0b263-4918-4c81-8c97-630471e7185b,10% Happy Hour Discount - Medium Price Sensitivity,day,all,Order Discount,% Off,10.0%,25.00,USD,E Silverado Ranch,75746,2,67.19,6.72,0.00,0.00,1.98,-0.00,-0.00,33.60,4.35,7.72,0,2,0,2,0,2,0,2
2025-10-09,77e23ebd-6e10-4113-938c-bb55550710f5,Spice <> Capriotti's - Sep / Oct,promotion,2025-09-18,None,N/A,,d1d0b263-4918-4c81-8c97-630471e7185b,10% Happy Hour Discount - Medium Price Sensitivity,day,all,Order Discount,% Off,10.0%,25.00,USD,East Craig Road,75739,1,26.39,2.64,0.00,0.00,0.99,-0.00,-0.00,26.39,3.63,7.27,0,1,0,1,0,1,0,1
2025-10-09,77e23ebd-6e10-4113-938c-bb55550710f5,Spice <> Capriotti's - Sep / Oct,promotion,2025-09-18,None,N/A,,91f90d8c-8a7d-41cf-9b6a-888400112024,10% Happy Hour Discount - Min  $25 | High Price Sensitivity,day,all,Order Discount,% Off,10.0%,25.00,USD,West Basin Rd,575301,2,63.76,6.38,0.00,0.00,1.98,-0.00,-0.00,31.88,4.18,7.63,0,1,1,2,0,0,1,1
2025-10-09,77e23ebd-6e10-4113-938c-bb55550710f5,Spice <> Capriotti's - Sep / Oct,promotion,2025-09-18,None,N/A,,91f90d8c-8a7d-41cf-9b6a-888400112024,10% Happy Hour Discount - Min  $25 | High Price Sensitivity,day,all,Order Discount,% Off,10.0%,25.00,USD,Chicago River West,34048823,1,33.68,3.37,0.00,0.00,0.99,-0.00,-0.00,33.68,4.36,7.72,0,0,1,1,0,0,0,0
2025-10-09,77e23ebd-6e10-4113-938c-bb55550710f5,Spice <> Capriotti's - Sep / Oct,promotion,2025-09-18,None,N/A,,d1d0b263-4918-4c81-8c97-630471e7185b,10% Happy Hour Discount - Medium Price Sensitivity,day,all,Order Discount,% Off,10.0%,25.00,USD,South Rainbow,75732,0,0.00,0.00,0.00,0.00,0.00,-0.00,-0.00,0.00,0.00,0.00,0,0,0,0,0,0,0,0
2025-10-09,77e23ebd-6e10-4113-938c-bb55550710f5,Spice <> Capriotti's - Sep / Oct,promotion,2025-09-18,None,N/A,,d1d0b263-4918-4c81-8c97-630471e7185b,10% Happy Hour Discount - Medium Price Sensitivity,day,all,Order Discount,% Off,10.0%,25.00,USD,Marlboro - Easton,674514,0,0.00,0.00,0.00,0.00,0.00,-0.00,-0.00,0.00,0.00,0.00,0,0,0,0,0,0,0,0
2025-10-09,22a1aa22-01b8-4784-a262-c64e4855ebce,"Dormant customers, 20% off 07/31/2024",promotion,2024-07-31,None,N/A,,,,,,,$ Off,0.00,0.00,USD,East Sepulveda,1743753,0,0.00,0.00,0.00,0.00,0.00,-0.00,-0.00,0.00,0.00,0.00,0,0,0,0,0,0,0,0
2025-10-09,02d2c45e-5b6f-4058-b05d-1fbcb475312e,"First order, 20% off 04/09/2025",promotion,2025-04-09,None,N/A,,,,,,,$ Off,0.00,0.00,USD,Millsboro Plaza,23360934,0,0.00,0.00,0.00,0.00,0.00,-0.00,-0.00,0.00,0.00,0.00,0,0,0,0,0,0,0,0
2025-10-09,f632eba8-7caa-4715-8101-69a221822987,Spend $35 get $5 off 12/02/2024,promotion,2024-12-02,None,N/A,,,,,,,$ Off,0.00,0.00,USD,"Capriotti's of Milford, LLC",1636430,0,0.00,0.00,0.00,0.00,0.00,-0.00,-0.00,0.00,0.00,0.00,0,0,0,0,0,0,0,0
2025-10-09,492738a1-8e75-477a-b4bd-aec773e7d330,Spend $40 get $6 off 01/22/2025,promotion,2025-01-22,None,N/A,,,,,,,$ Off,0.00,0.00,USD,East Market Street,23256727,3,254.58,18.00,0.00,0.00,2.97,-0.00,-0.00,84.86,6.99,12.14,1,1,1,3,1,1,0,2
2025-10-09,77e23ebd-6e10-4113-938c-bb55550710f5,Spice <> Capriotti's - Sep / Oct,promotion,2025-09-18,None,N/A,,ba37e4d8-36c4-4cbe-8c7d-f4d1379109bd,"Spend $15, Save $3 | Low price Sensitivity",day,all,Order Discount,$ Off,3.00,15.00,USD,N 87th Street,27965,5,142.14,15.00,0.00,0.00,4.95,-0.00,-0.00,28.43,3.99,7.12,0,3,2,5,0,2,2,4
2025-10-09,02d2c45e-5b6f-4058-b05d-1fbcb475312e,"First order, 20% off 04/09/2025",promotion,2025-04-09,None,N/A,,,,,,,$ Off,0.00,0.00,USD,East Sepulveda,1743753,0,0.00,0.00,0.00,0.00,0.00,-0.00,-0.00,0.00,0.00,0.00,0,0,0,0,0,0,0,0
2025-10-09,77e23ebd-6e10-4113-938c-bb55550710f5,Spice <> Capriotti's - Sep / Oct,promotion,2025-09-18,None,N/A,,d1d0b263-4918-4c81-8c97-630471e7185b,10% Happy Hour Discount - Medium Price Sensitivity,day,all,Order Discount,% Off,10.0%,25.00,USD,North Town Center,75721,0,0.00,0.00,0.00,0.00,0.00,-0.00,-0.00,0.00,0.00,0.00,0,0,0,0,0,0,0,0
2025-10-09,77e23ebd-6e10-4113-938c-bb55550710f5,Spice <> Capriotti's - Sep / Oct,promotion,2025-09-18,None,N/A,,,,day,,,$ Off,0.00,0.00,USD,Townpark Lane,128721,0,0.00,0.00,0.00,0.00,0.00,-0.00,-0.00,0.00,0.00,0.00,0,0,0,0,0,0,0,0
2025-10-09,77e23ebd-6e10-4113-938c-bb55550710f5,Spice <> Capriotti's - Sep / Oct,promotion,2025-09-18,None,N/A,,d1d0b263-4918-4c81-8c97-630471e7185b,10% Happy Hour Discount - Medium Price Sensitivity,day,all,Order Discount,% Off,10.0%,25.00,USD,1st Ave NE,23128705,0,0.00,0.00,0.00,0.00,0.00,-0.00,-0.00,0.00,0.00,0.00,0,0,0,0,0,0,0,0
2025-10-09,77e23ebd-6e10-4113-938c-bb55550710f5,Spice <> Capriotti's - Sep / Oct,promotion,2025-09-18,None,N/A,,f06f33c5-bff5-4bb3-8dda-6cedeb2e6fc1,10% Happy hour Discount - Min $30 | Low Price Sensitivity,day,all,Order Discount,% Off,7.0%,30.00,USD,Smithtown Bypass,23349427,0,0.00,0.00,0.00,0.00,0.00,-0.00,-0.00,0.00,0.00,0.00,0,0,0,0,0,0,0,0
2025-10-09,77e23ebd-6e10-4113-938c-bb55550710f5,Spice <> Capriotti's - Sep / Oct,promotion,2025-09-18,None,N/A,,ba37e4d8-36c4-4cbe-8c7d-f4d1379109bd,"Spend $15, Save $3 | Low price Sensitivity",day,all,Order Discount,$ Off,3.00,15.00,USD,Gambrills,24415514,2,33.97,6.00,0.00,0.00,1.98,-0.00,-0.00,16.99,3.99,4.26,0,2,0,2,0,1,0,1
2025-10-09,77e23ebd-6e10-4113-938c-bb55550710f5,Spice <> Capriotti's - Sep / Oct,promotion,2025-09-18,None,N/A,,,,day,,,$ Off,0.00,0.00,USD,Parker,24021312,0,0.00,0.00,0.00,0.00,0.00,-0.00,-0.00,0.00,0.00,0.00,0,0,0,0,0,0,0,0
2025-10-09,77e23ebd-6e10-4113-938c-bb55550710f5,Spice <> Capriotti's - Sep / Oct,promotion,2025-09-18,None,N/A,,,,day,,,$ Off,0.00,0.00,USD,Arapahoe Rd,23349425,0,0.00,0.00,0.00,0.00,0.00,-0.00,-0.00,0.00,0.00,0.00,0,0,0,0,0,0,0,0
2025-10-09,77e23ebd-6e10-4113-938c-bb55550710f5,Spice <> Capriotti's - Sep / Oct,promotion,2025-09-18,None,N/A,,ba37e4d8-36c4-4cbe-8c7d-f4d1379109bd,"Spend $15, Save $3 | Low price Sensitivity",day,all,Order Discount,$ Off,3.00,15.00,USD,Bel Air,23733193,2,47.66,6.00,0.00,0.00,1.98,-0.00,-0.00,23.83,3.99,5.97,0,1,1,2,0,0,1,1
2025-10-09,77e23ebd-6e10-4113-938c-bb55550710f5,Spice <> Capriotti's - Sep / Oct,promotion,2025-09-18,None,N/A,,43340528-e1b7-4f95-ab40-8dc92bf9c274,"Spend $35, Save $6 | High Price Sensitivity",day,all,Order Discount,$ Off,6.00,35.00,USD,West Basin Rd,575301,3,127.46,18.00,0.00,0.00,2.97,-0.00,-0.00,42.49,6.99,6.08,0,3,0,3,0,3,0,3
2025-10-09,77e23ebd-6e10-4113-938c-bb55550710f5,Spice <> Capriotti's - Sep / Oct,promotion,2025-09-18,None,N/A,,43340528-e1b7-4f95-ab40-8dc92bf9c274,"Spend $35, Save $6 | High Price Sensitivity",day,all,Order Discount,$ Off,6.00,35.00,USD,Palm Ave - Fresno,1581092,1,41.57,6.00,0.00,0.00,0.99,-0.00,-0.00,41.57,6.99,5.95,1,0,0,1,1,0,0,1
2025-10-09,77e23ebd-6e10-4113-938c-bb55550710f5,Spice <> Capriotti's - Sep / Oct,promotion,2025-09-18,None,N/A,,91f90d8c-8a7d-41cf-9b6a-888400112024,10% Happy Hour Discount - Min  $25 | High Price Sensitivity,day,all,Order Discount,% Off,10.0%,25.00,USD,South  Walton Blvd,1616214,2,66.34,6.64,0.00,0.00,1.98,-0.00,-0.00,33.17,4.31,7.70,0,0,2,2,0,0,1,1
2025-10-09,77e23ebd-6e10-4113-938c-bb55550710f5,Spice <> Capriotti's - Sep / Oct,promotion,2025-09-18,None,N/A,,,,day,,,$ Off,0.00,0.00,USD,Lantana Drive,390888,0,0.00,0.00,0.00,0.00,0.00,-0.00,-0.00,0.00,0.00,0.00,0,0,0,0,0,0,0,0
2025-10-09,77e23ebd-6e10-4113-938c-bb55550710f5,Spice <> Capriotti's - Sep / Oct,promotion,2025-09-18,None,N/A,,d1d0b263-4918-4c81-8c97-630471e7185b,10% Happy Hour Discount - Medium Price Sensitivity,day,all,Order Discount,% Off,10.0%,25.00,USD,West Charleston,23641277,2,65.74,6.58,0.00,0.00,1.98,-0.00,-0.00,32.87,4.28,7.68,0,1,1,2,0,1,0,1
2025-10-09,77e23ebd-6e10-4113-938c-bb55550710f5,Spice <> Capriotti's - Sep / Oct,promotion,2025-09-18,None,N/A,,,,day,,,$ Off,0.00,0.00,USD,Douglas Blvd,1018616,0,0.00,0.00,0.00,0.00,0.00,-0.00,-0.00,0.00,0.00,0.00,0,0,0,0,0,0,0,0
2025-10-09,77e23ebd-6e10-4113-938c-bb55550710f5,Spice <> Capriotti's - Sep / Oct,promotion,2025-09-18,None,N/A,,f06f33c5-bff5-4bb3-8dda-6cedeb2e6fc1,10% Happy hour Discount - Min $30 | Low Price Sensitivity,day,all,Order Discount,% Off,7.0%,30.00,USD,Limonite Ave,2375675,0,0.00,0.00,0.00,0.00,0.00,-0.00,-0.00,0.00,0.00,0.00,0,0,0,0,0,0,0,0
2025-10-09,77e23ebd-6e10-4113-938c-bb55550710f5,Spice <> Capriotti's - Sep / Oct,promotion,2025-09-18,None,N/A,,,,day,,,$ Off,0.00,0.00,USD,Cortez Rd  West,26034424,0,0.00,0.00,0.00,0.00,0.00,-0.00,-0.00,0.00,0.00,0.00,0,0,0,0,0,0,0,0
2025-10-09,77e23ebd-6e10-4113-938c-bb55550710f5,Spice <> Capriotti's - Sep / Oct,promotion,2025-09-18,None,N/A,,d1d0b263-4918-4c81-8c97-630471e7185b,10% Happy Hour Discount - Medium Price Sensitivity,day,all,Order Discount,% Off,10.0%,25.00,USD,Sunset and Sandhill,32849799,1,32.58,3.26,0.00,0.00,0.99,-0.00,-0.00,32.58,4.25,7.67,0,1,0,1,0,0,0,0
2025-10-09,77e23ebd-6e10-4113-938c-bb55550710f5,Spice <> Capriotti's - Sep / Oct,promotion,2025-09-18,None,N/A,,,,day,,,$ Off,0.00,0.00,USD,Riverwind Dr,34516256,0,0.00,0.00,0.00,0.00,0.00,-0.00,-0.00,0.00,0.00,0.00,0,0,0,0,0,0,0,0
2025-10-09,77e23ebd-6e10-4113-938c-bb55550710f5,Spice <> Capriotti's - Sep / Oct,promotion,2025-09-18,None,N/A,,ba37e4d8-36c4-4cbe-8c7d-f4d1379109bd,"Spend $15, Save $3 | Low price Sensitivity",day,all,Order Discount,$ Off,3.00,15.00,USD,Sumneytown Pike,24717004,6,197.60,18.00,0.00,0.00,5.94,-0.00,-0.00,32.93,3.99,8.25,0,5,1,6,0,5,0,5
2025-10-09,77e23ebd-6e10-4113-938c-bb55550710f5,Spice <> Capriotti's - Sep / Oct,promotion,2025-09-18,None,N/A,,91f90d8c-8a7d-41cf-9b6a-888400112024,10% Happy Hour Discount - Min  $25 | High Price Sensitivity,day,all,Order Discount,% Off,10.0%,25.00,USD,Niles Cortland Rd SE,34043935,0,0.00,0.00,0.00,0.00,0.00,-0.00,-0.00,0.00,0.00,0.00,0,0,0,0,0,0,0,0
2025-10-09,77e23ebd-6e10-4113-938c-bb55550710f5,Spice <> Capriotti's - Sep / Oct,promotion,2025-09-18,None,N/A,,ba37e4d8-36c4-4cbe-8c7d-f4d1379109bd,"Spend $15, Save $3 | Low price Sensitivity",day,all,Order Discount,$ Off,3.00,15.00,USD,Anthem,75750,0,0.00,0.00,0.00,0.00,0.00,-0.00,-0.00,0.00,0.00,0.00,0,0,0,0,0,0,0,0
2025-10-09,77e23ebd-6e10-4113-938c-bb55550710f5,Spice <> Capriotti's - Sep / Oct,promotion,2025-09-18,None,N/A,,d1d0b263-4918-4c81-8c97-630471e7185b,10% Happy Hour Discount - Medium Price Sensitivity,day,all,Order Discount,% Off,10.0%,25.00,USD,Dana Park - Mesa,126177,2,99.03,7.51,0.00,0.00,1.98,-0.00,-0.00,49.52,4.75,10.44,1,1,0,2,1,1,0,2
2025-10-09,77e23ebd-6e10-4113-938c-bb55550710f5,Spice <> Capriotti's - Sep / Oct,promotion,2025-09-18,None,N/A,,,,day,,,$ Off,0.00,0.00,USD,University Dr,29894178,0,0.00,0.00,0.00,0.00,0.00,-0.00,-0.00,0.00,0.00,0.00,0,0,0,0,0,0,0,0
2025-10-09,77e23ebd-6e10-4113-938c-bb55550710f5,Spice <> Capriotti's - Sep / Oct,promotion,2025-09-18,None,N/A,,ba37e4d8-36c4-4cbe-8c7d-f4d1379109bd,"Spend $15, Save $3 | Low price Sensitivity",day,all,Order Discount,$ Off,3.00,15.00,USD,Terrace Center,321047,3,67.74,9.00,0.00,0.00,2.97,-0.00,-0.00,22.58,3.99,5.66,0,1,2,3,0,1,1,2
2025-10-09,77e23ebd-6e10-4113-938c-bb55550710f5,Spice <> Capriotti's - Sep / Oct,promotion,2025-09-18,None,N/A,,,,day,,,$ Off,0.00,0.00,USD,Anthem,75750,0,0.00,0.00,0.00,0.00,0.00,-0.00,-0.00,0.00,0.00,0.00,0,0,0,0,0,0,0,0
2025-10-09,77e23ebd-6e10-4113-938c-bb55550710f5,Spice <> Capriotti's - Sep / Oct,promotion,2025-09-18,None,N/A,,91f90d8c-8a7d-41cf-9b6a-888400112024,10% Happy Hour Discount - Min  $25 | High Price Sensitivity,day,all,Order Discount,% Off,10.0%,25.00,USD,College Station,23349412,0,0.00,0.00,0.00,0.00,0.00,-0.00,-0.00,0.00,0.00,0.00,0,0,0,0,0,0,0,0
2025-10-09,77e23ebd-6e10-4113-938c-bb55550710f5,Spice <> Capriotti's - Sep / Oct,promotion,2025-09-18,None,N/A,,d1d0b263-4918-4c81-8c97-630471e7185b,10% Happy Hour Discount - Medium Price Sensitivity,day,all,Order Discount,% Off,10.0%,25.00,USD,Paradise Road,75734,1,52.74,5.00,0.00,0.00,0.99,-0.00,-0.00,52.74,5.99,8.80,0,1,0,1,0,1,0,1
2025-10-09,77e23ebd-6e10-4113-938c-bb55550710f5,Spice <> Capriotti's - Sep / Oct,promotion,2025-09-18,None,N/A,,,,day,,,$ Off,0.00,0.00,USD,Old Town,27964,0,0.00,0.00,0.00,0.00,0.00,-0.00,-0.00,0.00,0.00,0.00,0,0,0,0,0,0,0,0
2025-10-09,77e23ebd-6e10-4113-938c-bb55550710f5,Spice <> Capriotti's - Sep / Oct,promotion,2025-09-18,None,N/A,,43340528-e1b7-4f95-ab40-8dc92bf9c274,"Spend $35, Save $6 | High Price Sensitivity",day,all,Order Discount,$ Off,6.00,35.00,USD,Blackstone-Fresno,24415716,0,0.00,0.00,0.00,0.00,0.00,-0.00,-0.00,0.00,0.00,0.00,0,0,0,0,0,0,0,0
2025-10-09,77e23ebd-6e10-4113-938c-bb55550710f5,Spice <> Capriotti's - Sep / Oct,promotion,2025-09-18,None,N/A,,f06f33c5-bff5-4bb3-8dda-6cedeb2e6fc1,10% Happy hour Discount - Min $30 | Low Price Sensitivity,day,all,Order Discount,% Off,7.0%,30.00,USD,Gambrills,24415514,0,0.00,0.00,0.00,0.00,0.00,-0.00,-0.00,0.00,0.00,0.00,0,0,0,0,0,0,0,0
2025-10-09,4d5a689d-a212-46a2-91dc-8288a79ff11a,"First order, 20% off 01/02/2025",promotion,2025-01-02,None,N/A,,,,,,,$ Off,0.00,0.00,USD,Bidwell - Folsom,26234909,1,15.99,3.20,0.00,0.00,0.99,-0.00,-0.00,15.99,4.19,3.82,1,0,0,1,0,0,0,0
2025-10-09,425a2568-d931-4baa-8593-d268f8a0c259,Happy Hour discount is 30% OFF,promotion,2025-01-24,None,Daily,28.57,,,,,,$ Off,0.00,0.00,USD,Old Town,27964,0,0.00,0.00,0.00,0.00,0.00,-0.00,-0.00,0.00,0.00,0.00,0,0,0,0,0,0,0,0
2025-10-09,02d2c45e-5b6f-4058-b05d-1fbcb475312e,"First order, 20% off 04/09/2025",promotion,2025-04-09,None,N/A,,,,,,,$ Off,0.00,0.00,USD,Bel Air,23733193,5,114.20,21.49,0.00,0.00,4.95,-0.00,-0.00,22.84,5.29,4.32,5,0,0,5,4,0,0,4
2025-10-09,6c1ac2b8-1b1b-4277-8266-2ffa49f73156,Happy Hour Item Discount 09/22/2025,promotion,2025-09-22,None,N/A,,,,,,,$ Off,0.00,0.00,USD,Frisco,34516355,0,0.00,0.00,0.00,0.00,0.00,-0.00,-0.00,0.00,0.00,0.00,0,0,0,0,0,0,0,0
2025-10-09,77e23ebd-6e10-4113-938c-bb55550710f5,Spice <> Capriotti's - Sep / Oct,promotion,2025-09-18,None,N/A,,,,day,,,$ Off,0.00,0.00,USD,Palm Ave - Fresno,1581092,0,0.00,0.00,0.00,0.00,0.00,-0.00,-0.00,0.00,0.00,0.00,0,0,0,0,0,0,0,0
2025-10-09,02d2c45e-5b6f-4058-b05d-1fbcb475312e,"First order, 20% off 04/09/2025",promotion,2025-04-09,None,N/A,,,,,,,$ Off,0.00,0.00,USD,Plank Rd,27918503,0,0.00,0.00,0.00,0.00,0.00,-0.00,-0.00,0.00,0.00,0.00,0,0,0,0,0,0,0,0
2025-10-09,02d2c45e-5b6f-4058-b05d-1fbcb475312e,"First order, 20% off 04/09/2025",promotion,2025-04-09,None,N/A,,,,,,,$ Off,0.00,0.00,USD,West Craig Road,75727,0,0.00,0.00,0.00,0.00,0.00,-0.00,-0.00,0.00,0.00,0.00,0,0,0,0,0,0,0,0
2025-10-09,02d2c45e-5b6f-4058-b05d-1fbcb475312e,"First order, 20% off 04/09/2025",promotion,2025-04-09,None,N/A,,,,,,,$ Off,0.00,0.00,USD,Horizon Ridge,75753,0,0.00,0.00,0.00,0.00,0.00,-0.00,-0.00,0.00,0.00,0.00,0,0,0,0,0,0,0,0
2025-10-09,02d2c45e-5b6f-4058-b05d-1fbcb475312e,"First order, 20% off 04/09/2025",promotion,2025-04-09,None,N/A,,,,,,,$ Off,0.00,0.00,USD,East Market Street,23256727,3,58.23,11.48,0.00,0.00,2.97,-0.00,-0.00,19.41,4.82,4.03,3,0,0,3,0,0,0,0
2025-10-09,b1b17c93-8403-4c3e-a886-f72875e9d017,Spend $25 get $5 off 07/31/2024,promotion,2024-07-31,None,N/A,,,,,,,$ Off,0.00,0.00,USD,East Sepulveda,1743753,7,220.26,35.00,0.00,0.00,6.93,-0.00,-0.00,31.47,5.99,5.25,2,4,1,7,2,2,1,5
2025-10-09,bf29a390-e14d-4578-af85-d658942a738b,Loyalty Promo - Capriotti's Sandwich Shop (bus id: 768909),promotion,2024-04-26,2034-04-26,N/A,,,,,,,$ Off,0.00,0.00,USD,"Capriotti's of Milford, LLC",1636430,2,27.76,10.00,0.00,0.00,0.00,-0.00,-0.00,13.88,5.00,2.78,0,2,0,2,0,0,0,0
2025-10-09,10f22bff-32eb-477c-b8fd-70d17c151ce3,Happy Hour discount 10/02/2025,promotion,2025-10-02,2025-11-02,N/A,,,,,,,$ Off,0.00,0.00,USD,Manchester Rd,27715447,3,104.70,26.18,0.00,0.00,2.97,-0.00,-0.00,34.90,9.72,3.59,1,2,0,3,1,2,0,3
2025-10-09,22011977-85b1-4624-ad97-926f3ebe49f4,Happy Hour discount 07/09/2025,promotion,2025-07-09,None,N/A,,,,,,,$ Off,0.00,0.00,USD,Niles Cortland Rd SE,34043935,6,169.24,36.55,0.00,0.00,5.94,-0.00,-0.00,28.21,7.08,3.98,1,4,1,6,1,3,0,4
2025-10-09,02d2c45e-5b6f-4058-b05d-1fbcb475312e,"First order, 20% off 04/09/2025",promotion,2025-04-09,None,N/A,,,,,,,$ Off,0.00,0.00,USD,Magnolia Ave,31345441,2,52.47,8.76,0.00,0.00,1.98,-0.00,-0.00,26.24,5.37,4.89,2,0,0,2,0,0,0,0
2025-10-09,02d2c45e-5b6f-4058-b05d-1fbcb475312e,"First order, 20% off 04/09/2025",promotion,2025-04-09,None,N/A,,,,,,,$ Off,0.00,0.00,USD,Broadway - Tucson,27829895,2,77.74,8.12,0.00,0.00,1.98,-0.00,-0.00,38.87,5.05,7.70,2,0,0,2,1,0,0,1
2025-10-09,02d2c45e-5b6f-4058-b05d-1fbcb475312e,"First order, 20% off 04/09/2025",promotion,2025-04-09,None,N/A,,,,,,,$ Off,0.00,0.00,USD,Sumneytown Pike,24717004,0,0.00,0.00,0.00,0.00,0.00,-0.00,-0.00,0.00,0.00,0.00,0,0,0,0,0,0,0,0
2025-10-09,02d2c45e-5b6f-4058-b05d-1fbcb475312e,"First order, 20% off 04/09/2025",promotion,2025-04-09,None,N/A,,,,,,,$ Off,0.00,0.00,USD,South Eastern Ave,75744,1,19.28,3.86,0.00,0.00,0.99,-0.00,-0.00,19.28,4.85,3.98,1,0,0,1,1,0,0,1
2025-10-09,02d2c45e-5b6f-4058-b05d-1fbcb475312e,"First order, 20% off 04/09/2025",promotion,2025-04-09,None,N/A,,,,,,,$ Off,0.00,0.00,USD,Sahara & Las Vegas,75735,2,49.55,9.63,0.00,0.00,1.98,-0.00,-0.00,24.78,5.81,4.27,2,0,0,2,2,0,0,2
2025-10-09,02d2c45e-5b6f-4058-b05d-1fbcb475312e,"First order, 20% off 04/09/2025",promotion,2025-04-09,None,N/A,,,,,,,$ Off,0.00,0.00,USD,Zionsville,24415273,1,22.47,4.49,0.00,0.00,0.99,-0.00,-0.00,22.47,5.48,4.10,1,0,0,1,0,0,0,0
2025-10-09,77e23ebd-6e10-4113-938c-bb55550710f5,Spice <> Capriotti's - Sep / Oct,promotion,2025-09-18,None,N/A,,f06f33c5-bff5-4bb3-8dda-6cedeb2e6fc1,10% Happy hour Discount - Min $30 | Low Price Sensitivity,day,all,Order Discount,% Off,7.0%,30.00,USD,Rancho Mirage,32864869,0,0.00,0.00,0.00,0.00,0.00,-0.00,-0.00,0.00,0.00,0.00,0,0,0,0,0,0,0,0
2025-10-09,77e23ebd-6e10-4113-938c-bb55550710f5,Spice <> Capriotti's - Sep / Oct,promotion,2025-09-18,None,N/A,,f06f33c5-bff5-4bb3-8dda-6cedeb2e6fc1,10% Happy hour Discount - Min $30 | Low Price Sensitivity,day,all,Order Discount,% Off,7.0%,30.00,USD,Arapahoe Rd,23349425,1,32.58,2.28,0.00,0.00,0.99,-0.00,-0.00,32.58,3.27,9.96,0,1,0,1,0,1,0,1
2025-10-09,02d2c45e-5b6f-4058-b05d-1fbcb475312e,"First order, 20% off 04/09/2025",promotion,2025-04-09,None,N/A,,,,,,,$ Off,0.00,0.00,USD,Southern Highlands,1750142,0,0.00,0.00,0.00,0.00,0.00,-0.00,-0.00,0.00,0.00,0.00,0,0,0,0,0,0,0,0
2025-10-09,6f71233a-4f7b-43f5-b70b-89dc41af1fd0,Late night 5 off 25,promotion,2025-01-17,None,N/A,,,,,,,$ Off,0.00,0.00,USD,Oso Blanca Rd,178087,0,0.00,0.00,0.00,0.00,0.00,-0.00,-0.00,0.00,0.00,0.00,0,0,0,0,0,0,0,0
2025-10-09,02d2c45e-5b6f-4058-b05d-1fbcb475312e,"First order, 20% off 04/09/2025",promotion,2025-04-09,None,N/A,,,,,,,$ Off,0.00,0.00,USD,West Glenwood Ave,575295,7,157.14,28.01,0.00,0.00,6.93,-0.00,-0.00,22.45,4.99,4.50,7,0,0,7,2,0,0,2
2025-10-09,02d2c45e-5b6f-4058-b05d-1fbcb475312e,"First order, 20% off 04/09/2025",promotion,2025-04-09,None,N/A,,,,,,,$ Off,0.00,0.00,USD,International Pkwy,24671402,1,34.06,5.00,0.00,0.00,0.99,-0.00,-0.00,34.06,5.99,5.69,1,0,0,1,0,0,0,0
2025-10-09,58fe435a-cdf8-4a86-abc7-b68d7b574ba5,Spend $25 Get 20% Off,promotion,2022-12-01,None,N/A,,,,,,,$ Off,0.00,0.00,USD,Happy Valley,23584856,0,0.00,0.00,0.00,0.00,0.00,-0.00,-0.00,0.00,0.00,0.00,0,0,0,0,0,0,0,0
2025-10-09,55ceb1d5-c2fa-48a3-8e52-3fbe10ad9c00,"Dormant customers, 20% off 07/15/2025",promotion,2025-07-16,None,N/A,,,,,,,$ Off,0.00,0.00,USD,Dana Park - Mesa,126177,3,115.89,18.66,0.00,0.00,2.97,-0.00,-0.00,38.63,7.21,5.36,0,0,3,3,0,0,3,3
2025-10-09,1f4f856e-e43b-49d1-95e9-9c3ab42f5144,"Dormant customers, 20% off 09/22/2025",promotion,2025-09-22,None,N/A,,,,,,,$ Off,0.00,0.00,USD,Frisco,34516355,1,32.66,5.00,0.00,0.00,0.99,-0.00,-0.00,32.66,5.99,5.45,0,0,1,1,0,0,1,1
2025-10-09,77e23ebd-6e10-4113-938c-bb55550710f5,Spice <> Capriotti's - Sep / Oct,promotion,2025-09-18,None,N/A,,,,day,,,$ Off,0.00,0.00,USD,South  Walton Blvd,1616214,0,0.00,0.00,0.00,0.00,0.00,-0.00,-0.00,0.00,0.00,0.00,0,0,0,0,0,0,0,0
2025-10-09,77e23ebd-6e10-4113-938c-bb55550710f5,Spice <> Capriotti's - Sep / Oct,promotion,2025-09-18,None,N/A,,,,day,,,$ Off,0.00,0.00,USD,"Marlton, NJ",35211042,0,0.00,0.00,0.00,0.00,0.00,-0.00,-0.00,0.00,0.00,0.00,0,0,0,0,0,0,0,0
2025-10-09,77e23ebd-6e10-4113-938c-bb55550710f5,Spice <> Capriotti's - Sep / Oct,promotion,2025-09-18,None,N/A,,43340528-e1b7-4f95-ab40-8dc92bf9c274,"Spend $35, Save $6 | High Price Sensitivity",day,all,Order Discount,$ Off,6.00,35.00,USD,College Station,23349412,1,40.24,6.00,0.00,0.00,0.99,-0.00,-0.00,40.24,6.99,5.76,1,0,0,1,1,0,0,1
2025-10-09,70d4cf5a-37fe-47ad-bac7-d5196b53b89c,Spend $30 get 20% off 09/03/2025,promotion,2025-09-03,None,N/A,,,,,,,$ Off,0.00,0.00,USD,Happy Valley,23584856,3,156.30,28.22,0.00,0.00,2.97,-0.00,-0.00,52.10,10.40,5.01,1,2,0,3,1,2,0,3
2025-10-09,02d2c45e-5b6f-4058-b05d-1fbcb475312e,"First order, 20% off 04/09/2025",promotion,2025-04-09,None,N/A,,,,,,,$ Off,0.00,0.00,USD,Newark,390890,0,0.00,0.00,0.00,0.00,0.00,-0.00,-0.00,0.00,0.00,0.00,0,0,0,0,0,0,0,0
2025-10-09,77e23ebd-6e10-4113-938c-bb55550710f5,Spice <> Capriotti's - Sep / Oct,promotion,2025-09-18,None,N/A,,91f90d8c-8a7d-41cf-9b6a-888400112024,10% Happy Hour Discount - Min  $25 | High Price Sensitivity,day,all,Order Discount,% Off,10.0%,25.00,USD,Shepherd - Fresno,24559604,4,175.66,16.94,0.00,0.00,3.96,-0.00,-0.00,43.92,5.23,8.40,0,4,0,4,0,4,0,4
2025-10-09,77e23ebd-6e10-4113-938c-bb55550710f5,Spice <> Capriotti's - Sep / Oct,promotion,2025-09-18,None,N/A,,,,day,,,$ Off,0.00,0.00,USD,St Rose Pkwy,1335286,0,0.00,0.00,0.00,0.00,0.00,-0.00,-0.00,0.00,0.00,0.00,0,0,0,0,0,0,0,0
2025-10-09,77e23ebd-6e10-4113-938c-bb55550710f5,Spice <> Capriotti's - Sep / Oct,promotion,2025-09-18,None,N/A,,d1d0b263-4918-4c81-8c97-630471e7185b,10% Happy Hour Discount - Medium Price Sensitivity,day,all,Order Discount,% Off,10.0%,25.00,USD,S Fort Apache,75730,1,76.86,5.00,0.00,0.00,0.99,-0.00,-0.00,76.86,5.99,12.83,1,0,0,1,1,0,0,1
2025-10-09,77e23ebd-6e10-4113-938c-bb55550710f5,Spice <> Capriotti's - Sep / Oct,promotion,2025-09-18,None,N/A,,,,day,,,$ Off,0.00,0.00,USD,Blackstone-Fresno,24415716,0,0.00,0.00,0.00,0.00,0.00,-0.00,-0.00,0.00,0.00,0.00,0,0,0,0,0,0,0,0
2025-10-09,77e23ebd-6e10-4113-938c-bb55550710f5,Spice <> Capriotti's - Sep / Oct,promotion,2025-09-18,None,N/A,,f06f33c5-bff5-4bb3-8dda-6cedeb2e6fc1,10% Happy hour Discount - Min $30 | Low Price Sensitivity,day,all,Order Discount,% Off,7.0%,30.00,USD,Downingtown,33699763,0,0.00,0.00,0.00,0.00,0.00,-0.00,-0.00,0.00,0.00,0.00,0,0,0,0,0,0,0,0
2025-10-09,77e23ebd-6e10-4113-938c-bb55550710f5,Spice <> Capriotti's - Sep / Oct,promotion,2025-09-18,None,N/A,,d1d0b263-4918-4c81-8c97-630471e7185b,10% Happy Hour Discount - Medium Price Sensitivity,day,all,Order Discount,% Off,10.0%,25.00,USD,Main Street - Anoka,34494893,1,52.24,5.00,0.00,0.00,0.99,-0.00,-0.00,52.24,5.99,8.72,0,1,0,1,0,1,0,1
2025-10-09,77e23ebd-6e10-4113-938c-bb55550710f5,Spice <> Capriotti's - Sep / Oct,promotion,2025-09-18,None,N/A,,d1d0b263-4918-4c81-8c97-630471e7185b,10% Happy Hour Discount - Medium Price Sensitivity,day,all,Order Discount,% Off,10.0%,25.00,USD,Park Road Center,27677423,0,0.00,0.00,0.00,0.00,0.00,-0.00,-0.00,0.00,0.00,0.00,0,0,0,0,0,0,0,0
2025-10-09,425a2568-d931-4baa-8593-d268f8a0c259,Happy Hour discount is 30% OFF,promotion,2025-01-24,None,Daily,28.57,,,,,,$ Off,0.00,0.00,USD,N 87th Street,27965,0,0.00,0.00,0.00,0.00,0.00,-0.00,-0.00,0.00,0.00,0.00,0,0,0,0,0,0,0,0
2025-10-09,77e23ebd-6e10-4113-938c-bb55550710f5,Spice <> Capriotti's - Sep / Oct,promotion,2025-09-18,None,N/A,,d1d0b263-4918-4c81-8c97-630471e7185b,10% Happy Hour Discount - Medium Price Sensitivity,day,all,Order Discount,% Off,10.0%,25.00,USD,Red Cliff Dr,578425,0,0.00,0.00,0.00,0.00,0.00,-0.00,-0.00,0.00,0.00,0.00,0,0,0,0,0,0,0,0
2025-10-09,77e23ebd-6e10-4113-938c-bb55550710f5,Spice <> Capriotti's - Sep / Oct,promotion,2025-09-18,None,N/A,,ba37e4d8-36c4-4cbe-8c7d-f4d1379109bd,"Spend $15, Save $3 | Low price Sensitivity",day,all,Order Discount,$ Off,3.00,15.00,USD,University Dr,29894178,1,46.37,3.00,0.00,0.00,0.99,-0.00,-0.00,46.37,3.99,11.62,0,1,0,1,0,0,0,0
2025-10-09,77e23ebd-6e10-4113-938c-bb55550710f5,Spice <> Capriotti's - Sep / Oct,promotion,2025-09-18,None,N/A,,d1d0b263-4918-4c81-8c97-630471e7185b,10% Happy Hour Discount - Medium Price Sensitivity,day,all,Order Discount,% Off,10.0%,25.00,USD,Cheyenne Rd,2375637,1,25.76,2.58,0.00,0.00,0.99,-0.00,-0.00,25.76,3.57,7.22,0,1,0,1,0,1,0,1
2025-10-09,02d2c45e-5b6f-4058-b05d-1fbcb475312e,"First order, 20% off 04/09/2025",promotion,2025-04-09,None,N/A,,,,,,,$ Off,0.00,0.00,USD,Marlboro - Easton,674514,3,77.30,13.01,0.00,0.00,2.97,-0.00,-0.00,25.77,5.33,4.84,3,0,0,3,2,0,0,2
2025-10-09,77e23ebd-6e10-4113-938c-bb55550710f5,Spice <> Capriotti's - Sep / Oct,promotion,2025-09-18,None,N/A,,91f90d8c-8a7d-41cf-9b6a-888400112024,10% Happy Hour Discount - Min  $25 | High Price Sensitivity,day,all,Order Discount,% Off,10.0%,25.00,USD,Broadway - Tucson,27829895,1,26.76,2.68,0.00,0.00,0.99,-0.00,-0.00,26.76,3.67,7.29,0,1,0,1,0,1,0,1
2025-10-09,ef08edf0-aabc-406a-bdf8-30534f44839a,Lunch specials item discount 09/25/2025,promotion,2025-09-25,2025-10-26,N/A,,,,,,,$ Off,0.00,0.00,USD,Niles Cortland Rd SE,34043935,2,37.56,7.50,0.00,0.00,0.00,-0.00,-0.00,18.78,3.75,5.01,0,2,0,2,0,1,0,1
2025-10-09,77e23ebd-6e10-4113-938c-bb55550710f5,Spice <> Capriotti's - Sep / Oct,promotion,2025-09-18,None,N/A,,ba37e4d8-36c4-4cbe-8c7d-f4d1379109bd,"Spend $15, Save $3 | Low price Sensitivity",day,all,Order Discount,$ Off,3.00,15.00,USD,The Old Road,24898774,0,0.00,0.00,0.00,0.00,0.00,-0.00,-0.00,0.00,0.00,0.00,0,0,0,0,0,0,0,0
2025-10-09,77e23ebd-6e10-4113-938c-bb55550710f5,Spice <> Capriotti's - Sep / Oct,promotion,2025-09-18,None,N/A,,,,day,,,$ Off,0.00,0.00,USD,Concord Pike,23151390,0,0.00,0.00,0.00,0.00,0.00,-0.00,-0.00,0.00,0.00,0.00,0,0,0,0,0,0,0,0
2025-10-09,77e23ebd-6e10-4113-938c-bb55550710f5,Spice <> Capriotti's - Sep / Oct,promotion,2025-09-18,None,N/A,,,,day,,,$ Off,0.00,0.00,USD,Forest Drive,674540,0,0.00,0.00,0.00,0.00,0.00,-0.00,-0.00,0.00,0.00,0.00,0,0,0,0,0,0,0,0
2025-10-09,77e23ebd-6e10-4113-938c-bb55550710f5,Spice <> Capriotti's - Sep / Oct,promotion,2025-09-18,None,N/A,,f06f33c5-bff5-4bb3-8dda-6cedeb2e6fc1,10% Happy hour Discount - Min $30 | Low Price Sensitivity,day,all,Order Discount,% Off,7.0%,30.00,USD,Bidwell - Folsom,26234909,0,0.00,0.00,0.00,0.00,0.00,-0.00,-0.00,0.00,0.00,0.00,0,0,0,0,0,0,0,0
2025-10-09,77e23ebd-6e10-4113-938c-bb55550710f5,Spice <> Capriotti's - Sep / Oct,promotion,2025-09-18,None,N/A,,f06f33c5-bff5-4bb3-8dda-6cedeb2e6fc1,10% Happy hour Discount - Min $30 | Low Price Sensitivity,day,all,Order Discount,% Off,7.0%,30.00,USD,Raccoon Rd,26015022,2,91.18,6.38,0.00,0.00,1.98,-0.00,-0.00,45.59,4.18,10.91,1,1,0,2,1,0,0,1
2025-10-09,77e23ebd-6e10-4113-938c-bb55550710f5,Spice <> Capriotti's - Sep / Oct,promotion,2025-09-18,None,N/A,,f06f33c5-bff5-4bb3-8dda-6cedeb2e6fc1,10% Happy hour Discount - Min $30 | Low Price Sensitivity,day,all,Order Discount,% Off,7.0%,30.00,USD,East Market Street,23256727,1,37.46,2.62,0.00,0.00,0.99,-0.00,-0.00,37.46,3.61,10.38,0,1,0,1,0,1,0,1
2025-10-09,77e23ebd-6e10-4113-938c-bb55550710f5,Spice <> Capriotti's - Sep / Oct,promotion,2025-09-18,None,N/A,,ba37e4d8-36c4-4cbe-8c7d-f4d1379109bd,"Spend $15, Save $3 | Low price Sensitivity",day,all,Order Discount,$ Off,3.00,15.00,USD,Murrieta Hot Springs Rd,29652192,4,112.42,12.00,0.00,0.00,3.96,-0.00,-0.00,28.11,3.99,7.04,0,4,0,4,0,4,0,4
2025-10-09,77e23ebd-6e10-4113-938c-bb55550710f5,Spice <> Capriotti's - Sep / Oct,promotion,2025-09-18,None,N/A,,d1d0b263-4918-4c81-8c97-630471e7185b,10% Happy Hour Discount - Medium Price Sensitivity,day,all,Order Discount,% Off,10.0%,25.00,USD,East Ridge Pike,1640642,0,0.00,0.00,0.00,0.00,0.00,-0.00,-0.00,0.00,0.00,0.00,0,0,0,0,0,0,0,0
2025-10-09,02d2c45e-5b6f-4058-b05d-1fbcb475312e,"First order, 20% off 04/09/2025",promotion,2025-04-09,None,N/A,,,,,,,$ Off,0.00,0.00,USD,Collier Pkwy-Lutz,23057623,0,0.00,0.00,0.00,0.00,0.00,-0.00,-0.00,0.00,0.00,0.00,0,0,0,0,0,0,0,0
2025-10-09,02d2c45e-5b6f-4058-b05d-1fbcb475312e,"First order, 20% off 04/09/2025",promotion,2025-04-09,None,N/A,,,,,,,$ Off,0.00,0.00,USD,Blue Diamond Road,333447,0,0.00,0.00,0.00,0.00,0.00,-0.00,-0.00,0.00,0.00,0.00,0,0,0,0,0,0,0,0
2025-10-09,a82d49b2-a34a-4ce3-aa26-2a1d94c385eb,"All customers, $0 delivery fees 04/07/2025",promotion,2025-04-07,None,N/A,,,,,,,$ Off,0.00,0.00,USD,East Market Street,23256727,2,47.36,4.48,0.00,0.00,5.50,-0.00,-0.00,23.68,4.99,4.75,0,2,0,2,0,0,0,0
2025-10-09,77e23ebd-6e10-4113-938c-bb55550710f5,Spice <> Capriotti's - Sep / Oct,promotion,2025-09-18,None,N/A,,ba37e4d8-36c4-4cbe-8c7d-f4d1379109bd,"Spend $15, Save $3 | Low price Sensitivity",day,all,Order Discount,$ Off,3.00,15.00,USD,Byers Dr,23186665,1,22.37,3.00,0.00,0.00,0.99,-0.00,-0.00,22.37,3.99,5.61,0,1,0,1,0,0,0,0
2025-10-09,02d2c45e-5b6f-4058-b05d-1fbcb475312e,"First order, 20% off 04/09/2025",promotion,2025-04-09,None,N/A,,,,,,,$ Off,0.00,0.00,USD,Sunset and Sandhill,32849799,1,22.78,4.56,0.00,0.00,0.99,-0.00,-0.00,22.78,5.55,4.10,1,0,0,1,0,0,0,0
2025-10-09,77e23ebd-6e10-4113-938c-bb55550710f5,Spice <> Capriotti's - Sep / Oct,promotion,2025-09-18,None,N/A,,d1d0b263-4918-4c81-8c97-630471e7185b,10% Happy Hour Discount - Medium Price Sensitivity,day,all,Order Discount,% Off,10.0%,25.00,USD,Barnes Road,24892677,0,0.00,0.00,0.00,0.00,0.00,-0.00,-0.00,0.00,0.00,0.00,0,0,0,0,0,0,0,0
2025-10-09,ed10ed86-5221-41d8-9af0-0ac62871adbb,"First Order, 20% Off",promotion,2022-05-17,None,N/A,,,,,,,$ Off,0.00,0.00,USD,Pioneer Pkwy,874359,2,52.67,8.64,0.00,0.00,1.98,-0.00,-0.00,26.34,5.31,4.96,2,0,0,2,1,0,0,1
2025-10-09,02d2c45e-5b6f-4058-b05d-1fbcb475312e,"First order, 20% off 04/09/2025",promotion,2025-04-09,None,N/A,,,,,,,$ Off,0.00,0.00,USD,Plumb Lane,439577,3,64.45,12.61,0.00,0.00,2.97,-0.00,-0.00,21.48,5.19,4.14,3,0,0,3,1,0,0,1
2025-10-09,02d2c45e-5b6f-4058-b05d-1fbcb475312e,"First order, 20% off 04/09/2025",promotion,2025-04-09,None,N/A,,,,,,,$ Off,0.00,0.00,USD,Sierra St - Reno,719271,4,111.18,16.65,0.00,0.00,3.96,-0.00,-0.00,27.80,5.15,5.39,4,0,0,4,3,0,0,3
2025-10-09,58fe435a-cdf8-4a86-abc7-b68d7b574ba5,Spend $25 Get 20% Off,promotion,2022-12-01,None,N/A,,,,,,,$ Off,0.00,0.00,USD,Coeur d'Alene,23085790,6,219.04,40.04,0.00,0.00,5.94,-0.00,-0.00,36.51,7.66,4.76,1,5,0,6,1,3,0,4
2025-10-09,70d4cf5a-37fe-47ad-bac7-d5196b53b89c,Spend $30 get 20% off 09/03/2025,promotion,2025-09-03,None,N/A,,,,,,,$ Off,0.00,0.00,USD,Grand Ave-Portland,1370229,14,775.03,116.94,0.00,0.00,13.86,-0.00,-0.00,55.36,9.34,5.93,2,7,5,14,1,6,5,12
2025-10-09,77e23ebd-6e10-4113-938c-bb55550710f5,Spice <> Capriotti's - Sep / Oct,promotion,2025-09-18,None,N/A,,,,day,,,$ Off,0.00,0.00,USD,Roby Dr - Hammond,24891803,0,0.00,0.00,0.00,0.00,0.00,-0.00,-0.00,0.00,0.00,0.00,0,0,0,0,0,0,0,0
2025-10-09,02d2c45e-5b6f-4058-b05d-1fbcb475312e,"First order, 20% off 04/09/2025",promotion,2025-04-09,None,N/A,,,,,,,$ Off,0.00,0.00,USD,"Capriotti's of Milford, LLC",1636430,1,31.18,5.00,0.00,0.00,0.99,-0.00,-0.00,31.18,5.99,5.21,1,0,0,1,1,0,0,1
2025-10-09,77e23ebd-6e10-4113-938c-bb55550710f5,Spice <> Capriotti's - Sep / Oct,promotion,2025-09-18,None,N/A,,,,day,,,$ Off,0.00,0.00,USD,International Pkwy,24671402,0,0.00,0.00,0.00,0.00,0.00,-0.00,-0.00,0.00,0.00,0.00,0,0,0,0,0,0,0,0
2025-10-09,02d2c45e-5b6f-4058-b05d-1fbcb475312e,"First order, 20% off 04/09/2025",promotion,2025-04-09,None,N/A,,,,,,,$ Off,0.00,0.00,USD,N 87th Street,27965,1,47.26,5.00,0.00,0.00,0.99,-0.00,-0.00,47.26,5.99,7.89,1,0,0,1,0,0,0,0
2025-10-09,02d2c45e-5b6f-4058-b05d-1fbcb475312e,"First order, 20% off 04/09/2025",promotion,2025-04-09,None,N/A,,,,,,,$ Off,0.00,0.00,USD,East Ridge Pike,1640642,3,84.22,13.33,0.00,0.00,2.97,-0.00,-0.00,28.07,5.43,5.17,3,0,0,3,3,0,0,3
2025-10-09,77e23ebd-6e10-4113-938c-bb55550710f5,Spice <> Capriotti's - Sep / Oct,promotion,2025-09-18,None,N/A,,f06f33c5-bff5-4bb3-8dda-6cedeb2e6fc1,10% Happy hour Discount - Min $30 | Low Price Sensitivity,day,all,Order Discount,% Off,7.0%,30.00,USD,Bel Air,23733193,1,30.67,2.15,0.00,0.00,0.99,-0.00,-0.00,30.67,3.14,9.77,0,1,0,1,0,1,0,1
2025-10-09,02d2c45e-5b6f-4058-b05d-1fbcb475312e,"First order, 20% off 04/09/2025",promotion,2025-04-09,None,N/A,,,,,,,$ Off,0.00,0.00,USD,Freeman Park,24404087,2,66.34,8.02,0.00,0.00,1.98,-0.00,-0.00,33.17,5.00,6.63,2,0,0,2,0,0,0,0
2025-10-09,6e2eeb77-e45d-427b-974e-9e6d639dce9e,"Buy 1, get 1 free promotion 10/02/2025",promotion,2025-10-02,2025-11-02,N/A,,,,,,,$ Off,0.00,0.00,USD,Manchester Rd,27715447,2,71.91,12.58,0.00,0.00,1.98,-0.00,-0.00,35.96,7.28,4.94,0,2,0,2,0,1,0,1
2025-10-09,02d2c45e-5b6f-4058-b05d-1fbcb475312e,"First order, 20% off 04/09/2025",promotion,2025-04-09,None,N/A,,,,,,,$ Off,0.00,0.00,USD,Aliante Casino,75725,1,31.98,5.00,0.00,0.00,0.99,-0.00,-0.00,31.98,5.99,5.34,1,0,0,1,1,0,0,1
2025-10-09,5164f786-a14b-4b5d-970f-ced7eba0593a,Spend $35 get 20% off 06/03/2025,promotion,2025-06-03,None,N/A,,,,,,,$ Off,0.00,0.00,USD,Hamilton Blvd,23066760,11,947.20,107.37,0.00,0.00,10.89,-0.00,-0.00,86.11,10.75,8.01,5,6,0,11,2,4,0,6
2025-10-09,77e23ebd-6e10-4113-938c-bb55550710f5,Spice <> Capriotti's - Sep / Oct,promotion,2025-09-18,None,N/A,,ba37e4d8-36c4-4cbe-8c7d-f4d1379109bd,"Spend $15, Save $3 | Low price Sensitivity",day,all,Order Discount,$ Off,3.00,15.00,USD,International Pkwy,24671402,3,54.26,9.00,0.00,0.00,2.97,-0.00,-0.00,18.09,3.99,4.53,0,3,0,3,0,1,0,1
2025-10-09,02d2c45e-5b6f-4058-b05d-1fbcb475312e,"First order, 20% off 04/09/2025",promotion,2025-04-09,None,N/A,,,,,,,$ Off,0.00,0.00,USD,East 82nd St,184537,4,94.19,17.30,0.00,0.00,3.96,-0.00,-0.00,23.55,5.32,4.43,4,0,0,4,0,0,0,0
2025-10-09,77e23ebd-6e10-4113-938c-bb55550710f5,Spice <> Capriotti's - Sep / Oct,promotion,2025-09-18,None,N/A,,d1d0b263-4918-4c81-8c97-630471e7185b,10% Happy Hour Discount - Medium Price Sensitivity,day,all,Order Discount,% Off,10.0%,25.00,USD,North Haven Ave,28834163,2,61.94,6.20,0.00,0.00,1.98,-0.00,-0.00,30.97,4.09,7.57,1,1,0,2,1,0,0,1
2025-10-09,77e23ebd-6e10-4113-938c-bb55550710f5,Spice <> Capriotti's - Sep / Oct,promotion,2025-09-18,None,N/A,,ba37e4d8-36c4-4cbe-8c7d-f4d1379109bd,"Spend $15, Save $3 | Low price Sensitivity",day,all,Order Discount,$ Off,3.00,15.00,USD,Happy Valley,23584856,2,36.87,6.00,0.00,0.00,1.98,-0.00,-0.00,18.44,3.99,4.62,0,1,1,2,0,0,1,1
2025-10-09,02d2c45e-5b6f-4058-b05d-1fbcb475312e,"First order, 20% off 04/09/2025",promotion,2025-04-09,None,N/A,,,,,,,$ Off,0.00,0.00,USD,Highlands Ranch,1791292,3,70.81,12.15,0.00,0.00,2.97,-0.00,-0.00,23.60,5.04,4.68,3,0,0,3,2,0,0,2
2025-10-09,77e23ebd-6e10-4113-938c-bb55550710f5,Spice <> Capriotti's - Sep / Oct,promotion,2025-09-18,None,N/A,,ba37e4d8-36c4-4cbe-8c7d-f4d1379109bd,"Spend $15, Save $3 | Low price Sensitivity",day,all,Order Discount,$ Off,3.00,15.00,USD,Governor Ritchie,24121153,1,21.86,3.00,0.00,0.00,0.99,-0.00,-0.00,21.86,3.99,5.48,0,1,0,1,0,1,0,1
2025-10-09,6f71233a-4f7b-43f5-b70b-89dc41af1fd0,Late night 5 off 25,promotion,2025-01-17,None,N/A,,,,,,,$ Off,0.00,0.00,USD,West Cheyenne Ave,75722,1,25.78,5.00,0.00,0.00,0.99,-0.00,-0.00,25.78,5.99,4.30,1,0,0,1,0,0,0,0
2025-10-09,f12a26e0-24e1-4d8e-ac05-d7e43f06d2bf,Happy Hour discount 11/12/2024,promotion,2024-11-12,None,N/A,,,,,,,$ Off,0.00,0.00,USD,Collier Pkwy-Lutz,23057623,1,29.68,7.00,0.00,0.00,0.99,-0.00,-0.00,29.68,7.99,3.71,0,1,0,1,0,0,0,0
2025-10-09,77e23ebd-6e10-4113-938c-bb55550710f5,Spice <> Capriotti's - Sep / Oct,promotion,2025-09-18,None,N/A,,ba37e4d8-36c4-4cbe-8c7d-f4d1379109bd,"Spend $15, Save $3 | Low price Sensitivity",day,all,Order Discount,$ Off,3.00,15.00,USD,Highlands Ranch,1791292,2,61.04,6.00,0.00,0.00,1.98,-0.00,-0.00,30.52,3.99,7.65,0,1,1,2,0,1,1,2
2025-10-09,02d2c45e-5b6f-4058-b05d-1fbcb475312e,"First order, 20% off 04/09/2025",promotion,2025-04-09,None,N/A,,,,,,,$ Off,0.00,0.00,USD,Smithtown Bypass,23349427,0,0.00,0.00,0.00,0.00,0.00,-0.00,-0.00,0.00,0.00,0.00,0,0,0,0,0,0,0,0
2025-10-09,25abde4d-2867-459b-9b99-b628e195401e,"Dormant customers, 20% off 07/24/2025",promotion,2025-07-24,None,N/A,,,,,,,$ Off,0.00,0.00,USD,West Fullerton Ave,23349403,3,94.72,18.94,0.00,0.00,2.97,-0.00,-0.00,31.57,7.30,4.32,0,0,3,3,0,0,2,2
2025-10-09,77e23ebd-6e10-4113-938c-bb55550710f5,Spice <> Capriotti's - Sep / Oct,promotion,2025-09-18,None,N/A,,ba37e4d8-36c4-4cbe-8c7d-f4d1379109bd,"Spend $15, Save $3 | Low price Sensitivity",day,all,Order Discount,$ Off,3.00,15.00,USD,GVR Casino,75749,1,31.26,3.00,0.00,0.00,0.99,-0.00,-0.00,31.26,3.99,7.83,0,1,0,1,0,0,0,0
2025-10-09,77e23ebd-6e10-4113-938c-bb55550710f5,Spice <> Capriotti's - Sep / Oct,promotion,2025-09-18,None,N/A,,ba37e4d8-36c4-4cbe-8c7d-f4d1379109bd,"Spend $15, Save $3 | Low price Sensitivity",day,all,Order Discount,$ Off,3.00,15.00,USD,Kent Island,691089,2,51.10,6.00,0.00,0.00,1.98,-0.00,-0.00,25.55,3.99,6.40,0,2,0,2,0,1,0,1
2025-10-09,77e23ebd-6e10-4113-938c-bb55550710f5,Spice <> Capriotti's - Sep / Oct,promotion,2025-09-18,None,N/A,,d1d0b263-4918-4c81-8c97-630471e7185b,10% Happy Hour Discount - Medium Price Sensitivity,day,all,Order Discount,% Off,10.0%,25.00,USD,Eden Square Ctr,420646,3,139.45,11.58,0.00,0.00,2.97,-0.00,-0.00,46.48,4.85,9.58,0,3,0,3,0,2,0,2
2025-10-09,02d2c45e-5b6f-4058-b05d-1fbcb475312e,"First order, 20% off 04/09/2025",promotion,2025-04-09,None,N/A,,,,,,,$ Off,0.00,0.00,USD,Gambrills,24415514,0,0.00,0.00,0.00,0.00,0.00,-0.00,-0.00,0.00,0.00,0.00,0,0,0,0,0,0,0,0
2025-10-09,f12a26e0-24e1-4d8e-ac05-d7e43f06d2bf,Happy Hour discount 11/12/2024,promotion,2024-11-12,None,N/A,,,,,,,$ Off,0.00,0.00,USD,Northdale Blvd,24976449,2,63.74,12.27,0.00,0.00,1.98,-0.00,-0.00,31.87,7.13,4.47,1,1,0,2,1,1,0,2
2025-10-09,02d2c45e-5b6f-4058-b05d-1fbcb475312e,"First order, 20% off 04/09/2025",promotion,2025-04-09,None,N/A,,,,,,,$ Off,0.00,0.00,USD,Concord Pike,23151390,0,0.00,0.00,0.00,0.00,0.00,-0.00,-0.00,0.00,0.00,0.00,0,0,0,0,0,0,0,0
2025-10-09,02d2c45e-5b6f-4058-b05d-1fbcb475312e,"First order, 20% off 04/09/2025",promotion,2025-04-09,None,N/A,,,,,,,$ Off,0.00,0.00,USD,College Station,23349412,0,0.00,0.00,0.00,0.00,0.00,-0.00,-0.00,0.00,0.00,0.00,0,0,0,0,0,0,0,0
2025-10-09,178f54dc-804b-413e-b1bd-ffbdde7f61a1,"Dormant customers, 20% off 02/01/2025",promotion,2025-02-01,None,N/A,,,,,,,$ Off,0.00,0.00,USD,East Sepulveda,1743753,0,0.00,0.00,0.00,0.00,0.00,-0.00,-0.00,0.00,0.00,0.00,0,0,0,0,0,0,0,0
2025-10-09,02d2c45e-5b6f-4058-b05d-1fbcb475312e,"First order, 20% off 04/09/2025",promotion,2025-04-09,None,N/A,,,,,,,$ Off,0.00,0.00,USD,Old Town,27964,5,185.30,22.47,0.00,0.00,4.95,-0.00,-0.00,37.06,5.48,6.76,5,0,0,5,3,0,0,3
2025-10-09,a895bc94-3910-43c9-b1b9-bc7f513286d7,Spend $25 get $5 off 07/31/2024,promotion,2024-07-31,None,N/A,,,,,,,$ Off,0.00,0.00,USD,The Old Road,24898774,1,54.37,5.00,0.00,0.00,0.99,-0.00,-0.00,54.37,5.99,9.08,1,0,0,1,1,0,0,1
2025-10-09,77e23ebd-6e10-4113-938c-bb55550710f5,Spice <> Capriotti's - Sep / Oct,promotion,2025-09-18,None,N/A,,91f90d8c-8a7d-41cf-9b6a-888400112024,10% Happy Hour Discount - Min  $25 | High Price Sensitivity,day,all,Order Discount,% Off,10.0%,25.00,USD,North Union St,575293,3,152.50,13.75,0.00,0.00,2.97,-0.00,-0.00,50.83,5.57,9.12,0,1,2,3,0,1,2,3
2025-10-09,9708621d-8c94-41e7-8a63-2da71ea0199e,"Dormant customers, 20% off 07/02/2025",promotion,2025-07-02,None,N/A,,,,,,,$ Off,0.00,0.00,USD,Southern Highlands,1750142,1,60.45,5.00,0.00,0.00,0.99,-0.00,-0.00,60.45,5.99,10.09,0,0,1,1,0,0,1,1
2025-10-09,02d2c45e-5b6f-4058-b05d-1fbcb475312e,"First order, 20% off 04/09/2025",promotion,2025-04-09,None,N/A,,,,,,,$ Off,0.00,0.00,USD,University Dr,29894178,0,0.00,0.00,0.00,0.00,0.00,-0.00,-0.00,0.00,0.00,0.00,0,0,0,0,0,0,0,0
2025-10-09,02d2c45e-5b6f-4058-b05d-1fbcb475312e,"First order, 20% off 04/09/2025",promotion,2025-04-09,None,N/A,,,,,,,$ Off,0.00,0.00,USD,North Town Center,75721,0,0.00,0.00,0.00,0.00,0.00,-0.00,-0.00,0.00,0.00,0.00,0,0,0,0,0,0,0,0
2025-10-09,02d2c45e-5b6f-4058-b05d-1fbcb475312e,"First order, 20% off 04/09/2025",promotion,2025-04-09,None,N/A,,,,,,,$ Off,0.00,0.00,USD,Jennersville Rd,433075,1,56.37,5.00,0.00,0.00,0.99,-0.00,-0.00,56.37,5.99,9.41,1,0,0,1,1,0,0,1
2025-10-09,ff18ac99-74db-48ce-9c94-2959c91b6665,Capriotti's Sandwich Shop's Promo Campaign,promotion,2025-10-02,None,N/A,,348d5036-ec24-4cbc-aaf8-9cd8d2a19433,Spend $15 - Save $3,day,all,Order Discount,$ Off,3.00,15.00,USD,Waialae Ave,25380836,4,153.37,12.00,0.00,0.00,3.96,-0.00,-0.00,38.34,3.99,9.61,2,1,1,4,1,1,1,3
2025-10-09,77e23ebd-6e10-4113-938c-bb55550710f5,Spice <> Capriotti's - Sep / Oct,promotion,2025-09-18,None,N/A,,ba37e4d8-36c4-4cbe-8c7d-f4d1379109bd,"Spend $15, Save $3 | Low price Sensitivity",day,all,Order Discount,$ Off,3.00,15.00,USD,Bidwell - Folsom,26234909,2,42.45,6.00,0.00,0.00,1.98,-0.00,-0.00,21.23,3.99,5.32,0,2,0,2,0,1,0,1
2025-10-09,02d2c45e-5b6f-4058-b05d-1fbcb475312e,"First order, 20% off 04/09/2025",promotion,2025-04-09,None,N/A,,,,,,,$ Off,0.00,0.00,USD,Parker,24021312,1,32.58,5.00,0.00,0.00,0.99,-0.00,-0.00,32.58,5.99,5.44,1,0,0,1,1,0,0,1
2025-10-09,77e23ebd-6e10-4113-938c-bb55550710f5,Spice <> Capriotti's - Sep / Oct,promotion,2025-09-18,None,N/A,,91f90d8c-8a7d-41cf-9b6a-888400112024,10% Happy Hour Discount - Min  $25 | High Price Sensitivity,day,all,Order Discount,% Off,10.0%,25.00,USD,West Fullerton Ave,23349403,0,0.00,0.00,0.00,0.00,0.00,-0.00,-0.00,0.00,0.00,0.00,0,0,0,0,0,0,0,0
2025-10-09,77e23ebd-6e10-4113-938c-bb55550710f5,Spice <> Capriotti's - Sep / Oct,promotion,2025-09-18,None,N/A,,91f90d8c-8a7d-41cf-9b6a-888400112024,10% Happy Hour Discount - Min  $25 | High Price Sensitivity,day,all,Order Discount,% Off,10.0%,25.00,USD,Riverwind Dr,34516256,0,0.00,0.00,0.00,0.00,0.00,-0.00,-0.00,0.00,0.00,0.00,0,0,0,0,0,0,0,0
2025-10-09,2c07ba1b-ffe7-48b6-b99f-17555cbc8290,Lunch specials item discount 07/25/2025,promotion,2025-07-25,None,N/A,,,,,,,$ Off,0.00,0.00,USD,Southern Highlands,1750142,0,0.00,0.00,0.00,0.00,0.00,-0.00,-0.00,0.00,0.00,0.00,0,0,0,0,0,0,0,0
2025-10-09,02d2c45e-5b6f-4058-b05d-1fbcb475312e,"First order, 20% off 04/09/2025",promotion,2025-04-09,None,N/A,,,,,,,$ Off,0.00,0.00,USD,North Union St,575293,1,31.67,5.00,0.00,0.00,0.99,-0.00,-0.00,31.67,5.99,5.29,1,0,0,1,1,0,0,1
2025-10-09,77e23ebd-6e10-4113-938c-bb55550710f5,Spice <> Capriotti's - Sep / Oct,promotion,2025-09-18,None,N/A,,91f90d8c-8a7d-41cf-9b6a-888400112024,10% Happy Hour Discount - Min  $25 | High Price Sensitivity,day,all,Order Discount,% Off,10.0%,25.00,USD,Kirkwood Hwy,390889,1,29.18,2.92,0.00,0.00,0.99,-0.00,-0.00,29.18,3.91,7.46,0,1,0,1,0,1,0,1
2025-10-09,77e23ebd-6e10-4113-938c-bb55550710f5,Spice <> Capriotti's - Sep / Oct,promotion,2025-09-18,None,N/A,,,,day,,,$ Off,0.00,0.00,USD,E 53rd - Davenport,582282,0,0.00,0.00,0.00,0.00,0.00,-0.00,-0.00,0.00,0.00,0.00,0,0,0,0,0,0,0,0
2025-10-09,6f71233a-4f7b-43f5-b70b-89dc41af1fd0,Late night 5 off 25,promotion,2025-01-17,None,N/A,,,,,,,$ Off,0.00,0.00,USD,West Craig Road,75727,0,0.00,0.00,0.00,0.00,0.00,-0.00,-0.00,0.00,0.00,0.00,0,0,0,0,0,0,0,0
2025-10-09,02d2c45e-5b6f-4058-b05d-1fbcb475312e,"First order, 20% off 04/09/2025",promotion,2025-04-09,None,N/A,,,,,,,$ Off,0.00,0.00,USD,Eden Square Ctr,420646,7,233.22,32.63,0.00,0.00,6.93,-0.00,-0.00,33.32,5.65,5.90,7,0,0,7,4,0,0,4
2025-10-09,77e23ebd-6e10-4113-938c-bb55550710f5,Spice <> Capriotti's - Sep / Oct,promotion,2025-09-18,None,N/A,,f06f33c5-bff5-4bb3-8dda-6cedeb2e6fc1,10% Happy hour Discount - Min $30 | Low Price Sensitivity,day,all,Order Discount,% Off,7.0%,30.00,USD,East Sepulveda,1743753,0,0.00,0.00,0.00,0.00,0.00,-0.00,-0.00,0.00,0.00,0.00,0,0,0,0,0,0,0,0
2025-10-09,77e23ebd-6e10-4113-938c-bb55550710f5,Spice <> Capriotti's - Sep / Oct,promotion,2025-09-18,None,N/A,,ba37e4d8-36c4-4cbe-8c7d-f4d1379109bd,"Spend $15, Save $3 | Low price Sensitivity",day,all,Order Discount,$ Off,3.00,15.00,USD,Horizon Ridge,75753,2,66.84,6.00,0.00,0.00,1.98,-0.00,-0.00,33.42,3.99,8.38,0,2,0,2,0,2,0,2
2025-10-09,02d2c45e-5b6f-4058-b05d-1fbcb475312e,"First order, 20% off 04/09/2025",promotion,2025-04-09,None,N/A,,,,,,,$ Off,0.00,0.00,USD,West Flamingo Road,75731,3,92.49,13.44,0.00,0.00,2.97,-0.00,-0.00,30.83,5.47,5.64,3,0,0,3,3,0,0,3
2025-10-09,77e23ebd-6e10-4113-938c-bb55550710f5,Spice <> Capriotti's - Sep / Oct,promotion,2025-09-18,None,N/A,,,,day,,,$ Off,0.00,0.00,USD,Collier Pkwy-Lutz,23057623,0,0.00,0.00,0.00,0.00,0.00,-0.00,-0.00,0.00,0.00,0.00,0,0,0,0,0,0,0,0
2025-10-09,58fe435a-cdf8-4a86-abc7-b68d7b574ba5,Spend $25 Get 20% Off,promotion,2022-12-01,None,N/A,,,,,,,$ Off,0.00,0.00,USD,Zionsville,24415273,6,192.82,38.56,0.00,0.00,5.94,-0.00,-0.00,32.14,7.42,4.33,1,3,2,6,0,3,2,5
2025-10-09,77e23ebd-6e10-4113-938c-bb55550710f5,Spice <> Capriotti's - Sep / Oct,promotion,2025-09-18,None,N/A,,ba37e4d8-36c4-4cbe-8c7d-f4d1379109bd,"Spend $15, Save $3 | Low price Sensitivity",day,all,Order Discount,$ Off,3.00,15.00,USD,Sierra Hwy,27476315,2,237.54,6.00,0.00,0.00,1.98,-0.00,-0.00,118.77,3.99,29.77,0,2,0,2,0,1,0,1
2025-10-09,77e23ebd-6e10-4113-938c-bb55550710f5,Spice <> Capriotti's - Sep / Oct,promotion,2025-09-18,None,N/A,,,,day,,,$ Off,0.00,0.00,USD,West Fullerton Ave,23349403,0,0.00,0.00,0.00,0.00,0.00,-0.00,-0.00,0.00,0.00,0.00,0,0,0,0,0,0,0,0
2025-10-09,77e23ebd-6e10-4113-938c-bb55550710f5,Spice <> Capriotti's - Sep / Oct,promotion,2025-09-18,None,N/A,,,,day,,,$ Off,0.00,0.00,USD,Ogletown Stanton,422117,0,0.00,0.00,0.00,0.00,0.00,-0.00,-0.00,0.00,0.00,0.00,0,0,0,0,0,0,0,0
2025-10-09,77e23ebd-6e10-4113-938c-bb55550710f5,Spice <> Capriotti's - Sep / Oct,promotion,2025-09-18,None,N/A,,d1d0b263-4918-4c81-8c97-630471e7185b,10% Happy Hour Discount - Medium Price Sensitivity,day,all,Order Discount,% Off,10.0%,25.00,USD,Southern Highlands,1750142,0,0.00,0.00,0.00,0.00,0.00,-0.00,-0.00,0.00,0.00,0.00,0,0,0,0,0,0,0,0
2025-10-09,77e23ebd-6e10-4113-938c-bb55550710f5,Spice <> Capriotti's - Sep / Oct,promotion,2025-09-18,None,N/A,,,,day,,,$ Off,0.00,0.00,USD,Nevada Way,75754,0,0.00,0.00,0.00,0.00,0.00,-0.00,-0.00,0.00,0.00,0.00,0,0,0,0,0,0,0,0
2025-10-09,02d2c45e-5b6f-4058-b05d-1fbcb475312e,"First order, 20% off 04/09/2025",promotion,2025-04-09,None,N/A,,,,,,,$ Off,0.00,0.00,USD,NE Cookingham Dr,23035356,3,75.92,12.88,0.00,0.00,2.97,-0.00,-0.00,25.31,5.28,4.79,3,0,0,3,0,0,0,0
2025-10-09,77e23ebd-6e10-4113-938c-bb55550710f5,Spice <> Capriotti's - Sep / Oct,promotion,2025-09-18,None,N/A,,d1d0b263-4918-4c81-8c97-630471e7185b,10% Happy Hour Discount - Medium Price Sensitivity,day,all,Order Discount,% Off,10.0%,25.00,USD,De Soto-Chatsworth,651597,0,0.00,0.00,0.00,0.00,0.00,-0.00,-0.00,0.00,0.00,0.00,0,0,0,0,0,0,0,0
2025-10-09,02d2c45e-5b6f-4058-b05d-1fbcb475312e,"First order, 20% off 04/09/2025",promotion,2025-04-09,None,N/A,,,,,,,$ Off,0.00,0.00,USD,Palm Ave - Fresno,1581092,4,234.45,19.75,0.00,0.00,3.96,-0.00,-0.00,58.61,5.93,9.89,4,0,0,4,4,0,0,4
2025-10-09,77e23ebd-6e10-4113-938c-bb55550710f5,Spice <> Capriotti's - Sep / Oct,promotion,2025-09-18,None,N/A,,ba37e4d8-36c4-4cbe-8c7d-f4d1379109bd,"Spend $15, Save $3 | Low price Sensitivity",day,all,Order Discount,$ Off,3.00,15.00,USD,Smithtown Bypass,23349427,2,45.84,6.00,0.00,0.00,1.98,-0.00,-0.00,22.92,3.99,5.74,0,2,0,2,0,2,0,2
2025-10-09,77e23ebd-6e10-4113-938c-bb55550710f5,Spice <> Capriotti's - Sep / Oct,promotion,2025-09-18,None,N/A,,43340528-e1b7-4f95-ab40-8dc92bf9c274,"Spend $35, Save $6 | High Price Sensitivity",day,all,Order Discount,$ Off,6.00,35.00,USD,"Capriotti's of Milford, LLC",1636430,0,0.00,0.00,0.00,0.00,0.00,-0.00,-0.00,0.00,0.00,0.00,0,0,0,0,0,0,0,0
2025-10-09,77e23ebd-6e10-4113-938c-bb55550710f5,Spice <> Capriotti's - Sep / Oct,promotion,2025-09-18,None,N/A,,,,day,,,$ Off,0.00,0.00,USD,Hamilton Blvd,23066760,0,0.00,0.00,0.00,0.00,0.00,-0.00,-0.00,0.00,0.00,0.00,0,0,0,0,0,0,0,0
2025-10-09,02d2c45e-5b6f-4058-b05d-1fbcb475312e,"First order, 20% off 04/09/2025",promotion,2025-04-09,None,N/A,,,,,,,$ Off,0.00,0.00,USD,17th St Ammon,24968543,6,230.76,26.31,0.00,0.00,5.94,-0.00,-0.00,38.46,5.38,7.16,6,0,0,6,2,0,0,2
2025-10-09,02d2c45e-5b6f-4058-b05d-1fbcb475312e,"First order, 20% off 04/09/2025",promotion,2025-04-09,None,N/A,,,,,,,$ Off,0.00,0.00,USD,Nature Park Drive,75726,0,0.00,0.00,0.00,0.00,0.00,-0.00,-0.00,0.00,0.00,0.00,0,0,0,0,0,0,0,0
2025-10-09,77e23ebd-6e10-4113-938c-bb55550710f5,Spice <> Capriotti's - Sep / Oct,promotion,2025-09-18,None,N/A,,43340528-e1b7-4f95-ab40-8dc92bf9c274,"Spend $35, Save $6 | High Price Sensitivity",day,all,Order Discount,$ Off,6.00,35.00,USD,West Fullerton Ave,23349403,1,39.47,6.00,0.00,0.00,0.99,-0.00,-0.00,39.47,6.99,5.65,0,1,0,1,0,1,0,1
2025-10-09,77e23ebd-6e10-4113-938c-bb55550710f5,Spice <> Capriotti's - Sep / Oct,promotion,2025-09-18,None,N/A,,d1d0b263-4918-4c81-8c97-630471e7185b,10% Happy Hour Discount - Medium Price Sensitivity,day,all,Order Discount,% Off,10.0%,25.00,USD,Sierra St - Reno,719271,1,62.14,5.00,0.00,0.00,0.99,-0.00,-0.00,62.14,5.99,10.37,0,1,0,1,0,1,0,1
2025-10-09,77e23ebd-6e10-4113-938c-bb55550710f5,Spice <> Capriotti's - Sep / Oct,promotion,2025-09-18,None,N/A,,43340528-e1b7-4f95-ab40-8dc92bf9c274,"Spend $35, Save $6 | High Price Sensitivity",day,all,Order Discount,$ Off,6.00,35.00,USD,Millsboro Plaza,23360934,0,0.00,0.00,0.00,0.00,0.00,-0.00,-0.00,0.00,0.00,0.00,0,0,0,0,0,0,0,0
2025-10-09,02d2c45e-5b6f-4058-b05d-1fbcb475312e,"First order, 20% off 04/09/2025",promotion,2025-04-09,None,N/A,,,,,,,$ Off,0.00,0.00,USD,Brayden Pkwy,2375657,2,127.46,10.00,0.00,0.00,1.98,-0.00,-0.00,63.73,5.99,10.64,2,0,0,2,2,0,0,2
2025-10-09,7b3c5d68-2d5c-4d2d-b0b1-a1fb4346169d,Spend $20 Get $5 Off,promotion,2023-02-01,None,N/A,,,,,,,$ Off,0.00,0.00,USD,Gambrills,24415514,16,769.03,80.00,0.00,0.00,15.84,-0.00,-0.00,48.06,5.99,8.02,4,10,2,16,0,5,2,7
2025-10-09,750e00fa-6876-4d9b-8c15-6ca184c578b9,Happy Hour discount 03/17/2025,promotion,2025-03-17,None,N/A,,,,,,,$ Off,0.00,0.00,USD,Interquest Parkway,27558470,0,0.00,0.00,0.00,0.00,0.00,-0.00,-0.00,0.00,0.00,0.00,0,0,0,0,0,0,0,0
2025-10-09,77e23ebd-6e10-4113-938c-bb55550710f5,Spice <> Capriotti's - Sep / Oct,promotion,2025-09-18,None,N/A,,ba37e4d8-36c4-4cbe-8c7d-f4d1379109bd,"Spend $15, Save $3 | Low price Sensitivity",day,all,Order Discount,$ Off,3.00,15.00,USD,University Ave,1084955,5,142.03,15.00,0.00,0.00,4.95,-0.00,-0.00,28.41,3.99,7.12,0,4,1,5,0,2,1,3
2025-10-09,a685c20e-2ab7-43e8-a7a8-447ab209f7f8,Spend $25 get $5 off 07/31/2024,promotion,2024-07-31,None,N/A,,,,,,,$ Off,0.00,0.00,USD,De Soto-Chatsworth,651597,3,109.69,15.00,0.00,0.00,2.97,-0.00,-0.00,36.56,5.99,6.10,0,3,0,3,0,2,0,2
2025-10-09,02d2c45e-5b6f-4058-b05d-1fbcb475312e,"First order, 20% off 04/09/2025",promotion,2025-04-09,None,N/A,,,,,,,$ Off,0.00,0.00,USD,South Rainbow,75732,0,0.00,0.00,0.00,0.00,0.00,-0.00,-0.00,0.00,0.00,0.00,0,0,0,0,0,0,0,0
2025-10-09,77e23ebd-6e10-4113-938c-bb55550710f5,Spice <> Capriotti's - Sep / Oct,promotion,2025-09-18,None,N/A,,,,day,,,$ Off,0.00,0.00,USD,Kennett Square,575296,0,0.00,0.00,0.00,0.00,0.00,-0.00,-0.00,0.00,0.00,0.00,0,0,0,0,0,0,0,0
2025-10-09,77e23ebd-6e10-4113-938c-bb55550710f5,Spice <> Capriotti's - Sep / Oct,promotion,2025-09-18,None,N/A,,f06f33c5-bff5-4bb3-8dda-6cedeb2e6fc1,10% Happy hour Discount - Min $30 | Low Price Sensitivity,day,all,Order Discount,% Off,7.0%,30.00,USD,Frisco,34516355,0,0.00,0.00,0.00,0.00,0.00,-0.00,-0.00,0.00,0.00,0.00,0,0,0,0,0,0,0,0
2025-10-09,ab8ae3e5-4758-4b2a-b268-d7fb378c5caa,Spend $15 Get 20% Off,promotion,2022-05-17,None,N/A,,,,,,,$ Off,0.00,0.00,USD,Pioneer Pkwy,874359,3,70.24,13.29,0.00,0.00,2.97,-0.00,-0.00,23.41,5.42,4.32,0,3,0,3,0,2,0,2
